id,title,link,content,date,author,category,sub_category,source,summary
VNEX_060925_00075,Prologue - 'ngôi sao' doanh số mới của Honda,https://vnexpress.net/prologue-ngoi-sao-doanh-so-moi-cua-honda-4935401.html,"Doanh số của các thương hiệuHondavà Acura tăng 4,4% trong năm nay, nhưng đó có lẽ không phải là điểm đáng chú ý nhất trong báo cáo doanh số gần đây. Thay đổi đáng kể nhất là doanh số xe điện của Honda tăng hơn 50% trong nửa đầu năm, với sự phổ biến ngày càng tăng của mẫu xe Prologue chạy điện. Cũng giống đồng hươngToyota, Honda là một hãng chậm chân trong lĩnh vực điện khí hóa, bởi hiện hãng chỉ bán một mẫu xe chạy pin duy nhất tại Mỹ, Prologue, thậm chí còn không phải là sản phẩm riêng vì được xây dựng trên cùng nền tảng với Chevrolet Blazer EV và các mẫu xe khác của General Motors. Tuy nhiên, Honda cung cấp các tùy chọn hybrid khác cho một số mẫu xe phổ biến, bao gồmCivic,CR-VvàAccord. Thực tế, nhu cầu về xe hybrid đang tăng, mang lại lợi ích cho Honda. Honda Prologue tại một đại lý ở Mỹ. Ảnh:Hendrick Buick GMC Cary Trong 8 tháng đầu năm, Honda Mỹ, bao gồm các thương hiệu Honda và Acura, bán được tổng cộng 992.904 xe trên toàn nước Mỹ, tăng 4,4% so với cùng kỳ 2024. Trong danh mục sản phẩm của Honda, 306.252 trong số 903.325 xe bán ra là xe điện, đánh dấu mức tăng trưởng 53,4% so với 199.597 xe điện được bán ra trong cùng kỳ năm trước. Mức độ phổ biến của mẫu xe Prologue chạy điện thậm chí còn vượt xa những con số này. Trong 8 tháng đầu năm 2024, 10.394 chiếc được bán ra tại Mỹ. Sang năm sau, doanh số tăng vọt 207,7% lên 31.982 chiếc. Tháng 8 cũng là một tháng thành công của Prologue với tổng doanh số 9.347 chiếc, tăng 73,1% so với con số 5.401 chiếc của 2024. Cũng như các nhà sản xuất ôtô khác, phần lớn sự gia tăng này có thể xuất phát từ việc người mua nhanh chóng hành động trước thời hạn tín dụng thuế xe điện vào ngày 30/9. Tất cả những điều này trái ngược với kết quả chung của Honda trong tháng 8, giảm 4,9% xuống còn 121.633 chiếc. Prologue cũng vượt mặt đối thủFord Mustang Mach-E- mẫu xe đạt kỷ lục 7.226 xe trong tháng 8. MẫuIoniq 5mới củaHyundaicó một tháng bứt phá với 7.773 xe bán ra, tăng 61% so với tháng 8/2024. Ngay cả khi sự tăng trưởng mạnh mẽ của dòng xe điện đang gây xôn xao dư luận, những mẫu xe bán chạy nhất lâu năm của Honda tiếp tục là trụ cột của thương hiệu. CR-V vẫn là mẫu xe bán chạy nhất của Honda. Năm nay, 278.952 xe đã về tay khách hàng, tăng 3,7% so với con số 268.947 xe của 2024. Xếp sau CR-V là Civic với doanh số 168.876 xe, giảm 2,2% so với con số 172.661 xe của 2024. Tại Mỹ, Prologue bán ra hai phiên bản, gồm FWD và AWD, cả hai đều trang bị pin Ultinum NCMA với dung lượng 85 kWh. Xe có giá 49.000-59.300 USD. Mỹ Anh(theoCarscoops)","Thứ bảy, 6/9/2025, 05:34 (GMT+7)",Mỹ Anh,Xe,Xe điện,VN Express,"Doanh số tổng thể của Honda và Acura tăng 4,4% trong năm nay, tuy nhiên, điểm nổi bật là doanh số xe điện của Honda tăng mạnh, đặc biệt là nhờ sự phổ biến của mẫu Prologue. Mặc dù Honda là một hãng đi sau trong lĩnh vực điện khí hóa, sự tăng trưởng đáng kể này cho thấy tiềm năng của hãng trên thị trường xe điện. Dù vậy, các mẫu xe truyền thống như CR-V vẫn là trụ cột doanh thu của Honda."
VNEX_060925_00072,"Từng bị lừa tình, giờ tôi lại bị người đàn ông khác lừa 300 triệu",https://vnexpress.net/tung-bi-lua-tinh-gio-toi-lai-bi-nguoi-dan-ong-khac-lua-300-trieu-4935709.html,"Tôi thường xuyên vào một diễn đàn về ôtô trò chuyện nên quen biết khá nhiều người bạn trong nước trên đó. Khi tôi thất tình vì bị người yêu (cũng là một thành viên diễn đàn) ruồng bỏ, tâm trạng buồn bã, chán nản..., một người đàn ông trong nhóm bạn chơi chung quan tâm, an ủi và chia sẻ nỗi buồn cùng tôi. Tôi xem người đàn ông này như tri kỷ vì anh ta rất tốt tính lại có hoàn cảnh đáng thương (bị vợ bỏ). Anh ta cũng rất có uy tín trên diễn đàn tôi tham gia. Khi người đàn ông này ngỏ lời hỏi mượn 300 triệu đồng để trả lương thưởng nhân viên vào cuối năm (anh ta làm chủ một quán cà phê), tôi rất tin tưởng nên chuyển khoản cho mượn ngay. Anh ta hẹn tôi sáu tháng bán được đất ở quê sẽ trả. Sau khi tôi cho mượn tiền, hàng ngày anh ta đều nhắn tin hỏi han quan tâm đến tôi, mua hoa tặng tôi hàng ngày và bắt đầu nói những lời đường mật để chinh phục tôi, thậm chí còn ngỏ lời cưới tôi làm vợ. Nhưng với tôi, anh ta chưa đủ khả năng và hoàn toàn không phải mẫu người tôi thích nên thẳng thừng từ chối và chỉ xem anh ta là bạn bè. Sáu tháng trôi qua, anh ta không trả nợ đúng hẹn, tôi nhiều lần nhắn tin, gọi điện thoại, anh ta đều không trả lời. Tôi bắt đầu nhận ra thì ra trước kia anh ta tán tỉnh tôi với mục đích nếu tôi nhận lời yêu, anh ta không phải trả món nợ 300 triệu kia. Tôi điều tra biết được trước kia anh ta bị vợ bỏ là vì đam mê banh bóng dẫn đến nợ nần... khác xa với những gì anh ta kể với tôi về vợ cũ. Tôi đến quán cà phê của anh ta nhiều lần nhưng không gặp. Tôi lên diễn đàn kể rõ sự tình cho các thành viên khác biết. Có lẽ anh ta muốn xù 300 triệu của tôi thật rồi. Tôi đã bị một người đàn ông lừa tình ruồng bỏ, lại bị một người đàn ông khác lừa tiền. Có lẽ tôi không còn tin vào đàn ông nữa, nhất là đàn ông trên các diễn đàn trên mạng. Có lẽ số tôi hồng nhan bạc phận. Trâm Anh","Thứ bảy, 6/9/2025, 09:34 (GMT+7)",Trâm Anh,Tâm sự,,VN Express,"Một cô gái tên Trâm Anh quen nhiều người trên diễn đàn ôtô, sau khi thất tình đã được một người đàn ông hơn tuổi an ủi và trở nên thân thiết. Tin tưởng người này, Trâm Anh cho anh ta mượn 300 triệu đồng. Tuy nhiên, sau đó người đàn ông này không trả nợ và Trâm Anh phát hiện ra anh ta đã lừa dối cô về hoàn cảnh cá nhân, đồng thời có ý định ""gán nợ"" bằng tình cảm. Vỡ mộng vì bị lừa cả tình lẫn tiền, Trâm Anh mất niềm tin vào đàn ông, đặc biệt là những người quen qua mạng."
VNEX_060925_00084,Kẹt cứng ở Bình Triệu,https://vnexpress.net/ket-cung-o-binh-trieu-4935728.html,"Cầu Bình Triệu 1 đang cấm ôtô để sửa chữa từ 26/8, cầu Bình Triệu 2 phải chia lửa bằng cách mở thêm làn đường ngược chiều cho ôtô lưu thông. Một lượng xe rất lớn đi qua ""nút cổ chai"" khiến cho giao thông trở nên căng thẳng. Khu vực này vốn là cửa ngõ quan trọng hàng đầu ở phía Đông TP HCM cũ, nơi mà bến xe miền Đông vẫn hoạt động ở công suất cao và có tuyến đường sắt đi ngang qua. Sau khi sáp nhập, khu vực này nằm ngay trung tâm của TP HCM mới, là nút giao thông quan trọng bậc nhất, giữ vai trò kết nối các trung tâm hành chính ở phường Sài Gòn, phường Bình Dương cũng như các phường xã khác. Lý do sửa chữa cầu Bình Triệu 1 liên quan đến một câu chuyện xa hơn. Được xây dựng vào cuối những năm 1960 và đã trải qua một lần nâng cấp hơn 15 năm trước, nhưng tĩnh không thông thuyền của cầu Bình Triệu 1 hiện chỉ là 5,5 m. Cùng với cầu Bình Phước 1 cũng bắc qua sông Sài Gòn, cầu Bình Triệu 1 được xem là trở ngại đối với vận tải hàng hóa quy mô lớn trên tuyến sông Sài Gòn. Sông Sài Gòn đoạn qua cầu Bình Phước 1 và Bình Triệu 1 thuộc cấp đường thủy nội địa số 2, tĩnh không phải đạt 7-9,5 m. Việc cải tạo, nâng cấp cầu Bình Triệu 1 là rất cần thiết. Hiện nay các phương tiện qua đoạn sông này hoặc phải khai thác dưới mức công suất tối đa, hoặc phải dừng chờ con nước để có thể lưu thông an toàn. Giảm doanh thu do giảm lượng hàng có thể chuyên chở, hay tăng thời gian vận chuyển do phải chờ con nước, cả hai điều này đều ảnh hưởng đến hiệu quả khai thác phương tiện, ảnh hưởng tới chi phí logistics. Không dừng lại ở đó, điều này kéo theo hai hệ quả quan trọng khác là các bến cảng khu vực thượng lưu cầu Bình Phước 1 như An Sơn, An Tây, Rạch Bắp bị giảm năng lực khai thác, và giao thông đường thủy mất cơ hội chia sẻ với đường bộ, đặc biệt là khi tuyến đường sông Sài Gòn có thể đảm nhận lượng hàng lớn từ các KCN ở Bình Dương (cũ) đưa về xuất khẩu ở Cát Lái và Cái Mép - Thị Vải. Vì vậy, nâng tĩnh không cầu Bình Triệu 1 để đồng bộ hóa cơ sở hạ tầng trên toàn tuyến giao thông thủy trên sông Sài Gòn là điều cần được ưu tiên. Nhưng cũng phải thừa nhận, cho dù chủ đầu tư và nhà thầu cố gắng đảm bảo tiến độ xây dựng, thì thực tế trong những ngày đầu triển khai và đặc biệt là sáng 3/9 cho thấy, ảnh hưởng từ việc sửa chữa cầu là không nhỏ. Đây không phải lần đầu tiên thành phố buộc phải triển khai một dự án giao thông quan trọng, và biết trước là việc thi công sẽ ảnh hưởng đến tình hình đi lại và sinh kế của người dân. Việc thông báo về tình trạng cấm ôtô qua cầu Bình Triệu đã được triển khai khá sớm và lực lượng chức năng cũng nỗ lực tối đa trong khâu phân luồng, tổ chức giao thông, nhưng tần suất truyền thông hay việc thông báo lộ trình thay thế với các chỉ dẫn rõ ràng cần được triển khai qua nhiều kênh hơn, đến đúng các đối tượng liên quan hơn. Để khắc phục giao thông cho cửa ngõ quan trọng này trong trung hạn, tôi tin rằng việc sớm khép kín đường Vành đai 2, đẩy nhanh tiến độ đường Vành đai 3, xây dựng cao tốc TP HCM - Chơn Thành là các nhiệm vụ cấp bách. Đặc biệt, sau khi các cầu Bình Triệu 1 và Bình Phước 1 được nâng tĩnh không, khâu vận tải hành khách qua tuyến đường thủy này là một nội dung rất cần được nghiên cứu cụ thể hơn. Giải pháp dài hạn đối với khu vực này, chắc chắn nằm trong câu chuyện tổ chức lại không gian đô thị theo hướng văn minh, bền vững. Khu vực Hàng Xanh đang được nghiên cứu dự án TOD chỉnh trang đô thị, một dự án nhiều tham vọng và nếu được quy hoạch phù hợp và triển khai đúng đắn, đây chắc chắn là lời giải khả dĩ cho khu vực Hàng Xanh - Bình Triệu. Đối với những dự án cải tạo, nâng cấp hạ tầng thiết yếu sau này, tôi cho rằng sẽ cần xem chi phí xã hội (thời gian, kẹt xe, năng suất bị mất) là một phần phải tính trong kế hoạch đầu tư, từ đó có ngân sách cho giải pháp giảm thiểu tác động như hỗ trợ vận tải công cộng, truyền thông. Thực tế từ cầu Bình Triệu một lần nữa nhắc nhở rằng đầu tư hạ tầng không chỉ là xây dựng hay nâng cấp một cây cầu, mà còn là cách thức quản trị những tác động xã hội - kinh tế trong suốt quá trình thi công. Nếu không chuẩn bị giải pháp phân luồng và phối hợp logistics, cái giá phải trả sẽ luôn lặp lại: ùn tắc, bức xúc và lãng phí nguồn lực. Đặng Dương","Thứ bảy, 6/9/2025, 00:00 (GMT+7)",Đặng Dương,Góc nhìn,Kinh doanh & quản trị,VN Express,"Việc sửa chữa cầu Bình Triệu 1, một nút giao thông quan trọng ở cửa ngõ phía Đông TP HCM, gây ra tình trạng ùn tắc giao thông nghiêm trọng. Nguyên nhân sửa chữa là để nâng tĩnh không cầu, đáp ứng tiêu chuẩn đường thủy nội địa và tạo điều kiện cho vận tải hàng hóa trên sông Sài Gòn. Việc nâng cấp này sẽ giúp tăng hiệu quả khai thác vận tải đường thủy, giảm chi phí logistics và mở rộng năng lực khai thác của các cảng thượng lưu. Để giảm thiểu ảnh hưởng giao thông trong quá trình sửa chữa, cần tăng cường truyền thông và đẩy nhanh tiến độ các dự án giao thông khác như đường Vành đai 2, 3 và cao tốc TP HCM - Chơn Thành."
VNEX_060925_00013,Màu của iPhone 17 Pro hé lộ qua linh kiện,https://vnexpress.net/mau-cua-iphone-17-pro-he-lo-qua-linh-kien-4935732.html,"Dynamic Island trên iPhone. Ảnh:Macrumors Trang công nghệMacrumorsdẫn thông tin từ một người đang làm cho công ty sản xuất miếng dán màn hình iPhone rằng Dynamic Island trên mẫu 17 Pro và 17 Pro Max sẽ được làm gọn lại. Chiều rộng của phần khuyết hình viên thuốc sẽ giảm từ 2 cm trên iPhone 16 xuống còn 1,5 cm. Thông tin trên củng cố báo cáo trước đó từ các nhà phân tích rằng Apple đang tìm cách giảm kích cỡ Dynamic Island nhờ công nghệ metalens mới, giúp tích hợp các thành phần của Face ID, làm gọn hệ thống camera và cảm biến ở mặt trước. Bên cạnh đó, hình ảnh linh kiện cổng USB-C với màu cam và xanh dương, được cho là của iPhone 17 Pro, cũng bị rò rỉ. Điều này khớp với tin đồn trước đó rằng iPhone 17 Pro dự kiến có 4 màu: cam, xanh dương, trắng và đen. Màu xanh dương có vẻ sáng hơn so với dự đoán ban đầu, có thể do chất lượng chụp ảnh kém hoặc Apple đã quyết định sử dụng một sắc độ xanh mới. Cổng sạc USB-C của iPhone 17 Pro mới. Ảnh: Pipfix iPhone 17 Pro và 17 Pro Max sẽ thay đổi thiết kế, trở lại sử dụng vỏ nhôm. Trong đó, cụm camera vuông hiện tại mở rộng thành hình chữ nhật, tương tự Pixel 9 Pro của Google. Diện tích phần này khá lớn, ba ống kính vẫn giữ cách bố trí tam giác và nằm bên trái. Đèn flash LED, micro và cảm biến Lidar được chuyển sang phải và xếp dọc. Ngoài chip xử lý A19 Pro và RAM tăng lên 12 GB, hai model Pro có ống tele 48 megapixel. Camera trước của cả bốn phiên bản tăng lên 24 megapixel, gấp đôi thế hệ trước. Thế hệ iPhone 2025 sẽ ra mắt vào ngày 9/9 với 4 phiên bảniPhone 17, 17 Air, 17 Pro và 17 Pro Max. Trong đó, iPhone 17 Air là dòng hoàn toàn mới với thiết kế siêu mỏng, thay thế mẫu Plus. Huy Đức(theoMacrumor, Apple Insider)","Thứ bảy, 6/9/2025, 09:00 (GMT+7)",Huy Đức,Khoa học công nghệ,Thiết bị,VN Express,"Bài viết tóm tắt những thay đổi dự kiến trên dòng iPhone 17 Pro và Pro Max. Dynamic Island sẽ được thu nhỏ nhờ công nghệ mới, và thiết kế mặt sau có thể thay đổi với cụm camera hình chữ nhật. Các mẫu Pro cũng được đồn đoán sẽ có cổng USB-C với các tùy chọn màu mới, camera tele 48 megapixel và RAM 12 GB. Ngoài ra, dòng iPhone 17 dự kiến sẽ có thêm phiên bản iPhone 17 Air với thiết kế siêu mỏng."
VNEX_060925_00055,Khiếu múa hát của em bé song ca Mỹ Tâm ở đại lễ 2/9,https://vnexpress.net/khieu-mua-hat-cua-em-be-song-ca-my-tam-o-dai-le-2-9-4935204.html,"Tại lễ 2/9, xuất hiện cùng ca sĩ Mỹ Tâm, bé Thủy Tiên ngân vang lời ca: ""Đoàn quân Việt Nam đi, chung lòng cứu quốc. Bước chân dồn vang trên đường gập ghềnh xa"". Hai câu hát được nhạc sĩ Phạm Hồng Biển trích từ tác phẩmTiến quân ca(nhạc sĩ Văn Cao), nói về ''giai điệu tự hào'' mỗi người được nghe từ những ngày thơ ấu. Ca sĩ Mỹ Tâm và bé Thủy Tiên đều hát theo cách giản dị, mộc mạc. Điều này khiến tiết mục chinh phục đa số khán giả ở Quảng trường Ba Đình cũng như những người theo dõi qua sóng trực tiếp. Video phần trình diễn hiện thu hút hơn 13 triệu lượt xem và hàng chục nghìn lượt chia sẻ trên fanpage ca sĩ Mỹ Tâm. Bé Hà Thủy Tiên sinh ra trong gia đình có mẹ là diễn viên múa, bố làm thợ tóc. Từ năm lên ba tuổi, bé theo mẹ đi học và bộc lộ sở thích nhảy múa, ca hát. Bé Hà Thủy Tiên sinh ra trong gia đình có mẹ là diễn viên múa, bố làm thợ tóc. Từ năm lên ba tuổi, bé theo mẹ đi học và bộc lộ sở thích nhảy múa, ca hát. Bé Hà Thủy Tiên nhảy múaBé Hà Thủy Tiên biểu diễn lúc 5 tuổi tại lễ tổng kết năm học. Bố bé - Hà Văn Bạo, 32 tuổi - cho biết khi thấy con hát rõ hơn, gia đình cho đi học hát ở trung tâm nghệ thuật của nghệ sĩ Đinh Lan Hương. ""Nhờ cô tận tình khai thác tiềm năng của con, bé ngày càng tiến bộ"", anh nói. Bố bé - Hà Văn Bạo, 32 tuổi - cho biết khi thấy con hát rõ hơn, gia đình cho đi học hát ở trung tâm nghệ thuật của nghệ sĩ Đinh Lan Hương. ""Nhờ cô tận tình khai thác tiềm năng của con, bé ngày càng tiến bộ"", anh nói. Trước khi được chọn hát ở Lễ diễu binh, diễu hành, bé Hà Thủy Tiên từng biểu diễn ở nhiều chương trình lớn như:Lễ kỷ niệm 80 năm ngày truyền thống Công an Nhân dân, 20 năm Ngày hội toàn dân bảo vệ an ninh Tổ quốc và trao tặng Huân chương Sao Vàng cho lực lượng Công an Nhân dân(tháng 8),Người là Hồ Chí Minh(tháng 5). Trước khi được chọn hát ở Lễ diễu binh, diễu hành, bé Hà Thủy Tiên từng biểu diễn ở nhiều chương trình lớn như:Lễ kỷ niệm 80 năm ngày truyền thống Công an Nhân dân, 20 năm Ngày hội toàn dân bảo vệ an ninh Tổ quốc và trao tặng Huân chương Sao Vàng cho lực lượng Công an Nhân dân(tháng 8),Người là Hồ Chí Minh(tháng 5). Hà Thủy Tiên trong chương trình ""Người là Hồ Chí Minh""Hà Thủy Tiên xuất hiện ở phút thứ 1:05 khi được người đóng vai Chủ tịch Hồ Chí Minh bế trên tay trong tiết mụcĐêm qua em mơ gặp Bác Hồ(Xuân Giao sáng tác) do Hòa Minzy, Minh Hải và nhóm thiếu nhi thể hiện. Nhờ sự hỗ trợ của cô giáo dạy hát, bé được mời diễn ở nhiều sự kiện, chương trình truyền hình do đài quốc gia thực hiện. Theo nghệ sĩ Đinh Lan Hương, học trò bảy tuổi thông minh, cảm thụ âm nhạc tốt. Thủy Tiên sáng sân khấu, toát lên sự hồn nhiên, đáng yêu. Nhờ sự hỗ trợ của cô giáo dạy hát, bé được mời diễn ở nhiều sự kiện, chương trình truyền hình do đài quốc gia thực hiện. Theo nghệ sĩ Đinh Lan Hương, học trò bảy tuổi thông minh, cảm thụ âm nhạc tốt. Thủy Tiên sáng sân khấu, toát lên sự hồn nhiên, đáng yêu. Hà Thủy Tiên hát ""Cho con""Hà Thủy Tiên hátCho con(Phạm Trọng Cầu sáng tác). Hà Thủy Tiên (thứ ba, phải sang) cùng các bạn trong nhóm học hát xuất hiện trên sân khấu cùng ca sĩ Hoàng Bách ở showSao Độc lập 2025tại Nhà hát Hồ Gươm hồi tháng 8. Hà Thủy Tiên (thứ ba, phải sang) cùng các bạn trong nhóm học hát xuất hiện trên sân khấu cùng ca sĩ Hoàng Bách ở showSao Độc lập 2025tại Nhà hát Hồ Gươm hồi tháng 8. Do mẹ bận rộn với lớp dạy nhảy múa, Hà Thủy Tiên thường được bố đưa đi diễn. Do mẹ bận rộn với lớp dạy nhảy múa, Hà Thủy Tiên thường được bố đưa đi diễn. Bố bé cho biết mỗi ngày sau khi con học ở trường, anh sẽ đưa đến trung tâm học hát. ""Vợ chồng tôi muốn con gái tập trung học văn hóa song song rèn luyện năng khiếu. Nếu con có khả năng theo đuổi nghệ thuật lâu dài, gia đình sẽ ủng hộ, tùy bé lựa chọn"", anh Hà Văn Bạo nói. Bố bé cho biết mỗi ngày sau khi con học ở trường, anh sẽ đưa đến trung tâm học hát. ""Vợ chồng tôi muốn con gái tập trung học văn hóa song song rèn luyện năng khiếu. Nếu con có khả năng theo đuổi nghệ thuật lâu dài, gia đình sẽ ủng hộ, tùy bé lựa chọn"", anh Hà Văn Bạo nói. Ngoài múa hát, bé Hà Thủy Tiên còn thích vẽ, bơi. Ngoài múa hát, bé Hà Thủy Tiên còn thích vẽ, bơi. Hoàng DungẢnh, video: Nhân vật cung cấp","Thứ bảy, 6/9/2025, 00:00 (GMT+7)",Hoàng Dung,Giải trí,Giới sao,VN Express,"Tại lễ 2/9, màn trình diễn giản dị, mộc mạc bài ""Tiến quân ca"" của ca sĩ Mỹ Tâm và bé Thủy Tiên đã chinh phục đông đảo khán giả. Tiết mục này thu hút hàng triệu lượt xem trên mạng xã hội. Bé Thủy Tiên, xuất thân từ gia đình có truyền thống nghệ thuật, đã bộc lộ năng khiếu ca hát từ nhỏ và được đào tạo bài bản. Trước đó, bé đã tham gia nhiều chương trình lớn và được đánh giá cao về khả năng cảm thụ âm nhạc và sự tự tin trên sân khấu."
