id,title,link,content,date,author,category,sub_category,source,summary
VNEX_291025_00001,Lũ ở Huế và Đà Nẵng xuống chậm,https://vnexpress.net/lu-o-hue-va-da-nang-xuong-cham-4956996.html,"Trung tâm Dự báo Khí tượng Thủy văn quốc gia cho biết đêm qua và sáng sớm nay, Huế, Đà Nẵng, phía đông tỉnh Quảng Ngãi có mưa vừa, mưa to. Lượng mưa tính từ 19h hôm qua đến 3h hôm nay cục bộ có nơi trên 170 mm như: Đỉnh Bạch Mã (Huế) 193 mm, Trà Vân (Đà Nẵng) 174 mm, Sơn Lập (Quảng Ngãi) 192 mm. So với hai hôm trước, lượng mưa đã giảm một nửa. Tuyến đường Lý Thường Kiệt ở TP Huế biến thành sông, ngày 28/10. Ảnh:Võ Thạnh Mưa giảm, song lũ sông Hương, sông Bồ (Huế) xuống chậm, sông Vu Gia - Thu Bồn (Đà Nẵng) vẫn đang dao động ở mức cao và sông Trà Khúc (Quảng Ngãi) đang lên. Lúc 5h hôm nay, lũ sông Bồ tại Phú Ốc (Huế) xuống dưới báo động ba 0,05 m sau khi tăng nhẹ lên trên báo động ba 0,28 m vào 16h hôm qua. Sông Hương tại Kim Long trên báo động ba 0,37 m, giảm 0,81 m. Sông Vu Gia tại Ái Nghĩa (Đà Nẵng) lúc 2h trên báo động ba 1,12 m, giảm 0,04 m so với 16h hôm qua; sông Thu Bồn tại Câu Lâu trên báo động ba 1,22 m, lên 0,11 m so với 20h hôm qua. Sông Trà Khúc trên báo động hai 0,35 m. Cơ quan khí tượng dự báo từ nay đến đêm mai, Huế, Đà Nẵng mưa 120-250 mm, cục bộ trên 400 mm; nam Quảng Trị, phía đông Quảng Ngãi 80-180 mm, cục bộ trên 350 mm; Hà Tĩnh - bắc Quảng Trị 70-140 mm, cục bộ 250 mm. Nguy cơ xảy ra mưa cường suất lớn trên 150 mm trong ba giờ. Từ ngày 30/10, mưa lớn ở Huế - Quảng Ngãi sẽ giảm dần. Do trời vẫn mưa, dự báo trong 24 giờ tới, lũ sông Hương, sông Bồ tiếp tục xuống chậm. Mực nước sông Bồ tại Phú Ốc sẽ xuống dưới mức báo động ba, sông Hương trạm Kim Long trên báo động ba. Lũ sông Vu Gia - Thu Bồn dao động trên báo động ba khoảng 1,1-1,2 m; sông Trà Khúc tiếp tục lên báo động hai, ba. Bản đồ các con sông và trạm đo mưa, đo lũ ở miền Trung. Đồ họa:Hoàng Khánh Ảnh hưởng của tổ hợp hình thế thời tiết điển hình ở miền Trung, gồm không khí lạnh ở tầng thấp, dải hội tụ nhiệt đới dâng trục từ phía nam lên, kết hợp với gió đông ẩm ở độ cao 1.500-5.000 m, lượng mưa tại Huế, Đà Nẵng đã vượt giá trị lịch sử năm 1999. Lượng mưa ghi nhận từ 19h ngày 24/10 đến 7h hôm nay ở đỉnh Bạch Mã (Huế) 2.785 mm, Khe Tre (Huế) 1.484 mm, Hương Sơn (Huế) 1.270 mm, Trà Thanh (Quảng Ngãi) 999 mm, Phước Thành (Đà Nẵng) 903 mm, Phước Chánh (Đà Nẵng) 879 mm, thủy điện La Tó (Quảng Trị) 758 mm. Do mưa lớn, lũ rút chậm, 32/40 xã phường ở Huế, 16/94 xã phường ở Đà Nẵng vẫn đang ngập 0,5-1,5 m, giảm 0,3-0,5 m so với sáng qua. Riêng hạ lưu sông Vu Gia - Thu Bồn ở Đà Nẵng vẫn lên do nước ở thượng nguồn đổ về. Quỹ Hy vọng - báo VnExpress mở chiến dịch ""Cùng đồng bào vượt lũ"" nhằm hỗ trợ người dân vượt lên nghịch cảnh thiên tai, tái thiết các trường học bị thiệt hại. Mọi đóng góp của bạn xin ủng hộtại đây.","Thứ tư, 29/10/2025, 07:27 (GMT+7)",Unknown,Thời sự,,VN Express,"Đêm qua và sáng sớm nay, khu vực Huế - Quảng Ngãi có mưa vừa đến mưa to, tuy lượng mưa đã giảm so với hai ngày trước. Mực nước các sông ở Huế, Đà Nẵng và Quảng Ngãi diễn biến phức tạp, có sông xuống chậm, có sông vẫn ở mức cao hoặc đang lên. Dự báo từ nay đến đêm mai, khu vực này tiếp tục mưa lớn, nguy cơ cao xảy ra lũ quét và ngập úng, sau đó mưa sẽ giảm dần từ ngày 30/10. Nhiều xã phường ở Huế và Đà Nẵng vẫn đang bị ngập, và Quỹ Hy vọng của báo VnExpress đã mở chiến dịch hỗ trợ người dân vùng lũ."
VNEX_291025_00006,Chủ tịch Hạ viện Mỹ: Khó sửa hiến pháp để ông Trump tranh cử tiếp,https://vnexpress.net/chu-tich-ha-vien-my-kho-sua-hien-phap-de-ong-trump-tranh-cu-tiep-4957090.html,"""Nhiệm kỳ của Tổng thống đang vô cùng tuyệt vời. Tuy nhiên, tôi nghĩ rằng Tổng thống hiểu rõ, và tôi cũng đã nói với ông ấy nhiều lần, về những ràng buộc của Hiến pháp"", Chủ tịch Hạ viện Mike Johnson nói ngày 28/10 tại Washington, trả lời truyền thông về những bình luận của Tổng thống Donald Trump xoay quanh cách tiếp tục tranh cử vào năm 2028. Hiến pháp Mỹ quy định trong Tu chính án 22 rằng một công dân không được ""đắc cử tổng thống"" quá hai lần. Một số chuyên gia pháp lý còn diễn giải rằng ông Trump cũng không thể tranh cử phó tổng thống vì Tu chính án 12 viết rằng người không đủ điều kiện làm tổng thống thì cũng không thể làm phó tổng thống. Chủ tịch Hạ viện Mỹ Mike Johnson họp báo ngày 28/10 tại Đồi Capitol. Ảnh:AP ""Tôi không thấy cách nào để sửa đổi hiến pháp. Quá trình đó phải mất khoảng 10 năm"", ông Johnson nói. Mọi đề xuất sửa đổi Hiến pháp Mỹ cần được 2/3 Hạ viện thông qua, sau đó được 3/4 trên tổng số 50 bang phê chuẩn. ""Tôi không thấy khả năng đó, nhưng tôi cũng không ngừng cố gắng"", ông nói thêm. Ông Trump nói trên chuyên cơ Không Lực Một ngày 27/10, trên đường từ Malaysia đến Nhật Bản, rằng ""luật cho phép"" ông tranh cử với tư cách phó tổng thống cùng một người khác. Sau khi đắc cử, ông có thể trở lại nắm quyền khi người đắc cử tổng thống từ chức. Dù vậy, Tổng thống Trump đã bác bỏ phương án này, cho rằng nó ""quá khôn lỏi"" và người dân Mỹ sẽ không ủng hộ. Ông Trump nhiều lần nói đùa về việc tiếp tục tranh cử tổng thống trong các cuộc mít tinh với người ủng hộ. Đội ngũ của ông cũng bán mũ in dòng chữ ""Trump 2028"". Ông Johnson thừa nhận mẫu mũ này ""là một trong những sản phẩm bán chạy nhất từ trước đến nay"", nhưng khẳng định đây chỉ là cách ""trêu chọc phe Dân chủ"". Tuy nhiên, một số đồng minh của Tổng thống đang nghiêm túc nhìn nhận ý tưởng này. Cựu chiến lược gia Nhà Trắng Steve Bannon tiết lộ với tạp chíEconomistrằng ""đã có kế hoạch"" để ông Trump giữ chức tổng thống thêm một nhiệm kỳ nữa. ""Ông Trump sẽ là tổng thống năm 2028, mọi người nên làm quen với điều đó. Đến lúc thích hợp, chúng tôi sẽ công bố kế hoạch"", Bannon nói. Thanh Danh(TheoABC)","Thứ tư, 29/10/2025, 07:13 (GMT+7)",Thanh Danh,Thế giới,,VN Express,"Chủ tịch Hạ viện Mike Johnson khẳng định Tổng thống Trump hiểu rõ giới hạn Hiến pháp về việc tranh cử quá hai nhiệm kỳ, bác bỏ khả năng sửa đổi Hiến pháp để ông Trump tiếp tục tranh cử. Ông Johnson cho rằng những lời đùa của ông Trump và việc bán mũ ""Trump 2028"" chỉ là cách trêu chọc đảng Dân chủ. Tuy nhiên, một số đồng minh của ông Trump, như Steve Bannon, đang nghiêm túc xem xét các kế hoạch để ông Trump tiếp tục nắm quyền sau năm 2024."
VNEX_291025_00074,Phù chân tay do nhiễm giun lươn,https://vnexpress.net/phu-chan-tay-do-nhiem-giun-luon-4957100.html,"Ông Quỳnh đang uống thuốc điều trị đái tháo đường, sút 11 kg trong ba tháng, phù chân tay nặng, đến Bệnh viện Đa khoa Tâm Anh Hà Nội kiểm tra. Kết quả xét nghiệm máu cho thấy bạch cầu ái toan tăng cao trong máu bệnh nhân - dấu hiệu thường gặp khi nhiễm ký sinh trùng; soi phân dương tính với ấu trùng giun lươn (Strongyloides stercoralis) Ông Quỳnh dùng thuốc giảm đau chứa corticoid thời gian dài để điều trị đau khớp do bệnh gout, không tẩy giun định kỳ nhiều năm. Thạc sĩ, bác sĩ Nguyễn Vũ Hồng Vân, khoa Nội Tổng hợp, cho biết người khỏe mạnh nhiễm ấu trùng giun lươn thường bị rối loạn tiêu hóa nhẹ. Người cao tuổi, mắc bệnh mạn tính hoặc sử dụng corticoid kéo dài khiến hệ miễn dịch suy giảm, tạo điều kiện cho giun lươn sinh sản gây sụt cân, chán ăn, mệt mỏi, phù chân tay.Ấu trùnggiun lươn ký sinh trong ruột và tá tràng của ông Quỳnh làm tổn thương niêm mạc ruột, dẫn đến hội chứng kém hấp thu protein, gây biến chứng phù nề chân tay. Bác sĩ Hồng Vân đang kiểm tra sức khỏe cho ông Quỳnh trước khi ra viện. Ảnh:Bệnh viện Đa khoa Tâm Anh Bác sĩ chỉ định điều trị cho người bệnh bằng phác đồ tẩy giun lươn dài ngày kết hợp kháng sinh đường tĩnh mạch để kiểm soát tình trạng nhiễm trùng đi kèm. Người bệnh được theo dõi đường huyết, huyết áp, acid uric máu, bổ sung vi chất dinh dưỡng và protein năng lượng nhằm cải thiện thể trạng. Sau hơn một tuần, ông ăn uống tốt hơn, giảm phù tay chân, bớt mệt mỏi. Bác sĩ Vânkhuyên người từng dùng corticoid dài ngày, mắc bệnh gout, đái tháo đường hoặc bệnh mạn tính khác nên tẩy giun định kỳ và đi khám khi có triệu chứng bất thường. Bác sĩ có thể chỉ định làm xét nghiệm soi tươi, test huyết thanh học và chẩn đoán hình ảnh chuyên sâu giúp phát hiện sớm bệnh. Mọi người nên ăn chín uống sôi, rửa tay bằng xà phòng. Khi có các triệu chứng chán ăn, sụt cân,rối loạn tiêu hóakéo dài, phù tay chân, cần đến cơ sở y tế khám. Thanh Ba","Thứ tư, 29/10/2025, 08:00 (GMT+7)",Thanh Ba,Sức khỏe,Các bệnh,VN Express,
VNEX_291025_00014,Amazon sa thải 14.000 người vì 'AI giúp chuyển đổi nhanh chóng',https://vnexpress.net/amazon-sa-thai-14-000-nguoi-vi-ai-giup-chuyen-doi-nhanh-chong-4957097.html,"""Thời đại AI đang chuyển đổi mạnh mẽ nhất mà chúng ta từng chứng kiến kể từ khi Internet ra đời. Nó cho phép các công ty chuyển đổi nhanh hơn bao giờ hết, trong cả phân khúc thị trường hiện tại và những lĩnh vực hoàn toàn mới"", Beth Galetti, Phó chủ tịch cấp cao phụ trách trải nghiệm con người và công nghệ của Amazon, viết trên blog ngày 28/10. Bên ngoài một chi nhánh của Âmzon. Ảnh:Investopedia Cũng theo Galetti, động thái mới là sự tiếp nối kế hoạch của CEO Andy Jassy nhằm vận hành Amazon ""giống một startup lớn nhất thế giới"". Bà nhấn mạnh công ty hoạt động tốt nhưng vẫn phải cắt giảm việc làm do AI đang thay đổi thế giới một cách nhanh chóng. Bà Galetti nói thêm, Amazon cần tinh gọn hơn, ít lớp quản lý hơn giúp thể hoạt động nhanh hơn. Công ty đang tổ chức lại các nguồn lực để đầu tư những dự án lớn nhất, trong khi vẫn tiếp tục tuyển dụng ở các bộ phận khác. TheoBusiness Insider, Amazon có tổng cộng 1,55 triệu nhân viên trên toàn cầu, bao gồm nhân viên văn phòng và công nhân làm trong các kho hàng. Số lượng cắt giảm chiếm khoảng 4% trong tổng số 350.000 nhân viên văn phòng và là đợt điều chỉnh nhân sự lớn nhất từ trước đến nay của công ty. Đây là một phần trong nỗ lực của CEO Jassy nhằm xây dựngAmazontinh gọn và kỷ luật hơn. Những năm qua, công ty đã điều chỉnh nhiều tầng quản lý, thắt chặt chi phí, cải tổ hệ thống hiệu suất và lương thưởng, đồng thời yêu cầu hầu hết nhân viên công ty trở lại văn phòng 5 ngày một tuần. Hồi tháng 6, Jassy cho biết ứng dụng AI đang giúp công ty tăng hiệu quả, nhưng cũng khiến lực lượng lao động giảm. Đầu năm nay, công ty đóng băng ngân sách tuyển dụng tại bộ phận bán lẻ. Vào tháng 7, bộ phận đám mây Amazon Web Services cũng đối mặt với việc sa thải nhân viên. Amazon được cho là đangđặt mục tiêusử dụng ít nhân viên và nhiều robot hơn, hướng tới tự động hóa 75% hoạt động. Đội ngũ nhân công của Amazon tại Mỹ hiện nhiều gấp ba so với năm 2018, lên gần 1,2 triệu người. Hãng dự kiến có thể không phải tuyển dụng hơn 160.000 người tại Mỹ năm 2027 nhờ tự động hóa. Điều này giúp công ty tiết kiệm 30 xu cho mỗi món hàng được lựa chọn, đóng gói và giao cho khách. Đến 2033, họ ước tính bán được số sản phẩm gấp đôi, nhưng tự động hóa cho phép hoàn thành công việc mà không cần tuyển thêm 600.000 nhân viên. Bảo Lâm(theoBusiness Insider, Amazon)","Thứ tư, 29/10/2025, 07:46 (GMT+7)",Bảo Lâm,Khoa học công nghệ,Chuyển đổi số,VN Express,
VNEX_291025_00020,Alcaraz thua ngay trận đầu ở Paris Masters,https://vnexpress.net/alcaraz-thua-ngay-tran-dau-o-paris-masters-4957079.html,"Alcaraz chơi dưới phong độ, trong trận chính thức đầu tiên kể từ khi anh giành danh hiệu thứ tám trong mùa giải tại Tokyo vào cuối tháng 9. Tay vợt số một thế giới mắc tới 54 lỗi tự đánh hỏng, và gặp nhiều khó khăn trong việc điều chỉnh nhịp độ cũng như di chuyển tại sân Trung tâm ở La Defense Arena. Dù thắng set đầu tiên nhờ break duy nhất, Alcaraz vẫn loay hoay tìm cảm giác thi đấu. Tay vợt Tây Ban Nha trao đổi căng thẳng với HLV Juan Carlos Ferrero sau khi thua set hai 3-6, cũng từ việc mất một game giao bóng trong cả set. Thua set ba 4-6 khiến Alcaraz lần đầu thất bại tại Masters 1000 kể từ tháng 3 tại Miami, nơi anh cũng dừng bước ở trận mở màn. Trong chuỗi thắng 17 trận kể từ đó, Alcaraz đã vô địch tại Monte Carlo, Rome và Cincinnati. Với thất bại này, Alcaraz có nguy cơ mất ngôi số 1 thế giới trong bảng điểm ATP tuần tới. Nếu Jannik Sinner vô địch tại Paris, tay vợt Italy sẽ trở lại đỉnh bảng lần đầu tiên kể từ sau Mỹ Mở rộng. Tuy nhiên, trong cuộc đua cho vị trí số 1 cuối năm, Alcaraz vẫn đang nắm lợi thế lớn với cách biệt 2.040 điểm. Alcaraz đánh trái tay trong trận gặp Norrie, trên sân Trung tâm ở tổ hợp La Defense, Paris, Pháp hôm 28/10. Ảnh:Reuters Chiến thắng trướcAlcarazcũng đánh dấu lần đầu tiên Norrie hạ được đương kim số 1 thế giới. Tay vợt 30 tuổi người Anh lọt vào vòng 1/8 một giải Masters 1000 lần đầu kể từ Rome 2023, cân bằng thành tích tốt nhất ở Paris. ""Thật to lớn với tôi, cực kỳ to lớn"" Norrie nói về ý nghĩa của chiến thắng. ""Tôi vừa trở lại sau chấn thương. Năm ngoái, tôi thua ngay từ vòng loại ở đây. Nửa sau năm nay tôi cố gắng tận hưởng quần vợt nhiều hơn, và chiến thắng trước một người đang có phong độ tự tin bậc nhất hành tinh khiến tôi vô cùng hạnh phúc""'. Ở set ba, bước ngoặt đến khi Norrie tận dụng break-point ở game thứ bảy sau cú phản công trái tay chéo sân. Dưới áp lực, anh cứu hai break-point trong game sau và giữ vững tinh thần để kết thúc trận đấu sau 2 giờ 22 phút. Norrie là tay vợt thứ ba trong lịch sử Paris Masters đánh bại hạt giống số 1 ngay ở trận đầu tiên. Trước đó, Julien Benneteau thắngRoger Federernăm 2009 và Marc Rosset thắng Pete Sampras năm 1996. Đối thủ tiếp theo của Norrie sẽ là người thắng trong trận đấu giữa hai anh em họ, Valentin Vacherot và Arthur Rinderknech. Vacherot vừa khép lại hành trình cổ tích ở Thượng Hải Masters tháng này bằng chức vô địch sau khi đánh bại chính Rinderknech, trở thành nhà vô địch Masters 1000 có thứ bậc thấp nhất trong lịch sử (số 204 thế giới). Vy Anh","Thứ tư, 29/10/2025, 05:12 (GMT+7)",Vy Anh,Thể thao,Tennis,VN Express,
VNEX_291025_00100,Hải Phòng có thêm hơn 1.000 căn nhà xã hội từ 760 triệu đồng,https://vnexpress.net/hai-phong-co-them-hon-1-000-can-nha-xa-hoi-tu-760-trieu-dong-4957138.html,"Thông tin này được Sở Xây dựng công bố hôm 28/10. Dự án gồm 5 tòa chung cư, cao 15 tầng với tổng số 1.479 căn hộ. Khu nhà ở xã hội này được xây dựng trên khu đất rộng hơn 31.800 m2 tại phường Tân Hưng, TP Hải Phòng (trước đây là phường Hải Tân, Tân Hưng, TP Hải Dương). Chủ đầu tư của dự án là liên danh NHS và Newland. Công trình này dự kiến hoàn thành và đưa vào sử dụng từ quý II/2027. Theo thông báo của Sở Xây dựng, giá bán tạm tính căn hộ tại dự án này khoảng 17,6 triệu đồng một m2 (gồm VAT, chưa có phí bảo trì). Như vậy, căn hộ nhỏ nhất tại đây (43,1 m2) giá gần 760 triệu đồng và căn lớn nhất (74,6 m2) trên 1,31 tỷ. Sở yêu cầu trong 180 ngày kể từ khi công trình được nghiệm thu đưa vào sử dụng, chủ đầu tư phải kiểm toán và quyết toán chi phí xây dựng để xác định giá bán chính thức. Nếu giá bán sau kiểm toán thấp hơn mức tạm tính, chủ đầu tư phải hoàn trả phần chênh lệch cho người mua. Trường hợp giá sau kiểm toán cao hơn, chủ đầu tư không được thu thêm của người mua. Hải Phòng hiện là một trong những địa phương đi đầu cả nước về phát triển nhà ở xã hội. Kế hoạch giai đoạn 2024-2025, thành phố đặt mục tiêu hoàn thành 6.948 căn tại 10 dự án, khởi công thêm 8 dự án mới. Qua đó, Hải Phòng có thể hoàn thành khoảng 11.900 căn nhà xã hội vào cuối năm nay, cao hơn chỉ tiêu Chính phủ giao (10.694 căn). Trước sáp nhập với Hải Dương, Hải Phòng được giao chỉ tiêu phát triển ít nhất 33.500 căn nhà xã hội tới 2030. Trong khi đó, Hải Dương phải hoàn thành 15.900 căn trong 5 năm tới. Nếu tính theo chỉ tiêu này, sau sáp nhập, TP Hải Phòng mới cần phát triển khoảng 49.400 căn nhà ở xã hội vào năm 2030. Anh Tú","Thứ tư, 29/10/2025, 10:39 (GMT+7)",Anh Tú,Bất động sản,Thị trường,VN Express,
VNEX_291025_00077,Phản ứng của người Hàn với nạn nhân giải cứu từ Campuchia,https://vnexpress.net/phan-ung-cua-nguoi-han-voi-nan-nhan-giai-cuu-tu-campuchia-4956986.html,"Đầu tháng 10, cảnh sát Hàn Quốc giải cứu ba thanh niên ở độ tuổi 20 bị lừa sang Campuchia làm việc từ tháng 8. Họ bị giam giữ, tịch thu hộ chiếu, điện thoại và ép tham gia lừa đảo trực tuyến. Câu chuyện bắt đầu gây tranh cãi khi nghị sĩ Kim Byung Joo thuộc Đảng Dân chủ đăng tải hình ảnh chiến dịch giải cứu. Một nạn nhân bị làm mờ hoàn toàn cơ thể bởi có hình xăm dày đặc. Việc làm mờ để che giấu hình xăm trong các hình ảnh trên truyền thông vốn là thông lệ ở Hàn Quốc. Nhân vật Chorong, người cầm đầu băng nhóm tội phạm trong phimThe Roundup: No Way Out.Ảnh:Koreaboo Bức ảnh lập tức làm dấy lên tranh cãi. Nhiều bình luận trên mạng xã hội gọi nạn nhân là ""tội phạm"", ""xã hội đen"", so sánh người này với Chorong, một nhân vật trùm băng đảng trong bộ phimThe Roundup: No Way Out. Tại một cuộc họp báo sau đó, nghị sĩ Kim Byung Joo đã bật khóc. Ông lên án việc kỳ thị người khác dựa trên hình xăm, cho rằng đây là sự phân biệt đối xử vô lý với nạn nhân. Vụ việc phản ánh định kiến về hình xăm tại Hàn Quốc. Định kiến này bắt nguồn từ thời cổ đại, khi hình xăm được dùng để trừng phạt tội phạm và dần bị coi là biểu tượng của ""sự tha hóa xã hội"". Đến nay, dù một bộ phận giới trẻ xem hình xăm là nghệ thuật, phần lớn xã hội vẫn giữ quan điểm tiêu cực. Khảo sát của Trendmonitor cho thấy hơn 70% người Hàn tin hình xăm biểu thị ""hành vi lệch lạc"" hoặc ""tội phạm"". Một khảo sát khác năm 2019 ghi nhận 78% có ấn tượng không tốt về người xăm trổ. Hàn Quốc vẫn duy trì luật ban hành từ năm 1992, coi xăm là một ""hành vi y tế"" và chỉ cho phép bác sĩ thực hiện. Hậu quả là hơn 13 triệu người có hình xăm phải che giấu chúng để tránh bị từ chối việc làm, bị kỳ thị nơi công cộng. Theo Liên đoàn nghệ sĩ xăm Hàn Quốc, ít nhất 6 người đã bị kết án tù từ tháng 4/2023 vì hành nghề trái phép. Giới chức Hàn Quốc đang có những nỗ lực thay đổi định kiến này. Nghị sĩ trẻ nhất Quốc hội, Ryu Ho Jeong, cùng nhiều nghệ sĩ xăm cho rằng định kiến này đã ""lạc hậu so với thực tế xã hội"". Bà Ryu đã đề xuất luật hợp pháp hóa hành nghề xăm, nhấn mạnh đây là nghệ thuật, biểu hiện cá tính và ""giới trẻ cũng ủng hộ việc coi hình xăm là thẩm mỹ, thúc đẩy văn hóa chấp nhận sự đa dạng"". Ngọc Ngân(TheoKoreaboo)","Thứ tư, 29/10/2025, 08:27 (GMT+7)",Ngọc Ngân,Đời sống,Nhịp sống,VN Express,"Vụ việc giải cứu ba thanh niên Hàn Quốc bị lừa sang Campuchia làm việc đã gây tranh cãi khi một nghị sĩ đăng ảnh nạn nhân bị làm mờ hình xăm, làm dấy lên định kiến về hình xăm trong xã hội Hàn Quốc. Định kiến này bắt nguồn từ lịch sử và được thể hiện qua các khảo sát cho thấy phần lớn người Hàn có ấn tượng tiêu cực về người xăm trổ. Mặc dù có luật cấm xăm hình không có giấy phép y tế, một số nghị sĩ và nghệ sĩ đang nỗ lực thay đổi định kiến này và hợp pháp hóa hành nghề xăm, coi đây là một hình thức nghệ thuật và biểu hiện cá tính."
