id,title,link,content,date,author,category,sub_category,source,summary
VNEX_120725_00072,Việt Nam lần đầu đào tạo thạc sĩ y khoa cho sinh viên nước ngoài,https://vnexpress.net/viet-nam-lan-dau-dao-tao-thac-si-y-khoa-cho-sinh-vien-nuoc-ngoai-4913322.html,"Trường Đại học Y Dược ngày 12/7 cho biết tuyển sinh 4 chương trình thạc sĩ quốc tế là Nội khoa, Ngoại khoa, Nhi khoa, Điện quang và Y học hạt nhân từ năm nay. Theo đề án, mỗi chương trình nhận khoảng 15 học viên. Các chương trình kéo dài hai năm, được xây dựng theo chuẩn kiểm định quốc tế và giảng dạy hoàn toàn bằng tiếng Anh, bởi đội ngũ chuyên gia, giảng viên trong nước và quốc tế. Học viên được thực hành lâm sàng tại gần 30 bệnh viện tuyến trung ương và Hà Nội. Họ cũng được học các học phần tiếng Việt cơ bản nhằm hỗ trợ giao tiếp, sinh hoạt tại Việt Nam và hòa nhập với môi trường văn hóa bản địa trong quá trình học tập. Trường Đại học Y Dược cho biết Ấn Độ là quốc gia đầu tiên gửi sinh viên tới học các chương trình thạc sĩ quốc tế này. Hiện, nước này cũng có hơn 400 sinh viên học ngành y bậc đại học ở các trường đại học tại Cần Thơ và TP HCM. Tuy nhiên, ở bậc thạc sĩ, đây là những chương trình quốc tế y khoa đầu tiên. Trước đó, trường Đại học Y Hà Nội có một chương trình thạc sĩ quốc tế nhưng ở ngành Y tế công cộng. ""Việc tiếp tục mở rộng thu hút sinh viên quốc tế tới học tập, đặc biệt trong lĩnh vực y dược, không chỉ mở ra cơ hội hợp tác học thuật đa quốc gia mà còn góp phần xây dựng một môi trường quốc tế ngay tại Việt Nam, nâng cao uy tín và thương hiệu học thuật của quốc gia trong khu vực và trên thế giới"", đại diện trường Đại học Y Dược nhận định. Sinh viên trường Đại học Y Dược, Đại học Quốc gia Hà Nội học tập tại Bệnh viện E. Ảnh:VNU Trường Đại học Y Dược, Đại học Quốc gia Hà Nội, thành lập năm 2020, trên cơ sở khoa Y Dược. Hiện, quy mô đào tạo của trường là hơn 3.000 sinh viên với 6 chương trình đào tạo đại học, 10 chương trình thạc sĩ ở 12 chuyên ngành và 13 chương trình bác sĩ nội trú. Toàn trường có gần 400 cán bộ, trong đó có hơn 280 giảng viên cơ hữu. Nhiều thầy cô đang làm việc ở các bệnh viện lớn như Bạch Mai, Việt Đức, Nhi Trung ương, Phụ sản Trung ương. Ở bậc đại học, điểm trúng tuyển trường Đại học Y Dược thường trong top 3 cao nhất. Như năm ngoái, điểm chuẩn vào trường xét theo kết quả thi tốt nghiệp THPT là từ 24,49 đến 27,15/30. Dương Tâm","Thứ bảy, 12/7/2025, 10:25 (GMT+7)",Dương Tâm,Giáo dục,Tin tức,VN Express,"Trường Đại học Y Dược bắt đầu tuyển sinh 4 chương trình thạc sĩ quốc tế (Nội, Ngoại, Nhi, Điện quang và Y học hạt nhân) giảng dạy bằng tiếng Anh, theo chuẩn quốc tế, với 15 học viên mỗi chương trình. Chương trình kéo dài hai năm, có thực hành lâm sàng tại nhiều bệnh viện lớn và học tiếng Việt cơ bản. Ấn Độ là quốc gia đầu tiên gửi sinh viên đến học, đánh dấu bước tiến mới trong hợp tác quốc tế và nâng cao uy tín học thuật của Việt Nam."
VNEX_120725_00060,Hồng Đào áy náy vì làm Tuấn Trần bị thương khi diễn,https://vnexpress.net/hong-dao-ay-nay-vi-lam-tuan-tran-bi-thuong-khi-dien-4912965.html,"Hậu trường Hồng Đào đóng vai người mẹ mắc Alzheimer, được con chăm sóc. Video:Đoàn phim cung cấp Trong phim điện ảnhMang mẹ đi bỏ,Hồng Đào vàovai chính - bà Lê Thị Hạnh, 64 tuổi, mắc hội chứng suy giảm trí nhớ. Một trong những phân cảnh khó diễn nhất của chị là khi chứng bệnh tiến triển, không còn kiểm soát bản thân, bà Hạnh cắn mạnh vào chân con trai. Dù Tuấn Trần chủ động đề nghị Hồng Đào cắn thật, nghệ sĩ day dứt vì đóng nhập tâm, để lại vết bầm tím cho bạn diễn. ""Đêm đó, về nhà tôi không ngủ được vì hối hận, như thể khiến chính con mình bị đau vậy"", chị nói. Lần thứ hai đóng vai mẹ con với Tuấn Trần, Hồng Đào có cảm giác gần gũi, thân thuộc hơn. Khi đóngMaicủa Trấn Thành (2024), đôi diễn viên ít diễn chung, chủ yếu ghi dấu ở phân cảnh người mẹ phản đối chuyện tình của con. Sang tác phẩm mới, cả hai đồng hành suốt hai tháng trên trường quay, từ đó cảm nhận được mối liên kết. ""Tuấn Trần quan tâm tôi một cách tự nhiên, từ trong phim đến ngoài đời. Lần đầu, tôi hiểu được cảm xúc của một người mẹ có con trai như thế nào"", chị cho biết. Tạo hình nhân vật người mẹ do Hồng Đào thể hiện. Ảnh:Đoàn phim cung cấp Hồng Đào đánh giá vai Hạnh nặng về tâm lý, đòi hỏi sự tìm tòi thực tế. Chị dành nhiều tháng để phân tích tính cách nhân vật, hỏi thăm bệnh tình một số người quen, trong đó có mẹ của một người bạn và bác sĩ chuyên khoa. Diễn viên được cho biết Alzheimer không chỉ dừng ở tình trạng nhớ nhớ, quên quên mà nếu nặng, có thể gây nên những tình huống đau lòng. ""Điều tôi tâm đắc là phim không xoáy vào sự bi lụy của căn bệnh mà tập trung vào tình mẫu tử, sự hiếu thảo con dành cho mẹ"", nghệ sĩ nói. Mang mẹ đi bỏdo đạo diễn Mo Hong Jin (phimĐiều ước cuối của tù nhân 2037) thực hiện. Nhân vật chính trăn trở với câu hỏi: ""Khi yêu thương trở thành gánh nặng, bạn sẽ quyết định như thế nào?"". Ngoài Hồng Đào, Tuấn Trần, dự án có sự tham gia của tài tửJung Il Woo- phimGia đình là số một(Unstoppable High Kick), Juliet Bảo Ngọc (Tro tàn rực rỡ). Để viết kịch bản, Mo Hong Jin tìm hiểu lối sống, nét văn hóa Việt, với sự đồng hành của một số đơn vị sản xuất trong nước. Êkíp chọn đề tài về gia đình vì tin đây là yếu tố quen thuộc với bất kể ngôn ngữ, quốc gia nào. Phan Gia Nhật Linh - đạo diễnEm và Trịnh, Em là bà nội của anh- là một trong những nhà sản xuất. Hồng Đào, Tuấn Trần trong một phân cảnh của ""Mang mẹ đi bỏ"". Ảnh:Đoàn phim cung cấp Hồng Đào tên đầy đủ là Nguyễn Đình Hồng Đào, 62 tuổi, được biết đến như một trong những nghệ sĩ kịch thuộc ""thế hệ vàng"" của TP HCM thập niên 1990, bên cạnh Thành Lộc, Hồng Vân. Năm 1994, chị sang Mỹ định cư tại Bắc California. Những năm gần đây, Hồng Đào tham gia nhiều dự án phim nhưPhượng khấu,Thưa mẹ con đi,Ngôi nhà bươm bướm. Sauly hôn, nghệ sĩ sắp xếp lịch đi, về giữa Mỹ và trong nước để lo cho hai con và bố mẹ - hiện sống tại California. Năm 2024, chị tham gia vai thứ chính trongMai- tác phẩm đạt 520 tỷ đồng, trở thành phim Việt ăn khách nhất mọi thời. Cùng năm, phimChị dâuHồng Đào đóng cùng Việt Hương, Lê Khánh, Ngọc Trinh đạt 113 tỷ đồng. Tuấn Trần 33 tuổi, từng làm người mẫu trước khi lấn sang phim ảnh. Vai Quắn - con trai Ba Sang trongBố già(2021) của Trấn Thành - giúp anh đoạt giảiNam diễn viên chính xuất sắctại Liên hoan phim Việt Nam lần thứ 22. Đầu năm 2024, Mai đưa Tuấn Trần trở thành nam diễn viên trong nước đầu tiên có tổng doanh thu phim chiếu rạp trên 1.000 tỷ. Mai Nhật","Thứ bảy, 12/7/2025, 07:58 (GMT+7)",Mai Nhật,Giải trí,Phim,VN Express,"Trong phim ""Mang mẹ đi bỏ"", Hồng Đào vào vai bà mẹ mắc Alzheimer và có nhiều phân đoạn diễn xuất khó, đặc biệt là cảnh cắn con trai do Tuấn Trần đóng. Hồng Đào đã dành nhiều thời gian nghiên cứu và tìm hiểu về bệnh Alzheimer để nhập vai tốt nhất, đồng thời đánh giá cao việc bộ phim tập trung vào tình mẫu tử thay vì chỉ xoáy sâu vào sự bi lụy của bệnh tật. Phim do đạo diễn Mo Hong Jin thực hiện, xoay quanh câu hỏi về gánh nặng yêu thương và có sự tham gia của nhiều diễn viên nổi tiếng."
VNEX_120725_00089,"Mua đất vườn chung sổ, làm sao để tách thửa?",https://vnexpress.net/mua-dat-vuon-chung-so-lam-sao-de-tach-thua-4912986.html,"Nhà tôi mua một mảnh đất vườn hơn 50 m2, thuộc khu đất rộng 500 m2, từ năm 2008 bằng giấy tờ viết tay. Mảnh đất chung đã có sổ đỏ, do 3 người không ở cùng khu này đứng tên. Giấy tờ mua bán của tôi chỉ có 2 trên 3 người ký, các mảnh khác cùng khu cũng giao dịch như vậy. Trước đó, xóm tôi có nộp hồ sơ lên Sở Nông nghiệp và Môi trường làm giấy tờ nhưng không được do chưa có chính sách giải quyết cho loại đất này. Gần đây, các hộ trong xóm bàn nhau cách xử lý là sang tên mảnh đất 500 m2 do ba người kia đứng tên cho một người chưa lập gia đình trong nhóm, đề phòng một trong những người đứng tên sổ đỏ chung có vấn đề về sức khỏe. Mong độc giả quý báo tư vấn giúp tôi việc sang tên cho một người trong xóm sổ đỏ mảnh đất cả xóm đang ở có hợp lý không. Nếu một trong ba người đứng tên sổ đột ngột mất, chúng tôi bị ảnh hưởng như thế nào? Nếu chúng tôi muốn chuyển đất thành thổ cư và tách thửa riêng cần phải làm gì? Xin cảm ơn! Độc giảVân Bình","Thứ bảy, 12/7/2025, 00:00 (GMT+7)",Vân Bình,Bất động sản,Tư vấn,VN Express,"Năm 2008, gia đình bà Vân Bình mua một mảnh đất vườn (50m2) thuộc khu đất lớn (500m2) đã có sổ đỏ chung do 3 người đứng tên, nhưng giao dịch chỉ có 2 người ký. Do chưa có chính sách, xóm chưa làm được giấy tờ đất. Xóm đang tính sang tên sổ đỏ chung cho một người để tránh rủi ro nếu một trong ba người đứng tên sổ gặp vấn đề. Bà Vân Bình muốn được tư vấn về tính hợp lý của việc này, ảnh hưởng nếu một người đứng tên mất, và thủ tục chuyển đất thành thổ cư, tách thửa."
VNEX_120725_00011,Những lời khai bất thường trong vụ tay vợt nữ Ấn Độ bị bố bắn chết,https://vnexpress.net/nhung-loi-khai-bat-thuong-trong-vu-tay-vot-nu-an-do-bi-bo-ban-chet-4913054.html,"Sáng thứ Năm 10/7, cuộc đời của một nữ tay vợt cấp quốc gia bị kết liễu một cách tàn nhẫn. Không phải vì tai nạn hay một kẻ đột nhập, mà do chính bố cô gây ra. Deepark Yadav (trái) bị bắt sau khi bắn chết con gái, Radhika (phải). Ảnh:NDTV Deepak 49 tuổi, một cựu nhân viên ngân hàng, đã bắn 5 phát súng lục vào con gái, khi cô đang nấu ăn trong bếp tại nhà riêng ở thành phố Gurugram, bang Haryana. Ba viên đạn găm trúng cô từ phía sau. Vài giờ sau đó, Deepak thừa nhận đã bắn chết con gái. Nguyên nhân là lòng tự tôn của một người đàn ông bị tổn thương, sự chế giễu của xã hội và nỗi oán giận ngày càng tăng về sự độc lập của con gái. Năm ngoái, Deepak nghe được những tin đồn về nhân cách của Radhika, đặc biệt sau khi cô xuất hiện trong một video ca nhạc có tên Karwaan, do nghệ sĩ độc lập INAAM thực hiện. Trong video đăng trênYoutubenăm ngoái, có cảnh Radhika ngồi trên xe máy và ôm INAAM từ phía sau. Deepak đã yêu cầu con gái gỡ video này, nhưng không được chấp thuận. Video không có gì phản cảm, nhưng vẫn khiến Deepak cảm thấy khó chịu, báo Ấn ĐộNDTVdẫn lời khai của nghi phạm. Video ca nhạc do tay vợt nữ Radhika đóng chính. Deepak đã thất nghiệp trong nhiều năm, cùng em trai Kuldeep đi làm thuê nên công việc không cố định. Deepak đã đóng cửa một hiệu bán phụ tùng ô tô vài năm trước. Nhưng ông không gặp nhiều khó khăn tài chính, bởi con trai là Dheeraj đang làm ở công ty bất động sản. Radhika 25 tuổi, lại đang trên đà phát triển, từng đại diện Ấn Độ dự các giải trẻ thuộc hệ thống Liên đoàn quần vợt thế giới (ITF). Cô đã giành nhiều danh hiệu quần vợt cấp bang, nhưng phải sớm giải nghệ vì chấn thương vai. Sau đó, Radhika chuyển sang mở học viện quần vợt cho trẻ em, không chỉ nuôi sống bản thân, còn đóng góp vào thu nhập gia đình. Nhưng thay vì tự hào về con gái, Deepak lại cảm thấy bị tổn thương trước những lời đàm tiếu của xã hội. Khi đến mua sữa ở làng Wazirabad, ông thường bị dân làng chế giễu phải ""sống nhờ một đứa con gái"". Theo báo ĐứcDW, sự kỳ thị phụ nữ ngày càng ăn sâu vào tiềm thức người Ấn Độ. Đàn ông nước này có xu hướng dùng bạo lực và đổ lỗi cho phụ nữ, và Deepak nằm trong số đó. Ông cho biết lòng tự trọng của bản thân bị tổn thương vì những lời giễu của dân làng. Trong xã hội gia trưởng, đàn ông thường được coi là trụ cột kiếm tiền cho gia đình. Deepak không chịu đựng được sự đàm tiếu khi con gái đem về nguồn thu chính cho cả nhà. Deepak đã yêu cầu Radhika đóng cửa học viện quần vợt, nhưng cô từ chối. Sau này, Deepak khai với cảnh sát rằng lời từ chối của con gái làm ông khó chịu và ""gây tổn hại tới phẩm giá"". Deepak khai do bị căng thẳng và xấu hổ, ông đã bắn con gái khi cô đang làm bữa sáng. Khẩu súng lục ổ xoay này có giấy phép sử dụng. ""Không chỉ vì những phát súng của bố, Radhika đã bị giết chết vì chế độ gia trưởng và căm ghét phụ nữ"", báoIndian Expressđăng bài viết về thảm kịch. Theo lời khai của người chú Kuldeep, khi xảy ra án mạng, nhà anh trai chỉ có Deepak, người vợ Manju và Radhika. Dheeraj đang làm việc ở văn phòng công ty. Kuldeep và con trai Piyush sống ở tầng dưới, khi nghe thấy tiếng nổ đã chạy lên tầng để xem tình hình. Kuldeep thấy cháu gái nằm bất động trong bếp, còn khẩu súng ở phòng khách. Kuldeep và Piyush ngay lập tức đưa Radhika đến bệnh viện, nhưng cô đã không qua khỏi. Mẹ của Radhika, Manju không cung cấp lời khai nào cho cảnh sát về vụ việc, lấy lý do bị sốt và nằm trong phòng ở thời điểm gây án. Deepak đã bị cảnh sát bắt giam. Ông khai: ""Tôi rất đau khổ và căng thẳng vì bị xã hội chế giễu. Tôi bị ám ảnh, tổn thương lòng tự trọng. Vì thế, tôi lấy súng ra và bắn trúng Radhika. Tôi đã giết chết con"". Chủ tịch Liên đoàn quần vợt Haryana, ông Suman Kapur cho biết khi còn thi đấu, Radhika luôn giữ kỷ luật và tập trung vào sự nghiệp. ""Cô gái không giành được huy chương nhưng vẫn luôn thi đấu với sự bền bỉ. Tôi rất đau lòng khi nghe tin"". Cảnh sát cho biết họ vẫn đang điều tra vụ việc, gồm cả lời khai bất thường của người mẹ. Họ cũng sẽ khám nghiệm tử thi Radhika, để điều tra kỹ hơn. Hoàng An(theoNDTV,Times of India)","Thứ bảy, 12/7/2025, 06:24 (GMT+7)",Hoàng An,Thể thao,Tennis,VN Express,"Sáng ngày 10/7, tay vợt Radhika đã bị chính cha mình, Deepak Yadav, bắn chết tại nhà riêng ở Gurugram, Ấn Độ. Nguyên nhân vụ việc xuất phát từ việc Deepak cảm thấy bị tổn thương lòng tự trọng do những lời đàm tiếu về sự độc lập và thành công của con gái, đặc biệt sau khi cô xuất hiện trong một video ca nhạc. Dù Radhika là người kiếm tiền chính trong gia đình, Deepak không chịu đựng được sự chế giễu của xã hội khi ""sống nhờ con gái"", dẫn đến hành động bạo lực và gây ra thảm kịch. Vụ án này phản ánh vấn đề sâu sắc về tư tưởng gia trưởng và sự kỳ thị phụ nữ vẫn còn tồn tại ở Ấn Độ."
VNEX_120725_00059,Phong cách minh tinh 'Bến Thượng Hải',https://vnexpress.net/phong-cach-minh-tinh-ben-thuong-hai-4913080.html,"TheoElle, nghệ sĩ hoạt động sôi nổi ở làng giải trí Hoa ngữ, liên tục tham gia show truyền hình, ca nhạc, thời trang. Mỗi lần xuất hiện, bà gây ấn tượng với trang phục trẻ trung, phong thái trang nhã. TheoElle, nghệ sĩ hoạt động sôi nổi ở làng giải trí Hoa ngữ, liên tục tham gia show truyền hình, ca nhạc, thời trang. Mỗi lần xuất hiện, bà gây ấn tượng với trang phục trẻ trung, phong thái trang nhã. Triệu Nhã Chi dự sự kiện phim diễn ra tháng 6. Triệu Nhã Chi dự sự kiện phim diễn ra tháng 6. Bà tiết chế trang sức khi mặc trang phục xu hướng tối giản. TheoSina, bộ đầm đuôi cá giúp minh tinh tôn vóc dáng. Bà tiết chế trang sức khi mặc trang phục xu hướng tối giản. TheoSina, bộ đầm đuôi cá giúp minh tinh tôn vóc dáng. Khi dự sự kiện, bà thường chọn váy áo đơn sắc, tạo điểm nhấn vùng eo. Khi dự sự kiện, bà thường chọn váy áo đơn sắc, tạo điểm nhấn vùng eo. TrênOn, Triệu Nhã Chi cho biết chú trọng làm đẹp, việc tạo diện mạo tươm tất giúp bà vui vẻ. Nghệ sĩ luôn chọn nữ trang, phụ kiện hòa hợp phong cách trang phục. TrênOn, Triệu Nhã Chi cho biết chú trọng làm đẹp, việc tạo diện mạo tươm tất giúp bà vui vẻ. Nghệ sĩ luôn chọn nữ trang, phụ kiện hòa hợp phong cách trang phục. Triệu Nhã Chi và con trai chạy 5 km tại sự kiện thể thao hồi tháng 3. Video:Weibo Từng có khán giả cho rằng Triệu Nhã Chi ""cưa sừng làm nghé"", trênDouyin, bà cho biết sống như bản thân mong muốn. Kể từ sau 50 tuổi, diễn viên luôn nghĩ mỗi dịp sinh nhật, bà nhỏ đi một tuổi chứ không phải thêm tuổi. Nhã Chi tâm niệm bản thân mới ngoài 30, đủ thời gian, sức khỏe để theo đuổi công việc yêu thích. Từng có khán giả cho rằng Triệu Nhã Chi ""cưa sừng làm nghé"", trênDouyin, bà cho biết sống như bản thân mong muốn. Kể từ sau 50 tuổi, diễn viên luôn nghĩ mỗi dịp sinh nhật, bà nhỏ đi một tuổi chứ không phải thêm tuổi. Nhã Chi tâm niệm bản thân mới ngoài 30, đủ thời gian, sức khỏe để theo đuổi công việc yêu thích. Minh tinh đội vòng kết hoa tươi tại sự kiện đầu tháng 6, bà viết trên trang cá nhân: ""Biến ánh mặt trời và niềm vui thành váy áo, mặc lên đi gặp mọi người"". Minh tinh đội vòng kết hoa tươi tại sự kiện đầu tháng 6, bà viết trên trang cá nhân: ""Biến ánh mặt trời và niềm vui thành váy áo, mặc lên đi gặp mọi người"". Triệu Nhã Chi tạo dáng với trang phục cổ điển. Trên Douyin, Weibo, nhiều khán giả viết không nghĩ diễn viên ngoài 70 tuổi vì bà luôn toát vẻ năng động, cách tạo dáng như các phụ nữ trẻ. Triệu Nhã Chi tạo dáng với trang phục cổ điển. Trên Douyin, Weibo, nhiều khán giả viết không nghĩ diễn viên ngoài 70 tuổi vì bà luôn toát vẻ năng động, cách tạo dáng như các phụ nữ trẻ. Nghệ sĩ hóa ""nàng tiên hoa"" ở show âm nhạc tháng 5. Nghệ sĩ hóa ""nàng tiên hoa"" ở show âm nhạc tháng 5. Khi di chuyển ở sân bay, bà thường phối quần jeans và áo nhiều sắc màu. Khi di chuyển ở sân bay, bà thường phối quần jeans và áo nhiều sắc màu. Dung nhan Triệu Nhã Chi qua thời gian. Video:Bilibili TheoSohu, Triệu Nhã Chi chú trọng tập thể thao để giữ sức khỏe, vóc dáng. Bà thích chạy marathon, leo núi. Nghệ sĩ duy trì thói quen luyện yoga hơn 30 năm qua. TheoSohu, Triệu Nhã Chi chú trọng tập thể thao để giữ sức khỏe, vóc dáng. Bà thích chạy marathon, leo núi. Nghệ sĩ duy trì thói quen luyện yoga hơn 30 năm qua. Triệu Nhã Chi sinh ở Hong Kong, là tên tuổi lớn trong làng phim Hoa ngữ, có nhiều tác phẩm để đời nhưBến Thượng Hải(vai Phùng Trình Trình),Sở Lưu Hương,Tân Bạch Nương Tử truyền kỳ,Người tình của Tần Thủy Hoàng... Nghệ sĩ kết hôn với doanh nhân Hoàng Cẩm Sâm năm 1985, có một con trai. Trước đó, bà qua một đời chồng, có hai con riêng. Triệu Nhã Chi sinh ở Hong Kong, là tên tuổi lớn trong làng phim Hoa ngữ, có nhiều tác phẩm để đời nhưBến Thượng Hải(vai Phùng Trình Trình),Sở Lưu Hương,Tân Bạch Nương Tử truyền kỳ,Người tình của Tần Thủy Hoàng... Nghệ sĩ kết hôn với doanh nhân Hoàng Cẩm Sâm năm 1985, có một con trai. Trước đó, bà qua một đời chồng, có hai con riêng. Như AnhẢnh:Elle, Sina","Thứ bảy, 12/7/2025, 08:47 (GMT+7)",Như Anh,Giải trí,Thời trang,VN Express,"Triệu Nhã Chi, một nghệ sĩ Hoa ngữ năng động, luôn gây ấn tượng bởi vẻ ngoài trẻ trung, trang nhã trong các sự kiện giải trí. Bà chú trọng vào việc làm đẹp, lựa chọn trang phục đơn sắc, tôn dáng và kết hợp phụ kiện tinh tế. Dù bị cho là ""cưa sừng làm nghé"", Triệu Nhã Chi vẫn tự tin sống theo ý mình, duy trì lối sống tích cực và năng động, khiến nhiều người ngưỡng mộ vẻ trẻ trung vượt thời gian của bà. Bà còn chia sẻ bí quyết giữ gìn sức khỏe và vóc dáng bằng cách tập thể thao thường xuyên."
