id,title,link,content,date,author,category,sub_category,source,summary
VNEX_011025_00017,Chelsea gieo sầu cho đội của Mourinho ở Champions League,https://vnexpress.net/chelsea-gieo-sau-cho-doi-cua-mourinho-o-champions-league-4945736.html,"Kết quả lần này nối dài mạch không thắng của Mourinho khi đối đầu đội bóng cũ Chelsea lên con số 8. Đây cũng là thất bại đầu tiên của chiến lược gia Bồ Đào Nha từ khi tiếp quản Benfica mùa này, sau hai trận thắng và một hòa ở giải VĐQG. Trở lại Stamford Bridge, ""Người Đặc biệt"" bây giờ tóc bạc hơn, không còn sự bùng nổ quen thuộc bên đường biên. Mourinho chỉ đáp lại tiếng hát gọi tên ông của khán giả Chelsea bằng vài cái vẫy tay khiêm nhường. Tình cảm đó gợi nhắc rằng thời gian có thể xoa dịu vết thương. Ông từng bị coi là kẻ phản bội, bị la ó khi trở lại cùngMan Utdhay Tottenham. Nhưng lần này người hâm mộ không còn ác cảm, chỉ còn sự trân trọng dành cho người từng biến Chelsea thành cỗ máy săn danh hiệu từ năm 2004. Mourinho chỉ đạo các cầu thủ Benfica, ở trận gặp Chelsea trên sân Stamford Bridge, London, Anh hôm 30/9. Ảnh:Reuters Những lời dự báo của truyền thông Anh rằng ngàyMourinhotrở lại sẽ phơi bày sự tụt dốc của đội bóng thành London đã không xảy ra. Không có ma thuật chiến thuật nào từ chiến lược gia 62 tuổi, cũng chẳng có kế hoạch cao tay nào khiến đồng nghiệp Enzo Maresca bối rối. Nhưng cũng phải nói rằng Mourinho năm 2025 không còn dẫn dắt một gã khổng lồ Champions League. Benfica chơi nhạt nhòa và hiếm khi cho thấy khả năng tìm bàn gỡ trước Chelsea. Sau trận thua Bayern Munich ở lượt mở màn, Maresca cần một kết quả tích cực để giảm bớt áp lực. Chelsea chắp vá bởi cơn bão chấn thương, không ở trạng thái tốt nhất, nhưng vẫn đủ để chiến thắng. Thứ Bảy này, khi tiếp Liverpool ở Ngoại hạng Anh, họ sẽ cần thể hiện nhiều hơn. Không khí ởChelseavẫn căng thẳng, ký ức về chức vô địch Club World Cup bắt đầu nhạt dần khi họ sa sút. Maresca thay năm vị trí sau trận thua Brighton, nhưng đội hình xuất phát còn non. Vắng nhiều trụ cột, đáng kể nhất là Cole Palmer, Chelsea nhập cuộc đầy bối rối. Benfica thậm chí suýt mở tỷ số sau tám phút khi sai lầm của Marc Cucurella tạo cơ hội cho Lukebakio dứt điểm, buộc thủ môn Robert Sanchez đẩy bóng trúng cột dọc. Chelsea lỏng lẻo, còn Benfica hứng khởi, đến mức Richard Rios sau đó cũng thử tài Sanchez. Ngoài đường biên, Maresca kêu gọi các học trò giữ bình tĩnh. Chelsea dần hồi phục. Pedro Neto năng nổ với một cú sút căng, rồi chính anh tạt bóng giúp Alejandro Garnacho kiến tạo, khiến Rios phản lưới. Đó là kiểu bàn thua mà một đội bóng dưới thời Mourinho ngày xưa hiếm khi mắc phải. Cucurella, Fernandez và Garnacho (từ trái qua phải) mừng bàn mở tỷ số của Chelsea, trên sân Stamford Bridge, London, Anh hôm 30/9. Ảnh:Reuters Benficahoàn toàn mờ nhạt kể từ đó. Chelsea có thể nới rộng cách biệt, nhưng Anatolyi Trubin cản phá được pha dứt điểm của Tyrique George. Trevor Chalobah và Benoit Badiashile, những người mới trở lại sau chấn thương, đứng vững ở trung tâm hàng thủ. Nỗi lo cho Maresca là Chalobah sẽ bị treo giò trận gặp Liverpool, trong khi lực lượng hàng thủ Chelsea vẫn bị bào mòn. Dù vậy, một chiến thắng vẫn là điều Chelsea cần. Điểm trừ duy nhất của chủ nhà là chiếc thẻ đỏ dành cho Joao Pedro ở phút bù giờ, sau khi anh nhận thẻ vàng thứ hai. Với Maresca, thắng 1-0 là kết quả quan trọng để thoát áp lực, sau khi thua ba trong bốn trận gần nhất và dính vào cuộc khủng hoảng nhân sự. Chelsea giành ba điểm đầu tay ở Champions League, còn Benfica toàn thua hai trận đầu. Ở trận cùng giờ,Tottenhamkhông thể hạ Bodo/Glimt, đội bóng họ từng đánh bại ở cả lượt đi và về tại bán kết Europa League năm ngoái. Phải nhờ bàn của Micky Van de Ven và pha phản lưới của Jostein Gundersen, đội khách mới giật lại được một điểm sau khi Jens Hauge lập cú đúp giúp đại diện Na Uy dẫn hai bàn. Vy Anh","Thứ tư, 1/10/2025, 05:03 (GMT+7)",Vy Anh,Thể thao,Bóng đá,VN Express,
VNEX_011025_00077,20 năm gắn bó của vợ chồng Nicole Kidman,https://vnexpress.net/20-nam-gan-bo-cua-vo-chong-nicole-kidman-4945316.html,"Ngày 29/9, báo chí quốc tế xác nhận diễn viên cặp sao ly thân, chưa rõ nguyên nhân. Nguồn tin củaTMZcho biết họ sống riêng từ đầu mùa hè. Keith dọn khỏi nhà chung ở Nashville (Mỹ), mua căn hộ khác cùng khu vực. Nicole được cho không muốn chia tay, cố cứu vãn hôn nhân. Thời gian qua, diễn viên chăm sóc hai con gái là Sunday, 17 tuổi, và Faith, 15 tuổi, giữ gia đình ổn định từ khi chồng rời đi. Vợ chồng Nicole Kidman trong bức ảnh kỷ niệm 19 năm hôn nhân. Ảnh:Instagram/ Nicole Kidman Nhiều tháng qua, vợ chồng không gặp nhau do lịch trình bận rộn. Minh tinh vừa quay xong phimPractical Magic 2ở London tháng 9, còn chồng cô đang đi lưu diễn và chuẩn bị tổ chức chặng tiếp theo tại Pennsylvania đầu tháng 10. TheoPeople, việc cả hai chia tay gây sốc nhưng với nhiều người quen biết cặp sao thì đây ""không phải bí mật"". Nguồn tin nói thêm: ""Những ai thân với Keith đều cảm thấy đó là điều không thể tránh khỏi"". Hiện đại diện của hai nghệ sĩ chưa phản hồi các thông tin trên. Sau khi tin chia tay nổ ra, một số khán giả để lại bình luận động viên minh tinh dưới bài đăng gần nhất của cô, hy vọng nghệ sĩ đủ mạnh mẽ vượt qua khó khăn. Nicole Kidman và Keith Urban trên khán đài trận đấu FIFA Club World Cup tháng 6. Video:Daily Mail Trước khi rạn nứt, Nicole Kidman và Keith Urban nổi tiếng là đôi vợ chồng đồng cam cộng khổ, trải qua nhiều sóng gió để gìn giữ tình yêu suốt 20 năm.Cả hai gặp nhau lần đầu tại gala G'Day USA tháng 1/2005 và Nicole phải lòng ca sĩ đồng hương từ đó. Bốn tháng sau, Keith chủ động gọi điện thoại cho minh tinh. TrênPeoplenăm 2019, người đẹp kể lại giây phút nhận ra Keith Urban là ""the one"" (một nửa của đời mình) vào dịp sinh nhật 38 tuổi của cô. Hôm ấy, Keith khiến cô xúc động khi bất ngờ xuất hiện trước thềm nhà bạn gái lúc 5h sáng để tặng hoa dành dành cho người thương. ""Đó là lúc tôi nghĩ đây chính là người đàn ông mình hy vọng được cưới. Lúc ấy, tôi tin anh ấy là tình yêu đời mình"", cô nói. Tháng 6/2006, cả hai kết hôn sau một tháng đính ước, cử hành hôn lễ tại điền trang St. Patrick ở vùng ngoại ô Sydney. Hai con nuôi của Nicole với chồng cũ Tom Cruise - Isabella và Connor - cũng đến dự. TheoPeople, đám cưới ""đẹp như trong truyện cổ tích"". Sau đêm tân hôn, cả hai hưởng tuần trăng mật tại Polynesia, Pháp. Bốn tháng đầu của hôn nhân, Nicole Kidman hỗ trợ chồng vượt qua chứng nghiện rượu và cocaine. Trong ba tháng đi cai nghiện, Keith Urban cho biết từng thấy bất an do không biết liệu vợ có còn ở bên mình, cảm động khi thấy cô bỏ qua mọi điều tiếng để tiếp tục yêu anh. Trong lễ trao giải AFI Life Achievement năm 2024, ca sĩ nhắc lại khoảng thời gian đó, cảm ơn tình cảm của vợ. Cặp sao tham dự sự kiện âm nhạc tại Nashville đầu năm. Ảnh:Instagram/ Keith Urban Gần hai thập niên bên nhau, cặp sao luôn đồng hành trong mọi sự kiện, chia sẻ tất cả niềm vui nỗi buồn. Họ thường xuyên nói tốt về bạn đời trong mỗi dịp phỏng vấn, chia sẻ bí quyết giữ lửa hạnh phúc. Nhưng gần đây, Keith Urban và Nicole Kidman không còn nhắc đến nhau với truyền thông. Trên showHayley & Max in the Morningđầu tháng 7, Keith Urban đột ngột ngừng buổi phỏng vấn qua Zoom khi MC Max Burford hỏi anh nghĩ gì khi thấy vợ đóng cảnh tình tứ với diễn viên trẻ Zac Efron trong phimA Family Affair. Người đồng dẫn chương trình Hayley Peterson cho rằng êkíp của Keith ngắt máy vì không muốn họ hỏi điều này. Về phần Nicole Kidman, cô cũng không nhắc đến chồng trong cuộc trò chuyện vớiForbeshôm 29/9. Dù chủ đề về cuộc sống cá nhân, cô chỉ nói đến các phương pháp rèn luyện sức khỏe, học yoga cùng các con. Trước đó, cô dành nhiều lời khen cho chồng khi xuất hiện trên tạp chíWsố tháng 1. Khi ấy, diễn viên còn chia sẻ bí quyết giúp hôn nhân hạnh phúc là tắm cùng nhau. Ngoài ra, trangPage Sixchỉ ra một số dấu hiệu cho thấy cặp sao rạn nứt từ trước. Từ tháng 5, Keith Urban không còn đăng ảnh cả hai lên trang cá nhân, không dự kiện sự kiện cùng vợ. Nicole Kidman cũng không xuất hiện trong chuyến lưu diễn của chồng dù trước đây cô xem đó là dịp để cả hai đi phượt cùng nhau. Lần gần nhất họ xuất hiện chung là khi đi xem một trận đấu thuộc giải FIFA Club World Cup tại Nashville hôm 20/6. TrênInstagramnăm ngày sau đó, Nicole đăng ảnh hạnh phúc bên chồng dịp kỷ niệm 19 năm ngày cưới. Thuở mặn nồng của vợ chồng Nicole - Keith. Video:Instagram/ Keith Urban Nicole Kidmansinh năm 1967, là con gái của gia đình gốc Australia ở Hawaii. Theo thống kê củaIMDb, Kidman từng nhận 258 đề cử, đoạt 111 giải thưởng điện ảnh, trong đó có một tượng vàng Oscar và năm giải Quả Cầu Vàng. Trước Keith Urban, cô có cuộc hôn nhân 11 năm vớiTom Cruise, ly hôn năm 2001. Keith Urbansinh năm 1967, là ca sĩ kiêm nghệ sĩ guitar Australia nổi tiếng với phong cách nhạc đồng quê. Anh từng nhận bốn kèn vàng Grammy và nhiều giải thưởng lớn nhỏ khác trong sự nghiệp. Phương Thảo(theoPeople, ENews)","Thứ tư, 1/10/2025, 00:05 (GMT+7)",Phương Thảo,Giải trí,Giới sao,VN Express,
VNEX_011025_00083,Điều gì xảy ra khi tắm nước lạnh?,https://vnexpress.net/dieu-gi-xay-ra-khi-tam-nuoc-lanh-4945553.html,"Tắm nước lạnh có thể không phù hợp với tất cả mọi người, dễ làm tăng huyết áp tạm thời, dẫn đến những thay đổi sinh lý khác. Tiếp xúc với nhiệt độ lạnh có thể kích hoạt hệ thần kinh tự chủ (ANS) - hệ thống này điều chỉnh tim, mạch máu và nhiều chức năng tự động khác của cơ thể. ANS phản ứng nhanh chóng để làm ấm để cơ thể có nhiệt độ bình thường. Ngoài huyết áp, nhịp tim, tốc độ thở cũng tăng lên. Dù những thay đổi này chỉ là tạm thời (mất khoảng 4 phút để huyết áp trở lại bình thường sau khi ngâm mình trong nước lạnh) nhưng điều này có thể nguy hiểm đối với một số người, gây sốc lạnh. Sốc lạnh là phản ứng căng thẳng sinh lý, có thể làm tăng áp lực lên tim. Người mắc bệnh tim, suy tim nên trao đổi với bác sĩ trước khi thường xuyên thực hiện liệu pháp thư giãn này. Nhiều người tắm nước lạnh như hình thức trị liệu toàn thân, tăng cường sức khỏe. Thông thường, liệu pháp này bao gồm ngâm mình trong nước lạnh hoặc nước đá khoảng tối đa 10 phút. Chúng có thể mang lại một số lợi ích sức khỏe. Tuần hoàn máu tốt hơn: Phản ứng vật lý tức thời với nhiệt độ lạnh giúp tăng cường lưu lượng máu, cải thiện tuần hoàn máu trong cơ thể. Tăng khả năng tập trung và chú ý: Những người lớn tắm trong nước lạnh trong khoảng 5 phút có thể tỉnh táo, tập trung tốt và nhiều năng lượng hơn. Phục hồi cơ: Liệu pháp lạnh được các vận động viên ưa chuộng để thúc đẩy quá trình phục hồi sau khi tập luyện và thi đấu. Lợi ích cho da: Ngâm mình trong nước lạnh làm giảm viêm và căng thẳng oxy hóa, ảnh hưởng đến vẻ ngoài và sức khỏe của da. Cải thiện khả năng miễn dịch: Tiếp xúc với nước lạnh hỗ trợ tăng cường hệ miễn dịch, giảm khả năng mắc bệnh. Các chuyên gia lưu ý bắt đầu tắm nước lạnh khoảng 10-15 độ C, trong 5 phút mỗi lần và tăng dần lên 10 phút để đạt được hiệu quả. Mỗi người nên theo dõi để phát hiện dấu hiệu sốc lạnh. Khi gặp các triệu chứng như chóng mặt, thở hổn hển, khó thở,nhịp tim nhanh, run rẩy, tê liệt tay, chân hãy dừng tắm. Nếu bạn lo ngại nào về vấn đề sức khỏe như bệnh tim mạch hãy nói chuyện với bác sĩ về những rủi ro và lợi ích của việc tắm nước lạnh. Lê Nguyễn(TheoVery Well Health)","Thứ tư, 1/10/2025, 10:00 (GMT+7)",Lê Nguyễn,Sức khỏe,Các bệnh,VN Express,
VNEX_011025_00026,Mbappe: 'Tôi phải ghi 5 bàn từ 5 cơ hội',https://vnexpress.net/mbappe-toi-phai-ghi-5-ban-tu-5-co-hoi-4945734.html,"""Một cầu thủ như tôi, nếu có 5 cơ hội thì phải ghi đủ 5 bàn"", Mbappe nói vớiMovistarsau trận. ""Hôm nay tôi ghi ba bàn, điều đó tốt, nhưng tôi có thể ghi nhiều hơn. Tôi sẽ tiếp tục nỗ lực để dứt điểm hiệu quả hơn"". Mbappe bấm bóng ghi bàn trong trận Real thắng Kairat 5-0 trên sân Ortalyq, thành phố Almaty, Kazakhstan ở lượt hai vòng bảng Champions League tối 30/9/2025. Ảnh:Reuters Tại sân Pavlodar hôm 30/9,Mbappethi đấu nổi bật. Nhà vô địch World Cup 2018 chạm bóng 56 lần, chuyền chính xác 81% với ba đường quyết định (key pass), qua người hai lần và dứt điểm tám lần. Anh được chuyên trangSofascorechấm 9,6 điểm - cao nhất trận. Mbappe mở tỷ số phút 24 với cú sút phạt đền, sau khi Franco Mastantuono bị thủ môn Kairat phạm lỗi trong vòng cấm. Sang hiệp hai, Mbappe ghi thêm hai bàn để lần thứ tư lập hat-trick tạiChampions League. Trong đó, Mbappe lập ba hat-trick trên sân khách - thông số tốt nhất lịch sử giải, bằng cựu tiền đạo Filippo Inzaghi. Nhưng tiền đạo 26 tuổi cũng phung phí nhiều cơ hội. Anh đặt lòng chân phải trong vòng cấm bị thủ môn Kairat cản phá phút 21, dứt điểm chân trái cận thành chệch cột phút 44 hay sút ra ngoài từ cự ly 10 mét ở phút 58. Mbappe ca ngợiThibaut Courtois- thủ môn phất bóng từ vòng cấm để anh thoát xuống bấm bóng điệu nghệ ghi bàn thứ hai. Courtois là thủ môn thứ hai của Real kiến tạo trong lịch sử Champions League, sau Santiago Canizares trong trận gặp Olympiakos vào tháng 10/1997. ""Tôi không biết anh ấy có chủ ý hay không, nhưng đó là một con đường tuyệt vời. Courtois làm 80% bàn thắng, tôi chỉ góp 20% còn lại"", Mbappe bông đùa. Kylian Mbappe tiếc nuối sau khi lỡ cơ hội. Ảnh:Reuters Hai bàn còn lại của Real được ghi bởi các cầu thủ vào sân thay người Eduardo Camavinga và Brahim Diaz. Nhưng Mbappe cho rằng chiến thắng 5-0 trước Kairat không giúp Real xua tan nỗi thất vọng từtrận thua Atletico 2-5tại La Liga cuối tuần qua. ""Chúng tôi không được phép quên cú sốc vừa qua"", Mbappe nhấn mạnh. ""Đây là một giải đấu khác, nhưng chúng tôi phải nhớ để cải thiện, để không phải trải qua một đêm tồi tệ như thế nữa"". HLVXabi Alonsocũng dành nhiều lời khen cho Mbappe. ""Cậu ấy quyết định cục diện gần như ở mọi trận đấu"", ông nói. ""Mbappe dứt điểm rất lạnh lùng. Ngay cả trận derby vừa qua, cậu ấy cũng ghi một bàn tuyệt đẹp. Chúng tôi cần chất lượng của Mbappe được phát huy, không chỉ ở khía cạnh ghi bàn mà còn ở tầm ảnh hưởng. Mbappe có thể trải qua một mùa giải bùng nổ"". Ngày 4/10, Real trở về sân nhà gặp Villarreal ở vòng 8 La Liga. Hồng Duy(theoESPN, Marca)","Thứ tư, 1/10/2025, 05:26 (GMT+7)",Hồng Duy,Thể thao,Bóng đá,VN Express,
VNEX_011025_00012,Cú bổ nhào khiến tiêm kích Mỹ tự bắn hạ chính mình năm 1956,https://vnexpress.net/cu-bo-nhao-khien-tiem-kich-my-tu-ban-ha-chinh-minh-nam-1956-4942447.html,"Ngày 21/9/1956, tiêm kích F11F-1 Tiger số đuôi 138620 cất cánh từ cơ sở của công ty quốc phòng Grumman tại New York để thực hiện chuyến bay thử nghiệm trên Đại Tây Dương, cách bờ biển Long Island khoảng 30 km. Người điều khiển là Thomas Attridge Jr., phi công thử nghiệm 33 tuổi và từng có kinh nghiệm vận hành chiến đấu cơ F9F Panther. Attridge có nhiệm vụ khai hỏa 4 khẩu pháo Colt Mk 12 cỡ nòng 20 mm, nhằm đánh giá khả năng hoạt động của chúng và ảnh hưởng đến tiêm kích Tiger khi xả đạn ở tốc độ siêu thanh. Chiến đấu cơ F11F-1 Tiger của hải quân Mỹ bay hồi năm 1960. Ảnh:Wikimedia Sau khi đạt độ cao 6.000 m, Attridge cho chiếc F11F-1 bổ nhào ở góc 20 độ và tăng tốc độ lên 1.240 km/h, nhanh hơn âm thanh. Khi đến độ cao 4.000 m, Attridge khai hỏa 4 khẩu pháo trong vòng 4 giây, sau đó bật chế độ tăng lực và tiếp tục chúi mũi bổ nhào. Ở độ cao 2.100 m, chiếc Tiger khai hỏa lần hai để xả hết cơ số đạn mang theo và tiếp tục di chuyển với vận tốc siêu thanh. Khoảng 11 giây sau, nắp kính buồng lái tiêm kích đột nhiên lõm vào trong, máy bay rung lắc và động cơ xuất hiện nhiều âm thanh lạ. Phi công thông báo cho đài chỉ huy về sự cố, cho biết cửa hút gió bên phải có lỗ thủng lớn, tốc độ vòng quay động cơ giảm xuống 78% và mất toàn bộ lực đẩy. Attridge tin rằng tiêm kích đã đâm phải chim, nhanh chóng giảm ga và tìm cách lượn về hạ cánh khẩn cấp ở sân bay của Grumman cách đó 13 km. Sau khi bay được hơn 3 km, máy bay chỉ còn cách mặt đất khoảng 365 m và khó lòng trở về sân bay với công suất động cơ hiện tại. ""Tôi thử tăng ga và động cơ lập tức xuất hiện những tiếng ồn dữ dội"", Attridge nhớ lại. Động cơ ngừng hoạt động sau đó không lâu, buộc phi công thu càng và áp dụng quy trình hạ cánh khẩn cấp bằng bụng xuống khu rừng cách sân bay khoảng 800 m. Máy bay trượt dài 90 m giữa đám cây cối, mất toàn bộ cánh phải và cánh đuôi ngang. Nhiên liệu rò rỉ tạo ra đám cháy lớn, khiến chiếc Tiger bị phá hủy hoàn toàn. Attridge kịp phóng ghế thoát hiểm song vẫn bị thương nặng, gãy một chân và nứt ba đốt sống. Sau khi nhập viện để điều trị, anh đã hồi phục và tiếp tục công việc phi công thử nghiệm. Kết quả điều tra cho thấy chiếc Tiger không đâm phải chim, mà trúng ba viên đạn 20 mm do chính nó bắn ra. Viên đầu tiên xuyên qua kính buồng lái, viên thứ hai phá thủng mũi máy bay, còn viên cuối cùng gây hư hại cửa hút gió bên phải, đánh trúng van điều khí và găm vào tầng nén đầu tiên của động cơ. Mô phỏng sự cố khiến tiêm kích Tiger Mỹ bắn trúng chính mình năm 1956. Đồ họa:Amusing Planet Các điều tra viên cho biết loạt đạn 20 mm có sơ tốc đầu nòng rất lớn, khoảng 3.675 km/h, cao hơn nhiều so với tốc độ của chiếc F11-F1. Tuy nhiên, đạn giảm tốc rất nhanh do lực cản không khí, trong khi máy bay lại tăng tốc do những cú bổ nhào và liên tục bật chế độ tăng lực. Sau khi bay được 4-5 km, những viên đạn này có tốc độ ngang với máy bay và lao xuống phía dưới do trọng lực, vào đúng vị trí mà tiêm kích di chuyển sau khi khai hỏa. Sự cố đánh dấu lần đầu một tiêm kích bắn rơi chính nó trong lịch sử hàng không thế giới. Các chiến đấu cơ trước đó không bay đủ nhanh để tình huống như vậy xảy ra. Các nhà điều tra Mỹ đã rút ra hàng loạt bài học sau sự cố hy hữu này, dẫn đến những sửa đổi trong quy trình thử nghiệm vũ khí ở tốc độ cao. Giới chức Mỹ đã áp đặt quy định nghiêm ngặt về góc bổ nhào và điều kiện khai hỏa để tránh trường hợp phi cơ bay trúng loạt đạn của mình. Phi công tiêm kích cũng phải đổi hướng hoặc kéo mũi máy bay, tăng độ cao sau khi khai hỏa pháo. Tiêm kích F11F Tiger được trưng bày ở bảo tàng lịch sử không quân tại Virginia, Mỹ hồi năm 2023. Ảnh:Wikimedia F11F/F-11 Tiger là tiêm kích hạm siêu thanh một chỗ ngồi, được Grumman sản xuất trong giai đoạn 1954-1959 cho hải quân Mỹ. Mẫu phi cơ này có khối lượng nhẹ, khả năng cơ động và độ an toàn cao, yêu cầu bảo dưỡng thấp. Đây cũng là một trong những mẫu tiêm kích đầu tiên đạt tốc độ siêu thanh. Dù vậy, nó lại xuất hiện cùng thời điểm với hai mẫu tiêm kích khác mạnh mẽ hơn là F-8U Crusader và F-4 Phantom II. Điều này khiến dòng Tiger bị lu mờ và ít được sử dụng trên thực tế, dù sở hữu thiết kế có hiệu suất cao. Các phi đội F-11A ngừng hoạt động trên tàu sân bay từ năm 1961, chỉ 7 năm sau khi nguyên mẫu F11F-1 thực hiện chuyến bay đầu tiên. Chúng tiếp tục được sử dụng trong nhiệm vụ huấn luyện đến năm 1967, cũng như nằm trong biên chế đội biểu diễn Blue Angels của hải quân Mỹ giai đoạn 1957-1969. Phạm Giang(TheoEurasian Times)","Thứ tư, 1/10/2025, 01:00 (GMT+7)",Phạm Giang,Thế giới,Quân sự,VN Express,
VNEX_011025_00001,"Người Hà Nội vượt đường ngập, tắc đi làm",https://vnexpress.net/nhieu-diem-van-ngap-quan-doi-dieu-xe-dua-don-nguoi-dan-4945761.html,"Cổng chào dẫn vào khu đô thị An Khánh nước đã rút song một số đoạn vẫn ngập quá bánh xe ôtô. Ảnh:Thảo Nhi Nước vẫn ngập đường Nguyễn Khuyến đoạn qua khu đô thị Văn Quán, Hà Đông sáng nay. Ảnh:Thanh Hải Xe máy, người đi bộ nép vào lề tìm lối đi ở Hà Đông. Ảnh:Thanh Hải Trước bến xe Mỹ Đình vẫn còn ngập sâu, dòng xe di chuyển trên cao bắt đầu đổ về trung tâm Hà Nội lúc 7h sáng. Ảnh:Hoàng Long Đường Lê Đức Thọ trước sân vận động Mỹ Đình vẫn còn đoạn ngập dài, sâu 50-60 cm. Ảnh:Thanh Hải Chiến sĩ hỗ trợ người dân xuống xe. Video:Ngọc Thành Sáng nay, trời đã tạnh mưa, hửng nắng song một số khu vực phía tây như trước bến xe Mỹ Đình, sân vận động Mỹ Đình... nước vẫn ngập sâu 20-30 cm. Xe quân đội qua đoạn nước sâu trên đường Phùng Hưng, Hà Đông. Ảnh:Ngọc Thành Chiến sĩ hỗ trợ người dân qua đoạn ngập sâu. Ảnh:Ngọc Thành","Thứ tư, 1/10/2025, 07:09 (GMT+7)",Unknown,Thời sự,,VN Express,
