id,title,link,content,date,author,category,sub_category,source,summary
VNEX_260925_00048,Ăn khuya món gì để tránh tăng cân?,https://vnexpress.net/an-khuya-mon-gi-de-tranh-tang-can-4942888.html,"Cử nhân dinh dưỡng Mai Thị Thùy, Khoa Dinh dưỡng, Bệnh viện Đa khoa Xuyên Á TP HCM, cho biết để duy trì cơ thể khỏe mạnh và vóc dáng cân đối, cần ăn đúng bữa và hình thành thói quen ăn trước 20 giờ. Song, việc học tập hay làm việc khuya thường khiến cơ thể cần bổ sung năng lượng. Để tránh tăng cân, nên ưu tiên các món ăn vặt ít calo, giàu chất xơ và protein. Những món này không chỉ giúp no lâu mà còn hạn chế lượng calo nạp vào cơ thể. Quan trọng hơn, việc kiểm soát khẩu phần ăn là yếu tố then chốt. Dù là thực phẩm ít calo, nếu tiêu thụ quá nhiều, cơ thể vẫn sẽ nạp vào lượng calo dư thừa. Người dùng nên đọc kỹ nhãn thực phẩm để tránh tiêu thụ đường, chất béo và muối không cần thiết, từ đó bảo vệ sức khỏe và giữ gìn vóc dáng. Dưới đây là những món ăn khuya ít calo, giúp no lâu, tránh tăng cân: Trái cây (chuối, mận, táo, các loại quả mọng) Những loại trái cây này giàu chất xơ, vitamin và khoáng chất, gần như không chứa chất béo, giúp làm đầy dạ dày nhanh chóng với lượng calo thấp. Tuy nhiên, nên ưu tiên ăn trái cây tươi thay vì uống nước ép để giữ nguyên chất xơ. Các loại hạt (hạnh nhân, óc chó, hạt điều) Chứa chất béo lành mạnh, giàu protein và chất xơ, giúp no lâu. Tuy nhiên, do hàm lượng calo cao, cần ăn vừa phải và kiểm soát khẩu phần. Chuối giàu chất xơ, vitamin và khoáng chất, gần như không chứa chất béo, giúp làm đầy dạ dày nhanh chóng với lượng calo thấp. Ảnh: Dậu Đỗ Bỏng ngô không đường Là món ăn vặt đơn giản, ít calo, giúp no bụng mà không gây tăng cân. Trà không đường, không chứa caffeine Các loại trà như trà tim sen, trà hoa cúc, trà bạc hà... chứa chất chống oxy hóa, giúp giảm căng thẳng, xoa dịu cơn đói thần kinh và hỗ trợ giấc ngủ hiệu quả. Sữa nghệ vàng Với lượng calo thấp, món uống này giúp giảm căng thẳng và hỗ trợ tiêu hóa. Nước mật ong pha loãng Cung cấp khoáng chất, vitamin và axit amin thiết yếu, giúp no lâu, giảm cơn thèm ăn ban đêm. Rau củ luộc, hấp và trứng luộc Đây là lựa chọn lý tưởng cho bữa khuya lành mạnh. Rau củ luộc hoặc hấp giữ được nhiều vitamin, khoáng chất và chất xơ, hỗ trợ tiêu hóa, giảm cholesterol và tăng cường sức đề kháng. Phương pháp chế biến này hạn chế dầu mỡ, giúp bữa ăn nhẹ nhàng, dễ hấp thu và tránh tích tụ mỡ. Trứng luộc là nguồn protein hoàn chỉnh, giàu vitamin B12,vitamin D, choline và các axit amin thiết yếu, tốt cho não bộ và cơ bắp. Kết hợp rau củ với trứng luộc không chỉ cân bằng dinh dưỡng mà còn phù hợp cho người ăn kiêng, tập luyện thể thao hoặc muốn duy trì lối sống lành mạnh. Cử nhân Thùy khuyến cáo nên tránh các chất kích thích như caffeine, thực phẩm chứa cồn, đồ ăn nhiều đường, cay hoặc nhiều dầu mỡ vào bữa tối. Những thực phẩm này có thể ảnh hưởng tiêu cực đến giấc ngủ và hệ tiêu hóa. Thay vào đó, lựa chọn các món ăn vặt ít calo, giàu chất xơ và protein sẽ giúp cung cấp năng lượng mà vẫn duy trì sức khỏe và vóc dáng. Mỹ Ý","Thứ sáu, 26/9/2025, 00:03 (GMT+7)",Mỹ Ý,Sức khỏe,Sống khỏe,VN Express,
VNEX_260925_00006,'Hoàng Sao' nén đau để thắng ngược ở giải billiards 10 bi VĐTG,https://vnexpress.net/hoang-sao-nen-dau-de-thang-nguoc-o-giai-billiards-10-bi-vdtg-4943812.html,"Tối 29/5, cơ thủ Dương Quốc Hoàng làm nức lòng người hâm mộ billiards pool Việt Nam khiđánh bại cơ thủ số hai thế giớiFiller 3-2 ở vòng 32. Sau trận đấu, ""Hoàng Sao"" thừa nhận anh thi đấu không như ý, có nhiều pha xử lý hỏng, vì bị trúng thực trước đó, khiến cơ thể không đảm bảo thể lực. Cơ thủ Dương Quốc Hoàng (phải) gặp Filler ở vòng 32 Predator WPA Men’s 10-Ball World Championship 2025, tối 25/9 trong tình trạng thể lực không tốt. Ảnh:Đức Đồng ""Trước trận đấu, tôi cố gắng nằm ngủ vài tiếng, nhưng vẫn trong tình trạng không thể kiểm soát được cơn đau vì trúng thực. Tôi chỉ ăn được một tô cháo. Nên khi vào trận, gặp đối thủ đẳng cấp như Filler, tôi càng thêm áp lực. Tôi lo lắng và luôn đánh trong tâm trạng sợ hãi"", anh nói sau trận. Vì không đảm bảo thể lực, Quốc Hoàng thua nhanh Filler 1-4 trong set một, nhưng kịp gỡ lại ở set hai. Sang set ba, cơ thủ Đức thắng lại, rồi có cơ hội kết thúc trận đấu ở set 4 nhưng anh đánh hỏng bi số 9 (bị lắc lỗ). Quốc Hoàng chớp cơ hội từ may mắn này để thắng set 4, rồi thể hiện bản lĩnh ở set 5, qua đó thắng chung cuộc 3-2. ""Vượt qua Filler, nhưng thật sự tôi rất hâm mộ anh ấy vì lối đánh rất tinh tế, gọn gàng và đơn giản"" cơ thủ 38 tuổi nhận xét. ""Khi Filler chuẩn bị đánh bi số 9 ở set 4, tôi đã nghĩ mình không còn hy vọng gì nữa, vì xác suất trượt là rất hiếm, gần như không thể xảy ra. Nhưng không hiểu sao anh ấy lại bị trượt và mang lại may mắn cho tôi. Cùng với sự cổ vũ của khán giả nhà, tôi đã tận dung tốt cơ hội này để giành chiến thắng"". Cơ thủ Dương Quốc Hoàng tận dụng sai lầm của đối thủ để giành chiến thắng 3-2 trước Joshua Filler ở vòng 32 Predator WPA Men’s 10-Ball World Championship 2025, tối 25/9. Ảnh:Đức Đồng Đối thủ của Quốc Hoàng ở vòng 16 là Aloysius Yapp - tay cơ Singapore đang có phong độ cao với hai chức vô địch liên tiếp các giải 9 bi tại Mỹ. ""Yapp là cơ thủ toàn diện, tôi đã theo dõi Yapp qua nhiều giải đấu gần đây với những chiến thắng rất thuyết phục"", cơ thủ Việt Nam nhận xét về đối thủ. ""Anh ấy đánh rất chỉn chu, gọn gàng, tinh tế và rất ít sai số"". ""Hoàng Sao"" thừa nhận Yapp là chướng ngại lớn, nhưng khẳng định anh sẽ cố gắng hết sức và hy vọng làm được điều gì đó với sự cổ vũ nồng nhiệt của khán giả nhà. Quốc Hoàng quê Quảng Ninh, là tay cơ pool số một Việt Nam với biệt danh ""Hoàng Sao"". Năm 2024, anh giành chiến thắng lịch sử ở chung kết pool 9 bi Scottish Open. Sau đó, tay cơ 38 tuổi còn vô địch Reyes Cup 2024 cùng đội tuyển châu Á. Quốc Hoàng hiện đứng thứ 22 thế giới. Trận Quốc Hoàng - Aloysius Yapp lúc 11h hôm nay 26/9. Ba giải đấu 10 bi nam Predator WPA Men’s 10-Ball World Championship, Box Billiards Mixed Doubles và Poison Cues Saigon Women’s 9-Ball Open được Box Billiards, Predator và Liên đoàn Billiards & Snooker TP HCM (HBSF) đồng tổ chức tại Nhà thi đấu Quân khu 7, TP HCM từ 17 đến 28/9. Tổng giá trị giải thưởng của chuỗi sự kiện 425.000 USD (khoảng 11,2 tỷ đồng), trong đó riêng tiền thưởng của giải 10 bi nam 2025 là 250.000 USD (gần 7 tỷ đồng). Nhà vô địch thế giới 10 bi nam được thưởng 70.000 USD (1,8 tỷ đồng), còn Á quân nhận 40.000 USD. Hai tay cơ đồng hạng ba nhận 17.500 USD. Ở nội dung Box Billiards Mixed Doubles Open kết thúc tối 19/9, cặp vợ chồng Joshua Filler và Pia Filler vô địch, nhận 40.000 USD tiền thưởng. Cặp Đài Loan Ko Ping Chung - Chou Chieh-yu về nhì. Đức Đồng","Thứ sáu, 26/9/2025, 08:14 (GMT+7)",Đức Đồng,Thể thao,Các môn khác,VN Express,
VNEX_260925_00044,Bố mẹ và khán giả đón Đức Phúc trở về sau Intervision,https://vnexpress.net/bo-me-va-khan-gia-don-duc-phuc-tro-ve-sau-intervision-4943862.html,"Ông Hà Minh Thắng (phải) - Phó Cục trưởng Cục Nghệ thuật Biểu diễn, Trưởng đoàn Việt Nam tham dự Intervision 2025. ""Hôm nay, khi trở về quê hương, Phúc mang theo chiến thắng đầu tiên của nghệ sĩ Việt Nam tại một sân chơi âm nhạc quy mô lớn. Đây là niềm vinh dự, nhưng đồng thời là trách nhiệm để chúng ta tiếp tục phấn đấu đưa văn hóa, nghệ thuật Việt Nam hội nhập mạnh mẽ hơn nữa"", ông nói. Ông Hà Minh Thắng (phải) - Phó Cục trưởng Cục Nghệ thuật Biểu diễn, Trưởng đoàn Việt Nam tham dự Intervision 2025. ""Hôm nay, khi trở về quê hương, Phúc mang theo chiến thắng đầu tiên của nghệ sĩ Việt Nam tại một sân chơi âm nhạc quy mô lớn. Đây là niềm vinh dự, nhưng đồng thời là trách nhiệm để chúng ta tiếp tục phấn đấu đưa văn hóa, nghệ thuật Việt Nam hội nhập mạnh mẽ hơn nữa"", ông nói. Ông Trần Văn Trung và bà Hồng Yến, bố mẹ ca sĩ Đức Phúc, có mặt ở sân bay từ 6h30 để đón con trai về nước sauvô địch Intervision. Ông Trần Văn Trung và bà Hồng Yến, bố mẹ ca sĩ Đức Phúc, có mặt ở sân bay từ 6h30 để đón con trai về nước sauvô địch Intervision. Mẹ Đức Phúc xúc động cho biết hôm ngồi ở nhà xem chung kết cuộc thi âm nhạc tại Nga, vợ chồng ông bà từ hồi hộp đến vỡ òa vì con chiến thắng. Mẹ Đức Phúc xúc động cho biết hôm ngồi ở nhà xem chung kết cuộc thi âm nhạc tại Nga, vợ chồng ông bà từ hồi hộp đến vỡ òa vì con chiến thắng. Trước khi lên đường sang Nga, Đức Phúc không chia sẻ với bố nhiều về tiết mục. Ca sĩ rủ bố đi lễ đền Gióng. Đến khi xem cuộc thi, ông Trung mới biết con biểu diễn bàiPhù Đổng Thiên Vương(Hồ Hoài Anh sáng tác). Trước khi lên đường sang Nga, Đức Phúc không chia sẻ với bố nhiều về tiết mục. Ca sĩ rủ bố đi lễ đền Gióng. Đến khi xem cuộc thi, ông Trung mới biết con biểu diễn bàiPhù Đổng Thiên Vương(Hồ Hoài Anh sáng tác). Đức Phúc mặc áo dài, đội nón lá trong ngày trở về. Anh cho biết êkíp ở Nga chăm sóc, giúp đỡ anh rất chu đáo trong mọi khâu. Đức Phúc mặc áo dài, đội nón lá trong ngày trở về. Anh cho biết êkíp ở Nga chăm sóc, giúp đỡ anh rất chu đáo trong mọi khâu. Fan mang theo hoa, poster in hình Đức Phúc. Các fan hoạt động trong FC của nam ca sĩ từ năm 2015 đến nay, đồng hành anh ở nhiều sự kiện. Khán giả Hương Giang 34 tuổi, là fan Đức Phúc từ khi anh đoạt quán quân The Voice. Hôm nay, cô xin đi làm muộn để đến đón thần tượng. Nguyễn Quỳnh, 26 tuổi, trưởng câu lạc bộ fan Đức Phúc. Cô có mặt ở sân bay Nội Bài từ 5h30. Fan mang theo hoa, poster in hình Đức Phúc. Các fan hoạt động trong FC của nam ca sĩ từ năm 2015 đến nay, đồng hành anh ở nhiều sự kiện. Khán giả Hương Giang 34 tuổi, là fan Đức Phúc từ khi anh đoạt quán quân The Voice. Hôm nay, cô xin đi làm muộn để đến đón thần tượng. Nguyễn Quỳnh, 26 tuổi, trưởng câu lạc bộ fan Đức Phúc. Cô có mặt ở sân bay Nội Bài từ 5h30. Ca sĩ chụp ảnh cùng người hâm mộ, trả lời các câu hỏi của truyền thông. Đức Phúc cho biết khi đến với cuộc thi, anh không đặt nặng chuyện thắng thua mà chủ yếu muốn quảng bá hình ảnh văn hóa, kết nối với thí sinh các nước. Ca sĩ chuẩn bị nón lá tặng tất cả thí sinh. Ca sĩ chụp ảnh cùng người hâm mộ, trả lời các câu hỏi của truyền thông. Đức Phúc cho biết khi đến với cuộc thi, anh không đặt nặng chuyện thắng thua mà chủ yếu muốn quảng bá hình ảnh văn hóa, kết nối với thí sinh các nước. Ca sĩ chuẩn bị nón lá tặng tất cả thí sinh. Sau khi trở về, Đức Phúc sẽ tổ chức một số buổi họp fan. Ngoài ra, anh dự định học thêm tiếng Nga, ra sản phẩm âm nhạc bằng ngôn ngữ mới. Ca sĩ tên đầy đủ là Nguyễn Đức Phúc, 28 tuổi, quê Hà Nội. Năm 2015, anh làquán quâncuộc thi Giọng hát Việt qua sự dẫn dắt của Mỹ Tâm. Anh có các bản hit nhưÁnh nắng của anh, Ta còn yêu nhau, Còn yêu đâu ai rời đi, Hơn cả yêu,Người ơi người ở đừng về,Ngày đầu sau chia tay. Năm 2024, Đức Phúc gây chú ý khi tham giaAnh trai say himùa đầu tiên, vào đội hình Best Five cuối cùng. Sau khi trở về, Đức Phúc sẽ tổ chức một số buổi họp fan. Ngoài ra, anh dự định học thêm tiếng Nga, ra sản phẩm âm nhạc bằng ngôn ngữ mới. Ca sĩ tên đầy đủ là Nguyễn Đức Phúc, 28 tuổi, quê Hà Nội. Năm 2015, anh làquán quâncuộc thi Giọng hát Việt qua sự dẫn dắt của Mỹ Tâm. Anh có các bản hit nhưÁnh nắng của anh, Ta còn yêu nhau, Còn yêu đâu ai rời đi, Hơn cả yêu,Người ơi người ở đừng về,Ngày đầu sau chia tay. Năm 2024, Đức Phúc gây chú ý khi tham giaAnh trai say himùa đầu tiên, vào đội hình Best Five cuối cùng. Tiết mục dự thi của Đức Phúc tại Intervision 2025. Video:Intervision Intervisioncó tên gốc làIntervision Song Contest, từng do Tổ chức Phát thanh - Truyền hình Quốc tế (OIRT) khởi xướng. Những năm đầu (1965-1968), sân chơi diễn ra tại các thành phố của Tiệp Khắc như Praha, Bratislava và Karlovy Vary. Từ năm 1977 đến 1980,Intervisionđược tổ chức trở lại tại Sopot (Ba Lan), thay thế Sopot International Song Festival. Sau năm 1980, cuộc thi dừng tổ chức. Trở lại sau hơn 40 năm, cuộc thi thu hút thí sinh ở Cuba, Kyrgyzstan, Trung Quốc, Ai Cập, Mỹ, Kenya, Kazakhstan, UAE, Nga, Brazil, Tajikistan, Qatar, Madagascar, Saudi Arabia, Colombia, Ethiopia, Venezuela, Serbia, Nam Phi, Việt Nam, Belarus, Uzbekistan. Arab Saudi sẽ đăng cai cuộc thi năm sau. Hà Thu - Tùng Đinh","Thứ sáu, 26/9/2025, 09:48 (GMT+7)",Hà Thu - Tùng Đinh,Giải trí,Giới sao,VN Express,
VNEX_260925_00012,Nữ vô địch Stockholm Marathon qua đời ở tuổi 30,https://vnexpress.net/nu-vo-dich-stockholm-marathon-qua-doi-o-tuoi-30-4943835.html,"Theo truyền thông Ethiopia, Alene cảm thấy mệt mỏi và yếu sức trong một buổi tập tại Addis Ababa hồi đầu. Cô được đưa đến bệnh viện nhưng không qua khỏi. Ban tổ chức Stockholm Marathon sau đó xác nhận thông tin trên, đồng thời gửi lời chia buồn sâu sắc đến gia đình và người thân của nữ VĐV. Shewarge Alene vô địch Stockholm Marathon 2025. Ảnh:AP Alene sinh ra ở Ethiopia nhưng chuyển tới New York từ khi còn thiếu niên để theo đuổi sự nghiệp chuyên nghiệp. Cô đã dự 26 cuộc đua marathon, giành 12 chức vô địch và 9 lần khác đứng trên bục giành huy chương. Thành tích nổi bật gần nhất của Alene là chiến thắng tại Stockholm Marathon hồi tháng 5/2025 với thời gian 2 giờ 30 phút 38 giây. Alene đạt thành tích cá nhân tốt nhất (PB) khi về ba Cape Town Marathon 2023 với 2 giờ 27 phút 26 giây. Cô cũng từng gây chú ý ngay từ tuổi 17, khi xếp thứ tư cự ly marathon tại New York 2011 và nhờ đó được dự New York City Marathon cùng năm - đánh dấu lần đầu tiên cô tranh tài ở cự ly 42km. Thông tin về sự ra đi đột ngột của Alene đã gây bàng hoàng cho cộng đồng điền kinh. Trên mạng xã hội, nhiều đồng đội và người hâm mộ bày tỏ niềm tiếc thương, gọi cô là ""một chiến binh thực thụ"" và ""nguồn cảm hứng cho các VĐV trẻ Ethiopia"". Dù hiếm gặp, các sự cố sức khỏe nghiêm trọng như ngừng tim đột ngột (sudden cardiac arrest - SCA) có thể xảy ra ở VĐV chạy bộ. TheoPubmed, trong khoảng 10 triệu người tham gia marathon hay half marathon, vẫn có những trường hợp bị đột tử liên quan đến tim mạch. Một khảo sát gần đây từ Mỹ cho biết trung bình 0,6 trường hợp ngừng tim trên 100.000 VĐV hoàn thành marathon xảy ra mỗi năm, tỷ lệ tương đương nhiều năm trước đây. Nhưng ngày nay, tỷ lệ tử vong đã giảm mạnh nhờ các giải chạy đều cải thiện hệ thống cấp cứu. Nguyên nhân thường gặp của những sự cố này là bệnh mạch vành (coronary artery disease), tổn thương cấu trúc tim chưa phát hiện hoặc rối loạn điện tim tiềm ẩn. Trong các trường hợp được ghi nhận, việc xảy ra ngừng tim thường ở giai đoạn cuối của cuộc đua, khi tim và cơ bị áp lực quá lớn. Hồng Duytổng hợp","Thứ sáu, 26/9/2025, 09:53 (GMT+7)",Hồng Duy,Thể thao,Marathon,VN Express,
VNEX_260925_00002,Mỹ bất ngờ triệu tập hàng trăm tướng lĩnh dự họp gấp,https://vnexpress.net/my-bat-ngo-trieu-tap-hang-tram-tuong-linh-du-hop-gap-4943792.html,"TờWashington Posthôm 25/9 cho biết Bộ trưởng Quốc phòng Mỹ Pete Hegseth đã lệnh cho hàng trăm tướng lĩnh Mỹ đang làm nhiệm vụ, trong đó có những chỉ huy triển khai trên khắp thế giới, đến dự cuộc họp tại căn cứ thủy quân lục chiến ở bang Virginia vào tuần sau. Thông báo được đưa ra bất ngờ, không có kế hoạch trước và không nêu lý do tổ chức cuộc họp. Hãng thông tấnReuterschỉ ra rằng hiếm khi có nhiều sĩ quan cấp cao của quân đội Mỹ tập trung tại cùng một địa điểm như vậy. ""Tôi rất thích và nghĩ nó thật tuyệt vời. Hãy để ông ấy thân thiện với tất cả tướng lĩnh từ khắp nơi trên thế giới"", Tổng thống Mỹ Donald Trump cho biết khi bình luận về thông tin. Phó tổng thống Mỹ JD Vance nói với các phóng viên rằng cuộc họp ""thực ra không có gì bất thường cả"". Bộ trưởng Quốc phòng Mỹ Pete Hegseth tại sự kiện ở Lầu Năm Góc ngày 19/9. Ảnh:Reuters Phát ngôn viên Lầu Năm Góc Sean Parnell thông báo rằng Bộ trưởng Hegseth ""sẽ phát biểu trước các chỉ huy quân đội cấp cao vào đầu tuần tới"", nhưng không nêu chi tiết. Một số sĩ quan trong diện triệu tập đang chỉ huy hàng nghìn binh sĩ. Phần lớn đều có lịch trình chi tiết được xây dựng từ trước đó nhiều tuần, song giờ đã bị đảo lộn. ""Mọi người đang cố gắng điều chỉnh kế hoạch và xem liệu họ có phải tham dự hay không"", một quan chức Mỹ tiết lộ. Bộ trưởng Hegseth đang triển khai kế hoạch tái cấu trúc Lầu Năm Góc và đã miễn nhiệm nhiều chỉ huy cấp cao của quân đội. Hồi tháng 2, ông Hegseth cách chức Chủ tịch Hội đồng Tham mưu trưởng Liên quân Charles Brown Jr., cùng 5 tướng cấp cao. Ông Hegseth tháng trước cũng cách chức lãnh đạo cơ quan tình báo của Lầu Năm Góc và hai chỉ huy quân đội. Trong bản ghi nhớ ban hành vào tháng 5, Bộ trưởng Hegseth yêu cầu giảm 20% số đại tướng trong quân đội. Ông cũng cho biết sẽ giảm tối thiểu 20% sĩ quan cấp tướng trong Vệ binh Quốc gia Mỹ cùng 10% sĩ quan cấp tướng trong toàn quân. ""Thêm tướng không giúp thành công hơn"", Bộ trưởng Quốc phòng Mỹ tuyên bố. Nguyễn Tiến(TheoAFP, Reuters)","Thứ sáu, 26/9/2025, 07:09 (GMT+7)",Nguyễn Tiến,Thế giới,Quân sự,VN Express,
