id,title,link,content,date,author,category,sub_category,source,summary
VNEX_311025_00065,"Giảm thị lực do đục thủy tinh thể, glôcôm",https://vnexpress.net/giam-thi-luc-do-duc-thuy-tinh-the-glocom-4957951.html,"Bà Loan bất ngờ bị điện thoại rơi trúng mắt khi nằm xem điện thoại, sau đó mắt hơi đỏ, đến Bệnh viện Đa khoa Tâm Anh TP HCM khám. ThS.BS Dương Minh Phúc, Trung tâm Mắt Công nghệ cao, cho biết mắt trái bà Loan bị đục thủy tinh thể (cườm khô) độ 4 và thị lực chỉ còn 3/10, mắt phải bị glôcôm (cườm nước), thị lực 7/10. Đục thủy tinh thể là tình trạng thủy tinh thể của mắt mất độ trong, ngăn ánh sáng truyền đến võng mạc. Glôcôm xảy ra khi dây thần kinh thị giác bị tổn thương. Cả hai bệnh đều gây suy giảm thị lực, có thể mù lòa nếu không chữa trị kịp thời. Bác sĩ Phúc cho biết người bệnh không bị tổn thương nào về mắt sau cú rơi điện thoại, cơn đau có thể do chấn thương phần mềm ngoài mắt, sẽ hết sau vài ngày. Tuy nhiên mắt trái bịđục thủy tinh thểđộ 4 cần phẫu thuật, nếu không thủy tinh thể quá già (chín), cứng hơn, khó mổ và có thể gây viêm, thoái hóa mắt khiến thị lực suy giảm nghiêm trọng, nguy cơ biến chứng nội nhãn, tăng nhãn áp dẫn đếnbệnh glôcôm, thậm chí mù lòa. Mắt phải của bà bị glôcôm nhưng chỉ số nhãn áp 10-21 mmHg là bình thường, chưa cần phẫu thuật mà chỉ điều trị nội khoa, theo dõi và tái khám đều đặn. Bác sĩ Hưng phẫu thuật mắt cho bà Lan. Ảnh:Bệnh viện Đa khoa Tâm Anh Bà Lan được phẫu thuật mắt trái theo phương pháp phaco. Bác sĩ tán nhuyễnthủy tinh thể bị đụcbằng sóng siêu âm, sau đó hút ra ngoài và thay thế bằng thủy tinh thể nhân tạo để khôi phục thị lực. Sau phẫu thuật một tuần, bà Lan tái khám đạt thị lực 8/10 ở mắt trái. Bác sĩ Phúc khuyến cáo người bệnh nên tái khám đều đặn, mỗi hai, ba tháng một lần để can thiệp kịp thời cho mắt phải bị glôcôm. Nhật Minh *Tên người bệnh đã được thay đổi","Thứ sáu, 31/10/2025, 08:00 (GMT+7)",Nhật Minh,Sức khỏe,Các bệnh,VN Express,
VNEX_311025_00020,Sinner: 'Alcaraz là số 1 năm nay',https://vnexpress.net/sinner-alcaraz-la-so-1-nam-nay-4957979.html,"Phát biểu trong cuộc họp báo sau khi đánh bại Zizou Bergs 6-4, 6-2 ở trận ra quân Paris Masters, Sinner nói anh không bận tâm cuộc đua giành vị trí số một bởi hy vọng rất mong manh. ""Có lẽ đó sẽ là chuyện của năm sau"", tay vợt Italy bày tỏ, hôm 29/10. ""Năm nay vị trí đó không nằm trong tay tôi. Alcaraz rất xuất sắc từ đầu năm và cậu ấy đang có quyền tự quyết"". Sinner (trái) và Alcaraz trò chuyện trong một buổi phỏng vấn chung hồi tháng 11 năm ngoái, bên lề giải ATP Finals. Ảnh:Reuters Alcaraz bất ngờthua sốcCameron Norrie ở vòng hai Paris Masters, dẫn tới bị trừ 90 điểm. Trong khi đó, Sinner có thể kiếm trọn 1.000 điểm nếu vô địch sự kiện Masters 1000 cuối cùng trong năm. Trong trường hợp đó, tay vợt Italy sẽ lấy lại vị trí số một thế giới khi hơn kình địch vài chục điểm. Tuy nhiên, khó khăn cho Sinner là phải bảo vệ danh hiệu ATP Finals, nơi Alcaraz chỉ bảo vệ 200 điểm. Tay vợt Tây Ban Nha chắc chắn giữ số một thế giới nếu thắng ba trận ở ATP Finals, bất kể kết quả của Sinner tại Paris Masters. ""Như mọi năm, tôi muốn kết thúc mùa tốt nhất có thể"", Sinner nói thêm. ""Tôi hài lòng với những gì làm được năm nay. Tháng 12 rất quan trọng để nghĩ và chuẩn bị cho mùa sau. Đó là mối bận tâm duy nhất của tôi"". Dù bị cấm thi đấu ba tháng,Sinnervẫn là tay vợt thành công bậc nhất mùa này khi thắng 48 trong 54 trận, đoạt bốn danh hiệu, gồm hai Grand Slam. Trong đó anh tạo đột phá khi vào chung kết Roland Garros và vô địch Wimbledon, trên những mặt sân không phải sở trường. Phong độ ở sân cứng của Sinner vẫn ổn định, với vị trí á quân Mỹ Mở rộng và hai danh hiệu gần đây tại Bắc Kinh và Vienna. ""Vẫn còn những điểm phải cải thiện và tôi sẽ cố gắng xử lý điều đó trong giai đoạn nghỉ hết mùa"", tay vợt 23 tuổi nói. Anh đặt mục tiêu bảo vệ thành công danh hiệu Australia Mở rộng vào tháng 1/2026 và chinh phục những cột mốc khác trong sự nghiệp. Sau 6 năm góp mặt ở ATP Tour, Sinner có 22 danh hiệu, gồm 4 Grand Slam, và 65 tuần giữ số một thế giới. Trận tiếp theo của anh là gặp Francesco Cerundolo, ở vòng ba Paris Masters, dự kiến lúc 1h ngày 31/10, giờ Hà Nội. Vy Anh","Thứ sáu, 31/10/2025, 05:41 (GMT+7)",Vy Anh,Thể thao,Tennis,VN Express,
VNEX_311025_00013,Haaland có thể rời Man City,https://vnexpress.net/haaland-co-the-roi-man-city-4958038.html,"Theo báoSport, có trụ sở ở Barcelona, Real và Vinicius Junior đang bế tắc trong quá trình đàm phán gia hạn hợp đồng. Hợp đồng của ngôi sao Brazil sẽ hết hạn hè 2027, vì thế nếu không sớm ký hợp đồng mới, anh có thể tự do rời Bernabeu. CLB Hoàng gia không muốn điều này xảy ra. Nhiều CLB Arab Saudi đang quan tâm tới Vinicius. Một trong số đó được cho sẵn sàngchi cả tỷ USD, bao gồm từ 300 đến 365 triệu phí chuyển nhượng và phần còn lại là tiền lương, để giành bằng được siêu sao Brazil 25 tuổi. Trong trường hợp Real bán Vinicius với giá kỷ lục thế giới mới - khoảng 263 triệu USD, họ sẽ quyết mua Haaland. Khi đó, Mbappe sẽ được trở lại vị trí tiền đạo trái quen thuộc, còn tiền đạo Na Uy sẽ chơi như trung phong. Trả lời báo Tây Ban NhaAShôm 30/10, chuyên gia bóng đá Anh, cựu Giám đốc điều hành Aston Villa Keith Wyness cũng tin rằng nếu bán được Vinicius, Real sẽ làm tất cả để rước Haaland về từ Man City ngay hè này. Real sẽ dốc sức chiêu mộ Haaland nếu bán Vinicius. Ảnh:Goal Haaland gia nhập Man City từ Dortmund, hè 2022 với phí 67 triệu USD. Ngay lập tức, anh chứng tỏ khả năng săn bàn siêu hạng, với hai mùa liên tiếp giành Vua phá lưới Ngoại hạng Anh. Tháng 1/2025, tiền đạo Na Uy ký hợp đồng mới, thời hạn tới năm 2034, khi anh 34 tuổi. Haalandchưa từng bày tỏ ý định rời Man City. ""Qua những cuộc đàm phán, tôi tin gia hạn với Man City là lựa chọn đúng"", trung phong cao 1,95 m nói. ""Tôi cảm thấy rất vui khi tiếp tục gắn bó với đội bóng. Tôi mong muốn được cống hiến nhiều năm nữa cho Man City"". Dù vậy, thực tế cho thấy không nhiều cầu thủ có thể từ chối sức hút từ CLB giàu thành tích nhất lịch sử Champions League như Real Madrid. Đội bóng của chủ tịch Florentino Perez cũng đang không có một trung phong cắm đích thực, ngoại trừ cầu thủ trẻ Gonzalo Garcia hay Endrick. Nếu bán Vinicius, Real sẽ có đủ tài chính để chiêu mộ Haaland. Trong khi đó,Man Citynổi tiếng là đội không giữ cầu thủ bằng mọi giá nếu họ muốn ra đi. Vấn đề sẽ nằm ở Haaland, khi tiền đạo này có muốn thay đổi môi trường và tìm kiếm cảm hứng thi đấu mới, để chuyển sang chơi cho đội bóng giàu truyền thống như Real hay không. Với đội bóng Anh hiện tại, Haaland đã giành gần đủ bộ sưu tập danh hiệu tập thể, gồm một Champions League, một Siêu Cup châu Âu, hai Ngoại hạng Anh, một Cup FA và một Siêu Cup Anh. Hoàng An(theoSport&AS)","Thứ sáu, 31/10/2025, 05:39 (GMT+7)",Hoàng An,Thể thao,Ngoại hạng Anh,VN Express,
VNEX_311025_00005,Ông Putin mời nhà báo nước ngoài đến thành trì Ukraine bị bao vây,https://vnexpress.net/ong-putin-moi-nha-bao-nuoc-ngoai-den-thanh-tri-ukraine-bi-bao-vay-4958066.html,"Bộ Quốc phòng Nga ngày 30/10 cho biết Tổng thống Vladimir Putin đã ra lệnh đảm bảo tự do đi lại cho những nhà báo nước ngoài muốn thăm những khu vực có lực lượng Ukraine đang bị bao vây, gồm thành phố Pokrovsk và làng Dimitrov ở tỉnh Donetsk, cùng thành phố chiến lược Kupyansk ở tỉnh Kharkov. ""Bộ tư lệnh quân đội Nga sẵn sàng ngừng giao tranh ở khu vực này trong 5-6 tiếng và mở hành lang cho phép truyền thông nước ngoài, trong đó có cả phóng viên Ukraine, tự do ra vào nếu cần, miễn là đảm bảo an toàn cho nhà báo và quân nhân Nga tại đây"", Bộ Quốc phòng Nga cho hay. Giới chức Nga lưu ý các nhà báo muốn tới thăm cũng cần liên hệ trước với Bộ tư lệnh quân đội Ukraine. Pháo tự hành 2S7M Malka Nga trên mặt trận Pokrovsk, tỉnh Donetsk, tháng 11/2024. Ảnh:RIA Novosti Phát ngôn viên Bộ Ngoại giao Ukraine Heorhi Tykhy sau đó cho biết ""không khuyến nghị phóng viên tin vào đề xuất của Nga về hành lang trong vùng chiến sự"". ""Tôi xin nhắc nhở các cơ quan truyền thông rằng mọi chuyến thăm đến khu vực Moskva kiểm soát mà không được Kiev cho phép là vi phạm luật pháp Ukraine và quốc tế. Điều này sẽ gây ra hậu quả lâu dài về mặt pháp lý và uy tín. Chúng tôi sẽ theo dõi sát sao tình hình"", ông nói. Trong cuộc họp với Tổng thống Putin ngày 26/10, các chỉ huy quân đội Nga cho biết khoảng 5.000 binh sĩ Ukraine đang bị bao vây tại mặt trận Kupyansk, trong khi con số này ở Pokrovsk là 5.500. Quân đội Ukraine sau đó bác tin, tuyên bố hai thành trì này không bị bao vây. Tổng tư lệnh quân đội Ukraine Oleksandr Syrsky ngày 30/10 cho biết bộ binh Nga tại Pokrovsk tránh giao tranh, tập trung ở khu vực nội đô và thường xuyên đổi vị trí. ""Nhiệm vụ của các đơn vị phòng thủ Pokrovsk là xác định vị trí đối phương và tiêu diệt họ. Lực lượng Ukraine đang tăng cường ổn định phòng tuyến trong thành phố, bảo vệ những tuyến đường tiếp tế và sơ tán"", ông nói. Trong khi đó, giới chuyên gia Ukraine và nước ngoài bày tỏ bi quan về tình hình ở thành trì Pokrovsk. Deep State, nhóm phân tích có liên hệ với Bộ Quốc phòng Ukraine, nhận định ""diễn biến ở Pokrovsk đang cận kề thảm họa và liên tục xấu đi, gây ra nguy cơ không thể cứu vãn tình hình"". Pasi Paroinen, chuyên gia thuộc hãng tư vấn Black Bird có trụ sở tại Phần Lan, cho biết lực lượng Nga tại Pokrovsk đã đông đến mức các đơn vị Ukraine không thể đẩy lùi. Thời tiết xấu đôi khi cũng giúp tăng thiết giáp Nga tiếp cận Pokrovsk mà không bị phát hiện. Các binh sĩ Ukraine ở Pokrovsk tiết lộ họ phải đối mặt tình trạng thiếu hụt quân số, trong khi những đợt tập kích bằng drone và bom lượn cũng cắt đứt tuyến hậu cần. Tình trạng này từng xảy ra ở nhiều thành trì chiến lược mà Ukraine phải từ bỏ, trong đó có Avdeevka. Vị trí một số đô thị, khu dân cư thuộc tỉnh Donetsk và Kharkov. Đồ họa:RYV Pokrovsk có diện tích gần 30 km2, là trung tâm hậu cần quan trọng và một trong những thành trì chính của Ukraine tại tỉnh Donetsk. Nếu kiểm soát được Pokrovsk, Nga sẽ làm suy yếu tuyến phòng thủ và năng lực tiếp tế của Ukraine, giúp họ tiến gần hơn mục tiêu kiểm soát toàn bộ tỉnh Donetsk. Kupyansk rộng hơn 33 km2, nằm cách thủ phủ Kharkov của tỉnh cùng tên khoảng 100 km. Đây là thành phố chiến lược về mặt giao thông, kết nối mạng lưới đường sắt và đường bộ ở đông bắc Ukraine, nằm trong tuyến phòng thủ chủ chốt của Ukraine ở tỉnh Kharkov. Nga từng giành được Kupyansk trong giai đoạn đầu xung đột, song bị Ukraine đánh bật trong cuộc phản công chớp nhoáng cuối năm 2022. Truyền thông Nga nhận định tái kiểm soát Kupyansk sẽ giúp quân đội nước này tiến sâu hơn về phía tây. Nguyễn Tiến(TheoRIA Novosti, AFP, Reuters)","Thứ sáu, 31/10/2025, 08:15 (GMT+7)",Nguyễn Tiến,Thế giới,Quân sự,VN Express,
VNEX_311025_00071,Những ôtô hybrid bán chạy nhất Việt Nam,https://vnexpress.net/nhung-oto-hybrid-ban-chay-nhat-viet-nam-4957828.html,"Với 9.994 xe bán ra sau ba quý đầu 2025, nhu cầu của người Việt về xe hybrid tăng 124%, tức hơn gấp đôi so với cùng kỳ năm ngoái. Số liệu này chỉ tính ở các dòng phổ thông của các hãng thuộc Hiệp hội các nhà sản xuất ôtô Việt Nam (VAMA), bao gồm hybrid tự sạc (HEV), hybrid nhẹ (MHEV) và hybrid sạc ngoài PHEV. Xét riêng từng sản phẩm,Toyota Innova Crosslà mẫu hybrid được người Việt mua nhiều nhất, doanh số đạt hơn 2.100 xe sau 9 tháng đầu 2025. Bản hybrid chiếm khoảng 39% tổng lượng bán ra của dòng xe này nói chung. Toyotacó thêm một đại diện trong nhóm đầu bán chạy làCorolla Cross, mẫu hybrid khơi mào cho xu hướng xe lai xăng, điện tại Việt Nam, ra mắt lần đầu hồi 2020. Sức hút của Corolla Cross giảm nhiệt phần nào so với giai đoạn hai năm đầu mở bán do thị trường ngày càng nhiều lựa chọn. Bên cạnh đó, sự xuất hiện của chính đàn em Yaris Cross, ""gà đẻ trứng vàng"" hiện tại của Toyota, cũng khiến nhu cầu của khách đối với Corolla Cross san sẻ phần nào. Innova Cross hybrid lăn bánh tại Hà Nội. Ảnh:TMV Những mẫu hybrid khác của Toyota nhưYaris Cross,Corolla,Alphardcó mức đóng góp khiêm tốn hơn. Nhờ số lượng sản phẩm phong phú nhất, Toyota chiếm khoảng 57% thị phần ở nhóm xe hybrid, tiếp tục thống trị mảng này tại Việt Nam. Khác với hầu hết đối thủ với cấu hình full-hybrid, tức pin dung lượng lớn, môtơ có khả năng vận hành độc lập, tất cả xe Suzuki bán ở Việt Nam đều là loại MHEV. Các mẫuSwift,Fronx,XL7có dung lượng pin không quá 10 Ah, môtơ chỉ mang tính chất bổ trợ lực kéo cho động cơ chứ không thể vận hành độc lập. XL7 đang là mẫu hybrid bán chạy nhất của Suzuki và thứ ba thị trường. Bám sát phía sau XL7 là Honda CR-V, mẫu CUV cỡ C nhập Thái Lan (bản hybrid). Sau Toyota,Hondalà hãng Nhật đẩy mạnh mảng xe hybrid và hiện có danh mục sản phẩm nhiều thứ hai. Các mẫu hybrid nhưCR-V,HR-V,Civicmang về cho Honda khoảng 23% thị phần. Kia Sorento, Toyota Corolla là những mẫu hybrid bán chưa đến 100 xe sau ba tháng đầu 2025. Mẫu xe hybrid có giá bán đắt nhất phân khúc phổ thông, Alphard (4,615 tỷ đồng) thậm chí bán nhiều hơn Corolla và Sorento với giá lần lượt 870 triệu và 1,149-1,247 tỷ đồng. Mảng xe hybrid tại Việt Nam còn sản phẩm của các hãng xe sang, xe Trung Quốc. Nhưng những hãng này không công bố số liệu bán hàng cụ thể. Doanh số 9.994 xe hybrid chiếm khoảng 2,5% thị phần toàn thị trường. So với con số tiêu thụ của xe điện (toàn bộ là xe VinFast) ở mức 103.381 xe - tương đương thị phần 26,4% toàn ngành, mức độ phổ biến của hybrid khiêm tốn hơn nhiều. Phạm Trung","Thứ sáu, 31/10/2025, 05:00 (GMT+7)",Phạm Trung,Xe,Thị trường,VN Express,
VNEX_311025_00009,Vua Charles bỏ tước hiệu hoàng gia của Hoàng tử Andrew,https://vnexpress.net/vua-charles-bo-tuoc-hieu-hoang-gia-cua-hoang-tu-andrew-4958047.html,"""Hoàng gia hôm nay khởi xướng quy trình chính thức để tước bỏ danh xưng, tước vị và địa vị của Hoàng tử Andrew. Kể từ nay, Hoàng tử Andrew sẽ được gọi là Andrew Mountbatten Windsor"", Cung điện Buckingham thông báo hôm 30/10. Ông Andrew, 65 tuổi, cũng bị yêu cầu chuyển khỏi Royal Lodge, dinh thự lớn trong khuôn viên Lâu đài Windsor ở phía tây thủ đô London và là nơi ông đã cư trú lâu năm, và chuyển đến ""chỗ ở riêng tư khác"". ""Những biện pháp khiển trách này được cho là cần thiết, dù ông vẫn tiếp tục phủ nhận những cáo buộc nhằm vào mình. Nhà vua muốn bày tỏ rõ ràng rằng ngài đã, đang và sẽ luôn dành tâm tư, sự cảm thông sâu sắc nhất cho các nạn nhân và người từng bị lạm dụng"", Cung điện Buckingham cho hay. Hoàng tử Andrew tại London ngày 16/9. Ảnh:AFP Andrew là con thứ ba của Nữ hoàng Elizabeth II. Ông từng giữ nhiều chức vụ quan trọng, mang quân hàm chuẩn đô đốc trong hải quân Anh. Andrew hồi năm 2019 bị yêu cầu dừng thực hiện nhiệm vụ hoàng gia, khi ông vấp phải phản ứng dữ dội do tình bạn với tỷ phú ấu dâm Mỹ Jeffrey Epstein. Động thái của Vua Charles diễn ra sau khi cuốn hồi ký của Virginia Giuffre, một nạn nhân của Epstein, được xuất bản. Trong cuốn sách, Giuffre nhắc lại một cách chi tiết và gây sốc rằng cô đã quan hệ tình dục với ông Andrew ba lần, bao gồm cả khi mới 17 tuổi. Andrew, người phủ nhận mọi cáo buộc và nói chưa bao giờ gặp Giuffre, hồi năm 2022 chấp thuận trả cho Giuffre hàng triệu USD để dàn xếp vụ kiện về tấn công tình dục. Cùng năm đó, ông bị tước quân hàm và danh xưng hoàng gia. Giuffre tự sát vào tháng 4, ở tuổi 41, trong khi Epstein tự sát năm 2019 trong nhà tù ở New York khi đang bị giam chờ xét xử. Những cáo buộc liên quan thành viên hoàng gia Anh khiến công chúng phẫn nộ. Ông Andrew hôm 17/10 tuyên bố từ bỏ các tước hiệu hoàng gia, nói rằng những cáo buộc nhằm vào bản thân đang ảnh hưởng xấu đến công việc của anh trai, cũng như của hoàng gia Anh nói chung. Huyền Lê(TheoAFP)","Thứ sáu, 31/10/2025, 06:42 (GMT+7)",Huyền Lê,Thế giới,Quân sự,VN Express,
VNEX_311025_00004,Hôm nay Quốc hội góp ý sửa Luật Chuyển giao công nghệ,https://vnexpress.net/hom-nay-quoc-hoi-gop-y-sua-luat-chuyen-giao-cong-nghe-4957994.html,"Ngày 31/10, Chính phủ sẽ trình Quốc hội dự án Luật sửa đổi, bổ sung một số điều của Luật Chuyển giao công nghệ. Phát biểu trước Thường vụ Quốc hội cách đay 3 tuần, Bộ trưởng Khoa học và Công nghệ Nguyễn Mạnh Hùng cho biết dự luật được xây dựng nhằm hoàn thiện khung pháp lý, thúc đẩy hoạt động chuyển giao công nghệ hiệu quả, đồng bộ và theo kịp xu hướng thế giới. Theo Bộ trưởng, nhiều năm qua Việt Nam vẫn chủ yếu gia công, lắp ráp, chưa chú trọng làm chủ công nghệ. ""Đã đến lúc phát triển dựa vào khoa học, công nghệ và đổi mới sáng tạo"", ông nói, nhấn mạnh việc chuyển giao phải hướng tới công nghệ tạo ra giá trị đột phá và có khả năng thương mại hóa. Dự luật cũng rút gọn thủ tục hành chính, cập nhật danh mục công nghệ mới, công nghệ chiến lược và mở rộng ưu đãi cho hoạt động chuyển giao. Dự thảo quy định ba mức độ chuyển giao công nghệ, gồm ứng dụng, làm chủ và nghiên cứu - phát triển. Mỗi mức độ sẽ được Nhà nước áp dụng chính sách hỗ trợ và ưu đãi tăng dần tương ứng, nhằm khuyến khích doanh nghiệp tiến tới tự làm chủ và sáng tạo công nghệ. Bên cạnh đó, dự luật bổ sung quy định về tổ chức trung gian chuyển giao công nghệ - mô hình phổ biến ở nhiều quốc gia phát triển nhưng còn thiếu tại Việt Nam. Các tổ chức này sẽ giúp doanh nghiệp nhỏ, địa phương khó khăn tiếp cận, tiếp nhận và làm chủ công nghệ mới. Bộ trưởng Khoa học và Công nghệ Nguyễn Mạnh Hùng. Ảnh:Cổng TTĐT Quốc hội Dự luật cũng mở rộng chuyển giao công nghệ nội sinh, khuyến khích thương mại hóa kết quả nghiên cứu trong nước. Doanh nghiệp và nhà khoa học có thể góp vốn bằng công nghệ, Nhà nước được phép mua, phổ biến công nghệ đã làm chủ để hỗ trợ sản xuất. Chính sách tăng cường kiểm soát chuyển giao công nghệ xuyên biên giới cũng được sửa đổi, bổ sung nhằm bảo đảm an ninh công nghệ, đồng thời thúc đẩy xuất khẩu công nghệ Việt Nam. Nhà nước sẽ phát triển thị trường khoa học - công nghệ minh bạch, chuyên nghiệp, với sàn giao dịch và trung tâm công bố công nghệ làm hạt nhân kết nối cung - cầu. Trong ngày 30/10, Chính phủ cũng trình Quốc hội dự án Luật Chuyển đổi số. Dự Luật xác định quản lý trên môi trường số là mặc định, quản lý trên giấy chỉ là ngoại lệ, nhằm bảo đảm mọi người dân đều có thể tiếp cận bình đẳng dịch vụ công trực tuyến. Dự thảo quy định Nhà nước có trách nhiệm bảo đảm mọi công dân, không phân biệt độ tuổi, giới tính, trình độ, điều kiện địa lý hay kinh tế, đều có cơ hội bình đẳng trong việc tiếp cận và sử dụng dịch vụ công trực tuyến. Hệ thống dịch vụ công trực tuyến phải tuân thủ các chuẩn mực quốc tế, gồm giao diện thân thiện, hỗ trợ đa ngôn ngữ, có ngôn ngữ ký hiệu và hình thức hỗ trợ người khuyết tật. Nền tảng phải tương thích với nhiều loại thiết bị, đồng thời có công cụ hỗ trợ tiếp cận ở vùng sâu, vùng đặc biệt khó khăn. Dự luật cũng nêu dịch vụ công trực tuyến cần được thiết kế theo sự kiện cuộc sống của người dân và vòng đời doanh nghiệp, hướng tới cá thể hóa phù hợp với từng cá nhân, tổ chức. Cơ quan nhà nước phải phối hợp liên thông để cung cấp dịch vụ công trực tuyến theo chuỗi sự kiện, thay vì phân mảnh theo thẩm quyền hành chính. Người dân, doanh nghiệp chỉ phải cung cấp thông tin một lần; quy trình xử lý xuyên suốt, liền mạch, phi địa giới hành chính, cắt giảm tối đa thời gian và chi phí. Thứ trưởng Thường trực Bộ Khoa học và Công nghệ Vũ Hải Quân cho biết dự luật xác định chuyển đổi số là ""đột phá hàng đầu"", ưu tiên phát triển hạ tầng, dữ liệu, nhân lực và hợp tác quốc tế. Dự thảo cũng luật hóa các nguyên tắc: lấy người dân làm trung tâm, số hóa ngay từ đầu và quản lý dựa trên dữ liệu, nhằm bảo đảm ""không ai bị bỏ lại phía sau"". Theo chương trình, Quốc hội cũng nghe tờ trình về 4 dự án luật: sửa đổi, bổ sung một số điều của Luật Công nghiệp quốc phòng, an ninh và động viên công nghiệp; An ninh mạng; Bảo vệ bí mật nhà nước (sửa đổi); sửa đổi, bổ sung một số điều của 10 luật có liên quan đến an ninh, trật tự. Sau đó, Bộ trưởng Ngoại giao trình bày Tờ trình về dự thảo Luật sửa đổi, bổ sung một số điều của Luật Điều ước quốc tế. Buổi chiều, các đại biểu sẽ thảo luận tổ các dự án Luật được trình buổi sáng. Sơn Hà","Thứ sáu, 31/10/2025, 00:00 (GMT+7)",Sơn Hà,Thời sự,Chính trị,VN Express,
