id,title,link,content,date,author,category,sub_category,source,summary
VNEX_190825_00070,5 dấu hiệu trên mặt và cổ cảnh báo thận suy yếu,https://vnexpress.net/5-dau-hieu-tren-mat-va-co-canh-bao-than-suy-yeu-4928010.html,"Bệnh thận là tình trạng thận bị tổn thương và không thể lọc máu đúng cách, dẫn đến tích tụ chất thải và dịch trong cơ thể. Bệnh có thể cấp tính (đột ngột và ngắn hạn) hoặc mãn tính (dần dần và dài hạn). Bệnh thận mãn tính có thể tiến triển thànhsuy thận, thường không thể phục hồi. Dù khó phát hiện ở giai đoạn đầu, bệnh thận có thể biểu hiện qua 5 dấu hiệu trên mặt và cổ, dù những triệu chứng này không chỉ xuất hiện riêng ở bệnh lý này. Mặt sưng húp Sưng phù, đặc biệt là tình trạng phù nề trên mặt, là một trong những dấu hiệu sớm nhất của bệnh thận. Khi thận không hoạt động hiệu quả, cơ thể tích tụ dịch dư thừa, gây sưng ở các vùng quanh mắt và má. Tình trạng này biểu hiện rõ rệt hơn vào buổi sáng. Làn da trở nên căng tức, mất đi độ đàn hồi tự nhiên. Ngoài mặt, sưng phù có thể lan sang tay, chân và mắt cá chân. Các chuyên gia khuyến cáo, nếu nhận thấy mặt sưng bất thường và không tự giảm, cần nhanh chóng đi khám để kiểm tra chức năng thận. Da nhợt nhạt, tái xám hoặc vàng vọt Tổn thương thận không chỉ ảnh hưởng đến sức khỏe mà còn tác động rõ rệt đến diện mạo, đặc biệt là làn da vùng mặt và cổ. Khi thận suy yếu, độc tố tích tụ khiến da mặt chuyển màu bất thường, từ sáng màu sang xám xịt hoặc vàng vọt, làm mất đi vẻ tươi tắn. Nhiều người dễ dàng nhận thấy sự thay đổi này. Do thận không thể đào thải chất thải hiệu quả và duy trì cân bằng dinh dưỡng, da trở nên khô, bong tróc hoặc sần sùi. Những mảng da bất thường cùng sự đổi màu dần dần là dấu hiệu cảnh báo cần chú ý, đặc biệt ở những người mắc bệnh thận. Minh họa tình trạng suy thận. Ảnh:Preferred Vascular Group Ngứa da và nổi mẩn đỏ Bệnh nhân mắc bệnh thận mãn tính giai đoạn cuối thường đối mặt với tình trạng ngứa dữ dội, đặc biệt khi bệnh tiến triển nặng. Tình trạng này, được y khoa gọi là ""ngứa do thận"", tập trung chủ yếu ở vùng mặt và cổ, gây kích ứng, khó chịu nghiêm trọng. Việc gãi liên tục để giảm ngứa thường dẫn đến các đốm đỏ, mụn nhỏ, phát ban, thậm chí là vết loét hoặc trầy xước. Nếu không được điều trị, những tổn thương này có thể trở thành ổ nhiễm trùng hoặc gây đau đớn. Nguyên nhân bắt nguồn từ việc thận không thể loại bỏ chất thải và khoáng chất, khiến chúng tích tụ, kích thích các đầu dây thần kinh trên da. Các chuyên gia cảnh báo ngứa dai dẳng ở mặt và cổ kèm theo đốm đỏ là dấu hiệu cần được kiểm tra y tế ngay lập tức, vì có thể liên quan đến các vấn đề nghiêm trọng về thận. Quầng thâm hoặc quầng mắt Quầng thâm mắt không chỉ đơn thuần là biểu hiện của sự mệt mỏi, mà còn có thể là lời cảnh báo từ bệnh thận. Khi thận suy yếu, cơ thể tích tụ chất thải và giữ nước, khiến vùng da mỏng quanh mắt sưng phồng và chuyển màu sẫm. Những quầng thâm này, đôi khi trông giống vết bầm tím, thường đi kèm với tình trạng sưng phù. Dù không phải mọi trường hợp quầng thâm đều liên quan đến bệnh thận, các chuyên gia khuyến cáo, nếu triệu chứng này xuất hiện đột ngột hoặc nặng hơn, kèm theo sưng tấy, mệt mỏi hoặc các dấu hiệu bất thường khác, bạn cần nhanh chóng kiểm tra sức khỏe thận. Tĩnh mạch cổ giãn và sưng Bệnh thận tiến triển khiến cơ thể tích tụ dịch, gây sưng phù và ảnh hưởng nghiêm trọng đến các tĩnh mạch ở cổ. Khi chức năng thận và tim suy giảm, các tĩnh mạch cổ giãn nở, trở nên nổi rõ, đặc biệt khi nằm xuống hoặc cơ bắp căng lên. Tình trạng này xảy ra do áp lực mạch máu tăng cao bởi lượng dịch dư thừa. Các tĩnh mạch sưng hoặc lồi lên ở một bên cổ là dấu hiệu dễ nhận thấy. Các chuyên gia nhấn mạnh, bất kỳ sự bất thường nào như tĩnh mạch cổ sưng phồng đều cần được kiểm tra y tế khẩn cấp, vì đây có thể là biểu hiện của sự mất cân bằng dịch nghiêm trọng và suy yếu chức năng các cơ quan. Mỹ Ý(TheoTimes of India)","Thứ ba, 19/8/2025, 06:00 (GMT+7)",Mỹ Ý,Sức khỏe,Các bệnh,VN Express,"Bệnh thận, cả cấp tính và mãn tính, xảy ra khi thận bị tổn thương và mất khả năng lọc máu hiệu quả, dẫn đến tích tụ chất thải và dịch trong cơ thể. Dù khó phát hiện sớm, bệnh thận có thể biểu hiện qua các dấu hiệu trên mặt và cổ như sưng húp, da nhợt nhạt, ngứa da, quầng thâm mắt và tĩnh mạch cổ giãn. Các dấu hiệu này không đặc hiệu cho bệnh thận, nhưng sự xuất hiện của chúng, đặc biệt khi kết hợp với các triệu chứng khác, nên được kiểm tra y tế để đánh giá chức năng thận. Việc phát hiện và điều trị sớm có thể giúp ngăn ngừa bệnh thận tiến triển thành suy thận."
VNEX_190825_00006,Băng trộm cuỗm viên kim cương hồng 25 triệu USD,https://vnexpress.net/bang-trom-cuom-vien-kim-cuong-hong-25-trieu-usd-4928604.html,"Cảnh sát thành phố Dubai, Các tiểu vương quốc Arab Thống nhất (UAE), ngày 18/8 cho biết viên kim cương hồng do một doanh nhân mang về từ châu Âu. Băng trộm lừa ông rằng một người giàu có đang quan tâm đến viên kim cương này. Để tạo độ tin cậy, nhóm nghi phạm thuê xe sang, đặt lịch hẹn ở những khách sạn cao cấp, thậm chí thuê cả một chuyên gia kim cương nổi tiếng để kiểm định viên đá. Những hành động này khiến doanh nhân đồng ý mang viên kim cương ra khỏi cửa hàng an ninh nghiêm ngặt của mình. Viên kim cương hồng bị đánh cắp ở Dubai. Ảnh:Văn phòng Truyền thông Dubai Băng trộm sau đó dụ ông đến một biệt thự với lý do ""gặp người mua"". Sau khi viên kim cương được trưng ra, nhóm nghi phạm cuỗm lấy nó và bỏ trốn. ""Tôi vừa gặp rắc rối. Tôi đến gặp khách hàng để bán viên kim cương. Họ xem hàng và giờ nó đã bị đánh cắp"", doanh nhân nói trong cuộc gọi khẩn cấp do Văn phòng Truyền thông Dubai công bố. Giới chức Dubai cho biết nhóm nghi phạm, đều là người đàn ông châu Á, đã bị bắt ""nhờ nỗ lực của nhóm chuyên trách và thực địa, cũng như sự hỗ trợ của các công nghệ AI mới nhất"". Viên kim cương khi đó đang được đưa tới một quốc gia châu Á. ""Bộ tư lệnh Cảnh sát Dubai đã ngăn chặn vụ trộm viên kim cương hồng cực hiếm có trị giá 25 triệu USD"", cảnh sát cho hay, thêm rằng những tên trộm đã lên kế hoạch suốt một năm. Doanh nhân bày tỏ ngạc nhiên khi cảnh sát gọi điện thông báo đã bắt được băng trộm và thu hồi viên kim cương ngay sáng hôm nay. Viên kim cương hồng 21,25 carat có độ tinh khiết độc đáo, được coi là gần như không thể thay thế vì chỉ 0,01% cơ hội tìm thấy một viên cùng loại. Dubai là trung tâm quan trọng với hoạt động buôn bán kim cương, giới chức UAE cũng luôn tự hào về an ninh và sự ổn định nhờ hệ thống giám sát chặt chẽ. Huyền Lê(TheoCBS News,Gulf Times)","Thứ ba, 19/8/2025, 09:56 (GMT+7)",Huyền Lê,Thế giới,Cuộc sống đó đây,VN Express,"Một doanh nhân mang viên kim cương hồng quý giá từ châu Âu đến Dubai đã bị một băng trộm người châu Á lừa đảo và đánh cắp. Bọn trộm đã tạo dựng vỏ bọc giàu có, thuê xe sang và chuyên gia kim cương để tạo lòng tin. Cảnh sát Dubai đã nhanh chóng vào cuộc, bắt giữ băng trộm và thu hồi viên kim cương trị giá 25 triệu USD, khi chúng đang trên đường tẩu thoát sang một quốc gia châu Á khác. Vụ việc khẳng định hiệu quả của hệ thống an ninh và giám sát chặt chẽ của Dubai."
VNEX_190825_00071,"Ba món ăn bữa sáng giúp giữ dáng, tràn năng lượng",https://vnexpress.net/ba-mon-an-bua-sang-giup-giu-dang-tran-nang-luong-4927988.html,"Tiến sĩ Lee Jin-bok, một chuyên gia y học gia đình với 25 năm kinh nghiệm điều trị béo phì tại Hàn Quốc, đã chia sẻ trên kênh YouTubeThe God of Health, rằng chỉ cần thay đổi bữa sáng là có thể ổn định lượng đường trong máu và giúp làm phẳng bụng. ""Protein vào buổi sáng rất quan trọng, giúp xây dựng cơ bắp, cũng rất cần thiết cho việc sản xuất hormone và tế bào"", ông nói, thêm rằng protein chất lượng tốt thúc đẩy việc giải phóng một chất trong ruột gọi là incretin, giúp tăng cảm giác no và giảm lượng thức ăn nạp vào trong ngày. Dưới đây là ba lựa chọn bữa sáng lành mạnh, giàu protein, giúp bạn giữ dáng và tràn đầy năng lượng. Trứng Trứng chứa đầy đủ các chất dinh dưỡng, ngoại trừvitamin Cvà chất xơ. Đặc biệt, trứng rất giàu choline, một hợp chất hỗ trợ phân hủy chất béo và hỗ trợ chức năng não bộ. Một số người lo lắng về cholesterol trong trứng, nhưng ông Lee cho biết mặc dù trứng chứa các thành phần làm tăng cholesterol, nhưng chúng cũng chứa các hợp chất làm giảm cholesterol. ""Không cần phải lo lắng quá nhiều"", ông nói. Đối với người khỏe mạnh, ăn hai hoặc ba quả trứng mỗi ngày là đủ. Những người cócholesterol caođang dùng thuốc có thể ăn tối đa hai quả; nếu không dùng thuốc, nên ăn một quả trứng. Trứng rất giàu choline, một hợp chất hỗ trợ phân hủy chất béo, giúp giữ dáng. Ảnh:Bùi Thủy Các loại đậu Tiến sĩ Lee gọi các loại đậu là ""loại protein thực vật tốt nhất"". Chúng không chỉ là nguồn protein chất lượng cao mà còn có nhiều dạng khác nhau, chẳng hạn như đậu nành sẽ có các dạng như đậu phụ, sữa đậu nành không đường, đậu nành lên men, bã đậu nành và natto. Ông cũng lưu ý rằng các loại đậu giàu chất xơ, giúp làm chậm sự tăng đột biến lượng đường trong máu. Chỉ số đường huyết (GI) của chúng rất thấp - 29 đối với đậu lăng, 30 đối với đậu đen và 24 đối với đậu thận. Thực phẩm có GI từ 55 trở xuống được coi là thấp, 55-69 là trung bình và 70 trở lên là cao. Sữa chua Hy Lạp Sữa chua Hy Lạp được làm bằng cách lọc sữa chua thông thường để loại bỏ váng sữa - chất lỏng trong có chứa đường tự nhiên và các chất có khả năng gây dị ứng. Ông Lee khuyến nghị sữa chua Hy Lạp là một lựa chọn giàu protein nhưng nhấn mạnh tầm quan trọng của việc kiểm tra nhãn. ""Hãy đảm bảo rằng nó không đường và có ít hơn 10 g carbohydrate, lý tưởng nhất là 5 g hoặc ít hơn"", ông nói. Hàm lượng chất béo được khuyến nghị là 3 g hoặc ít hơn. Mỹ Ý(TheoThe Korea Times)","Thứ ba, 19/8/2025, 05:00 (GMT+7)",Mỹ Ý,Sức khỏe,Sống khỏe,VN Express,"Tiến sĩ Lee Jin-bok khuyên rằng thay đổi bữa sáng bằng cách tập trung vào protein có thể giúp ổn định lượng đường trong máu và giảm mỡ bụng. Ông đề xuất ba lựa chọn bữa sáng giàu protein: trứng (giàu choline giúp phân hủy chất béo), các loại đậu (nguồn protein thực vật tốt nhất và giàu chất xơ), và sữa chua Hy Lạp (chú ý chọn loại không đường và ít carbohydrate). Việc bổ sung protein vào buổi sáng giúp xây dựng cơ bắp, sản xuất hormone, tăng cảm giác no và giảm lượng thức ăn nạp vào trong ngày."
VNEX_190825_00014,Cách ông Trump tăng cường dùng quân đội để 'trị quốc',https://vnexpress.net/cach-ong-trump-tang-cuong-dung-quan-doi-de-tri-quoc-4925874.html,"Thượng sĩ Craig Clapper, phát ngôn viên lực lượng Vệ binh Quốc gia được triển khai đến thủ đô Washington, ngày 17/8 xác nhận các binh sĩ được giao nhiệm vụ tuần tra ở thủ đô Washington theo lệnh của Tổng thống Donald Trump có thể mang vũ khí. Với thông báo này, hình ảnh các binh sĩ mang súng, áo giáp chống đạn cùng xe thiết giáp Humvee nhiều khả năng sẽ xuất hiện nhiều hơn trên đường phố Washington trong những ngày tới. Lực lượng quân sự Mỹ cũng có thể tham gia sâu hơn vào quá trình hành pháp, trị an trên đất Mỹ, điều từng bị hạn chế đáng kể trước đây. Quyết định hôm 11/8 điều động 800 Vệ binh Quốc gia tới thủ đô Washington được cho là động thái táo bạo nhất của Tổng thống Trump cho đến nay nhằm mở rộng phạm vi sử dụng quyền lực quân sự trên lãnh thổ Mỹ. Lính Vệ binh Quốc gia cùng xe thiết giáp tuần tra trên đường phố Washington hôm 16/8. Ảnh:AP Đây là một trong nhiều động thái của ông Trump nhằm gia tăng vai trò cũng như cách triển khai lực lượng quân sự trên lãnh thổ Mỹ, làm dấy lên một cuộc tranh luận gay gắt về ảnh hưởng và hiện diện ngày càng tăng của quân đội ở trong nước. Ông Trump đang sử dụng các căn cứ quân sự Mỹ làm trung tâm giam giữ người nhập cư trái phép, đồng thời đã triển khai Vệ binh Quốc gia đến Los Angeles và biên giới phía nam để đảm bảo an ninh. ""Đây có thể được diễn giải là một nỗ lực của ông Trump để ghi điểm với công chúng bằng cách coi tỷ lệ tội phạm vốn đã ở mức thấp kỷ lục tại thủ đô là công lao của mình"", Carrie Lee, chuyên gia cấp cao tại Quỹ Marshall Đức, cựu giáo sư tại Học viện Quân sự Mỹ, cho biết. ""Nó cũng có thể là đợt thí điểm cho cách triển khai lực lượng quân sự tới các thành phố khác của Mỹ với căn cứ pháp lý mơ hồ hơn"". Cùng ngày Tổng thống Trump thông báo điều Vệ binh Quốc gia tới thủ đô Washington, một phiên tòa liên bang đã mở ra tại San Francisco nhằm giải quyết đơn kiện từ Thống đốc California Gavin Newsom thách thức việc Nhà Trắng nắm quyền kiểm soát trực tiếp các đơn vị Vệ binh Quốc gia của bang này hai tháng trước đó. Vụ kiện có thể là phát súng mở màn cho một cuộc chiến sâu rộng hơn về việc sử dụng lực lượng quân sự trên đường phố Mỹ khi Tổng thống ban bố tình trạng khẩn cấp. Ông Trump từ lâu đã muốn tăng cường sử dụng quân đội Mỹ để giải quyết các vấn đề nội địa, thay vì chỉ dựa vào lực lượng hành pháp. John Kelly, chánh văn phòng Nhà Trắng dưới chính quyền Trump đầu tiên, từng nói với mọi người xung quanh rằng một trong những thách thức lớn nhất của ông là thuyết phục Tổng thống không sử dụng quân đội trên đất Mỹ. Theo một nguồn tin giấu tên am hiểu vấn đề, Kelly cho hay Tổng thống Trump dường như không hiểu rằng quân đội chỉ được triển khai trong những trường hợp vô cùng hãn hữu. Theo một quan chức cấp cao chính quyền, sau khi trở lại Nhà Trắng hồi đầu năm, Tổng thống ngày càng để ý đến các khu lều trại dành cho người vô gia cư khi đoàn xe của ông đi qua thành phố để đến sân golf ở Sterling, Virginia, hoặc đến Trung tâm Kennedy. ""Ông ấy ở thủ đô nhiều hơn và quan tâm đến tin tức tại Washington hơn"", người này nói. Trong giai đoạn chuyển giao quyền lực, ông Trump đã nêu vấn đề tội phạm với Thị trưởng Washington Muriel Bowser và theo dõi sát sao hàng loạt vụ án xảy ra trong dịp lễ quốc khánh ngày 4/7. Tổng thống không ít lần lần đưa vấn đề tội phạm ra bàn luận với các trợ lý cấp cao, trong đó có phó chánh văn phòng Stephen Miller. Trong gần 150 năm qua, Đạo luật Posse Comitatus đã hạn chế nghiêm ngặt vai trò của quân đội đối với chức năng thực thi pháp luật trong nước, cấm quân đội trấn áp dân thường, trừ một số trường hợp đặc biệt và được pháp luật quy định. Tuy nhiên, Tổng thống Trump đang cho thấy ông khá thoải mái khi triển khai Vệ binh Quốc gia và quân đội trên lãnh thổ Mỹ. Hồi tháng 6, Tổng thống triển khai lính thủy quân lục chiến và Vệ binh Quốc gia California tới Los Angeles để trấn áp những cuộc biểu tình phản đối Cơ quan Thực thi Di trú và Hải quan (ICE) truy quét người nhập cư bất hợp pháp. Lính Mỹ được điều động đến Los Angeles ban đầu chỉ có nhiệm vụ bảo vệ các tòa nhà liên bang, nhưng vai trò của họ đã được mở rộng sang hộ tống nhân viên ICE trong những vụ bắt người nhập cư bất hợp pháp. Việc điều động này không có thời hạn cụ thể. Ban đầu, các binh sĩ dự kiến ở lại Los Angeles 60 ngày, nhưng Lầu Năm Góc gần đây gia hạn đợt triển khai của họ đến đầu tháng 11. Hiện chỉ còn vài trăm trong gần 5.000 lính Vệ binh Quốc gia ở lại thành phố, chủ yếu đóng tại những địa điểm có các tòa nhà liên bang. Ông Trump còn điều động binh sĩ và Vệ binh Quốc gia tới biên giới Mỹ - Mexico, bắt giam những người di cư bên trong ""Khu vực Phòng thủ Quốc gia"" mới thiết lập. Vận tải cơ của không quân Mỹ được sử dụng để chuyển người nhập cư bất hợp pháp ra khỏi đất nước. Tháng trước, Bộ trưởng Quốc phòng Pete Hegseth tuyên bố các căn cứ quân sự ở New Jersey và Indiana sẽ được dùng để giam những người nhập cư bất hợp pháp và do Bộ An ninh Nội địa giám sát. Động thái trên sẽ mở rộng mạng lưới các cơ sở quân sự được sử dụng để giam người nhập cư. Tổng thống Trump tuyên bố quyết định điều quân tới thủ đô là cần thiết vì thành phố Washington đang bị ""các băng đảng bạo lực và tội phạm khát máu chiếm giữ"", đồng thời nhấn mạnh mục tiêu duy trì luật pháp và trật tự, thông điệp vốn hợp lòng những người ủng hộ phong trào Làm nước Mỹ vĩ đại trở lại (MAGA). Tuy nhiên, trái với mối lo lắng của Tổng thống Trump, giới chức Washington cho biết tỷ lệ tội phạm bạo lực năm ngoái tại thành phố đã giảm xuống mức thấp nhất trong vòng 30 năm. Tổng thống Mỹ Donald Trump trong cuộc họp báo tại Nhà Trắng ngày 11/8. Ảnh:AP Nhưng ông Trump không mấy quan tâm đến những số liệu này, cho rằng thủ đô Washington cần được ""giải phóng"". Chưa rõ Vệ binh Quốc gia sẽ được triển khai tới Washington trong bao lâu. ""Đối với quân đội, những sứ mệnh này rất phức tạp. Thành công hay thất bại phụ thuộc vào kế hoạch triển khai, điều hiện còn khá mơ hồ"", Peter Feaver, giáo sư khoa học chính trị và chính sách công tại Đại học Duke, nhận định. ""Nếu nhiệm vụ của họ giống với công việc của cảnh sát truyền thống, điều này sẽ gây ra nhiều vấn đề hơn cho quân đội, về cả mặt pháp lý lẫn nghiệp vụ"". Các tổng thống Mỹ trước đây từng điều động Vệ binh Quốc gia để dập tắt tình trạng bất ổn dân sự quy mô lớn, như khi bạo loạn nổ ra ở Washington sau vụ ám sát Martin Luther King năm 1968. Tổng thống Lyndon Johnson lúc bấy giờ đã viện dẫn Đạo luật Chống Nổi loạn năm 1807 để triển khai 1.750 lính Vệ binh Quốc gia và hơn 11.000 lính chính quy nhằm hỗ trợ lực lượng cảnh sát thủ đô đối phó biểu tình. Luật tự quản của thủ đô Washington trao cho Tổng thống nhiều quyền hạn hơn khi sử dụng Vệ binh Quốc gia so với những nơi khác trên cả nước. Tổng thống có quyền kiểm soát trực tiếp Vệ binh Quốc gia Washington mà không cần liên bang hóa lực lượng này, vốn là yêu cầu bắt buộc đối với các bang khác. ""Washington từ lâu đã là nơi đặc biệt về cả về chính trị lẫn pháp lý"", Stephen Vladeck, giáo sư tại Trung tâm Luật Đại học Georgetown, cho hay, nhấn mạnh rằng người dân thủ đô thời gian tới sẽ phải làm quen với việc lực lượng quân sự được triển khai ở thành phố thường xuyên hơn trong nhiệm kỳ của ông Trump. Vũ Hoàng(TheoWSJ, AFP, Reuters)","Thứ ba, 19/8/2025, 00:00 (GMT+7)",Vũ Hoàng,Thế giới,Phân tích,VN Express,"Tổng thống Trump đã điều động Vệ binh Quốc gia tới Washington D.C. và cho phép họ mang vũ khí tuần tra, làm dấy lên lo ngại về việc quân đội tham gia sâu hơn vào các vấn đề nội địa. Động thái này được xem là một phần trong nỗ lực rộng lớn hơn của Trump nhằm gia tăng vai trò của quân đội trên lãnh thổ Mỹ, bao gồm cả việc sử dụng các căn cứ quân sự để giam giữ người nhập cư và triển khai Vệ binh Quốc gia đến các khu vực khác. Quyết định này đã gây ra tranh cãi và dẫn đến các vụ kiện thách thức quyền kiểm soát của Nhà Trắng đối với lực lượng Vệ binh Quốc gia, mở ra cuộc tranh luận về giới hạn sử dụng quân đội trong nước."
