id,title,link,content,date,author,category,sub_category,source,summary
VNEX_030625_00014,Trung Quốc căng thẳng trước trận sinh tử với Indonesia,https://vnexpress.net/trung-quoc-cang-thang-truoc-tran-sinh-tu-voi-indonesia-4893682.html,"Trung Quốc đang đứng cuối bảng C, với sáu điểm như Bahrain nhưng kém hiệu số bàn thắng thua (-13 so với -8). Trong khi đó, Indonesia đứng thứ tư với ba điểm nhiều hơn cùng hiệu số -6. Thứ bậc phân định dựa theo điểm số, hiệu số bàn thắng thua, số bàn thắng rồi mới đến hiệu số đối đầu. Trung Quốc thắng hai trận còn lại trước Indonesia (5/6) và Bahrain (10/6) cũng chưa chắc đi tiếp. Nhưng nếu họ thua đại diện Đông Nam Á, giấc mơ World Cup sẽ lập tức khép lại. Trước tình thế ấy, các tuyển thủ Trung Quốc thừa nhận lo lắng. Mees Hilgers (áo trắng) xoạc lấy bóng từ Zhang Yuning trong trận Indonesia thua Trung Quốc 1-2, ở lượt bốn bảng C vòng loại ba World Cup 2026. Ảnh:GT ""Tình thế hiện tại buộc chúng tôi phải thắng Indoensia nếu không muốn bị loại"", Li Lei nói ngày 2/6, trước khi cùng đội tuyển sang Indonesia. ""Trận nào cũng có phần căng thẳng, nhất là trận sinh tử sắp tới"". Hậu vệ sinh năm 1992 đánh giá làm khách tại sân Gelora Bung Karno là thách thức lớn. Nhưng trước khi cố gắng ghi bàn, đội phải chơi gắn kết và hạn chế mất bóng. ""Chúng tôi còn cơ hội. Mọi người phải giữ tự tin"", Li Lei cho hay. Wang Shangyuan thì cho rằng Trung Quốc phải chơi trên 120% sức lực. ""Mục tiêu đặt ra phải quyết tâm làm được. Năng lượng tinh thần không được thua Indoensia"", tiền vệ sinh năm 1992 cho hay. Theo trang tin Trung Quốc163, LĐBĐ Trung Quốc (CFA) đã đưa các chuyên gia tâm lý giàu kinh nghiệm đến hỗ trợ giải tỏa căng thẳng cho cầu thủ. Trong khi đó, trang tinSohucho biết HLV Branko Ivankovic thường cho đội đấu tập nội bộ hơn 100 phút để duy trì nhịp độ cao khi vào đấu thật, bao gồm cả bù giờ. Trọng tài nhắc nhở tiền đạo Zhang Yuning (áo đỏ dưới) đang nằm sân, trong trận Trung Quốc thắng Indonesia 2-1 ở lượt bốn bảng C vòng loại ba World Cup 2026 - khu vực châu Á. Ảnh: Xinhua 25 cầu thủ Trung Quốc sang Indonesia đều thi đấu trong nước. So với trận thắng Indonesia 2-1 vào tháng 10/2024, lực lượng Trung Quốc có một số gương mặt mới, như hậu vệ Wang Shiqin, tiền vệ Serginho, Yang Mingyang, hay hai tiền đạo 18 tuổi Wang Yudong và Liu Chengyu. Serginho là cầu thủ nhập tịch gốc Brazil. Anh ra mắt đội tuyển ở trận thua Australia 0-2 hồi tháng 3. Trong khi đó, Yang Mingyang sinh tại Thụy Sĩ và mới hoàn tất thủ tục thi đấu cho Trung Quốc vào ngày 19/5. Trước đây, tiền vệ sinh năm 1995 đã thi đấu từ cấp độ U16 đến U20 cho Thụy Sĩ. Trận Indoensia - Trung Quốc sẽ diễn ra tại sân Gelora Bung Karno, lúc 20h45 ngày 5/6. Danh sách đội tuyển bóng đá Trung Quốc Thủ môn (3): Yan Junling (Shanghai Port), Wang Dalei (Shandong Taishan), Liu Dianzuo (Chengdu Rongcheng) Hậu vệ (9): Zhu Chenjie, Yang Zexiang (Shanghai Shenhua), Tyias Browning, Wei Zhen (Shanghai Port), Li Lei, Wu Shaocong (Beijing Guoan), Hu Hetao, Han Pengfei (Chengdu Rongcheng), Wang Shiqin (Zhejiang) Tiền vệ (7): Wang Shangyuan (Henan), Xie Wenneng, Huang Zhengyu (Shandong Taishan), Xu Haoyang (Shanghai Shenhua), Cao Yongjing, Serginho (Beijing Guoan), Yang Mingyang (Chengdu Rongcheng) Tiền đạo (6): Zhang Yuning, Lin Liangming, Wang Ziming (Beijing Guoan), Wei Shihao (Chengdu Rongcheng), Wang Yudong (Zhejiang), Liu Chengyu (Shanghai Shenshua). Trung Thu","Thứ ba, 3/6/2025, 05:38 (GMT+7)",Trung Thu,Thể thao,Bóng đá,VN Express,"Tuyển Trung Quốc đang ở thế bất lợi tại bảng C vòng loại World Cup và buộc phải thắng Indonesia trong trận đấu sắp tới để duy trì hy vọng đi tiếp. Các cầu thủ Trung Quốc thừa nhận lo lắng trước trận đấu sinh tử này, đặc biệt khi phải làm khách tại Indonesia. Để chuẩn bị, đội tuyển đã được hỗ trợ tâm lý và tập luyện cường độ cao, đồng thời có sự bổ sung một số cầu thủ mới, bao gồm cả cầu thủ nhập tịch."
VNEX_030625_00105,Báo Anh nêu những điểm khiến du lịch Việt Nam hơn Thái Lan,https://vnexpress.net/bao-anh-neu-nhung-diem-khien-du-lich-viet-nam-hon-thai-lan-4893719.html,"Trong bài viết đăng tải trên trangThe Daily Expresscuối tháng 5, tác giả Molly Toolan, đến từ Anh, cho hay Thái Lan là điểm du lịch hàng đầu Đông Nam Á nhưng Việt Nam thu hút hơn vì là ""điểm đến mới mẻ, ít đông đúc và sở hữu vẻ đẹp tự nhiên, văn hóa đặc sắc và chi phí hợp lý"". Từng du lịch Việt Nam vài lần, cây viết nhận xét mảnh đất chữ S sở hữu nhiều bãi biển đẹp ""không kém Thái Lan"", vẫn còn giữ được nét hoang sơ vốn có. Có thể kể đến Phú Quốc với làn nước biển trong xanh và bãi cát trắng mịn, hay Mũi Né nổi tiếng với những đồi cát trải dài, đều là những địa điểm nghỉ dưỡng lý tưởng. Tác giả nhắc đến Hội An nổi tiếng là phố cổ mang đậm bản sắc văn hóa, lịch sử, sở hữu bãi biển yên bình, thích hợp cho những du khách muốn tránh ồn ào. Du khách Ba Lan tại TP HCM dịp Tết Ất Tỵ. Ảnh:Quỳnh Trần Toolan cho hay du khách đến Việt Nam nên ghé thăm 8 Di sản thế giới được UNESCO công nhận. Vịnh Hạ Long, Di sản thiên nhiên thế giới với hàng nghìn đảo đá vôi kỳ vĩ. Chuyến đi bằng thuyền trên Vịnh Hạ Long hay chèo kayak giữa các đảo đá là ""trải nghiệm khó quên"" với cây viết người Anh. Với những du khách ưa mạo hiểm, cung đường Hà Giang dài hơn 370 km quanh co giữa núi rừng phía Bắc là hành trình đáng nhớ. Cảnh quan trên đường thay đổi liên tục từ núi non hùng vĩ, ruộng bậc thang đến các bản làng nằm cheo leo bên sườn núi. Molly gợi ý du khách có thể bắt đi xe khách đêm từ Hà Nội lên Hà Giang và trải nghiệm chuyến đi khám phá thác nước, ruộng bậc thang và các bản làng của người dân tộc thiểu số. So sánh chi phí ăn uống, di chuyển và lưu trú với Thái Lan, nữ tác giả cho rằng chi tiêu ở Việt Nam rẻ hơn đáng kể, nhưng vẫn đảm bảo chất lượng. ""Đây là yếu tố quan trọng với nhiều những du khách muốn du lịch dài ngày"", Toolan nói. Nữ du khách cho hay ẩm thực Việt nổi tiếng với những món ăn tươi ngon và hương vị đậm đà. Món phở, bánh mì, nem cuốn không chỉ phổ biến trong nước mà còn được yêu thích trên toàn thế giới. Toolan gợi ý du khách tham gia lớp học nấu ăn ở các thành phố du lịch. Các lớp học thường được hướng dẫn bởi đầu bếp địa phương. Du khách nước ngoài học đổ bánh xèo tại lớp học nấu ăn món Việt. Ảnh:Bích Phương Một điểm nhấn đặc biệt của du lịch Việt Nam là văn hóa cà phê. Toolan cho rằng cà phê Việt không giống bất kỳ nơi nào, có nhiều biến tấu như cà phê trứng, cà phê cốt dừa, cà phê muối. Từng ngụm cà phê đậm đà, thơm béo không chỉ đánh thức vị giác mà còn là một phần của trải nghiệm bản địa không thể thiếu. Sự hiếu khách và thân thiện của người dân cũng gây ấn tượng với nữ tác giả. Từ những người bán hàng rong, chủ homestay hay các hướng dẫn viên bản địa, họ luôn tươi cười và nhiệt tình tiếp đón du khách. Cây viết nhận xét du lịch Việt Nam trên đà phát triển, lượng khách ít hơn đáng kể so với Thái Lan, nhưng du khách sẽ tránh được những điểm đến quá đông đúc và có trải nghiệm gần gũi, thoải mái hơn. ""Nếu bạn đang tìm kiếm một lựa chọn thay thế cho Thái Lan, thì Việt Nam chính là điểm đến xứng đáng để cân nhắc trong hành trình khám phá Đông Nam Á"", Molly kết luận. Bích Phương(TheoThe DailyExpress)","Thứ ba, 3/6/2025, 09:56 (GMT+7)",Bích Phương,Du lịch,Điểm đến,VN Express,"Trong bài viết trên The Daily Express, tác giả Molly Toolan khẳng định Việt Nam là điểm đến hấp dẫn hơn Thái Lan nhờ vẻ đẹp tự nhiên, văn hóa đặc sắc, chi phí hợp lý và ít đông đúc hơn. Việt Nam sở hữu nhiều bãi biển đẹp hoang sơ, các di sản UNESCO nổi tiếng, ẩm thực phong phú và văn hóa cà phê độc đáo. Đặc biệt, sự hiếu khách của người dân địa phương cũng góp phần tạo nên trải nghiệm du lịch gần gũi và thoải mái cho du khách."
VNEX_030625_00107,Hàng bánh dừa 30 năm chỉ dân địa phương mới biết ở Phú Yên,https://vnexpress.net/hang-banh-dua-30-nam-chi-dan-dia-phuong-moi-biet-o-phu-yen-4893567.html,"Ở một góc ngã 5 Tuy Hòa, quầy bánh kẹp dừa nhỏ của bà Thuận đã tồn tại gần 30 năm. Hoài Thương, sống ở Phú Hòa, nói thường được bố đèo đi ăn khi còn nhỏ dù nhà cách quán gần 10 km. ""Mỗi khi có dịp về quê, tôi vẫn ra đây ăn ít nhất một lần, hương vị vẫn ngon như ngày nào"", cô nói. Do quán nằm ở gần cuối thành phố Tuy Hòa, khách du lịch hầu như không biết đến. Tuy nhiên, quầy bánh nhỏ lúc nào cũng tấp nập người địa phương tới mua, người ít lấy 2-3 cái, người mua nhiều tới 20 cái mỗi lần. Bởi thế, bà Thuận không bao giờ ngơi tay, làm tới đâu bán hết đến đó. Nhiều khi, khách chờ lâu lại phải đi một vòng rồi quay lại mới có bánh ăn. Quán hiện có 6 chiếc chảo gang nướng bánh liên tục, gấp ba lần so với khi mới mở. Ảnh:Tú Nguyễn Bánh dừa bà Thuận là kiểu bánh kẹp, cỡ bàn tay, được nướng trên chảo gang nhỏ. Bên cạnh chảo nướng là một nồi lớn, đựng hỗn hợp bột bánh dừa gồm bột gạo, bột mì, đường, trứng, nước cốt dừa và rất nhiều dừa sợi. Tay bà Thuận thoăn thoắt mở nắp chảo, phết chút dầu bơ lên bề mặt rồi đổ đầy hỗn hợp dừa màu trắng trong nồi vào và đóng nắp. Thời gian chờ một chiếc bánh chín khoảng hơn một phút. Kinh nghiệm của bà là khi mở nắp chảo, thấy bánh rời ra là ổn. Thành phẩm ra lò là chiếc bánh nhỏ, màu vàng nâu, giống như chiếc bánh waffle bẻ đôi. Vỏ bánh mềm, phần cạnh giòn, thơm nức mùi dừa nướng và bơ, trứng. Điểm đặc biệt của quán bánh bà Thuận là dừa sợi lúc nào cũng đầy đặn, được nhiều khách quen nhận xét ""quá rẻ so với giá 3.000 đồng"" ""Tôi cứ thấy bột vơi là bỏ thêm dừa vào, phải nhiều ăn mới ngon"", bà Thuận nói. Chủ quán tiết lộ mình không mua dừa sợi sẵn mà dùng dừa Bến Tre thơm, nhiều cơm dừa về tự xay. Ngoài ra, bà bán tới khi hết hàng mới về nên không bao giờ có chuyện hôm sau bán đồ thừa của hôm trước. Chiếc bánh dừa sau hơn một phút nướng. Ảnh:Tú Nguyễn Bà mở hàng lúc 13h và thường bán hết trước 21h, ngày đông khách khoảng 19h đã hết. Chủ quán cho biết mỗi ngày thường bán vài trăm cái nhưng chỉ có một mình nên tốc độ làm chậm, khách đôi khi phải chờ lâu. ""Khách hàng dễ thương lắm, họ thấy tôi bán một mình nên toàn xuống xe, vào tự gắp bánh, bỏ túi hộ nếu mua mang về"", bà nói, tay thoăn thoắt kẹp chiếc bánh trong chảo và cho vào tủ kính bên cạnh. Theo các khách quen của quán, ai tới mua cũng phải chờ ít nhất 5-10 phút, hiếm lắm mới có bánh sẵn trong tủ. Tuy nhiên, họ sẵn sàng đợi để được thưởng thức hương vị tuổi thơ. Hiện tại, ở Tuy Hòa không còn nhiều hàng bánh dừa kiểu này nên nếu không có người địa phương chỉ, du khách thường bỏ lỡ một món ngon. Bà Thuận cho biết ngày mới mở, khu vực ngã năm có tới 4-5 hàng cùng bán nhưng giờ chỉ còn mình bà. Dẫu thời gian trôi qua, quầy bánh nhỏ của bà vẫn là một mảnh ghép không thể thiếu trong ký ức của người dân Tuy Hòa. Hàng bánh dừa 30 năm của bà Thuận tại Phú Yên. Video:Tú Nguyễn Tú Nguyễn","Thứ ba, 3/6/2025, 07:08 (GMT+7)",Tú Nguyễn,Du lịch,Ẩm thực,VN Express,"Quán bánh kẹp dừa của bà Thuận tại ngã 5 Tuy Hòa đã tồn tại gần 30 năm, trở thành hương vị quen thuộc của người dân địa phương. Bánh được làm từ bột gạo, bột mì, đường, trứng, nước cốt dừa và dừa sợi Bến Tre tự xay, nướng trên chảo gang với công thức đặc biệt tạo nên hương vị thơm ngon khó cưỡng. Dù khách phải chờ đợi, quán luôn tấp nập và bà Thuận luôn được khách hàng yêu quý, giúp đỡ. Quán bánh của bà đã trở thành một phần ký ức của nhiều thế hệ người dân Tuy Hòa."
VNEX_030625_00104,Thách thức của miễn viện phí,https://vnexpress.net/thach-thuc-cua-mien-vien-phi-4893677.html,"Hệ thống Medicare được giới thiệu vào năm 1984 như một phần cải cách y tế của chính phủ, hướng tới chăm sóc sức khỏe công cộng quốc gia, cung cấp miễn phí hoặc trợ cấp một phần các dịch vụ y tế thiết yếu. Đây là đặc quyền rất lớn dành cho người Australia vì y tế ở các quốc gia phát triển hết sức đắt đỏ, khiến cho người dân nhiều nước khác thậm chí không ""dám"" ốm. Phần lớn chi phí khám bệnh không phải nằm viện ở Australia cũng được miễn. Tính đến 2024, khoảng 78% bác sĩ đa khoa tuyến đầu (GP- general practitioner) ở Australia không thu tiền khám bệnh từ bệnh nhân mà chỉ nhận thanh toán từ chính phủ, giúp họ có nhiều bệnh nhân hơn. Trong năm 2024, hệ thống y tế của Australia ghi nhận trung bình mỗi tuần có 100.000 lượt khám miễn phí. Việc miễn viện phí tùy thuộc vào hệ thống y tế và sức khỏe kinh tế của từng quốc gia. Australia chi khoảng 10% GDP (hơn 30% tổng thu ngân sách mỗi năm), Cuba chi tới 12% GDP. Trong khi đó, Mỹ, Đức, Pháp, Nhật chi xấp xỉ 16% GDP mà y tế vẫn không miễn phí. Ví dụ, khi nằm viện ở Đức, người dân vẫn phải trả khoảng 10 euro cho tiền ăn ở mỗi ngày. Trong khi đó hệ thống bệnh viện công của Australia hoàn toàn miễn phí ăn ở cho người dân Australia và thường trú nhân đủ điều kiện. Hiện Việt Nam chi chưa tới 7% GDP cho dịch vụ y tế, nên việc hướng tới miễn viện phí toàn dân một cách hợp lý và lâu dài cần rất nhiều bước chuẩn bị. Tôi sẽ cố gắng làm rõ một số điều tôi nắm được ở Australia, không phải để so sánh, mà để hiểu hơn về nền tảng xã hội và các điều kiện cần khi nói đến miễn viện phí ở quy mô quốc gia. Thứ đầu tiên và quan trọng nhất giúp giảm chi phí y tế là dân tộc khỏe mạnh. Khi đã khỏe mạnh rồi sẽ ít cần tới chăm sóc y tế. Người dân Australia rất quan tâm tới sức khỏe của chính mình và thường xuyên rèn luyện. Khi con gái tôi học lớp 5, bé phải rèn chạy việt dã (cross country run). Điền kinh, bơi lội, chèo thuyền... đều là các môn thế mạnh ở Australia. Thể thao phong trào sôi động là nền tảng để Australia gặt hái hơn 600 huy chương Olympic, đứng trong top 10 bảng xếp hạng các quốc gia, bất chấp dân số ít ỏi. Người Australia cũng rất quan tâm tới môi trường, với các mức phạt cho hoạt động gây ô nhiễm đủ làm nản lòng bất cứ công ty nào. Australia cũng nổi tiếng với việc kiểm soát thực phẩm nhập khẩu. Nếu không khai báo thực phẩm mang theo, du khách có thể bị trục xuất và phạt 5.500 AUD. Nếu không đảm bảo vệ sinh an toàn thực phẩm, cá nhân có thể chịu phạt tới 100.000 AUD (1,7 tỷ đồng) và hai năm tù giam. Chiến lược phòng vệ sức khỏe quốc gia của Australia được thiết lập mỗi mười năm, vạch rõ các nguy cơ y tế và tầm quan trọng của việc nâng cao nhận thức sức khỏe của người dân. Lợi thế thứ hai mà Australia có là ngành công nghiệp dược phẩm, đặc biệt là vaccine, kháng sinh, và thực phẩm chức năng. Thực tế thì người lớn khỏe mạnh ít phải khám bác sĩ. Chi phí chủ yếu dành cho trẻ nhỏ và nhóm 55-85 tuổi. Vaccine và kháng sinh giúp trẻ khỏe mạnh, tránh các biến chứng sức khỏe lâu dài. Trong khi đó, nhóm 55-85 tuổi cần thực phẩm chức năng cung cấp omega, magnesium, glucosamine và vitamins, do các cơ quan nội tạng dần suy giảm khả năng làm việc. Năm 2022, ngành thực phẩm chức năng của Australia sản xuất gần 6 tỷ AUD. Australia còn có tuyến y tế cơ sở rất vững mạnh. Đối với một vài nước đang phát triển, y tế tuyến cơ sở chỉ để tiêm phòng. Bác sĩ cơ sở không được tin tưởng, hoặc không có khả năng chữa bệnh, đặc biệt là khi có tình trạng tuyển sinh và đào tạo ngành y ồ ạt. Người dân không còn tin vào tuyến cơ sở nữa mà bệnh lớn bệnh nhỏ gì cũng tới bệnh viện tuyến trên, làm quá tải hệ thống y tế. Thậm chí còn có những trường hợp làm dịch bệnh trầm trọng hơn, do lây chéo trong bệnh viện. Dù sẵn sàng chi ngân sách lớn cho y tế miễn phí, Australia đồng thời cũng tìm nhiều cách tiết kiệm chi phí y tế. Một trong số đó là tăng thuế đối với người có thu nhập cao, nếu họ không mua bảo hiểm y tế tư nhân và sử dụng dịch vụ y tế tư nhân. Nhờ vậy, ngân sách nhà nước sẽ giảm bớt gánh nặng chi trả cho nhóm này, tập trung hỗ trợ tốt hơn cho những người thu nhập thấp. Ngoài việc thu xếp các nguồn lực khác nhau, chính phủ Australia cũng đặt giới hạn cho mức tăng chi phí y tế hàng năm. Các bệnh viện cũng đặt trần cho các bác sĩ, người lên phương án điều trị, và y tá trưởng, người chịu trách nhiệm chi tiêu các vật phẩm y tế thông dụng. Nếu vượt trần, cần phải giải trình và xin cung ứng bổ sung. Mặc dù làm dấy lên lo ngại về chất lượng y tế, chủ trương tiết kiệm chắc chắn là điều không thể thiếu khi hướng tới miễn viện phí toàn dân. Bên cạnh đó Australia đánh thuế rất cao những thứ có hại cho sức khỏe. Thuế bia rượu ở Australia cao thứ tư thế giới, mà mức thuế này còn tăng hai lần mỗi năm. Quay trở lại bối cảnh trong nước, miễn viện phí là một chính sách phúc lợi quan trọng và được trông đợi ở Việt Nam, đồng thời cũng là một mục tiêu đầy thách thức, với không ít vấn đề cần đối mặt: Nguồn lực tài chính cho y tế lấy từ đâu; Lộ trình thực hiện ra sao; Chất lượng khám chữa và áp lực dồn lên các bệnh viện tuyến trên sẽ bị tác động như thế nào... Việc tinh giản biên chế để cắt giảm quỹ lương có thể không bao giờ đủ để tăng phúc lợi xã hội. Mặc dù có bộ máy gọn nhẹ, chính phủ Australia cũng từng vài lần phải đặt thêm mức thuế tạm thời để bổ sung nguồn lực cho viện phí. Tuy nhiên, tăng thuế có thể gây ảnh hưởng tới kinh tế, sản xuất và thu nhập cá nhân. Cơm phải ăn từng miếng, đường phải đi từng bước, rất nhiều khó khăn phải vượt qua. Nhưng không đi thì không thể tiến về phía trước. Nếu không thể ngay lập tức miễn viện phí toàn dân, có thể hướng tới một số bệnh hiểm nghèo và các nhóm đối tượng xã hội cần ưu tiên; sau đó làm rộng ra theo từng bước. Để miễn viện phí thành hiện thực, ngoài sự chuẩn bị từ phía chính phủ - về ngân sách, chiến lược nâng cao năng lực y tế cơ sở... còn cần sự chung tay ở cả phía người dân, từ ý thức quan tâm đến sức khỏe bản thân, đến việc gìn giữ môi trường, đảm bảo an toàn thực phẩm. Miễn viện phí không phải là giấc mơ, đó là một bước quan trọng để quốc phú, dân cường. Tô Thức","Thứ ba, 3/6/2025, 00:02 (GMT+7)",Tô Thức,Góc nhìn,Y tế & sức khỏe,VN Express,"Medicare, hệ thống chăm sóc sức khỏe công cộng của Australia từ năm 1984, cung cấp dịch vụ y tế miễn phí hoặc trợ cấp, với phần lớn bác sĩ đa khoa không thu phí khám bệnh. Dù chi phí y tế ở Australia không phải là thấp so với GDP, nhưng nhờ vào đó, người dân được miễn viện phí và hưởng nhiều lợi ích khác. Một trong những yếu tố giúp Australia giảm chi phí y tế là ý thức rèn luyện sức khỏe và phòng bệnh của người dân, cùng với ngành công nghiệp dược phẩm phát triển. Để có thể hướng tới miễn viện phí toàn dân một cách lâu dài, Việt Nam cần có những bước chuẩn bị kỹ lưỡng về nền tảng xã hội và điều kiện kinh tế."
