id,title,link,content,date,author,category,sub_category,source,summary
VNEX_050925_00071,5 loại củ nhiều tinh bột người tiểu đường nên tránh,https://vnexpress.net/5-loai-cu-nhieu-tinh-bot-nguoi-tieu-duong-nen-tranh-4935061.html,"Rau củ giàu tinh bột là nhóm rau có lượng carbohydrate (carbs) trên 15 g trong khẩu phần 100 g. Dù chứa nhiều chất dinh dưỡng nhưng lượng carbs lớn này tác động không tốt đến lượng đường trong máu, dễ gây tăng cân. Bí đỏhấp, hầm, hay nấu canh cung cấp lượng chất dinh dưỡng và chất xơ cao, song người bệnh tiểu đường nên ăn không quá 150 g mỗi lần. Lượng carbs trong bí ngô cao dễ làm tăng đường huyết nhanh. Nếu dùng bí ngô nấu chè hay sữa nên giảm đường để tránh ảnh hưởng đến lượng đường trong máu. Rau củ giàu tinh bột là nhóm rau có lượng carbohydrate (carbs) trên 15 g trong khẩu phần 100 g. Dù chứa nhiều chất dinh dưỡng nhưng lượng carbs lớn này tác động không tốt đến lượng đường trong máu, dễ gây tăng cân. Bí đỏhấp, hầm, hay nấu canh cung cấp lượng chất dinh dưỡng và chất xơ cao, song người bệnh tiểu đường nên ăn không quá 150 g mỗi lần. Lượng carbs trong bí ngô cao dễ làm tăng đường huyết nhanh. Nếu dùng bí ngô nấu chè hay sữa nên giảm đường để tránh ảnh hưởng đến lượng đường trong máu. Củ sắncó khoảng 38 g carbs trong khẩu phần 100 g, có thể làm tăng đường huyết. Sắn còn chứa axit cyanhydric - chất độc gây ngộ độc nếu không được sơ chế kỹ. Người tiểu đường nên ăn một lượng nhỏ, ưu tiên hấp hoặc luộc, không cho thêm đường, mật ong hay cốt dừa vì dễ khiến đường huyết tăng đột ngột. Củ sắncó khoảng 38 g carbs trong khẩu phần 100 g, có thể làm tăng đường huyết. Sắn còn chứa axit cyanhydric - chất độc gây ngộ độc nếu không được sơ chế kỹ. Người tiểu đường nên ăn một lượng nhỏ, ưu tiên hấp hoặc luộc, không cho thêm đường, mật ong hay cốt dừa vì dễ khiến đường huyết tăng đột ngột. Khoai tâycó lượng carbs khoảng 20 g trong một khẩu phần. Món ăn này được tiêu hóa nhanh, khiến lượng đường trong máu khó kiểm soát. Khoai tây có chỉ số đường huyết GI cao (trên 60), dù nướng hay luộc cũng có thể gây tăng đường huyết. Khoai tâycó lượng carbs khoảng 20 g trong một khẩu phần. Món ăn này được tiêu hóa nhanh, khiến lượng đường trong máu khó kiểm soát. Khoai tây có chỉ số đường huyết GI cao (trên 60), dù nướng hay luộc cũng có thể gây tăng đường huyết. Khoai mỡcó 28 g carbs trong 100 g, làm tăng đường huyết nhanh nếu ăn nhiều. Người bệnhtiểu đườngnên dùng loại củ nhiều tinh bột này luộc để ăn nhẹ, chọn khẩu phần dưới 100 g để kiểm soát đường huyết tốt hơn. Khoai mỡcó 28 g carbs trong 100 g, làm tăng đường huyết nhanh nếu ăn nhiều. Người bệnhtiểu đườngnên dùng loại củ nhiều tinh bột này luộc để ăn nhẹ, chọn khẩu phần dưới 100 g để kiểm soát đường huyết tốt hơn. Khoai môncó lượng carbs tương tự khoai mỡ, lượng đường và calo trong món ăn này có thể tăng nếu bạn chế biến bằng cách chiên, xào, nghiền nát hoặc tẩm bột. Lúc này, chỉ số GI cao khiến quá trình tiêu hóa và hấp thu đường nhanh, ảnh hưởng không tốt đến sức khỏe của người bệnh tiểu đường. Khoai môncó lượng carbs tương tự khoai mỡ, lượng đường và calo trong món ăn này có thể tăng nếu bạn chế biến bằng cách chiên, xào, nghiền nát hoặc tẩm bột. Lúc này, chỉ số GI cao khiến quá trình tiêu hóa và hấp thu đường nhanh, ảnh hưởng không tốt đến sức khỏe của người bệnh tiểu đường. Anh Chi(TheoWebMD, Very Well Health)Ảnh:Bùi Thủy, Anh Chi","Thứ sáu, 5/9/2025, 08:00 (GMT+7)",Anh Chi,Sức khỏe,Các bệnh,VN Express,"Văn bản đề cập đến các loại rau củ giàu tinh bột như bí đỏ, sắn, khoai tây, khoai mỡ, và khoai môn, vốn có lượng carbohydrate cao, gây ảnh hưởng đến đường huyết và dễ gây tăng cân. Đặc biệt, người bệnh tiểu đường cần hạn chế và kiểm soát khẩu phần ăn các loại rau củ này, ưu tiên chế biến đơn giản như luộc, hấp, và tránh thêm đường hoặc các nguyên liệu làm tăng đường huyết. Việc sơ chế cẩn thận và ăn một lượng nhỏ là cần thiết để đảm bảo sức khỏe."
VNEX_050925_00060,Thư Kỳ ra mắt phim ở Liên hoan phim Venice,https://vnexpress.net/thu-ky-ra-mat-phim-o-lien-hoan-phim-venice-4935308.html,"Ngày 4/9 giờ địa phương (tối cùng ngày giờ Hà Nội),Thư Kỳxuất hiện trên thảm đỏ để ra mắt phim đầu tay do cô đạo diễn. Tác phẩmtranh giảiSư Tử Vàng, hạng mục quan trọng nhất Liên hoan phim Venice 2025. Ngày 4/9 giờ địa phương (tối cùng ngày giờ Hà Nội),Thư Kỳxuất hiện trên thảm đỏ để ra mắt phim đầu tay do cô đạo diễn. Tác phẩmtranh giảiSư Tử Vàng, hạng mục quan trọng nhất Liên hoan phim Venice 2025. Người đẹp diện trang phục của nhà thiết kế Ấn Độ Gaurav Gupta, nằm trong bộ sưu tập Haute Couture Xuân Hè 2025. Trên các diễn đàn mạng xã hội, nhiều người hâm mộ khen bộ cánh của cô toát lên vẻ sang trọng với đường cắt may tinh xảo, tôn lên vóc dáng mảnh mai. Người đẹp diện trang phục của nhà thiết kế Ấn Độ Gaurav Gupta, nằm trong bộ sưu tập Haute Couture Xuân Hè 2025. Trên các diễn đàn mạng xã hội, nhiều người hâm mộ khen bộ cánh của cô toát lên vẻ sang trọng với đường cắt may tinh xảo, tôn lên vóc dáng mảnh mai. Dàn diễn viên phim, từ trái qua: Khưu Trạch, Thư Kỳ, Bạch Hiểu Anh và ca sĩ 9m88. Cả bốn người dành thời gian để chụp ảnh và giao lưu với truyền thông trước khi bước vào khu vực chiếu phim. Dàn diễn viên phim, từ trái qua: Khưu Trạch, Thư Kỳ, Bạch Hiểu Anh và ca sĩ 9m88. Cả bốn người dành thời gian để chụp ảnh và giao lưu với truyền thông trước khi bước vào khu vực chiếu phim. Trước khi lên thảm đỏ, diễn viên có buổi họp báo dự án. Cô diện vest của Bottega Veneta, phối cùng áo thun trắng và dây chuyền. Theo Thư Kỳ, sau gần 30 năm gắn bó nghề diễn, cô luôn theo đuổi đam mê kể những câu chuyện bằng hình ảnh, nhiều lần được mời làm giám khảo tại các liên hoan phim quốc tế. Quá trình thẩm định những tác phẩm đã khơi dậy trong cô mong muốn sáng tạo, thôi thúc Thư Kỳ viết kịch bản cho bộ phim đầu tay. Người đẹp hy vọng tác phẩm được khán giả đón nhận, đồng cảm. Trước khi lên thảm đỏ, diễn viên có buổi họp báo dự án. Cô diện vest của Bottega Veneta, phối cùng áo thun trắng và dây chuyền. Theo Thư Kỳ, sau gần 30 năm gắn bó nghề diễn, cô luôn theo đuổi đam mê kể những câu chuyện bằng hình ảnh, nhiều lần được mời làm giám khảo tại các liên hoan phim quốc tế. Quá trình thẩm định những tác phẩm đã khơi dậy trong cô mong muốn sáng tạo, thôi thúc Thư Kỳ viết kịch bản cho bộ phim đầu tay. Người đẹp hy vọng tác phẩm được khán giả đón nhận, đồng cảm. Trailer 'Girl' do Thư Kỳ đạo diễnTrailerGirldo Thư Kỳ đạo diễn. Video:La Biennale di Venezia Phim dài 125 phút, lấy bối cảnh năm 1988 tại cảng Cơ Long. Nhân vật Lâm Tiểu Lệ là cô bé lớn lên trong nghèo khó, luôn khao khát thoát khỏi bóng tối cuộc đời. Số phận dần thay đổi khi cô gặp Lý Lệ Lệ, người tự do, bất chấp ánh nhìn phán xét của xã hội. Tuy nhiên, mong muốn của Tiểu Lệ vô tình chạm đến vết thương cũ của mẹ cô - A Quyên - người từng có những ước mơ tươi đẹp nhưng bị hiện thực nghiệt ngã vùi dập. Các nhân vật trong phim như những mảnh gương soi rọi nỗi đau của nhau nhưng chẳng ai có thể hàn gắn. Diễn viênBạch Tiểu Anh, 18 tuổi, đóng Lâm Tiểu Lệ, cô bé lớn lên trong nghèo khó, luôn khao khát thoát khỏi bóng tối cuộc đời. Diễn viên có mẹ người Nhật, cha người Đài Loan, đóng phim từ năm 10 tuổi. Cô từng đoạt Diễn viên mới triển vọng nhờ vai Hà Gia Tình ởNo Pets Allowed, tại giải Kim Chung năm 2020. Diễn viênBạch Tiểu Anh, 18 tuổi, đóng Lâm Tiểu Lệ, cô bé lớn lên trong nghèo khó, luôn khao khát thoát khỏi bóng tối cuộc đời. Diễn viên có mẹ người Nhật, cha người Đài Loan, đóng phim từ năm 10 tuổi. Cô từng đoạt Diễn viên mới triển vọng nhờ vai Hà Gia Tình ởNo Pets Allowed, tại giải Kim Chung năm 2020. Ca sĩ 9m88 (tên thật là Thang Dục Ỷ), 35 tuổi, được đánh giá cao khi hóa thân mẹ của Bạch Tiểu Anh. Nghệ sĩ là gương mặt nổi bật trong làng nhạc hip-hop, jazz tại Đài Loan. Cô được biết đến với phong cách âm nhạc tự do, phóng khoáng. Một số bản hit của 9m88 gồmWalking Towards Me,Everybody Woohoo,Hello Bye Bye. Ca sĩ 9m88 (tên thật là Thang Dục Ỷ), 35 tuổi, được đánh giá cao khi hóa thân mẹ của Bạch Tiểu Anh. Nghệ sĩ là gương mặt nổi bật trong làng nhạc hip-hop, jazz tại Đài Loan. Cô được biết đến với phong cách âm nhạc tự do, phóng khoáng. Một số bản hit của 9m88 gồmWalking Towards Me,Everybody Woohoo,Hello Bye Bye. Quế ChiẢnh:AFP","Thứ sáu, 5/9/2025, 09:25 (GMT+7)",Quế Chi,Giải trí,Phim,VN Express,"Thư Kỳ ra mắt phim đầu tay do cô đạo diễn tại Liên hoan phim Venice 2025, tác phẩm tranh giải Sư Tử Vàng. Nữ diễn viên xuất hiện lộng lẫy trên thảm đỏ với trang phục của NTK Ấn Độ Gaurav Gupta, đồng thời chia sẻ về đam mê kể chuyện bằng hình ảnh đã thôi thúc cô viết kịch bản. Phim lấy bối cảnh năm 1988, xoay quanh cô bé nghèo khó Lâm Tiểu Lệ và những ước mơ bị vùi dập của mẹ cô. Thư Kỳ hy vọng tác phẩm sẽ được khán giả đón nhận và đồng cảm."
VNEX_050925_00012,Giá vàng miếng trong nước vượt 134 triệu đồng,https://vnexpress.net/gia-vang-hom-nay-ngay-5-9-4935370.html,"Sáng 5/9, các thương hiệu tiếp tục tănggiá vàngmiếng. Công ty Vàng bạc Đá quý Sài Gòn (SJC) mua bán kim loại quý tại 132,9 - 134,4 triệu đồng một lượng, tăng 500.000 đồng so với ngày hôm qua, cao nhất từ trước đến nay. VietinBank, Bảo Tín Minh Châu, DOJI và PNJ niêm yết mặt hàng này ở mức giá tương tự SJC. Chênh lệch giữa chiều mua và bán duy trì 1,5 triệu đồng một lượng. Với nhẫn trơn, SJC cũng tăng giá thêm 500.000 đồng so với hôm qua, niêm yết tại 126,7 - 129,2 triệu đồng một lượng. Bảo Tín Minh Châu báo giá ở mức 126,5 - 129,5 triệu đồng. DOJI mua bán mặt hàng này tại 126,5 - 129,9 triệu đồng. Vàng trong nước tiếp tục diễn biến cùng chiều với giá thế giới. Trong phiên sáng nay, giá quốc tế giao ngay tăng hơn 6 USD, đạt 3.551 USD một ounce. Quy đổi theo tỷ giá bán Vietcombank, vàng thế giới tương đương 113,5 triệu đồng một lượng, cao hơn 20,9 triệu so với vàng miếng trong nước. Trong một cuộc phỏng vấn vớiKitco News, ông Aakash Doshi, Trưởng phòng Chiến lược vàng tại State Street Investment Management, cho biết kim loại quý có thể tiếp tục tăng, đạt 4.000 USD một ounce trong năm sau. Doshi cho biết thị trường đang xuất hiện sự dịch chuyển khi nhu cầu từ các ngân hàng trung ương, vốn chiếm ưu thế suốt thời gian qua, dần nhường chỗ cho dòng vốn của nhà đầu tư. Ông nhận định tình trạng kinh tế bất ổn cùng nguy cơ lạm phát gia tăng đã thúc đẩy nhu cầu với các tài sản thay thế có tính thanh khoản cao như vàng. Xu hướng này sẽ sớm phản ánh vào các quỹ hoán đổi danh mục (ETF) gắn với vàng. ""Năm nay là thời điểm của các ETF vàng. Dòng tiền tài chính đang bắt kịp với môi trường vàng vật chất vốn đã rất sôi động trong nhiều năm qua"", ông Doshi bình luận. Trọng Hiếu","Thứ sáu, 5/9/2025, 09:30 (GMT+7)",Trọng Hiếu,Kinh doanh,Hàng hóa,VN Express,"Sáng 5/9, giá vàng miếng trong nước tiếp tục tăng mạnh, đạt mức cao kỷ lục mới, với SJC niêm yết giá mua bán lên tới 134,4 triệu đồng/lượng. Giá nhẫn trơn cũng tăng tương tự. Giá vàng thế giới cũng tăng và được dự báo có thể đạt 4.000 USD/ounce vào năm sau do nhu cầu từ nhà đầu tư tăng cao trong bối cảnh kinh tế bất ổn."
VNEX_050925_00001,Cầu nối cao tốc Bến Lức với cảng Cái Mép sau 2 năm thi công,https://vnexpress.net/cau-noi-cao-toc-ben-luc-voi-cang-cai-mep-sau-2-nam-thi-cong-4935078.html,"Khởi công tháng 6/2023, phần cầu chính dự án cầu Phước An hiện đạt hơn 61%. Các đoạn cầu dẫn, hai trụ tháp chính dây văng cũng đã cơ bản thành hình, chờ nối nhịp. Mỗi trụ tháp cao khoảng 119 m, trong đó từ mặt cầu lên tới đỉnh 60 m. Khởi công tháng 6/2023, phần cầu chính dự án cầu Phước An hiện đạt hơn 61%. Các đoạn cầu dẫn, hai trụ tháp chính dây văng cũng đã cơ bản thành hình, chờ nối nhịp. Mỗi trụ tháp cao khoảng 119 m, trong đó từ mặt cầu lên tới đỉnh 60 m. Ngày 4/9, công trình bắt đầu vào giai đoạn lắp đặt 96 bộ cáp dây văng ở hai trụ tháp chính, song song với thi công các hạng mục lớn khác. Ngày 4/9, công trình bắt đầu vào giai đoạn lắp đặt 96 bộ cáp dây văng ở hai trụ tháp chính, song song với thi công các hạng mục lớn khác. Kỹ sư, công nhân cùng các thiết bị kéo cáp dây văng được huy động đến công trường. Theo thiết kế, mỗi trụ tháp có 48 bộ cáp dây văng, chia làm hai mặt được lắp đặt. Kỹ sư, công nhân cùng các thiết bị kéo cáp dây văng được huy động đến công trường. Theo thiết kế, mỗi trụ tháp có 48 bộ cáp dây văng, chia làm hai mặt được lắp đặt. Cầu Phước An có tĩnh không thông thuyền 55 m - tương đương hai cầu Bình Khánh và Phước Khánh nằm trên cao tốc Bến Lức - Long Thành. Đây là tĩnh không cầu cao nhất Việt Nam, đảm bảo khả năng thông thuyền cho tàu thủy trọng tải 30.000 tấn chạy phía dưới. Cầu Phước An có tĩnh không thông thuyền 55 m - tương đương hai cầu Bình Khánh và Phước Khánh nằm trên cao tốc Bến Lức - Long Thành. Đây là tĩnh không cầu cao nhất Việt Nam, đảm bảo khả năng thông thuyền cho tàu thủy trọng tải 30.000 tấn chạy phía dưới. Công nhân, máy móc được huy động để thi công các trụ cầu trên sông. Phần cầu chính do Trungnam E&C (thuộc Trungnam Group) và Trung chính là nhà thầu thi công. Công nhân, máy móc được huy động để thi công các trụ cầu trên sông. Phần cầu chính do Trungnam E&C (thuộc Trungnam Group) và Trung chính là nhà thầu thi công. Công trường cầu nằm ở nơi biệt lập với khu dân cư, sông nước bao quanh. Quá trình đi lại, vận chuyển vật liệu, thiết bị máy móc chủ yếu bằng sà lan, tàu, canô. Nhà thầu xây cầu tạm rộng hơn một mét trên sông làm lối đi công vụ trong thời gian thi công. Công trường cầu nằm ở nơi biệt lập với khu dân cư, sông nước bao quanh. Quá trình đi lại, vận chuyển vật liệu, thiết bị máy móc chủ yếu bằng sà lan, tàu, canô. Nhà thầu xây cầu tạm rộng hơn một mét trên sông làm lối đi công vụ trong thời gian thi công. Đường dẫn cầu Phước An phía Bà Rịa - Vũng Tàu cũ nhiều đoạn đã hoàn thành kết cấu. Đường dẫn cầu Phước An phía Bà Rịa - Vũng Tàu cũ nhiều đoạn đã hoàn thành kết cấu. Cầu dẫn ở phía Bà Rịa - Vũng Tàu cũ cũng đã dần thành hình. Cầu dẫn ở phía Bà Rịa - Vũng Tàu cũ cũng đã dần thành hình. Cầu và đường dẫn ở phía Đồng Nai băng qua rừng ngập mặn đang trong giai đoạn thi công đại trà cọc khoan nhồi, trụ đất gia cố xi măng và mặt bằng công trường. Đến nay, tiến độ hạng mục này đạt khoảng 0,45% tổng giá trị xây lắp. Hiện đoạn này còn vướng gần 3 ha mặt bằng, dự kiến hoàn tất trong quý 3 năm nay để bàn giao cho đơn vị thi công. Cầu và đường dẫn ở phía Đồng Nai băng qua rừng ngập mặn đang trong giai đoạn thi công đại trà cọc khoan nhồi, trụ đất gia cố xi măng và mặt bằng công trường. Đến nay, tiến độ hạng mục này đạt khoảng 0,45% tổng giá trị xây lắp. Hiện đoạn này còn vướng gần 3 ha mặt bằng, dự kiến hoàn tất trong quý 3 năm nay để bàn giao cho đơn vị thi công. Đây là cây cầu lớn nhất được xây dựng vượt sông Thị Vải, tổng mức đầu tư gần 4.877 tỷ đồng. Dự án tạo trục giao thông kết nối trực tiếp hệ thống cảng Cái Mép với cao tốc Bến Lức - Long Thành, giúp xe chạy thẳng về các tỉnh miền Tây không phải vòng qua nội đô TP HCM. Theo kế hoạch, dự án sẽ hoàn thành tháng 5/2027, ngoài tăng kết nối giao thông giữa các khu vực trọng điểm sẽ giảm tải cho quốc lộ 51, phát triển kinh tế, xã hội ở khu vực. Đây là cây cầu lớn nhất được xây dựng vượt sông Thị Vải, tổng mức đầu tư gần 4.877 tỷ đồng. Dự án tạo trục giao thông kết nối trực tiếp hệ thống cảng Cái Mép với cao tốc Bến Lức - Long Thành, giúp xe chạy thẳng về các tỉnh miền Tây không phải vòng qua nội đô TP HCM. Theo kế hoạch, dự án sẽ hoàn thành tháng 5/2027, ngoài tăng kết nối giao thông giữa các khu vực trọng điểm sẽ giảm tải cho quốc lộ 51, phát triển kinh tế, xã hội ở khu vực. Đến công trường dự án cầu Phước An ngày 4/9, Phó chủ tịch UBND TP HCM Nguyễn Văn Thọ ghi nhận nỗ lực của chủ đầu tư, nhà thầu trong việc triển khai dự án. Ông yêu cầu cùng với đẩy nhanh tiến độ, quá trình thi công phải đảm bảo an toàn các hạng mục, bao gồm giao thông thuỷ phía dưới bởi đây là khu vực có mật độ tàu thuyền rất lớn. Đến công trường dự án cầu Phước An ngày 4/9, Phó chủ tịch UBND TP HCM Nguyễn Văn Thọ ghi nhận nỗ lực của chủ đầu tư, nhà thầu trong việc triển khai dự án. Ông yêu cầu cùng với đẩy nhanh tiến độ, quá trình thi công phải đảm bảo an toàn các hạng mục, bao gồm giao thông thuỷ phía dưới bởi đây là khu vực có mật độ tàu thuyền rất lớn. Hướng tuyến cầu Phước An. Đồ họa:Thanh Huyền Hướng tuyến cầu Phước An. Đồ họa:Thanh Huyền Trường Hà","Thứ sáu, 5/9/2025, 05:00 (GMT+7)",Trường Hà,Thời sự,Giao thông,VN Express,"Dự án cầu Phước An đã đạt tiến độ hơn 61% phần cầu chính, với các trụ tháp cao 119m đang được lắp đặt 96 bộ cáp dây văng. Cầu có tĩnh không thông thuyền cao nhất Việt Nam (55m), đảm bảo cho tàu 30.000 tấn di chuyển. Việc thi công gặp khó khăn do vị trí biệt lập, chủ yếu vận chuyển bằng đường thủy, và đường dẫn ở hai phía Bà Rịa - Vũng Tàu và Đồng Nai đang được triển khai với tiến độ khác nhau."
VNEX_050925_00084,Mercedes hồi sinh G-class Cabriolet,https://vnexpress.net/mercedes-hoi-sinh-g-class-cabriolet-4935314.html,"Hãng xe sang ĐứcMercedesxác nhận hồi sinh bản mui trần của G-class, bổ sung thêm lựa chọn vào dòng sản phẩm xe SUV địa hình có tiếng của thương hiệu. G-class Cabriolet được cung cấp trên toàn thế giới, trong đó có cả thị trường Mỹ. Mercedes G-class bản mui trần lộ diện. Ảnh:Mercedes Từ hình ảnh hé lộ cho thấy một kiểu dáng G-class quen thuộc với đường nét thiết kế vuông vức, kính chắn gió thẳng. Những thay đổi lớn hơn xuất hiện ở đuôi xe, nơi phần mui có thể thu vào ngay từ cột A. Kính chắn gió ở phần tư thứ ba cũng không còn, gợi nhớ đến Mercedes-Maybach G 650 Landaulet. Các thông số kỹ thuật chưa công bố, nhưng theoAutoCar, mẫu xe địa hình mui trần mới có thể trang bị hệ truyền động diesel, xăng và điện tương tự G-class thông thường. Cụ thể, G 450d lắp động cơ dầu 3.0 I6 tăng áp công suất 362 mã lực, trong khi bản xăng G 500 sử dụng động cơ 3.0 V6 tăng áp công suất 443 mã lực. Bản hiệu suất cao G 63 4.0 V8 tăng áp kép công suất 577 mã lực. Bản thuần điện G 580 với 4 môtơ điện đặt ở 4 bánh, sản sinh tổng công suất 579 mã lực và gói pin 116 kWh. Mercedes-Maybach G 650 Landaulet đời 2018. Ảnh: CarandDriver Mercedes G-class Carbriolet mới sẽ có giá dự kiến cao hơn nhiều so với G-class thông thường, với giá khởi điểm từ 175.000 USD, theoAutoCar. Theo kế hoạch, Mercedes G-class Cabriolet sẽ ra mắt tại triển lãm IAA Mobility 2025, sự kiện diễn ra ở Đức từ ngày 8/9. Minh Vũ","Thứ sáu, 5/9/2025, 11:01 (GMT+7)",Minh Vũ,Xe,Thị trường,VN Express,"Mercedes-Benz sẽ hồi sinh phiên bản mui trần của dòng xe địa hình G-Class, cung cấp trên toàn cầu, bao gồm cả thị trường Mỹ. G-Class Cabriolet có thiết kế quen thuộc nhưng phần mui có thể thu vào từ cột A, gợi nhớ đến Mercedes-Maybach G 650 Landaulet. Xe có thể trang bị các tùy chọn động cơ diesel, xăng, điện tương tự G-Class thông thường. Dự kiến, mẫu xe này sẽ có giá khởi điểm từ 175.000 USD và ra mắt tại triển lãm IAA Mobility 2025."
