id,title,link,content,date,author,category,sub_category,source,summary
VNEX_060725_00087,"Hết tiền, vỡ mộng bỏ việc để du lịch khắp thế giới",https://vnexpress.net/het-tien-vo-mong-bo-viec-de-du-lich-khap-the-gioi-4910457.html,"Cuối năm 2022, sau một năm sống chung, Christina Fang, người Mỹ, và bạn trai chia tay. Cuộc sống của Christina xoay quanh bạn trai, thậm chí, cô còn nhận công việc marketing ở Colorado để chuyển đến sống cùng nhau. Do đó, cuộc chia tay khiến cô hoàn toàn suy sụp. Bị mắc kẹt trong một công việc không yêu thích, Christina biết mình cần một sự thay đổi nhưng cô không chắc phải làm thế nào. Ngay sau cuộc chia tay, Christina gọi điện cho người bạn thân Megan, giáo viên tiếng Anh ở Madrid. Họ từng mơ ước đi du lịch bụi cùng nhau nhưng chưa bao giờ tìm được thời điểm phù hợp. Lần này, Megan được nghỉ hè còn Christina thì bất ngờ tự do. Vì vậy, cô tiết kiệm từng đồng, nghỉ việc và lên đường đến Madrid vào tháng 6/2023. Ban đầu, chuyến đi là tất cả những gì Christina mơ ước. Cô và Megan đã có khoảng thời gian tuyệt vời khám phá cùng nhau. Những tháng đầu tiên kỳ diệu như thể giấc mơ ""Ăn, Cầu Nguyện, Yêu"" của cô trở thành hiện thực. Megan và Christina (phải) trong một chuyến du lịch hè. Ảnh:Christina Fang Họ dành thời gian thưởng thức tapas (các món ăn nhẹ kiểu Tây Ban Nha) ở Madrid, đạp xe qua Copenhagen và đi bộ trên Đường của các Vị thần tại bờ biển Amalfi, Italy. Christina hiếm khi nghĩ về cuộc chia tay nhưng khi nghĩ đến, nỗi đau nhanh chóng bị chôn vùi bởi những khung cảnh ngoạn mục hay đĩa paella (cơm thập cẩm kiểu Tây Ban Nha) tiếp theo. Sau châu Âu, họ đến châu Á, tham gia thiền cùng các nhà sư ở Thái Lan, lái xe máy qua những ngọn núi ở Việt Nam và nhảy múa với người lạ trong các câu lạc bộ đêm ở Nhật Bản. Cuối cùng, Megan trở lại châu Âu, còn Christina ở lại Đài Loan để sống cùng gia đình. Cô ở lại thêm 6 tháng để chăm sóc bà nội bệnh nặng. Dù xuất phát từ mong muốn cá nhân được ở bên bà những ngày cuối đời, việc chăm sóc người bệnh khiến tinh thần của Christina đi xuống. Cuộc sống của cô chìm trong tã lót và sự tuyệt vọng. Vào tháng 2 năm 2024, Christina rời Đài Loan, sẵn sàng kết thúc hành trình ở nước ngoài và mua vé máy bay từ Bangkok đến Chicago. Cô muốn kết thúc hành trình du lịch nước ngoài tại Koh Phangan - hòn đảo nhỏ ở Thái Lan - để thăm bạn rồi sẽ trở về nhà tại Mỹ. Tuy nhiên, khi đến đảo, Christina như lạc vào một cơn lốc vui chơi. Mỗi ngày, cô gặp gỡ những người du lịch bụi trên bãi biển, bơi trên biển và viết lách ở các quán cà phê. Lần đầu tiên sau một thời gian dài, cô cảm thấy tự do, tự tin và vui vẻ. Christina đắm mình trong những buổi ca hát, thưởng thức xôi xoài và nhảy múa trong rừng. Sau đó, cô bay về nhà chỉ để đóng gói đồ đạc và chuyển lại Koh Phangan. Christina trong một chuyến du lịch năm 2023. Ảnh:Christina Fang Dù vậy, niềm vui không kéo dài lâu khi tiền nhanh chóng cạn kiệt. Christina nhận các công việc lặt vặt như kiểm tra phiếu bầu cho Associated Press và thậm chí làm diễn viên quần chúng cho ""The White Lotus"". Cô cố gắng trở thành một nhà văn du lịch tự do để tự nuôi sống bản thân nhưng không biết bắt đầu từ đâu. Chẳng bao lâu, cô cảm thấy kiệt sức và dành nhiều thời gian xem Netflix hơn là ra bãi biển. Khi thu nhập giảm, sức khỏe tinh thần của Christina cũng đi xuống. Cô cảm thấy mình thất bại, không thể đạt được ước mơ lớn lao khi sống ở nước ngoài. Đến mùa thu, cô rơi vào trầm cảm, trầm trọng hơn khi nhìn thấy khách du lịch thư giãn trong kỳ nghỉ mơ ước của họ. Christina như cái bóng của chính mình khi mới đến. Đến mùa đông, cô cuối cùng chấp nhận rằng cuộc phiêu lưu đã kết thúc. Vào đêm Giáng sinh năm 2024, Christina đáp xuống sân bay quốc tế O’Hare, nơi bố mẹ cô đón cô về để tận hưởng một đêm ấm cúng chơi board game và hát karaoke. Việc trở về nhà mang lại sự chữa lành cho Christina sau 18 tháng đầy biến động. Cô tái kết nối với gia đình, kết bạn trên khắp thế giới và tìm thấy một cảm giác độc lập mới. Trở về nhà là một cú sốc văn hóa nhưng nó cho cô không gian để xử lý mọi thứ đã trải qua. Đôi lúc, Christina cảm thấy xấu hổ vì trở về nhưng khi sức khỏe tinh thần cải thiện, cô nhận ra đó là lựa chọn tốt nhất. Cô tìm được một công việc ổn định, xây dựng lại mạng lưới hỗ trợ từ những mối quan hệ cũ và mới, đồng thời tạo ra một thói quen kết hợp mọi thứ cô học được như thiền, viết lách, nhảy múa và tập yoga. Ở nhà, Christina tìm thấy niềm vui trong sự thoải mái của cuộc sống hàng ngày khi đi dạo với bố mẹ, picnic cùng bạn thân và viết lách mỗi ngày. Christina sẽ không bao giờ ngừng du lịch nhưng thay vì liên tục di chuyển, giờ đây cô thực hiện những chuyến đi ngắn hơn. ""Thật tuyệt khi tận hưởng mỗi điểm đến mà không phải chịu áp lực của guồng quay hàng ngày"", cô nói. Từng chút một, cô đang đối mặt với nỗi đau mà cô từng cố gắng chạy trốn. Hoài Anh(TheoBusiness Insider)","Chủ nhật, 6/7/2025, 00:09 (GMT+7)",Hoài Anh,Du lịch,Tin tức,VN Express,"Sau cuộc chia tay đau khổ và công việc không yêu thích, Christina Fang quyết định thay đổi cuộc sống bằng một chuyến du lịch bụi cùng bạn thân vòng quanh thế giới. Họ đã có những trải nghiệm tuyệt vời ở châu Âu và châu Á, giúp Christina tạm quên đi nỗi buồn. Tuy nhiên, sau khi chăm sóc bà nội ở Đài Loan và trở lại hòn đảo Koh Phangan, Thái Lan, cô lại đối mặt với khó khăn tài chính và cảm thấy bế tắc trong việc tìm kiếm hướng đi cho bản thân. Hành trình tìm lại chính mình của Christina vẫn còn nhiều thử thách phía trước."
VNEX_060725_00014,"Real hạ Dortmund, vào bán kết FIFA Club World Cup",https://vnexpress.net/real-ha-dortmund-vao-ban-ket-fifa-club-world-cup-4910665.html,"Trận bán kết được chờ đợi này sẽ diễn ra trên sân MetLife, New Jersey lúc 2h ngày 10/7, giờ Hà Nội. Trận bán kết còn lại sẽ diễn ra trước đó một ngày, giữa Chelsea và Fluminense. Gonzalo Garcia đệm chéo góc mở tỷ số, trong trận Real thắng Dortmund 3-2 ở tứ kết FIFA Club World Cup trên sân MetLife, New Jersey, Mỹ ngày 5/7/2025. Ảnh:AS Trước giờ bóng lăn, HLV Niko Kovactuyên bố bắt bài đồng nghiệp Xabi Alonsosau màn đối đầu tại Bundesliga mùa trước. Nhưng vào trận, Real áp đảo, đặc biệt trong hiệp một. Đội bóng hoàng gia có thể ghi bốn bàn trong 45 phút đầu, qua đó tránh trải qua khoảng thời gian thót tim cuối trận. Realkhông nhập cuộc với nhịp độ cao nhưng chỉ cần 10 phút để mở tỷ số. Arda Guler treo bóng từ rìa cánh trái vòng cấm để Gonzalo Garcia chọn vị trí và đệm chéo góc tung lưới Gregor Kobel. Tiền đạo 21 tuổitiếp đà thăng hoasau khi được đôn lên đội một. Garcia là cầu thủ duy nhất ghi dấu giày vào bàn thắng trong tất cả các trận tại FIFA Club World Cup 2025, với bốn bàn và một kiến tạo. Phút 20, Garcia tiếp tục để lại dấu ấn với đường chuyền choTrent Alexander-Arnoldbăng xuống đáy biên. Tân binh người Anh căng ngang một chạm để người đá cánh đối diện Fran Garcia ập vào đệm nhân đôi cách biệt. Fran Garcia mừng bàn nâng tỷ số lên 2-0. Ảnh:AS Trong thời gian còn lại của hiệp một, Real lẽ ra phải ghi thêm hai bàn. Phút 27, Vinicius nhả bóng đểJude Bellinghamxộc vào vòng cấm rồi sút chân trái chéo góc chệch cột dọc trong gang tấc. Phút 40, Guler chọc khe choViniciusbăng xuống. Khi thấy thủ môn Dortmund dâng cao, tiền đạo Brazil lốp bóng, nhưng thừa lực. Thế trận trong hiệp hai chỉ bùng nổ ở những phút bù. Phút bù thứ hai, trung vệAntonio Rudigerphá bóng nhẹ đến đúng vị trí của Maximilian Beier để cầu thủ vào sân thay người này sút chéo góc, đưa bóng ngoài tầm với của thủ thành Thibaut Courtois. Kylian Mbappe tung người dứt điểm ghi bàn. Ảnh:Reuters Real chỉ cần hai phút để tái lập cách biệt dẫn hai bàn. Từ quả tạt của Guler bên cánh phải,Kylian Mbappetung người dứt điểm ngẫu hứng tung lưới Kobel, ghi bàn đầu tiên tại FIFA Club World Cup 2025. Tiền đạo người Pháp không có thể lực sung mãn sau khi nhập viện vìviêm dạ dày ruột cấp. Ở pha lên bóng của Dortmund ngay sau đó, trung vệ Dean Huijsen kéo ngã Serhou Guirassy trong vòng cấm địa và nhận thẻ đỏ trực tiếp. Trên chấm 11 mét, Guirassy sút mạnh về góc trái, khiến Courtois đoán đúng hướng cũng không thể chạm bóng, ghi bàn ở phút bù thứ tám. Dortmund kịp lên pha bóng cuối sau đó. Từ quả tạt bên cánh phải, Marcel Sabitzer đỡ bóng rồi dứt điểm nguy hiểm về góc gần. Nhưng Courtois bắt dính, dù mất hai nhịp, giúp Real bảo toàn chiến thắng 3-2. Diễn biến chiến trận Real 2-0 Dortmund. Hồng Duy","Chủ nhật, 6/7/2025, 06:12 (GMT+7)",Hồng Duy,Thể thao,Fifa Club World Cup 2025,VN Express,"Real Madrid đã đánh bại Borussia Dortmund với tỷ số 3-2 trong trận tứ kết FIFA Club World Cup 2025 diễn ra trên sân MetLife, New Jersey. Real Madrid dẫn trước 2-0 nhờ các bàn thắng của Gonzalo Garcia và Fran Garcia trong hiệp một. Mặc dù Dortmund gỡ được hai bàn trong những phút bù giờ, Kylian Mbappe cũng kịp ghi bàn giúp Real tái lập khoảng cách hai bàn, và cuối cùng Real vẫn bảo toàn được chiến thắng để tiến vào bán kết gặp đội thắng trong cặp đấu giữa Chelsea và Fluminense."
VNEX_060725_00063,Chồng muốn tôi nuôi con riêng của anh,https://vnexpress.net/con-rieng-chong-muon-toi-nuoi-con-rieng-cua-anh-4910669.html,"Tôi 32 tuổi, lập gia đình được gần sáu năm, có hai con, đứa lớn bốn tuổi, đứa nhỏ hơn hai. Chúng tôi yêu nhau hơn ba năm trước khi cưới, trong mắt tôi khi ấy, anh là người đàn ông tử tế, hiền lành, chịu khó, luôn quan tâm và biết nghĩ cho người khác. Thời điểm đó, tôi tin rằng mình đã chọn đúng người để gửi gắm cả cuộc đời. Chúng tôi cưới nhau không lâu thì có con đầu lòng. Mang thai, sinh con, rồi nuôi con nhỏ khiến tôi vất vả, nhiều đêm một mình bế con khóc vì mệt mỏi. Anh cũng bận rộn công việc, ít ở nhà, nhưng tôi luôn tự an ủi, đàn ông phải lo sự nghiệp, miễn sao yêu vợ thương con là được. Cách đây hơn một tháng, có một người phụ nữ gọi cho tôi và nói rằng chồng tôi có một đứa con riêng, mong tôi nói chuyện với chồng để lo liệu cho đứa nhỏ vì mẹ đứa nhỏ đã mất trước đó không lâu vì bệnh nặng. Cô ta là em gái người phụ nữ đó, gọi cho chồng tôi nhiều lần nhưng anh không nghe máy. Tôi bàng hoàng nhưng vẫn không muốn tin nên hỏi chồng ngay lập tức. Anh im lặng rất lâu, cuối cùng thừa nhận tất cả.Đứa bé ấy hơn con đầu lòng của tôi chỉ vài tháng tuổi. Tức là trong lúc yêu tôi, chuẩn bị cưới xin, anh qua lại với người đó để rồi cả hai mang thai gần như cùng lúc. Anh bảo khi đó người phụ nữ kia cố ý giữ đứa bé, anh không dám nói với tôi vì sợ mất tôi, cũng không có đủ can đảm để gánh cả hai bên. Sau đó, người phụ nữ ấy tự nuôi con và không hề liên lạc gì với anh. Cách đây vài tháng, cô ta gọi cho anh muốn anh nuôi đứa nhỏ vì cô ta bệnh giai đoạn cuối. Anh đang chưa biết phải sắp xếp thế nào thì tôi biết chuyện. Anh xin tôi tha thứ, nói rằng đó là sai lầm trong quá khứ và anh luôn cố gắng bù đắp cho tôi, rằng từ sau khi cắt đứt với người đó, anh toàn tâm toàn ý lo cho gia đình và chỉ yêu mình tôi. Giờ việc đã lỡ, anh xin tôi để anh đưa đứa bé về nuôi (bố mẹ anh đều đã mất), dù gì đó cũng là máu mủ. Tôi nghe mà đắng chát, thấy tim mình như vỡ vụn. Tôi không ghét đứa trẻ, nó vô tội, nhưng nghĩ đến việc suốt những năm qua tôi sống trong dối lừa, tận tụy vun vén cho gia đình, còn anh che giấu mọi chuyện, tôi lại thấy không thở nổi. Tôi không biết phải làm sao. Nếu chấp nhận, tôi thấy tim đau đớn và lại nghĩ tới chuyện bị phản bội, thấy mình cam chịu. Nhưng nếu không, đứa bé ấy sẽ ra sao? Tôi rối bời, mất ngủ nhiều đêm, không dám nói với bố mẹ, cũng không dám tâm sự với bạn bè, chỉ biết ôm con mình, khóc lặng lẽ. Tôi thật sự rất hoang mang, mong nhận được lời khuyên. Tuyết Mai","Chủ nhật, 6/7/2025, 09:00 (GMT+7)",Tuyết Mai,Tâm sự,,VN Express,"Tuyết Mai, 32 tuổi, phát hiện chồng mình có con riêng chỉ hơn con đầu lòng của chị vài tháng, tức là chồng chị đã ngoại tình và có con trong lúc yêu và chuẩn bị cưới chị. Người phụ nữ kia qua đời, và em gái cô ấy đã liên lạc với Tuyết Mai để chồng chị có trách nhiệm với đứa bé. Chồng Tuyết Mai thừa nhận sự việc, xin tha thứ và mong muốn đưa đứa bé về nuôi. Tuyết Mai vô cùng đau khổ, cảm thấy bị lừa dối và đang phân vân giữa việc chấp nhận để giúp đứa bé vô tội hoặc từ chối để bảo vệ lòng tự trọng và tránh nỗi đau bị phản bội."
VNEX_060725_00068,Siêu xe bị thu giữ vì chủ nợ quá nhiều phí đường bộ,https://vnexpress.net/sieu-xe-bi-thu-giu-vi-chu-no-qua-nhieu-phi-duong-bo-4910349.html,"Văn phòng Giao thông Vận tải khu vực (RTO) thành phố Bengaluru nhận được thông tin về việc chiếc xe trốn phí đường bộ tại bang Karnataka lên tới 165.000 USD. Siêu xe thực tế khá nổi tiếng và thường xuyên được bắt gặp chạy trên đường. Chính sự nổi tiếng khiến các cơ quan chức năng chú ý đến chiếc Ferrari màu đỏ. RTO tiến hành xác minh khi có thông tin về khoản phí đường bộ mà chủ xe chưa nộp. Siêu xe bị thu giữ khi đang đỗ trước cửa nhà. Chủ xe nhận được thông báo và được yêu cầu thanh toán khoản phí trong thời hạn nhất định nếu không sẽ phải đối mặt với hành động pháp lý. Siêu xe Ferrari bị cảnh sát thu giữ khi đang đỗ trước cửa nhà. Ảnh:Hindustan Times Chủ siêu xe đã ngay lập tức thanh toán đầy đủ hơn 165.000 USD cho RTO Bengaluru ngay trong ngày và nhận lại chiếc Ferrari. Sự việc đánh dấu một trong những khoản thu hồi nợ phí lớn nhất ở bang này. Chiếc Ferrari SF90 này không phải là xe duy nhất bị các viên chức RTO Bengaluru tịch thu. Đầu năm nay, một chiếc Ferrari SF90 khác và những chiếc xe sang, bao gồm Porsche, BMW, Mercedes, Land Rover và Aston Martin, đã bị tịch thu. Theo báo cáo, tổng số tiền trốn thuế là khoảng 351.000 USD. Trong vài tháng gần đây, RTO Bengaluru rất cảnh giác với các cuộc tụ tập xe hơi lạ. Sở đã thành lập các đội đặc biệt tích cực theo dõi các chuyến đi và cuộc tụ tập vào cuối tuần, nơi những chiếc xe lạ có biển số không phải của Karnataka được phát hiện. Sau đó, họ sẽ xác minh thông tin đăng ký và bắt giữ những người chưa nộp thuế đường bộ của Karnataka. Mỹ Anh(theoCartoq)","Chủ nhật, 6/7/2025, 03:56 (GMT+7)",Mỹ Anh,Xe,Thị trường,VN Express,"Văn phòng Giao thông Vận tải Bengaluru đã tịch thu một chiếc Ferrari đỏ nổi tiếng vì trốn phí đường bộ lên tới 165.000 USD. Sau khi bị thông báo, chủ xe đã nhanh chóng thanh toán toàn bộ khoản nợ. Sự việc này nằm trong chiến dịch truy quét gắt gao của RTO Bengaluru đối với các xe sang trốn thuế, với tổng số tiền thu hồi được lên tới 351.000 USD từ nhiều thương hiệu xe khác nhau. RTO đang tăng cường giám sát các cuộc tụ tập xe hơi để phát hiện và xử lý các trường hợp trốn thuế đường bộ."
VNEX_060725_00017,Ronaldo sợ gây huyên náo nếu dự tang lễ của Diogo Jota,https://vnexpress.net/ronaldo-so-gay-huyen-nao-neu-du-tang-le-cua-diogo-jota-4910664.html,"Ronaldokhông xuất hiện ở tang lễ của Jota và em trai Andre Silva tại nhà thờ Công giáo Igreja Matriz de Gondomar sáng 5/7, cũng như lễ viếng tại Nhà nguyện Sao Cosme trước đó một ngày. Ronaldo bá vai Diogo Jota trong trận Bồ Đào Nha gặp CH Czech thuộc bảng F Euro 2024 trên sân Red Bull Arena, Leipzig, Đức ngày 18/6/2024. Ảnh:AFP Theo báo AnhMirror, thủ quân tuyển Bồ Đào Nha e ngại sự xuất hiện của mình tại thị trấn nhỏ Gondomar sẽ làm lu mờ buổi lễ tiễn biệt anh em Jota. Tiền đạo 40 tuổi được cho đã rất cân nhắc, và cuối cùng, quyết định không đến dự lễ viếng cũng như lễ tang để tránh trở thành tâm điểm chú ý, gây xao lãng và làm mất đi ý nghĩa của các sự kiện này. TờRecordcủa Bồ Đào Nha thông tin thêm rằng, Ronaldo đã nói chuyện với gia đình Jota để đảm bảo rằng sẽ luôn ở bên cạnh và hỗ trợ họ. Anh cũng giải thích lý do vắng mặt tại tang lễ của Jota và em trai. Ronaldo được cho là đang nghỉ dưỡng trên du thuyền trị giá 7,5 triệu USD ở Majorca, Tây Ban Nha. Sau khi hay tin Jota qua đời, anh đã tưởng nhớ đồng đội ở đội tuyển Bồ Đào Nha qua mạng xã hội. ""Điều này thật vô lý. Mới đây thôi chúng ta còn ở cùng nhau tại ĐTQG. Mới đây thôi, cậu làm lễ kết hôn"", Ronaldo viết. ""Tôi xin gửi lời chia buồn đến gia đình, vợ và các con của Jota và chúc họ luôn khỏe mạnh. Tôi biết cậu sẽ luôn bên họ. Yên nghỉ nhé Diogo và Andre. Chúng tôi sẽ nhớ hai người"". Các thành viên Liverpool mang đến hai vòng hoa số 20 và 30, số áo của Jota tại Liverpool và Andre Silva tại Penafiel. Jota và em trai Andre da Silvagặp tai nạn trên khúc cuatrên xa lộ A‐52, Cernadilla, tỉnh Zamora phía tây Tây Ban Nha ngày 3/7. Xe của họ bị nổ lốp, dẫn đến mất lái, lật nhiều vòng rồi bốc cháy. Lực lượng cứu hộ và y tế được huy động lập tức, nhưng cả hai đều thiệt mạng tại hiện trường. Hôm qua, nhiều cầu thủ Liverpool, như Virgil van Dijk, Andy Robertson, Curtis Jones, Alexis Mac Allister, Harvey Elliott, Wataru Endo, Darwin Nunez, Federico Chiesa và HLV Arne Slot, cùng các thành viên tuyển Bồ Đào Nha, gồm Bernardo Silva, Diogo Dalot, Joao Cancelo, Ruben Neves cùng HLV Roberto Martinez đã có mặt tại nhà thờ Igreja Matriz de Gondomar để tiễn biệt Jota. Các cựu cầu thủ Liverpool là Caoimhin Kelleher, Jordan Henderson và James Milner cũng có mặt. Alisson Becker đăng ảnh tiễn biễn Diogo Jota. Alissonlà ngôi sao khác không dự tang lễ của Jota. Trong bài đăng trênInstagram, Alisson, đồng đội của Jota tại Liverpool từ năm 2020, chia sẻ rằng đại dương đã ngăn cách anh ""nói lời tạm biệt"" với người mà anh yêu quý. ""Thông thường, tôi đăng những điều có ý nghĩa, nhưng hôm nay, mọi thứ dường như vô nghĩa! Một lần nữa, đại dương ngăn cách tôi 'nói lời tạm biệt' với người tôi yêu mến! Nhưng tôi biết rằng các đồng đội của tôi tại câu lạc bộ đã thay mặt tôi!"", thủ thành Brazil viết và đăng bức ảnh đen trắng của anh cùng Natalia, Jota cùng Rute và các con. Alisson mô tả Jota - người đã qua đời chưa đầy hai tuần sau khi anh và Rute kết hôn - là một ""người bạn, người cha và người chồng tuyệt vời"". Thủ thành 32 tuổi kết thúc bài viết bằng cách trích dẫn đoạn Kinh Thánh Truyền Đạo 3:1-8, nói về việc có một thời điểm cho mọi mục đích dưới bầu trời, bao gồm ""một thời để khóc, và một thời để cười; một thời để than van, và một thời để nhảy múa"". Hồng Duytổng hợp","Chủ nhật, 6/7/2025, 07:25 (GMT+7)",Hồng Duy,Thể thao,Hậu trường,VN Express,"Ronaldo đã không tham dự tang lễ của Jota và em trai vì lo ngại sự xuất hiện của mình sẽ làm lu mờ buổi lễ. Thay vào đó, anh đã liên lạc với gia đình Jota để bày tỏ sự hỗ trợ và chia buồn, đồng thời giải thích lý do vắng mặt. Nhiều đồng đội và cựu đồng đội của Jota từ Liverpool và đội tuyển Bồ Đào Nha đã đến dự tang lễ để tiễn biệt anh. Jota và em trai qua đời trong một tai nạn xe hơi ở Tây Ban Nha, gây bàng hoàng cho giới bóng đá và người hâm mộ."
