id,title,link,content,date,author,category,sub_category,source,summary
VNEX_291025_00099,TP HCM dự kiến triển khai hai dự án lấn biển tại Côn Đảo,https://vnexpress.net/tp-hcm-du-kien-trien-khai-hai-du-an-lan-bien-tai-con-dao-4957046.html,"Theo kế hoạch điều chỉnh quy hoạch chung xây dựng Côn Đảo tầm nhìn đến 2045 vừa được UBND TP HCM ban hành, thành phố dự kiến triển khai 76 dự án hạ tầng kỹ thuật và xã hội, du lịch, văn hóa, đô thị hỗn hợp. Theo đó, giai đoạn 2026-2030 thành phố sẽ có 73 dự án, gồm 21 dự án đầu tư theo hình thức đối tác công - tư (PPP), còn lại là hạ tầng xã hội và kỹ thuật. Trong số này, hai dự án lấn biển gồm khu vực Đông Nam Suối Ớt - Cỏ Ống và trung tâm Côn Đảo sẽ được đầu tư theo hình thức PPP đến 2030, để tạo quỹ đất cho đô thị, du lịch và các công trình dịch vụ công cộng. Sau năm 2030, thành phố sẽ phát triển 3 dự án còn lại. Một góc đặc khu Côn Đảo, TP HCM.Ảnh: Ngọc Thành Quy hoạch chung xây dựng Côn Đảo sẽ ưu tiên phát triển các dự án hạ tầng khung, gồm cảng hàng hóa, cảng du lịch, bến du thuyền, văn hóa, khu đô thị và các tuyến giao thông chính, đồng thời bảo tồn hệ sinh thái rừng, biển. Tổng nguồn lực đầu tư ước tính khoảng 2,5 tỷ USD (tương đương 66.155 tỷ đồng), trong đó vốn đầu tư công hơn 21.000 tỷ. UBND TP HCM giao Sở Quy hoạch và Kiến trúc làm đầu mối theo dõi, bảo đảm các dự án thực hiện đúng mục tiêu, gắn phát triển du lịch - đô thị với bảo tồn tài nguyên thiên nhiên và cảnh quan đặc trưng của Côn Đảo. Côn Đảo là đặc khu du lịch - đô thị trọng điểm của TP HCM, rộng gần 76 km2, gồm 16 hòn đảo. Nơi này cách trung tâm thành phố hơn 230 km, được định hướng trở thành hình mẫu phát triển biển đảo xanh, bền vững. Các dịch vụ giao thông, lữ hành, lưu trú, ẩm thực... là nguồn thu chủ yếu của kinh tế địa phương. 7 tháng đầu năm, thương mại, dịch vụ, du lịch của đặc khu đạt trên 3.000 tỷ đồng, tăng gần 15% so với cùng kỳ. Phương Uyên","Thứ tư, 29/10/2025, 00:10 (GMT+7)",Phương Uyên,Bất động sản,Chính sách,VN Express,
VNEX_291025_00078,"Thành đạt, quyền lực, nhưng tôi sợ mình đang dần 'hắc hóa'",https://vnexpress.net/dan-ong-dao-hoa-khi-nao-chan-vui-dua-voi-cac-co-gai-toi-se-cuoi-nguoi-vo-ngoan-hien-4956809.html,"Tôi là con trai một trong gia đình cơ bản. Sau khi tốt nghiệp đại học, tôi đi du học cao học ở nước ngoài rồi trở về Việt Nam làm việc. Nhờ có bằng cấp cao, ngoại ngữ tốt, và sự hậu thuẫn của gia đình, tôi nhanh chóng thăng tiến từ một nhân viên bình thường trở thành quản lý và hiện tại là phó giám đốc của một công ty trong khu công nghiệp với hơn ngàn nhân viên. Cổ nhân có câu: ""Đi với bụt mặc áo cà sa, đi với ma mặc áo giấy"". Tôi thấy mình áp dụng câu này khá triệt để. Thời sinh viên, ban ngày tôi là sinh viên học giỏi, gương mẫu, nhưng tối đến lại tụ tập bạn bè, đi bar, vui chơi. Tôi quen không ít cô gái từ trường này sang trường khác. Khi đi làm, tôi vẫn vậy: hòa đồng, thân thiện, sẵn sàng giúp đỡ đồng nghiệp. Tôi có nguyên tắc rõ ràng: ai tôn trọng mình thì mình tôn trọng lại, còn ai chơi xấu thì tôi không ngại đáp trả. Tôi không thích chịu thiệt. Phần lớn mọi người trong công ty đều quý tôi, đi ăn còn chừa chỗ, lấy phần hộ nên tôi cũng quý họ. Dĩ nhiên, vẫn có vài người khiến tôi khó chịu và khi tôi tỏ thái độ cứng rắn thì họ lại trở nên dễ chịu hơn, khiến môi trường làm việc nhìn chung hài hòa. Các mối quan hệ xã hội của tôi khá đa dạng, cả ""hắc"" lẫn ""bạch"". Tôi thân với một ""anh đại"" trong thành phố nên khi công ty có chuyện liên quan đến dân xã hội, tôi đều giúp giải quyết ổn thỏa. Gia đình tôi luôn dặn rằng, dù giữ chức cao vẫn phải khiêm nhường, kính trọng người lớn và tôi cũng luôn cố gắng giữ hình ảnh đó. Tuy nhiên, ngoài công việc, tôi lại có phần ""bề trên"", có lẽ do thói quen lãnh đạo hình thành. Về chuyện trai gái, ngoài các mối quan hệ trong xã hội, tôi còn phải tiếp đối tác nên việc đi massage, karaoke là chuyện bình thường. Nhưng dần dần tôi thấy chán với những cô gái ""dùng chung"" như vậy. Tôi bắt đầu để ý những cô gái xinh xắn cùng khu công nghiệp hoặc cùng thành phố. Nhiều khi nhìn thấy một cô hợp mắt, tôi chỉ muốn nhanh chóng khiến cô ấy có tình cảm rồi trở thành của mình. Tôi vốn háo thắng, thích kiểm soát. Từ nhỏ, khi chơi với lũ bạn cùng trang lứa, tôi luôn cố hết sức để thắng họ và cuối cùng họ không chơi với tôi nữa vì tôi toàn thắng. Thỉnh thoảng, tôi còn kể lại vài ""chiến tích"" ấy cho cấp dưới nghe, khiến họ ngưỡng mộ: nào là sự nghiệp thành công, tài sản ổn định, địa vị cao, người yêu thay liên tục. Tôi cũng thường chọn những cô có vẻ ngoài sang chảnh để cùng đi dự tiệc, cho mát mặt. Gần đây, gia đình giục tôi cưới vợ. Tôi nghĩ sau này tìm một cô ngoan hiền mà lấy. Tôi nhận ra mình có phần ngông, chút gia trưởng và háo thắng nhưng có lẽ đó là kết quả của việc phải thích nghi với môi trường công ty cạnh tranh và khắc nghiệt, chạm với giới trắng đen đan xen tạo nên ""cái tôi quyền lực"". Viết ra những dòng này, tôi không biết mình đúng hay sai, có đang lạc hướng và hắc hóa. Có lẽ tôi đã quen với việc phải mạnh mẽ, phải hơn người khác nên quên mất rằng đôi khi điều quan trọng nhất là được bình yên và sống thật. Có thể tôi đã làm tổn thương vài người, đang đánh mất chính mình từng chút một nhưng ít ra, tôi vẫn còn biết sợ điều đó. Tôi không chắc mình sẽ thay đổi ngay được, nhưng ít nhất tôi muốn bắt đầu thử sống chậm lại, bớt tính toán hơn và biết trân trọng người thật lòng với mình. Hoàng Nguyên","Thứ tư, 29/10/2025, 00:00 (GMT+7)",Hoàng Nguyên,Tâm sự,,VN Express,
VNEX_291025_00070,Uống thuốc gì chữa zona thần kinh?,https://vnexpress.net/uong-thuoc-gi-chua-zona-than-kinh-4947621.html,"Bài viết được tư vấn chuyên môn bởi ThS.BS Thái Thanh Yến, Khoa Da liễu - Thẩm mỹ Da, Bệnh viện Đại học Y Dược TP HCM. Virus varicella zoster gây cả bệnhthủy đậulẫnzona. Virus này có thể trú ẩn trong hạch thần kinh cảm giác dây thần kinh cột sống nhiều năm sau khi gây ra bệnh thủy đậu và tái hoạt động khi gặp điều kiện thích hợp như: suy giảm miễn dịch, chấn thương hay các loại thuốc làm giảm sức đề kháng... Triệu chứng chính của bệnh zona là mụn nước dạng chum xuất hiện trên nền hồng ban xuất hiện ở một bên cơ thể hoặc mặt với triệu chứng đau rát. Điều trị thường bắt đầu bằng thuốc kết hợp các biện pháp khắc phục chăm sóc tại nhà giúp giảm đau và khó chịu do các triệu chứng gây ra. Bác sĩ có thể kê đơn thuốc để kiểm soát nhiễm trùng, đẩy nhanh quá trình lành bệnh, giảm viêm và đau. Các loại thuốc điều trị bệnh bao gồm: Thuốc kháng virus Thuốc kháng virus điều trị zona bao gồm acyclovir (Sitavig, Zovirax), famciclovir (Famvir), valacyclovir (Valtrex). Những loại thuốc này có thể làm chậm tiến triển của phát ban zona, đặc biệt nếu bạn dùng chúng trong vòng 72 giờ đầu tiên sau khi xuất hiện triệu chứng. Chúng cũng góp phần giảm nguy cơ biến chứng. Nên tham vấn ý kiến bác sĩ về các tác dụng phụ khi dùng những loại thuốc này. Thuốc giảm đau Zona gây viêm, đau nhức dữ dội. Một số loại thuốc không kê đơn để giảm bớt khó chịu như acetaminophen, ibuprofen, naproxen... Sử dụng các thuốc này có thể giúp giảm đau do biến chứng đau dây thần kinh zona - một tình trạng đau nhức, nóng rát mà một số người gặp phải sau khi phát ban và mụn nước củabệnh zonabiến mất. Các loại thuốc khác Người mắc zona đau dữ dội sau hết phát ban hoặc nhiễm trùng trong thời gian bùng phát zona, bác sĩ có thể kê đơn: Kem capsaicin (với nồng độ 0,025%, 0,075%, 0,25%) Là một loại thuốc giảm đau dùng qua da dạng kem bôi. Chỉ bôi thuốc sau khi vết thương đã lành, không bôi thuốc lên vùng da bị trợt loét hoặc viêm tấy. Bạn nên chú ý cẩn thận không để kem dính vào mắt. Thuốc tê Thường có thành phần lidocaine (Lidoderm, Xylocaine) tác dụng giảm đau. Thuốc này có thể có nhiều dạng khác nhau, chẳng hạn kem, dạng lỏng, miếng dán, bột, thuốc xịt, cùng nhiều loại khác. Thuốc kháng sinh Thường sử dụng trong trường hợp vi khuẩn xâm nhập trên da gây nhiễm trùng da và phát ban. Thuốc không có tác dụng trong trường hợp không phải do vi khuẩn gây ra. Thuốc chống trầm cảm ba vòng và thuốc chống co giật Những loại thuốc này có thể giúp giảm đau kéo dài sau khi da đã lành, chẳng hạn như amitriptyline (Amitid, Elavil, Endep), desipramine (Norpramin), gabapentin (Neurontin, Gralise), nortriptyline (Pamelor) và pregabalin (Lyrica). Trao đổi với bác sĩ để nắm rõ những rủi ro và lợi ích của việc sử dụng thuốc. Nếu cơn đau nghiêm trọng, bác sĩ có thể kê đơn steroid hoặc thuốc giảm đau mạnh như oxycodone trong một thời gian ngắn. Bác sĩ cấp phát thuốc cho bệnh nhân. Ảnh:Quỳnh Trần Tự chăm sóc tại nhà Một số cách có thể giúp da mau lành sau zona: Mỹ Ý","Thứ tư, 29/10/2025, 01:00 (GMT+7)",Mỹ Ý,Sức khỏe,Các bệnh,VN Express,
VNEX_291025_00081,Những mẫu xe điện có pin 'khỏe mạnh' nhất,https://vnexpress.net/nhung-mau-xe-dien-co-pin-khoe-manh-nhat-4956708.html,"Kvdbil, sàn giao dịch xe cũ của Thụy Điển, tiến hành một thử nghiệm quy mô lớn, phân tích ""Tình trạng Sức khỏe"" (State of Health - SoH) của hơn 1.300 xe điện và xe hybrid cắm sạc đã qua sử dụng (723 trong số đó là xe thuần điện). Nghiên cứu cho thấy, 8 trong số 10 xe điện đã qua sử dụng được thử nghiệm vẫn giữ được hơn 90% dung lượng pin ban đầu. Martin Reinholdsson, giám đốc thử nghiệm tại Kvdbil, nhận xét: ""Quá trình suy giảm pin ôtô diễn ra chậm nhờ công nghệ tiên tiến và thiết kế thông minh, bao gồm cả việc làm mát các cell pin. Kết quả này cũng bác bỏ quan niệm sai lầm rằng pin ôtô đã qua sử dụng sẽ không bền"". Khi xem xét các mẫu xe thuần điện có hiệu suất cao nhất, danh sách này có những điểm thú vị.Kiagây ấn tượng khi chiếm hai vị trí dẫn đầu với EV6 và Niro Electric. Xe điện Kia EV6 ở Thụy Điển. Ảnh:Wayke Ngay phía sau, Tesla Model Y giành được vị trí thứ ba. Mẫu xe điện Mỹ có doanh số cao nhất trong nhóm. Khi xếp hạng các thương hiệu tổng thể, Tesla xếp thứ tư, chỉ sau Kia, Audi và Opel. Nghiên cứu cũng khẳng định điều mà hầu hết chủ sở hữu xe điện đã biết: cách tốt nhất để duy trì sức khỏe pin là tuân thủ các thói quen sạc pin tốt, chẳng hạn giới hạn mức sạc hàng ngày ở mức 80% và giảm thiểu việc sử dụng sạc nhanh DC. Reinholdsson cũng đưa ra những lời khuyên cho người sử dụng xe điện, với 5 mẹo chính. Không sạc đầy pin thường xuyên: cố gắng giữ mức sạc của pin 20-80% trong cuộc sống hàng ngày và để dành 100% pin ngay trước những chuyến đi dài hơn. Tránh nhiệt độ quá cao và quá thấp: bảo vệ pin khỏi nhiệt độ khắc nghiệt bằng cách đỗ xe ở nơi mát mẻ khi trời nóng, làm nóng xe trước khi cắm điện trong thời tiết lạnh và sử dụng bất kỳ chế độ điều hòa pin nào. Hạn chế sạc nhanh: sử dụng sạc nhanh khi cần nhưng không phải lúc nào cũng vậy; tránh sạc nhanh khi pin lạnh và sạc đầy bằng bộ sạc ở nhà trước khi lái xe đi. Không đỗ xe lâu sau khi sạc đầy: không để xe đỗ quá lâu ở mức gần 0% hoặc 100%, và nếu sẽ đỗ xe trong hơn hai tuần, hãy để pin ở mức khoảng 40-60% và tắt các chức năng tiêu tốn năng lượng. Đặt giới hạn sạc: tận dụng tính năng hỗ trợ phần mềm của xe bằng cách đặt giới hạn sạc (ví dụ: 80%), lên lịch sạc để xe sẵn sàng gần thời điểm khởi hành và thường xuyên cập nhật phần mềm. Một trạm sạc xe điện với các trụ sạc nhanh ở Jarna, Thụy Điển. Ảnh:Drivkraft Danmark TheoElectrek, trong nhiều năm, một điểm gây tranh cãi lớn đối với việc áp dụng xe điện là nỗi lo sợ vô căn cứ rằng bộ pin sẽ vô dụng sau 5-8 năm, dẫn đến chi phí thay thế lên đến hàng chục triệu USD. Việc thay pin thực sự vẫn còn tốn kém, nhưng quan niệm sai lầm rằng việc thay pin là cần thiết đang dần bị phá vỡ. Thực tế, pin đang dần có vẻ như sẽ bền hơn cả chính chiếc xe. Bộ pin làm mát bằng chất lỏng hiện đại rất bền bỉ. Việc 80% xe điện được thử nghiệm vẫn duy trì được hơn 90% dung lượng pin sẽ giúp củng cố niềm tin vào thị trường xe điện đã qua sử dụng còn non trẻ. Mỹ Anh","Thứ tư, 29/10/2025, 06:00 (GMT+7)",Mỹ Anh,Xe,Cầm lái,VN Express,
VNEX_291025_00002,TP HCM dự kiến có hơn 3.600 xe buýt điện năm 2030,https://vnexpress.net/tp-hcm-du-kien-co-hon-3-600-xe-buyt-dien-nam-2030-4957045.html,"Thông tin được UBND TP HCM nêu trong tờ trình xin chủ trương ban hành Nghị quyết của HĐND thành phố về lộ trình, chính sách hỗ trợ chuyển đổi xe buýt điện, năng lượng xanh trên địa bàn. Hiện, hệ thống buýt ở TP HCM sau khi sáp nhập có 176 tuyến, gần 2.400 xe, trong đó 627 ôtô điện (26%), 451 xe buýt CNG (18%), còn lại chạy dầu diesel. Mạng lưới này đến năm 2030 dự kiến tăng lên 297 tuyến với hơn 3.600 xe, toàn bộ vận hành bằng điện, năng lượng xanh. Trong đó, gần 1.500 xe sẽ được đầu tư mới song song với thay thế toàn bộ ôtô đang chạy dầu diesel, kể cảCNGdo không còn đáp ứng tiêu chí năng lượng sạch. Xe buýt điện hoạt động ở TP HCM. Ành:Giang Anh Phân tích tính khả thi về hạ tầng trong lộ trình chuyển đổi, chính quyền thành phố cho biết trên địa bàn hiện có 5 trạm sạc buýt điện với 56 trụ, đáp ứng nhu cầu của 627 xe đang hoạt động. Sắp tới, thành phố sẽ xã hội hóa đầu tư trạm sạc tại 19 bến xe buýt ở khu vực TP HCM (cũ), 15 bến tại Bình Dương, Bà Rịa - Vũng Tàu (cũ). Bên cạnh đó, một số doanh nghiệp nhà nước cũng dự kiến đầu tư thêm 10 trạm sạc giai đoạn 2025-2027. Khi hoàn thành, toàn hệ thống có 393 trụ sạc nhanh, có thể phục vụ hơn 5.500 xe sạc mỗi ngày. Nhằm thu hút các đơn vị vận tải tham gia đầu tư hệ thống buýt trong lộ trình chuyển đổi, TP HCM dự kiến hỗ trợ doanh nghiệp vay tối đa 85% vốn đầu tư xe (không quá 300 tỷ đồng mỗi dự án), lãi suất 3% trong 7 năm. Với hạ tầng trạm sạc, nhà đầu tư phần xây dựng được hỗ trợ 70% và công nghệ, thiết bị 85% (không quá 200 tỷ đồng mỗi dự án)... Lộ trình và các chính sách hỗ trợ chuyển đổi xe buýt điện ở TP HCM thuộc giai đoạn một củaĐề án kiểm soát khí thải phương tiện giao thông trên địa bàn. Với mục tiêu đến năm 2030 toàn bộ xe buýt vận hành bằng điện và năng lượng xanh, thành phố đặt kế hoạch sớm hơn 20 năm so với yêu cầu của Chính phủ. Giai đoạn hai của đề án nêu trên sẽ mở rộng sang các loại xe khác. Theo lộ trình dự kiến, TP HCM sẽ thí điểm vùng phát thải thấp(LEZ)tại khu trung tâm, Cần Giờ và Côn Đảo, từng bước hạn chế xe chạy xăng dầu không đạt chuẩn ra vào các khu vực này. Chính sách dự kiến áp dụng từ năm 2026, trước mắt với xe máy kinh doanh dịch vụ và ôtô thương mại. Giang Anh","Thứ tư, 29/10/2025, 00:00 (GMT+7)",Giang Anh,Thời sự,Giao thông,VN Express,
VNEX_291025_00022,VM Hải Phòng siết vận hành đường chạy khi lượng VĐV 42km tăng kỷ lục,https://vnexpress.net/vm-hai-phong-42km-tang-ky-luc-dieu-chinh-van-hanh-4954276.html,"Theo thống kê từ Ban tổ chức, hơn 10.000 vận động viên đã hoàn tất đăng ký các cự ly tính đến hết giai đoạn Regular (22/10). Trong đó, có gần 4.000 người đăng ký 42km, số VĐV đăng ký 21km là hơn 3.500. Đây là lần đầu tiên trong hệ thống VnExpress Marathon, số lượng đăng ký full marathon vượt cự ly bán marathon. Đoàn tàu sub3 tại VM Hải Phòng 2024. Ảnh:VnExpress Marathon Theo ông Dương Hải Anh - Giám đốc đường chạy hệ thống VnExpress Marathon, điều này phản ánh sự trưởng thành của cộng đồng chạy bộ, cũng như sức hút đặc biệt của cung đường Hải Phòng, nơi nhiều runner từng ghi nhận thành tích cá nhân tốt ở mùa trước. ""Cung đường từ trung tâm thành phố ra Đồ Sơn luôn được xem là lý tưởng cho những người chinh phục thành tích. Thời tiết mát lạnh, độ dốc vừa phải giúp runner duy trì nhịp ổn định và dễ đạt PR"", ông Hải Anh đánh giá Tuy nhiên, việc số lượng vận động viên tăng đột biến, đặc biệt ở nhóm 42km, khiến ban tổ chức phải tính toán lại toàn bộ phương án vận hành. ""Toàn bộ hệ thống sẽ được điều chỉnh tương ứng, cả về quy mô lẫn chất lượng"" đại diện VnExpress Marathon cho biết. Cụ thể, các điểm tiếp nước sẽ được bố trí dày hơn và mở rộng quy mô phục vụ, đảm bảo mỗi VĐV đều được tiếp năng lượng nhanh chóng và an toàn. Số lượng bàn phục vụ, bình nước, điện giải, hoa quả và vật phẩm y tế tại các trạm này đều sẽ được tăng cường. Về hậu cần, ban tổ chức rút kinh nghiệm qua các mùa giải trước để tối ưu quy trình gửi, nhận đồ cá nhân, khu vực xuất phát và sau khi về đích, giảm thiểu thời gian chờ của VĐV. Đặc biệt, giải diễn ra vào mùa đông, yếu tố y tế và nhân sự tình nguyện viên sẽ được chú trọng hơn bao giờ hết. Các kíp y tế lưu động sẽ được bố trí tại nhiều điểm then chốt, cùng đội ngũ TNV được huấn luyện kỹ nhằm đảm bảo hỗ trợ kịp thời khi thời tiết lạnh ảnh hưởng đến thể trạng của VĐV. Với đặc thù giải diễn ra trong mùa lạnh tại Hải Phòng, cung đường từ trung tâm thành phố về khu vực Đồ Sơn luôn là điểm nhấn được runner mong chờ, vừa có cảnh quan đẹp, vừa là đoạn đường lý tưởng để bứt phá thành tích cá nhân. Vì vậy VnExpress Marathon Hải Phòng sẽ giữ nguyên tinh thần và đặc trưng của cung đường này, đồng thời thực hiện một số điều chỉnh kỹ thuật nhỏ để tối ưu khả năng vận hành khi mật độ người tham gia tăng cao. Các thay đổi chủ yếu tập trung vào làn di chuyển, khu vực quay đầu, và điểm tiếp sức nhằm đảm bảo đường chạy luôn thông thoáng, an toàn và mượt mà cho nhóm chạy dài. ""Chúng tôi muốn runner vừa có không gian trải nghiệm đẹp, vừa yên tâm về an toàn vận hành"", ông nói. Lực lượng chức năng có mặt tại các điểm giao cắt tại giải năm ngoái. Ảnh:VnExpress Marathon Năm nay, cả hai nhóm 21km và 42km đều tăng số lượng đáng kể, tạo áp lực lớn lên khâu phân luồng. Ban tổ chức áp dụng hình thức chia wave xuất phát theo thành tích dự kiến, giúp giảm giao cắt giữa các nhóm tốc độ khác nhau. Hệ thống rào chắn mềm, biển chỉ dẫn và vật tư phân luồng cũng được bổ sung để đảm bảo vận động viên có không gian di chuyển tối ưu. ""Ban tổ chức không chỉ hướng tới đủ chỗ để chạy, mà là đảm bảo mỗi người đều có trải nghiệm trọn vẹn"", đại diện ban tổ chức nhấn mạnh. Ngoài lực lượng chuyên môn, giải còn phối hợp cùng các câu lạc bộ chạy địa phương để bố trí điểm cổ vũ, tiếp sức tinh thần dọc đường, góp phần tạo nên không khí sôi động trong ngày thi đấu. HiệnVnExpress Marathon Hải Phòngmở đăng ký giai đoạn Late, kéo dài đến hết ngày 2/12. Runner muốn trải nghiệm ""cung đường của những PR"" đăng kýtại đây. Lan Anh","Thứ tư, 29/10/2025, 09:00 (GMT+7)",Lan Anh,Thể thao,Marathon,VN Express,
