id,title,link,content,date,author,category,sub_category,source,summary
VNEX_271225_00051,Phan Đinh Tùng tặng Tự Long nhẫn kim cương,https://vnexpress.net/phan-dinh-tung-tang-tu-long-nhan-kim-cuong-4998862.html,"Diễn viên Tự Long là một trong những khách mời tạiĐinh Show- concert kỷ niệm tuổi 50 của Phan Đinh Tùng. Sau phần biểu diễn chung, ca sĩ bất ngờ tặng món trang sức cho đàn anh. Anh cho biết Tự Long không nhận cát-xê khi tham gia chương trình, nên anh muốn tìm cách khác để bày tỏ lòng biết ơn. Ca sĩ Phan Đinh Tùng, diễn viên Tự Long trên sân khấu. Ảnh:Ban tổ chức cung cấp Ban đầu, món quà dự định được trao trong tiệc mừng sau đêm diễn, nhưng do nghệ sĩ phải ra sân bay gấp, Phan Đinh Tùng quyết định thực hiện ngay trên sân khấu. ""Kim cương thể hiện tình cảm bền chặt"", ca sĩ nói. Phan Đinh Tùng không tiết lộ giá trị chiếc nhẫn. Phan Đinh Tùng nói về ý nghĩa chiếc nhẫn tặng Tự Long. Tự Long nói về lý do từ chối nhận cát-xê: ""'Mình không có tiền nhưng tiền không quan trọng. Trước đó, tôi chỉ nghĩ sẽ đến chia vui, chưa biết mình làm được điều gì. Tôi nói với Tùng: 'Em cứ để anh tự nhiên, đến lúc đó nếu cảm thấy hát được anh sẽ hát, còn không thì anh nói chuyện'"". Trích đoạn Tự Long, Phan Đinh Tùng tấu hài ngẫu hứng. Trước đó, trong phần giao lưu, diễn viên Tự Long đặt ra thử thách diễn hài ứng biến theo phong cách chương trìnhƠn giời, cậu đây rồicho Phan Đinh Tùng. Tự Long đóng vai một nhà sản xuất, đang tìm đối tác tổ chức liveshow. Phan Đinh Tùng đến ứng tuyển, phải thể hiện tài năng ca hát. Anh trổ tài ca vọng cổ bằng tiếng Anh. Sau tiết mục, Tự Long tiếp tục thể hiện ca khúcTình đất(nhạc sĩ Tuấn Phương), đồng thời ngẫu hứng hát một đoạn nhạc chế xoay quanh biến động giá đất trong năm. Tự Long và Phan Đinh Tùng thân thiết sau khi tham gia chương trìnhAnh trai vượt ngàn chông gai, cùng luyện tập một số tiết mục. Phan Đinh Tùng, Hà Lê hát ""Biển nhớ"". Trong liveshowđón tuổi 50, Phan Đinh Tùng mang đến bức tranh âm nhạc đa sắc, kéo dài năm tiếng với gần 30 ca khúc. Nghệ sĩ gợi ký ức những năm 2000 qua loạt hitSóng tình, Tình yêu diệu kỳ, Dòng thời gian.Phan Đinh Tùng cho biết năm 2003, anh từng vay 80 triệu đồng làm album nhưng thất bại. Sau đó, anh nghiên cứu gu âm nhạc của khán giả, viết bàiBởi vì anh yêu em.Nhờ tác phẩm, anh trả được nợ, có thêm fan. Phan Đinh Tùng đội tóc giả, hát ""Người tình mùa đông"". Ca sĩ nhảy, hátSay một đời vì em, Người tình mùa đôngphong cách disco. Ngoài ra, anh cũng thể hiện loạt ca khúc Noel kinh điển nhưSilent Night, O Holy Night, Feliz Navidad.Cuối show, anh biểu diễnKhúc hát mừng sinh nhậtvà tiết lộ dự án làm mới ca khúc với các nghệ sĩ quốc tế. Phan Đinh Tùng cho biết tên chương trình -Đinh Show- mang nhiều ý nghĩa. ""Đinh"" là tên đệm, họ của mẹ anh, người khuyến khích anh theo đuổi âm nhạc. Ca sĩ cũng muốn nhắc lại nghệ danh ""Phan Đinh Tùng"", sau nhiều năm thường xuyên bị gọi nhầm thành ""Phan Đình Tùng"". Ca sĩ sinh năm 1975, tên thật là Phan Thy Phương Tùng, là cựu thành viên nhóm nhạc MTV. Sau khi rời nhóm, anh ghi dấu ấn với loạt ca khúc:Ngồi bên em, Khúc hát mừng sinh nhật, Bởi vì anh yêu em, Cào cào lá tre, Con gái nhỏ của ba. Bài, video:Hà Thu","Thứ bảy, 27/12/2025, 09:45 (GMT+7)",Hà Thu,Giải trí,Nhạc,VN Express,
VNEX_271225_00003,Nga kết án nhà ngoại giao 12 năm tù vì chuyển bí mật cho Mỹ,https://vnexpress.net/nga-ket-an-nha-ngoai-giao-12-nam-tu-vi-chuyen-bi-mat-cho-my-4998856.html,"Cơ quan An ninh Liên bang Nga (FSB) ngày 26/12 cho biết cựu quan chức ngoại giao Arseniy Konovalov, sinh năm 1987, đã bị kết tội phản quốc. Theo FSB, trong thời gian làm nhiệm vụ tại Mỹ năm 2014-2017, Konovalov đã chuyển giao thông tin mật cho nước này để đổi lấy tiền. Arseniy Konovalov bị bắt và hầu tòa với tội danh phản quốc. Video:TASS Konovalov bị FSB bắt hồi tháng 3 năm ngoái. Tòa án ở Moskva kết án cựu quan chức ngoại giao này 12 năm tù, thụ án tại một trại giam an ninh tối đa. Ông cũng bị phạt 100.000 ruble (khoảng 1.200 USD). FSB không nêu rõ Konovalov đã chuyển thông tin gì cho tình báo Mỹ hay ông bị cáo buộc làm việc với cơ quan nào của Mỹ. Các cơ quan tình báo Mỹ chưa phản hồi về thông tin. TheoKommersant, Konovalov từng giữ chức bí thư thứ hai tại Tổng lãnh sự quán Nga ở Houston, Mỹ. Ngọc Ánh(TheoReuters, TASS, RT)","Thứ bảy, 27/12/2025, 08:44 (GMT+7)",Ngọc Ánh,Thế giới,,VN Express,
VNEX_271225_00059,Tôi và bạn gái khó tiến tới hôn nhân vì em muốn tiếp tục nuôi mèo,https://vnexpress.net/song-chung-voi-ban-gai-toi-va-ban-gai-kho-tien-toi-hon-nhan-vi-em-muon-tiep-tuc-nuoi-meo-4998311.html,"Tôi là nam, 26 tuổi, bạn gái 24 tuổi, cả hai đang ở trọ và làm việc tại TP HCM. Tôi làm kỹ thuật, lương khoảng 20 triệu đồng mỗi tháng, bạn gái làm văn phòng, lương khoảng 10 triệu mỗi tháng. Chúng tôi có ý định dọn về sống chung và đi đến hôn nhân, nhưng lại vướng một vấn đề là bạn gái đang nuôi một bé mèo lông dài được hai năm. Tôi có tiền sử bệnh hô hấp là hen suyễn, dị ứng với lông mèo và khói, hít vào sẽ ho rất nhiều, nặng có thể viêm hô hấp vài hôm. Ở khía cạnh của tôi, tôi muốn bạn gái ngừng nuôi để về sống chung. Vì tôi thấy việc không nuôi mèo sẽ có những lợi ích sau (tôi cũng từng nuôi mèo 1,5 năm): Tự do - đi du lịch hay đi xa không vướng bận; Thời gian - tiết kiệm thời gian chăm mèo; Tiền bạc - đỡ tiền nuôi, nhiều khi bệnh thì tiền còn đội lên rất nhiều; Sức khỏe - hạn chế bệnh sán (tôi đang bị sán chó mèo) và hô hấp; Sinh hoạt - nhiều khi tối nó quậy thì mất ngủ. Ở khía cạnh của bạn gái, cô ấy muốn chúng tôi nuôi bé mèo này vì cô ấy đã xem bé như gia đình và có rất nhiều tình cảm. Giải pháp cô ấy đề ra là sẽ thuê phòng trọ to một xíu để cách ly không gian nuôi mèo và sinh hoạt của tôi. Nhưng tôi bác bỏ ngay vì kinh tế của chúng tôi không đủ sức và không đủ dư để chi tiền cho việc này. Vì sống với nhau, tôi nghĩ tới tiết kiệm để làm việc lớn. Hiện chúng tôi chưa tìm ra phương án tốt nhất ngoài việc chia tay và tìm người phù hợp hơn. Mong các anh chị có kinh nghiệm góp ý. Hoàng Huân","Thứ bảy, 27/12/2025, 09:00 (GMT+7)",Hoàng Huân,Tâm sự,,VN Express,
VNEX_271225_00065,Nhiều doanh nghiệp cân nhắc sở hữu văn phòng để kiểm soát chi phí,https://vnexpress.net/nhieu-doanh-nghiep-can-nhac-so-huu-van-phong-de-kiem-soat-chi-phi-4998827.html,"An Phú Tech, doanh nghiệp công nghệ quy mô 200 nhân sự, sau 8 năm vận hành, nhận định văn phòng được xem là yếu tố quan trọng trong quá trình hoạt động và định vị hình ảnh. Không gian làm việc không chỉ phục vụ nhu cầu hàng ngày, mà còn phản ánh mức độ ổn định và định hướng phát triển trong dài hạn. Những năm đầu hoạt động, đơn vị này xác định văn phòng là chi phí cần thiết để đáp ứng nhu cầu làm việc trước mắt. Bước vào giai đoạn mở rộng, CEO cần quan tâm đến các yếu tố khác như hình ảnh thương hiệu, sự ổn định về địa điểm và khả năng đáp ứng cho các kế hoạch trung, dài hạn. Lúc này, mô hình thuê văn phòng dù linh hoạt nhưng khiến đơn vị gặp nhiều bài toán khó. Năm 2024, chủ thông báo tăng giá thuê, khiến đơn vị phải cân đối để tránh hụt dòng tiền. Câu chuyện tương tự cũng diễn ra tại Thái Minh - doanh nghiệp dịch vụ logistics với gần 100 lao động, hoạt động từ năm 2015. Những năm đầu, công ty thuê văn phòng kết hợp kho nhỏ tại khu vực nội đô để thuận tiện giao dịch. Tuy nhiên, khi quy mô đơn hàng tăng, nhu cầu mở rộng mặt bằng và ổn định địa điểm trở thành bài toán lớn. Theo ông Minh Phát, CEO doanh nghiệp, chỉ trong 5 năm trở lại đây, đơn vị đã ba lần chuyển địa điểm văn phòng do chi phí thuê cũng như chủ nhà thay đổi mục đích sử dụng. ""Mỗi lần thay đổi địa điểm kéo theo chi phí cải tạo, gián đoạn vận hành, ảnh hưởng đến cả hệ thống hoạt động"", ông Phát nói. Dưới góc nhìn đơn vị kinh doanh văn phòng tại Hà Nội, ông Bùi Quang Hiệp (48 tuổi, phường Đống Đa), cho rằng việc sở hữu mặt bằng mang lại lợi thế nhất định so với mô hình thuê. Theo ông, khi doanh nghiệp hoạt động trên tài sản thuộc quyền sở hữu, mức độ tin cậy với đối tác và khách hàng thường cao hơn, đồng thời tạo cảm giác ổn định cho đội ngũ nhân sự về định hướng dài hạn. Bối cảnh này khiến nhiều doanh nghiệp, trong đó có An Phú Tech và Thái Minh bắt đầu xem xét văn phòng như tài sản có thể nắm giữ và khai thác lâu dài, thay vì chỉ là chi phí vận hành. Phối cảnh một văn phòng cho thuê. Ảnh:ROX Signature Tiềm năng từ sở hữu văn phòng cũng được ghi nhận trong một số báo cáo thị trường. Nghiên cứu Hanoi Figures của CBRE Vietnam cho thấy, thị trường văn phòng Hà Nội duy trì trạng thái ổn định, nguồn cung tiếp tục được bổ sung theo từng quý. Giá thuê và tỷ lệ lấp đầy ghi nhận xu hướng tích cực, đặc biệt tại các tòa nhà có chất lượng tốt, phản ánh nhu cầu thuê bền vững từ nhóm doanh nghiệp quy mô vừa và lớn. Cùng góc nhìn, Savills cho biết thị trường văn phòng Hà Nội đang tái cân bằng. Đến quý III/2025, tổng nguồn cung văn phòng đạt khoảng 2,3 triệu m2 sàn từ gần 190 tòa nhà. Giá thuê ổn định, trong khi công suất cải thiện nhẹ lên quanh mức 85%, chủ yếu nhờ khả năng lấp đầy tích cực tại các dự án mới. Hoạt động thuê tập trung vào nhóm doanh nghiệp có nhu cầu dịch chuyển văn phòng để tối ưu chi phí và nâng cấp không gian làm việc, đặc biệt tại khu vực nội thành và phía Tây Hà Nội. Trong bối cảnh đó, theo ghi nhận của ROX Signature, một bộ phận cũng có nhu cầu sở hữu văn phòng. Nhóm này thường là các doanh nghiệp đã tích lũy đủ dài, có dòng tiền ổn định, ưu tiên các tòa văn phòng hạng A, do yêu cầu cao hơn về tiêu chuẩn kỹ thuật và khả năng khai thác linh hoạt. Savills cũng đánh giá tỷ lệ trống của văn phòng hạng A tại Hà Nội thường thấp hơn các phân khúc còn lại. Điều này cho thấy khả năng giữ giá và thanh khoản tốt hơn trong trung và dài hạn. Trong bối cảnh quỹ đất khu trung tâm ngày càng hạn chế, các khu nội thành mở rộng và khu vực phía Tây đang nổi lên như điểm đến mới của dòng vốn và người sử dụng văn phòng. Tòa văn phòng cho thuê ROX Tower Goldmark City tại 136 Hồ Tùng Mậu. Ảnh:ROX Signature Từ nhu cầu thị trường, một số chủ đầu tư phát triển dự án văn phòng theo hướng coi đây là loại tài sản có thể đồng hành cùng nhiều giai đoạn phát triển của doanh nghiệp. Thay vì chỉ cung cấp không gian cho thuê, các dự án hướng tới mô hình văn phòng vừa làm trụ sở, vừa có thể khai thác cho thuê khi doanh nghiệp tái cơ cấu hoặc mở rộng hoạt động. Đơn cử là dự án ROX Tower Goldmark City do ROX Group phát triển, tọa lạc tại số 136 Hồ Tùng Mậu. Dự án gồm 40 tầng nổi, hơn 97.000 m2 sàn văn phòng, có thể chia tách linh hoạt theo nhu cầu sử dụng. Công trình đã hoàn thiện và sẵn sàng khai thác. Điểm cộng của dự án còn đến từ mô hình ""Smart Asset"", cho phép doanh nghiệp chủ động sử dụng làm trụ sở, đồng thời có thể khai thác cho thuê trong các giai đoạn điều chỉnh chiến lược. Về mặt tài chính, theo tính toán của đơn vị phát triển, khoảng cách giữa chi phí thuê và sở hữu văn phòng đang dần thu hẹp. Với diện tích khoảng 130-140 m2 tại khu vực phía Tây Hà Nội, chi phí thuê phổ biến 15-17 USD mỗi m2 một tháng, tương đương 660-740 triệu đồng mỗi năm. ""Nếu sở hữu và kết hợp khai thác linh hoạt, thời gian thu hồi vốn được ước tính dưới 10 năm, tùy phương án tài chính và diễn biến thị trường"", đại diện ROX Group phân tích. Theo các chuyên gia, quyết định sở hữu bất động sản văn phòng cần được đặt trong tổng thể bài toán tài chính và cấu trúc tài sản của doanh nghiệp. Khi văn phòng được ghi nhận là tài sản, doanh nghiệp có thêm dư địa chủ động về không gian làm việc, đồng thời tạo nền tảng cho các kế hoạch phát triển trung và dài hạn. Song Anh","Thứ bảy, 27/12/2025, 11:30 (GMT+7)",Song Anh,Bất động sản,Thị trường,VN Express,
VNEX_271225_00004,Nga nói kế hoạch hòa bình của Ukraine khác hoàn toàn với Mỹ,https://vnexpress.net/nga-noi-ke-hoach-hoa-binh-cua-ukraine-khac-hoan-toan-voi-my-4998848.html,"""Nếu gọi đó là kế hoạch thì nó hoàn toàn khác biệt so với dự thảo 27 điểm mà Mỹ đề xuất ban đầu và được Nga nghiên cứu. Sẽ không thể đạt được thỏa thuận dứt điểm nếu không giải quyết thỏa đáng những vấn đề gốc rễ của cuộc khủng hoảng"", Thứ trưởng Ngoại giao Nga Sergey Ryabkov cho biết hôm 26/12. Ông nhấn mạnh mọi thỏa thuận đều phải ""nằm trong giới hạn"" mà Tổng thống Nga Vladimir Putin và Tổng thống Mỹ Donald Trump đặt ra trong hội nghị thượng đỉnh tại Alaska hồi tháng 8. ""Nếu không sẽ chẳng đạt được sự nhất trí nào"", Thứ trưởng Ryabkov nói thêm. ""Khả năng thực hiện cú hích cuối cùng và đạt thỏa thuận sẽ phụ thuộc vào nỗ lực của chính Nga cùng ý chí chính trị của phía còn lại, nhất là trong bối cảnh Ukraine và các nhà tài trợ của họ, đặc biệt là Liên minh châu Âu (EU), bên không ủng hộ đạt thỏa thuận, đang tăng cường nỗ lực phá hoại"", ông cho hay. Theo quan chức Nga, không thể nói chính xác khi nào xung đột Ukraine có thể được giải quyết. ""Những mốc thời gian mang tính áp đặt sẽ không giúp ích gì ở đây. Thời hạn 9 ngày, 90 ngày hay bất kỳ mốc nào khác đều không mang lại giá trị thực tiễn gì"", Thứ trưởng Ryabkov cho hay, đồng thời kêu gọi ""tập trung vào bản chất của vấn đề"". Thứ trưởng Ngoại giao Nga Sergey Ryabkov tại cuộc họp báo ở Moskva ngày 26/11. Ảnh:Reuters Giới chức Ukraine và EU chưa lên tiếng về những phát biểu này. Dự thảo kế hoạch hòa bình 20 điểm do Tổng thống Ukraine Volodymyr Zelensky công bố hôm 23/12 bao quát nhiều vấn đề, từ sắp xếp lãnh thổ hậu xung đột cho đến các cam kết an ninh mà Kiev mong muốn nhận được, cũng như kế hoạch tái thiết Ukraine. Ukraine đã giành được một số nhượng bộ trong dự thảo mới, như đóng băng chiến tuyến và không bị yêu cầu từ bỏ tham vọng gia nhập NATO. Dự thảo không buộc Ukraine lập tức rút quân hay thiết lập khu phi quân sự, những điều khoản trước đây Kiev phản đối hoặc tránh né, nhưng đã lần đầu đưa vào đàm phán để có thể xem xét trong tương lai. Tổng thống Ukraine sẽ gặp người đồng cấp Mỹ Donald Trump tại Florida ngày 28/12 để thảo luận về phiên bản mới của kế hoạch hòa bình. Theo ông Zelensky, ""các vấn đề nhạy cảm như vùng Donbass và nhà máy điện hạt nhân Zaporizhzhia"" cũng sẽ được bàn tới. Huyền Lê(TheoAFP,TASS)","Thứ bảy, 27/12/2025, 06:50 (GMT+7)",Huyền Lê,Thế giới,,VN Express,
VNEX_271225_00064,Ngôi nhà 99 m2 ghép từ nhiều lớp vật liệu và 'ký ức',https://vnexpress.net/ngoi-nha-99-m2-ghep-tu-nhieu-lop-vat-lieu-va-ky-uc-4997798.html,"Ngôi nhà có diện tích 99 m2, tọa lạc tại Ichinomiya, Nhật Bản. Khu đất của căn nhà nằm ở rìa đồng bằng, nơi ruộng lúa và khu dân đan xen. Ngôi nhà có diện tích 99 m2, tọa lạc tại Ichinomiya, Nhật Bản. Khu đất của căn nhà nằm ở rìa đồng bằng, nơi ruộng lúa và khu dân đan xen. Gia chủ muốn xây một ngôi nhà mới mang dấu ấn, ý nghĩa riêng. Thiết kế của căn nhà được lấy cảm hứng từ những lớp ký ức gắn với các giai đoạn sống khác nhau của gia chủ, từ tuổi thơ, thời sinh viên đến hiện tại. Gia chủ muốn xây một ngôi nhà mới mang dấu ấn, ý nghĩa riêng. Thiết kế của căn nhà được lấy cảm hứng từ những lớp ký ức gắn với các giai đoạn sống khác nhau của gia chủ, từ tuổi thơ, thời sinh viên đến hiện tại. Công trình được tạo nên từ nhiều mảng tường có chất liệu và độ dày khác nhau. Các bức tường đứng độc lập, đảm nhiệm đồng thời vai trò ngăn chia, lưu trữ và định hình công năng. Cách tổ chức này tạo ra các vùng sử dụng linh hoạt, không có ranh giới cứng. Người ở có thể cảm nhận không gian thay đổi tùy theo chất liệu đang hiện diện, từ bê tông trần, gỗ tự nhiên đến tấm kim loại. Công trình được tạo nên từ nhiều mảng tường có chất liệu và độ dày khác nhau. Các bức tường đứng độc lập, đảm nhiệm đồng thời vai trò ngăn chia, lưu trữ và định hình công năng. Cách tổ chức này tạo ra các vùng sử dụng linh hoạt, không có ranh giới cứng. Người ở có thể cảm nhận không gian thay đổi tùy theo chất liệu đang hiện diện, từ bê tông trần, gỗ tự nhiên đến tấm kim loại. Nguồn cảm hứng vật liệu được lấy từ xưởng gốm của gia đình, trường học đối diện, căn hộ thời sinh viên của gia chủ và cảnh quan đường phố nơi họ lớn lên. Nguồn cảm hứng vật liệu được lấy từ xưởng gốm của gia đình, trường học đối diện, căn hộ thời sinh viên của gia chủ và cảnh quan đường phố nơi họ lớn lên. Các khối nhà bố trí xoay quanh sân trong, giúp lấy sáng và thông gió tự nhiên cho toàn bộ công trình. Hệ cửa kính lớn kết nối trực tiếp các khu vực sinh hoạt với khoảng sân, tăng tính liên thông trong sinh hoạt hàng ngày. Các khối nhà bố trí xoay quanh sân trong, giúp lấy sáng và thông gió tự nhiên cho toàn bộ công trình. Hệ cửa kính lớn kết nối trực tiếp các khu vực sinh hoạt với khoảng sân, tăng tính liên thông trong sinh hoạt hàng ngày. Các bức tường thay vì đứng tách biệt, chúng đóng vai trò trung gian, giúp đồ đạc và vật dụng cá nhân hòa vào tổng thể. Các bức tường thay vì đứng tách biệt, chúng đóng vai trò trung gian, giúp đồ đạc và vật dụng cá nhân hòa vào tổng thể. Phòng khách, bếp và khu ăn uống nằm trong một trục mở. Phòng khách, bếp và khu ăn uống nằm trong một trục mở. Không gian chuyển tiếp, kết nối phòng ngủ, khu sinh hoạt chung và sân trong. Không gian chuyển tiếp, kết nối phòng ngủ, khu sinh hoạt chung và sân trong. Phòng ngủ được bố trí mở ra sân trong qua hệ cửa kính trượt. Phòng ngủ được bố trí mở ra sân trong qua hệ cửa kính trượt. Không gian nhìn từ phòng ngủ mở ra khu vệ sinh chung, cho thấy cách tổ chức mặt bằng không khép kín, mà theo các lớp vật liệu. Không gian nhìn từ phòng ngủ mở ra khu vệ sinh chung, cho thấy cách tổ chức mặt bằng không khép kín, mà theo các lớp vật liệu. Khu vệ sinh được đặt cạnh sân trong tận dụng ánh sáng và thông gió tự nhiên. Bàn lavabo dạng dài kết hợp hai chậu đá, bên dưới bố trí hệ kệ mở đựng đồ, giỏ mây và khăn tắm, giúp tăng khả năng lưu trữ. Khu vệ sinh được đặt cạnh sân trong tận dụng ánh sáng và thông gió tự nhiên. Bàn lavabo dạng dài kết hợp hai chậu đá, bên dưới bố trí hệ kệ mở đựng đồ, giỏ mây và khăn tắm, giúp tăng khả năng lưu trữ. Ngôi nhà lên đèn vào buổi tối với ánh sáng vàng dịu hắt ra từ các ô cửa và hiên mái. Ngôi nhà lên đèn vào buổi tối với ánh sáng vàng dịu hắt ra từ các ô cửa và hiên mái. Bích Phương(theoArchdaily)","Thứ bảy, 27/12/2025, 00:00 (GMT+7)",Bích Phương,Bất động sản,Không gian sống,VN Express,
