id,title,link,content,date,author,category,sub_category,source,summary
VNEX_060925_00083,Nút thắt kép Bình Triệu,https://vnexpress.net/nut-that-kep-binh-trieu-4935728.html,"Cầu Bình Triệu 1 đang cấm ôtô để sửa chữa từ 26/8, cầu Bình Triệu 2 phải chia lửa bằng cách mở thêm làn đường ngược chiều cho ôtô lưu thông. Một lượng xe rất lớn đi qua ""nút cổ chai"" khiến cho giao thông trở nên căng thẳng. Khu vực này vốn là cửa ngõ quan trọng hàng đầu ở phía Đông TP HCM cũ, nơi mà bến xe miền Đông vẫn hoạt động ở công suất cao và có tuyến đường sắt đi ngang qua. Sau khi sáp nhập, khu vực này nằm ngay trung tâm của TP HCM mới, là nút giao thông quan trọng bậc nhất, giữ vai trò kết nối các trung tâm hành chính ở phường Sài Gòn, phường Bình Dương cũng như các phường xã khác. Lý do sửa chữa cầu Bình Triệu 1 liên quan đến một câu chuyện xa hơn. Được xây dựng vào cuối những năm 1960 và đã trải qua một lần nâng cấp hơn 15 năm trước, nhưng tĩnh không thông thuyền của cầu Bình Triệu 1 hiện chỉ là 5,5 m. Cùng với cầu Bình Phước 1 cũng bắc qua sông Sài Gòn, cầu Bình Triệu 1 được xem là trở ngại đối với vận tải hàng hóa quy mô lớn trên tuyến sông Sài Gòn. Sông Sài Gòn đoạn qua cầu Bình Phước 1 và Bình Triệu 1 thuộc cấp đường thủy nội địa số 2, tĩnh không phải đạt 7-9,5 m. Việc cải tạo, nâng cấp cầu Bình Triệu 1 là rất cần thiết. Hiện nay các phương tiện qua đoạn sông này hoặc phải khai thác dưới mức công suất tối đa, hoặc phải dừng chờ con nước để có thể lưu thông an toàn. Giảm doanh thu do giảm lượng hàng có thể chuyên chở, hay tăng thời gian vận chuyển do phải chờ con nước, cả hai điều này đều ảnh hưởng đến hiệu quả khai thác phương tiện, ảnh hưởng tới chi phí logistics. Không dừng lại ở đó, điều này kéo theo hai hệ quả quan trọng khác là các bến cảng khu vực thượng lưu cầu Bình Phước 1 như An Sơn, An Tây, Rạch Bắp bị giảm năng lực khai thác, và giao thông đường thủy mất cơ hội chia sẻ với đường bộ, đặc biệt là khi tuyến đường sông Sài Gòn có thể đảm nhận lượng hàng lớn từ các KCN ở Bình Dương (cũ) đưa về xuất khẩu ở Cát Lái và Cái Mép - Thị Vải. Vì vậy, nâng tĩnh không cầu Bình Triệu 1 để đồng bộ hóa cơ sở hạ tầng trên toàn tuyến giao thông thủy trên sông Sài Gòn là điều cần được ưu tiên. Nhưng cũng phải thừa nhận, cho dù chủ đầu tư và nhà thầu cố gắng đảm bảo tiến độ xây dựng, thì thực tế trong những ngày đầu triển khai và đặc biệt là sáng 3/9 cho thấy, ảnh hưởng từ việc sửa chữa cầu là không nhỏ. Đây không phải lần đầu tiên thành phố buộc phải triển khai một dự án giao thông quan trọng, và biết trước là việc thi công sẽ ảnh hưởng đến tình hình đi lại và sinh kế của người dân. Việc thông báo về tình trạng cấm ôtô qua cầu Bình Triệu đã được triển khai khá sớm và lực lượng chức năng cũng nỗ lực tối đa trong khâu phân luồng, tổ chức giao thông, nhưng tần suất truyền thông hay việc thông báo lộ trình thay thế với các chỉ dẫn rõ ràng cần được triển khai qua nhiều kênh hơn, đến đúng các đối tượng liên quan hơn. Để khắc phục giao thông cho cửa ngõ quan trọng này trong trung hạn, tôi tin rằng việc sớm khép kín đường Vành đai 2, đẩy nhanh tiến độ đường Vành đai 3, xây dựng cao tốc TP HCM - Chơn Thành là các nhiệm vụ cấp bách. Đặc biệt, sau khi các cầu Bình Triệu 1 và Bình Phước 1 được nâng tĩnh không, khâu vận tải hành khách qua tuyến đường thủy này là một nội dung rất cần được nghiên cứu cụ thể hơn. Giải pháp dài hạn đối với khu vực này, chắc chắn nằm trong câu chuyện tổ chức lại không gian đô thị theo hướng văn minh, bền vững. Khu vực Hàng Xanh đang được nghiên cứu dự án TOD chỉnh trang đô thị, một dự án nhiều tham vọng và nếu được quy hoạch phù hợp và triển khai đúng đắn, đây chắc chắn là lời giải khả dĩ cho khu vực Hàng Xanh - Bình Triệu. Đối với những dự án cải tạo, nâng cấp hạ tầng thiết yếu sau này, tôi cho rằng sẽ cần xem chi phí xã hội (thời gian, kẹt xe, năng suất bị mất) là một phần phải tính trong kế hoạch đầu tư, từ đó có ngân sách cho giải pháp giảm thiểu tác động như hỗ trợ vận tải công cộng, truyền thông. Thực tế từ cầu Bình Triệu một lần nữa nhắc nhở rằng đầu tư hạ tầng không chỉ là xây dựng hay nâng cấp một cây cầu, mà còn là cách thức quản trị những tác động xã hội - kinh tế trong suốt quá trình thi công. Nếu không chuẩn bị giải pháp phân luồng và phối hợp logistics, cái giá phải trả sẽ luôn lặp lại: ùn tắc, bức xúc và lãng phí nguồn lực. Đặng Dương","Thứ bảy, 6/9/2025, 00:00 (GMT+7)",Đặng Dương,Góc nhìn,Kinh doanh & quản trị,VN Express,"Việc sửa chữa cầu Bình Triệu 1 (TP.HCM) gây ra tình trạng ùn tắc giao thông nghiêm trọng do cầu Bình Triệu 2 phải gánh thêm lượng xe lớn. Nguyên nhân sửa chữa là do cầu Bình Triệu 1 không đáp ứng tĩnh không thông thuyền, gây cản trở vận tải hàng hóa trên sông Sài Gòn và ảnh hưởng đến hiệu quả logistics. Để giảm thiểu tác động, cần tăng cường truyền thông về lộ trình thay thế và đẩy nhanh tiến độ các dự án giao thông trọng điểm khác."
VNEX_060925_00058,Trẻ dậy thì sớm dễ nhiễm HPV đúng không?,https://vnexpress.net/tre-day-thi-som-de-nhiem-hpv-dung-khong-4935793.html,"Trả lời: HPV là virus gây u nhú ở người, dễ lây lan qua đường quan hệ tình dục, bao gồm quan hệ qua đường âm đạo, hậu môn, đường miệng. Người từng quan hệ tình dục đều có nguy cơ lây nhiễm vào một thời điểm nào đó trong đời. Ngoài ra, HPV lây qua sử dụng chung đồ dùng cá nhân có chứa dịch tiết người bệnh dù tỷ lệ thấp. Ở đường lây này, virus HPV sẽ xâm nhập vào cơ thể qua các vết nứt, trầy xước trên da như ở môi, hậu môn, bộ phận sinh dục, niêm mạc miệng, mũi, mắt... Còn dậy thì sớm là tình trạng trẻ bắt đầu xuất hiện các dấu hiệu trưởng thành sớm hơn trước 8 tuổi ở bé gái và trước 9 tuổi ở bé trai. Trẻ dậy thì sớm sẽ thay đổi hormone và phát triển nhanh hệ xương, cơ bắp, cơ quan sinh sản, xuất hiện lông mu, thay đổi giọng nói. Phụ huynh nên đồng hành cùng trẻ trong giai đoạn dậy thì sớm, tránh để trẻ nhiễm các bệnh lây qua đường tình dục. Ảnh minh họa:Vecteezy Trẻ dậy thì sớm ít có khả năng lây nhiễm HPV nếu không xảy ra quan hệ tình dục hoặc tiếp xúc với virus. Tuy nhiên, trẻ dậy thì sớm thường có chiều cao, tâm lý, bề ngoài lớn hơn so với tuổi, dẫn tới nguy cơ bị xâm hại tình dục. Trẻ cũng có xu hướng tò mò giới tính, quan hệ tình dục sớm để lại hậu quả như mắc các bệnh dễ lây qua đường tình dục như HIV, HPV, viêm gan B. Do đó, bạn nên tuân thủ hướng dẫn của bác sĩ để điều trị dậy thì sớm cho con và trò chuyện cùng con, nhằm giúp con hiểu các vấn đề về giới tính, biết cách bảo vệ bản thân. Bạn cũng nên hướng dẫn con tránh sử dụng chung đồ dùng cá nhân với người khác, ngủ sớm, ngủ đủ giấc, thường xuyên vận động, tham gia các hoạt động xã hội, hoạt động dã ngoại nhằm phát triển chiều cao, tăng cường sức đề kháng. Bữa ăn của bé nên có đủ chất dinh dưỡng, tránh sử dụng nhiều nước ngọt, thức ăn nhanh, thức ăn nhiều năng lượng. Các bệnh như sùi mào gà, ung thư cổ tử cung, ung thư vùng hầu họng, ung thư hậu môn... do nhiều typevirus HPVgây ra đã có hai loại vaccine phòng ngừa. Trong đó,vaccine Gardasilphòng 4 type 6, 11, 16, 18, chỉ định cho bé gái và phụ nữ trong tuổi 9-26. Vaccine thế hệ mới Gardasil 9 phòng ngừa 9 type 6, 11, 16, 18, 31, 33, 45, 52 và 58, chỉ định cho nam và nữ trong tuổi 9-45, hiệu quả bảo vệ đến trên 90%. Con bạn năm nay 7 tuổi, còn hai năm nữa sẽ đến tuổi tiêm ngừa. Nếu lo lắng về việc lây nhiễm virus HPV của con, bạn giúp con phòng ngừa bằng các biện pháp trên, nên tiêm ngừa khi bé đủ tuổi. Bé trai từ 9 đến dưới 15 tuổi chỉ cần tiêm hai mũi vaccine Gardasil 9, giúp tiết kiệm tài chính và thời gian, bảo vệ sớm cho con. Bác sĩ Lê Thị Minh NguyệtQuản lý Y khoa, Hệ thống Tiêm chủng VNVC Độc giả đặt câu hỏi tư vấn vaccine để bác sĩ trả lờitại đây.","Thứ bảy, 6/9/2025, 10:00 (GMT+7)",Bác sĩ Lê Thị Minh Nguyệt,Sức khỏe,Vaccine,VN Express,"HPV là virus lây lan chủ yếu qua đường tình dục, và dù hiếm gặp, cũng có thể lây qua đồ dùng cá nhân. Trẻ dậy thì sớm ít có nguy cơ nhiễm HPV trừ khi quan hệ tình dục hoặc tiếp xúc với virus, nhưng do phát triển sớm về thể chất và tâm lý nên dễ bị xâm hại hoặc tò mò về tình dục. Phụ huynh cần giáo dục giới tính, bảo vệ con, đồng thời tuân thủ điều trị dậy thì sớm và khuyến khích lối sống lành mạnh cho con. Hiện có vaccine phòng ngừa HPV hiệu quả, nên tiêm cho trẻ khi đủ tuổi để phòng các bệnh nguy hiểm do virus này gây ra."
VNEX_060925_00065,Uống thuốc kháng đông có phòng nhồi máu cơ tim?,https://vnexpress.net/uong-thuoc-khang-dong-co-phong-nhoi-mau-co-tim-4935748.html,"Trả lời: Chỉ định dùng thuốc kháng đông vô thời hạn sau khi thay van tim cơ học là bắt buộc. Van tim cơ học được làm từ vật liệu nhân tạo (kim loại, carbon...). Khi tiếp xúc với máu, cơ thể nhận diện đây là ""vật lạ"" và có xu hướng kích hoạt quá trình đông máu tự nhiên. Uống thuốc kháng đông đều đặn giúp tránh nguy cơ này. Ngoài ra sau phẫu thuật thay van, các cục máu đông nhỏ có khả năng hình thành và bám trên bề mặt van tim nhân tạo dẫn đến hai biến chứng nguy hiểm. Đầu tiên là kẹt van tim, xảy ra khi cục máu đông lớn dần làm van không thể đóng mở bình thường, gây kẹt van cấp tính. Đây là cấp cứu y khoa, có thể gây suy tim cấp, đột quỵ, tử vong nếu không được xử trí kịp thời. Thứ hai là thuyên tắc mạch hệ thống, tức cục máu đông có thể vỡ ra, theo dòng máu đi đến các cơ quan khác, làm tắc mạch như tắc mạch não (gây đột quỵ), tắc mạch chi, tắc mạch thận... Để ngăn ngừa những biến chứng này, bạn cần uống thuốc kháng đông, nhóm thuốc kháng vitamin K. Mục tiêu điều trị là duy trì chỉ số đông máu INR (International Normalized Ratio) trong giới hạn nhất định, gọi là ""khoảng điều trị mục tiêu"". Bác sĩ sẽ chỉ định khoảng INR phù hợp với loại van và vị trí van của bạn. Tuân thủ uống thuốc đúng liều, tái khám đúng hẹn để theo dõi chỉ số INR nhằm đảm bảo van tim hoạt động tốt, an toàn. Về mối liên quan giữa thuốc kháng đông và phòng ngừa nhồi máu cơ tim thì thuốc kháng đông không có tác dụng phòng ngừa nhồi máu cơ tim. Tác nhân chính dẫn tớinhồi máu cơ tim(còn gọi là đau tim hay cơn đau thắt ngực cấp) là các mảng xơ vữa trong lòng động mạch vành (mạch máu chính nuôi tim). Theo thời gian, mảng xơ vữa có thể bị nứt vỡ. Khi đó, cơ thể sẽ phản ứng bằng cách hình thành một cục máu đông ngay tại vị trí đó để ""vá"" lại. Cục máu đông này lớn nhanh, gây tắc nghẽn đột ngột dòng máu đến nuôi một phần cơ tim, làm hoại tử vùng cơ tim đó. Quá trình này chủ yếu liên quan đến tiểu cầu và hệ thống đông máu tại chỗ trên nền một động mạch bị xơ vữa. Trong khi đó, thuốc kháng vitamin K có tác dụng chính là ức chế các yếu tố đông máu phụ thuộc vitamin K trong gan, từ đó làm loãng máu, ngăn ngừa sự hình thành cục máu đông trong buồng tim và trên bề mặtvan nhân tạo. Về lý thuyết, máu loãng hơn có thể làm chậm quá trình hình thành cục máu đông khi mảng xơ vữa nứt vỡ, nhưng đây không phải là cơ chế phòng ngừa chính và hiệu quả với nhồi máu cơ tim. Phòng ngừa bệnh tập trung chủ yếu vào kiểm soát tốt yếu tố nguy cơ (tăng huyết áp, đái tháo đường, rối loạn mỡ máu, hút thuốc lá, stress, béo phì...). Sử dụng các loại thuốc (nếu có chỉ định từ bác sĩ) như thuốc chống kết tập tiểu cầu (nhóm thuốc chính giúp ngăn tiểu cầu kết dính vào nhau và vào mảng xơ vữa bị nứt vỡ, thường được chỉ định cho những bệnh nhân có nguy cơ cao hoặc từng bị nhồi máu cơ tim), thuốc statin (thuốc hạ mỡ máu giúp ổn định mảng xơ vữa, giảm viêm và ngăn ngừa nứt vỡ). Uống thuốc kháng đông (kháng vitamin K) đều đặn sau phẫu thuậtthay van timcơ học để phòng ngừa các biến chứng như kẹt van hay đột quỵ, không phải biện pháp chính giúp ngăn ngừa nhồi máu cơ tim. Bạn cần tuân thủ nghiêm ngặt chỉ định dùng thuốc kháng đông, theo dõi INR. Trao đổi với bác sĩ về các yếu tố nguy cơ tim mạch khác để có kế hoạch toàn diện phòng ngừa bệnh mạch vành, nhồi máu cơ tim. ThS.BS Phạm Hoàng Trọng HiếuTrung tâm Tim mạch Can thiệpBệnh viện Đa khoa Tâm Anh TP HCM","Thứ bảy, 6/9/2025, 10:00 (GMT+7)",ThS.BS Phạm Hoàng Trọng Hiếu,Sức khỏe,Các bệnh,VN Express,"Sau phẫu thuật thay van tim cơ học, việc sử dụng thuốc kháng đông là bắt buộc để ngăn ngừa hình thành cục máu đông trên van nhân tạo, tránh các biến chứng nguy hiểm như kẹt van hoặc thuyên tắc mạch. Thuốc kháng đông giúp duy trì chỉ số INR trong khoảng mục tiêu, đảm bảo van tim hoạt động tốt. Tuy nhiên, thuốc kháng đông không có tác dụng phòng ngừa nhồi máu cơ tim, mà cần kiểm soát các yếu tố nguy cơ và sử dụng các thuốc đặc trị khác theo chỉ định của bác sĩ."
VNEX_060925_00006,Ông Trump ký sắc lệnh đổi tên Bộ Quốc phòng thành Bộ Chiến tranh,https://vnexpress.net/ong-trump-ky-sac-lenh-doi-ten-bo-quoc-phong-thanh-bo-chien-tranh-4935741.html,"""Tôi nghĩ động thái này đã gửi đi thông điệp chiến thắng. Đó là cái tên phù hợp hơn nhiều trong bối cảnh thế giới hiện nay"", Tổng thống Donald Trump nói tại Nhà Trắng hôm 5/9, trong buổi ký sắc lệnh đổi tên Bộ Quốc phòng Mỹ thành Bộ Chiến tranh. Ông Trump cho rằng tên gọi Bộ Quốc phòng đã được sử dụng hơn 70 năm và ""mang tính chính trị thái quá"". Cơ quan này từng mang tên ""Bộ Chiến tranh"" trong giai đoạn 1789-1947. Tổng thống Donald Trump ký sắc lệnh hành pháp tại Nhà Trắng ngày 5/9. Ảnh:AFP Tổng thống Trump không thể thay đổi hoàn toàn tên gọi của Bộ Quốc phòng nếu không có sự chấp thuận từ quốc hội Mỹ, song sắc lệnh mới sẽ cho phép sử dụng Bộ Chiến tranh như ""tên gọi phụ"". Bộ trưởng Quốc phòng Pete Hegseth nhanh chóng bày tỏ ủng hộ thay đổi này, khi đăng video ghi lại cảnh tấm bảng ghi ""Bộ trưởng Chiến tranh"" được gắn lên cửa phòng làm việc của ông tại Lầu Năm Góc. Ông thêm rằng sắc lệnh không chỉ đơn thuần là đổi tên, mà còn khôi phục tinh thần chiến đấu. ""Hiệu quả tối đa, chứ không phải sự hợp pháp yếu ớt. Tác động mạnh mẽ, thay vì chỉ là sự đúng đắn về mặt chính trị. Chúng ta sẽ đào tạo nên những chiến binh, chứ không chỉ là những người bảo vệ"", ông nói. Nhà Trắng chưa công bố chi phí để đổi tên Bộ Quốc phòng, nhưng truyền thông Mỹ dự đoán nước này sẽ tốn hàng tỷ USD để thay đổi hàng trăm cơ quan, biểu tượng, địa chỉ email và đồng phục. Thanh Tâm(TheoAFP)","Thứ bảy, 6/9/2025, 06:59 (GMT+7)",Thanh Tâm,Thế giới,Tư liệu,VN Express,"Tổng thống Trump ký sắc lệnh đổi tên Bộ Quốc phòng thành Bộ Chiến tranh, cho rằng tên gọi hiện tại ""mang tính chính trị thái quá"" và muốn khôi phục ""tinh thần chiến đấu"". Mặc dù cần quốc hội chấp thuận để thay đổi hoàn toàn, sắc lệnh cho phép sử dụng ""Bộ Chiến tranh"" như tên gọi phụ. Bộ trưởng Quốc phòng ủng hộ động thái này, nhấn mạnh mục tiêu đào tạo chiến binh thay vì người bảo vệ. Việc đổi tên dự kiến sẽ tốn hàng tỷ USD cho các thay đổi liên quan."
VNEX_060925_00060,"Đàn hát, đọc sách, đánh cờ trong viện ung bướu",https://vnexpress.net/dan-hat-doc-sach-danh-co-trong-vien-ung-buou-4935013.html,"Bà Dung, 54 tuổi, đang điều trị ung thư vú, là một trong những bệnh nhân đầu tiên bước vào Phòng thư giãn - giải trí vừa khai trương chiều 4/9 tại Viện Ung bướu và Y học hạt nhân, Bệnh viện Quân y 175. Sau những ngày dài rệu rã vì hóa trị, mái tóc rụng hết, bà nhẹ nhàng đội thử mái tóc giả vừa được tặng. Ngày mai, bà bước vào chu kỳ hóa trị thứ hai trong tổng cộng sáu chu kỳ, tâm trạng không khỏi lo lắng, nặng nề. ""Vào phòng thư giãn, ngồi nghe sách nói, nhìn mấy chậu cây xanh, thấy lòng nhẹ đi một chút"", bà nói. Nữ bệnh nhân 27 tuổi, ung thư buồng trứng giai đoạn 3, đang nghe sách nói tại Phòng thư giãn - giải trí tại Viện Ung bướu và Y học hạt nhân, Bệnh viện Quân y 175. Ảnh:Thế Lân Không chỉ bà Dung, nhiều bệnh nhân khác cũng tìm thấy chút bình yên trong căn phòng nhỏ này. Ông Hùng, 65 tuổi, từng phẫu thuật và xạ trị ung thư thực quản, nay trở lại bệnh viện vì những cơn đau lưng kéo dài, đang chờ bác sĩ xác định nguyên nhân. Trong lúc chờ kết quả, ông ghé vào phòng, ngồi bên bàn cờ cùng những người cùng cảnh ngộ. ""Thời gian nằm viện thường rất nặng nề, ở đây có sách, có đàn, có người chuyện trò, tôi thấy đỡ trống trải hơn"", ông tâm sự. Theo đại tá, GS.TS.BS Nguyễn Văn Ba, Phó giám đốc Bệnh viện Quân y 175, đối với bệnh nhân, nhất là bệnh nhân ung thư, tinh thần lạc quan có ý nghĩa vô cùng quan trọng. Phòng thư giãn là công trình tuy nhỏ nhưng mang giá trị nhân văn to lớn, góp phần hiện thực hóa phương châm chăm sóc sức khỏe toàn diện - cả thể chất và tinh thần cho người bệnh. Một phân tích tổng hợp lớn được công bố trên tạp chí Psycho-Oncology cho thấy các can thiệp tâm lý - xã hội như liệu pháp nhận thức - hành vi (CBT) hay các nhóm hỗ trợ giúp giảm đáng kể mức độ trầm cảm, lo âu và cải thiện chất lượng sống của bệnh nhân ung thư. Một nghiên cứu khác trên tạp chí Cancer của Hiệp hội Ung thư Mỹ cũng chỉ ra rằng các liệu pháp dựa trên chánh niệm (mindfulness) có thể làm giảm các triệu chứng mệt mỏi và rối loạn giấc ngủ - những tác dụng phụ rất phổ biến sau hóa trị. Trên thế giới, mô hình phòng thư giãn là một phần không thể thiếu trong chiến lược Y học tích hợp (Integrative Medicine) tại các trung tâm ung thư hàng đầu. Các bệnh viện tiên tiến như Mayo Clinic (Mỹ) hay The Royal Marsden (Anh) đều có những khoa chuyên biệt cung cấp liệu pháp nghệ thuật, các lớp yoga, thiền định và không gian tĩnh tâm cho bệnh nhân. Đặc biệt, mô hình Maggie's Centres tại Anh đã rất thành công khi xây dựng những ngôi nhà ấm cúng ngay trong khuôn viên bệnh viện, nơi người bệnh được hỗ trợ tâm lý, dinh dưỡng và tham gia các hoạt động cộng đồng hoàn toàn miễn phí. Ngoài ra, các chương trình tình nguyện như Look Good Feel Better còn giúp bệnh nhân lấy lại sự tự tin thông qua việc hướng dẫn chăm sóc ngoại hình sau hóa trị. Tất cả những nỗ lực này đều chung mục đích chăm sóc sức khỏe toàn diện, coi tinh thần là một trụ cột quan trọng trong quá trình điều trị ung thư. Bệnh nhân sinh hoạt tại Phòng thư giãn giải trí. Ảnh:Thế Lân Công trình do Ban Công tác xã hội phối hợp Viện Ung bướu và Y học Hạt nhân cùng các đơn vị, nhà tài trợ triển khai, nhằm chăm sóc sức khỏe tinh thần, tiếp thêm nghị lực cho bệnh nhân trong quá trình điều trị, đồng thời tạo không gian thư giãn, tái tạo năng lượng cho đội ngũ cán bộ, nhân viên y tế. Lê Phương","Thứ bảy, 6/9/2025, 00:04 (GMT+7)",Lê Phương,Sức khỏe,Tin tức,VN Express,"Phòng thư giãn - giải trí vừa khai trương tại Bệnh viện Quân y 175 mang đến không gian thư giãn, giải trí cho bệnh nhân ung thư, giúp họ giảm bớt căng thẳng và lo lắng trong quá trình điều trị. Các hoạt động như nghe sách nói, chơi cờ, trò chuyện giúp bệnh nhân cảm thấy đỡ cô đơn và lạc quan hơn. Mô hình này là một phần của xu hướng Y học tích hợp, chú trọng chăm sóc sức khỏe toàn diện cả về thể chất và tinh thần cho người bệnh ung thư, tương tự như các mô hình thành công trên thế giới."
