id,title,link,content,date,author,category,sub_category,source,summary
VNEX_120725_00064,4 việc cần tránh sau 5h chiều để ngừa đột quỵ,https://vnexpress.net/suc-khoe-cam-nang-4-viec-can-tranh-sau-5h-chieu-de-ngua-dot-quy-4911882.html,"Đột quỵlà sự cố đột ngột nguy hiểm của hệ tuần hoàn, làm ngừng cung cấp oxy và dưỡng chất cho tế bào não. Đột quỵ có thể để lại di chứng lâu dài nặng nề hoặc dẫn tới tử vong. Thực tế, các nghiên cứu cho thấy có tới 84% các ca đột quỵ liên quan đến các yếu tố lối sống có thể thay đổi được. Một phần trong số đó bắt nguồn từ những thói quen trong giờ làm việc, nhưng những gì bạn làm - hoặc không làm - sau giờ tan sở cũng có thể ảnh hưởng lâu dài đến nguy cơ đột quỵ. Dưới đây là 4 thói quen ban đêm nên tránh để giảm nguy cơ đột quỵ mà chuyên gia khuyến cáo: Ăn tối muộn Ăn tối muộn có thể là một phần bình thường trong thói quen của bạn, nhưng nó có thể gây nguy hiểm cho sức khỏe não bộ và tim mạch. ""Ăn tối muộn có thể làm gián đoạn nhịp sinh học của cơ thể và ảnh hưởng tiêu cực đến huyết áp và quá trình trao đổi chất"", Michelle Routhenstein, thạc sĩ, một chuyên gia dinh dưỡng chuyên về sức khỏe tim mạch, cho biết, thêm rằng theo thời gian, những gián đoạn này có thể làm tăng nguy cơ mắc các vấn đề về tim mạch, bao gồm cả đột quỵ. Nghiên cứu đã phát hiện ra rằng ăn bữa cuối cùng trong ngày sau 9 giờ tối có liên quan đến nguy cơ đột quỵ cao hơn so với ăn tối sớm hơn. Một nguy cơ gia tăng tương tự cũng liên quan đến việc ăn sáng muộn, cho thấy thời điểm ăn cả bữa đầu tiên và bữa cuối cùng của bạn có thể đóng vai trò lớn hơn trong nguy cơ đột quỵ. Tạo thói quen ăn sớm hơn, cả vào buổi sáng và buổi tối, có thể hỗ trợ nhịp điệu tự nhiên của cơ thể bạn và ngừa đột quỵ. Nằm dài trên ghế Sau bữa tối, bạn có thể muốn nằm dài trên ghế để thư giãn, đặc biệt là sau một ngày bận rộn. Tuy nghỉ ngơi là quan trọng, việc dành quá nhiều thời gian thư giãn vào ban đêm có thể làm tăng nguy cơ đột quỵ, đặc biệt nếu bạn đã ngồi nhiều suốt cả ngày và ngay cả khi còn trẻ. Nghiên cứu đã phát hiện ra những người không hoạt động thể chất dưới 60 tuổi dành hơn 8 giờ mỗi ngày để xem TV, sử dụng máy tính hoặc đọc sách, có khả năng bị đột quỵ cao gấp 3,5 lần so với những người dành ít thời gian rảnh rỗi hơn cho các hoạt động ít vận động. Tin tốt là ngay cả một lượng nhỏ hoạt động cũng có thể có lợi. Malhotra cho biết: ""Đi bộ sau bữa tối trong 20 phút có thể giúp tiêu hóa trong khi tối ưu hóa việc kiểm soát lượng đường trong máu"". Điều này có thể giúp giảm nguy cơ tiền tiểu đường,tiểu đường,huyết áp caovà cuối cùng là bệnh tim và đột quỵ. Nếu bạn đang đi bộ để giảm nguy cơ đột quỵ, việc tăng tốc độ có thể giúp ích nhiều hơn nữa. Theo một phân tích tổng hợp, tăng một km mỗi giờ đi bộ sẽ giúp giảm 13% nguy cơ này. Thức khuya để xem TV, lướt điện thoại hoặc làm việc có thể đang gây hại nhiều hơn là có lợi. Ảnh:Hoàng Minh Nhâm nhi một ly rượu trước khi đi ngủ Nếu thói quen thư giãn buổi tối của bạn bao gồm một hoặc hai ly rượu vang, bia hoặc rượu bourbon, bạn có thể đang tạo điều kiện cho đột quỵ mà không hay biết. Trong khi các nghiên cứu trước đây cho thấy việc uống rượu có thể bảo vệ cơ thể chống lại đột quỵ, thì các bằng chứng gần đây đã thách thức quan điểm đó. ""Rượu làm tăng tình trạng viêm và gây tổn thương tế bào"", tiến sĩ Troy Alexander-El nói. Một trong những nghiên cứu quốc tế lớn nhất về nguy cơ đột quỵ đã phát hiện ra rằng lượng rượu vừa phải và cao có liên quan đến nguy cơ đột quỵ cao hơn. Ngay cả việc uống 5 ly trở lên mỗi ngày và chỉ một lần một tháng cũng làm tăng nguy cơ của một người. Do đó, việc thay thế rượu trước khi đi ngủ bằng một tách trà thảo mộc hoặc một ly mocktail có thể là một cách đơn giản để giảm nguy cơ đột quỵ. Thức khuya Thức khuya để xem TV, lướt điện thoại hoặc làm việc có thể đang gây hại nhiều hơn là có lợi. Malhotra cho biết: ""Giấc ngủ là trụ cột tuổi thọ cơ bản và là thói quen lối sống bị đánh giá thấp nhất"". Nghiên cứu đã phát hiện ra rằng ngủ quá nhiều hoặc quá ít đều có thể làm tăng nguy cơ đột quỵ. Tuy nhiên, ngủ quá nhiều thậm chí còn có hại hơn là không ngủ đủ. Một phân tích tổng hợp cho thấy những người ngủ 5 tiếng trở xuống mỗi đêm có khả năng bị đột quỵ cao hơn 33%. Tuy nhiên, tỷ lệ đó tăng lên 71% ở những người ngủ 8 tiếng trở lên mỗi đêm. Do cả ngủ quá ít và quá nhiều đều có vấn đề, ngủ đủ 8 tiếng mỗi đêm là một mục tiêu tốt. Malhotra cho biết việc duy trì giờ đi ngủ và giờ thức dậy nhất quán, ngay cả vào cuối tuần, cũng có thể hữu ích. Mỹ Ý(TheoEating Well)","Thứ bảy, 12/7/2025, 00:05 (GMT+7)",Mỹ Ý,Sức khỏe,Các bệnh,VN Express,"Đột quỵ là một sự cố nguy hiểm, có thể gây tử vong hoặc di chứng lâu dài. Nghiên cứu cho thấy lối sống có ảnh hưởng lớn đến nguy cơ đột quỵ, và những thói quen vào buổi tối có thể đóng vai trò quan trọng. Cụ thể, các chuyên gia khuyến cáo nên tránh ăn tối muộn, nằm dài trên ghế quá nhiều, và uống rượu trước khi đi ngủ. Thay vào đó, nên ăn tối sớm, đi bộ sau bữa ăn, và hạn chế thức khuya để giảm nguy cơ đột quỵ."
VNEX_120725_00088,VietinBank lại rao bán tòa tháp hơn 10.000 tỷ tại khu đô thị Ciputra Hà Nội,https://vnexpress.net/vietinbank-lai-rao-ban-toa-thap-hon-10-000-ty-tai-khu-do-thi-ciputra-ha-noi-4913335.html,"Theo thông báo mới đăng tải, Ngân hàng VietinBank cho biết đang tiến hành các thủ tục cần thiết để chuyển nhượng dự án tòa nhà trụ sở chính (hay còn được gọi là VietinBank Tower) tại lô đất TM1 khu đô thị Nam Thăng Long, phường Phú Thượng, TP Hà Nội (tên thương mại Ciputra). Bởi vậy, VietinBank mời các nhà đầu tư có nhu cầu nhận chuyển nhượng dự án và đáp ứng các điều kiện về năng lực thực hiện, khả năng tài chính đến làm việc để được cung cấp thông tin, hướng dẫn thủ tục, đàm phán các nội dung liên quan đến giao dịch. Ngân hàng này sẽ tiếp nhận nhu cầu đăng ký mua dự án đến hết ngày 25/7. Công trình nằm trên khu đất rộng gần 30.000 m2 với thiết kế 2 tháp cao 48 và 68 tầng. Theo kế hoạch ban đầu, một tháp sẽ được VietinBank đặt trụ sở chính và tòa còn lại làm khách sạn 5 sao, khu chăm sóc sức khỏe, căn hộ cao cấp cho thuê. Dự án có tổng vốn đầu tư khoảng 10.267 tỷ đồng được khởi công từ năm 2010, nhưng đến nay vẫn chưa thể hoàn thành do phía ngân hàng vướng một số khó khăn nhất định trong việc triển khai. Đây cũng không phải là lần đầu tiên xuất hiện thông tin VietinBank muốn bán dự án này. Năm 2018, ngân hàng đã thống nhất sẽ tái cơ cấu dự án theo phương án chuyển nhượng cho đối tác và thuê lại một tháp 68 tầng làm trụ sở. Tại phiên họp thường niên năm 2021, lãnh đạo ngân hàng nói rằng tại thời điểm đó, 29 nhà đầu tư quan tâm tới VietinBank Tower. Trong đó, 21 nhà đầu tư đã ký thỏa thuận bảo mật thông tin để tiếp cận hồ sơ và thẩm định dự án. Hai nhà đầu tư đề xuất tài chính sơ bộ. Anh Tú","Thứ bảy, 12/7/2025, 09:49 (GMT+7)",Anh Tú,Bất động sản,Dự án,VN Express,"VietinBank thông báo đang tiến hành thủ tục chuyển nhượng dự án VietinBank Tower tại khu đô thị Nam Thăng Long do gặp khó khăn trong triển khai. Ngân hàng mời các nhà đầu tư có năng lực và tài chính đến làm việc để được cung cấp thông tin và đàm phán giao dịch, hạn chót đăng ký là 25/7. Dự án có tổng vốn đầu tư hơn 10 nghìn tỷ đồng, bao gồm hai tháp cao 48 và 68 tầng trên khu đất gần 30.000 m2 và đã từng có nhiều nhà đầu tư quan tâm trước đây."
VNEX_120725_00063,Nửa thế kỷ từ bệnh viện một bác sĩ thành nơi ghép tủy lớn nhất Việt Nam,https://vnexpress.net/nua-the-ky-tu-benh-vien-mot-bac-si-thanh-noi-ghep-tuy-lon-nhat-viet-nam-4912932.html,"Tiền thân là Viện Truyền máu Quốc gia (chế độ Sài Gòn), sau ngày thống nhất đất nước nơi đây được đổi tên thành Viện Truyền máu và 5 năm sau trở thành Trung tâm Truyền máu - Huyết học TP HCM. Năm 2002, nơi này mang tên Bệnh viện Truyền máu Huyết học TP HCM, là cơ sở chuyên khoa hạng một, tuyến cuối của khu vực phía Nam, một trong những bệnh viện hàng đầu cả nước về truyền máu và huyết học. Những ngày đầu hoạt động sau ngày thống nhất đất nước năm 1975, viện chỉ vỏn vẹn 36 người, gồm một bác sĩ và bốn dược sĩ, chuyên tiếp nhận, điều chế và phân phối máu cho các bệnh viện tại thành phố, TS.BS.CK2 Phù Chí Dũng, Giám đốc Bệnh viện Truyền máu Huyết học TP HCM, cho biết tạiLễ kỷ niệm 50 năm thành lập bệnh viện, 30 năm thực hiện ca ghép tế bào gốc đầu tiên tại Việt Nam, ngày 11/7. Ngày 12/5/1990 đánh dấu bước ngoặt lớn khi bệnh viện lập khu điều trị các bệnh lý về máu quy mô 30 giường, với đội ngũ 6 bác sĩ, 10 điều dưỡng. Đây được xem là khoa điều trị bệnh lý huyết học riêng biệt đầu tiên cả nước. Hơn 5 năm sau, học hỏi kinh nghiệm từ Nhật Bản, Đài Loan, viện thực hiện ca ghép tủy xương đầu tiên tại Việt Nam và trở thành trung tâm ghép tủy đầu tiên của cả nước, mở đầu kỷ nguyên ghép tủy trị bệnh huyết học. Người đầu tiên ở Việt Nam được ghép tủy là nam thanh niên 21 tuổi mắc bệnh bạch cầu cấp dòng tủy, được ghép tế bào gốc từ chị ruột hiến. Đây là ca ghép nửa thuận hợp HLA (người cho tế bào gốc chỉ phù hợp một nửa gene với bệnh nhân), tính chất phức tạp hơn so với ghép tế bào gốc tự thân của chính người bệnh. Sau ghép, người thanh niên khỏi bệnh, lập gia đình, sinh hai con và sống khỏe đến nay. PGS.TS.BS Trần Văn Bé, giám đốc đầu tiên của viện, người chỉ huy ca ghép trên, nhớ lại muôn vàn khó khăn thiếu thốn khi tiên phong thực hiện kỹ thuật này để cứu người bệnh. ""Đến cây kim chọc tủy khi ấy còn chưa có, chúng tôi phải chọn lựa từ loại dùng cho thú y đem về xử lý để dùng"", ông nói. Từ thành công này, bệnh viện tiếp tục đi đầu trong nhiều kỹ thuật ghép tế bào gốc phức tạp khác. Năm 2002, nơi đây thực hiện ca ghép máu cuống rốn đầu tiên Việt Nam, sau đó là những kỹ thuật mới nhất của thế giới, đồng thời hỗ trợ nhiều bệnh viện khác triển khai kỹ thuật. Đến nay, bệnh viện thực hiện khoảng 700 ca, đứng đầu cả nước về số lượng. Ca ghép tủy đầu tiên Việt Nam tại Bệnh viện Truyền máu Huyết học TP HCM, năm 1995. Ảnh:Bệnh viện cung cấp Ngân hàng tế bào gốc là một trong ba lĩnh vực mạnh nhất của Bệnh viện Truyền máu - Huyết học TP HCM hiện nay. Hai lĩnh vực còn lại là khám chữa bệnh với gần 10.000 ca nhập viện, 140.000 lượt ngoại trú mỗi năm và ngân hàng máu. Hiện, ngân hàng máu cho ra đời hơn 650.000 đơn vị chế phẩm máu mỗi năm, phục vụ tất cả bệnh viện tại thành phố và một số tỉnh lân cận. Dự kiến cuối năm nay, bệnh viện khởi công xây trụ sở hai ngân hàng này, công suất gấp nhiều lần hiện tại. Đầu năm nay, bệnh viện là cơ sở y tếcông lập đầu tiênđạt chứng nhận chất lượng JCI hàng đầu thế giới, điều trị người bệnh theo tiêu chuẩn quốc tế với giá cả Việt Nam. Nơi này hiện có gần 1.000 nhân viên với hơn 160 bác sĩ ở nhiều chuyên khoa. Bệnh viện tiếp tục phát triển nhiều liệu pháp mới, kỹ thuật mới, để người bệnh được thụ hưởng tiến bộ hàng đầu thế giới, không cần phải đi nước ngoài điều trị. Bệnh viện Truyền máu Huyết học TP HCM khánh thành cơ sở mới vào tháng 5/2022, với cơ ngơi khang trang, trang thiết bị hiện đại. Ảnh:Bệnh viện cung cấp Phó chủ tịch UBND TP HCM Trần Thị Diệu Thúy đánh giá cao những nỗ lực của bệnh viện trong hành trình từ cơ sở chỉ có một lĩnh vực duy nhất là lấy máu đã trở thành ngân hàng máu, ngân hàng tế bào gốc, cơ sở khám chữa bệnh đạt chuẩn quốc tế JCI, tiên phong trong nhiều kỹ thuật phức tạp ở Việt Nam. Bà kỳ vọng nơi này cùng một số bệnh viện lớn trong thành phố tiếp tục vai trò dẫn dắt, góp phần xây dựng TP HCM trở thành trung tâm chăm sóc sức khỏe khu vực ASEAN. Lê Phương","Thứ bảy, 12/7/2025, 05:02 (GMT+7)",Lê Phương,Sức khỏe,Tin tức,VN Express,"Bệnh viện Truyền máu Huyết học TP HCM, tiền thân là Viện Truyền máu Quốc gia, là bệnh viện chuyên khoa hạng một và tuyến cuối của khu vực phía Nam về truyền máu và huyết học. Bệnh viện đã thực hiện ca ghép tủy xương đầu tiên tại Việt Nam vào năm 1995 và không ngừng phát triển các kỹ thuật ghép tế bào gốc phức tạp. Hiện nay, bệnh viện là một trong những đơn vị hàng đầu cả nước về ghép tế bào gốc, ngân hàng máu và khám chữa bệnh về huyết học, đồng thời đạt chứng nhận chất lượng JCI hàng đầu thế giới."
VNEX_120725_00091,"Trung Quốc ra mắt tàu siêu tốc, đi 1.200 km trong 2,5 giờ",https://vnexpress.net/trung-quoc-ra-mat-tau-sieu-toc-di-1-200-km-trong-2-5-gio-4913334.html,"Hôm 11/7, tàu đệm từ do Trung Quốc chế tạo được ra mắt công chúng tại Bắc Kinh. Tàu trở thành phương tiện giao thông mặt đất nhanh nhất từ trước đến nay của Trung Quốc, giúp giảm đáng kể thời gian di chuyển và củng cố vị thế của nước này là quốc gia dẫn đầu thế giới về mạng lưới đường sắt cao tốc. Tàu sở hữu tốc độ tối đa 600km/h, được Tổng công ty Đường sắt Trung Quốc (CRRC), phát triển, có thiết kế khí động lực học với mũi nhọn để giảm lực cản từ không khí. Video từ đài truyền hình nhà nước CCTV cho thấy nội thất mang phong cách tương lai. Giai đoạn kỹ thuật đầu tiên đã hoàn thành vào tháng 7/2024. Các thử nghiệm về tuyến đường, an toàn và đánh giá tính khả thi kỹ thuật sẽ được tiến hành trước khi tàu có thể đi vào hoạt động thương mại. Theo trang tinPapercó trụ sở tại Thượng Hải, tàu sẽ hoạt động giữa các thành phố lớn, bổ sung cho mạng lưới đường sắt hiện có. Với tốc độ tối đa 600km/h, tàu đệm từ siêu tốc chỉ mất 2,5 giờ để di chuyển 1.200 km từ Bắc Kinh đến Thượng Hải - so với 5,5 giờ như tàu cao tốc hiện tại. Ông Shao Nan, kỹ sư cao cấp của CRRC, nói con tàu mới kết hợp độ chính xác và an toàn của vận tải đường sắt với tốc độ của hàng không. CRRC kỳ vọng con tàu ""lấp đầy khoảng cách tốc độ giữa đường sắt cao tốc và hàng không trong phạm vi 2.000 km"". Tàu siêu tốc mới được ra mắt tại Triển lãm Đường sắt Hiện đại lần thứ 17 ở Bắc Kinh. Ảnh:SCMP Công nghệ đệm từ siêu dẫn điện tốc độ cao hứa hẹn mang lại phương tiện giao thông thân thiện với môi trường và hiệu quả về năng lượng hơn. Các lợi ích bao gồm tốc độ cao hơn, tiếng ồn vận hành thấp hơn và không phát thải. Ngoài ra, chi phí bảo trì dài hạn cũng thấp hơn do hệ thống không tiếp xúc giảm ma sát và hao mòn cơ học. Công nghệ đệm từ sử dụng cảm ứng điện từ giữa nam châm siêu dẫn trên tàu và đường ray, cho phép tàu lơ lửng sau khi đạt tốc độ 150km/h. Trước ngưỡng này, bánh xe cao su sẽ chịu trách nhiệm di chuyển tàu. ""Mô hình này được trang bị chức năng lái tự động hoàn toàn, đòi hỏi tích hợp nhiều công nghệ như truyền thông 5G, thu thập video AI, cảm biến âm thanh và triển khai các loại cảm biến dọc theo tuyến đường,"" ông Shao nói. Tuyến đệm từ đầu tiên của Trung Quốc được khai trương vào năm 2003 với tuyến kết nối Sân bay Quốc tế Phố Đông Thượng Hải với thành phố, do Đức xây dựng. Trung Quốc mở tuyến đệm từ nội địa đầu tiên tại Trường Sa vào năm 2016 và Bắc Kinh mở một tuyến đệm từ vào năm 2017. Tuy nhiên, cả hai tuyến này đều là đệm từ tốc độ thấp với tốc độ tối đa giới hạn ở 120km/h. Mạng lưới đường sắt cao tốc của Trung Quốc đã mở rộng nhanh chóng kể từ giữa những năm 2000, trở thành mạng lưới đường sắt cao tốc lớn nhất thế giới với 48.000 km đường ray tính đến cuối năm 2024. Nhà điều hành đường sắt của nước này đặt mục tiêu đạt hơn 50.000 km đường ray trong năm nay. Hoài Anh(TheoSCMP)","Thứ bảy, 12/7/2025, 09:44 (GMT+7)",Hoài Anh,Du lịch,Tin tức,VN Express,"Ngày 11/7, Trung Quốc ra mắt tàu đệm từ mới, phương tiện giao thông mặt đất nhanh nhất từ trước đến nay của nước này với tốc độ tối đa 600km/h. Tàu được kỳ vọng sẽ rút ngắn thời gian di chuyển giữa các thành phố lớn, bổ sung cho mạng lưới đường sắt hiện có và lấp đầy khoảng cách tốc độ giữa đường sắt cao tốc và hàng không. Công nghệ đệm từ siêu dẫn điện tốc độ cao hứa hẹn mang lại phương tiện giao thông thân thiện với môi trường, hiệu quả về năng lượng và chi phí bảo trì thấp. Tàu được trang bị chức năng lái tự động hoàn toàn và dự kiến sẽ trải qua các thử nghiệm trước khi đi vào hoạt động thương mại."
VNEX_120725_00061,Quả bóng đập vào đầu người phụ nữ gây thủng màng nhĩ,https://vnexpress.net/qua-bong-dap-vao-dau-nguoi-phu-nu-gay-thung-mang-nhi-4913043.html,"Kết quả nội soi tai mũi họng của chị Anh tại Phòng khám Đa khoa Tâm Anh Quận 7 ghi nhận lỗ thủng khá rộng ở màng nhĩ trái, trong khi hòm nhĩ (khoang phía sau màng nhĩ) khô, mũi và họng không có dấu hiệu bất thường. Kết quả đo thính lực cho thấy tai trái nghe kém dẫn truyền ở mức độ hai. BS.CKI Nguyễn Tri Minh Trí, Đơn vị Tai Mũi Họng, chẩn đoán chị Anh thủng màng nhĩ sau chấn thương dẫn đến nghe kém. ""Thủng màng nhĩ do chấn thương mạnh trực tiếp như đánh nhau thì thường gặp, nhưng chấn thương do bóng đập vào đầu gây thủng màng nhĩ như thế này ít gặp"", bác sĩ Trí nói. ThS.BS.CKII Trần Thị Thúy Hằng, Trưởng khoa Tai Mũi Họng, Trung tâm Tai Mũi Họng, Bệnh viện Đa khoa Tâm Anh TP HCM, giải thích rằng quả bóng đột ngột va đập mạnh vào tai chị Anh tạo ra một sóng áp lực lớn truyền qua ống tai ngoài, dồn thẳng lên màng nhĩ (lớp màng mỏng có độ dày 0,1 mm). Áp suất trong ống tai ngoài tăng đột ngột khiến vòi eustache (có nhiệm vụ giúp cân bằng áp suất không khí hai bên màng nhĩ) không kịp mở ra để điều hòa áp suất ở tai giữa. Sự chênh lệch áp suất quá lớn này vượt quá khả năng chịu đựng của màng nhĩ, gây thủng. Cơ chế này cũng tương tự thủng màng nhĩ do tiếp xúc với âm thanh lớn đột ngột (như tiếng bom nổ, tiếng máy bay phản lực) hoặc bị tát mạnh vào tai. Màng nhĩ cũng có thể thủng do các tác động cơ học trực tiếp như khi vô tình đưa tăm bông hoặc các vật cứng khác vào quá sâu trong tai. Lực tác động mạnh không chỉ gây thủng màng nhĩ mà còn có thể ảnh hưởng đến chuỗi xương con (xương búa, xương đe, xương bàn đạp) nằm trong tai giữa. Những xương nhỏ bé này chịu trách nhiệm truyền rung động âm thanh từ màng nhĩ đến ốc tai, nếu tổn thương, thính lực bị ảnh hưởng nhiều hơn. Bệnh nhân được kê đơn thuốc điều trị, tái khám sau hai tuần hoặc khám ngay nếu có triệu chứng bất thường. Hai tuần sau, vết thủng ở tai của chị lành tốt, thu nhỏ kích thước, bớtđau tai, triệu chứng ù tai và nghe kém được cải thiện. Bác sĩ Trí nội soi tai cho chị Anh trong lần tái khám. Ảnh:Phòng khám Đa khoa Tâm Anh Quận 7 Triệu chứng thường gặp khithủng màng nhĩdo chấn thương như đau nhói đột ngột, ù tai, nghe kém, cảm giác đau nhức sâu trong tai, chảy máu tai, chóng mặt nếu có tổn thương đến hệ thống tiền đình ốc tai. Nếu không được điều trị kịp thời và đúng cách, thủng màng nhĩ có thể dẫn đến các biến chứng nghiêm trọng như viêm tai giữa, suy giảm thính lực vĩnh viễn, viêm xương chũm, điếc. Theo bác sĩ Trí, thủng màng nhĩ do chấn thương, đặc biệt khi lỗ thủng nhỏ, không viêm nhiễm ở tai ngoài hoặc tai giữa,màng nhĩkhả năng cao sẽ tự lành. Lúc này, người bệnh chỉ cần theo dõi và điều trị các vấn đề về mũi họng (nếu có). Nếu lỗ thủng trên màng nhĩ không tự lành thì người bệnh có thể được phẫu thuật vá nhĩ (sau khi điều trị cải thiện tình trạng viêm). Bác sĩ Trí khuyến cáo người có triệu chứng bất thường sau chấn thương va chạm vùng tai nên đến chuyên khoa Tai Mũi Họng khám càng sớm càng tốt. Không tự ý ngoáy tai hay nhỏ thuốc khi thấy chảy dịch, chảy máu tai, giữ tai khô ráo. Người bệnh tái khám theo lịch hẹn để bác sĩ theo dõi, điều trị phù hợp, ngăn biến chứng. Uyên Trinh *Tên người bệnh đã được thay đổi","Thứ bảy, 12/7/2025, 08:00 (GMT+7)",Uyên Trinh,Sức khỏe,Các bệnh,VN Express,"Chị Anh bị thủng màng nhĩ do bóng đập vào tai, gây ra tình trạng nghe kém. Bác sĩ giải thích rằng áp lực đột ngột từ quả bóng tạo ra sự chênh lệch áp suất lớn, khiến màng nhĩ bị tổn thương. Thủng màng nhĩ do chấn thương có thể tự lành nếu lỗ thủng nhỏ và không bị nhiễm trùng, nhưng nếu không tự lành thì cần phẫu thuật. Bác sĩ khuyến cáo nên đi khám chuyên khoa Tai Mũi Họng sớm nếu có triệu chứng bất thường sau chấn thương vùng tai."
