id,title,link,content,date,author,category,sub_category,source,summary
VNEX_271225_00057,Những đứa trẻ 'nghiện' game đổi đời nhờ eSport,https://vnexpress.net/nhung-dua-tre-nghien-game-doi-doi-nho-esport-4998790.html,"Son Si-woo vẫn nhớ như in khoảnh khắc mẹ anh giật phắt dây nguồn máy tính khi anh đang trong buổi phỏng vấn trực tuyến để trở thành game thủ. ""Bà nói chơi game khiến tính nết tôi xấu đi và tôi đã bị nghiện"", chàng trai 27 tuổi nhớ lại. Bước ngoặt chỉ đến khi Son thắng một giải nghiệp dư với tiền thưởng 2 triệu won (hơn 36 triệu đồng). Anh đưa toàn bộ số tiền cho cha mẹ. ""Từ đó, họ bắt đầu có chút niềm tin"", anh nói. Gần một thập kỷ sau, Son - với nghệ danh Lehends - đã là nhà vô địch nhiều giải đấuLiên Minh Huyền Thoại(LoL). Anh hiện khoác áo Nongshim RedForce, đội tuyển chuyên nghiệp được bảo trợ bởi một trong những tập đoàn thực phẩm lớn nhất xứ kim chi. Lehends(trái)và Kingen(phải)là những tuyển thủ chuyên nghiệp của câu lạc bộ Nongshim RedForce. Ảnh:Raphael Rashid Sự nghiệp của Son là hình ảnh phản chiếu cho cuộc ""lột xác"" về định kiến của xã hội Hàn Quốc đối với trò chơi điện tử. Tháng 10 vừa qua, ông Tổng thống Hàn Quốc Lee Jae-myung công khai tuyên bố ""trò chơi điện tử không phải chất gây nghiện"". Đây là sự thay đổi lớn so với năm 2013, khi giới lập pháp nước này từng nỗ lực xếp game vào nhóm ""bốn loại gây nghiện chính"" ngang hàng với ma túy, cờ bạc và rượu bia. Số liệu kinh tế đã chứng minh cho sự thay đổi này. Từ năm 2019 đến 2023, thị trường game nội địa Hàn Quốc tăng trưởng 47%, đạt giá trị gần 23.000 tỷ won (khoảng 16,5 tỷ USD). Xuất khẩu game chiếm gần 2/3 tổng kim ngạch xuất khẩu nội dung số, vượt xa các lĩnh vực văn hóa nổi tiếng khác như K-pop hay điện ảnh. Trong hệ sinh thái đó, Thể thao điện tử (esports) đóng vai trò là đầu tàu, định hình cách quảng bá và tiêu thụ trò chơi, dù giá trị trực tiếp chỉ chiếm một phần nhỏ (khoảng 257 tỷ won năm 2023). Hàn Quốc hiện đứng thứ tư thế giới về thị phần game, sau Mỹ, Trung Quốc và Nhật Bản. Hàn Quốc, quốc gia từng áp lệnh cấm trẻ em chơi game sau nửa đêm (Luật Shutdown), giờ đây coi game là một nghề nghiệp chính thống. Nền tảng của sự chuyển mình bắt đầu từ cuối thập niên 90 với sự bùng nổ của các quán net (PC bang). Ngày nay, khoảng 7.800 PC bang vẫn hoạt động nhộn nhịp, nhưng giấc mơ của giới trẻ đã chuyên nghiệp hơn nhiều. Tại học viện Nongshim Esports ở quận Guro (Seoul), không khí tập luyện căng thẳng không kém bất kỳ lò đào tạo vận động viên Olympic nào. Các học viên trẻ dán mắt vào màn hình trong sự im lặng tuyệt đối, dưới sự giám sát chặt chẽ của huấn luyện viên. Dọc hành lang là những dãy cúp sáng loáng. Học viện có ký túc xá riêng và nhà ăn với chuyên gia dinh dưỡng phụ trách từng bữa. Roh Hyun-jun, 22 tuổi, quyết định bảo lưu việc học ngành kỹ thuật cơ khí để theo đuổi con đường này. ""Đại học chỉ là phương án dự phòng. Tôi muốn cảm nhận sự đoàn kết khi cả đội 5 người cùng nhìn về một hướng để chiến thắng"", Roh nói. Nhưng cái giá của giấc mơ không rẻ. Học phí tại đây khoảng 500.000 won (gần 10 triệu đồng) cho 20 giờ huấn luyện mỗi tháng. Evans Oh, CEO của Nongshim Esports, tiết lộ tỷ lệ đào thải cực cao, chỉ 1-2% học viên có thể trở thành tuyển thủ chuyên nghiệp hoặc tìm được việc làm liên quan. Từ năm 2018 đến nay, học viện mới chỉ ""xuất xưởng"" được 42 chuyên gia. Đổi lại, các siêu sao có thể kiếm được mức lương lên tới sáu con số (tính bằng USD), chưa kể tiền thưởng và hợp đồng quảng cáo béo bở. Các game thủ tại một quán internet ở quận Guro, phía tây Seoul. Ảnh:Raphael Rashid Tuy nhiên, hào quang thường ngắn ngủi. Aiden Lee, Tổng thư ký giải đấu LCK, cho biết game thủ Hàn tập luyện hơn 16 giờ mỗi ngày. Sự nghiệp của họ thường kết thúc trước tuổi 30 - mốc thời gian càng bị thắt chặt bởi nghĩa vụ quân sự bắt buộc đối với nam giới. ""Nếu không đủ giỏi, bạn phải từ bỏ sớm. Thị trường này là vậy"", Hwang Sung-hoon, 25 tuổi, đồng đội của Lehends, thừa nhận sự khốc liệt. Aiden Lee, Tổng thư ký giải League of Legends Champions Korea (LCK), cho biết các đội Hàn Quốc đã vô địch 10 trên 15 giải thế giới nhờ môi trường cạnh tranh cực cao. ""Game thủ Hàn có thể tập luyện hơn 16 giờ mỗi ngày. Sự tập trung của họ ở một đẳng cấp khác,"" ông nói. Dù ủng hộ tăng trưởng, chính phủ vẫn duy trì sự bảo vệ. Hiện có 7 trung tâm ""chữa lành"" trên toàn quốc phối hợp với các bệnh viện để tư vấn cho những người trẻ quá đắm chìm vào game. Các hợp đồng tiêu chuẩn cũng giới hạn giờ tập luyện của cầu thủ trẻ để đảm bảo cạnh tranh lành mạnh. Dù vậy, sức hút của nghề ""gõ phím"" vẫn rất lớn. Trong một khảo sát của Bộ Giáo dục Hàn Quốc, ""game thủ chuyên nghiệp"" đứng thứ 5 trong danh sách nghề nghiệp mơ ước của học sinh tiểu học nam. Với những người trẻ như Roh, quyết tâm vẫn không đổi: ""Tôi muốn để lại tên tuổi là một trong những game thủ nổi tiếng nhất"". Minh Phương(TheoGuardian)","Thứ bảy, 27/12/2025, 06:00 (GMT+7)",Minh Phương,Đời sống,Nhịp sống,VN Express,
VNEX_271225_00054,Những kiểu phối đồ tôn dáng với giày bệt,https://vnexpress.net/nhung-kieu-phoi-do-ton-dang-voi-giay-bet-4993175.html,"TheoWWW, một trong những cách đơn giản bạn có thể áp dụng là kết hợp blazer, váy ngắn, quần tất len cùng giày Mary Jane. Phần quai của loại giày này tạo cảm giác chân bớt trống trải khi mang đồ ngắn. TheoWWW, một trong những cách đơn giản bạn có thể áp dụng là kết hợp blazer, váy ngắn, quần tất len cùng giày Mary Jane. Phần quai của loại giày này tạo cảm giác chân bớt trống trải khi mang đồ ngắn. Thay blazer bằng áo khoác dạ dáng dài tối giản và áp dụng phong cách mặc cả ""cây"" đồng màu, bạn sẽ có một diện mạo phù hợp đi làm, đi chơi. Thay blazer bằng áo khoác dạ dáng dài tối giản và áp dụng phong cách mặc cả ""cây"" đồng màu, bạn sẽ có một diện mạo phù hợp đi làm, đi chơi. Một trong những bí quyết giúp bạn tôn chân khi mang giày bệt là sử dụng quần ống côn hoặc ống trứng, tránh quần ống rộng. Độ ôm của quần tạo nên sự gọn gàng,trông dáng người cao ráo hơn. Một trong những bí quyết giúp bạn tôn chân khi mang giày bệt là sử dụng quần ống côn hoặc ống trứng, tránh quần ống rộng. Độ ôm của quần tạo nên sự gọn gàng,trông dáng người cao ráo hơn. Bộ cánh áo len cổ lọ, quần jeans và giày búp bê là công thức phối dành cho những người chuộng phong cách thanh lịch. Bộ cánh áo len cổ lọ, quần jeans và giày búp bê là công thức phối dành cho những người chuộng phong cách thanh lịch. Những cô gái thích phá cách có thể kết hợp quần culottes, giày mũi nhọn và áo khoác lông. Những cô gái thích phá cách có thể kết hợp quần culottes, giày mũi nhọn và áo khoác lông. Nếu không thích mặc quần tất cùng quần shorts hoặc váy ngắn, bạn có thể chọn tất cao tới đầu gối. Tránh mang tất cổ thấp vì khiến tổng thể mất cân đối. Nếu không thích mặc quần tất cùng quần shorts hoặc váy ngắn, bạn có thể chọn tất cao tới đầu gối. Tránh mang tất cổ thấp vì khiến tổng thể mất cân đối. Khimặc cả bộ cùng màu sắc, nhất làváy midi tạo cảm giác lòe xòe, bạn hãy chọn tất màu nổi và giày mũi nhọn để hướng sự chú ý vào chân, từ đó tạo hiệu ứng thời trang và thon thả hơn. Khimặc cả bộ cùng màu sắc, nhất làváy midi tạo cảm giác lòe xòe, bạn hãy chọn tất màu nổi và giày mũi nhọn để hướng sự chú ý vào chân, từ đó tạo hiệu ứng thời trang và thon thả hơn. Giày loafer dành cho những cô gái chuộng phong cách công sở thanh lịch và nam tính. Bạn có thể phối chúng cùng cardigan, sơ mi và chân váy midi, mini hoặc quần jeans ống đứng đều đẹp. Giày loafer dành cho những cô gái chuộng phong cách công sở thanh lịch và nam tính. Bạn có thể phối chúng cùng cardigan, sơ mi và chân váy midi, mini hoặc quần jeans ống đứng đều đẹp. Bộ cánh gồm áo khoác tweed, quần jeans và sneakers dành cho những người làm việc, sinh hoạt trong môi trường năng động. Bộ cánh gồm áo khoác tweed, quần jeans và sneakers dành cho những người làm việc, sinh hoạt trong môi trường năng động. Sao MaiẢnh:Pinterest","Thứ bảy, 27/12/2025, 05:00 (GMT+7)",Sao Mai,Giải trí,Thời trang,VN Express,
VNEX_271225_00017,Ai nhanh nhất Ngoại hạng Anh?,https://vnexpress.net/ai-nhanh-nhat-ngoai-hang-anh-4998665.html,"Theo tính toán của ban tổ chức, Jackson Tchatchoua là cầu thủ chạy nhanh nhất với vận tốc hơn 37,3 km/h. Hậu vệ cánh Wolverhampton từng nổi danh là người nhanh nhất Serie A mùa trước khi đạt tốc độ 36 km/h trong màu áo Hellas Verona. Để so sánh, tốc độ nhanh nhất từng được ghi nhận của con người là khi Usain Bolt đạt 44,7 km/h trong cuộc đua ở nội dung 100m tại giải vô địch thế giới năm 2009. Tchatchoua đang cùng Wolves ngụp lặn ở đáy bảng Ngoại hạng Anh, với chỉ 2 điểm sau 17 vòng. Ảnh:Reuters Thông số của Tchatchoua năm nay tốt hơn khoảng 1 km/h so với vị trí thứ hai của một hậu vệ cánh khác, Destiny Udogie (Tottenham). Ngôi sao của Man Utd,Bryan Mbeumođứng thứ ba ở danh sách những cầu thủ nhanh nhất nhờ sở hữu thông số 36,3 km/h. Giữ vị trí thứ tư và thứ năm lần lượt là Pedro Neto của Chelsea và Anthony Gordon của Newcastle. Những gương mặt còn lại trong top 10 có Daniel James, Yankuba Minteh, Anthony Elanga, Nico O’Reilly, Kevin và William Osula. CảHaalandlẫn Van de Ven đều không có mặt trong top 10 mùa này, dù từng được xem là hai trong số những cầu thủ nhanh nhất giải đấu trong những năm gần đây. Trong khi đó, cầu thủ chậm nhất Ngoại hạng Anh là thủ thành John Victor của Nottingham Forest. Không tính vị trí người gác đền, ""danh hiệu"" cầu thủ chạy chậm nhất hiện thuộc về Joe Knight khi cầu thủ khoác áo Brighton chỉ đạt tốc độ tối đa 20 km/h. Thực tế cầu thủ 20 tuổi không có nhiều cơ hội cải thiện thành tích bởi anh mới thi đấu đúng một phút. Không ai trong số bốn cầu thủ bị đánh giá chậm nhất được chơi quá hai phút ở Ngoại hạng Anh tính đến lúc này. Tương tự Knight, Nehemiah Oriola (20,4 km/h) cũng mới đá khoảng 60 giây cho Brighton, còn Odsonne Edouard (23,8 km/h) và Harrison Armstrong (20,4 km/h) cũng mới xuất hiện trên sân chớp nhoáng. Với trường hợp thi đấu từ 100 phút trở lên, Diego Coppola là người chậm nhất. Cầu thủ Italy đạt vận tốc cực đại là 24,1 km/h trong 107 phút đã phục vụ Brighton. Harvey Elliott bị tạm coi là cầu thủ Anh chậm nhất với vận tốc chỉ là 24,9 km/h, trong khi Mateo Kovacic, với thông số 25,1 km/h, nhiều khả năng là người sẽ bị bỏ lại nếu đội hình Man City chạy thi. Vy Anh","Thứ bảy, 27/12/2025, 06:45 (GMT+7)",Vy Anh,Thể thao,Ngoại hạng Anh,VN Express,
VNEX_271225_00019,Guardiola: 'Man City muốn dẫn đầu chứ không phải kẻ bám đuổi ở Ngoại hạng Anh',https://vnexpress.net/guardiola-man-city-muon-dan-dau-chu-khong-phai-ke-bam-duoi-o-ngoai-hang-anh-4998846.html,"Ở vòng 17,Man Citytừng có lúc leo lên đầu bảng sau khi đè bẹp West Ham 3-0, trước khi bịArsenalđòi lại bằng chiến thắng sít sao trên sân Everton. Hôm nay, thầy trò Guardiola tiếp tục có cơ hội vượt lên, khi đấu Nottingham Forest ở trận đấu sớm nhất của thứ Bảy. ""Vị trí tốt nhất là dẫn đầu, nhưng hiện chúng tôi vẫn chưa ở đó"", Guardiola nói ở họp báo chiều 26/12. ""Tôi muốn dẫn trước mọi đội 10 điểm, nhưng thực tế là vậy. Arsenal đang chơi tốt, và chúng tôi cũng không ở quá xa"". Dù vậy, nhà cầm quân người Tây Ban Nha nhấn mạnh rằng ưu tiên của ông là kết quả từng trận, thay vì liên tục quan tâm tới bảng điểm. Ông nói: ""Tôi thích dẫn đầu hơn là phải đuổi theo, nhưng điều quan trọng là từng trận đấu, từng bước. Chúng tôi đang đi đúng hướng, và mọi thứ sẽ được quyết định từ kết quả trên sân"". HLV Pep Guardiola vui mừng sau trận Man City thắng Crystal Palace 3-0 trên sân Selhurst Park, London, Anh ngày 14/12/2025. Ảnh:AP Trước dịp nghỉ lễ Giáng sinh, Guardiola từng cảnh báo các cầu thủ vềnguy cơ tăng cân do ăn quá nhiều. Và ông không nói đùa. Nhà cầm quân người Tây Ban Nha cho biết đã kiểm tra lại cân nặng và loại những cái tên tăng cân đột biến trước khi hành quân đến Nottingham Forest. ""Tôi có thể tăng vài ký trong dịp Giáng sinh, nhưng các cầu thủ vẫn cực kỳ kỷ luật"", HLV 54 tuổi bày tỏ. ""Mọi người biết mình phải làm gì, và tiêu chuẩn của CLB đã được thiết lập từ lâu. Đây không phải là ngoại lệ, mà là chuẩn mực của chúng tôi suốt 10 năm qua"". Guardiolasau đó ca ngợi toàn đội đã cải thiện phong độ rõ rệt so với đầu mùa, khi thắng bảy trận gần nhất và đang chinh chiến cả bốn mặt trận. ""Tôi biết điểm mạnh, điểm yếu của các cầu thủ vì làm việc cùng họ mỗi ngày"", ông nói. ""Mỗi lời khuyên, mỗi nhận xét đều nhằm giúp họ trở nên tốt hơn. Rayan Cherki có tài năng tuyệt vời, bầu trời là giới hạn với cậu ấy. Cậu ấy muốn đạt đến đâu, phụ thuộc vào bản thân mình, nhưng tiềm năng là rất lớn"". Về nhân sự, Guardiola cho biếtRodricó thể tái xuất sau khi bình phục chấn thương gân kheo, trong khi John Stones (đùi) và Jeremy Doku (bắp chân) vẫn chưa thể ra sân. ""Một số cầu thủ quan trọng sắp trở lại, vì vậy chúng tôi có thể tiến từng bước và xem chuyện gì sẽ xảy ra"", ông nói và để ngỏ khả năng tăng cường lực lượng trong kỳ chuyển nhượng giữa mùa. Man City được cho đang quan tâm đến Antoine Semenyo - tiền đạo cánh có điều khoản giải phóng 87 triệu USD với Bournemouth. Nếu thương vụ này thành công, chủ sân Etihad có thể chia tay Oscar Bobb và Savinho. Hồng Duy(theoESPN, Mancity.com)","Thứ bảy, 27/12/2025, 06:32 (GMT+7)",Hồng Duy,Thể thao,Ngoại hạng Anh,VN Express,
VNEX_271225_00009,Nagakawa hợp tác Điện Máy Xanh mở rộng hệ thống phân phối,https://vnexpress.net/nagakawa-hop-tac-dien-may-xanh-mo-rong-he-thong-phan-phoi-4998309.html,"Theo nội dung thỏa thuận, từ năm 2026, hai bên sẽ tập trung nguồn lực để đẩy mạnh phân phối các dòng sản phẩm chủ lực của Nagakawa trên toàn hệ thống siêu thị Điện Máy Xanh. Trong đó, mảng điều hòa không khí dân dụng vốn là thế mạnh cốt lõi của Nagakawa sẽ tiếp tục được ưu tiên phát triển về độ phủ và chính sách bán hàng. Điểm mới trong giai đoạn hợp tác này là kế hoạch mở rộng danh mục sang các ngành hàng gia dụng và thiết bị nhà bếp của Nagakawa, hướng tới việc cung cấp các giải pháp trọn bộ cho không gian sống, đáp ứng nhu cầu ngày càng đa dạng và khắt khe của hộ gia đình Việt Nam. CEO Tập đoàn Nagakawa Nguyễn Thị Huyền Thương và CEO Điện Máy Xanh Đoàn Văn Hiểu Em ký kết thỏa thuận hợp tác chiến lược toàn diện. Ảnh:Nagakawa Hai đơn vị đánh giá hợp tác là bước chuyển mình quan trọng trong mối quan hệ giữa nhà sản xuất và nhà bán lẻ, nâng cấp từ các hợp đồng thương mại thường niên sang định hướng chiến lược dài hạn kéo dài 5 năm. Theo đại diện Nagakawa, đơn vị có 3 năm liên tiếp đạt mức tăng trưởng doanh thu ấn tượng tại hệ thống Điện Máy Xanh. Kết quả này không chỉ chứng minh sức hấp dẫn của sản phẩm với người tiêu dùng, còn khẳng định sự tương thích về năng lực vận hành và triết lý kinh doanh giữa hai bên. ""Đây là tiền đề để hai doanh nghiệp quyết định gắn kết sâu rộng hơn nhằm khai thác tối đa tiềm năng thị trường trong chu kỳ kinh doanh mới"", vị đại diện chia sẻ. Đại diện hai bên cũng cho biết, hợp tác diễn ra trong bối cảnh thị trường điện máy Việt Nam đang bước vào giai đoạn tái cấu trúc mạnh mẽ. Áp lực cạnh tranh ngày càng tăng buộc các doanh nghiệp phải thay đổi tư duy từ bán hàng đơn thuần sang tối ưu hóa trải nghiệm và dịch vụ. Việc thiết lập quan hệ đối tác chiến lược giúp hai bên chủ động hơn trong việc quy hoạch nguồn hàng, ổn định giá cả và nâng cao chất lượng phục vụ, từ đó tạo ra lợi thế cạnh tranh bền vững. Sản phẩm của Nagakawa trưng bày và phân phối rộng rãi trong chuỗi siêu thị Điện Máy Xanh. Ảnh:Nagakawa Với Nagakawa, việc đồng hành cùng nhà bán lẻ chiếm thị phần lớn nhất Việt Nam là bước đi then chốt trong chiến lược mở rộng độ phủ. Hệ thống cửa hàng trải dài khắp 63 tỉnh thành của Điện Máy Xanh sẽ giúp sản phẩm của hãng tiếp cận nhanh chóng và sâu rộng hơn tới người tiêu dùng, từ khu vực đô thị đến nông thôn. Ngược lại, Điện Máy Xanh cũng đa dạng hóa được danh mục sản phẩm, mang đến nhiều lựa chọn chất lượng với mức giá hợp lý cho khách hàng, đồng thời tối ưu hóa hiệu quả kinh doanh trên từng điểm bán. CEO Tập đoàn Nagakawa Nguyễn Thị Huyền Thương chia sẻ với Điện Máy Xanh. Ảnh:Nagakawa Về định hướng sắp tới, bà Nguyễn Thị Huyền Thương, CEO Tập đoàn Nagakawa cho biết, giai đoạn 2026-2030 mở ra một chu kỳ mới với mục tiêu tăng trưởng mạnh mẽ hơn. Lãnh đạo Nagakawa nhấn mạnh, việc hợp tác với các đối tác phân phối hàng đầu như Điện Máy Xanh được xác định là một trong những trụ cột quan trọng để hiện thực hóa tham vọng này. Không dừng lại ở một thỏa thuận thương mại, sự hợp tác này còn thể hiện cam kết đồng hành dài hạn của hai thương hiệu Việt, cùng chia sẻ nguồn lực và kinh nghiệm để tạo ra giá trị gia tăng cho người dùng. Thanh Thư","Thứ bảy, 27/12/2025, 09:00 (GMT+7)",Thanh Thư,Kinh doanh,Doanh nghiệp,VN Express,
VNEX_271225_00018,Arteta tránh nói về khả năng ăn bốn của Arsenal,https://vnexpress.net/arteta-tranh-noi-ve-kha-nang-an-bon-cua-arsenal-4998845.html,"Arsenalđang dẫn đầu cả Ngoại hạng Anh, Champions League, sẽ gặp Chelsea ở bán kết Cup Liên đoàn và đấu CLB hạng dưới Portsmouth ở vòng ba Cup FA ngày 11/1. Vì vậy, trong cuộc phỏng vấn với kênhESPN,khi được hỏi về khả năng giành nhiều cúp mùa này, trung vệ William Saliba nói: ""Dĩ nhiên là có. Arsenal có cơ hội vô địch ở bất kỳ giải đấu nào tham dự. Ba mùa gần đây, chúng tôi đều tiến rất gần chức vô địch Ngoại hạng Anh. Mùa trước, đội cũng vào bán kết Champions League và Cup Liên đoàn, vì vậy chúng tôi hiểu rằng mình có thể vô địch mọi giải đấu"". Salibacũng cho rằng mỗi danh hiệu đều có giá trị riêng. ""Khi nhìn lại sự nghiệp, người ta sẽ đếm số danh hiệu đã giành được. Cup Liên đoàn cũng là một danh hiệu, và khi đã vào bán kết thì tất nhiên chúng tôi muốn vô địch, giống như mọi giải đấu khác mà Arsenal tham dự"", cầu thủ 24 tuổi bày tỏ. HLV Mikel Arteta trong buổi tập của Arsenal ngày 26/12. Ảnh:Arsenal FC Tuy nhiên, trong buổi họp báo trước trận gặp Brighton ở vòng 18 Ngoại hạng Anh, khi được hỏi về phát biểu của học trò,Mikel Artetathận trọng: ""Tôi chỉ nghĩ đến việc về nhà, nghỉ ngơi một chút, tận hưởng một ngày rồi bắt đầu nói về trận gặp Brighton. Đó là điều chúng tôi phải làm"". Arteta dẫn dắt Arsenal thay Unai Emery năm 2019, đoạt một Cup FA và hai Siêu Cup Anh. HLV người Tây Ban Nha đưa Arsenal trở lại Champions League sau bảy năm, và cạnh tranh chức vô địch Ngoại hạng Anh với Man City, Liverpool trong ba mùa gần nhất nhưng đều về nhì. Ông vì vậy đang chịu nhiều áp lực về mặt thành tích. Đối thủ hôm nay - Brighton - từng để lại cho Arsenal một kỷ niệm buồn. Trong trận đấu hồi tháng 8/2024,Declan Rice phải nhận thẻ vàng thứ haichỉ vì gẩy bóng đi khi Joel Veltman chuẩn bị thực hiện quả đá phạt. Trận đó, hai đội hòa nhau 1-1. Một tháng sau, nỗi ấm ức tương tự xảy ra khi Leandro Trossard bị đuổi khỏi sân trong trận gặp Man City vì đá bóng lên khán đài. ""Tôi còn nhớ rất rõ. Tôi thực sự rất bực bội với cách chúng tôi chơi khi chỉ còn 10 người. Hy vọng lần này mọi thứ sẽ rất khác"", Arteta nói về việc Rice bị truất quyền mùa trước. ""Tôi nghĩ các quy định bây giờ đã khác. Chúng tôi đã phải trả cái giá rất đắt vì cách áp dụng luật khi đó, và hy vọng điều đó không lặp lại, để chúng tôi tiếp tục thi đấu với đủ 11 cầu thủ"". Mùa trước,Arsenal nhận sáu thẻ đỏ, nhiều hơn ít nhất ba thẻ so với bất kỳ đội bóng nào khác tại Ngoại hạng Anh. Nhưng mùa này, họ đang dẫn đầu bảng xếp hạng Fair Play củaNgoại hạng Anhvới chỉ 22 thẻ vàng và chưa nhận thẻ đỏ nào sau 17 trận. Khi được hỏi về thống kê này, Arteta tỏ ra bất ngờ: ""Tôi không biết điều đó. Nhưng như vậy là tốt, quá tốt"". Hồng Duytổng hợp","Thứ bảy, 27/12/2025, 06:43 (GMT+7)",Hồng Duy,Thể thao,Ngoại hạng Anh,VN Express,
