id,title,link,content,date,author,category,sub_category,source,summary
VNEX_140725_00079,5 đồ uống giàu melatonin người mất ngủ nên dùng,https://vnexpress.net/5-do-uong-giau-melatonin-nguoi-mat-ngu-nen-dung-4913792.html,"Sinh tố kiwi:Nếu bạn không muốn ăn trực tiếp có thể xay nhuyễn kiwi chín với một ít hạt và sữa không đường để làm sinh tố. Quả kiwi chứa nhiều vitamin, khoáng chất như vitamin C và E, kali, hormone melatonin, folate. Uống một cốc sinh tố kiwi sau bữa tối có thể ức chế tình trạng viêm, cải thiện thiếu hụt folate, tăng nồng độ serotonin, kích thích buồn ngủ. Sinh tố kiwi:Nếu bạn không muốn ăn trực tiếp có thể xay nhuyễn kiwi chín với một ít hạt và sữa không đường để làm sinh tố. Quả kiwi chứa nhiều vitamin, khoáng chất như vitamin C và E, kali, hormone melatonin, folate. Uống một cốc sinh tố kiwi sau bữa tối có thể ức chế tình trạng viêm, cải thiện thiếu hụt folate, tăng nồng độ serotonin, kích thích buồn ngủ. Sinh tố anh đào chua:Quả anh đào chua (cherry) có hương vị chua ngọt đặc trưng. Nó chứa nồng độ melatonin cao giúp điều hòanhịp sinh họcvà thúc đẩy giấc ngủ lành mạnh. Sinh tố làm từ anh đào chua còn có axit amin tryptophan mà cơ thể sử dụng để sản xuất melatonin và serotonin. Serotonin là chất dẫn truyền thần kinh có liên quan đến điều hòa tâm trạng, tác dụng chống oxy hóa, giúp ngủ ngon. Sinh tố anh đào chua:Quả anh đào chua (cherry) có hương vị chua ngọt đặc trưng. Nó chứa nồng độ melatonin cao giúp điều hòanhịp sinh họcvà thúc đẩy giấc ngủ lành mạnh. Sinh tố làm từ anh đào chua còn có axit amin tryptophan mà cơ thể sử dụng để sản xuất melatonin và serotonin. Serotonin là chất dẫn truyền thần kinh có liên quan đến điều hòa tâm trạng, tác dụng chống oxy hóa, giúp ngủ ngon. Sữa mạch nha:Đồ uống này được làm bằng cách kết hợp sữa với bột mì, lúa mạch và sữa nguyên kem. Lúa mạch giàu vitamin B và D, phốt pho, kẽm, magie có tác dụng thư giãn trước khi đi ngủ. Sữa cũng chứa melatonin, uống một cốc vào buổi tối góp phần tăng melatonin cho cơ thể, tạo cảm giác buồn ngủ. Sữa mạch nha:Đồ uống này được làm bằng cách kết hợp sữa với bột mì, lúa mạch và sữa nguyên kem. Lúa mạch giàu vitamin B và D, phốt pho, kẽm, magie có tác dụng thư giãn trước khi đi ngủ. Sữa cũng chứa melatonin, uống một cốc vào buổi tối góp phần tăng melatonin cho cơ thể, tạo cảm giác buồn ngủ. Trà hoa cúc: Hoa cúc chứa chất chống oxy hóa apigenin, có khả năng liên kết với các thụ thể trong não, thúc đẩy buồn ngủ. Trà hoa làm dịu và thư giãn, giúpgiảm căng thẳngvà lo âu, từ đó hỗ trợ giấc ngủ. Loại trà này có một lượng nhỏ melatonin, có thể giảm triệu chứng mất ngủ. Trà hoa cúc: Hoa cúc chứa chất chống oxy hóa apigenin, có khả năng liên kết với các thụ thể trong não, thúc đẩy buồn ngủ. Trà hoa làm dịu và thư giãn, giúpgiảm căng thẳngvà lo âu, từ đó hỗ trợ giấc ngủ. Loại trà này có một lượng nhỏ melatonin, có thể giảm triệu chứng mất ngủ. Sữa hạt:Óc chó, hạnh nhân cung cấp melatonin tự nhiên dồi dào cho cơ thể. Hàm lượng melatonin trong sữa hạt có thể thay đổi tùy thuộc vào loại hạt, cách chế biến. Uống một cốc sữa vào buổi tối giúp cơ bắp và đầu óc thư giãn, tinh thần thoải mái, hỗ trợ giấc ngủ sâu và ngon hơn. Sữa hạt:Óc chó, hạnh nhân cung cấp melatonin tự nhiên dồi dào cho cơ thể. Hàm lượng melatonin trong sữa hạt có thể thay đổi tùy thuộc vào loại hạt, cách chế biến. Uống một cốc sữa vào buổi tối giúp cơ bắp và đầu óc thư giãn, tinh thần thoải mái, hỗ trợ giấc ngủ sâu và ngon hơn. Anh Chi(TheoEating Well, Healthline)Ảnh:Anh Chi, AI","Thứ hai, 14/7/2025, 09:30 (GMT+7)",Anh Chi,Sức khỏe,Các bệnh,VN Express,"Văn bản giới thiệu một số loại đồ uống có thể giúp cải thiện giấc ngủ. Sinh tố kiwi và anh đào chua chứa nhiều vitamin, khoáng chất và melatonin, giúp điều hòa nhịp sinh học và thúc đẩy giấc ngủ. Sữa mạch nha cung cấp vitamin, khoáng chất và melatonin, tạo cảm giác thư giãn và buồn ngủ. Trà hoa cúc chứa chất chống oxy hóa apigenin giúp giảm căng thẳng, lo âu và hỗ trợ giấc ngủ, trong khi sữa hạt giàu melatonin giúp thư giãn cơ bắp và tinh thần, cải thiện chất lượng giấc ngủ."
VNEX_140725_00071,Axit folic không gây ung thư,https://vnexpress.net/axit-folic-khong-gay-ung-thu-4913883.html,"Gần đây, các nội dung trên Facebook và TikTok lan truyền thông điệp cho rằng axit folic có thể gây độc tính hoặcung thư, đặc biệt đối với những người mang biến thể gen MTHFR. Một bài đăng trên Facebook khẳng định: ""Ngũ cốc được bổ sung dinh dưỡng không hề bổ dưỡng hơn. Chúng được phun axit folic tổng hợp, một phiên bản hóa học nhân tạo của vitamin B9"". Trong khi đó, trên TikTok, nhiều người dùng tuyên bố axit folic chưa chuyển hóa có thể làm suy giảm miễn dịch và liên quan đến ung thư. AFP dẫn lời các chuyên gia phản bác những tuyên bố này, khẳng định axit folic là một dạng vitamin B tổng hợp, dễ hấp thụ và quan trọng đối với cơ thể. Cơ thể cần folate để tạo DNA và biến đổi protein. Đặc biệt trong thai kỳ, axit folic giúp ngăn ngừa dị tật ống thần kinh như tật nứt đốt sống. Trung tâm Kiểm soát và Phòng ngừa Dịch bệnh Mỹ (CDC) ước tính, việc tăng cường axit folic trong thực phẩm có thể ngăn ngừa khoảng 1.300 ca dị tật ống thần kinh mỗi năm. Tại Mỹ và Canada, sau khi áp dụng chính sách bổ sung axit folic vào các sản phẩm như bánh mì và mì ống từ năm 1998, tỷ lệ dị tật này đã giảm mạnh. ""Ngày nay, chúng ta có rất nhiều thứ phải lo lắng, nhưng axit folic trong thực phẩm bổ sung không phải là một trong số đó"", Walter Willett, giáo sư dịch tễ học và dinh dưỡng tại Trường Y tế Công cộng Harvard, nhận định. Ông cho biết việc dùng quá liều axit folic có thể gây một số tác dụng phụ, nhưng mức an toàn được xác định là 400 microgam mỗi ngày, tối đa 1.000 microgam đối với người không có chỉ định y tế đặc biệt. Người dân mua bánh mì tại một siêu thị ở Monterey Park, California. Ảnh:AFP Liên quan đến gen MTHFR, AFP dẫn thông tin từ CDC cho biết những người mang biến thể gen này vẫn có khả năng xử lý tất cả các loại folate, bao gồm axit folic. Người mang biến thể gen MTHFR nghĩa là họ có một sự thay đổi nhỏ ở gen MTHFR, làm cho cơ thể khó xử lý vitamin B9 (folate) hiệu quả như người bình thường. Điều này có thể khiến họ dễ gặp các vấn đề về sức khỏe như tim mạch, sảy thai, hoặc một số bệnh khác, nhưng không phải ai cũng bị bệnh. Các tổ chức y tế như Học viện Y khoa Di truyền & Gen Mỹ, Bệnh viện Nhi đồng Đại học Bắc Carolina đều không khuyến nghị xét nghiệm gen này vì giá trị lâm sàng thấp. Về lo ngại ung thư, giáo sư y khoa Raphael Cuomo, Đại học California, San Diego cho biết nguy cơ ung thư thực chất tăng nếu cơ thể thiếu hụt folate, tức dưới 200 microgam mỗi ngày. Nghiên cứu tại Mỹ cho thấy bổ sung folate đầy đủ giúp giảm nguy cơ một số loại ung thư, bao gồmung thư vúở phụ nữ có tiêu thụ rượu vàung thư đại trực tràng. Theo giáo sư Cuomo, không có bằng chứng nào cho thấy dạng folate cụ thể nào, kể cả axit folic, gây ung thư. Ông lưu ý rủi ro chỉ có thể xảy ra với liều lượng rất cao trong thời gian dài, chủ yếu ở người từng có tiền sử ung thư hoặc tổn thương tiền ung thư, và điều này liên quan đến việc dùng thực phẩm bổ sung liều cao. AFP nhấn mạnh các thông tin đồn đoán axit folic gây ung thư là sai lệch, và lợi ích sức khỏe cộng đồng từ việc tăng cường chất này trong thực phẩm vượt xa các rủi ro lý thuyết. Thục Linh(TheoAFP)","Thứ hai, 14/7/2025, 09:54 (GMT+7)",Thục Linh,Sức khỏe,Tin tức,VN Express,"Các thông tin lan truyền trên mạng xã hội cho rằng axit folic gây độc tính hoặc ung thư, đặc biệt ở người có biến thể gen MTHFR, đã bị các chuyên gia bác bỏ. Axit folic là một dạng vitamin B tổng hợp quan trọng, giúp ngăn ngừa dị tật ống thần kinh và giảm nguy cơ một số bệnh ung thư khi được bổ sung đầy đủ. Dù liều cao có thể gây tác dụng phụ ở một số người có tiền sử bệnh, nhưng các tổ chức y tế không khuyến nghị xét nghiệm gen MTHFR do giá trị lâm sàng thấp. Tóm lại, axit folic vẫn an toàn và có lợi cho sức khỏe cộng đồng."
VNEX_140725_00086,Bạn gái nói 'không có tiền thì đừng yêu',https://vnexpress.net/dau-hieu-ban-gai-dao-mo-tinh-phi-khi-yeu-ban-gai-noi-khong-co-tien-thi-dung-yeu-4913824.html,"Tôi làm IT, sinh năm 1996, thu nhập tạm ổn, khoảng 47 triệu đồng mỗi tháng, đang góp tiền mua nhà. Bạn gái là sinh viên ngân hàng, chuẩn bị tốt nghiệp và đang đi thực tập. Hơn 10 năm tôi mới yêu lại kể từ những năm tháng sinh viên vì tính chất công việc và cũng muốn tập trung cho sự nghiệp. Tôi biết đến em thông qua mai mối của mẹ. Mẹ em là bạn làm ăn của mẹ tôi. Nhà hai đứa cách nhau chỉ 2 km. Em là cô bé nhỏ nhắn, xinh xắn và đang yêu. Cách đây một năm, tôi yêu và tỏ tình với em, phần vì muốn có bạn đồng hành, phần vì em chấp nhận một người khô khan, nói chuyện kém duyên, thiếu tinh tế và ăn mặc xuề xòa như tôi. Nhờ những góp ý của em, tôi dần trở nên trẻ hơn, biết chăm chút bản thân, biết quan tâm và nói chuyện có duyên hơn trong mắt những người xung quanh. Tôi nghĩ tầm này tuổi nên yêu nghiêm túc và muốn tiến xa với em. Còn em từng trải qua mối tình bị bạn trai vô tâm, phải chịu tình phí và yêu xa nên khi đến bên tôi, tôi rất chiều chuộng để bù đắp cho em những tổn thương không phải tôi gây ra. Thời gian đầu, em đòi hỏi rất nhiều, từ quà cáp đến ăn uống, đi chơi xem phim, mua sắm đều do tôi chi trả. Có tháng tình phí lên đến hơn chục triệu chỉ tính ăn uống và đi chơi. Tôi có góp ý về việc này thì dẫn đến cãi nhau. Em nói yêu nhau phải như thế, không có tiền thì đừng yêu. Lúc đó tôi mù quáng nghe theo. Đỉnh điểm, có lần em lừa dối tôi đi chơi với người cũ, vì thấy tôi chịu chi phí quá nhiều. Sau khi tôi phát hiện, có nói chuyện, em chấm dứt với người cũ, giao luôn mật khẩu điện thoại, cũng không còn đòi hỏi quá đáng như trước. Kể từ sau sự kiện này, tôi mới cảm nhận được em yêu tôi. Tôi cũng nhận thấy có chút khác biệt trong suy nghĩ của cả hai khi nói về ước muốn sau này. Tôi muốn góp tiền mua chung cư, tận hưởng sự tiện nghi để làm việc, về sau có tiền sẽ mua nhà mua xe tiếp. Em chỉ quan tâm đến xe hơi, không cần nhà cửa gì dù chỉ mới là sinh viên chưa làm ra tiền. Để ý Tiktok của em chỉ toàn video về việc người yêu chiều chuộng bạn gái, quà cáp, quần áo, mĩ phẩm và xe. Việc nhà sau này em muốn thuê người giúp việc chứ không muốn làm. Bẵng đi một thời gian, đến hiện tại, tuy tần suất cãi nhau giảm đi nhiều nhưng vẫn còn nhiều chuyện khiến tôi phải suy nghĩ. Mỗi khi em bệnh hay đến kỳ kinh nguyệt, tôi đều chăm sóc tận tình chu đáo, từ đồ ăn thuốc men đưa tận giường, đến mọi công việc nhà. Khi tôi bệnh, em chăm sóc qua loa, nhiều việc tôi vẫn phải tự làm. Đỉnh điểm có lần chuẩn bị đi chơi, tôi bị đau đầu nên không đi được, em nhìn tôi trách móc rằng tưởng được đi chơi chứ, rồi nói sao tôi không cố gắng bớt bệnh để khỏi báo người yêu. Hôm đó chúng tôi cãi nhau to. Tôi có thể đi hàng chục cây số để đón em đi liên hoan công ty hay đi chơi với bạn bè khuya về, nhưng em ngại đi đón tôi nếu như không có việc ở ngoài đường sẵn. Tôi có thể đợi 20-30 phút để em makeup, nhưng nếu tôi để em đợi quá 5 phút là em giận. Chuyện tôi chi trả chi phí sinh hoạt, ăn uống cho em, em không nói cho gia đình. Thành ra hàng tháng ngoài tiền từ gia đình, em còn dư một khoản nhỏ ăn uống, đi chơi với tôi. Ấy thế mà em vẫn thường xuyên hết tiền. Tôi biết do em hay mua sắm quần áo, mĩ phẩm. Cứ mỗi lần hết tiền, em đều mượn tôi hoặc lấy quỹ chung hai đứa góp để đi du lịch ra trả. Những khoản em mượn, vui và nhớ thì em trả, không thì thôi, tôi cũng không đòi làm gì. Lần gần đây nhất, tôi thắc mắc về việc này, em giận dỗi nói tôi nghi ngờ em và dần trở nên lạnh nhạt. Gần đây, em đi với chị về khuya, có mua cho tôi ly nước nhưng tôi đã ngủ mất vì trước đó tôi hỏi có mua gì không, em nói khuya sợ hết. Em đến gọi nhưng tôi ngủ mất không nghe máy, em giận dỗi, ném ly nước và muốn chia tay. Tôi nghĩ chuyện ngủ quên chỉ là giọt nước tràn ly. Mỗi lần ngồi lại với nhau nói chuyện, tôi chỉ muốn cả hai cùng nhìn nhận thiếu sót mà phát triển, còn em luôn nghĩ mình bị nghĩ xấu rồi thành ra cãi nhau. Kết quả không chỉ vấn đề không được giải quyết, tôi còn phải năn nỉ, dỗ dành rồi mệt mỏi thêm. Tôi có sai khi mong muốn người yêu trưởng thành hơn? Liệu có phải tôi chưa đủ kiên nhẫn để yêu em? Hay có nên thực sự dừng lại? Tôi biết mình còn yêu nhiều lắm. Mong mọi người cho tôi xin ý kiến. Xuân Mạnh","Thứ hai, 14/7/2025, 09:22 (GMT+7)",Xuân Mạnh,Tâm sự,,VN Express,"Câu chuyện xoay quanh một chàng IT 9x có thu nhập ổn định đang trong mối quan hệ với một sinh viên ngân hàng. Ban đầu, anh chiều chuộng bạn gái để bù đắp tổn thương từ quá khứ, chấp nhận chi trả mọi chi phí và thay đổi bản thân theo hướng tích cực hơn. Tuy nhiên, sau một thời gian, anh nhận ra sự khác biệt trong suy nghĩ và lối sống của cả hai, đặc biệt là cách bạn gái quá chú trọng vật chất và thiếu sự quan tâm, chia sẻ trong mối quan hệ. Điều này khiến anh cảm thấy mệt mỏi và đặt ra nhiều câu hỏi về tương lai của mối quan hệ."
VNEX_140725_00002,Tìm thấy thi thể cuối cùng trong vụ tai nạn liên hoàn ở Nghệ An,https://vnexpress.net/tim-thay-thi-the-cuoi-cung-trong-vu-tai-nan-lien-hoan-o-nghe-an-4913777.html,"Sáng 14/7, lãnh đạo xã Vạn An cho biết anh Sơn quê ở TP Vinh cũ, được lực lượng cứu hộ phát hiện lúc gần 1h hôm nay, cách vị trígặp nạnkhoảng 200 m về phía hạ lưu sông Đào. Thi thể đã được bàn giao cho gia đình đưa về mai táng. Lực lượng chức năng trục vớt ôtô 5 chỗ dưới sông Đào, chiều 13/7. Ảnh:Hùng Lê Trước đó khoảng 17h ngày 13/7, anh Trần Hữu Ba, 37 tuổi, lái ôtô 5 chỗ chở anh Sơn và Trần Văn Trung, 35 tuổi, chạy trên quốc lộ 46, hướng xã Kim Liên lên Vạn An, huyện Nam Đàn cũ. Khi đến cầu Thiên Đường, xã Vạn An, ôtô va chạm với hai xe máy. Một xe máy do người phụ nữ đi cùng chiều điều khiển, xe còn lại chở bốn người trong gia đình anh Đậu Đình Công, 32 tuổi, trú xã Đại Huệ, chạy hướng ngược lại. Sau tai nạn, anh Công tử vong, vợ và cháu bị thương. Ôtô 5 chỗ cuốn theo bé trai 9 tuổi (cháu anh Công), húc đổ hơn 10 m lan can cầu rồi lao xuống sông Đào. Xe máy của các nạn nhân bị biến dạng sau tai nạn. Ảnh:Đức Hùng Anh Ba và Trung được người dân bơi ra tiếp cận, đưa lên bờ an toàn. Riêng anh Sơn mất tích. Khoảng 18h, lực lượng cứu hộ trục vớt ôtô khỏi sông. Bốn tiếng sau, thi thể bé trai 9 tuổi được tìm thấy, cách điểm rơi khoảng 10 m. Theo video từ camera hành trình gắn trên ôtô chạy hướng ngược lại, ôtô 5 chỗ lao nhanh, mất lái rồi tông liên tiếp vào hai xe máy, sau đó rơi xuống sông trong làn bụi mù mịt. Thời điểm đó, khu vực cầu có nhiều phương tiện qua lại. Khoảnh khắc ôtô tông hai xe máy, rơi xuống sông. Video:Phú Hùng Cầu Thiên Đường nơi xảy ra tai nạn dài khoảng 150 m, rộng 40 m, hai bên có lan can. Gần khu vực này có công trường đang thi công. Đức Hùng","Thứ hai, 14/7/2025, 07:51 (GMT+7)",Đức Hùng,Thời sự,Chính trị,VN Express,"Ngày 13/7, một vụ tai nạn nghiêm trọng xảy ra tại cầu Thiên Đường, xã Vạn An, khi một ôtô 5 chỗ mất lái, tông vào hai xe máy rồi lao xuống sông Đào. Vụ tai nạn khiến anh Đậu Đình Công tử vong, vợ và cháu bị thương, còn anh Sơn trên xe ôtô mất tích. Lực lượng cứu hộ đã tìm thấy thi thể anh Sơn và bé trai 9 tuổi (cháu anh Công) vào rạng sáng và tối cùng ngày, đồng thời trục vớt ôtô lên bờ."
VNEX_140725_00022,"Derrick Lewis tái xuất UFC, thắng knock-out sau 35 giây",https://vnexpress.net/derrick-lewis-tai-xuat-ufc-thang-knock-out-sau-35-giay-4913751.html,"Tại Nashville, Tennessee hôm 12/7, Teixeira định đánh phủ đầu với đòn jab. Nhưng Lewis lập tức đáp trả với cú móc trái chính xác, khiến Teixeira ngã xuống sàn. Sau đó, Lewis lao vào tung chuỗi đòn ground-and-pound. Đây là chiêu thức diễn ra võ sĩ khống chế được đối thủ trên mặt sàn (ground), rồi tung ra các đòn đánh liên tục từ tư thế kiểm soát - thường là đấm, chỏ hoặc gối - để gây sát thương (pound). Derrick Lewis (phải) tung đòn về phía Tallison Teixeira trong trận đấu tại Nashville, Tennessee, Mỹ ngày 12/7. Ảnh:Zuffa LLC Dù bị choáng, Teixeira không bất tỉnh và vẫn dựa vào lồng đấu để che chắn, dường như có ý định tiếp tục phòng thủ. Tuy nhiên, trọng tài can thiệp nhanh chóng và tuyên bố dừng trận ở giây 35, trao chiến thắng cho Lewis. Quyết định này gây tranh cãi, khi nhiều CĐV và chuyên gia cho rằng trận đấu nên được tiếp tục thêm ít nhất vài giây, vì Teixeira vẫn tỉnh táo và không buông tay phòng thủ. Tuy nhiên, Daniel Cormier, cựu vô địch UFC và hiện là bình luận viên, ủng hộ quyết định của trọng tài. ""Teixeira không có động thái phản kháng rõ ràng nào sau khi bị hạ. Trong những tình huống như vậy, trọng tài đã làm đúng, an toàn là trên hết"", ông nói. Lewis không quan tâm tới phán quyết của trọng tài và cũng không bình luận về tình huống sau trận. Võ sĩ 40 tuổi tiếp tục mừng phấn khích bằng cách cởi quần đùi, làm điệu bộ đi tiểu ở góc đài đối thủ và ném cốc lên khán đài. ""Họ nói xấu tôi suốt tuần nay"", Lewis trả lời trong lồng bát giác về màn ăn mừng khiêu khích. ""Nói xấu tôi suốt tuần. Tôi không biết tiếng Bồ Đào Nha, nhưng tôi biết chắc họ đã nói xấu tôi. Kệ họ đi"". Derrick Lewis thắng knock-out kỹ thuật Tallison Teixeira sau 35 giây. Chiến thắng trước Teixeira giúp Lewis nối dài kỷ lục lên16 lần knock-out/knock-out kỹ thuậttrong lịch sử UFC. Anh thắng ba trong bốn trận gần nhất, đang xếp thứ 9 trong bảng thứ bậc các võ sĩ hạng nặng UFC và có thể tranh đai nếu duy trì phong độ. Lewis, sinh năm 1985, thi đấu chuyên nghiệp từ năm 2010, từng thi đấu cho các giải như Bellator MMA và Legacy FC, nơi anh giành đai vô địch hạng nặng. Võ sĩ Mỹ đang giữ kỷ lục knock-out nhiều nhất trong lịch sử UFC (15) và đang xếp hạng 9 trong bảng thứ bậc các võ sĩ hạng nặng UFC. Ngoài khả năng hạ đo ván đối thủ, Lewis còn gây chú ý với những màn mừng chiến thắng ""độc nhất vô nhị"", gồm cả hành động gây sốc như cởi quần ăn mừng ngay trên sàn đấu haynhảy theo ""điệu nhảy ngựa""như trong ca khúc đình đàm ""Gangnam Style"" của ca sĩ Hàn Quốc Psy. Hồng Duytổng hợp","Thứ hai, 14/7/2025, 04:26 (GMT+7)",Hồng Duy,Thể thao,Các môn khác,VN Express,"Trong trận đấu tại Nashville, Derrick Lewis đã hạ knock-out kỹ thuật Tallison Teixeira chỉ sau 35 giây bằng một cú móc trái và chuỗi đòn ground-and-pound. Quyết định dừng trận đấu sớm của trọng tài gây tranh cãi, nhưng Lewis không quan tâm và ăn mừng chiến thắng bằng cách cởi quần và có những hành động khiêu khích. Chiến thắng này giúp Lewis nối dài kỷ lục knock-out trong lịch sử UFC và củng cố vị trí của anh trong top các võ sĩ hạng nặng hàng đầu."
