id,title,link,content,date,author,category,sub_category,source,summary
VNEX_060725_00086,Quán cà phê 'khách ngừng thương chủ quán ngừng thở' gây chú ý ở Bạc Liêu,https://vnexpress.net/quan-ca-phe-khach-ngung-thuong-chu-quan-ngung-tho-gay-chu-y-o-bac-lieu-4910564.html,"Cafe Mộc ở đường Dương Văn Điệp, phường Bạc Liêu, nhận nhiều chú ý vì những câu đùa được thay đổi mỗi ngày, ghi trên tấm bảng đen. Gần đây, những câu đùa của quán được chia sẻ rộng rãi, nổi bật như ""Khách mà ngừng thương thì chủ quán ngừng thở""; ""Ở đây bán thức uống giá cả phải căng"" hay ""Mây của trời cứ để gió cuốn, chân của khách thì làm ơn giữ lại"". ""Sao mà dễ thương, có dịp tới Bạc Liêu nhất định phải ghé thử"", người dùng Bùi Dung bình luận. ""Nội dung hay mà chữ hơi xấu"" là bình luận của Linh Hoàng. Nhiều người dùng mạng xã hội cũng nói thích thú vì độ ""mặn"" (hài hước) của quán. Trong khi đó, một số khác trêu rằng do ế khách nên chủ quán mới có nhiều thời gian ngồi nghĩ câu đùa như vậy. Anh Dương và vợ bên cạnh tấm bảng ""gây sốt"" của quán. Ảnh:NVCC Chủ quán Nguyễn Lâm Thái Dương cho biết quán mở khoảng 6 năm và bắt đầu viết những câu đùa trên bảng từ năm 2023. Câu đầu tiên được viết lên bảng là ""Khách hàng là chén cơm của chúng ta, hãy lấy hết từ bi ra mà phục vụ"". Anh Dương cho biết khi đăng hình ảnh tấm bảng kèm câu đùa lên mạng cũng nhận được nhiều sự hưởng ứng nhưng do lúc đó lười viết, không duy trì lâu. Gần đây, khi đẩy mạnh quảng cáo trên các nền tảng mạng xã hội, anh mới bắt đầu duy trì đều đặn thói quen cập nhật câu đùa mới lên bảng. Ví dụ, sáng 5/7, khi nhìn thấy nhân viên mang bánh ra, anh nghĩ ngay đến việc khách hàng thường sợ bánh để từ hôm qua sẽ không ngon. Do đó, câu đùa ""Em của ngày hôm qua nhưng yên tâm, bánh là của ngày hôm nay"" được thêm vào tấm bảng. ""Tôi học văn kém cũng không biết dùng AI nên toàn tự nghĩ để viết"", anh cho biết. Quán cà phê này có sức chứa khoảng 200 khách và lượng khách duy trì ổn định trong nhiều năm. Anh Dương nói nếu chỉ đến vì tấm bảng, lượng khách khó đều đặn. Chủ quán tự tin về các món trà, bánh trong thực đơn, cộng với mức giá hợp lý - từ 20.000 đồng đến 35.000 đồng - cùng sự vui vẻ, tích cực của mình đã thu hút khách đến quán, dù nằm tận trong hẻm. Hoài Anh","Chủ nhật, 6/7/2025, 08:14 (GMT+7)",Hoài Anh,Du lịch,Tin tức,VN Express,"Quán Cafe Mộc ở Bạc Liêu nổi tiếng nhờ những câu đùa hài hước, ""mặn mà"" được cập nhật mỗi ngày trên bảng đen, thu hút sự chú ý và chia sẻ rộng rãi trên mạng xã hội. Chủ quán, anh Nguyễn Lâm Thái Dương, bắt đầu viết những câu đùa từ năm 2023, lấy cảm hứng từ cuộc sống hàng ngày. Mặc dù vậy, anh khẳng định quán vẫn duy trì lượng khách ổn định nhờ chất lượng đồ uống, bánh ngon và giá cả hợp lý, chứ không chỉ dựa vào những câu đùa."
VNEX_060725_00001,Bão Danas mạnh cấp 11,https://vnexpress.net/bao-danas-manh-cap-11-4910697.html,"Theo Trung tâm Dự báo Khí tượng Thủy văn Quốc gia, lúc 7h, bão mạnh cấp 11 (117 km/h), giật cấp 13, di chuyển chậm theo hướng bắc đông bắc với tốc độ 5 km/h. Dự báo ngày 7/7, bão giữ cường độ khi di chuyển trên vùng biển tỉnh Phúc Kiến (Trung Quốc), sau đó tăng tốc lên 15-20 km/h. Đến 7h ngày 8/7, bão hoạt động trên vùng biển tỉnh Chiết Giang, cường độ giảm còn cấp 10, giật cấp 12, sau đó đi vào đất liền và suy yếu. Các đài khí tượng quốc tế cũng đều chung nhận định bão không ảnh hưởng đến đất liền Việt Nam. Đài khí tượng Nhật Bản dự báo bão sẽ đạt cực đại ngày mai với sức gió hơn 160 km/h; Đài Hong Kong cho rằng Danas đang ở giai đoạn mạnh nhất với sức gió khoảng 130 km/h. Tuy nhiên do ảnh hưởng hoàn lưu bão, vùng đông bắc Bắc Biển Đông có mưa giông, gió mạnh cấp 7-9; vùng gần tâm bão cấp 10-11, giật cấp 13; sóng biển cao 4-6 m. Tàu thuyền hoạt động trong khu vực này cần lưu ý đảm bảo an toàn. Dự báo hướng đi của bão Danas, ngày 6/7. Ảnh:NCHMF Trước đó, từ đầu năm đến nay, Biển Đông mới ghi nhận một cơn bão - Wutip - không đổ bộ Việt Nam nhưng hoàn lưu phía tây gây mưa lớn diện rộng tại Trung Trung Bộ từ ngày 11 đến 13/6, với lượng mưa phổ biến 300-650 mm, có nơi như Nam Đông (Thừa Thiên Huế) lên tới 768 mm. Đợt mưa lũ khiến 11 người thiệt mạng tại Thừa Thiên Huế, Quảng Trị, Quảng Bình; hơn 3.500 nhà bị ngập; khoảng 88.000 ha cây trồng bị ảnh hưởng; nhiều tuyến giao thông quốc gia bị sạt lở, ngập úng; hơn 20 chuyến bay tại Đà Nẵng phải hủy, hoãn; chương trình chung kết Hoa hậu trên sông Hương tối 14/6 cũng phải dời lịch. Dự báo năm nay Biển Đông sẽ xuất hiện 11-13 cơn bão và áp thấp nhiệt đới; trong đó khoảng 5-6 cơn có khả năng ảnh hưởng trực tiếp đến đất liền Việt Nam. Miền Bắc được cảnh báo nguy cơ cao từ tháng 7 đến 9, còn Trung Bộ và Nam Bộ từ tháng 9 đến 11. Gia Chính","Chủ nhật, 6/7/2025, 09:13 (GMT+7)",Gia Chính,Thời sự,,VN Express,"Hiện tại, bão mạnh cấp 11 tên Danas đang di chuyển chậm về phía bắc đông bắc và dự kiến sẽ ảnh hưởng đến vùng biển các tỉnh Phúc Kiến và Chiết Giang của Trung Quốc, sau đó suy yếu. Mặc dù bão không ảnh hưởng trực tiếp đến đất liền Việt Nam, nhưng hoàn lưu bão gây mưa giông và gió mạnh ở vùng đông bắc Bắc Biển Đông, nguy hiểm cho tàu thuyền. Trước đó, cơn bão Wutip đã gây mưa lớn ở Trung Trung Bộ vào tháng 6, gây thiệt hại đáng kể. Dự báo năm nay Biển Đông sẽ có nhiều bão và áp thấp nhiệt đới, một số có khả năng ảnh hưởng đến Việt Nam."
VNEX_060725_00005,Lãnh tụ tối cao Iran lần đầu xuất hiện công khai sau xung đột với Israel,https://vnexpress.net/lanh-tu-toi-cao-iran-lan-dau-xuat-hien-cong-khai-sau-xung-dot-voi-israel-4910666.html,"Trong video được phát sóng trên truyền hình nhà nước Iran ngày 5/7, lãnh tụ tối cao Iran Ali Khamenei vẫy chào mọi người trong tiếng hò reo tại nhà thờ Hồi giáo Imam Khomeini ở trung tâm Tehran, khi những người sùng đạo kỷ niệm ngày Ashura, ngày linh thiêng nhất trong lịch của người Hồi giáo dòng Shiite. Lãnh tụ tối cao Iran Ali Khamenei tham gia một buổi lễ tôn giáo tại nhà thờ Hồi giáo ở thủ đô Tehran ngày 5/7. Video:Press TV Ông Khamenei, 86 tuổi, xuất hiện trên sân khấu trong trang phục màu đen khi đám đông giơ nắm tay và hô vang ""Máu trong huyết quản chúng ta dành cho lãnh tụ của chúng ta"". Nhà thờ Imam Khomeini được đặt theo tên người sáng lập nước Cộng hòa Hồi giáo Iran. Ông Khamenei, nắm quyền từ năm 1989, tuần trước có bài phát biểu trong video được ghi hình trước, nhưng không xuất hiện trước công chúng kể từ trước khi Israel không kích phủ đầu Iran ngày 13/6. Lần xuất hiện công khai gần nhất của ông là vào ngày 11/6, khi lãnh tụ tối cao gặp gỡ các thành viên quốc hội. Chiến dịch ném bom của Israel diễn ra sau cuộc chiến ngầm kéo dài hàng thập kỷ với Iran, với lý do ngăn chặn Tehran phát triển vũ khí hạt nhân. Trong khi đó, Iran nhiều lần khẳng định chương trình hạt nhân của nước này chỉ nhằm mục đích hòa bình. Mỹ ngày 22/6 can thiệp vào xung đột Iran - Israel khi điều oanh tạc cơ B-2 không kích ba cơ sở hạt nhân của Iran rồi đề nghị Tehran ngồi vào bàn đàm phán. Tehran sau đó đáp trả Washington bằng đòn tấn công kiềm chế vào căn cứ Mỹ ở Qatar. Iran và Israel ngày 24/6 chấp nhận ngừng bắn, kết thúc 12 ngày giao tranh và đều mô tả mình là bên thắng cuộc. Xung đột khiến hơn 900 người chết, hơn 4.700 người bị thương ở Iran và 28 người chết, hơn 2.500 người bị thương ở Israel. Tel Aviv đã hạ sát hàng chục chỉ huy quân sự cấp cao và nhà khoa học hạt nhân của Tehran. Thủ tướng Israel thậm chí còn từng nêu khả năng ám sát ông Ali Khamenei. Những ngày giao tranh diễn ra, lãnh tụ tối cao Iran được cho là ở một địa điểm an toàn. Trong bài phát biểu vài ngày sau khi lệnh ngừng bắn có hiệu lực, ông Khamenei tuyên bố Iran đã đánh bại cả Israel và Mỹ. Ông cũng khẳng định Iran sẽ không đầu hàng Mỹ. Huyền Lê(TheoAFP,Reuters)","Chủ nhật, 6/7/2025, 06:34 (GMT+7)",Huyền Lê,Thế giới,Phân tích,VN Express,"Ngày 5/7, Lãnh tụ tối cao Iran Ali Khamenei xuất hiện trước công chúng tại nhà thờ Imam Khomeini ở Tehran trong lễ kỷ niệm Ashura, đánh dấu lần đầu xuất hiện sau cuộc không kích của Israel và những đồn đoán về tình hình sức khỏe của ông. Sự kiện diễn ra sau thời gian căng thẳng giữa Iran và Israel, bao gồm các cuộc tấn công và phản công, với sự can thiệp của Mỹ. Trong bài phát biểu sau lệnh ngừng bắn, ông Khamenei tuyên bố Iran đã đánh bại cả Israel và Mỹ, đồng thời khẳng định nước này sẽ không đầu hàng Mỹ. Sự xuất hiện này được xem như một động thái trấn an dư luận và thể hiện sự kiên định của lãnh đạo Iran."
VNEX_060725_00066,"Peugeot 408 có thêm bản Legend Edition, giá tăng 20 triệu đồng",https://vnexpress.net/peugeot-408-co-them-ban-legend-edition-gia-tang-20-trieu-dong-4910420.html,"Ngày 4/7, hãng xe PhápPeugeotra mắt mẫu 408 phiên bản giới hạn mang tên Legend Edition đến thị trường Việt Nam. Xe được sản xuất giới hạn với số lượng 215 chiếc, đánh dấu 215 năm ra đời của thương hiệu (1810-2025), giá bán đắt hơn phiên bản408thông thường 20 triệu đồng. Về cơ bản, biến thể Legend Edition không có sự khác biệt về kiểu dáng, động cơ, hệ truyền động so với mẫu 408 đã ra mắt vào tháng 10/2023. Sự thay đổi nằm ở các chi tiết nhỏ trên ngoại thất và nội thất. 408 Legend Edition được bổ sung màu sơn xám mới mang lên Selenium Grey, và nội thất màu nâu, thay vì đen như trước đó. Đuôi xe được gắn thêm bảng nhận diện phiên bản, kèm số thứ tự từ 001 đến 215. Trong khoang lái, logo sư tử sải bước theo mũi tên đầu tiên của Peugeot, kèm con số 215 được dập chìm trên mỗi tựa đầu ghế. Peugeot 408 thuộc phân khúc crossover cỡ C, dùng chung nền tảng khung gầm với 3008, mẫu xe cũng đang bán ở Việt Nam nhưng thiết kế nội, ngoại thất không có liên hệ nào. Kích thước dài x rộng x cao của 408 lần lượt 4.690 x 1.850 x 1.480 mm, khoảng sáng gầm 189 mm. So với 3008 (4.510 x 1.850 x 1.650 mm), 408 dài và thấp hơn, chiều rộng tương đương. 408 là mẫu xe gầm cao phong cách coupe duy nhất trong phân khúc cỡ C. Xe trang bị động cơ 1.6 Turbo PureTech công suất 218 mã lực, mô-men xoắn 300Nm, hộp số tự động 8 cấp. Hệ thống an toàn tiêu chuẩn trên xe có các tính năng như cân bằng điện tử, hỗ trợ khởi hành ngang dốc, cảm biến và camera lùi, điều khiển hành trình, cảnh báo va chạm phía trước, cảnh báo lệch làn và hỗ trợ giữ làn. Hai bản cao nhất có thêm cảnh báo điểm mù, cảnh báo phương tiện cắt ngang khi lùi và hỗ trợ chuyển làn. Khách hàng có thể chọn biến thể Legend Edition cho tất cả phiên bản 408 đang bán, bao gồm Allure, Premium và GT. Giá bán đắt hơn 20 triệu đồng, lần lượt là 1,039 tỷ đồng, 1,139 tỷ đồng và 1,289 tỷ đồng, và được chọn số theo ý muốn khi đặt hàng. Giá bán của mẫu xe Pháp này vượt hơn hẳn so các đối thủ thuần crossover nhưMazda CX-5(749-999 triệu đồng),Hyundai Tucson(769-989 triệu đồng). Hồ Tân","Chủ nhật, 6/7/2025, 05:56 (GMT+7)",Hồ Tân,Xe,Thị trường,VN Express,"Ngày 4/7, Peugeot Việt Nam ra mắt phiên bản giới hạn 408 Legend Edition, sản xuất 215 chiếc để kỷ niệm 215 năm thành lập hãng. Xe không thay đổi về kiểu dáng và động cơ so với bản thường, chỉ khác biệt ở màu sơn, nội thất nâu và logo đặc biệt. Peugeot 408 Legend Edition thuộc phân khúc crossover cỡ C, trang bị động cơ 1.6 Turbo PureTech, hệ thống an toàn đầy đủ và có giá cao hơn 20 triệu đồng so với các phiên bản thường. Người mua có thể chọn phiên bản Legend Edition cho tất cả các phiên bản 408 và chọn số thứ tự xe theo ý muốn."
VNEX_060725_00016,Enrique: 'PSG không phải đội bóng bạo lực',https://vnexpress.net/enrique-psg-khong-phai-doi-bong-bao-luc-4910674.html,"Ngoài chuyên môn, điểm nhấn của trận đấu trên sân Mercedes-Benz hôm 5/7 là những tấm thẻ đỏ cũng như chấn thương nặng củaJamal Musiala. Phút bù hiệp một, tiền vệ người Đức nỗ lực cứu bóng, va chạm mạnh với thủ thànhGianluigi Donnarummarồi nằm xuống đau đớn với cổ chân biến dạng. Phút 82, Willian Pacho nhận thẻ đỏ trực tiếp sau pha vào bóng thô bạo với Leno Goretzka ở giữa sân. Phút bù giờ, đến lượt Lucas Hernandez bị truất quyền vì đánh nguội Raphael Guerreiro ngay trước mặt trọng tài Anthony Taylor. Pha va chạm với thủ thành Gianluigi Donnarumma dẫn đến chấn thương nặng của Jamal Musiala. Ảnh:Reuters ""Musiala không may bị Donnarumma ngã đè lên"", Enrique nói sau trận và chúc tiền vệ của Bayern sớm bình phục. ""Chấn thương xảy ra trong thể thao đỉnh cao. Không có ý định xấu nào cả. Chúng tôi không phải là CLB bạo lực hay thích phạm lỗi"". Nhà cầm quân Tây Ban Nha cho rằng trọng tài có những quyết định kỳ lạ, bất lợi choPSGsau chấn thương nặng của Musiala. Nhưng ông thừa nhận Pacho đáng bị đuổi sau pha vào bóng với Goretzka. ""Đấu với Bayern khi đủ 11 người đã rất khó rồi. Khi còn 9 người thì chẳng khác nào chơi xổ số cả"", Enrique nói. Thiếu hai người, PSG vẫn hạ Bayern nhờ hai bàn cuối trận. Phút 78, Desire Doue đột phá rồi dứt điểm từ ngoài vòng cấm vào góc gần, đánh lừa Manuel Neuer - thủ thành bị Jonathan Tah che khuất tầm nhìn. Phút bù thứ sáu, Achraf Hakimi đột phá qua ba cầu thủ Bayern rồi kiến tạo cho Ousmane Dembele sút chéo góc ấn định chiến thắng 2-0. Enriqueca ngợi PSG thi đấu bền bỉ và thể hiện nỗ lực tuyệt vời. ""Chúng tôi chứng minh mình là tập thể khó bị đánh bại"", HLV 55 tuổi nói. ""Chúng tôi chơi tốt cả khi có và không có bóng"". HLV Luis Enrique mừng sau trận PSG thắng Bayern Munich 2-0 ở tứ kết FIFA Club World Cup trên sân Mercedes Benz, Atlanta, Mỹ ngày 5/7/2025. Ảnh:Elgrafico Trong khi đó, đội trưởng Marquinhos nhấn mạnh PSG ra sân với quyết tâm phục thùthất bại 0-1 trước Bayernở vòng bảng Champions League diễn ra trên sân Allianz ngày 26/11/2024. ""Chúng tôi có việc cần giải quyết với Bayern và rất muốn thắng trận này"", hậu vệ người Brazil nói. ""Thẻ đỏ là chi tiết mà chúng tôi cần phải xử lý. Việc thi đấu thiếu người có thể khiến cục diện trận đấu thay đổi. Nhưng chúng tôi tiếp tục nỗ lực và ghi bàn thắng thứ hai ngay cả khi thiếu người. Đội đã sẵn sàng cho mọi thứ"". Achraf Hakimithì nói ""Chúng tôi đã trải qua rất nhiều thời điểm khó khăn mùa này nhưng cả đội đã cho thấy bản lĩnh và cá tính, sự đoàn kết trong nghịch cảnh. Chúng tôi muốn tiếp tục ở lại giải đấu này và là ứng viên vô địch"". Diễn biến chính trận PSG 2-0 Bayern Munich. Hồng Duytổng hợp","Chủ nhật, 6/7/2025, 07:28 (GMT+7)",Hồng Duy,Thể thao,Fifa Club World Cup 2025,VN Express,"Trận đấu giữa PSG và Bayern Munich diễn ra căng thẳng với nhiều điểm nhấn ngoài chuyên môn như chấn thương nặng của Musiala và ba thẻ đỏ. PSG đã giành chiến thắng 2-0 nhờ sự tỏa sáng của Doue và Dembele trong bối cảnh thiếu người. HLV Enrique ca ngợi tinh thần chiến đấu của PSG, trong khi Marquinhos nhấn mạnh quyết tâm phục thù của đội trước Bayern."
VNEX_060725_00056,Những màn diễn 'bốc lửa' ở show tái xuất của Blackpink,https://vnexpress.net/nhung-man-dien-boc-lua-o-show-tai-xuat-cua-blackpink-4910686.html,"Bốn cô gái Jisoo, Jennie, Lisa và Rosé mở đầu tour thế giớiDeadlinebằng đêm diễn tại Goyang, Gyeonggi-do tối 5/7. Ban tổ chức bố trí màn diễn drone, ghi những dấu ấn quan trọng trong sự nghiệp của Blackpink, từ lúc thành lập nhóm ngày 8/8/2016 đến nay. Bốn cô gái Jisoo, Jennie, Lisa và Rosé mở đầu tour thế giớiDeadlinebằng đêm diễn tại Goyang, Gyeonggi-do tối 5/7. Ban tổ chức bố trí màn diễn drone, ghi những dấu ấn quan trọng trong sự nghiệp của Blackpink, từ lúc thành lập nhóm ngày 8/8/2016 đến nay. Trình diễn drone ở liveshow. Bốn ca sĩ được khán giả nhận xét tràn sức sống, biểu diễn sôi động. Trang phục trình diễn cũng được đánh giá đa dạng, sành điệu. Bốn ca sĩ được khán giả nhận xét tràn sức sống, biểu diễn sôi động. Trang phục trình diễn cũng được đánh giá đa dạng, sành điệu. Lisa ở tour Deadline Các video của Lisa được hàng chục nghìn khán giả chia sẻ trên các mạng xã hội. Lisa biến hóa trên sân khấu, khi nhí nhảnh, khi tạo vẻ quyến rũ. Blackpink ra mắt tháng 8/2016 và được đánh giá là nhóm nhạc thành công bậc nhất của công ty giải trí YG. TheoElle, bốn thành viên đều xây dựng được tầm ảnh hưởng toàn cầu ở lĩnh vực âm nhạc, thời trang. Năm 2023, tourBorn Pinktoàn cầu của nhóm gây tiếng vang trong làng nhạc quốc tế. Lisa biến hóa trên sân khấu, khi nhí nhảnh, khi tạo vẻ quyến rũ. Blackpink ra mắt tháng 8/2016 và được đánh giá là nhóm nhạc thành công bậc nhất của công ty giải trí YG. TheoElle, bốn thành viên đều xây dựng được tầm ảnh hưởng toàn cầu ở lĩnh vực âm nhạc, thời trang. Năm 2023, tourBorn Pinktoàn cầu của nhóm gây tiếng vang trong làng nhạc quốc tế. Trên các fanpage, nhiều khán giả nhận xét Rosé đột phá về giọng hát, thể hiện sự trưởng thành rõ rệt trong phong cách âm nhạc lẫn trình diễn. Cuối năm 2023, bốn thành viên Lisa, Jennie, Jisoo và Rosé ký hợp đồng mới với YG, theo đó, họ vẫn duy trì nhóm song được quyền ký hợp đồng cá nhân với công ty khác. Lisa, Jennie, Jisoo đều thành lập công ty riêng để quản lý công việc cá nhân, ra các MV riêng. Trên các fanpage, nhiều khán giả nhận xét Rosé đột phá về giọng hát, thể hiện sự trưởng thành rõ rệt trong phong cách âm nhạc lẫn trình diễn. Cuối năm 2023, bốn thành viên Lisa, Jennie, Jisoo và Rosé ký hợp đồng mới với YG, theo đó, họ vẫn duy trì nhóm song được quyền ký hợp đồng cá nhân với công ty khác. Lisa, Jennie, Jisoo đều thành lập công ty riêng để quản lý công việc cá nhân, ra các MV riêng. Jennie hút fan ở vẻ quyến rũ. Jennie hút fan ở vẻ quyến rũ. Jisoo lau mồ hôi cho JennieJisoo lau mồ hôi cho Jennie. Jisoo (trái) và Jennie. Nhiều fan cho biết cảm động khi thấy các cô gái thân thiết, quan tâm nhau. ""Đêm nhạc như một giấc mơ, đẹp mắt, cảm giác rất đã sau thời gian dài chờ đợi. Nhóm thực sự làm chủ sân khấu"", khán giả Soraru viết trênRednote. Jisoo (trái) và Jennie. Nhiều fan cho biết cảm động khi thấy các cô gái thân thiết, quan tâm nhau. ""Đêm nhạc như một giấc mơ, đẹp mắt, cảm giác rất đã sau thời gian dài chờ đợi. Nhóm thực sự làm chủ sân khấu"", khán giả Soraru viết trênRednote. Jisoo được khen sắc vóc ngọt ngào ở tuổi 30. Jisoo được khen sắc vóc ngọt ngào ở tuổi 30. Màn trình diễn solo của Jisoo ở liveshow dẫn đầu chủ đề hot trên mạng xã hộiRednoteở Trung Quốc. Sau buổi diễn, Jisoo viết trên trang cá nhân: ""Nóng quá, nóng muốn xỉu, mọi người ổn cả chứ? Hôm nay chúng tôi còn nhiều thiếu sót, nhưng thiếu sót cũng tạo nên sự đáng yêu của concert đầu tiên. Chúng tôi sẽ cố gắng hơn ngày mai, yêu các bạn"". Màn trình diễn solo của Jisoo ở liveshow dẫn đầu chủ đề hot trên mạng xã hộiRednoteở Trung Quốc. Sau buổi diễn, Jisoo viết trên trang cá nhân: ""Nóng quá, nóng muốn xỉu, mọi người ổn cả chứ? Hôm nay chúng tôi còn nhiều thiếu sót, nhưng thiếu sót cũng tạo nên sự đáng yêu của concert đầu tiên. Chúng tôi sẽ cố gắng hơn ngày mai, yêu các bạn"". Nhóm trình diễn 25 ca khúc trong ba tiếng, khoảng 40.000 khán giả cổ vũ ở sân vận động. Sau Hàn Quốc,Blackpinklưu diễn tại Mỹ, Pháp, Italy, Anh, Thái Lan, Singapore, Nhật Bản, Hong Kong. Nhóm trình diễn 25 ca khúc trong ba tiếng, khoảng 40.000 khán giả cổ vũ ở sân vận động. Sau Hàn Quốc,Blackpinklưu diễn tại Mỹ, Pháp, Italy, Anh, Thái Lan, Singapore, Nhật Bản, Hong Kong. Như AnhẢnh, video:Blackpink Era","Chủ nhật, 6/7/2025, 09:28 (GMT+7)",Như Anh,Giải trí,Nhạc,VN Express,"Blackpink đã mở đầu tour diễn thế giới bằng một đêm diễn ấn tượng tại Goyang, Gyeonggi-do, với màn trình diễn drone tái hiện những dấu mốc quan trọng trong sự nghiệp của nhóm. Bốn thành viên Jisoo, Jennie, Lisa và Rosé được đánh giá cao về năng lượng, phong cách trình diễn và thời trang, đặc biệt Lisa gây ấn tượng với sự biến hóa đa dạng trên sân khấu. Sau thành công của tour Born Pink năm 2023, các thành viên Blackpink đã ký hợp đồng mới với YG, cho phép họ phát triển sự nghiệp cá nhân và thành lập công ty riêng, đồng thời vẫn duy trì hoạt động nhóm. Đêm diễn đã mang đến nhiều cảm xúc cho khán giả, thể hiện sự gắn bó giữa các thành viên và khẳng định vị thế của Blackpink trong làng nhạc quốc tế."
