id,title,link,content,date,author,category,sub_category,source,summary
VNEX_240725_00100,Honda Việt Nam tung ưu đãi cho xe gắn máy điện,https://vnexpress.net/honda-viet-nam-tung-uu-dai-cho-xe-gan-may-dien-4918235.html,"Điểm nhấn trong ưu đãi lần này của Honda Việt Nam là mẫu xe gắn máy điện ICON e:. Theo đó, người mua sẽ nhận ưu đãi voucher phụ kiện trị giá 2 triệu đồng (áp dụng tại HEAD) hoặc trả góp 0% lãi suất thông qua các công ty tài chính. Xe gắn máy điện Honda ICON e:. Ảnh:HVN Đây là mẫu xe gắn máy điện đầu tiên được Honda Việt Nam bán ra, dùng pin lithium-ion chuẩn chống nước IP67, có thể sạc trên xe hoặc tháo rời pin. ICON e: được hãng Nhật tích hợp hệ thống phanh kết hợp CBS, đèn chiếu sáng LED, cốp dung tích 26 lít, hộc đồ phía trước có cổng sạc USB và màn hình LCD. Xe có ba phiên bản Thể thao (27,3 triệu), Đặc biệt (27,1 triệu) và Cao cấp (26,9 triệu), đã bao gồm VAT. Đại diện Honda Việt Nam cho biết, ưu đãi trên áp dụng cho ICON e: từ 15/7 đến 15/10, tại hệ thống HEAD trên toàn quốc. Honda ICON e: hướng đến nhóm người dùng học sinh, sinh viên. Ảnh:HVN Chương trình ưu đãi lần này cũng áp dụng cho các dòng xe máy. Wave Alpha, Blade và Wave RSX nhận ưu đãi thẻ điện thoại 500.000 đồng hoặc voucher mua phụ kiện 600.000 đồng. Vision nhận 2 thẻ điện thoại 500.000 đồng hoặc smartwatch Samsung hoặc trả góp 0%. Với Winner X, hãng Nhật áp dụng ưu đãi tặng smartphone Samsung Galaxy A06 hoặc trả góp 0%. Với SH125i/ SH160i, người mua sẽ nhận tai nghe Samsung Galaxy hoặc voucher phụ kiện 1,6 triệu đồng. Xe côn tay Winner X. Ảnh:HVN Năm tài chính 2025 (kết thúc vào 31/3/2025), Honda Việt Nam bán ra thị trường gần 2,3 triệu xe máy, chiếm khoảng 83% thị phần trong Hiệp hội các Nhà sản xuất xe máy Việt Nam (VAMM), tăng 1,6% so với năm trước đó. Trong thời gian này, hãng Nhật ra mắt 13 xe máy mới, gồm hai mẫu điện hóa đầu tiên là ICON e: và CUV e: (hình thức cho thuê). Quang Anh","Thứ năm, 24/7/2025, 09:30 (GMT+7)",Quang Anh,Xe,Thị trường,VN Express,"Honda Việt Nam đang triển khai chương trình ưu đãi từ 15/7 đến 15/10 cho nhiều dòng xe máy, đặc biệt là xe điện ICON e: với voucher phụ kiện hoặc trả góp 0%. Các dòng xe khác như Wave, Vision, Winner X và SH cũng có các ưu đãi khác nhau như thẻ điện thoại, phụ kiện, smartwatch hoặc smartphone. Trong năm tài chính 2025, Honda Việt Nam chiếm 83% thị phần xe máy tại Việt Nam và ra mắt 13 mẫu xe mới, bao gồm cả xe điện."
VNEX_240725_00121,Giá đất nền phía Nam vẫn neo cao,https://vnexpress.net/gia-dat-nen-phia-nam-van-neo-cao-4917995.html,"Theo báo cáo quý II của chuyên trang Batdongsan, sau giai đoạn tăng nóng nhờ kỳ vọng vào sáp nhập đơn vị hành chính, thị trường đất nền bước vào giai đoạn điều chỉnh rõ rệt. Trong quý II, lượt tìm kiếm đất nền trên cả nước giảm 19% so với quý trước - mức giảm sâu nhất trong các phân khúc bất động sản. Tại TP HCM (cũ), nhu cầu mua đất nền giảm 28%, trong khi các địa phương phía Nam khác như Tây Ninh (Long An cũ), Bình Dương và Đồng Nai cũ cũng ghi nhận lượt tìm kiếm giảm 30-33%. Cùng với đó, lượng tin đăng rao bán đất nền giảm từ 3-9%, cho thấy cả người bán lẫn người mua đều đang thận trọng hơn. Không chỉ nhu cầu giảm, thanh khoản thị trường cũng xuống thấp. Báo cáo của DKRA Group cho biết trong quý II, toàn khu vực phía Nam chỉ tiêu thụ được 446 nền đất trên tổng nguồn cung sơ cấp khoảng 6.415 nền, tỷ lệ hấp thụ vỏn vẹn 7%. Hơn 95% nguồn hàng mở bán là sản phẩm tồn kho từ các quý trước, phần lớn có giá dao động từ 9-70 triệu đồng mỗi m2. Chỉ khoảng 5% là hàng mới và mức giá cũng không hề thấp. Tuy nhiên, nghịch lý là trong bối cảnh giao dịch chững lại, mặt bằng giá đất nền không những không giảm mà còn tiếp tục duy trì ở vùng cao. Theo Batdongsan ghi nhận, trong tháng 3, giá đất nền tại một số khu vực phía Nam đã tăng bình quân 30-40%. Tuy nhiên, sau cơn sốt sáp nhập tỉnh, giá đất chỉ giảm nhẹ tầm 10-15% trên nền giá đã tăng và neo ở khoảng khá cao so với cùng kỳ 2024. Còn giá đất nền tại các khu vực TP HCM (Bình Dương và Bà Rịa – Vũng Tàu cũ), Tây Ninh (Long An cũ), Đồng Nai, Cần Thơ hiện vào khoảng 16-31 triệu đồng mỗi m2, tăng trung bình 18-25% so với cùng kỳ năm ngoái. Còn theo DKRA Group, nhiều dự án đất nền thậm chí vẫn đang tăng khoảng 4-7% so với quý trước, bất chấp thanh khoản vẫn còn khó khăn. Bất động sản khu Đông TP HCM với các dự án đất nền, nhà phố. Ảnh:Quỳnh Trần Báo cáo của VARS cũng ghi nhận mức tăng giá đất nền phổ biến từ 30-40% trong giai đoạn đầu năm tại nhiều khu vực nhờ hiệu ứng sáp nhập tỉnh. Từ tháng 5 thị trường bắt đầu điều chỉnh, nhưng giá bán trên thị trường sơ cấp gần như không giảm, do phần lớn chủ đầu tư đã ""găm hàng"" và không chịu hạ giá, trong khi giao dịch thứ cấp lại ảm đạm. Theo ông Đinh Minh Tuấn, Giám đốc Batdongsan khu vực miền Nam, thị trường đất nền hiện đã chuyển sang trạng thái ""nghe ngóng"", nhà đầu tư không còn chủ động săn hàng như giai đoạn đầu năm. Nếu quý I ghi nhận sự tăng mạnh cả về cung lẫn cầu, từ sau đợt ""thoát hàng"" đầu tháng 4, giao dịch gần như chững lại. Một khảo sát của Batdongsan cho thấy, chỉ khoảng 19% nhà đầu tư có ý định mua đất nền trong các tháng còn lại của năm, trong khi gần 40% đánh giá thị trường quý II ảm đạm hơn quý trước. Phần lớn tâm lý này xuất hiện ở khu vực phía Nam, nơi từng là tâm điểm của cơn sốt hồi tháng 3 và 4. Báo cáo của Hội Môi giới Bất động sản Việt Nam (VARS) cũng chỉ ra, giá đất nền từng tăng tới 40% chỉ trong vài tuần đầu năm, do nhà đầu tư kỳ vọng việc sáp nhập tỉnh và điều chỉnh quy hoạch hành chính sẽ giúp nâng giá trị tài sản. Có dự án tăng giá tới 10% chỉ sau một đêm mà vẫn bán được. Tuy nhiên, từ giữa tháng 4 trở đi, thị trường bắt đầu hạ nhiệt nhanh chóng, đặc biệt ở các khu vực ngoài vùng quy hoạch trọng điểm. Ngoài yếu tố kỳ vọng sáp nhập tỉnh, thị trường đất nền còn chịu ảnh hưởng từ nhiều yếu tố khác. Theo ông Tuấn, những thông tin liên quan đến đề xuất đánh thuế bất động sản, chính sách thắt chặt tín dụng, chi phí vay vốn cao và kỳ nghỉ lễ kéo dài cuối tháng 4 đều tác động tiêu cực đến tâm lý người mua. Đồng thời, hơn 75% nhà đầu tư đất nền thừa nhận phải vay từ 30–70% giá trị tài sản, trong khi ngân hàng hiện vẫn thận trọng với các khoản vay mang tính đầu cơ. Đất nền là phân khúc phụ thuộc nhiều vào đòn bẩy tài chính, vì vậy khi lãi suất chưa thực sự giảm mạnh và chính sách chưa rõ ràng, thị trường sẽ khó sớm phục hồi mạnh về thanh khoản. Về việc mặt bằng giá đất nền vẫn khó giảm, theo chuyên gia một phần do nhà đầu tư không chịu xả hàng cắt lỗ, phần khác đến từ chi phí đầu vào cao và kỳ vọng dài hạn vào hạ tầng – quy hoạch. Tình trạng mất cân đối cung - cầu khiến giá sơ cấp tiếp tục neo ở vùng cao, đặc biệt tại các dự án đã hoàn thiện pháp lý. Dự báo trong quý III, theo DKRA Group nguồn cung đất nền có thể tăng nhẹ so với quý II, với khoảng 450-550 sản phẩm mở bán mới. Long An (cũ), Bình Dương (cũ), Đồng Nai (cũ) và các dự án bước vào giai đoạn tiếp theo vẫn được kỳ vọng là nguồn cung chủ lực. Ngoài ra, các chính sách hỗ trợ như nới lỏng tín dụng, giảm thuế phí và thúc đẩy giải ngân đầu tư công có thể giúp cải thiện sức mua, nhất là ở phân khúc phục vụ nhu cầu ở thực. Thị trường thứ cấp cũng được dự báo sẽ tích cực hơn về thanh khoản và giá bán trong quý III, nhờ các dự án pháp lý hoàn thiện và có mức độ tạo thị tốt. Tuy vậy, xu hướng đầu tư ngắn hạn lướt sóng nhiều khả năng sẽ chưa quay lại sớm, giá đất nền sẽ đi ngang nhưng khó giảm sâu do đã bước vào giai đoạn ổn định từ quý III sau quý II hạ nhiệt. Phương Uyên","Thứ năm, 24/7/2025, 01:10 (GMT+7)",Phương Uyên,Bất động sản,Thị trường,VN Express,"Thị trường đất nền quý II ghi nhận sự điều chỉnh mạnh sau giai đoạn tăng nóng đầu năm do kỳ vọng sáp nhập đơn vị hành chính, thể hiện qua việc giảm lượt tìm kiếm và lượng tin đăng. Mặc dù nhu cầu và thanh khoản giảm sâu, đặc biệt ở khu vực phía Nam, giá đất nền vẫn neo ở mức cao và thậm chí tiếp tục tăng ở một số dự án. Nguyên nhân chính là do chủ đầu tư găm hàng và không chịu hạ giá, trong khi nhà đầu tư trở nên thận trọng và có tâm lý ""nghe ngóng"" thị trường. Điều này cho thấy sự mất cân đối giữa cung và cầu, đồng thời tiềm ẩn rủi ro cho thị trường đất nền trong thời gian tới."
VNEX_240725_00001,Nhiều cách làm hay ở các trung tâm hành chính TP HCM sau sáp nhập,https://vnexpress.net/nhieu-cach-lam-hay-o-cac-trung-tam-hanh-chinh-tp-hcm-sau-sap-nhap-4918152.html,"""Quầy người dân tự phục vụ"" - tấm bảng nhỏ đặt ngay lối vào trung tâm - là nơi bày sẵn đồ ăn nhẹ, bình nước nóng lạnh, dụng cụ dùng một lần và bộ bàn trà với ấm chè xanh dành cho người dân lót dạ khi đến làm thủ tục hành chính chưa kịp ăn sáng hoặc chờ đợi lâu. Anh Hiệp, nhà ở phường Phước Long, cách đó gần 15 km, đi từ sớm để làm thủ tục xóa thế chấp nhưng bị kẹt xe. Khi đến nơi, nhiều người đã xếp hàng chờ ở quầy nhà đất. ""Là người làm dịch vụ, đi nhiều nơi, nhưng đây là lần đầu tôi thấy chính quyền chuẩn bị đồ ăn nhẹ cho người dân đến làm thủ tục"", anh Hiệp nói. Anh Vũ Hiệp (áo xanh) nói chuyện với ông Võ Thanh Bình, Phó giám đốc Trung tâm phục vụ hành chính công phường Tân Đông Hiệp, bên bàn trà, bánh được chuẩn bị sẵn, ngày 22/7. Ảnh:Lê Tuyết Tân Đông Hiệp là một trong 10 phường thuộc khu vực Bình Dương cũ được sáp nhập về TP HCM, hiện triển khai phục vụ người dân bằng đồ ăn nhẹ tại trung tâm hành chính. Theo ông Võ Thanh Bình, Phó giám đốc trung tâm, mô hình được thử nghiệm từ ngày 9/6 và duy trì sau khi đưa vào vận hành chính thức từ 1/7. Phường có diện tích hơn 21 km2, dân số trên 100.000 người, nhiều thủ tục hành chính mới, cán bộ chưa thuần thục quy trình, người dân ở xa, có người dẫn theo trẻ nhỏ... nên việc tạo không khí thân thiện là điều cần thiết. Nguồn chi phí được xã hội hóa, mỗi ngày khoảng 400.000 đồng. ""Kinh phí không lớn nhưng hiệu quả rõ rệt. Người dân thấy chính quyền thân thiện, chu đáo, giảm căng thẳng khi làm thủ tục"", ông Bình nói. Cách đó gần 20 km, tại Trung tâm phục vụ hành chính công phường Phú Nhuận, bà Thùy Trang, 57 tuổi, được một sinh viên hỗ trợ kê khai trích lục khai sinh lên Cổng dịch vụ công quốc gia. Sinh viên Lê Khánh, 20 tuổi, Đại học Tài chính -Marketing, hướng dẫn bà thao tác trực tuyến, sử dụng VNeID, quét mã QR, thanh toán online... Lê Khánh (giữa) và cán bộ Trung tâm hành chính công phường Phú Nhuận, hỗ trợ bà Trang nhập thông tin lên Cổng dịch vụ công quốc gia, ngày 23/7. Ảnh:Lê Tuyết Trong buổi sáng, Khánh đã giúp bốn người dân, phần lớn là người lớn tuổi chưa quen công nghệ hoặc thông tin giấy tờ chưa cập nhật. ""Tôi không biết dùng máy tính, được các cháu giúp tận tình nên vui lắm"", bà Trang nói sau khi hoàn tất thủ tục. Phường Phú Nhuận hiện bố trí 3 bàn hỗ trợ trực tuyến với 3-5 tình nguyện viên thường trực, cùng một cán bộ chuyên môn. Mỗi ngày, trung tâm tiếp nhận 200-300 hồ sơ, phần lớn là thủ tục hộ tịch, chứng thực, bảo trợ xã hội. Nhiều hồ sơ yêu cầu thực hiện trên nền tảng số, trong khi không ít người dân, nhất là người già, gặp khó khăn. Ngoài hỗ trợ tại trung tâm, phường đang lập tổ công nghệ số tại các khu phố, bố trí máy tính, tình nguyện viên hỗ trợ tận nơi cho người không có thiết bị hoặc không biết thao tác. Bà Nguyễn Thị Thanh Trâm, Phó giám đốc trung tâm, cho biết việc triển khai mô hình này không chỉ giúp người dân tiết kiệm thời gian mà còn giúp cơ quan hành chính vận hành hiệu quả hơn, giảm áp lực tiếp nhận trực tiếp tại phường. Theo ghi nhận, sau ba tuần triển khai mô hình chính quyền hai cấp, nhiều địa phương ở TP HCM có sáng kiến để phục vụ người dân tốt hơn. Tại phường Thủ Đức, trung tâm hành chính đưa vào sử dụng hairobot lễ tânhỗ trợ phát số, hướng dẫn quy trình và phục vụ nước uống. Robot lễ tân hỗ trợ người dân ở phường Thủ Đức, tháng 7/2025. Ảnh:Quỳnh Trần Một số phường mới sáp nhập như Diên Hồng, Tân Mỹ tạo ấn tượng với khu vực chờ thông thoáng, cán bộ giao tiếp lịch sự, nhiệt tình. Xã Long Hải triển khai mô hình ""một kèm một"", bố trí đoàn viên, dân quân và tình nguyện viên giúp người dân thao tác điện tử, điền hồ sơ, tra cứu VNeID. Ngoài ra, TP HCM hiện duy trì 41 điểm tiếp nhận và trả kết quả thủ tục hành chính, trong đó có 38 tổ địa bàn thuộc Trung tâm hành chính công thành phố. Mỗi tổ gồm 5 cán bộ từ các sở như Xây dựng, Tài chính, Tài nguyên - Môi trường, vừa tiếp nhận hồ sơ cấp thành phố, vừa hỗ trợ xã, phường xử lý và hướng dẫn nghiệp vụ. Mục tiêu là bảo đảm phục vụ thông suốt, không gián đoạn, hướng tới mô hình hành chính phi địa giới toàn diện vào cuối năm 2025. Theo bà Phạm Thị Thanh Hiền, Giám đốc Sở Nội vụ TP HCM, bên cạnh các cách làm sáng tạo nhằm phục vụ người dân số hơn, một số nơi vẫn gặp khó khăn như chưa rõ ràng về thẩm quyền xử lý, thiếu nhân sự, phần mềm chưa đồng bộ, một bộ phận cán bộ còn giữ thói quen làm việc cũ. Thành phố đang rà soát và tháo gỡ từng bước để hoàn thiện mô hình. Về lâu dài, TP HCM sẽ nhân rộng các cách làm hiệu quả, đẩy mạnh chuyển đổi số, cải tiến cách phối hợp giữa các cơ quan và tiếp tục đào tạo đội ngũ để xây dựng nền hành chính hiện đại, năng động và gần dân hơn. Lê Tuyết","Thứ năm, 24/7/2025, 10:00 (GMT+7)",Lê Tuyết,Thời sự,Kỷ nguyên mới,VN Express,"Phường Tân Đông Hiệp (TP.HCM) triển khai mô hình ""quầy người dân tự phục vụ"" với đồ ăn nhẹ và trà nước miễn phí, tạo sự thân thiện và giảm căng thẳng cho người dân đến làm thủ tục hành chính. Song song đó, phường Phú Nhuận cũng bố trí tình nguyện viên hỗ trợ người dân, đặc biệt là người lớn tuổi, thực hiện các thủ tục trực tuyến và số hóa hồ sơ, giúp tiết kiệm thời gian và giảm áp lực cho cơ quan hành chính. Cả hai mô hình đều nhận được phản hồi tích cực từ người dân, thể hiện sự chu đáo và tận tình của chính quyền."
VNEX_240725_00122,Điểm tin 6h: Áp thấp nhiệt đới mạnh lên thành bão | Thái Lan trục xuất đại sứ Campuchia,https://vnexpress.net/diem-tin-6h-ap-thap-nhiet-doi-manh-len-thanh-bao-thai-lan-truc-xuat-dai-su-campuchia-4918169.html,Liên hệ: 084 666 0123 hoặcpodcast@vnexpress.net.,"Thứ năm, 24/7/2025, 06:19 (GMT+7)",Unknown,Podcasts,,VN Express,Đây là thông tin liên hệ dành cho một podcast của VnExpress. Người nghe có thể liên hệ qua số điện thoại 084 666 0123 hoặc gửi email đến địa chỉ podcast@vnexpress.net. Thông tin này cung cấp các kênh giao tiếp để người nghe có thể tương tác với chương trình podcast.
VNEX_240725_00006,Vợ chồng Tổng thống Pháp kiện podcaster Mỹ,https://vnexpress.net/vo-chong-tong-thong-phap-kien-podcaster-my-4918227.html,"Đơn kiện gửi đến Tòa Thượng thẩm Delaware ngày 23/7 tập trung vào chương trình podcast 8 phần tênBecoming Brigittecủa Candace Owens, nhà bình luận chính trị người Mỹ, podcaster có sức ảnh hưởng trong giới cánh hữu nước này. Theo vợ chồng Tổng thống Emmanuel Macron, chương trình này đã lan truyền ""thông tin sai sự thật, gây tổn hại nghiêm trọng"". Trong đó, Owens cho rằng bà Brigitte, 72 tuổi, đã lấy danh tính của người khác rồi chuyển giới thành nữ, hoặc vợ chồng Macron là họ hàng chung huyết thống. ""Bà Owens mổ xẻ ngoại hình, hôn nhân, bạn bè, gia đình và quá khứ cá nhân của vợ chồng Macron, bóp méo tất cả nhằm kích động, hạ nhục, gây nên một chiến dịch bắt nạt dai dẳng trên quy mô toàn cầu"", đơn kiện có đoạn. Vợ chồng Tổng thống Pháp Emmanuel Macron tại một sự kiện ở London, ngày 9/7. Ảnh:AFP Trong podcast phát cùng ngày, Owens bác cáo buộc, cho biết vụ kiện ""đầy rẫy thông tin sai sự thật"" và là một phần trong chiến dịch truyền thông nhằm bôi nhọ danh tiếng của cô. Owens, 36 tuổi, nói thêm cô không biết trước vụ kiện, dù luật sư hai bên đã liên lạc với nhau từ tháng 1. Owens có hơn 6,9 triệu người theo dõi trên X và hơn 4,5 triệu người đăng ký trên YouTube. Phát ngôn viên của Owens gọi vụ kiện là ""nỗ lực bắt nạt"", sau khi Đệ nhất phu nhân Brigitte liên tục từ chối lời mời phỏng vấn của Owens. ""Một chính phủ nước ngoài đang xâm phạm quyền tự do ngôn luận theo hiến pháp của một nhà báo độc lập người Mỹ"", phát ngôn viên nói. Trong một tuyên bố chung, nhóm luật sư của vợ chồng Macron cho biết họ đệ đơn kiện sau khi Owens từ chối yêu cầu rút lại những phát ngôn phỉ báng. ""Chiến dịch phỉ báng của Owens rõ ràng được thiết kế nhằm quấy rối, làm tổn hại gia đình chúng tôi, đồng thời để gây tai tiếng, chú ý. Chúng tôi đã cho Owens mọi cơ hội để rút lại những tuyên bố đó, nhưng cô ấy đã từ chối"", vợ chồng Macron nói. Podcaster Mỹ Candace Owens phát biểu tại một sự kiện năm 2023. Ảnh:AFP Ở tuổi 15, Emmanuel Macron phải lòng cô giáo dạy kịch 40 tuổi đã lập gia đình Brigitte Auziere tại trường Công giáo Providence ở Amiens vào đầu những năm 1990. Con gái Laurence của bà là bạn cùng lớp của tổng thống Pháp tương lai. Bà Brigitte ly dị chồng cũ năm 2006. Bà kết hôn với ông Macron vào năm 2007 khi 54 tuổi còn ông Macron 29 tuổi. Sau khi ông Macron đắc cử, mối tình chênh hơn 20 tuổi của họ thu hút sự quan tâm của dư luận. Đức Trung(TheoReuters, AFP)","Thứ năm, 24/7/2025, 10:20 (GMT+7)",Đức Trung,Thế giới,Cuộc sống đó đây,VN Express,"Vợ chồng Tổng thống Pháp Emmanuel Macron đã kiện Candace Owens, một podcaster người Mỹ, vì lan truyền thông tin sai lệch và phỉ báng về bà Brigitte Macron trong podcast ""Becoming Brigitte"". Owens bị cáo buộc đã bóp méo thông tin về ngoại hình, hôn nhân và quá khứ của vợ chồng Macron. Owens bác bỏ cáo buộc và cho rằng vụ kiện là nỗ lực bôi nhọ danh tiếng của cô, đồng thời khẳng định quyền tự do ngôn luận của mình. Vợ chồng Macron cho biết họ đệ đơn kiện sau khi Owens từ chối rút lại những phát ngôn phỉ báng, và cáo buộc cô cố tình quấy rối và làm tổn hại gia đình họ."
