id,title,link,content,date,author,category,sub_category,source,summary
VNEX_140725_00001,Quân đội Việt Nam có thêm một đại tướng,https://vnexpress.net/quan-doi-viet-nam-co-them-mot-dai-tuong-4913856.html,"Ông Trịnh Văn Quyết là đại tướng thứ 18 của Quân đội nhân dân Việt Nam kể từ khi thành lập năm 1944 đến nay. Chủ tịch nước Lương Cường trao quyết định thăng quân hàm từ thượng tướng lên đại tướng cho Chủ nhiệm Tổng cục Chính trị Quân đội nhân dân Việt Nam Trịnh Văn Quyết, sáng 14/7. Ảnh:TTXVN Phó tổng tham mưu trưởng Quân đội nhân dân Việt Nam Nguyễn Quang Ngọc cùng ba Thứ trưởng Quốc phòng Nguyễn Hồng Thái, Nguyễn Văn Hiền, Nguyễn Trường Thắng, được thăng quân hàm từ trung tướng lên thượng tướng. Bốn trung tướng quân đội được thăng quân hàm lên thượng tướng. Ảnh:TTXVN Chủ tịch nước Lương Cường cũng trao quyết định thăng cấp bậc hàm từ trung tướng lên thượng tướng với hai Thứ trưởng Công an Phạm Thế Tùng và Nguyễn Ngọc Lâm. Hai Thứ trưởng Công an được thăng cấp bậc hàm từ trung tướng lên thượng tướng. Ảnh:TTXVN Đại tướng Trịnh Văn Quyết59 tuổi, quê ở xã Thanh Quang, huyện Thanh Hà, tỉnh Hải Dương. Ông là cử nhân Xây dựng Đảng và chính quyền Nhà nước, Ủy viên Trung ương Đảng và Bí thư Trung ương Đảng khóa 13. Tháng 5/2016, ông được bổ nhiệm giữ chức Chính ủy Quân khu 2, đồng thời được chỉ định giữ chức Bí thư Đảng ủy Quân khu 2. Tháng 4/2021, ông giữ chức Phó chủ nhiệm Tổng cục Chính trị Quân đội nhân dân Việt Nam. Từ tháng 6/2024 đến nay, ông giữ chức Chủ nhiệm Tổng cục Chính trị Quân đội nhân dân Việt Nam. Tổng cục Chính trị là cơ quan tham mưu chiến lược giúp Bộ Chính trị, Ban Bí thư, trực tiếp là Quân ủy Trung ương, đề ra các chủ trương, biện pháp nhằm tăng cường sự lãnh đạo của Đảng đối với Quân đội, xây dựng Quân đội vững mạnh về chính trị. Vũ Tuân","Thứ hai, 14/7/2025, 09:51 (GMT+7)",Vũ Tuân,Thời sự,Chính trị,VN Express,"Ngày 14/7, Chủ tịch nước Lương Cường đã trao quyết định thăng quân hàm cho nhiều cán bộ cấp cao trong Quân đội nhân dân và Công an nhân dân Việt Nam. Đáng chú ý, ông Trịnh Văn Quyết được thăng từ thượng tướng lên đại tướng, trở thành đại tướng thứ 18 của quân đội. Ngoài ra, bốn trung tướng quân đội và hai trung tướng công an cũng được thăng lên thượng tướng. Ông Trịnh Văn Quyết hiện giữ chức Chủ nhiệm Tổng cục Chính trị Quân đội nhân dân Việt Nam, cơ quan tham mưu chiến lược quan trọng của Đảng đối với quân đội."
VNEX_140725_00006,Cơn thịnh nộ của người ủng hộ ông Trump xoay quanh vụ hồ sơ Epstein,https://vnexpress.net/con-thinh-no-cua-nguoi-ung-ho-ong-trump-xoay-quanh-vu-ho-so-epstein-4912787.html,"Sau khi nhậm chức Bộ trưởng Tư pháp đầu tháng 2, bà Pam Bondi thường xuyên đề cập cuộc điều tra của Bộ Tư pháp Mỹ với vụ án Epstein. Bà cáo buộc chính quyền tiền nhiệm che giấu nhiều thông tin liên quan và sẽ công khai tất cả, đúng như cam kết của Tổng thống Donald Trump khi ông tranh cử. Nền tảng MAGA (Khiến nước Mỹ vĩ đại trở lại), gồm những người ủng hộ ông Trump nhiệt thành nhất, đã ca ngợi nỗ lực của bà Bondi. Nhưng họ sớm thất vọng khi Bộ Tư pháp và Cục Điều tra Liên bang Mỹ (FBI) cùng tháng công bố khoảng 100 trang tài liệu ""Giai đoạn 1"", với hầu hết nội dung trùng với những gì đã giải mật hồi năm 2024. Trong cuộc phỏng vấn củaFox Newshồi tháng 2, người dẫn chương trình đặt câu hỏi: ""Có phải Bộ Tư pháp sẽ công bố 'danh sách khách hàng' của Epstein?"". Bà Bondi trả lời rằng ""tài liệu đang ở trên bàn làm việc của tôi để chờ xem xét"". Nhưng Bộ Tư pháp và FBI ngày 7/7 lại bác bỏ sự tồn tại của tài liệu này và tuyên bố khép lại vụ án và không tiết lộ thêm thông tin. Diễn biến lập tức khiến những người MAGA phẫn nộ. Hàng loạt người cánh hữu có sức ảnh hưởng và đồng minh của ông Trump cáo buộc bà Bondi ""lừa dối người dân Mỹ"". Họ kêu gọi ông chủ Nhà Trắng cách chức hoặc thậm chí là luận tội Bộ trưởng Tư pháp. ""Người phụ nữ này sẽ còn được tha thứ vì làm hỏng mọi thứ bao nhiêu lần nữa trước khi bị sa thải?"", nhà hoạt động cực hữu Laura Loomer viết trên X. ""Bà ấy là nỗi xấu hổ, không làm gì để giúp đỡ Tổng thống Trump"". Với người ủng hộ Tổng thống Trump, cách Bộ trưởng Bondi giải quyết vụ hồ sơ Epstein là ví dụ gần nhất cho thấy bà hay thay đổi lập trường. Bộ trưởng Tư pháp Mỹ Pam Bondi điều trần tại Thượng viện ngày 25/6. Ảnh:AFP Jeffrey Epstein, sinh năm 1953, là tỷ phú tài chính người Mỹ. Ông bị bắt tháng 7/2019 với cáo buộc mua dâm hàng loạt trẻ vị thành niên từ năm 2002 đến 2005 tại các biệt thự ở bang New York và Florida. Doanh nhân này đối mặt với 45 năm tù nếu bị kết tội. Epstein bác bỏ mọi cáo buộc và bị giam ở nhà tù Manhattan. Tháng 8/2019, Epstein treo cổ tự tử trong phòng giam. Tỷ phú này từng đối mặt với các cáo buộc tương tự năm 2007, nhưng đã ký thỏa thuận nhận tội với các công tố viên và bị giam 13 tháng với tội danh nhẹ hơn là mại dâm. Vụ án Epstein nhanh chóng trở thành tâm điểm của ""các thám tử Internet"", thuyết âm mưu và đảng phái. Họ cố gắng liên kết hành vi phạm tội của Epstein với các chính trị gia đảng Dân chủ hoặc đảng Cộng hòa. Điều này càng gây chú ý khi Epstein chỉ lĩnh hình phạt nhẹ năm 2007. Việc bà Bondi ám chỉ ""danh sách khách hàng"" đang trên bàn làm việc hồi tháng 2 càng làm dấy lên các thuyết âm mưu, dù chưa có bằng chứng nào cho thấy tài liệu này có tồn tại. ""Mọi thứ sẽ được công bố. Người dân Mỹ có quyền được biết"", bà tiếp tục khẳng định trong tháng 3. Sự tò mò bùng lên khi Elon Musk, cựu cố vấn Nhà Trắng, đầu tháng 6 đăng trên X rằng Tổng thống Trump ""có tên trong hồ sơ Epstein"" và đó là lý do nó không được công khai. Ông Musk sau đó xóa bài đăng này, bày tỏ hối tiếc rằng một số bài đăng ""đã đi quá xa"". Tuy nhiên, đảng Dân chủ đã kịp nắm lấy cơ hội để công kích chính quyền đảng Cộng hòa. Bộ trưởng Bondi ngày 8/7 đính chính rằng trong cuộc phỏng vấn của Fox News, bà ""nhắc đến hồ sơ Epstein nói chung, không phải 'danh sách khách hàng'"". ""Hãy dừng bảo vệ sếp và khách hàng cũ của bà"", các hạ nghị sĩ Dân chủ viết trong thư dài 6 trang gửi bà Bondi cùng ngày. ""Lẽ ra bà ấy chỉ cần nói 'tôi chưa xem xét các tài liệu và sẽ thông báo sau'"", nhà bình luận bảo thủ Liz Wheeler cho biết. ""Bà ấy đang gieo rắc sự ngờ vực trong chính nền tảng ủng hộ Tổng thống Trump. Không chỉ danh tiếng của bà ấy bị đe dọa, mà di sản của Tổng thống Trump cũng đối mặt nguy hiểm"". Phát thanh viên bảo thủ Erick Erickson cho rằng bà Bondi nên bị sa thải vì ""nhiều lần nói dối công chúng Mỹ"". Người dẫn podcast cực hữu Jack Posobiec chỉ trích gay gắt Bondi vì tuyên bố vụ Epstein đã khép lại. ""Tôi rất tức giận, thất vọng, như bị lợi dụng sau khi đến Nhà Trắng và nhận một hồ sơ toàn là thông tin đã được công bố từ trước, nhưng lại được giới thiệu là 'tài liệu mới về Epstein'"", Posobiec nói. ""Họ bảo rằng sẽ còn nhiều thông tin được công bố thêm. Nhưng không có gì cả"". Bà Bondi còn từng ra những tuyên bố cường điệu về vấn đề nhập cư, chính sách ma túy, điều mà các chuyên gia pháp lý cho rằng có thể làm tổn hại đến uy tín của Bộ Tư pháp Mỹ trước tòa án và trong mắt công chúng. ""Nếu bạn hình thành thói quen nói bất cứ điều gì, miễn là thuận lợi về mặt chính trị lúc đó, thì sớm muộn gì nó cũng sẽ phản tác dụng"", Peter Keisler, quyền bộ trưởng tư pháp dưới thời tổng thống George W. Bush, cảnh báo. ""Việc có được sự tin cậy từ tòa án và các thể chế khác mang lại giá trị lớn hơn, và bà ấy đang lãng phí yếu tố đó bằng cách này"". Bộ trưởng Tư pháp Mỹ Pam Bondi phát biểu tại cuộc họp báo với Tổng thống Donald Trump ở Nhà Trắng ngày 27/6. Ảnh:AFP Những người ủng hộ Bondi nói bà đã giúp Bộ Tư pháp Mỹ, vốn là cơ quan khép kín, trở nên gần gũi với nền tảng cử tri ủng hộ ông Trump hơn bằng cách thường xuyên xuất hiện trên truyền hình. Phong cách cường điệu của bà cũng phản ánh phần nào cách tiếp cận của ông Trump trong các vấn đề. Nhà Trắng bênh vực cách bà Bondi xử lý vụ Epstein. ""Bộ Tư pháp cam kết tiến hành một cuộc điều tra toàn diện"", thư ký báo chí Nhà Trắng Karoline Leavitt nói. ""Họ đã làm điều đó và công bố kết quả. Đó chính là sự minh bạch"". Trong bài viết trên mạng xã hội ngày 12/7, ông Trump kêu gọi người ủng hộ ngừng công kích bà Bondi. ""Tôi không thích những gì đang xảy ra. Chúng ta có một chính quyền hoàn hảo, được cả thế giới nhắc tới, nhưng những kẻ ích kỷ đang cố gắng làm tổn hại nó, tất cả chỉ vì người đàn ông tên Jeffrey Epstein. Trong nhiều năm, vấn đề Epstein cứ lặp đi lặp lại. Đừng lãng phí thời gian và công sức cho Jeffrey Epstein, kẻ chẳng ai quan tâm"", ông viết. ""Hãy để Pam Bondi làm công việc của bà ấy. Đó là người tuyệt vời"". Như Tâm(TheoWSJ, Daily Beast, AFP)","Thứ hai, 14/7/2025, 10:23 (GMT+7)",Như Tâm,Thế giới,Tư liệu,VN Express,"Sau khi nhậm chức, Bộ trưởng Tư pháp Pam Bondi hứa sẽ công khai thông tin về vụ án Epstein, đáp ứng mong đợi của những người ủng hộ Tổng thống Trump. Tuy nhiên, việc Bộ Tư pháp và FBI công bố tài liệu trùng lặp với thông tin đã giải mật và phủ nhận sự tồn tại của ""danh sách khách hàng"" Epstein đã gây phẫn nộ trong giới MAGA. Bà Bondi bị chỉ trích vì thay đổi lập trường và bị cáo buộc ""lừa dối người dân Mỹ"", thậm chí bị kêu gọi cách chức. Sự việc này càng làm dấy lên các thuyết âm mưu xung quanh vụ án Epstein và sự liên quan của các chính trị gia."
VNEX_140725_00076,Ba dấu hiệu điển hình huyết áp cao,https://vnexpress.net/suc-khoe-cam-nang-ba-dau-hieu-dien-hinh-huyet-ap-cao-4912399.html,"Huyết áp cao là tình trạng áp lực máu tác động lên thành động mạch vượt quá mức. Điều này xảy ra khi chỉ số huyết áp tâm thu ≥ 140 mmHg và/hoặc huyết áp tâm trương ≥ 90 mmHg. Nguyên nhân có thể do di truyền, chế độ ăn nhiều muối hoặc biến chứng bệnh thận, tiểu đường... Huyết áp cao đôi khi không gây ra các triệu chứng rõ ràng song có liên quan đến các tình trạng nguy hiểm như đau tim, đột quỵ... Ngoài theo dõi chỉ số huyết áp thường xuyên, những người có nguy cơ cao nên chú ý đến ba dấu hiệu điển hình của bệnh để có thể phát hiện và điều trị sớm. Đau đầu dữ dội Một trong những triệu chứng phổ biến nhất củatăng huyết ápnguy hiểm là đau đầu dữ dội. Cơn đau đầu này thường đột ngột, dữ dội, không giống như đau đầu thông thường. Nó có thể gây ra cảm giác đau như búa bổ hoặc đau nhói, thường ở phía sau đầu. Huyết áp cao tạo thêm áp lực lên các mạch máu trong não. Áp lực này có thể gây đau, thậm chí tổn thương nếu không được điều trị.Đau đầudữ dội đột ngột, nhất là ở người bị huyết áp cao, có khả năng là dấu hiệu của cơn tăng huyết áp cấp tính, cần được điều trị sớm. Mờ mắt hoặc các thay đổi thị lực khác Huyết áp cao có thể làm hỏng các mạch máu nhỏ trong mắt. Khi các mạch máu này bị dày lên, hẹp lại, thậm chí bị rách, có thể ảnh hưởng đến thị lực. Người bệnh có thể mờ mắt, nhìn thấy đốm đen hay các vấn đề về thị lực khác. Triệu chứng này rất quan trọng vì nó cho thấy huyết áp cao đang ảnh hưởng đến toàn bộ cơ thể chứ không chỉ riêng tim. Người gặp những thay đổi về thị lực kèm theo các triệu chứng khác như đau đầu hoặc chóng mặt cần đi khám sớm. Đau ngực và khó thở Đau ngực và khó thở là những triệu chứng nghiêm trọng liên quan đến huyết áp cao. Khi huyết áp cao, tim phải làm việc nhiều hơn để bơm máu, có thể gây đau ngực hoặc cảm giác tức ngực. Khó thở cũng xảy ra ở người huyết áp cao do dẫn đến các vấn đề về tim hoặc tích tụ dịch trong phổi. Những triệu chứng này có khả năng báo hiệu bệnh tim hoặc một cơn đau tim do tăng huyết áp không được kiểm soát. Huyết áp cao âm thầm gây tổn thương động mạch và các cơ quan khác theo thời gian. Tình trạng này không được điều trị có thể dẫn đến các vấn đề đe dọa tính mạng nhưđột quỵ, nhồi máu cơ tim, suy thận, suy tim. Người trưởng thành khỏe mạnh nên kiểm tra huyết áp ít nhất hai năm một lần hoặc thường xuyên hơn nếu có nguy cơ cao. Duy trì thói quen ăn uống lành mạnh, ít muối, tập thể dục thường xuyên, tránh hút thuốc và cân nặng hợp lý cũng giúp ích. Bảo Bảo(TheoTimes of India)","Thứ hai, 14/7/2025, 00:02 (GMT+7)",Bảo Bảo,Sức khỏe,Các bệnh,VN Express,"Văn bản cung cấp thông tin về bệnh huyết áp cao, một tình trạng nguy hiểm có thể gây tổn thương tim, não và các cơ quan khác. Bài viết nhấn mạnh rằng huyết áp cao thường không có triệu chứng rõ ràng, nhưng người có nguy cơ nên chú ý đến các dấu hiệu như đau đầu dữ dội, mờ mắt hoặc thay đổi thị lực, và đau ngực kèm khó thở. Việc kiểm tra huyết áp thường xuyên và duy trì lối sống lành mạnh là rất quan trọng để phòng ngừa và điều trị bệnh."
VNEX_140725_00014,Có phải người không đóng bảo hiểm xã hội cũng được hưởng trợ cấp hưu trí?,https://vnexpress.net/thu-tuc-de-duoc-huong-tro-cap-huu-tri-xa-hoi-tu-thang-7-2025-4913388.html,"Theo quy định mới bắt đầu có hiệu lực từ tháng 7/2025, Nhà nước sẽ triển khai chính sách trợ cấp hưu trí xã hội cho người từ đủ 75 tuổi trở lên, nhằm bảo đảm an sinh cho những người cao tuổi không có lương hưu hay trợ cấp bảo hiểm xã hội hàng tháng. Đây là một bước tiến quan trọng trong chính sách an sinh xã hội, thể hiện sự quan tâm đến nhóm người cao tuổi có hoàn cảnh khó khăn. Vậy theo quy định mới, bố tôi có thuộc diện được nhận trợ cấp hưu trí xã hội hay không? Nếu có, thì cần chuẩn bị hồ sơ, giấy tờ gì, thực hiện thủ tục tại đâu? Và mức trợ cấp mà ông sẽ được nhận là bao nhiêu mỗi tháng (nếu có)? Độc giả Đức Dũng >>Luật sưPhạm Thanh Hữutư vấn","Thứ hai, 14/7/2025, 06:00 (GMT+7)",>>Luật sư,Pháp luật,Tư vấn,VN Express,"Từ tháng 7/2025, Nhà nước sẽ trợ cấp hưu trí xã hội cho người từ 75 tuổi trở lên không có lương hưu hay trợ cấp bảo hiểm xã hội. Chính sách này nhằm hỗ trợ người cao tuổi có hoàn cảnh khó khăn. Độc giả thắc mắc về điều kiện, thủ tục, hồ sơ và mức trợ cấp cho bố mình theo quy định mới này."
VNEX_140725_00088,Mitsubishi Destinator - xe gầm cao 7 chỗ bán ở Việt Nam cuối 2025,https://vnexpress.net/mitsubishi-destinator-xe-gam-cao-7-cho-ban-o-viet-nam-cuoi-2025-4913559.html,"Nguồn tin củaVnExpresscho biết,MitsubishiViệt Nam sẽ đưa về bán mẫu CUV 7 chỗ mới vào tháng 12 tới. Đây là bản thương mại của dòng xe concept DST từng được hãng giới thiệu vào đầu tháng 6 vừa qua tại Hà Nội và sau đó là TP HCM. Hiện các đại lý đã nhận đặt cọc của khách. Tên gọi chính thức của dòng concept kể trên là Destinator. Mitsubishi Nhật Bản sẽ ra mắt mẫu này vào 17/7 tới tại triển lãm ôtô quốc tế Indonesia (GIIAS) 2025. Tương tựXpander, Xforce, Mitsubishi Destinator sản xuất tại nhà máy ở xứ vạn đảo, phục vụ thị trường nội địa và xuất khẩu đến các quốc gia Đông Nam Á, trong đó có Việt Nam. Hiện chưa có thông tin về kích thước và động cơ của Destinator. Ở bản concept DST, hãng định vị xe nằm ở phân khúc C-D với cấu hình 7 chỗ thực sự chứ không phải dạng 5+2. Có nghĩa là, khi bán ra phiên bản thương mại, đây sẽ là mẫu xe thay thế cho Outlander và thậm chí là cả Pajero Sport tại thị trường Việt Nam. Hiện nay, các xe cỡ C nhưHonda CR-V,Ford Territory,Mazda CX-5,Hyundai Tucsonđều có 5 chỗ hoặc 5+2, tức hai ghế cuối chỉ phù hợp trẻ nhỏ, đi đường ngắn. Như vậy, Destinator sẽ có lợi thế không gian 7 chỗ như cỡ D nhưng giá dễ tiếp cận như cỡ C. Một đại diện của Mitsubishi Việt Nam cho biết, giống nhưXforce, bản thương mại của Destinator cũng giữ phần lớn thiết kế như bản concept DST. Mitsubishi DST mang ngôn ngữ thiết kế ""Gravitas & Dynamism"" (trọng lực và động lực). Những chi tiết nổi bật như các cột màu đen, thiết kế bề mặt độc đáo ở cột phía sau, khoảng sáng gầm cao và chắn bùn cơ bắp với lốp cỡ lớn. Các dải nẹp sườn và ốp gầm gờ nổi tạo thêm cảm giác mạnh mẽ. Khái niệm Dynamic Shield vẫn duy trì với thiết kế ba chiều cùng lưới tản nhiệt hình tổ ong. Thiết kế tổng thể của lưới tản nhiệt liền mạch với cản trước. Giống Xforce, đèn ban ngày phía trước và đèn hậu đều là LED và có dạng chữ T. DST có cabin rộng rãi và sử dụng vật liệu mềm mại. Thiết kế nội thất tạo cảm giác đồng nhất với cửa sổ trời toàn cảnh. Bảng đồng hồ tích hợp màn hình LCD toàn phần và liền mạch với màn hình giải trí. Mitsubishi nói rằng DST là xe dẫn động cầu trước nhưng vẫn có khả năng vận hành tốt trong mọi điều kiện thời tiết hoặc đường xá. Xe có 5 chế độ lái như Wet, Tarmac, Normal, Gravel và Mud. Phạm Trung","Thứ hai, 14/7/2025, 04:54 (GMT+7)",Phạm Trung,Xe,Thị trường,VN Express,"Theo VnExpress, Mitsubishi Việt Nam sẽ bán mẫu CUV 7 chỗ mới Destinator (bản thương mại của concept DST) vào tháng 12, sau khi ra mắt toàn cầu tại Indonesia vào tháng 7. Xe được sản xuất tại Indonesia và xuất khẩu sang Đông Nam Á, bao gồm Việt Nam. Destinator được định vị ở phân khúc C-D, thay thế Outlander và Pajero Sport, với lợi thế không gian 7 chỗ thực thụ và thiết kế mạnh mẽ, nhiều khả năng giữ nguyên từ bản concept DST."
VNEX_140725_00111,Loay hoay đóng thuế qua sàn thương mại điện tử,https://vnexpress.net/loay-hoay-dong-thue-qua-san-thuong-mai-dien-tu-4913755.html,Liên hệ: 084 666 0123 hoặcpodcast@vnexpress.net.,"Thứ hai, 14/7/2025, 04:00 (GMT+7)",Unknown,Podcasts,,VN Express,Tôi không có nội dung văn bản để tóm tắt. Bạn vui lòng cung cấp văn bản cho tôi.
