id,title,link,content,date,author,category,sub_category,source,summary
VNEX_170925_00087,Sếp Volkswagen: 'Tay nắm cửa thò thụt rất khó vận hành',https://vnexpress.net/sep-volkswagen-tay-nam-cua-tho-thut-rat-kho-van-hanh-4939487.html,"Volkswagen(VW) đang có những thay đổi lớn. Thương hiệu này không chỉ đang chuẩn bị ra mắt một loạt xe điện mới như ID. Cross và Polo chạy hoàn toàn bằng điện, mà còn đang xem xét lại thiết kế để mở rộng sức hấp dẫn của sản phẩm. Điều này đồng nghĩa với việc quay trở lại với những tính năng quen thuộc hơn với người mua, bao gồm cả những điều đơn giản như tay nắm cửa truyền thống thay vì kiểu tay nắm cửa thò thụt mà nhiều nhà sản xuất xe điện hiện ưa chuộng. Tại triển lãm IAA Mobility ở Munich, Thomas Schafer có cuộc trò chuyện vớiDeutsche Welle(DW) và đề cập đến một số chủ đề, bao gồm cả sự chậm lại trong doanh số xe điện tại các thị trường lớn như châu Âu và Mỹ. Khi được hỏi liệu VW có đang nỗ lực hết sức để làm cho xe điện của hãng dễ tiếp cận hơn hay không, Schafer nhanh chóng nhấn mạnh giá trị của sự quen thuộc. Xe điện ID. Cross concept với kiểu tay nắm cửa truyền thống. Ảnh:Volkswagen Ông cho biết: ""Mọi người mong đợi một sự quen thuộc nào đó với chiếc xe, với thương hiệu mà họ đang mua. Mọi người mua thương hiệu, nên theo quan điểm đó, các chức năng phải dễ sử dụng. Ví dụ như tay nắm cửa. Có tay nắm cửa phẳng thì tốt, nhưng rất kinh khủng khi vận hành, nên chúng tôi chắc chắn phải có tay nắm cửa phù hợp trên xe và khách hàng rất hài lòng. Đó là phản hồi mà chúng tôi nhận được"". Thực tế, Schafer không phải người duy nhất có quan điểm trên. Mới đây, các cơ quan quản lý tại Trung Quốc cũng để mắt đến kiểu tay nắm cửa phẳng và có thể thu vào và nhô ra, cân nhắc lệnh cấm sau những lo ngại về an toàn và các cuộc điều tra tai nạn. Với quy mô và tầm ảnh hưởng của thị trường ôtô Trung Quốc, động thái này có thể lan rộng ra ngoài biên giới, thúc đẩy các nhà sản xuất ôtô khác phải xem xét lại cách tiếp cận của họ đối với thiết kế từng được coi là xu hướng. Trong khi mẫu xe ý tưởng ID. Every1 ra mắt đầu năm nay có tay nắm cửa phẳng, thì cả ID. Cross và ID. Polo được giới thiệu tại Munich vừa qua đều sử dụng tay nắm cửa truyền thống hơn. Thiết kế có thể hy sinh một phần hiệu quả khí động học, nhưng lại dễ vận hành hơn nhiều trong cuộc sống hàng ngày. Trong cùng cuộc phỏng vấn, Schafer cũng thảo luận về quá trình chuyển đổi rộng rãi hơn sang xe điện của hãng. Ông lập luận rằng xe điện là lựa chọn ưu việt hơn cho người mua, nhưng đặt câu hỏi liệu nhu cầu và cơ sở hạ tầng có tăng trưởng đủ nhanh để VW ngừng bán các mẫu xe chạy bằng nhiên liệu hóa thạch (ICE) tại EU vào năm 2035 hay không. ""Câu hỏi đặt ra là liệu chúng ta có thể đạt được mục tiêu này đủ nhanh cho năm 2035 hay không? Liệu việc áp dụng và phát triển cơ sở hạ tầng cho việc sạc điện có diễn ra đủ nhanh để năm 2035 trở thành một mục tiêu khả thi hay không?"" ông nói. ""Dù là vài năm sau đó, thì cũng cần phải xem xét lại"". Mỹ Anh","Thứ tư, 17/9/2025, 04:00 (GMT+7)",Mỹ Anh,Xe,Thị trường,VN Express,"Volkswagen đang thực hiện những thay đổi lớn, bao gồm việc ra mắt các mẫu xe điện mới và xem xét lại thiết kế để tăng tính quen thuộc với người dùng, ví dụ như việc quay lại sử dụng tay nắm cửa truyền thống thay vì kiểu tay nắm cửa thò thụt. Giám đốc điều hành VW, Thomas Schafer, thừa nhận sự chậm lại trong doanh số xe điện và nhấn mạnh tầm quan trọng của việc tạo ra các sản phẩm dễ sử dụng, đáp ứng mong đợi của khách hàng. Ông cũng đặt câu hỏi về khả năng đạt được mục tiêu ngừng bán xe chạy bằng nhiên liệu hóa thạch vào năm 2035 do tốc độ phát triển của cơ sở hạ tầng sạc điện còn chậm."
VNEX_170925_00106,Văn hóa xăm miệng ở Nhật Bản,https://vnexpress.net/van-hoa-xam-mieng-o-nhat-ban-4939684.html,"Laksmi Wijayanti, chủ công ty du lịch Untold Japan Travel - chuyên khám phá những điểm du lịch, văn hóa ẩn của đất nước - cho biết hình xăm vốn bị nhìn nhận với thái độ tiêu cực ở Nhật Bản. Tuy nhiên, trong một lần du lịch miền Bắc Nhật Bản, cô đã thấy một phụ nữ xăm mặt. Laksmi càng ngạc nhiên hơn khi biết từng có một cộng đồng thiểu số ở Nhật Bản coi hình xăm là một phần quan trọng trong văn hóa. Đó là người Ainu, dân tộc bản địa ở miền bắc Nhật Bản, chủ yếu sinh sống tại đảo Hokkaido. Họ được cho là hậu duệ của tộc người Jomon cổ đại. Trong văn hóa Ainu, hình xăm (gọi là Sinuye) không chỉ để làm đẹp mà còn mang ý nghĩa tâm linh sâu sắc, là một nghi lễ quan trọng đánh dấu các giai đoạn trong cuộc đời người phụ nữ. Ảnh tư liệu về phụ nữ Ainu với hình xăm đặc trưng ở môi. Ảnh:Untold Japan Travel Khi các bé gái được 5-6 tuổi, họ bắt đầu được xăm những họa tiết hình học đầu tiên trên mu bàn tay và cánh tay. Các hoa văn này được tin là bùa hộ mệnh, giúp xua đuổi tà ma và bệnh tật. Nghi lễ quan trọng nhất là xăm miệng, thường bắt đầu khi thiếu nữ khoảng 12-13 tuổi và hoàn thiện dần trong vài năm cho đến khi sẵn sàng kết hôn. Hình xăm khởi đầu bằng một chấm nhỏ trên môi trên, sau đó mở rộng thành một đường bao quanh miệng, cong lên hai bên má, tựa như một nụ cười thường trực. Hình xăm này là điều kiện gần như bắt buộc để người phụ nữ có thể lấy chồng và được an nghỉ ở thế giới bên kia sau khi qua đời. Nghi lễ xăm được thực hiện bởi những người phụ nữ lớn tuổi có kinh nghiệm. Dụng cụ là một con dao nhỏ gọi là ""makiri"". Trước khi có ""makiri"" đầu thép, người ta sử dụng các mũi đá sắc như dao cạo, được quấn bằng sợi, chừa đầu mũi nhô ra nhằm kiểm soát độ sâu của vết cắt. Máu từ vết cắt được lau bằng miếng vải ngâm chất khử trùng làm từ tro gỗ tần bì. Muội than được lấy từ đáy nồi, chà xát vào các vết cắt để tạo màu. Sau đó, thợ xăm sẽ khấn hoặc hát để truyền sức mạnh vào hình khắc. Quá trình này rất đau đớn, có thể gây sốt và sưng tấy trong nhiều ngày. Theo Romyn Hitchcock, nhà dân tộc học làm việc cho Viện Smithsonian cuối thế kỷ 19, thợ xăm khuyến khích người xăm ngồi yên dù đau đớn. Người ta tin rằng việc chịu đựng được nỗi đau này sẽ giúp các cô gái thêm mạnh mẽ khi sinh con sau này. Tuy nhiên, từ cuối thế kỷ 18, chính quyền Nhật Bản bắt đầu cấm tục lệ này nhằm đồng hóa người Ainu. Năm 1871, Ủy ban Phát triển Hokkaido chính thức ra lệnh cấm, cho rằng đây là một tập tục ""tàn nhẫn"". Đến nay, nhiều người Nhật xem xăm hình là hủy hoại cơ thể, liên quan đến tội phạm. Những người Ainu ngày nay. Ảnh:RBTH Người Ainu từng kiên quyết né tránh các luật này vì hình xăm theo truyền thống là điều kiện tiên quyết để kết hôn và đến với thế giới bên kia. Một báo cáo từ những năm 1880 miêu tả rằng người Ainu ""đau buồn và khổ sở"" vì lệnh cấm xăm hình. Họ nói rằng các vị thần sẽ tức giận và phụ nữ không thể kết hôn trừ khi họ được xăm hình. Đến năm 1998, người phụ nữ Ainu cuối cùng được xăm đầy đủ theo văn hóa truyền thống đã qua đời. Ngày nay, phụ nữ Ainu không còn xăm mình nhưng họ vẫn tìm cách kết nối với di sản của tổ tiên. Trong các lễ hội, một số người sẽ vẽ lên mặt những hoa văn tương tự hình xăm xưa bằng lớp trang điểm. Du khách muốn tìm hiểu về nền văn hóa độc đáo này có thể ghé thăm Bảo tàng và Công viên Quốc gia Ainu Upopoy ở thị trấn Shiraoi, Hokkaido. Đây là trung tâm lớn nhất về văn hóa Ainu, nơi trưng bày các hiện vật, tái hiện nhà ở truyền thống và tổ chức các buổi biểu diễn nghệ thuật, giúp công chúng hiểu hơn về một phần lịch sử đa dạng của Nhật Bản. Buổi biểu diễn tái hiện văn hóa Ainu. Ảnh:Bảo tàng Quốc gia Ainu Hoài Anh(TheoUntold Japan Travel, Me Time JP, Lars Krutak)","Thứ tư, 17/9/2025, 05:00 (GMT+7)",Hoài Anh,Du lịch,Điểm đến,VN Express,"Bài viết kể về việc Laksmi Wijayanti, chủ công ty du lịch Untold Japan Travel, phát hiện ra tục xăm mình mang ý nghĩa văn hóa sâu sắc của người Ainu, một dân tộc bản địa ở Nhật Bản. Hình xăm, đặc biệt là xăm môi, đóng vai trò quan trọng trong các nghi lễ trưởng thành và hôn nhân của phụ nữ Ainu. Tuy nhiên, chính quyền Nhật Bản đã cấm tục lệ này từ cuối thế kỷ 18, dẫn đến sự mai một của truyền thống xăm mình trong cộng đồng Ainu."
VNEX_170925_00016,Mbappe cứu Real ở Champions League,https://vnexpress.net/mbappe-cuu-real-o-champions-league-4939952.html,"Tấm thẻ đỏ trực tiếp của Dani Carvajal ở phút 72 đẩy Real vào thế thiếu người khi hai đội đang hòa 1-1. Tuy nhiên, Mbappe kịp lên tiếng đúng lúc, đá thành công quả phạt đền thứ hai sau tình huống để bóng chạm tay gây tranh cãi của Facundo Medina, hoàn tất màn ngược dòng cho Real. Từ đầu giải, tiền đạo Pháp ghi tám bàn và góp hai kiến tạo cho đội bóng Hoàng gia, chỉ sau bảy trận. Trận này, Real dứt điểm tới 28 lần, trong đó có 15 lần trúng hướng cầu môn, với chỉ số bàn thắng kỳ vọng (xG) lên tới 3.65. Nhưng, chủ nhà phải cần tới hai quả phạt đền để duy trì mạch toàn thắng từ đầu mùa ở mọi đấu trường. Tiền đạo Mbappe mừng bàn nâng tỷ số lên 2-1, trong trận Real thắng Marseille, trên sân Bernabeu, Madrid, Tây Ban Nha hôm 16/9. Ảnh:Reuters Trận đấu khởi đầu với nhiều diễn biến bất lợi choReal. Mbappe và Franco Mastantuono bỏ lỡ ba cơ hội ngon ăn trong 10 phút đầu, còn hậu vệ phải Trent Alexander-Arnold gặp chấn thương gân kheo, rời sân nhường chỗ cho Carvajal ngay phút thứ 5. Khó khăn thêm chồng chất cho Real khi Timothy Weah bất ngờ mở tỷ số phút 22. Con trai Quả bóng Vàng 1995 George Weah lập công từ đường kiến tạo của Mason Greenwood, người đã cướp được bóng sau tình huống Arda Guler mất tập trung. Thủ môn Geronimo Rulli củaMarseillelà ngôi sao sáng trong hiệp một khi có tới 10 pha cứu thua, nổi bật là tình huống bay người một tay xuất thần chặn đứng cú dứt điểm cận thành của Mbappe. Tuy nhiên, lợi thế của đội khách cũng chỉ kéo dài sáu phút. Geoffrey Kondogbia phạm lỗi vụng về với Rodrygo trong cấm địa, trước khi Mbappe tận dụng cơ hội san bằng tỷ số từ quả phạt đền. Đây cũng là bàn thắng thứ 50 của Mbappe cho Real. Số cơ hội của Real ít dần đi trong hiệp hai. Mọi thứ trở nên khó khăn hơn khiCarvajalhúc đầu vào thủ môn Rulli sau một tình huống lời qua tiếng lại. Dù va chạm không mạnh, hành vi phi thể thao của Carvajal là rõ ràng và anh phải nhận thẻ đỏ sau khi trọng tài tham khảo VAR. Thủ môn Rulli nằm sân sau khi bị Carvajal (trắng, giữa) húc đầu trên sân Bernabeu, Madrid, Tây Ban Nha hôm 16/9. Ảnh:Reuters Nhưng cũng ở trong cấm địa của Marseille, hậu vệ Medina của chủ nhà để bóng chạm tay ở phút 81 sau nỗ lực ngăn cản pha đi bóng củaMbappe. Tình huống gây tranh cãi khi bóng chạm vào giày Medina rồi bật vào cánh tay dang rộng của hậu vệ đội khách. Rulli một lần nữa đoán đúng hướng sút của Mbappe, nhưng không thể cản phá. ""Phân tích các tình huống bóng chạm tay thật sự rất phức tạp"", Mbappe nói sau khi ghi bàn thứ 57 tại Champions League, vươn lên thứ sáu ở danh sách những người ghi nhiều bàn nhất đấu trường này. ""Với tôi, đó là một quả phạt đền, nhưng tôi hiểu sẽ có người nghĩ khác. Trọng tài cho phạt đền, nhiệm vụ của tôi là thực hiện và ghi bàn"". Ngoài Mbappe, một cá nhân khác cũng có dấu mốc đáng nhớ là Mastantuono. Ở 18 tuổi 33 ngày, cầu thủ Argentina trở thành người trẻ nhất đá chính cho Real tại Champions League. Kỷ lục cũ thuộc về Endrick khi tiền đạo Brazil xuất phát ở trận gặp Lille lúc 18 tuổi 73 ngày. Kết quả 2-1 giúp Real trở thành CLB đầu tiên trong lịch sử chạm mốc 200 trận thắng kể từ khi giải đấu thay đổi diện mạo năm 1992. Đây cũng là chiến thắng đầu tiên của Xabi Alonso trên cương vị HLV trưởng Los Blancos tại Champions League. Với ba điểm đầu tiên ở Champions League 2025-2026, Real tạm xếp thứ tư trên bảng thứ bậc tổng. Ở lượt trận sau hôm 30/9, thầy trò Xabi Alonso làm khách trên sân Kairat của Kazakhstan. Vy Anh","Thứ tư, 17/9/2025, 05:00 (GMT+7)",Vy Anh,Thể thao,Bóng đá,VN Express,"Real Madrid đã lội ngược dòng thắng Marseille 2-1 nhờ cú đúp phạt đền của Mbappe, trong một trận đấu đầy kịch tính với nhiều tranh cãi. Marseille mở tỷ số trước nhưng Mbappe gỡ hòa trên chấm phạt đền, trước khi Carvajal bị đuổi khỏi sân khiến Real gặp khó khăn. Cuối trận, một quả phạt đền gây tranh cãi khác được Mbappe thực hiện thành công, ấn định chiến thắng cho Real."
VNEX_170925_00010,USD mất giá trước thềm Fed giảm lãi suất,https://vnexpress.net/usd-mat-gia-truoc-them-fed-giam-lai-suat-4939997.html,"Sáng 17/9, giá euro có thời điểm tăng 0,9% so với USD, đổi được 1,187 đôla Mỹ. Đây là mức cao nhất kể từ tháng 9/2021. Dollar Index - theo dõi diễn biến của đồng bạc xanh với 6 tiền tệ lớn - giảm 0,7% về 96,63 điểm, thấp nhất kể từ đầu tháng 7. Bảng Anh tăng giá 0,5% so với đôla Mỹ, đổi được 1,366 USD. Ngân hàng Trung ương Anh (BoE) được kỳ vọng giữ nguyên lãi suất trong cuộc họp tuần này, sau khi đã giảm lãi tháng trước. Trong khi đó, so với yen Nhật, USD hiện thấp nhất một tháng, khi 1 USD chỉ đổi được 146,3 JPY. Tuần này, Ngân hàng Trung ương Nhật Bản (BOJ) cũng họp chính sách. Cơ quan này được kỳ vọng giữ nguyên lãi suất tại 0,5%. Diễn biến tỷ giá EUR/USD trong một năm qua. Đồ thị:Reuters Vài tháng qua, giá đôla Mỹ ổn định trở lại sau khi giảm mạnh đầu năm. Tuy nhiên gần đây, đồng tiền này chịu sức ép mới khi nhà đầu tư ngày càng đặt cược vào khả năng Fed giảm lãi suất. Tổng thống Mỹ Donald Trump cũng liên tiếp kêu gọi Fed làm điều này. Thị trường hiện đặt cược Fed giảm lãi thêm 25 điểm cơ bản (0,25%) trong cuộc họp tuần này. Các số liệu gần đây cho thấy thị trường lao động Mỹ đang yếu đi. ""Chúng tôi dự báo Chủ tịch Fed Jerome Powell sẽ xoa dịu rủi ro lạm phát và bày tỏ mong muốn rõ ràng hơn về hỗ trợ thị trường lao động. Quan điểm này tạo nền tảng cho hàng loạt đợt cắt giảm trong các tháng tới"", Karl Schamotta - chiến lược gia thị trường tại Corpay nhận xét. Báo cáo công bố ngày 15/9 cho thấy doanh số bán lẻ Mỹ tăng mạnh hơn kỳ vọng trong tháng 8. Tuy nhiên, nhà đầu tư vẫn lo ngại về tăng trưởng kinh tế Mỹ trong bối cảnh thị trường lao động yếu đi và giá cả tăng cao do thuế nhập khẩu. ""Chúng tôi cho rằng Fed sẽ nới lỏng tiền tệ dần dần. Lợi suất trái phiếu và giá đôla Mỹ có thể hồi phục một chút sau đó"", Jonas Goltermann - nhà kinh tế học tại Capital Economics dự báo. Hà Thu(theo Reuters)","Thứ tư, 17/9/2025, 08:38 (GMT+7)",Hà Thu,Kinh doanh,Quốc tế,VN Express,"Sáng 17/9, đồng euro tăng giá mạnh so với USD, đạt mức cao nhất kể từ tháng 9/2021, trong khi Dollar Index giảm xuống mức thấp nhất kể từ đầu tháng 7. Các đồng tiền tệ khác như bảng Anh cũng tăng giá so với đô la Mỹ. Nguyên nhân chính là do kỳ vọng Cục Dự trữ Liên bang Mỹ (Fed) sẽ giảm lãi suất do thị trường lao động Mỹ yếu đi, bất chấp doanh số bán lẻ tăng trưởng tốt. Thị trường đang đặt cược vào khả năng Fed giảm lãi suất, dù các chuyên gia dự đoán Fed sẽ nới lỏng tiền tệ dần dần."
VNEX_170925_00017,'Siêu dự bị' giúp Arsenal thắng trận ra quân Champions League,https://vnexpress.net/sieu-du-bi-giup-arsenal-thang-tran-ra-quan-champions-league-4939948.html,"Trên sân San Mames ngày 16/9,Arsenalra sân với bộ ba tiền đạo tân binh được tuyển mộ với tổng phí gần 200 triệu USD trong hè 2025, là Eberechi Eze, Viktor Gyokeres, Noni Madueke. Nhưng trước lối chơi áp sát nhanh và quyết liệt của Bilbao, ""Pháo thủ"" gặp không ít khó khăn. Đột biến chỉ xuất hiện khi HLV Mikel Arteta tung Trossard vào thay Gyokeres ở phút 65, còn Martinelli thế chỗ Eze phút 71. Bộ đôi này cùng nhau tỏa sáng giúp Arsenal rời Tây Ban Nha với trọn vẹn ba điểm. Gabriel Martinelli đặt lòng ghi bàn mở tỷ số... ... rồi ăn mừng trong trận Arsenal thắng Bilbao 2-0 ở lượt đầu Champions League tại San Mames, Xứ Basque, Tây Ban Nha ngày 16/9/2025. Ảnh:Reuters Phút 72,Trossardchuyền bổng một chạm để Martinelli mở tốc, loại hai hậu vệ Bilbao, xâm nhập vòng cấm rồi đặt lòng chân phải hạ thủ thành Unai Simon mở tỷ số. Tiền đạo người Brazil ghi bàn ngay pha chạm bóng đầu tiên, chỉ 36 giây sau khi vào sân - thời gian nhanh nhất để một cầu thủ dự bị của Arsenal ghi bàn tại Champions League. Phút 87,Martinelliđáp lễ đồng đội. Anh đi bóng từ cánh trái vào vòng cấm và nhả ngược cho Trossard. Tiền đạo người Bỉ nhấp nhả một nhịp rồi dứt điểm chạm người cầu thủ Bilbao đổi hướng vào lưới, ấn định chiến thắng 2-0. Từ khi đến Arsenal vào tháng 1/2023, Trossard góp dấu giày vào nhiều bàn hơn bất kỳ cầu thủ Ngoại hạng Anh nào khác trên mọi đấu trường (14 bàn, trong đó có 10 bàn tự ghi và 4 kiến tạo). Kết quả 2-0 giúp Arsenal trở thành CLB đầu tiên thắng 6 trận liên tiếp trước các đại diện Tây Ban Nha tại Cup C1 châu Âu/Champions League, sau khi thắng Real Madrid (2 lần), Sevilla (2 lần) và Girona. Leandro Trossard (phải) chia vui cùng Gabriel Martinelli sau khi ghi bàn ấn định chiến thắng. Ảnh:Arsenal FC Trận này, bộ ba tiền đạo tân binh của Arsenal không để lại nhiều dấu ấn - trái ngược với màn trình diễn ởtrận thắng Nottingham Forest 3-0tại vòng bốn Ngoại hạng Anh cuối tuần qua. Gyokeresthi đấu nổi bật hơn cả, với pha bứt tốc dứt điểm từ góc hẹp bị thủ môn Bilbao cản phá ở phút 24, rồi đánh đầu chệch khung thành sau đó hai phút. Nhưng trong tình huống cùng bật cao đánh đầu từ quả đá phạt ở phút 30, Gyokeres va chạm với đồng độiGabriel Magalhaesvà chảy máu đầu. Trung phong người Thụy Điển băng đầu và có thể tiếp tục thi đấu, nhưng không còn xông xáo như trước. Victor Gyokeres băng đầu sau khi va chạm mạnh với đồng đội Gabriel. Ảnh:AP Ngày 21/9, Arsenal trở về sân nhà Emirates tiếp Man City ở vòng năm Ngoại hạng Anh. Hồng Duy","Thứ tư, 17/9/2025, 04:26 (GMT+7)",Hồng Duy,Thể thao,Bóng đá,VN Express,"Trong trận đấu mở màn Champions League gặp Bilbao ngày 16/9/2025, Arsenal giành chiến thắng 2-0 nhờ sự tỏa sáng của bộ đôi vào sân thay người Trossard và Martinelli. Martinelli mở tỷ số ngay sau khi vào sân, còn Trossard ấn định chiến thắng sau đó, giúp Arsenal lập kỷ lục thắng 6 trận liên tiếp trước các đội bóng Tây Ban Nha tại Champions League. Mặc dù bộ ba tân binh đắt giá không gây được ấn tượng, nhưng sự thay đổi người chiến thuật của HLV Arteta đã mang về 3 điểm quan trọng cho Arsenal."
