id,title,link,content,date,author,category,sub_category,source,summary
VNEX_011025_00022,Mourinho giải nguy cho đội trưởng Chelsea,https://vnexpress.net/mourinho-giai-nguy-cho-doi-truong-chelsea-4945757.html,"Khi chuẩn bị đá phạt góc trong hiệp một, trận đấu trên sân Stamford Bridge, Enzo Fernandez bị một nhóm CĐV của Benfica chửi rủa. Đội trưởng Chelsea đáp lại bằng cách vỗ tay mang tính mỉa mai, khiến đám đông trên khán đài càng tức giận, ném đồ xuống sân làm trận đấu phải tạm dừng. Enzo từng khoác áo Benfica nửa đầu mùa 2022-2023, trước khi đầu quân cho Chelsea. Từ khu kỹ thuật của Benfica, Mourinho ra hiệu, yêu cầu các CĐV kiềm chế. Uy tín của ""Người Đặc biệt"" lập tức phát huy tác dụng. CĐV đội khách ngừng ném đồ, và Fernandez có thể tiếp tục thi đấu. Mourinho (giữa) trong trận Benfica thua Chelsea 0-1 ở lượt hai vòng bảng Champions League trên sân Stamford Bridge tối 30/9. Ảnh:Reuters Trận này, Chelsea thắng Benfica 1-0 bằng pha phản lưới của Richard Rios ở phút 18. Tân binh Alejandro Garnacho để lại dấu ấn khi căng ngang từ cánh trái, khiến trung vệ đội khách giật mình và tự đưa bóng vào khung thành. Ngoài bàn thua kém may mắn, Benfica kiểm soát bóng 43%, dứt điểm 9 lần - so với 8 của Chelsea, và có cùng số lần đưa bóng trúng đích (3). ""Chúng tôi đã chơi tốt trước một đối thủ mạnh"",Mourinhonhận xét. ""Kết quả có thể đã khác. Tuy nhiên, thua thì vẫn là thua, dù bạn chơi tốt đến đâu. Có những trận thua khiến bạn không dám ra khỏi nhà ngày hôm sau. Nhưng cũng có những trận thua để rút ra những điều tích cực. Chúng tôi buồn vì thua, nhưng vẫn lạc quan về sự phát triển chiến thuật và tinh thần"". Mourinho sau đó dành lời khenChelsea, đội bóng mà ông từng dẫn dắt hai giai đoạn 2004-2007 và 2013-2015. Nhà cầm quân người Bồ Đào Nha đánh giá cao chủ nhà về khả năng chuyển đổi thế trận và chiều sâu đội hình. ""Tôi đã thực hiện một số thay đổi để làm mới đội hình, nhưng Chelsea có những cầu thủ dự bị giỏi hơn những người đá chính. Họ có rất nhiều giải pháp"", ông nói thêm. Đây là thất bại đầu tiên của Mourinho cùng Benfica, sau khi thắng hai và hòa một ở giải vô địch Bồ Đào Nha. Đây cũng là trận cầm quân đầu tiên của ông ở Champions League (không tính sơ loại) từ năm 2020, khi còn ở Tottenham. Tại lượt đầu, Benfica - dưới sự dẫn dắt của HLV Bruno Lage - thua Qarabag 2-3 ngay trên sân nhà Da Luz. Trong khi đó, Chelsea giành được những điểm đầu tiên sau trận ra quân thua Bayern 1-3. Thanh Quý(theoMarca)","Thứ tư, 1/10/2025, 08:19 (GMT+7)",Thanh Quý,Thể thao,Bóng đá,VN Express,
VNEX_011025_00003,Doanh nghiệp muốn tài trợ 3 phà đi Cần Giờ,https://vnexpress.net/doanh-nghiep-muon-tai-tro-3-pha-di-can-gio-4945653.html,"Đề xuất được gửi UBND TP HCM và các đơn vị liên quan. Doanh nghiệp mong muốn tài trợ 3 phà 200 tấn, hoạt động thường xuyên để tăng năng lực vận chuyển. Các phương tiện sẽ giao cho Lực lượng Thanh niên xung phong vận hành. Toàn bộ chi phí nhiên liệu, nhân công và phát sinh do doanh nghiệp chi trả. Thời gian dự kiến khoảng 2,5 năm, gắn với mốc hoàn thành các công trình hạ tầng quan trọng của thành phố như cầu Cần Giờ và tuyến đường sắt đô thị. Phà chở khách ở bến Bình Khánh, năm 2020. Ảnh:Giang Anh Theo doanh nghiệp, việc bổ sung thêm 3 phà trọng tải lớn sẽ giúp tăng gấp đôi công suất khai thác, đáp ứng nhu cầu đi lại ngày càng tăng của người dân và doanh nghiệp, góp phần thúc đẩy kinh tế - xã hội khu vực. Hiện bến phà Bình Khánh có 5 phương tiện gồm 2 phà 200 tấn và 3 phà 100 tấn, phục vụ khoảng 22.000 lượt khách mỗi ngày. Tuy nhiên, tình trạng ùn tắc thường xuyên xảy ra, nhất là vào giờ cao điểm, dịp lễ Tết và cuối tuần, khiến việc di chuyển của người dân gặp khó khăn. UBND TP HCM ủng hộ đề xuất của doanh nghiệp và yêu cầu sở, ngành liên quan phối hợp thực hiện để sớm đưa phà vào hoạt động. Cần Giờ cách trung tâm TP HCM khoảng 50 km về phía Đông Nam, diện tích hơn 70.000 ha, trong đó gần 35.000 ha rừng ngập mặn phòng hộ. Vùng đất ngập nước này gắn liền hệ sinh thái rừng ngập mặn phục hồi sau chiến tranh, được UNESCO công nhận là Khu Dự trữ sinh quyển thế giới đầu tiên ở Việt Nam. Hồi tháng 4, Tập đoàn Vingroup khởi công Khu đô thị du lịch biển Cần Giờ diện tích 2.870 ha, quy mô dân số gần 230.000. Thành phố lên kế hoạch thu hút nhà đầu tư chiến lược thực hiện dự án Cảng trung chuyển quốc tế Cần Giờ. Thành phố cũng chấp thuận Vingroup nghiên cứu, lập hồ sơ tuyến metro dài 48,5 km, nối đại lộ Nguyễn Văn Linh đến dự án Khu đô thị lấn biển Cần Giờ. Lê Tuyết - Giang Anh","Thứ tư, 1/10/2025, 00:00 (GMT+7)",Lê Tuyết - Giang Anh,Thời sự,Giao thông,VN Express,
VNEX_011025_00088,Phụ huynh bức xúc vì 'ngành giáo dục Hà Nội phản ứng chậm chạp',https://vnexpress.net/phu-huynh-buc-xuc-vi-nganh-giao-duc-ha-noi-phan-ung-cham-chap-4945715.html,"Anh Ngô Bá Lục, ở Vĩnh Tuy, có hai con học lớp 12 và lớp 8 cho rằng ""Sở Giáo dục Hà Nội đã phản ứng quá chậm chạp và không đúng tinh thần chuyển đổi số quốc gia"". Theo phụ huynh này, nhiều ngày qua, mạng xã hội và nhiều kênh truyền thông của cơ quan chức năng và chuyên gia cập nhật từng giờ về thời tiết, cảnh báo để người dân chuẩn bị. ""Dự báo hai ngày sau bão số 10, Hà Nội sẽ mưa lớn, nhưng Sở không có động thái cho học sinh nghỉ học"", ông bố hai con bức xúc. Bình thường, hai con anh Lục tự đến trường bằng xe buýt. Sáng 30/9, con trai lớn tan học lúc 11h, đến 12h mới ra được điểm chờ xe nhưng đứng 30 phút không có xe. Gọi xe ôm công nghệ và đi nhiều điểm buýt vẫn không tìm được phương tiện, đành gọi anh Lục. Anh bắt đầu đi đón con lúc 13h30 nhưng 18h30 mới về được đến nhà. Nhiều đoạn ngập sâu, anh phải cõng con nhỏ trên lưng, gửi xe rất xa. ""Cả Hà Nội ngổn ngang trong biển nước, thật kinh khủng"", anh Lục nói. Anh đề xuất Sở Giáo dục nên phân quyền cho phường, xã, thậm chí cho hiệu trưởng các trường, căn cứ tình hình thời tiết thực tế để quyết định việc nghỉ học. ""Hà Nội rộng, có nơi mưa ngập nặng nhưng vùng khác vẫn nắng ráo. Nếu cho toàn thành phố nghỉ thì lãng phí, còn không nghỉ thì học sinh vùng ngập lại khổ"", anh Lục nói. Ông Nguyễn Vân Nga (70 tuổi) đội mưa, cõng cháu khoảng 500 m, từ trường Tiểu học Đại Từ để về chung cư số 1 Nguyễn Cảnh Dị. Ảnh:Huy Mạnh Chiều cùng ngày, sau gần hai giờ lội nước, chị Hồng Hoa, 35 tuổi, ở phường Nghĩa Đô mới đón được con trai lớp 2 về nhà. Sáng 30/9, chị dậy sớm nghe mưa xối xả, chờ thông báo nghỉ học nhưng không thấy. Dù chỉ cách trường hơn hai km, hai mẹ con mất gần một giờ di chuyển. Đến nơi, con lại được thông báo học online, học sinh nào trót đến trường tiếp tục học trên lớp. ""Tại sao trường không ra quyết định này từ đầu giờ sáng để phụ huynh và các con đỡ khổ?"", chị Hoa ý kiến. Buổi chiều, bà mẹ xin nghỉ làm từ 14h để về đón con. ""Về đến nhà thì nhận tin mai nghỉ học, trong khi mưa đã ngớt. Hôm ngập nặng thì đi, mai đường rút bớt lại cho nghỉ, thật khó hiểu"", chị nói. Nhiều phụ huynh đi đón con bị sóng đánh ngã do ôtô tải chạy nhanh trên đường Nguyễn Cảnh Dị (Định Công), chiều 30/9. Video:Huy Mạnh Hai ngày qua, Hà Nội dù không nằm trên đường đi của tâm bão Bualoi nhưng mưa lớn liên tục. Các đợt mưa chỉ cách nhau khoảng 15-30 phút làm phát sinh 82 điểm ngập úng chủ yếu ở nội đô và cửa ngõ phía Tây,giao thông hỗn loạn. Sáng 30/9, một số trường đã cho học sinh nghỉ hoặc đón học sinh muộn. Tuy nhiên, nhiều trường học trên địa bàn Thủ đô vẫn giữ lịch học bình thường. Trường THCS Cổ Nhuế 2, phường Đông Ngạc, phải nhờ lực lượng quân đội dùng xe chuyên dụng chở học sinh tới điểm khô ráo để phụ huynh đón con vào buổi trưa. Tới chiều, giao thông vẫn bị chia cắt khiến nhiều gia đình gặp khó khăn trong việc đưa con về nhà. Tối cùng ngày, Giám đốc Sở Giáo dục và Đào tạo Trần Thế Cương thông báo tất cả trường mầm non, phổ thông ở thủ đô với khoảng 2,3 triệu học sinh sẽ nghỉ học ngày 1/10 vì mưa lớn, đi lại khó khăn. Các học sinh trường con chị Hồng ngồi làm bài tập trên xe trong lúc tắc đường, từ trường về nhà, tối 30/9. Ảnh:Nhân vật cung cấp Chị Nguyễn Thị Hằng, 45 tuổi, ở Đống Đa, lại cho rằng quyết định của Sở Giáo dục Hà Nội là có cơ sở. Sáng qua, đường Hà Nội chưa ngập, tắc nghiêm trọng, nhiều xe vẫn lưu thông. Các doanh nghiệp cũng không có thông báo cho nhân viên nghỉ làm. ""Nếu bố mẹ đi làm, con được nghỉ phụ huynh sẽ than là quyết định bất ngờ, không biết gửi con ở đâu"", chị nói. Sáng 30/9, chị Hằng chủ động cho cả hai con nghỉ học, mình cũng nghỉ làm vì mưa lớn trong khi trường cách nhà 5 km. Chị cho rằng chính bố mẹ mới là người phải đưa ra quyết định trong trường hợp này, phù hợp với điều kiện của gia đình mình. ""Bố mẹ không sáng suốt, không chủ động được thì đừng nên trách trường, trách Sở"", chị nói. Song Nga","Thứ tư, 1/10/2025, 06:00 (GMT+7)",Song Nga,Đời sống,Tổ ấm,VN Express,
VNEX_011025_00082,"Khối u tim 'lắc lư' theo nhịp đập, nguy cơ gây đột quỵ.",https://vnexpress.net/khoi-u-tim-lac-lu-theo-nhip-dap-nguy-co-gay-dot-quy-4945778.html,"ThS.BS.CKII Huỳnh Hoàng Khang, Trưởng khoa Ngoại tim mạch, Trung tâm Tim mạch Can thiệp, Bệnh viện Đa khoa Tâm Anh TP HCM, cho biết u trong nhĩ trái bệnh nhân kích thước 47x27 mm, gần như bít kín lỗ van hai lá, gây hẹp, hở van, cản trở dòng máu xuống thất trái. Khối u không đứng yên mà lắc lư theo nhịp tim, tiềm ẩn nguy cơ vỡ bất cứ lúc nào. Trường hợp u vỡ, những mảnh vụn có thể trôi theo dòng máu lên não gây đột quỵ, xuống động mạch vành gây nhồi máu cơ tim, hoặc đi xuống làm tắc mạch thận, chi dưới... dẫn tới tổn thương nặng nề. Khối u còn có thể làm cản trở đường máu xuống thất trái dẫn đến phù phổi cấp đe dọa tính mạng. Trước đó, anh Huy khỏe mạnh, không triệu chứng bất thường. Bác sĩ phẫu thuật lấy trọn khối u và sửa van hai lá thành công, người bệnh hồi phục nhanh, xuất viện sau một tuần. Kết quả giải phẫu bệnh cho thấy khối u là sarcom cơ trơn (leiomyosarcoma), dạng ung thư nguyên phát rất hiếm ở tim. Anh Huy được chuyển khoa Ung bướu theo dõi điều trị tiếp. ""Đây là lần đầu tiên trong hơn 20 năm phẫu thuật tim tôi gặp trường hợp sarcom cơ trơn ở nhĩ trái"", bác sĩ Khang nói, thêm rằng đa phần khối u nhĩ trái là u nhầy (lành tính). Thống kê quốc tế cho thấy u tim nguyên phát chiếm 0,001-0,3% dân số, trong đó khoảng 90% lành tính. Ung thư tim hiếm vì cơ tim chủ yếu cấu tạo từ tế bào cơ chuyên biệt, ít có khả năng phân chia, sinh sản, khác với tế bào gan, phổi, dạ dày... vốn dễ phát triểnkhối u. Đa số ca ung thư tim nguyên phát được báo cáo trên y văn là angiosarcoma và thường gặp ở nhĩ phải. Bác sĩ phẫu thuật loại bỏ u tim cho bệnh nhân. Ảnh:Thanh Luận Ung thư tim thường biểu hiện triệu chứng sốt, mệt mỏi, sụt cân, đau nhức... hoặc diễn tiến âm thầm như trường hợp anh Huy. Khi khối u lớn, bệnh nhân có thể đột ngột suy tim (khó thở, phù, mệt nhiều), loạn nhịp tim,đau ngựchay ngất xỉu. Phương pháp điều trị ung thư tim gồm phẫu thuật cắt bỏ khối u kết hợp hóa trị, xạ trị. Tuy nhiên, tiên lượng còn hạn chế. Bác sĩ Khang dẫn nghiên cứu cho thấy tỷ lệ sống sót khoảng 50% trong năm đầu và dưới 20% vào năm thứ 5. Một số ca nếu được phẫu thuật triệt để kết hợp hóa trị, xạ trị có thể kéo dài cuộc sống lâu hơn, song vẫn hiếm gặp. Ung thư tim nguy hiểm vì thường được phát hiện muộn. Khám sức khỏe định kỳ, siêu âm tim và tầm soát ung thư sớm giúp tăng cơ hội phát hiện, điều trị kịp thời, kéo dài tuổi thọ. Thu Hà *Tên bệnh nhân đã được thay đổi","Thứ tư, 1/10/2025, 10:00 (GMT+7)",Thu Hà,Sức khỏe,Các bệnh,VN Express,
VNEX_011025_00024,Atletico thắng đậm trong ngày Simeone bị cấm chỉ đạo,https://vnexpress.net/atletico-thang-dam-trong-ngay-simeone-bi-cam-chi-dao-4945739.html,"Trong trận thua Liverpool trên sân Anfield ngày 17/9, HLVDiego Simeonexô xát với CĐV và nhận thẻ đỏ. Nhà cầm quân người Argentina cho rằng ôngphản ứng vì bị xúc phạm suốt trận, nhưng vẫn bị UEFA cấm chỉ đạo một trận do ""hành vi phi thể thao"". Vì thế, ông không được đứng ở ngoài đường biên, vào phòng thay đồ hoặc giao tiếp với các cầu thủ và nhân viên trong trận gặp Frankfurt tại sân nhà Metropolitano. Antoine Griezmann mừng bàn thứ 200 cho Atletico, trong trận thắng Frankfurt 5-1 ở lượt hai Champions League trên sân Metropolitano, động Riyadh Metropolitano, Madrid, Tây Ban Nha ngày 30/9/2025. Ảnh:Reuters Vắng HLV trưởng,Atleticovẫn thi đấu tưng bừng. Riêng hiệp một, họ dứt điểm 10 lần với 7 cú trúng đích - thống kê tốt nhất của CLB trong một trận tại Champions League kể từ trận gặp Astana hồi tháng 10/2015. Từ 7 cú sút trúng đích đó, chủ nhà ghi ba bàn nhờ công Giacomo Raspadori, Robin Le Normand và Antoine Griezmann. Trong đó,Griezmannchạm mốc 200 bàn ở trận thứ 454 khoác áo Atletico, bỏ xa cầu thủ xếp sau là Luis Aragones với 172 bàn cho CLB. Sang hiệp hai, Atletico ghi thêm hai bàn do công Giuliano Simeone vàJulian Alvarez, còn pha lập công duy nhất của Frankfurt thuộc về trung phong Jonathan Burkardt. Đây mới là lần thứ hai Atletico có năm cầu thủ ghi bàn trong một trậnChampions League, sau trận gặp Malmo vào tháng 10/2014, cũng với năm cầu thủ. Atletico đã ghi bàn trong 10 trận gần nhất tại Champions League (23 bàn), cân bằng thành tích tốt nhất của họ trong lịch sử giải, từng đạt được 3 lần (2008, 2014 và 2016). Đây cũng là lần thứ hai liên tiếp Atletico ghi năm bàn. Trước đó, đội bóng của Simeoneđè bẹp Real Madrid 5-2ở vòng bảy La Liga, cũng tại Metropolitano. Lautaro Martinez lập cú đúp trong trận Inter Milan thắng Slavia Praha 3-0 trên sân San Siro, Milan, Italy ngày 30/9. Ảnh:Reuters Ở trận đấu cùng giờ, đương kim á quânInter Milanhạ đội khách Slavia Praha 3-0 nhờ các bàn của Denzel Dumfries và cú đúp của Lautaro Martinez. Inter là một trong ba đội toàn thắng hai lượt đầu, bên cạnh Bayern Munich và Real Madrid. Hồng Duy","Thứ tư, 1/10/2025, 06:21 (GMT+7)",Hồng Duy,Thể thao,Bóng đá,VN Express,
VNEX_011025_00112,Có nên bán đất nền Hưng Yên vào TP HCM đầu tư căn hộ?,https://vnexpress.net/co-nen-ban-dat-nen-hung-yen-vao-tp-hcm-dau-tu-can-ho-4940638.html,"Tôi năm nay 42 tuổi, hiện sống cùng gia đình ở Hà Nội, sở hữu một lô đất nền 200 m2 tại vùng ven Hưng Yên. Lô đất này tôi mua cách đây hơn 6 năm với giá trên một tỷ, nay thị trường lên giá, có thể bán ra khoảng 2,5 tỷ đồng. Gần đây, tôi nghe bạn bè gợi ý nên ""chuyển trục"" dòng tiền vào TP HCM, nơi thị trường căn hộ vẫn sôi động, vừa có thể khai thác cho thuê, vừa kỳ vọng tăng giá trong vài năm tới. Tuy nhiên, ý định này khiến tôi phân vân, một phần do chưa từng đầu tư xa, cũng không có người thân quen ở TP HCM để hỗ trợ quản lý. Tôi băn khoăn nếu bán đất quê để mua một căn hộ chung cư trong Nam, liệu dòng tiền cho thuê có đủ ổn định. Liệu tiềm năng tăng giá có đáng để đánh đổi sự an toàn của khoản đất nền quen thuộc. Và với ngân sách hơn 2 tỷ đồng, tôi có thể mua ở đâu để vừa dễ cho thuê, vừa có cơ hội sinh lời trong dài hạn. Mong chuyên gia cho lời khuyên để tôi có một cái nhìn rõ ràng hơn trước khi đưa ra quyết định. Bất động sản khu đông TP HCM, thuộc phường Dĩ An. Ảnh:Quỳnh Trần Độc giả:Nguyễn Minh Chuyên gia tư vấn: Với kế hoạch bán lô đất 200 m2 ở Hưng Yên được khoảng 2,5 tỷ đồng để vào TP HCM mua chung cư vừa cho thuê vừa chờ tăng giá, bạn đang hướng đến chiến lược song song giữa lãi vốn và dòng tiền. Đây là mô hình đầu tư bền vững, nhưng ""đầu tư xa bờ"" cũng đi kèm nhiều rủi ro nếu thiếu sự chuẩn bị. Trước hết, khoảng cách địa lý sẽ làm việc quản lý tài sản trở nên phức tạp. Bạn cần cân nhắc liệu có người thân, bạn bè hoặc đối tác uy tín tại TP HCM để hỗ trợ hay không, bởi số vốn hơn 2 tỷ chưa đủ lớn để thường xuyên bay vào kiểm tra, giám sát. Từ khâu khảo sát dự án, ký hợp đồng đến quản lý cho thuê, bảo trì hay xử lý thủ tục hành chính, nếu thiếu sự hỗ trợ tại chỗ bạn sẽ gặp nhiều bất tiện, dễ bỏ lỡ thông tin thị trường, biến động giá hay quy hoạch hạ tầng mới. Với ngân sách hơn 2 tỷ, lựa chọn của bạn tại TP HCM chỉ xoay quanh các căn hộ cũ hoặc tái định cư diện tích 50-60 m2 ở khu vực xa trung tâm như Bình Chánh cũ, Thủ Đức cũ, quận 9 cũ hay quận 12 cũ, với giá khoảng 40 triệu đồng mỗi m2. Nếu mở rộng sang giáp ranh như Bình Dương, Long An cũ, bạn có thể mua căn hộ mới mở bán, diện tích tương tự, đầy đủ tiện ích hơn. Căn hộ giá hơn 2 tỷ thường cho thuê được 5-7 triệu đồng mỗi tháng. Sau khi trừ phí quản lý, môi giới, bảo trì, lợi nhuận ròng khoảng 50-70 triệu đồng một năm, tương đương tỷ suất 2,5-3,5%/năm, thấp hơn gửi tiết kiệm. Ngoài ra, chu kỳ 2-3 năm bạn sẽ phải chi thêm để sửa chữa, tân trang khi đổi khách thuê. Kỳ vọng chính sẽ nằm ở tiềm năng tăng giá. Tuy nhiên, với chung cư cũ phân khúc bình dân hoặc tái định cư, chất lượng xây dựng không cao và đã đạt mức giá 40 triệu đồng mỗi m2, nên khả năng bứt phá mạnh trong 5 năm tới khá hạn chế. Trong khi đó, căn hộ mới bàn giao tại vùng ven có triển vọng tăng 20-30% giá trị trong 3-5 năm đầu, nếu dự án đúng tiến độ và lấp đầy tốt. Bạn cũng cần lưu ý thêm về việc vay vốn. Do thu nhập, hồ sơ tín dụng chủ yếu ở miền Bắc, việc thế chấp căn hộ tại TP HCM có thể khiến ngân hàng đánh giá rủi ro cao hơn, hạn mức vay thấp hơn hoặc lãi suất cao hơn. Tóm lại, đầu tư xa không phải là không thể, nhưng để hạn chế rủi ro, bạn nên có người hỗ trợ quản lý tại địa phương, ưu tiên căn hộ mới ở vùng ven với tiềm năng tăng giá, thay vì chung cư cũ trong nội đô TP HCM. Chúc bạn đầu tư thành công! Ông Lê Quốc KiênChuyên gia tài chính, bất động sản","Thứ tư, 1/10/2025, 05:00 (GMT+7)",Ông Lê Quốc Kiên,Bất động sản,Tư vấn,VN Express,
