id,title,link,content,date,author,category,sub_category,source,summary
VNEX_260925_00046,Miley Cyrus: làm vườn là liều thuốc tinh thần,https://vnexpress.net/miley-cyrus-lam-vuon-la-lieu-thuoc-tinh-than-4942465.html,"Trên tạp chíCR Fashion Bookngày 22/9, ca sĩ Miley Cyrus trò chuyện với diễn viên Pamela Anderson về sự nghiệp và cuộc sống. Cô cho biết: ""Chăm sóc vườn tược là hoạt động vì chính mình. Khi chúng ta chia sẻ quá nhiều về bản thân, khoảng thời gian ngắn ngủi, quý báu dành cho những việc đơn giản - như gieo một hạt giống xuống đất, nuôi dưỡng nó - trở thành quá trình rất riêng tư"". Miley Cyrus trong bộ ảnh thực hiện hồi tháng 6. Ảnh:WireImage Ca sĩ so sánh đam mê mới như một phần của việc tập yoga vì được hòa mình vào thiên nhiên, để bàn tay bận rộn, cũng như thể hiện sựsáng tạo không cần gắn với danh tiếng và thành công.Khi thấy hoa nở vào mùa xuân, cô nói cảm giác như có ""một chiến thắng thực sự"". ""Tôi từng trải nghiệm điều đó trên sườn đồi sau nhà. Khi sắp đi lưu diễn, tôi đã vung vài hạt, nghĩ rằng biết đâu sẽ thấy điều kỳ diệu lúc về nhà. Và nó đã xảy ra"", giọng ca 33 tuổi. Miley Cyrus cảm ơn sự đóng góp của một người bạn - nhiếp ảnh gia Vijat Mohindra. Anh rải nhiều hạt giống trong vườn nhà của cô đến mức nơi này có khoảng 10.000 bông cúc dại, hơn 40 loài hoa hồng. ""Tôi trở về nhà và sườn đồi biến thành khu vườn cổ tích của công chúa"", Cyrus nói. Nghệ sĩ cũng tri ân mẹ - bà Tish Cyrus - đã cho cô tiếp xúc hoa cỏ từ nhỏ vì bà luôn cắm hoa khắp nơi. Theo Cyrus, mẹ trở thành một nhà làm vườn tài ba trong hai năm ở nhà tránhCovid-19. Cô cho biết: ""Một cái cây có thể chết cả năm nhưng mẹ tôi vẫn có cách hồi sinh nó"". MV ""Flowers"" (2023) của Miley Cyrus. Ca khúc mang lại cho cô tượng vàng Grammy đầu tiên trong sự nghiệp với danh hiệu ""Màn biểu diễn nhạc pop"" tại lễ trao giải năm 2024. Video:YouTube/ Miley Cyrus TheoPeople, Miley Cyrus bắt đầu cai nghiện chất kích thích từ năm 2019. Trước đây, cô có lối sống phóng túng, thích tiệc tùng và thường viết về đề tài này trong nhiều sáng tác. Năm 2017, Cyrus xuất hiện trên truyền hình với tình trạng thiếu tỉnh táo vì dùng nhiều cần sa. Trong cuộc phỏng vấn vớiApple Musictháng 5, ca sĩ nói việc từ bỏ chất gây nghiện thay đổi cuộc đời cô hoàn toàn. TrênGood Morning Americatháng 7, Cyrus cho biết hiện ưu tiên sức khỏe tinh thần, không còn muốn tổ chức các chuyến lưu diễn dù có đủ sức lực và cơ hội. Lần gần nhất nghệ sĩ tổ chức concert vào năm 2014 vớiBangerz Tour. Cô nói cảm thấy rất khó để duy trì sự tỉnh táo, giữ trạng thái cân bằng trong tour diễn. ""Trên sân khấu, hàng nghìn người hâm mộ reo hò khiến lượng dopamine của bạn tăng vọt, bạn cảm nhận rất nhiều tình yêu dành cho mình. Nhưng mọi thứ hoàn toàn sụp đổ khi show kết thúc. Bạn bắt đầu nghĩ một người yêu mình là không đủ. Bạn cần đến 10.000 người rồi 80.000"", Miley Cyrus giải thích thêm. Dopamine được gọi là ""hormone hạnh phúc"", có vai trò thúc đẩy cảm xúc tích cực như hạnh phúc và khoái cảm. Miley Cyrussinh năm 1992, là ca sĩ, diễn viên người Mỹ, nổi tiếng với vai Hannah Montana trong series cùng tên của Disney. Miley từng đượcTimeđưa vào danh sách 100 người có tầm ảnh hưởng nhất năm 2008 và 2014. Tại Grammy 2024, ca sĩ thắng hai giải Solo nhạc pop xuất sắc và Ghi âm của năm cho bản hitFlowers. Các ca khúc nổi tiếng của cô còn có:When I Look At You,We Can't Stop,Wrecking Ball,Malibu. Tháng 7, phòng thương mại Hollywood công bố Miley Cyrus là một trong 35 cái tên đượcgắn saotại Đại lộ Danh vọng 2026. Phương Thảo(theoCR Fashion Book,People)","Thứ sáu, 26/9/2025, 08:50 (GMT+7)",Phương Thảo,Giải trí,Giới sao,VN Express,
VNEX_260925_00050,Mẹ đơn thân chiến đấu với ung thư,https://vnexpress.net/me-don-than-chien-dau-voi-ung-thu-4943592.html,"Tin ung thư vú giai đoạn 3C đến với chị Ánh chưa đầy một tháng sau phiên tòa ly hôn. Khi ấy là năm 2023, chị được quyền nuôi hai con 7 và hai tuổi, chưa kịp lấy lại bình tĩnh để sắp xếp cuộc sống sau đổ vỡ hôn nhân thì đối mặt với ""bản án tử"". ThS.BS.CKI Huỳnh Bá Tấn, khoa Ngoại Vú - Đầu Mặt Cổ, Bệnh viện Đa khoa Tâm Anh TP HCM, cho biết tiên lượng sống sau 5 năm của người bệnh ung thư vú giai đoạn ba là khoảng 40-86% tùy thuộc tính chất sinh học của u, tuổi người bệnh. Kết quả này cũng tùy thuộc bệnh nhân có nỗ lực điều trị, có động lực chiến đấu với bệnh tật để sống, có sự đồng hành của gia đình hay không. Chị Ánh gần như tuyệt vọng. ""Trước mắt tôi khi ấy là khoảng không vô định: không chồng, không chỗ dựa, bệnh hiểm nghèo lại phải nuôi dạy hai con thơ"", chị Ánh nhớ lại. Chưa kể, áp lực kinh tế cũng là yếu tố khiến chị từ chối điều trị, nghĩ cái chết như một cách giải thoát. Chị kể nhiều đêm nhìn các con nằm ngủ bên cạnh, chạnh lòng ""không còn mẹ thì các con sẽ sống ra sao"" nên chuẩn bị tâm thế sau khi ra đi gửi con cho em gái ruột chăm sóc. Người thân biết chuyện, động viên chị cố gắng điều trị để ""sống vì con"" và gom góp tiền hỗ trợ. Chị có động lực hơn để bước vào cuộc chiến. Chị được phẫu thuật cắt tuyến vú với kế hoạch chi tiết, cẩn thận, kết quả giải phẫu bệnh ghi nhậnung thư vú di cănđến 12 hạch nách, hạch thượng đòn. Tế bào ung thư lan đến thành ngực. Chuỗi ngày kế tiếp là hóa trị, xạ trị tiêu diệt tế bào ung thư còn sót lại và ngăn nguy cơ tái phát. Cứ sau mỗi đợt truyền hóa chất mẹ chán ăn, con gái 7 tuổi học cách nấu cháo thịt bằm rau củ cho mẹ mà chị vẫn nói là ""ngon nhất trần đời"". Song song với điều trị, chị Ánh vẫn đi làm tại cửa hàng tiện lợi để có thu nhập duy trì cuộc sống. Lịch tái khám, hóa, xạ trị trùng lịch làm việc, may mắn các đồng nghiệp sẵn sàng thay đổi ca thuận lợi nhất cho chị. Có gia đình, đồng nghiệp, bạn bè sẻ chia, chị Ánh được tiếp thêm sức mạnh tinh thần, vật chất, không gục ngã khi cùng lúc xảy ra nhiều biến cố. Sau gần hai năm kiên trì chiến đấu, chị Ánh thở phào khi bác sĩ thông báo ""bệnh đã thoái lui, sức khỏe ổn định"". Bác sĩ Tấn kiểm tra sức khỏe cho chị Ánh trong thời gian điều trị. Ảnh:Bệnh viện Đa khoa Tâm Anh Còn chị Hằng, 38 tuổi, mẹ đơn thân nuôi con ba tuổi, ung thư đại tràng giai đoạn ba. Ban đầu, chị nản lòng không muốn điều trị vì lo ngại mổ. Song mỗi ngày về nhà nhìn con chạy lon ton vui vẻ đón mẹ, chị quyết định phẫu thuật cắt một phần đại tràng và nạo hạch di căn, sau đóhóa trịđể ngăn ngừa tái phát. Tiền thuốc, tiền sữa, tiền học, tiền sinh hoạt gia đình cộng dồn thành gánh nặng. Vừa điều trị vừa bán hàng online, thu nhập ít ỏi chỉ đủ chi tiêu cơ bản nên chị ngưng chữa bệnh, bỏ cuộc giữa chừng. Bác sĩ Tấn thuyết phục rằng chị Hằng đang đáp ứng tốt với hóa trị, tiên lượng sống sau 5 năm khoảng 90%, nếu ngưng điều trị sẽ bỏ lỡ cơ hội tốt. Nghĩ đến cảnh con chưa lớn đã mất mẹ, chị vay mượn tiền để điều trị tiếp. Hiện, kết quả kiểm tra cho thấy chị Hằng đã kiểm soát được ung thư song phải duy trì tái khám định kỳ để theo dõi, phát hiện bất thường. Điều dưỡng truyền thuốc cho chị Hằng trên ghế chuyên dụng dễ dàng điều chỉnh tư thế, êm ái. Ảnh:Bệnh viện Đa khoa Tâm Anh Một người khi nhận chẩn đoán ung thư thường sẽ trải qua cú sốc tâm lý và đối mặt gánh nặng kinh tế lẫn tinh thần. Tâm lý buông xuôi cho rằng ung thư là ""án tử"" cùng với chi phí điều trị và duy trì kinh tế gia đình là vấn đề lớn khiến người bệnh dễ từ chối điều trị hoặc bỏ cuộc giữa chừng. Các phương pháp điều trị như phẫu thuật, hóa trị, xạ trị, thuốc nội tiết... bên cạnh tác dụng tiêu diệt tế bào ác tính, cũng gây nhiều tác dụng phụ, mệt mỏi về tinh thần, thể chất. So với những bệnh nhân khác, mẹ đơn thân mắc ung thư đối mặt nhiều áp lực hơn. Họ suy kiệt thể chất, khủng hoảng tinh thần, bế tắc kinh tế gấp nhiều lần. Đồng thời, họ vừa nuôi con vừa điều trị bệnh, trong khi cần người thân bên cạnh động viên để có thể tập trung chữa bệnh. Tâm lý bị dồn nén, căng thẳng kéo dài khiến người bệnh dễ nản lòng buông xuôi. Hormone căng thẳng tăng cao như cortisol, gây suy giảm hệ miễn dịch, làm chậm quá trình hồi phục. Nếu không có con cái đồng hành, gia đình hỗ trợ tâm lý, nhiều người bệnh có thể bỏ cuộc, mất động lực chiến đấu. Ung thư vúlà nguyên nhân tử vong do ung thư hàng đầu ở phụ nữ Việt Nam, với hơn 24.000 ca mắc ở cả hai giới, theo Globocan 2022. Tuy nhiên, đây cũng là bệnh ung thư có khả năng điều trị khỏi cao và tỷ lệ sống sau 5 năm cao nhất. Quá trình điều trị có thể kéo dài từ ba tháng đến hàng chục năm, trải qua nhiều giai đoạn, cần sự kiên trì, bền bỉ của người bệnh. Với sự phát triển của y học, nhiều phác đồ đã rút ngắn thời gian nằm viện, tối ưu chi phí nhưng vẫn đạt hiệu quả cao. Đồng thời, quá trình điều trị cũng có sự hỗ trợ của bảo hiểm y tế, giúp giảm phần nào gánh nặng chi phí, theo bác sĩ Tấn. Bác sĩ khuyên người bệnh nên tìm kiếm sự hỗ trợ từ người thân, bạn bè về mặt tài chính, chăm sóc con, đưa đón con đi học... Sự động viên của gia đình, bạn bè, đồng nghiệp cũng tiếp thêm sức mạnh cho họ. Khi người bệnh không còn đơn độc về kinh tế, tinh thần, cơ hội chiến thắng bệnh sẽ lớn hơn. Hiện, cuộc sống của chị Ánh và hai con ổn định hơn trước. Mỗi ngày, chị đưa các con đến trường rồi đi làm, chiều về xuống bếp nấu những món con yêu thích. Tóc chị mọc lại sau những đợt hóa trị, khuôn mặt tươi tắn hơn. ""Nếu tôi bỏ điều trị, ba mẹ con đã không có những bữa cơm quây quần ấm cúng như thế này"", chị Ánh nói, thêm rằng ngôi nhà lúc nào cũng rộn vang tiếng cười, nói của các con thơ. Còn chị Hằng dự định mở cửa tiệm nhỏ để vừa ổn định kinh tế vừa có thời gian linh động chăm sóc con và bản thân. Chị cố gắng tập thể dục thường xuyên, ăn uống nhiều rau, thịt nạc, cá... Buổi tối, chị đọc truyện, chơi cùng con, bù đắp quãng thời gian điều trị đau đớn cũng là trân trọng từng khoảnh khắc bên gia đình. Nguyễn Trăm *Tên người bệnh đã được thay đổi","Thứ sáu, 26/9/2025, 09:00 (GMT+7)",Nguyễn Trăm,Sức khỏe,Các bệnh,VN Express,
VNEX_260925_00058,'Xe máy trùm kín vạch mắt võng vì ôtô chiếm đường',https://vnexpress.net/xe-may-trum-kin-vach-mat-vong-vi-oto-chiem-duong-4943638.html,"Tại TP HCM, tình trạng ùn tắc giao thông đã trở thành vấn nạn. Hàng loạt giao lộ được kẻ vạch mắt võng, bố trí tín hiệu cho xe rẽ phải liên tục mục đích giúp dòng xe thông suốt đồng thời cấm các phương tiện dừng, nhằm giữ lối ra cho dòng xe từ nhánh đường khác hòa nhập giảm thiểu ùn tắc. Thế nhưng, thực tế tại nhiều ngã tư, nút giao, vạch mắt võng lại bị... vô hiệu hóa. Xe máy dừng đỗ chen chúc đứng chật kín trên vạch mặt võng. Nhưng nếu chỉ trách người đi xe máy thì chưa đúng vì nguyên nhân nhiều khi lại xuất phát từ ôtô. Ôtô dàn hàng ngang, chiếm trọn mặt đường và dừng ngay sát vạch dừng đèn đỏ. Khi đó, làn đường cho xe máy vốn đã nhỏ nay càng bị thu hẹp. Người điều khiển xe hai bánh, không còn lựa chọn, buộc phải leo sang khu vực mắt võng thậm chí là vỉa hè để có chỗ đứng. Hệ quả là mắt võng mất tác dụng, xe từ nhánh đường bên không thể nhập dòng, giao thông thêm rối loạn. Vạch mắt võng chỉ phát huy tác dụng khi các loại phương tiện cùng tôn trọng nguyên tắc ""không chắn lối"". Nhưng tài xế ôtô thường chỉ quan tâm tới việc mình dừng đúng vạch đèn đỏ, ít để ý đến dòng xe máy phía sau. Xe máy bị chèn ép, bịt đường, không còn vị trí nào ngoài việc chiếm luôn ô mắt võng. Thậm chí có trường hợp ôtô còn dừng đè lên cả vạch mắt võng. Để giải quyết tình trạng này, ngoài việc tăng cường xử phạt xe máy dừng sai vị trí, cần nhìn nhận lỗi của ôtô trong việc chiếm hết diện tích đường. Lực lượng chức năng có thể nghiên cứu kẻ lại vạch phân làn, đảm bảo đủ khoảng trống cho xe máy dừng chờ; đồng thời nhắc nhở lái xe ôtô hiểu rằng giữ lối đi thông thoáng chính là góp phần giảm ùn tắc cho chính họ. Tóm lại, theo tôi xe máy đè lên vạch mắt võng không chỉ do ý thức cá nhân mà còn từ cách dừng, cách chiếm đường của ôtô. Khi chưa giải quyết tận gốc nguyên nhân này, mọi nỗ lực giữ cho mắt võng phát huy tác dụng sẽ khó đạt hiệu quả. Đây không chỉ là câu chuyện của riêng người điều khiển xe máy, mà là trách nhiệm chung của tất cả người tham gia giao thông. Độc giảVũ Vũ","Thứ sáu, 26/9/2025, 08:57 (GMT+7)",Vũ Vũ,Xe,Diễn đàn,VN Express,
VNEX_260925_00057,Top 20 đại học khai phóng hàng đầu Mỹ năm 2026,https://vnexpress.net/top-20-dai-hoc-khai-phong-hang-dau-my-nam-2026-4943881.html,"U.S.News ngày 23/9 công bố bảng xếp hạng đại học khai phóng tốt nhất nước Mỹ năm 2026. Top 10 chủ yếu vẫn là những cái tên quen thuộc, nhưng dao động nhẹ về thứ hạng. Học viện Hải quân Mỹ vươn lên top 3, vượt qua Swarthmore. Học viện Không quân Mỹ cũng tăng ba hạng để vào top 5, trong khi Swarthmore, Carleton và Pomona đều tụt hạng. Gương mặt mới của top 10 là Đại học Harvey Mudd, tăng hai bậc so với năm ngoái. Ở top 11-20, các trường khá đồng đều, khi có tới 9 trường cũng được xếp hạng 13. Học phí top 20 đại học khai phóng hàng đầu Mỹ trong khoảng 67.000 – 74.000 USD mỗi năm (1,7 - 1,9 tỷ đồng). Riêng các trường quân sự không thu học phí. Trường Xếp hạng Học phí (USD/năm) Đại học Williams 1 72.500 Đại học Amherst 2 73.800 Học viện Hải quân Mỹ 3 - Đại học Swarthmore 4 69.200 Học viện Không quân Mỹ 5 - Đại học Bowdoin 5 71,700 Đại học Wellesley 7 70,100 Đại học Pomona 7 68,700 Đại học Claremont McKenna 7 72.100 Học viện Quân sự Mỹ, West Point 10 - Đại học Harvey Mudd 10 73.100 Đại học Carleton 10 72.100 Đại học Wesleyan 13 72.800 Đại học Vassar 13 74.300 Đại học Smith 13 67.400 Đại học Middlebury 13 70.600 Đại học Hamilton 13 72.700 Đại học Grinnell 13 72.300 Đại học Davidson 13 69.100 Đại học Barnard 13 73.000 Thay vì tập trung đào tạo chuyên sâu một ngành học như các đại học nghiên cứu, các trường khai phóng (LAC) chú trọng trang bị nền tảng kiến thức rộng và các kỹ năng linh hoạt. Quy mô sinh viên thường nhỏ hơn, lớp học ít người, tạo điều kiện cho sự tương tác gần gũi giữa người học và giảng viên. Các trường LAC cũng có nguồn quỹ hỗ trợ tài chính dồi dào, cung cấp học bổng dựa trên thành tích học tập (merit-based) và cả hỗ trợ tài chính dựa trên nhu cầu (need-based) cho du học sinh. Khác với bảng xếp hạng đại học quốc gia (NU), các trường khai phóng được đánh giá chỉ với 13 tiêu chí, ít hơn 4. Tuy nhiên, ba thước đo quan trọng nhất không đổi: Đánh giá từ các trường bạn (20%), tỷ lệ tốt nghiệp (16%) và tỷ lệ tốt nghiệp so với dự đoán (10%). Bảng xếp hạng cao đẳng và đại học Mỹ của U.S. News ra đời từ năm 1983, là nguồn tham khảo phổ biến của sinh viên quốc tế, bên cạnh hai bảng xếp hạng QS và THE. Sinh viên trong lễ tốt nghiệp Đại học Amherst, Mỹ. Ảnh:Amherst College Fanpage Khánh Linh","Thứ sáu, 26/9/2025, 09:51 (GMT+7)",Khánh Linh,Giáo dục,Du học,VN Express,
VNEX_260925_00009,Alcaraz suýt dính chấn thương nặng ở Tokyo,https://vnexpress.net/alcaraz-suyt-dinh-chan-thuong-nang-o-tokyo-4943780.html,"Trong điểm đầu của game thứ năm, khi tỷ số đang là 2–2, Alcaraz chạy tập tễnh và ngã xuống sân khi cố bám đuổi pha bỏ nhỏ của Baez. Anh ngồi luôn ở sân với vẻ đau đớn, rồi được đội ngũ y tế chăm sóc. Pha quay chậm cho thấy Alcaraz bị đau ở cổ chân trái hoặc gân Achilles. ""Tôi có chút lo sợ sau tình huống đó"", Alcaraz chia sẻ sau trận. ""Tôi nghĩ mình sẽ phải bỏ cuộc vì lúc đó tôi không thể di chuyển được. Nhưng đội ngũ vật lý trị liệu đến kiểm tra, và khi tôi không cảm thấy gì nữa thì tôi tự tin hơn để tiếp tục. Tôi rất vui khi kết thúc trận đấu như ý muốn. Tôi sẽ cố hồi phục, làm mọi thứ để sẵn sàng cho vòng kế tiếp"". Alcaraz tập tễnh ở giữa set một trận gặp Baez, trên sân Trung tâm ở tổ hợp Musashino Forest Sports Plaza, Tokyo, Nhật Bản hôm 25/9. Ảnh:Reuters Sau khi được chăm sóc, Alcaraz di chuyển dè dặt hơn và phải sử dụng nhiều cú cắt bóng hơn. Dẫu vậy, anh vẫn ba lần thắng game đỡ bóng và không để đối thủ số 41 thế giới người Argentina đe dọa game giao, để thắng 6-4, 6-2. TheoMarca,Alcarazsẽ không đi kiểm tra y tế sau trận, mà chờ vào cảm nhận của cơ thể sau giấc ngủ hôm nay. Ưu tiên hàng đầu của tay vợt Tây Ban Nha là ở lại với giải đấu càng lâu càng tốt, để không phụ sự kỳ vọng của khán giả. Mùa này, Alcaraz đã giành 7 danh hiệu, trong đó có hai Grand Slam. ""Đây là mùa giải tốt nhất của tôi"", hạt giống số một nói. ""Tôi đã giành nhiều chức vô địch, chơi thứ tennis tuyệt vời, trưởng thành qua từng trận. Mùa giải có thể tốt hơn, nhưng tôi không thể phàn nàn sau những gì đã có"". Khi được hỏi về việc vượt qua kỷ lục 24 Grand Slam của Novak Djokovic, Alcaraz nói rằng giờ chưa phải lúc nghĩ đến con số đó. Tay vợt 22 tuổi đang sở hữu 6 major, bằng một phần tư Nole. Lúc này anh tập trung vào cuộc đua cho vị trí số một thế giới cuối năm vớiJannik Sinner, người thắng Marin Cilic 6-2, 6-2 ở vòng một Trung Quốc Mở rộng hôm nay 25/9. Vy Anh","Thứ sáu, 26/9/2025, 05:05 (GMT+7)",Vy Anh,Thể thao,Tennis,VN Express,
VNEX_260925_00055,Bạn gái định bỏ con 4 tháng cho bà ngoại chăm để đi chơi xa,https://vnexpress.net/ban-gai-khong-chiu-cuoi-con-chung-da-gan-3-thang-nhung-ban-gai-luon-tranh-ne-toi-4943839.html,"Tôi có con với bạn gái, chưa cưới và chưa đăng ký kết hôn. Tôi cảm nhận em không còn yêu tôi, luôn tìm cách tránh né, không muốn gặp tôi. Em sinh tháng bảy nhưng dự định tháng 11 đi Hà Nội chơi, bỏ con ở nhà với bà ngoại. Tôi hỏi em có muốn tôi đi cùng, em trả lời không. Tôi rủ em đi chơi cuối tháng 10 nhưng em nói đang bệnh không muốn đi, khuyên tôi ở nhà ngủ cho khỏe. Tôi ở nhà tôi, em ở nhà em, hai nhà cách nhau 20 km. Tôi hỏi em ""Có phải trái tim em hết yêu anh rồi và không còn hy vọng gì nữa đúng không? Anh cần câu trả lời thật lòng từ trái tim em"". Em chỉ nói mới sinh xong, sức khỏe yếu lắm, suy nghĩ đủ điều, dùng đủ lý do và né tránh câu hỏi của tôi. Em còn nói ""Anh không biết suy nghĩ cho người khác, chỉ biết cảm xúc của bản thân, chỉ cần anh để em yên là được"", nào là ám ảnh tâm lý... Thật sự tôi cảm nhận tình cảm em dành cho tôi đã hết nhưng em biện đủ lý do đổ ngược tội lỗi lên đầu tôi, chứ không trả lời câu hỏi. Tôi không hiểu, chỉ cần một câu: ""Vẫn còn tình cảm"" hoặc ""Hết tình cảm"" khó nói đến vậy sao? Ai từng rơi vào hoàn cảnh này hoặc có kinh nghiệm, xin hãy cho tôi lời khuyên chân thành, làm sao biết được bạn gái vẫn còn yêu mình, hay tôi nên làm gì trong hoàn cảnh này? Khang Nguyên","Thứ sáu, 26/9/2025, 09:24 (GMT+7)",Khang Nguyên,Tâm sự,,VN Express,
VNEX_260925_00052,Xóa cận 5 độ kèm loạn thị cho cô gái trẻ,https://vnexpress.net/xoa-can-5-do-kem-loan-thi-cho-co-gai-tre-4943677.html,"Du khám tại Trung tâm Mắt Công nghệ cao, Bệnh viện Đa khoa Tâm Anh TP HCM ghi nhận thị lực không kính rất kém, chỉ đếm được ngón tay trong phạm vi 4 m. Kết quả chụp bản đồ giác mạc cho thấy độ cong giác mạc bình thường. Các chỉ số về độ dày, hình dạng và độ chắc khỏe của giác mạc cô gái đáp ứng phẫu thuật laser để điều trị tật khúc xạ. ThS.BS Tăng Ngọc Anh, Phó khoa Mắt, Trung tâm Mắt Công nghệ cao, tư vấn Du có thể chọn một trong hai phương pháp phẫu thuật Femto Pro hoặc Smile Pro. Cô chọn kỹ thuật Femto Pro để phù hợp với nhu cầu, thói quen sinh hoạt, làm việc, vận động. Femto Pro hoặc Smile Pro là hai phương pháp phẫu thuật hiện đại nhất hiện nay, sử dụng laser Femtosecond. Smile Pro ưu điểm lớn nhất là không tạo vạt giác mạc, phục hồi nhanh, thích hợp cho mắt nhạy cảm hoặc người cần hoạt động thể thao sớm. Tuy nhiên chi phí phẫu thuật Smile Pro cao hơn. Trong khi đó, Femto Pro có tạo vạt giác mạc nhưng nhờ dùng tia laser thay vì dao cơ học nên độ chính xác cao, vết mổ chính xác, giảm tối đa sai lệch và hạn chế biến chứng. Bác sĩ Ngọc Anh khám mắt cho Khánh Du. Ảnh:Bệnh viện Đa khoa Tâm Anh Bác sĩ sử dụng laser Femtosecond thay thế dao cơ học, giúp tạo vạt giác mạc mỏng, bề mặt mịn, đều và chính xác. Sau đó, tia laser Excimer sẽ định hình lại giác mạc, điều chỉnhtật khúc xạ. Sau phẫu thuật, thị lực Du đạt 10/10 ở cả hai mắt, vết mổ lành tốt, thời gian phục hồi nhanh. Khánh Du trước và sau khi xóa cận. Ảnh:Nhân vật cung cấp Theo bác sĩ Ngọc Anh, không phải mọi người bị cận thị đều có thể phẫu thuật mà phụ thuộc vào độ dày và hình dạng giác mạc, chỉ số cơ sinh học giác mạc, mức độ cận - loạn, cùng tình trạng sức khỏe tổng thể. Người bị giác mạc mỏng bất thường, nghi ngờ giác mạc chóp hoặc có bệnh lý mắt kèm theo thường được khuyến cáo không nên mổ. Người có nhu cầuxóa cậnnên đi khám tại cơ sở y tế uy tín có chuyên khoa Mắt. Nhật Thành","Thứ sáu, 26/9/2025, 08:00 (GMT+7)",Nhật Thành,Sức khỏe,Các bệnh,VN Express,
