id,title,link,content,date,author,category,sub_category,source,summary
VNEX_210725_00020,Kroos giải nghệ vì sợ làm cầu thủ dự bị,https://vnexpress.net/kroos-giai-nghe-vi-so-lam-cau-thu-du-bi-4916515.html,"Năm 2024, Kroos chia tay sân cỏ khi mới 34 tuổi. Lúc đó, anh vừa giành Champions League và La Liga cùng Real. Quyết định của Kroos gây tranh cãi, vì nhiều cầu thủ khác vẫn thi đấu đỉnh cao ngay cả khi bước vào giai đoạn xế chiều sự nghiệp, gồm cả Lionel Messi (38 tuổi), Luka Modric (39) và Cristiano Ronaldo (40). ""Trước khi ai đó đẩy tôi lên ghế dự bị vì tôi không còn giỏi nữa, hoặc vì tôi không còn quan trọng với đội bóng như trước, thì tôi chọn cách tự mình ra đi"", Kroos nói trên tờEl Paishôm 19/7. ""HLV, gia đình, hay cơ thể đều không thể khuyên tôi khi nào nên giải nghệ. Bạn phải rời đi trước khi cơ thể kêu gọi dừng lại"". Kroos (phải) và Modric mừng chiến thắng sau trận chung kết Champions League 2024. Ảnh:UEFA Kroos cũng cho biết định giải nghệ vào năm 33 tuổi. Nhưng khi đó, anh chấp nhận gia hạn một phần vì nỗ lực thuyết phục của Real, một phần vì muốn ra đi ở đỉnh cao. ""Điều tốt nhất là rời đi trong tâm trạng phấn chấn"", cựu tiền vệ người Đức nói thêm. ""Thật khó để làm tốt hơn những gì tôi làm được trong mùa giải cuối cùng: giành Champions League và La Liga"". Khi còn thi đấu, Kroos là tiền vệ trung tâm số một của Real. Anh luôn xuất sắc trong các vai trò điều chỉnh nhịp độ trận đấu, phân phối bóng, hỗ trợ phòng ngự và tấn công. Mùa 2024-2025, Real thất bại trên cả bốn đấu trường chính gồm: Champions League, La Liga, Cup Nhà vua và Club World Cup. Theo giới chuyên môn, một trong những vấn đề khiến đội bóng Tây Ban Nha sa sút là mất Kroos. Man City cũng khủng hoảng sau khi mất tiền vệ trung tâm Rodri, cầu thủ bị rách dây chằng đầu gối hồi tháng 9/2024. Mùa vừa qua, đội chủ sân Etihad thất bại ở cả Ngoại hạng Anh, Cup FA, Cup Liên đoàn, Champions League và Club World Cup. ""Không còn nghi ngờ gì nữa, tiền vệ trung tâm đóng vai trò thiết yếu trong bóng đá hiện đại"",Kroosnói. ""Hãy nhìn những gì đã xảy ra với Man City sau khi Rodri dính chấn thương. Khi một tiền vệ trung tâm hoặc một tiền vệ phòng ngự giỏi có mặt, mọi thứ ổn đến mức bạn không nhận ra. Và khi anh ấy vắng mặt, mọi người mới cảm thấy nhớ"". Kroos từng giành một Champions League, ba Bundesliga với Bayern, năm Champions League, bốn La Liga vớiRealvà World Cup 2014 với tuyển Đức. Anh là một trong 5 cầu thủ giữ kỷ lục giành sáu Cup C1/Champions League, bên cạnh Luka Modric, Nacho, Dani Carvajal và Gento. Thanh Quý(theoEl Pais)","Thứ hai, 21/7/2025, 06:23 (GMT+7)",Thanh Quý,Thể thao,Bóng đá,VN Express,"Toni Kroos giải nghệ ở tuổi 34 sau khi cùng Real Madrid vô địch Champions League và La Liga 2024, một quyết định gây tranh cãi so với nhiều cầu thủ khác. Anh quyết định ra đi khi vẫn ở đỉnh cao phong độ, tránh tình trạng bị đẩy lên ghế dự bị. Kroos nhấn mạnh vai trò quan trọng của tiền vệ trung tâm trong bóng đá hiện đại, dẫn chứng sự sa sút của Real Madrid và Man City khi thiếu vắng anh và Rodri. Sự nghiệp lẫy lừng của Kroos với nhiều danh hiệu lớn khẳng định vị thế của anh trong làng bóng đá thế giới."
VNEX_210725_00096,Ám ảnh lái xe dưới mưa giông gió lốc,https://vnexpress.net/am-anh-lai-xe-duoi-mua-giong-gio-loc-4916681.html,"Hiện, bản thân tôi vẫn chưa hết ám ảnh vì phải chứng kiến một trận mưa giông vô cùng lớn trong ngày 19/7 tại Hà Nội. Từ đó khiến cho tôi cảm thấy ám ảnh vì phải lái xe trong điều kiện thời tiết rất xấu. Do vậy, tôi muốn chia sẻ với các bạn về nỗi ám ảnh rất đáng sợ khi mà tôi lái xe vào những điều kiện thời tiết giông lốc, gió to như thế này. Ảnh:Huy Mạnh Trời chuyển mây đen, gió bắt đầu rít qua những tán cây, và từng giọt mưa đầu tiên rơi xuống kính chắn gió. Với nhiều người, đó đơn giản chỉ là một cơn mưa giông thoáng qua. Nhưng với những tài xế, đặc biệt là người từng trải qua tai nạn hoặc chứng kiến hậu quả thảm khốc của thời tiết xấu, đó là một nỗi ám ảnh thật sự, một hành trình đầy bất an, nơi mỗi khúc cua hay vũng nước có thể trở thành bẫy tử thần. Tôi còn nhớ lúc ấy là khoảng 16h ngày 19/7, lúc đó tôi vừa rời khỏi trạm dừng, trời bắt đầu tối sầm và đổ mưa lớn. Tầm nhìn gần như bằng không, kính mờ do hơi nước, gạt mưa không đủ sức dọn sạch lớp nước dày đặc. Xe trước tôi bất ngờ phanh gấp, tôi đạp phanh theo phản xạ nhưng bánh xe trượt dài. May mắn là không tông vào xe phía trước, nhưng xe tôi xoay ngang, chỉ cách lan can vài phân. Từ đó khiến cho bản thân tôi cảm thấy sợ vì không phải đây là lần đầu tiên tôi lái xe trong điều kiện thời tiết mưa to như thế. Những tình huống như vậy không hiếm gặp. Theo thống kê của Cục Cảnh sát Giao thông, số vụ tai nạn giao thông tăng đột biến trong điều kiện thời tiết xấu, đặc biệt là trong mưa giông. Tầm nhìn hạn chế, đường trơn trượt, gió mạnh cộng với tâm lý hoảng loạn là những yếu tố khiến lái xe dễ đưa ra quyết định sai lầm. Lúc ấy tôi còn nhớ là tôi từng bị mắc kẹt trên cầu Vĩnh Tuy (Hà Nội) trong một trận mưa giông dữ dội. Sấm chớp liên tục, gió mạnh đến nỗi xe rung bần bật. Tôi không dám tiếp tục chạy mà cũng không dám dừng hẳn. Cảm giác như mình đang bị nhấn chìm giữa cơn cuồng nộ của thiên nhiên. Từ đó trở đi, cứ thấy mây đen là tôi né ngay việc lái xe. Không phải ai cũng may mắn thoát nạn. Những vụ tai nạn nghiêm trọng do mưa giông vẫn xảy ra thường xuyên. Có trường hợp xe máy bị gió quật ngã trên cầu, ôtô bị mất lái do ngập nước, cây xanh gãy đổ chắn ngang đường. Hệ thống thoát nước kém khiến nhiều đoạn đường ở các đô thị lớn như TP HCM, Hà Nội biến thành ""sông"", cuốn trôi cả người lẫn phương tiện. Ngoài ra, sét đánh cũng là mối nguy thực sự. Dù ôtô được xem là ""vỏ bọc an toàn"" khi có sét, thì với xe máy - phương tiện phổ biến ở Việt Nam thì người lái hoàn toàn phơi mình trước thiên nhiên. Không ít trường hợp bị sét đánh trúng khi đang chạy xe ngoài trời mưa. Theo tôi thì việc lái xe trong điều kiện thời tiết mưa giông, gió giật mạnh như vậy là rất nguy hiểm, có thể xảy ra những tai nạn đáng tiếc nếu chúng ta không biết cách dự phòng. Do vậy, việc lái xe trong mưa giông có thể không thể tránh khỏi hoàn toàn, nhưng có những biện pháp giúp giảm thiểu rủi ro và nỗi sợ hãi. Do vậy, khi mà mưa giông, gió to đến thì lúc ấy bản thân tôi đã cảm thấy sợ và hoảng loạn. Do vậy, tôi cần phải tìm nơi dừng chân an toàn thay vì cố gắng di chuyển. Bên cạnh đó, tôi cần đảm bảo hệ thống phanh, gạt mưa, đèn pha và lốp xe hoạt động tốt để ứng phó trong điều kiện đường trơn, tầm nhìn hạn chế. Hơn nữa, trước khi đi làm hoặc đi chơi bằng bất cứ phương tiện gì, tôi luôn theo dõi dự báo thời tiết trước khi khởi hành. Bởi lẽ chẳng may nếu có dấu hiệu giông lốc, nên trì hoãn nếu không quá cần thiết. Trong một xã hội phát triển, con người có xu hướng tự tin vào khả năng kiểm soát mọi thứ. Nhưng thiên nhiên, đặc biệt là những cơn mưa giông bất ngờ vẫn là một thế lực không thể xem thường. Hiểu và tôn trọng thiên nhiên, trang bị đầy đủ kỹ năng và kiến thức, cùng với sự thận trọng trong từng quyết định trên đường đó là cách duy nhất để mỗi hành trình dù giữa mưa giông vẫn có thể trở về bình an. Độc giảThu Sang","Thứ hai, 21/7/2025, 09:07 (GMT+7)",Thu Sang,Xe,Diễn đàn,VN Express,"Người viết chia sẻ nỗi ám ảnh sâu sắc sau khi chứng kiến và trải nghiệm lái xe trong trận mưa giông lớn ở Hà Nội, đặc biệt là sau suýt gặp tai nạn do tầm nhìn kém và đường trơn trượt. Bài viết nhấn mạnh sự nguy hiểm của việc lái xe trong điều kiện thời tiết xấu, với các yếu tố như tầm nhìn hạn chế, đường trơn, gió mạnh và nguy cơ tai nạn giao thông tăng cao. Tác giả cũng đề cập đến những rủi ro khác như ngập lụt, cây đổ và nguy cơ bị sét đánh, đặc biệt đối với người đi xe máy. Cuối cùng, người viết cho rằng cần có biện pháp phòng ngừa để giảm thiểu rủi ro khi lái xe trong mưa giông."
VNEX_210725_00112,"‘Siêu giông không thể dự báo, sẽ xuất hiện nhiều hơn do biến đổi khí hậu’",https://vnexpress.net/sieu-giong-khong-the-du-bao-se-xuat-hien-nhieu-hon-do-bien-doi-khi-hau-4916660.html,Liên hệ: 084 666 0123 hoặcpodcast@vnexpress.net.,"Thứ hai, 21/7/2025, 04:00 (GMT+7)",Unknown,Podcasts,,VN Express,"Thông tin liên hệ này cung cấp hai cách để liên lạc: qua số điện thoại 084 666 0123 hoặc qua địa chỉ email podcast@vnexpress.net. Đây là thông tin có thể dùng để liên hệ với một cá nhân hoặc tổ chức nào đó, có thể là liên quan đến podcast của VnExpress."
VNEX_210725_00013,AI của OpenAI 'đủ đạt huy chương vàng Olympic toán học',https://vnexpress.net/ai-cua-openai-du-dat-huy-chuong-vang-olympic-toan-hoc-4916730.html,"""Chương trình LLM lý luận thực nghiệm của chúng tôi vượt qua thách thức lớn và lâu đời nhất trong lĩnh vực AI: đủ điểm giành huy chương vàng tại cuộc thi toán học danh giá nhất thế giới, kỳ thi Olympic Toán quốc tế IMO"", Alexander Wei, thành viên của đội ngũ kỹ thuật của OpenAI, cho biết trên X cuối tuần qua. Minh họa mô hình của OpenAI với huy chương vàng IMO được Alexander Wei đăng trên X. Một trong các dự án AI của OpenAI có tên mã ""Strawberry"" (Dâu tây). Ảnh:X/Alexander Wei Giải thích trên blog, Wei cho biết đã để mô hình ""thử sức"" với đề thi toán IMO 2025 với sáu câu hỏi. Mô hình cũng có cách thi giống cuộc thi thật: hai buổi thi, mỗi buổi kéo dài 4,5 tiếng với ba câu hỏi, không có công cụ hoặc Internet hỗ trợ, đọc đề bài và giải bằng ngôn ngữ tự nhiên. ""Quá trình này sẽ cho thấy LLM có tư duy sáng tạo thế nào so với chuẩn mực trước đây. Khả năng viết lời giải giúp kiểm chứng thông tin dễ dàng, cũng như xác định mô hình có thể xây dựng lập luận phức tạp, chặt chẽ ở cấp độ nhà toán học"", Wei nói. ""Bên cạnh kết quả, cách tiếp cận không qua phương pháp luận hẹp và cụ thể cho từng nhiệm vụ sẽ giúp mô hình tạo ra bước đột phá trong học tăng cường theo mục đích chung và khả năng mở rộng tính toán theo thời gian"". Kết quả, mô hình giải thành công 5 trong số 6 bài toán. Các bài giải được nhóm giám khảo gồm ba người từng đoạt huy chương IMO chấm điểm độc lập. Tổng điểm dành cho mô hình của OpenAI là 35/42 - đủ để giành huy chương vàng. ""Các bài toán IMO đòi hỏi mức độ tư duy sáng tạo bền vững mới so với chuẩn mực trước đây"", Noam Brown, kỹ sư OpenAI, nói. ""Mô hình này đã có thể suy nghĩ trong thời gian dài"". ""Đây là mô hình nghiên cứu thử nghiệm. Chúng tôi chưa có kế hoạch phát hành bất kỳ sản phẩm nào có khả năng toán học ở cấp độ này trong vài tháng tới"", Wei nói. Trên X, CEO Sam Altman cũng nhắc lại thông điệp: ""Đây là chương trình LLM chuyên về toán học, không phải hệ thống toán học chính thức cụ thể. Mô hình là một phần trong nỗ lực của chúng tôi hướng tới trí thông minh tổng quát"". IMO hiện là một trong những kỳ thi khó nhất thế giới. Khởi nguồn từ Romania năm 1959, cuộc thi dành cho thí sinh dưới 20 tuổi. Các bài toán được lựa chọn từ toán học sơ cấp, gồm bốn lĩnh vực hình học, số học, đại số và tổ hợp. TheoBusiness Insider, bước tiến mới của OpenAI cho thấy trình độ giải toán của AI đang phát triển nhanh thế nào, đánh dấu khả năng tiến xa trong lĩnh vực lập luận toán học và tư duy sáng tạo của công nghệ này. Năm ngoái, các phòng thí nghiệm AI chủ yếu dùng toán tiểu học để đánh giá mô hình trí tuệ nhân tạo. Tỷ phú công nghệ Peter Thiel năm 2024 từng đánh giá ""phải ít nhất ba năm nữa"" AI mới có thể giải được các bài toán IMO. Bảo Lâm(theoBusiness Insider, LW)","Thứ hai, 21/7/2025, 09:55 (GMT+7)",Bảo Lâm,Khoa học công nghệ,AI,VN Express,"OpenAI đã phát triển một chương trình LLM lý luận thực nghiệm có khả năng giải các bài toán Olympic Toán quốc tế (IMO) ở trình độ huy chương vàng. Mô hình này, được thử nghiệm với đề thi IMO 2025 trong điều kiện tương tự cuộc thi thật, đã giải thành công 5/6 bài toán và đạt tổng điểm 35/42. Kết quả này cho thấy AI đã có những bước tiến vượt bậc trong tư duy sáng tạo và lập luận phức tạp, mặc dù OpenAI chưa có kế hoạch phát hành sản phẩm toán học cấp độ này trong tương lai gần. Thành công này đánh dấu một cột mốc quan trọng trong sự phát triển của AI trong lĩnh vực toán học, vượt qua những dự đoán trước đây về khả năng giải toán IMO của AI."
VNEX_210725_00108,Chung cư dưới 2 tỷ đồng chỉ chiếm dưới 7%,https://vnexpress.net/chung-cu-duoi-2-ty-dong-chi-chiem-duoi-7-4916652.html,"Trong báo cáo thị trường 6 tháng đầu năm, Viện Kinh tế xây dựng (Bộ Xây dựng) cho biết số lượng chung cư thương mại giá bình dân ở Hà Nội và TP HCM vẫn rất hạn chế do các chủ đầu tư chủ yếu phát triển nhà cao cấp. So với năm ngoái, nguồn cung căn hộ tiếp tục tăng với phần lớn dự án giá trên 80 triệu đồng mỗi m2. Thậm chí số dự án giá hơn 100 triệu đồng một m2 có xu hướng mở rộng ra cả khu vực vùng ven. Viện này cho biết giá chung cư tăng cao khiến số lượng căn hộ giá rẻ trên thị trường ngày càng ít, chủ yếu đến từ các dự án đã bàn giao lâu năm, xa trung tâm. Tại Hà Nội, tỷ trọng căn hộ chuyển nhượng dưới 2 tỷ đồng chỉ chiếm khoảng 3,9%, trong khi phân khúc trên 5 tỷ lên tới 55%. Tại TP HCM, căn hộ trên 5 tỷ đồng cũng chiếm tỷ trọng lớn, hơn 47%. Khoảng 28% thị phần thuộc về phân khúc 3-5 tỷ đồng. Còn chung cư dưới 2 tỷ đồng chiếm khoảng 7% và cũng đang có xu hướng biến mất. Diễn biến trên cũng được nhiều đơn vị nghiên cứu thị trường ghi nhận. Hãng tư vấn bất động sản CBRE cho biết 6 tháng đầu năm, tổng nguồn cung căn hộ mở bán mới ở Hà Nội đạt hơn 10.760 căn, cao thứ hai trong 5 năm trở lại đây. Giá bán các dự án mới đều được chủ đầu tư để ở ngưỡng cao, trung bình 79 triệu đồng một m2 (chưa gồm VAT, phí bảo trì và chiết khấu), tăng 33% so cùng kỳ năm ngoái. Tương tự, tại trung tâm TP HCM (trước sáp nhập), giá căn hộ đạt trung bình 82 triệu đồng mỗi m2, tăng 29% so với cùng kỳ năm ngoái. Các dự án mở bán mới ghi nhận mức tăng bình quân 10-13% so với giai đoạn trước. Bà Nguyễn Hoài An, Giám đốc cấp cao CBRE Hà Nội, cho biết chủ đầu tư ""kém mặn mà"" làm chung cư bình dân bởi họ phải cân bằng bài toán lợi nhuận. Hiện các chủ đầu tư đối mặt với chi phí liên quan đất đai tăng đáng kể sau khi áp dụng bảng giá đất mới cộng với giá vật liệu xây dựng và thủ tục pháp lý kéo dài, làm tăng chi phí đầu vào. ""Điều này dẫn đến giỏ hàng sơ cấp dưới 3 tỷ đồng ngày càng hiếm tại hai đô thị lớn, kéo theo chung cư cũ dưới 2 tỷ đồng cũng dần biến mất"", bà An cho hay. Một chung cư cao tầng ở trung tâm Hà Nội. Ảnh:Ngọc Thành Giá bán liên tục tăng tạo áp lực đến khả năng hấp thụ của thị trường.Viện Kinh tế Xây dựng cho biết tỷ lệ hấp thụ nguồn cung căn hộ tại Hà Nội và TP HCM đều sụt giảm, lần lượt 13% và 7% so với cùng kỳ năm trước. Trên thị trường chuyển nhượng, lượng giao dịch chung cư tại Thủ đô cũng hạ gần 8%. Tương tự, CBRE cho biết tổng lượng giao dịch chung cư tại Hà Nội trong quý II đạt gần 5.200 căn, giảm 27% so cùng kỳ. Tỷ lệ hấp thụ nguồn cung mới đạt trung bình 60% trong khi cùng kỳ năm ngoái, nhiều dự án do đơn vị này tham gia kinh doanh có mức thanh khoản hơn 90% sau mở bán. Theo một khảo sát mới đây củaVnExpressvới hơn 7.400 độc giả, hơn một nửa người tham gia chia sẻ rằng họ không muốn mua chung cư trong nửa cuối năm vì giá quá cao. Trong khi 65% người tham gia chỉ đủ khả năng mua căn hộ dưới 3 tỷ đồng. Về lâu dài, câu chuyện tăng giá bất động sản nếu không được can thiệp sớm, sẽ dẫn đến nhiều hệ lụy cho thị trường và xã hội. Ông Nguyễn Văn Đính, Chủ tịch Hội Môi giới bất động sản Việt Nam (VARS) cho rằng giá nhà liên tục tăng khiến người thu nhập trung bình và thấp ngày càng khó tiếp cận giấc mơ an cư. ""Nếu không kiểm soát kịp thời, nguy cơ bong bóng bất động sản có thể xảy ra khiến thị trường đối mặt rủi ro đổ vỡ dây chuyền, ảnh hưởng đến nền kinh tế"", ông Đính nói. Ngọc Diễm","Thứ hai, 21/7/2025, 10:00 (GMT+7)",Ngọc Diễm,Bất động sản,Thị trường,VN Express,"Báo cáo thị trường bất động sản 6 tháng đầu năm cho thấy nguồn cung căn hộ giá bình dân tại Hà Nội và TP.HCM rất hạn chế, chủ yếu là các dự án cao cấp với giá trên 80 triệu đồng/m2, thậm chí vượt 100 triệu đồng/m2 ở vùng ven. Giá chung cư tăng cao khiến căn hộ giá rẻ ngày càng khan hiếm, trong khi tỷ lệ căn hộ trên 5 tỷ đồng chiếm phần lớn thị trường. Điều này khiến tỷ lệ hấp thụ và lượng giao dịch giảm sút, do nhiều người không đủ khả năng chi trả mức giá cao. Các chủ đầu tư cho rằng việc tăng chi phí đất đai, vật liệu và thủ tục pháp lý là nguyên nhân khiến họ ít mặn mà với phân khúc bình dân."
VNEX_210725_00006,SSI có tổng giám đốc 8x,https://vnexpress.net/ssi-co-tong-giam-doc-8x-4916738.html,"Thông tin được Công ty cổ phần Chứng khoán SSI công bố sáng 21/7. Quyết định bổ nhiệm có thời hạn trong 3 năm. Ông Nguyễn Đức Thông. Ảnh:SSI Trong thông cáo báo chí, ông Nguyễn Duy Hưng - Chủ tịch HĐQT SSI - nói rằng ông tin ""sự kết hợp giữa trí tuệ toàn cầu và sự am hiểu thị trường Việt Nam sẽ giúp CEO mới đưa công ty bước vào giai đoạn phát triển bứt phá"". Ông Hưng cho biết đây là một lựa chọn chiến lược và sẵn sàng đồng hành trực tiếp, hỗ trợ tổng giám đốc mới. Ông Thông gia nhập SSI 6 năm trước và từng giữ nhiều vị trí quan trọng như Giám đốc Giao dịch phái sinh, Giám đốc Khối, Trợ lý Chủ tịch HĐQT. Đầu tháng 3/2024, ông được bổ nhiệm làm Phó tổng giám đốc công ty. Trước đó, ông tốt nghiệp Đại hội Cambridge (Vương quốc Anh) và từng có nhiều năm làm việc tại các tổ chức tài chính lớn như Goldman Sachs, Morgan Stanley. Đối với ông Nguyễn Hồng Nam, sau khi hết nhiệm kỳ tổng giám đốc, ông vẫn là Thành viên HĐQT công ty. Báo cáo tài chính quý II cho thấy SSI có doanh thu công ty mẹ xấp xỉ 2.910 tỷ đồng và lợi nhuận trước thuế 1.143 tỷ đồng. Lũy kế nửa năm, doanh thu hoạt động của công ty đạt 5.015 tỷ đồng, lợi nhuận trước thuế 2.161 tỷ đồng, lần lượt tăng 20,4% và 11,3% so với thực hiện cùng kỳ. Công ty có tổng tài sản 90.978 tỷ đồng và vốn chủ sở hữu 27.687 tỷ đồng vào cuối quý II. Năm nay, SSI đặt mục tiêu doanh thu 9.695 tỷ đồng, lợi nhuận trước thuế 4.252 tỷ đồng, tăng lần lượt 11% và 20% so với năm ngoái. Kế hoạch này dựa trên kịch bản VN-Index dao động trong khoảng 1.450-1.500 điểm với thanh khoản trung bình 19.500 tỷ đồng một phiên. SSI là công ty có thị phần môi giới tăng mạnh nhất nửa đầu năm nay khi lấy thêm 1,29 điểm phần trăm, lên 10,47%. Họ đang xếp thứ hai trên bảng xếp hạng thị phần, thu hẹp đáng kể khoảng cách so với công ty dẫn đầu là VPS. Phương Đông","Thứ hai, 21/7/2025, 09:53 (GMT+7)",Phương Đông,Kinh doanh,Chứng khoán,VN Express,"SSI đã bổ nhiệm ông Nguyễn Đức Thông, người có kinh nghiệm quốc tế và am hiểu thị trường Việt Nam, làm Tổng Giám đốc mới với kỳ vọng thúc đẩy sự phát triển của công ty. Quyết định này diễn ra sau khi ông Thông từng giữ nhiều vị trí quan trọng tại SSI và được bổ nhiệm làm Phó Tổng Giám đốc vào đầu năm 2024. Trong bối cảnh đó, SSI ghi nhận kết quả kinh doanh tích cực trong nửa đầu năm, đồng thời đặt mục tiêu tăng trưởng doanh thu và lợi nhuận đầy tham vọng cho năm nay. Thị phần môi giới của SSI cũng tăng mạnh, thu hẹp khoảng cách với công ty dẫn đầu."
