id,title,link,content,date,author,category,sub_category,source,summary
VNEX_190825_00017,FPT nhận giải Vàng Stevie Awards về tuyển dụng,https://vnexpress.net/fpt-nhan-giai-vang-stevie-awards-ve-tuyen-dung-4928621.html,"Giải thưởng Stevie Awards được công bố vào quý III/2025. Lễ trao giải chính thức sẽ được tổ chức tại Mỹ vào tháng 9 năm nay. Giải thưởng do hội đồng giám khảo quốc tế bình chọn, vinh danh các tổ chức xây dựng môi trường làm việc xuất sắc, nuôi dưỡng nhân tài và tạo giá trị bền vững cho người lao động. Vượt qua nhiều đối thủ toàn cầu, FPT được đánh giá cao nhờ chiến lược nhân sự dài hạn và các hoạt động kiến tạo môi trường làm việc hạnh phúc. Bà Phùng Thu Trang, Giám đốc Nhân sự FPT Telecom, Tập đoàn FPT cho biết giải thưởng ghi nhận hành trình xây dựng môi trường làm việc hiện đại và bền vững của đơn vị. ""Đây cũng là động lực để chúng tôi tiếp tục kiến tạo một môi trường kiểu mẫu, truyền cảm hứng cho thế hệ nhân sự tương lai"", bà Trang nói. Buổi giao lưu giữa đại diện FPT và sinh viên. Ảnh:FPT Cũng theo vị đại diện, thành tích này đến từ chiến lược ""con người làm trọng tâm"" được triển khai xuyên suốt nhiều năm. FPT hiện có gần 17.000 nhân viên trên toàn quốc, triển khai nhiều chính sách như hỗ trợ mua nhà, mua xe, chế độ lương thưởng gắn với KPI, cùng chuỗi sự kiện Happy Workplace nâng cao đời sống tinh thần, sức khỏe. Theo khảo sát Great Place to Work 2023, 91% nhân viên đánh giá FPT là nơi tuyệt vời để làm việc, 92% mong muốn gắn bó lâu dài và 94% tự hào khi là thành viên tập đoàn. ""Doanh nghiệp đã kiến tạo môi trường làm việc dân chủ, cởi mở nhưng vẫn duy trì tính kỷ luật cao với hệ thống KPI rõ ràng, giúp mỗi cá nhân vừa được phát huy năng lực, sáng tạo, vừa rèn luyện tinh thần trách nhiệm"", đại diện FPT nhận định. Đơn vị duy trì nhiều hoạt động cho đội ngũ nhân viên. Ảnh:FPT Bên cạnh đó, doanh nghiệp còn ứng dụng công nghệ vào đào tạo nhân sự, phát triển các nền tảng học tập trực tuyến như FoxSkill, AI Mentor, Chang AI và AI Knowledge Explore. Các nền tảng giúp mỗi cá nhân thiết kế lộ trình học riêng. FPT định hướng tiếp tục chiến lược ""Better Everyday"", tập trung thu hút chuyên gia AI, Big Data, đồng thời đẩy mạnh các chương trình huấn luyện chuyên sâu, mở rộng cơ hội trải nghiệm thực tế và ứng dụng công nghệ tiên tiến vào đào tạo. Song song, chính sách đãi ngộ sẽ tiếp tục được ưu tiên đầu tư, gắn với lộ trình phát triển cá nhân. Hoạt động đào tạo phát triển cá nhân cho nhân sự. Ảnh:FPT Trước đó, doanh nghiệp nhiều lần được vinh danh trong các bảng xếp như ""Nhà tuyển dụng được yêu thích nhất ngành Viễn thông"", top 2 ""nhà tuyển dụng được yêu thích nhất của khối doanh nghiệp lớn"" trong hai năm liên tiếp 2023-2024 do Career Việt thực hiện; ""Nơi làm việc tốt nhất Việt Nam"" từ năm 2019 đến 2024 do Anphabe tổ chức. Hoài Phương","Thứ ba, 19/8/2025, 10:00 (GMT+7)",Hoài Phương,Kinh doanh,Doanh nghiệp,VN Express,"FPT đã xuất sắc vượt qua nhiều đối thủ toàn cầu để nhận giải thưởng Stevie Awards, vinh danh các tổ chức có môi trường làm việc xuất sắc. Thành công này đến từ chiến lược ""con người làm trọng tâm"" được FPT triển khai xuyên suốt, thể hiện qua các chính sách đãi ngộ, sự kiện nâng cao đời sống tinh thần và ứng dụng công nghệ vào đào tạo. Nhờ vậy, FPT được đánh giá là nơi làm việc lý tưởng, thu hút và giữ chân nhân tài, đồng thời liên tục được vinh danh tại các giải thưởng uy tín về nhà tuyển dụng. FPT định hướng tiếp tục chiến lược ""Better Everyday"", tập trung vào phát triển nhân tài và ứng dụng công nghệ."
VNEX_190825_00026,Ronaldo đứng trước cơ hội phá dớp cùng Al Nassr,https://vnexpress.net/ronaldo-dung-truoc-co-hoi-pha-dop-cung-al-nassr-4928553.html,"*Al Nassr - Al Ittihad: 19h hôm nay 19/8, giờ Hà Nội. Siêu Cup Saudi năm nay lần đầu được tổ chức tại Hong Kong, như một bước đi nhằm quảng bá bóng đá Arab Saudi ra thế giới. Ban tổ chức kỳ vọng sự kiện này không chỉ mang đến bầu không khí cuồng nhiệt cho khán giả châu Á mà còn khẳng định tham vọng toàn cầu của bóng đá Saudi. Trận bán kết tâm điểm sẽ là màn đối đầu giữaAl Nassr- với những ngôi sao Ronaldo, Sadio Mane, Joao Felix, Kingsley Coman, và Al Ittihad của Benzema, N'Golo Kante cùng Fabinho. Cristiano Ronaldo trong buổi tập của Al Nassr tại Hong Kong ngày 18/8. Ảnh:Al Nassr Đây là cơ hội đểRonaldođoạt danh hiệu chính thức đầu tiên cùng Al Nassr. Từ khi chuyển đến Al Nassr, tiền đạo 40 tuổi về nhì Saudi Pro League hai lần, thua hai trận bán kết và một trận chung kết Siêu Cup Arab Saudi. Ngoài ra, anh cùng đồng đội đã thất bại ở một trận bán kết và một trận chung kết King Cup, bị loại ở tứ kết và bán kết AFC Champions League châu Á. Danh hiệu duy nhất Ronaldo giành được với Al Nassr làgiải giao hữu Arab Champions Cup 2023. Dù trắng tay tại các giải đấu chính, Ronaldo vẫn đạt thành tích cá nhân cao, ghi 99 bàn và 19 kiến tạo qua 111 trận trên mọi đấu trường cho Al Nassr. Tiền đạo Bồ Đào Nha giành Vua phá lưới Saudi Pro League hai mùa gần nhất, với lần lượt 35 và 25 bàn. Trận bán kết giữa Al Nassr và Al Ittihad hứa hẹn khó lường bởi quá khứ cạnh tranh khốc liệt. Trong 5 lần gặp nhau gần nhất, kết quả liên tục đảo chiều: Al Nassr từng thắng đậm 5-2 và 4-2, nhưng cũng thua 1-2 rồi 2-3. Trận đấu ngày 7/5/2025 là minh chứng rõ nét: Al Nassr dẫn 2-0 sau hiệp một, nhưng để Al Ittihad ngược dòng thắng 3-2 nhờ các bàn của Benzema, Kante và Aouar. Thất bại đó khiến Ronaldo tức giận,trách đồng đội mơ ngủngay trên sân. Siêu Cup Saudi chứng kiến những thay đổi sát giờ khiAl Hilalrút lui, để tập trung cho FIFA Club World Cup và đảm bảo cam kết nghỉ phép cho các cầu thủ. Liên đoàn bóng đá Saudi (SAFF) sau đó cấm Al Hilal tham dự hai kỳ Siêu Cup kế tiếp và phạt CLB này khoảng 133.350 USD. Điều này càng khiến cuộc đối đầu giữa Al Nassr và Al Ittihad trở thành tâm điểm chú ý lớn nhất. Đội thắng sẽ gặp Al Ahli hoặc Al Qadsiah ở chung kết trên Sân vận động Hong Kong lúc 19h ngày 23/8, giờ Hà Nội. Hồng Duytổng hợp","Thứ ba, 19/8/2025, 05:57 (GMT+7)",Hồng Duy,Thể thao,Bóng đá,VN Express,"Trận bán kết Siêu Cup Saudi giữa Al Nassr và Al Ittihad diễn ra tại Hong Kong như một phần trong nỗ lực quảng bá bóng đá Saudi ra thế giới. Tâm điểm của trận đấu là màn so tài giữa các ngôi sao như Ronaldo, Benzema, Kante. Đây là cơ hội để Ronaldo giành danh hiệu chính thức đầu tiên cùng Al Nassr sau nhiều lần thất bại ở các giải đấu khác. Đội thắng trong trận này sẽ đối đầu với Al Ahli hoặc Al Qadsiah trong trận chung kết."
VNEX_190825_00068,'Mười chín tháng Tám' - bản tốc ký thành khúc ca bất hủ,https://vnexpress.net/muoi-chin-thang-tam-ban-toc-ky-thanh-khuc-ca-bat-hu-4928378.html,"Ca khúc ""Mười chín tháng Tám"" do Hợp ca nam nữ Đài Tiếng nói Việt Nam thể hiện. Video:YouTube Hà Nội Vi Vu Đúng ngày này 80 năm trước, theo lời kêu gọi của Mặt trận Việt Minh, người Hà Nội xuống đường tiến về trung tâm Nhà hát Lớn dự mít tinh, cả thủ đô rực rỡ cờ đỏ sao vàng. Cuộc mít tinh chuyển thành biểu tình vũ trang tiến vào chiếm Phủ khâm sứ, Trại lính Bảo an và các cơ sở của chính phủ bù nhìn. Nhạc sĩ Đỗ Xuân Oanh, khi ấy 23 tuổi, chỉ huy đoàn tuần hành xuất phát từ khu vực ga Giáp Bát đến Nhà hát Lớn. Đi đầu đoàn, nhạc sĩ cảm nhận rõ từng bước chân, không khí sục sôi. Giai điệu, những câu từ đầu tiên của ca khúc bật ra, ông hát vang: ""Toàn dân Việt Nam đứng đều lên góp sức một ngày/ Thề đem xương máu hết lòng chiến đấu cho tương lai"". Sáng tác đến đâu, ông lại hướng dẫn để đoàn người hát theo, tiếng ca hòa nhịp bước chân. Khi tới Chợ Mơ (Hai Bà Trưng, Hà Nội), bài hát đã hoàn thiện với 10 câu, lấy luôn ngày lịch sử của dân tộc làm nhan đề. Nhạc sĩ bắt nhịp từ đầu, đoàn vừa đi vừa hát cho đến khi tới Nhà hát Lớn, các khối tuần hành từ khắp nơi đổ về, hòa vào dòng người, họ hát liên khúc cách mạng, từTiến quân ca, Diệt Phát xít, Cờ Việt Minhvà kết thúc bằngMười chín tháng Tám. Cuộc mít tinh tại Nhà hát Lớn ngày 19/8/1945.Ảnh tư liệu Theo cuốnĐỗ Xuân Oanh - Cánh chim Oanh của mùa Xuân cách mạng, từ cuối năm 1943-1944, khi trực tiếp tham gia hoạt động tuyên truyền bí mật cho Mặt trận Việt Minh, chuẩn bị Tổng khởi nghĩa ở Hà Nội, nhạc sĩ đã nung nấu ý định sáng tác ca khúc về sự kiện này. Cảm xúc còn tích tụ từ trước đó, khi ông nhớ về tuổi thơ gian khó, những gì chiến tranh gây ra cho gia đình mình. Ông nội nhạc sĩ - vốn là chí sĩ Phong trào Đông Kinh Nghĩa Thục - bị chính quyền thực dân đàn áp, phải rời xa quê hương, gia đình ly tán. Chị ông là cô gái đẹp nhất vùng thời bấy giờ, bị viên quan Pháp bắt làm vợ, hành hạ đến chết và mang xác trả về nhà. Vì nhà nghèo, Xuân Oanh chỉ học hết lớp bốn, sau đó tự bươn chải, làm nhiều việc như thợ đúc, thợ mỏ rồi đến Hải Phòng làm gia sư, đi hát mới quen biết nhạc sĩ Văn Cao, Nguyễn Đình Thi và bắt đầu tham gia cách mạng. Tất cả nỗi căm hờn, gian truân, khó nhọc từ thời thơ ấu cùng ngọn lửa cách mạng cháy trong lòng nghệ sĩ, bật thành giai điệu. Những câu hát ngắn, dồn dập như nhịp chân bước, tiếng ""căm hờn kêu thét"" trở thành sức mạnh đồng lòng, thúc giục toàn dân cùng ""đứng lên"", đập tan xiềng xích nô lệ. Đoàn người đi trong ""ánh sao tự do"", ""cờ bay muôn nơi"". Khúc hát khép lại bằng lời nhắc nhở: ""Mười chín tháng Tám chớ quên là ngày khởi nghĩa/ Hạnh phúc sáng tô non sông Việt Nam"", thể hiện sự lạc quan, niềm tin vào tương lai mới của đất nước. Nhạc sĩ ""có biệt tài sáng tác tại chỗ nhưng nếu không ghi lại là quên ngay"". Chiều 19/8, sau khi hoàn tất việc giành chính quyền ở Hà Nội, ông mới ký âm bản hành khúc trên vỏ bao thuốc lá, mang đến xưởng in của một người bạn. Bài hát được khắc gỗ và in ra như truyền đơn rải khắp Hà Nội. Hiện nay, gia đình nhạc sĩ cho biết qua nhiều biến cố, bản khắc gỗ đã không còn được lưu giữ. Khi đó ông còn giữ bản in trên giấy thô vàng khổ A4, đầu trang in lá cờ đỏ sao vàng. Sau này, bản in cũng thất lạc do chiến tranh. Dẫu vậy, tác phẩm vẫn vẹn nguyên trong lòng người dân Việt Nam qua nhiều thế hệ, ghi dấu ngày đất nước bước sang trang sử mới, mà theo nhà thơ Nguyễn Thụy Kha, đó là ""một tiếng nổ giai điệu bất ngờ và mạnh mẽ trong thời khắc của một cuộc khởi nghĩa giành chính quyền ở Hà Nội"". NSƯT Đăng Dương, ca sĩ Tùng Dương hát ""Mười chín tháng Tám"" tại concert ""Tổ quốc trong tim"". Video:HTV - Đài Hà Nội Mỗi dịp kỷ niệm cách mạng tháng Tám thành công, ca khúc lại vang lên, người nghe như được sống trong khí thế hào hùng năm xưa. Tại chương trìnhHà Nội - Từ mùa thu lịch sử 1945tối 15/8, dàn nghệ sĩ mang hàng trăm lá cờ lên sân khấu, tái hiện khoảnh khắc ''cờ bay nơi nơi muôn ánh sao vàng''. Hôm 10/8, tại concertTổ quốc trong tim, NSƯT Đăng Dương, ca sĩ Tùng Dương thể hiện liên khúcMười chín tháng Tám,Đoàn vệ quốc quân, Đường chúng ta đi, được hàng chục nghìn khán giả hát theo. Tác phẩm được thế hệ trẻ hưởng ứng nhờ lời ca dễ thuộc, dễ nhớ. TrongĐỗ Xuân Oanh - Cánh chim Oanh của mùa Xuân cách mạng, PGS. TS Đỗ Lê Châu - con trai nhạc sĩ - cho biết ông luôn nhận mình là người may mắn ""được lịch sử chọn làm người ghi lại bằng âm nhạc cái không khí cách mạng long trời lở đất của nhân dân Việt Nam trong ngày Tổng Khởi nghĩa giành chính quyền về tay nhân dân"". Theo gia đình ông, sinh thời, mỗi dịp 19/8, nhạc sĩ nhận nhiều lời mời phỏng vấn từ các báo hỏi về hoàn cảnh ra đời bài hát, ""đó là cơ hội để ông sống lại lần nữa ngày lịch sử"". Với chị Đỗ Anh Thư, cháu gái nhạc sĩ,Mười chín tháng Támlà bài hát của gia đình. ""Khi còn bé, chưa hiểu lời nhưng chỉ cần biết đó là do ông nội sáng tác, tôi đã thấy tự hào. 19/8 hàng năm, gia đình tôi quây quần bên nhau. Dù ông không còn, những ngày này vẫn mang ý nghĩa thiêng liêng, cả nhà vẫn ngồi lại, nghe ca khúc"". Nhạc sĩ Xuân Oanh với vợ (bà Xuân Uyên) và con trai đầu lòng Đỗ Lê Châu năm 1957. Ảnh:Sách ""Đỗ Xuân Oanh - Cánh chim Oanh của mùa Xuân cách mạng"" Nhạc sĩ Đỗ Xuân Oanh sinh năm 1923, mất năm 2010, quê tại Quảng Yên, Quảng Ninh, là nhà ngoại giao văn hóa, nhạc sĩ. Trước 1945, ông tham gia tuyên truyền cho Mặt trận Việt Minh. Sau cách mạng tháng Tám, ông lên chiến khu Việt Bắc và làm việc cho báoCứu quốc, từng là phát thanh viên chương trình Tiếng Anh thế hệ đầu tiên của Đài Tiếng nói Việt Nam và phiên dịch viên cho các lãnh đạo cao cấp của Đảng, Nhà nước. Trong nhiều năm, ông là Tổng Thư ký Ủy ban Bảo vệ hòa bình thế giới của Việt Nam, tham gia hội nghị Paris và nhiều sự kiện lịch sử khác. Ông còn viết các ca khúc nhưHồ Chí Minh - Người là muôn ánh sao, Quê hương anh bộ đội. Nhạc sĩ nhận Huân chương Độc lập hạng Ba năm 1998, giải thưởng Nhà nước về Văn học Nghệ thuật năm 2009. Châu Anh","Thứ ba, 19/8/2025, 00:00 (GMT+7)",Châu Anh,Giải trí,Nhạc,VN Express,"Bài viết kể về hoàn cảnh ra đời của ca khúc ""Mười chín tháng Tám"" do nhạc sĩ Đỗ Xuân Oanh sáng tác ngay trên đường phố Hà Nội trong cuộc tổng khởi nghĩa giành chính quyền năm 1945. Ca khúc được hình thành từ cảm xúc dồn nén về tuổi thơ gian khó, lòng căm thù thực dân và khát vọng tự do, độc lập của dân tộc. ""Mười chín tháng Tám"" nhanh chóng lan tỏa, trở thành bài ca cách mạng, thúc giục tinh thần chiến đấu của quần chúng nhân dân, góp phần vào thắng lợi của cuộc khởi nghĩa. Bài hát sau đó được in thành truyền đơn và lan truyền rộng rãi khắp Hà Nội."
VNEX_190825_00076,Ung thư tuyến giáp di căn nhưng không hình thành u,https://vnexpress.net/ung-thu-tuyen-giap-di-can-nhung-khong-hinh-thanh-u-4928407.html,"Ban đầu hạch nhỏ như hạt đậu, siêu âm nhưng không phát hiện ung thư, chị Hà tưởng hạch viêm. Lần này, chị đến Bệnh viện Đa khoa Tâm Anh TP HCM kiểm tra, siêu âm hạch và tuyến giáp không có khối u, hạch bạch huyết xuất hiện dọc theo chuỗi tĩnh mạch cảnh trong trái, nhiều vi vôi hóa ở vỏ hạch. ThS.BS.CKII Đoàn Minh Trông, khoa Ngoại Vú - Đầu Mặt Cổ, chẩn đoán hạch ở cổ chị Hà sưng không do viêm, chỉ định sinh thiết hạch kết quả xác định có tế bào ung thư tuyến giáp di căn. Chị được phẫu thuật cắt tuyến giáp, bảo tồn dây thanh quản, thần kinh quặt ngược (chi phối giọng nói) đồng thời nạo các hạch cổ di căn. Kết quả giải phẫu bệnh xác định ung thư tuyến giáp thể nhú dạng xơ ẩn. Ung thư tuyến giáp thể nhú là loại phổ biến nhưng thể nhú dạng xơ ẩn ít gặp, theo bác sĩ Trông và là lần đầu tiên trong gần 30 năm hành nghề ông tiếp nhận trường hợp ung thư tuyến giáp thể nhú biến thể đã di căn hạch nhưng không thấy khối u. ""Đây là một dạng ung thư chỉ thấy những tổn thương lan tỏa, không hình thành u, dễ lầm tưởng với viêm giáp thông thường"", bác sĩ Trông nói. Khi vết thương ổn định sau phẫu thuật, chị Hà tiếp tụcuống iốt phóng xạđể ngăn nguy cơ tái phát ung thư. Bác sĩ Trông (giữa) và êkíp khoa Ngoại Vú - Đầu Mặt Cổ phẫu thuật cho người bệnh. Ảnh:Bệnh viện Đa khoa Tâm Anh Ung thư tuyến giápthể nhú phát triển chậm, tiên lượng điều trị tốt, 90% chữa khỏi nếu phát hiện sớm và điều trị đúng cách. Song biến thể xơ hóa của ung thư tuyến giáp thể nhú thường được chẩn đoán ở giai đoạn tiến triển, tế bào ác tính xâm lấn lan tỏa một hay hai thùy tuyến giáp, tình trạng xơ hóa dày đặc. Trên siêu âm, bệnh thường thể hiện khối tròn, đặc, giảm âm, có mạch máu nuôi, vi vôi hóa. Phương pháp điều trị chính của biến thể này là phẫu thuật, uống iốt phóng xạ. Bệnh hay gặp ở người trẻ 19-35 tuổi, tỷ lệ tái phát và di căn cao nên người bệnh cần tái khám, theo dõi ba tháng một lần. Tùy tình trạng sức khỏe, bác sĩ sẽ kéo dài thời gian tái khám 6-12 tháng. Nổi hạch cổ(sưng hạch bạch huyết) xảy ra ở mọi lứa tuổi, khi cơ thể phản ứng với tác nhân gây bệnh cảm lạnh, viêm họng, cũng có thể do ung thư nên hay nhầm lẫn. Nếu hạch cổ vẫn còn sau khi hết cảm cúm, cảm lạnh, người bệnh nên khám bác sĩ chuyên khoa Ngoại Vú - Đầu Mặt Cổ hoặc Ung Bướu tìm nguyên nhân và điều trị. Khám sức khỏe định kỳ giúp phát hiện bất thường ở giai đoạn sớm. Người bệnh ung thư tuyến giáp đã điều trị cần tái khám định kỳ để kiểm soát nguy cơ di căn (nếu có) và can thiệp kịp thời. Bảo Trâm *Tên người bệnh đã được thay đổi","Thứ ba, 19/8/2025, 08:00 (GMT+7)",Bảo Trâm,Sức khỏe,Các bệnh,VN Express,"Chị Hà phát hiện hạch ở cổ, ban đầu nghi ngờ viêm nhưng sau khi kiểm tra tại Bệnh viện Đa khoa Tâm Anh, bác sĩ chẩn đoán là ung thư tuyến giáp thể nhú dạng xơ ẩn di căn hạch, một biến thể hiếm gặp không hình thành khối u rõ ràng. Chị đã được phẫu thuật cắt tuyến giáp, nạo hạch và tiếp tục điều trị bằng iốt phóng xạ để ngăn ngừa tái phát. Bác sĩ khuyến cáo người dân nên khám sức khỏe định kỳ và kiểm tra hạch cổ nếu không khỏi sau cảm cúm, đặc biệt là người trẻ tuổi vì biến thể này có tỷ lệ tái phát và di căn cao."
VNEX_190825_00027,Alonso: 'Tôi là người nói ít làm nhiều',https://vnexpress.net/alonso-toi-la-nguoi-noi-it-lam-nhieu-4928554.html,"""Tôi là người làm nhiều hơn là nói. Trong bóng đá, những lời hứa trước khi thực sự làm thường không có ý nghĩa"", Alonso nói ngày 18/8 ở họp báo trước trận ra quân La Liga. ""Chúng tôi rất khao khát, muốn mang năng lượng đó tới sân và chứng minh trên sân cỏ. Chỉ nói suông thì không thể. Chúng tôi muốn bắt đầu con đường ấy ngay ngày mai"". HLV Xabi Alonso trong buổi họp báo trước trận Real gặp Osasuna ở vòng một La Liga mùa 2025-2026. Ảnh:EFE Alonso, người đưa Leverkusen tới cú đúp quốc nội và vào chung kết Europa League 2023-2024, thế chỗCarlo Ancelottivới mục tiêu cứu vãn mùa giải bằng Club World Cup. Dưới sự dẫn dắt của nhà cầm quân người Tây Ban Nha, Real khởi đầu tốt, thắng 4 và hòa một trong năm trận đầu, rồithảm bại 0-4 trước PSGở bán kết. Cũng vì dự giải đấu trên đất Mỹ, đội bóng hoàng gia chỉ có 15 ngày tập luyện trước mùa giải mới. Real từng xin hoãn trận gặp Osasuna để có thêm thời gian chuẩn bị nhưng bịLiên đoàn Bóng đá Tây Ban Nha từ chối, với lý do cầu thủ chỉ bắt buộc được nghỉ tối thiểu 21 ngày sau mùa giải, chứ không có quy định về quãng tập huấn. ""Với sức khỏe cầu thủ, sau một mùa giải dài, chúng tôi muốn có thêm thời gian. Nhưng cuối cùng điều đó không xảy ra. Chúng tôi không viện cớ. Dù chỉ tập hai tuần, đội vẫn sẵn sàng ra sân và cạnh tranh,"" Alonso nhấn mạnh. HLV Xabi Alonso chỉ đạo trong buổi tập của Real Madrid ngày 17/8. Ảnh:Real Madrid FC Realkhông có lực lượng mạnh nhất, khi Jude Bellingham, Endrick, Eduardo Camavinga, Ferland Mendy chấn thương, còn Antonio Rudiger bị treo giò. Dù vắng nhiều trụ cột,Alonsovẫn nhấn mạnh triết lý gắn kết toàn đội, đặc biệt ở hàng công với hai ngôi sao Vinicius và Kylian Mbappe. ""Điều quan trọng là cả ba tuyến đều phải ý thức được vai trò của mình"", ông nói. ""Với các tiền đạo, họ không được để bị bỏ lại khi chuyển trạng thái, đồng thời hàng thủ phải dâng cao khi chúng tôi tấn công. Chúng tôi muốn vận hành như một tập thể, giữ được cự ly hợp lý cả khi phòng ngự lẫn khi tấn công. Tại Club World Cup, chúng tôi đã tiến thêm một bước. Đó là điều toàn đội đang ý thức rõ và tiếp tục rèn luyện"". HLV 43 tuổi cũng ủng hộ quan điểm của Real khi phản đối kế hoạch La Ligađưa trận Villarreal - Barcasang Mỹ vào tháng 12. ""Ngay từ đầu mùa chúng ta đã biết luật. Nếu thay đổi, cần có sự đồng thuận từ tất cả các bên"", Alonso bày tỏ. Hồng Duy(theoESPN, Managing Madrid)","Thứ ba, 19/8/2025, 05:46 (GMT+7)",Hồng Duy,Thể thao,Bóng đá,VN Express,
