id,title,link,content,date,author,category,sub_category,source,summary
VNEX_291025_00107,Vì sao móc quần áo là vật quan trọng nhất khi ngủ ở khách sạn?,https://vnexpress.net/vi-sao-moc-quan-ao-la-vat-quan-trong-nhat-khi-ngu-o-khach-san-4955765.html,"Nhiều chuyên gia du lịch trên mạng thường chia sẻ các bí quyết để có giấc ngủ ngon trong phòng khách sạn. Tuy nhiên, theo Alexandra Dubakova, một chuyên gia của Công ty lữ hành Thụy Sĩ FreeTour, vật dụng hữu ích nhất đã có sẵn trong phòng. ""Thay đổi múi giờ, đối phó với tình trạng lệch múi giờ và dải ánh sáng khó chịu len vào giữa hai tấm rèm khách sạn là một cơn ác mộng"", cô nói. ""Tôi luôn lấy móc quần áo trong tủ và dùng chúng để kẹp chặt hai mép rèm lại. Nó tạo ra một căn phòng tối hoàn toàn, giúp tôi nghỉ ngơi đúng nghĩa bất kể đang ở múi giờ nào"", Dubakova chia sẻ. Tuy nhiên, mẹo này chỉ áp dụng được với loại móc có kẹp và có thể lấy ra khỏi tủ. Nó sẽ không hiệu quả nếu khách sạn sử dụng loại móc chống trộm gắn liền vào thanh treo. Móc treo quần áo có kẹp trong khách sạn. Ảnh:Suntex Tiếp viên hàng không Sherry Martin Peters gợi ý một cách khác để loại bỏ ánh sáng. Theo đó, nhiều tiếp viên thường mang theo băng keo điện màu đen, không phải để sửa đồ, mà để che những nguồn sáng nhỏ li ti lọt vào phòng khiến khách mất ngủ như chấm xanh của tivi ở chế độ chờ, ánh sáng xanh nhức mắt từ củ sạc. ""Cứ thế, từng nguồn sáng bị che đi cho đến khi căn phòng chìm trong bóng tối hoàn toàn"", Peters nói. Ngoài ra, nhiều tiếp viên còn nhét khăn tắm dưới khe cửa để chặn ánh sáng từ hành lang, vì chỉ cần một tia sáng nhỏ cũng đủ khiến bộ não đang lệch múi giờ tưởng rằng trời vẫn còn sáng và khiến họ khó ngủ hơn. Các mẹo này được đưa ra trong bối cảnh một nghiên cứu cho thấy gần 20% người dân ở Anh không ngủ đủ giấc. Nguyên nhân thường do tiếng ồn và ánh sáng ban đêm, vốn đánh lừa cơ thể trì hoãn cơn buồn ngủ. Tiến sĩ Rebecca Robbins, chuyên gia giấc ngủ của chuỗi khách sạn Hilton, nói vớiNational Geographicrằng ""tìm thấy sự quen thuộc trong điều xa lạ"" là yếu tố then chốt. ""Sự thật là khi ở trong môi trường không quen thuộc, chúng ta thường khó thư giãn hơn"", bà nói. Robbins khuyên nên ""đánh lừa"" não bộ bằng cách xịt mùi hương quen thuộc, gợi cảm giác tích cực hoặc ấm cúng, đồng thời ghi lại những suy nghĩ lo lắng ra giấy trước khi ngủ để dễ thư giãn hơn. Cơ trưởng hãng British Airways, ông Al Smith, tiết lộ luôn tuân thủ nghiêm ngặt lịch trình ngủ nghỉ để đảm bảo tỉnh táo khi làm việc. Ông cho biết các chuyến bay đường dài ""là một cuộc chơi hoàn toàn khác"" và cố gắng không để mất giấc ngủ dù phải di chuyển thường xuyên. ""Tôi luôn ngủ trước khi khởi hành, chợp mắt sau khi hạ cánh và tranh thủ ngủ ngắn bất cứ khi nào có thể"", Smith nói. Anh Minh(TheoDM)","Thứ tư, 29/10/2025, 00:00 (GMT+7)",Anh Minh,Du lịch,Tin tức,VN Express,
VNEX_291025_00004,Đệ nhất phu nhân Pháp bị ám ảnh vì những lời đồn về giới tính,https://vnexpress.net/de-nhat-phu-nhan-phap-bi-am-anh-vi-nhung-loi-don-ve-gioi-tinh-4957117.html,"""Không có tuần nào mà mẹ tôi không bị quấy rầy"", Tiphaine Auziere, 41 tuổi, con gái của Đệ nhất phu nhân Pháp Brigitte Macron, phát biểu tại tòa án ở thủ đô Paris ngày 28/10. Auziere là con út trong ba người con của bà Brigitte với người chồng đầu Andre-Louis Auziere. Cô xuất hiện trong phiên tòa xét xử 10 người bị cáo buộc quấy rối Đệ nhất phu nhân Pháp trên mạng bằng cách phát tán ""bình luận ác ý"" về giới tính của bà. 10 bị cáo, gồm 8 nam và hai nữ, độ tuổi 41-60, bị truy tố vì tội ""quấy rối trên mạng có yếu tố giới tính"", với khung hình phạt tối đa là hai năm tù. Tổng thống Macron và Đệ nhất phu nhân Brigitte tại Điện Elysee ngày 8/10. Ảnh:Reuters Auziere nói rằng mẹ mình luôn phải chú ý về cách ăn mặc và ứng xử, vì lo ngại hình ảnh bản thân ""bị bóp méo và vũ khí hóa trên mạng"". Cô nhấn mạnh rằng những tin đồn đã tác động xấu đến sức khỏe tâm thần của bà Brigitte và dẫn đến tình trạng ""lo âu sâu sắc"", khẳng định điều này đã được các chuyên gia y tế xác nhận. Con gái của Đệ nhất cho biết làm chứng tại phiên tòa này là điều rất quan trọng. ""Bà từng đọc hết các dòng trạng thái trên mạng xã hội, nhưng giờ đây không muốn đọc nữa"", Auziere nói thêm. Theo con gái Đệ nhất phu nhân Brigitte, những tin đồn thất thiệt còn ảnh hưởng sâu sắc tới các thành viên trong gia đình. ""Mẹ rất đau khổ khi các cháu của mình nghe được những thông tin đó và không biết làm thế nào để ngăn chặn"", Auziere cho hay. Bà Brigitte, 72 tuổi, kết hôn với ông Macron, 47 tuổi, từ năm 2007. Sau khi ông Macron trở thành Tổng thống Pháp, mối tình chênh 24 tuổi của họ thu hút sự quan tâm của dư luận. Những tin đồn vô căn cứ rằng bà Brigitte ""được xác định giới tính nam khi sinh ra"" xuất hiện từ năm 2017, song song với những chỉ trích về khoảng cách tuổi giữa vợ chồng bà. Ngọc Ánh(TheoCNN, Yahoo News)","Thứ tư, 29/10/2025, 09:42 (GMT+7)",Ngọc Ánh,Thế giới,,VN Express,
VNEX_291025_00075,Viêm amidan có lây không?,https://vnexpress.net/viem-amidan-co-lay-khong-4957098.html,"Trả lời: Amidan là tổ chức bạch huyết lớn nằm ở hai bên họng miệng, có vai trò kích hoạt phản ứng miễn dịch chống lại các tác nhân gây bệnh xâm nhập vào cơ thể qua mũi và miệng. Cơ quan này thường xuyên tiếp xúc với các yếu tố gây bệnh nên dễ viêm nhiễm. Viêm amidan gồm cấp tính và mạn tính. Triệu chứng thường gặp như miệng hôi, sốt, nuốt vướng, mệt mỏi, đau nhức cơ thể, ho kéo dài, đờm xanh, đau rát cổ họng, khàn giọng hoặc mất giọng, ngủ ngáy... Nguyên nhân gây viêm amidan do vi khuẩn (streptococcal...), virus (cúm, parainfluenza, herpes simplex, epstein-barr...) tấn công khi hệ miễn dịch của cơ thể suy yếu. Uống nhiều rượu bia, thuốc lá; thường xuyên tiếp xúc khói bụi ô nhiễm, chất độc hại... cũng làm tăng nguy cơ mắc bệnh. Bác sĩ Phát nội soi họng cho một người bệnh. Ảnh minh họa:Phòng khám Đa khoa Tâm Anh Quận 7 Viêm amidankhông phải là bệnh lây nhiễm, tuy nhiên các tác nhân gây viêm như virus hoặc vi khuẩn có khả năng lây lan từ người này sang người khác. Những mầm bệnh này dễ dàng truyền qua đường hô hấp khi người bệnh ho, hắt hơi, nói chuyện hoặc dùng chung vật dụng cá nhân như ly, muỗng, khăn mặt. Hai bé trong gia đình bị viêm amidan cùng thời điểm rất có thể do cùng tiếp xúc với một nguồn lây bệnh (virus hoặc vi khuẩn). Hệ miễn dịch của trẻ non yếu, sống và sinh hoạt chung trong không gian kín (phòng điều hòa, lớp học, nhà trẻ...) khiến khả năng lây nhiễm chéo cao. Nếu trẻ bị viêm amidan tái phát nhiều lần, nguyên nhân có thể do sức đề kháng yếu, viêm amidan mạn tính hoặc các yếu tố thuận lợi khác như viêm mũi họng,trào ngược dạ dày thực quản, môi trường ô nhiễm... Để phòng tránh lây nhiễm chéo trong gia đình, bạn nên tách riêng đồ dùng cá nhân của từng trẻ (ly, muỗng, bàn chải, khăn mặt), cho trẻ súc miệng nước muối sinh lý hai lần mỗi ngày, rửa tay thường xuyên, giữ ấm cổ họng. Vệ sinh môi trường sống thông thoáng, lau dọn đồ chơi, tay nắm cửa, bàn học giúp loại bỏ tác nhân gây hại. Đồng thời, bạn cho con ngủ đủ giấc, ăn nhiều rau quả, uống đủ nước, bổ sung vitamin C tự nhiên để tăng sức đề kháng. Khi trẻ có dấu hiệu bệnh (sốt, đau họng, ho...) kéo dài, bạn nên cho con đi khám tại chuyên khoaTai Mũi Họngsớm để điều trị triệt để, tránh lây nhiễm, hạn chế biến chứng. ThS.BS.CKI Trương Tấn PhátTrưởng Đơn vị Tai Mũi HọngPhòng khám Đa khoa Tâm Anh Quận 7","Thứ tư, 29/10/2025, 08:00 (GMT+7)",ThS.BS.CKI Trương Tấn Phát,Sức khỏe,Các bệnh,VN Express,
VNEX_291025_00071,Tài xế công nghệ 'đốt' sức khỏe trên từng cuốc xe,https://vnexpress.net/tai-xe-cong-nghe-dot-suc-khoe-tren-tung-cuoc-xe-4956548.html,"""Ban đầu chỉ chạy xe sau giờ làm bảo vệ để kiếm thêm. Nhưng áp lực trả nợ mua nhà buộc tôi nghỉ việc cũ, lao vào nghề này toàn thời gian"", Nam, sống ở TP HCM, kể. Những dịp lễ Tết, anh còn kéo dài thời gian làm việc lên 18 tiếng để ""ăn"" hết lượng đơn hàng tăng vọt. Lịch trình dày đặc khiến anh thường xuyên bỏ bữa, ăn vội chiếc bánh mì hay hộp cơm nguội lạnh. Giấc ngủ của anh hiếm khi kéo dài quá 4 tiếng, đôi khi chỉ kịp chợp mắt ngay trên chiếc xe máy giữa các cuốc giao. Bạn bè khuyên nhủ, anh chỉ cười và đáp: ""Còn sức là còn chạy, tiền bạc quan trọng hơn"". Từ giữa năm 2024, những cơn đau lưng dữ dội và cảm giác tê bì chân tay hành hạ người đàn ông sau mỗi ngày dài mệt mỏi. Trong một lần giao hàng dưới trời mưa, anh bất ngờ ngã xe vì chóng mặt và kiệt sức. Tại Bệnh viện ĐH Y dược TP HCM, các bác sĩ chẩn đoán anh bị thoát vị đĩa đệm, thiếu máu do dinh dưỡng kém và suy nhược cơ thể. Shipper đứng xếp hàng chờ giao đồ trước bệnh viện dã chiến số 6, thời điểm dịch Covid-19. Ảnh:Thành Nguyễn Lan, 40 tuổi, ở Hà Nội, một mẹ đơn thân với hai con nhỏ, cũng ""trả giá đắt"" cho công việc chạy xe ôm công nghệ. Bốn năm trong nghề, cô gắn mình với lịch trình khắc nghiệt từ 5 giờ sáng đến 10 giờ tối, có khi kéo dài đến nửa đêm. Để duy trì tỉnh táo, cô nạp 2-3 cốc cà phê mỗi ngày, thỉnh thoảng dùng nước tăng lực. Bữa ăn của người phụ nữ thường chỉ là một ổ bánh mì hay gói xôi mua vội, nhiều hôm bỏ cả bữa trưa để tiết kiệm thời gian. Đầu năm 2025, trong một chuyến xe chở khách, Lan đột nhiên cảm thấy khó thở, tim đập nhanh dữ dội và phải vội vã dừng xe bên đường. Sau khi đi khám, cô được chẩn đoán mắc bệnh viêm loét dạ dày, rối loạn nhịp tim do lạm dụng cà phê và nước tăng lực, cùng với thoái hóa đốt sống cổ do ngồi lái xe quá lâu. Bác sĩ cảnh báo nếu không thay đổi lối sống, tình trạng sức khỏe của người phụ nữ có thể nghiêm trọng hơn. Những tài xế như Nam và Lan là một phần không thể thiếu của nền kinh tế, kết nối khách hàng với các dịch vụ thông qua những ứng dụng công nghệ. Tuy nhiên, tình trạng làm việc nhiều giờ liền dưới thời tiết khắc nghiệt và trong môi trường ô nhiễm, khiến nhóm này phải đối mặt với vô số nguy cơ sức khỏe mà chưa được quan tâm đúng mức. Một khảo sát năm 2021 thực hiện tại Hà Nội trên 549 tài xế xe ôm, công bố trên Tạp chí Giao thông và Sức khỏe, cho thấy 22,6% người tham gia bị mệt mỏi mãn tính và 22% bị đau lưng dưới. Các yếu tố nguy cơ như thừa cân, uống rượu và thời gian làm việc quá dài liên quan trực tiếp các vấn đề sức khỏe này. Trong khi đó, nghiên cứu công bố trên tạp chí Environmental Research năm 2020, tài xế ở các thành phố có ô nhiễm không khí nặng như Bangkok có nguy cơ suy giảm chức năng phổi và phát triển bệnh phổi tắc nghẽn mạn tính (COPD) cao hơn đáng kể so với dân số chung. Báo cáo của tổ chức Rest of World năm 2024 cũng cho thấy điều kiện làm việc của tài xế công nghệ tại nhiều quốc gia đang phát triển đặc biệt khắc nghiệt. Khoảng 30% người được phỏng vấn không có thời gian nghỉ ngơi, hơn 50% bị từ chối sử dụng các tiện ích công cộng như nhà vệ sinh hay khu vực nghỉ ngơi tại các trung tâm thương mại, nhà hàng. ""Phần lớn tài xế làm việc trong tình trạng thiếu ngủ mãn tính và sức khỏe suy giảm. Nhiều người làm việc đến 17 tiếng mỗi ngày, dùng thuốc giảm đau thường xuyên để duy trì khả năng làm việc"", Tobias Kuttler, nhà nghiên cứu tại Viện Internet Oxford, chia sẻ. Cùng quan điểm, bác sĩ CK1 Võ Văn Long từ Bệnh viện Đại học Y Dược TP HCM - Cơ sở 3, nhận định việc làm việc dưới nắng nóng, mưa lạnh, khói bụi và áp lực thời gian khiến các tài xế phải đối mặt với nhiều nguy cơ bệnh tật. Tổ chức Y tế Thế giới (WHO) từng cảnh báo vào năm 2023 rằng làm việc trên 55 giờ mỗi tuần làm tăng 35% nguy cơ đột quỵ và 17% nguy cơ mắc bệnh tim. ""Thiếu ngủ kéo dài không chỉ gây mệt mỏi, giảm phản xạ, mà còn dẫn đến tai nạn giao thông và các bệnh mạn tính như tăng huyết áp, béo phì, tiểu đường và trầm cảm"", bác sĩ Long giải thích. Làm việc dưới trời nắng gắt có thể gây stress nhiệt, một mối đe dọa nghiêm trọng. Theo hướng dẫn của CDC Mỹ, khi thân nhiệt vượt quá 40 độ C, cơ thể sẽ mất khả năng tự điều hòa, dẫn đến say nắng, kiệt sức, thậm chí tử vong. Ngoài ra, việc tiếp xúc với khói bụi đô thị cũng là một nguy cơ lớn. Một báo cáo năm 2021 của Viện Sức khỏe nghề nghiệp và Môi trường cho thấy nồng độ bụi mịn PM2.5 tại Hà Nội và TP.HCM đã vượt chuẩn của WHO từ 3 đến 5 lần, làm tăng nguy cơ mắc bệnh phổi tắc nghẽn mạn tính (COPD), hen suyễn và các vấn đề về tim mạch. Bên cạnh đó, thói quen ăn uống thất thường và lạm dụng thực phẩm chế biến sẵn khiến các bệnh về tiêu hóa và gan nhiễm mỡ ngày càng gia tăng ở nhóm tài xế công nghệ. Áp lực từ việc giao hàng đúng giờ, tình trạng kẹt xe và những đánh giá tiêu cực từ khách hàng cũng gây ra căng thẳng tâm lý, dẫn đến kiệt sức và trầm cảm. Tài xế công nghệ đón khách, giao hàng trên đường Lý Tự Trọng, TP HCM, năm 2023. Ảnh:Thanh Tùng Để bảo vệ sức khỏe, bác sĩ Long khuyến nghị tài xế công nghệ nên ngủ đủ 6-8 giờ mỗi ngày, tránh ca đêm liên tục quá ba ngày và có nghỉ ngơi thích hợp giữa các ca làm việc. Khi làm việc dưới nắng, nên mặc áo dài tay sáng màu, đội nón rộng vành, sử dụng kem chống nắng có chỉ số SPF tối thiểu 30 và uống 250-300ml nước mỗi 30-45 phút. ""Tránh lạm dụng cà phê và nước tăng lực vì chúng có thể gây mất nước và rối loạn nhịp tim"", bác sĩ Long nhấn mạnh. Ông cũng khuyên tài xế nên mang theo thực phẩm lành mạnh như trái cây, sữa chua, uống đủ 2-2,5 lít nước mỗi ngày và cố gắng ăn đúng giờ. Nam hiện giảm thời gian làm việc xuống còn 8-10 giờ mỗi ngày, bổ sung dinh dưỡng và tập vật lý trị liệu theo chỉ dẫn của bác sĩ. Mặc dù thu nhập giảm khiến anh không khỏi lo lắng, nhưng anh hiểu rằng sức khỏe mới là tài sản quý giá nhất. ""Nhiều đồng nghiệp vẫn chạy kiệt sức vì áp lực tài chính. Nhưng tôi đã nhìn thấy hậu quả và không muốn phải trả giá đắt hơn nữa"", Nam tâm sự. ""Tiền có thể kiếm lại, nhưng sức khỏe mất đi khó lòng phục hồi"". Trong khi đó, Lan đã điều chỉnh lịch làm việc, cố gắng nghỉ ngơi nhiều hơn và tập yoga nhẹ nhàng để phục hồi. Cô chia sẻ: ""Tôi vẫn phải chạy xe để nuôi con, nhưng giờ biết cách cân bằng hơn. Mất sức khỏe thì không thể kiếm được đồng nào"". Mỹ Ý","Thứ tư, 29/10/2025, 00:04 (GMT+7)",Mỹ Ý,Sức khỏe,Tin tức,VN Express,
VNEX_291025_00009,VinaCapital: Thị trường còn nhiều cổ phiếu hấp dẫn,https://vnexpress.net/vinacapital-thi-truong-con-nhieu-co-phieu-hap-dan-4957022.html,"Tại hội nghị nhà đầu tư thường niên ngày 28/10, bà Nguyễn Hoài Thu, Phó tổng giám đốc Công ty Quản lý quỹ VinaCapital, đưa ra thống kê cho thấyVN-Indexđã tăng 32,9% tính từ đầu năm đến cuối tuần trước. Tuy nhiên, loại trừ các cổ phiếu thuộc nhómVingroupvà Gelex, mức tăng chỉ còn 13,4%. Công ty quản lý quỹ này cho haybất động sảnlà nhóm cổ phiếu có hiệu suất tốt nhất, với mức tăng 162,5% kể từ đầu năm. Tốc độ này duy trì cách biệt lớn so với nhiều nhóm ngành khác. So với tăng trưởng lợi nhuận dự phóng cả năm, giá cổ phiếu bất động sản đang tăng cao hơn 2,8 lần. Công nghiệp và chứng khoán cũng là các nhóm có tốc độ tăng giá cổ phiếu vượt trội so với thị trường. Ở chiều ngược lại, nhiều nhóm ngành có tăng trưởng lợi nhuận dự phóng năm nay đạt hai chữ số, nhưng hiệu suất của giá cổ phiếu vẫn ""đứng im"", thậm chí đi lùi. Chẳng hạn, ngành công nghệ được dự báo lợi nhuận cả năm tăng 18,1%, song từ đầu năm đến nay giá cổ phiếu đã sụt 24,3%. Tương tự, lợi nhuận nhóm tiêu dùng thiết yếu dự báo có thể tăng tới 42,3% - chỉ sau các doanh nghiệp địa ốc - thực tế giá cổ phiếu mới tích lũy 4,9%. Định giá theo chỉ sốP/E(giá thị trường trên lợi nhuận mỗi cổ phiếu) một số ngành đang cao hơn mức trung bình 5 năm qua, theo VinaCapital. Số này có các cổ phiếu chứng khoán, bất động sản, và nguyên vật liệu. Trong khi đó, thị trường tồn tại các nhóm vẫn có định giá dưới trung bình như công nghiệp, năng lượng, bảo hiểm, tiêu dùng thiết yếu, tiện ích hay công nghệ. ""Còn nhiềucổ phiếuthực chất chưa kịp tăng cùng thị trường, đồng nghĩa vẫn còn cơ hội đầu tư những mã này trong năm 2026"", bà Thu nhận xét. Các nhóm cổ phiếu hấp dẫn được VinaCapital xem xét trên hai tiêu chí, gồm PEG và ROE. Trong đó,PEGlà chỉ số được sử dụng để định giá cổ phiếu dựa trên tốc độ tăng trưởng thu nhập từ mã đó. Ngoài P/E, cần xét thêm G là tốc độ tăng trưởng EPS (Earnings Per Share, lợi nhuận trên mỗi mã) của cổ phiếu. Chỉ số này được xây dựng nhằm cung cấp góc nhìn toàn diện hơn về định giá cổ phiếu, hỗ trợ nhà đầu tư xác định các mã bị định giá thấp trên thị trường. Chỉ số càng bé, cổ phiếu càng bị thị trường định giá thấp và ngược lại. CònROE(tỷ số lợi nhuận ròng trên vốn chủ sở hữu) là chỉ số quan trọng để đo lường khả năng sinh lời trên mỗi đồng vốn, và thước đo chính xác để đánh giá một đồng tích lũy tạo ra bao nhiêu lợi nhuận. Nó thường được các nhà đầu tư phân tích để so sánh với mã cùng ngành trên thị trường, từ đó tham khảo khi quyết định mua cổ phiếu của công ty nào. VinaCapital chọn lọc ra các ngành có PEG quanh 1 lần đổ xuống, ROE phải đạt trên 15%. Kết quả cho thấy vật liệu, ngân hàng, tiêu dùng, chăm sóc sức khỏe và công nghệ là những nhóm đang có định giá hấp dẫn. Theo phân tích của công ty quản lý quỹ này, sự hồi phục của ngành tiêu dùng, một trong những yếu tố thúc đẩy mạnh mẽ cho tăng trưởng kinh tế. Theo đó, nhóm cổ phiếu bán lẻ sẽ được hưởng lợi, nhất là những doanh nghiệp đang gia tăng thị phần tốt. Ngân hàng cũng là mã còn dư địa điều chỉnh, bởi nhóm có triển vọng tích cực khi tăng trưởng tín dụng được dự báo cao hơn, có thể đạt 19-20%, và chính sách gỡ bỏ hạn mức (room) tín dụng. Ngoài ra, bất động sản hồi phục và đầu tư công được đẩy mạnh cũng giúp các nhà băng có thêm dư địa, quản lý chất lượng tài sản tốt hơn, nhất là ngân hàng lớn, quản trị tốt và chỉ số an toàn vốn (CAR) cao. Cuối cùng là hạ tầng khi Chính phủ tập trung rót vốn để triển khai nhiều dự án đầu tư công lớn - động lực tăng trưởng kinh tế. Các doanh nghiệp trong ngành xây dựng, vật liệu được dự báo sẽ được hưởng lợi từ chính sách đầu tư này. Bà Hoài Thu cho rằng thị trường sẽ có chu trình ""bình thường hóa"", tức sau giai đoạn bị dẫn dắt bởi một nhóm nhỏ cổ phiếu,chứng khoánsẽ quay trở lại ""bình thường"" và điều này khuyến khích đầu tư dài hạn. Tuy nhiên, chuyên gia VinaCapital khuyến nghị nhà đầu tư lưu ý tới rủi ro về tỷ giá và lãi suất. Theo quan sát của công ty quản lý quỹ này, tỷ giá VND với USD đang tăng đáng kể và xuất hiện chênh lệch ở thị trường ""chợ đen"". Về lãi suất, sau thời gian dài duy trì mặt bằng thấp, nhóm phân tích cho rằng mức lãi có thể được điều chỉnh tăng trong thời gian tới khi áp lực tỷ giá leo thang. VinaCapital nhận định thị trường chứng khoán ""rất nhạy cảm"" với hai yếu tố trên, nên nhà đầu tư cần theo dõi kỹ để có kế hoạch đối ứng. Song, họ nhìn nhận đầu tư dài hạn, chọn lọc cổ phiếu dựa trên nền tảng cơ bản và định giá vẫn là chiến lược tối ưu. Tất Đạt","Thứ tư, 29/10/2025, 00:10 (GMT+7)",Tất Đạt,Kinh doanh,Chứng khoán,VN Express,
