id,title,link,content,date,author,category,sub_category,source,summary
VNEX_241225_00057,Vì sao liên tiếp xảy ra các vụ ngộ độc bánh mì?,https://vnexpress.net/vi-sao-lien-tiep-xay-ra-cac-vu-ngo-doc-banh-mi-4997448.html,"Những ngày qua,hơn 100 ngườingộ độc sau khi ăn bánh mì mua ở tiệm Ngọc Hà, phường Phú Mỹ (Bà Rịa - Vũng Tàu cũ). Trước đó, đầu tháng 11,hơn 300 ngườitại TP HCM bị ngộ độc sau khi ăn bánh mì mua ở các tiệm Cô Bích, nguyên nhân do nhiễm khuẩn Salmonella. Giữa tháng 12,hơn 200 ngườitại Quảng Ngãi cũng ngộ độc sau khi ăn bánh mì, do chả và rau nhiễm cùng tác nhân này. Qua các vụ việc, cơ quan chức năng ghi nhậnSalmonellalà tác nhân gây ngộ độc chủ yếu, một số trường hợp liên quan pate, chả, thịt nguội hoặc rau sống. Điều này cho thấy không chỉ một nguyên liệu riêng lẻ gây ngộ độc, mà chuỗi an toàn thực phẩm bị đứt gãy ở một hoặc nhiều khâu, từ chế biến, bảo quản đến phục vụ. Salmonella thường tồn tại trong thịt, trứng, gan động vật. Nếu thực phẩm không được nấu chín đủ nhiệt độ để tiêu diệt vi khuẩn, hoặc thực phẩm chín bị tái nhiễm chéo qua dao, thớt, tay người chế biến, nguy cơngộ độc thực phẩmsẽ rất lớn. Trong khi đó, rau sống ăn kèm nếu không được rửa sạch, khử khuẩn đúng cách cũng có thể mang mầm bệnh. Bánh mì thường được kẹp nhiều nguyên liệu. Ảnh:Minh Thảo Đại diện Sở An toàn thực phẩm TP HCM nhận định các vụ ngộ độc bánh mì liên tiếp cho thấy nguy cơ mất an toàn thực phẩm đối với thức ăn đường phố, đặc biệt là các món tiện lợi, tiêu thụ nhanh và phục vụ số lượng lớn người dân mỗi ngày. Theo đó, thực phẩm chế biến sẵn nếu không được bảo quản đúng cách sẽ tiềm ẩn nguy cơ cao nhiễm khuẩn. Bánh mì quen thuộc nhưng nhân bánh thường được chuẩn bị từ tối hôm trước, bảo quản không đủ lạnh hoặc để ở nhiệt độ phòng trong nhiều giờ có thể tạo điều kiện cho vi khuẩn phát triển nhanh chóng. Bên cạnh đó, nguồn gốc nguyên liệu là yếu tố then chốt. Các loại pate, chả, thịt nguội sản xuất thủ công, không được kiểm soát chặt chẽ điều kiện vệ sinh, rất dễ nhiễm Salmonella và các vi sinh gây bệnh khác. Ngoài nguyên liệu, vai trò của người trực tiếp chế biến cũng đặc biệt quan trọng. Không rửa tay đúng cách, không mang găng tay hoặc sử dụng chung dụng cụ cho thực phẩm sống và chín là những nguyên nhân phổ biến dẫn đến nhiễm khuẩn chéo. Đại diện Sở An toàn thực phẩm khuyến cáo các cơ sở kinh doanh bánh mì cần tuân thủ nghiêm quy định về điều kiện vệ sinh, bảo quản thực phẩm ở nhiệt độ phù hợp, chế biến trong ngày, không sử dụng nguyên liệu tồn trữ kéo dài. Người tiêu dùng nên lựa chọn các điểm bán có điều kiện vệ sinh rõ ràng, hạn chế ăn bánh mì có nhiều nhân chế biến sẵn, đặc biệt khi thấy thực phẩm có mùi lạ, màu sắc bất thường. Khi có biểu hiện nghi ngờ ngộ độc như đau bụng, nôn ói, tiêu chảy, cần đến cơ sở y tế sớm và thông báo cho cơ quan chức năng để kịp thời xử lý, ngăn chặn nguy cơ lan rộng. Lê Phương","Thứ tư, 24/12/2025, 05:00 (GMT+7)",Lê Phương,Sức khỏe,Tin tức,VN Express,
VNEX_241225_00065,Người trẻ Hà Nội biến quán bar thành văn phòng lúc nửa đêm,https://vnexpress.net/nguoi-tre-ha-noi-bien-quan-bar-thanh-van-phong-luc-nua-dem-4996979.html,"Nữ sinh viên năm cuối là một trong nhiều người trẻ đang tham gia trào lưu ""working at the bar"" (làm việc tại quán bar) trong cao điểm bận rộn cuối năm. Vài tháng nay, thay vì quán cà phê hay thư viện - những nơi cô cho là quá yên tĩnh đến mức ngột ngạt - Ngọc chọn quán bar làm trạm dừng chân mỗi tối. Ngọc coi nhạc điện tử nhịp độ nhanh (high BPM) là loại ""tiếng ồn trắng"" đặc biệt, chất xúc tác giúp não bộ duy trì trạng thái hưng phấn. ""Trong không gian này, tôi làm việc nhanh hơn, năng suất hơn"", cô nói. Mỗi buổi làm việc tại bar tốn từ 200.000 đến một triệu đồng. Khánh Ngân, 21 tuổi, phường Nam Từ Liêm đang chạy deadline ở quán bar, tối 20/12. Ảnh:Quỳnh Nguyễn Khánh Ngân, 21 tuổi, ở phường Nam Từ Liêm, một freelancer ngành sáng tạo, cũng coi các quán bar là ""văn phòng thứ hai"". Ngân phân loại địa điểm theo mục tiêu: Bar náo nhiệt để tìm ý tưởng đột phá, còn các mô hình ""hidden pub"" (quán rượu ẩn mình) để tập trung viết lách. Cô thường đi cùng nhóm bạn để vừa làm vừa chơi, biến những giờ lao động căng thẳng thành trải nghiệm tận hưởng. ""Khi mỏi mắt, tôi quan sát dòng người hoặc trò chuyện cùng bartender để xả stress, sau đó quay lại công việc với tâm thế mới"", Ngân cho biết. Dữ liệu mạng xã hội cho thấy từ khóa ""bar làm việc"" hay ""deadline tại bar"" đang trở thành xu hướng. Trên YouTube, các danh sách nhạc House, Techno với tiêu đề ""Nhạc tập trung làm việc"" thu hút hàng triệu lượt nghe. Nắm bắt thị hiếu này, nhiều tụ điểm giải trí tại Hà Nội bắt đầu thay đổi để chiều lòng các ""thượng đế mang laptop"". Anh Nguyễn Việt Hoàng (Edgar), DJ tại một quán bar ở phường Đống Đa cho biết, lượng khách mang máy tính tới quán vài tuần nay tăng gấp đôi, gấp ba, thường tập trung vào khung 21h đến 1h sáng. Anh Hoàng cho biết ở quán thường sẽ đánh nhạc house, techno sôi động. Khi thấy khách làm việc, quán sẽ tự điều chỉnh nhạc, giảm độ căng thẳng để cân bằng cho cả khách chơi và người chạy deadline. Quán của anh còn tung ra các bản phối nhạc (liveset) House dài một tiếng dành cho làm việc, thu hút hàng trăm nghìn lượt xem trên mạng xã hội. ""Trong MV chúng tôi dựng lên mô hình có bàn làm việc, có đèn học, có DJ đánh nhạc và nhận được rất nhiều lời mong muốn hiện thực hóa nó từ khán giả"", Hoàng nói. Trong khi đó, anh Nguyễn Văn Sỹ, chủ quán bar Zero Point (Hà Nội) ghi nhận trong năm 2025, lượng khách tới làm việc tăng đột biến so với cùng kỳ các năm. Trung bình mỗi tối có khoảng 10-15 bạn trẻ mang theo laptop. Thường khách làm việc sẽ đi một mình, đến ngồi cùng bartender hoặc các không gian ngoài trời. Quán phải phân chia khu vực nhạc mạnh và nhạc nhẹ, bố trí bàn ghế sofa phù hợp khách ngồi làm việc lâu. Minh Ngọc (bìa trái), 21 tuổi, ở phường Cầu Giấy đang làm việc tại quán bar ở phường Đống Đa, Hà Nội, ngày 20/12. Ảnh:Nga Thanh Lý giải dưới góc độ y khoa, thạc sĩ, bác sĩ Nguyễn Viết Chung, giảng viên Đại học Y Dược – ĐHQG Hà Nội cho biết, âm nhạc điện tử nhịp điệu đều đặn có thể hoạt động như một bộ lọc âm thanh. Hệ thống thần kinh giao cảm sẽ hoạt động mạnh hơn khi có kích thích từ âm nhạc nhịp điệu nhanh, giúp giảm tình trạng ""đãng trí"" (mind-wandering) và tăng khả năng tập trung vào nhiệm vụ (task-focus). ""Sự hưng phấn từ không gian năng động ở bar kích thích não bộ tiết dopamine, khiến việc hoàn thành những công việc mang tính lặp lại trở nên dễ dàng, thú vị hơn"", bác sĩ Chung phân tích. Tuy nhiên, chuyên gia cũng cảnh báo về định luật Yerkes–Dodson: Kích thích chỉ giúp tăng hiệu suất đến một điểm ""tối ưu"". Nếu âm lượng quá lớn hoặc ánh sáng nhấp nháy liên tục, hiệu suất làm việc sẽ giảm sút, gây mỏi mắt và suy giảm thị lực. Bác sĩ Chung khuyên người trẻ nên tuân thủ quy tắc 20-20-20 (cứ 20 phút nhìn xa 6 m trong 20 giây) và chọn không gian thoáng đãng, ít khói thuốc. Tiến sĩ tâm lý Nguyễn Thị Minh, Học viện Chính trị Hành chính Quốc gia Hồ Chí Minh nhận định, nhu cầu làm việc linh hoạt sau đại dịch khiến Gen Z có xu hướng xóa bỏ ranh giới giữa văn phòng và không gian giải trí. Việc nhìn thấy người khác cùng nỗ lực trong một không gian công cộng giúp họ xóa đi cảm giác cô độc, tạo động lực phấn đấu mạnh mẽ hơn. Người trẻ đi bar làm việc tại bar HYBRA On Top và bar Zero Point (Hà Nội), tháng 12/2025. Video:Nga Thanh Đồng hồ điểm 0h, Minh Ngọc gập máy tính sau khi hoàn thành chương cuối khóa luận. Với cô, quán bar lúc này không chỉ là nơi giải trí, mà là ""văn phòng dã chiến"" giúp cô đi qua mùa bận rộn nhất trong năm. ""Làm việc tại bar là cách tôi cân bằng áp lực. Khi máy tính tắt đi, tôi cũng kịp để lại mọi căng thẳng phía sau cánh cửa quán"", Ngọc chia sẻ. Nga Thanh - Quỳnh Nguyễn","Thứ tư, 24/12/2025, 06:00 (GMT+7)",Nga Thanh - Quỳnh Nguyễn,Đời sống,Nhịp sống,VN Express,
VNEX_241225_00002,"Nổ lớn làm sập viện dưỡng lão Mỹ, hai người chết",https://vnexpress.net/no-lon-lam-sap-vien-duong-lao-my-hai-nguoi-chet-4997559.html,"Nhân viên công ty điện lực Peco chiều 23/12 (rạng sáng 24/12 giờ Hà Nội) đến viện dưỡng lão Silver Lake ở thị trấn Bristol, ngoại ô Philadelphia, bang Pennsylvania sau khi nhận được tin báo về mùi khí gas tại cơ sở này. Khi họ đến nơi, một vụ nổ lớn xảy ra, khiến một phần tòa nhà đổ sập, khói đen bốc ngùn ngụt. Nhân viên Peco đã phải ngắt nguồn khí gas và điện đến viện dưỡng lão vì an toàn của lực lượng cứu hộ và người dân địa phương. Ít nhất hai người thiệt mạng, 5 người mất tích, số nạn nhân bị thương và mắc kẹt chưa được xác định. Cảnh sát thị trấn Upper Makefield mô tả đây là ""vụ nổ gây thương vong hàng loạt"". Hiện trường vụ nổ ở viện dưỡng lão Silver Lake tại thị trấn Bristol, bang Pennsylvania, Mỹ. Ảnh:WPVI Willie Tye, người sống gần viện dưỡng lão, đang xem TV thì nghe thấy tiếng nổ lớn. Ông ra ngoài, thấy ""lửa cháy khắp nơi"", mọi người tháo chạy khỏi tòa nhà. ""Tôi tưởng máy bay rơi xuống nhà. Chúng ta chỉ còn cách cầu nguyện cho họ"", ông Tye nói, cho biết vụ nổ dường như xảy ra ở khu nhà bếp. Nguyên nhân vụ nổ vẫn chưa rõ. Giới chức thị trấn đang sắp xếp nơi sơ tán tạm thời cho người cao tuổi ở viện dưỡng lão đến trường học gần đó. Thống đốc Pennsylvania Josh Shapiro khuyến nghị người dân làm theo hướng dẫn của chính quyền địa phương. Viện dưỡng lão Silver Lake có 174 giường. Cơ sở này đã được kiểm tra an toàn phòng cháy chữa cháy tiêu chuẩn vào tháng 9/2024, không phát hiện sai phạm. Đức Trung(TheoGuardian, ABC News, AP)","Thứ tư, 24/12/2025, 09:41 (GMT+7)",Đức Trung,Thế giới,Bắc Mỹ,VN Express,
VNEX_241225_00022,vRace mở đăng ký giải kỷ niệm 5 năm,https://vnexpress.net/vrace-mo-dang-ky-giai-chay-5-nam-4997376.html,"Giải chạy online được tổ chức trên nền tảng thể thao trực tuyến vRace, mở đăng ký từ 25/12, không giới hạn cự ly. Không giống những giải yêu cầu hoàn thành mục tiêu cụ thể, sự kiện kỷ niệm tập trung ghi nhận sự đồng hành của các runner. Người tham gia chỉ cần hoàn tất đăng ký và chạy hợp lệ theo quy định, không cần đạt cự ly tối thiểu để nhận vật phẩm. Ban tổ chức cho biết, bộ sản phẩm giới hạn gồm áo T-shirt, áo singlet, áo khoác chạy bộ và mũ, tone màu xanh navy và xanh lá neon chủ đạo. Thiết kế tượng trưng cho hành trình tiến hóa của runner, đồng thời là lời tri ân cộng đồng đã đồng hành từ khi nền tảng ra đời năm 2020 Đăng kýtại đây. Bộ vật phẩm kỷ niệm 5 năm của vRace. Ảnh:vRace Ban tổ chức cho biết T-shirt và singlet trong bộ sưu tập được làm từ vải tái chế, trọng lượng dưới 50g, áp dụng công nghệ cắt laser không đường may nhằm giảm ma sát khi vận động. Chất liệu thoáng khí, thấm hút mồ hôi, khô nhanh, có khả năng chống tia UV và hạn chế mùi, phù hợp cho tập luyện hằng ngày cũng như chạy đường dài, thi đấu cường độ cao. Áo khoác chạy bộ được thiết kế cho điều kiện thời tiết thay đổi, sử dụng chất liệu polyester pha spandex, cân bằng giữa khả năng giữ ấm, độ thoáng và độ co giãn. ""Sản phẩm có khả năng chắn gió, khô nhanh, ôm theo chuyển động cơ thể, hỗ trợ runner duy trì hiệu suất trên nhiều địa hình và cường độ vận động khác nhau"", đại diện vRace cho biết. Mũ lưỡi trai có thiết kế vành cong, tích hợp lưới. Các vật phẩm được bán lẻ hoặc theo combo, dự kiến giao hàng từ ngày 1/2/2026. vRace đời năm 2020 - giai đoạn các giải chạy offline tạm dừng bởi đại dịch. Những giải đầu tiên mang tính kết nối và động viên cộng đồng duy trì vận động trong bối cảnh giãn cách. Sau đó, nền tảng mở rộng sang các giải doanh nghiệp, trở thành công cụ gắn kết nội bộ, khuyến khích nhân viên vận động. Đến nay, vRace đã đồng hành cùng hơn 200 giải, từ quy mô vài trăm đến hàng chục nghìn người tham gia. Bảng giá vật phẩm giải chạy. Ảnh:vRace Năm 2024 đánh dấu bước ngoặt khi vRace lần đầu giới thiệu giải chạy có vật phẩm. Những bộ sản phẩm có thiết kế riêng, trở thành vật phẩm sưu tầm, mở đường cho nhiều giải chủ đề mới trong năm 2025, từ Tết, mùa lễ hội đến các giải chạy gắn với hoạt động thiện nguyện. Với các giải gây quỹ, mỗi km người chạy hoàn thành đều được quy đổi thành đóng góp cho người có hoàn cảnh khó khăn. Theo ban tổ chức, vRace có được ngày hôm nay nhờ sự đồng hành của cộng đồng runner. Những người chạy đầu tiên từ năm 2020 vẫn tiếp tục góp mặt trong các giải hiện tại. Hàng trăm doanh nghiệp đã duy trì giải riêng mỗi năm. ""Đó là động lực để chúng tôi tiếp tục phát triển các giải theo chủ đề văn hóa - lễ hội, giải thiện nguyện và các bộ vật phẩm mang tính sưu tầm cao hơn trong năm tới"", đại diện vRace cho hay. Runner có thể đăng ký giải và xem thêm hướng dẫn trênwebsite vRace. Lan Anh","Thứ tư, 24/12/2025, 10:00 (GMT+7)",Lan Anh,Thể thao,Marathon,VN Express,
VNEX_241225_00003,"Nga, Trung Quốc đấu khẩu với Mỹ về vấn đề Venezuela",https://vnexpress.net/nga-trung-quoc-dau-khau-voi-my-ve-van-de-venezuela-4997495.html,"""Các hành động của Mỹ đi ngược lại tất cả chuẩn mực quan trọng của luật pháp quốc tế"", Đại sứ Nga tại Liên Hợp Quốc Vassily Nebenzia phát biểu trong cuộc họp Hội đồng Bảo an Liên Hợp Quốc ngày 23/12, mô tả lệnh phong tỏa Venezuela do Mỹ tiến hành là ""hành động gây hấn"". Ông thêm rằng Washington phải chịu trách nhiệm đối với ""những hậu quả thảm khốc liên tục do hành vi ngang ngược như vậy gây ra"". Phó đại diện thường trực phái đoàn Trung Quốc tại Liên Hợp Quốc Tôn Lôi khẳng định Bắc Kinh phản đối ""mọi hành động đơn phương và bắt nạt"", cũng như ủng hộ các nước ""bảo vệ chủ quyền và phẩm giá quốc gia của mình"". Cuộc họp của Hội đồng Bảo an tại trụ sở Liên Hợp Quốc ở New York, Mỹ ngày 23/12. Ảnh:AFP Cuộc họp được tổ chức theo yêu cầu của Venezuela, với sự ủng hộ của Nga và Trung Quốc. Đại sứ Venezuela Samuel Moncada cho rằng đất nước ông đang đối mặt với ""thế lực hành động bất chấp luật pháp quốc tế, ép buộc người dân rời khỏi đất nước"", đồng thời mô tả đây là ""vụ tống tiền lớn nhất lịch sử"". Đại sứ Mỹ Mike Waltz đáp trả những lời chỉ trích, nói rằng Mỹ sẽ làm mọi thứ trong khả năng để ""bảo vệ bán cầu, biên giới và người dân"". Ông cũng lặp lại cáo buộc Tổng thống Venezuela Nicolas Maduro điều hành băng đảng ma túy Cartel de los Soles, dù đến nay chưa có bằng chứng nào cho thấy điều này. Tổng thống Mỹ Donald Trump đã nhiều lần cáo buộc Venezuela sử dụng dầu mỏ, nguồn tài nguyên quốc gia để tài trợ cho hoạt động ""khủng bố ma túy, buôn người, giết người và bắt cóc"". Caracas phủ nhận mọi cáo buộc, khẳng định Washington đang cố tìm cách chiếm đoạt trữ lượng dầu mỏ lớn nhất thế giới trên lãnh thổ Venezuela. Mỹ gần đây liên tục gia tăng áp lực lên chính quyền Tổng thống Maduro, triển khai nhiều khí tài quân sự đến khu vực với lý do tiến hành nhiệm vụ chống ma túy. Các cuộc không kích của quân đội Mỹ vào xuồng nghi chở ma túy ở Caribe và Thái Bình Dương kể từ tháng 9 đã khiến hơn 100 người thiệt mạng. Ông Maduro cho rằng động thái huy động lực lượng thể hiện Mỹ có ý định thay đổi chế độ tại Venezuela và muốn ""cướp đất đai, khoáng sản"" của nước này. Thanh Tâm(TheoAFP, Reuters)","Thứ tư, 24/12/2025, 08:55 (GMT+7)",Thanh Tâm,Thế giới,Bắc Mỹ,VN Express,
VNEX_241225_00067,Vợ cũ đã có bạn trai nhưng vẫn hỏi vay tiền tôi,https://vnexpress.net/vo-cu-da-co-ban-trai-nhung-van-hoi-vay-tien-toi-4997377.html,"Tôi và vợ cũ ly hôn cách đây gần hai năm, sau khi tôi phát hiện cô ấy ngoại tình. Khi đó, chúng tôi đã cố ngồi lại nói chuyện, nhưng mọi thứ không thể cứu vãn. Tôi chọn dừng lại vì không thể tiếp tục chung sống trong cảm giác nghi ngờ và tổn thương. Ly hôn diễn ra khá nhanh, không ồn ào, cũng không tranh chấp nhiều. Mỗi người nuôi một con, coi như chia đều trách nhiệm. Thời gian đầu sau ly hôn, mọi thứ tương đối ổn. Tôi đi làm, đón con đúng ngày, đúng giờ. Vợ cũ cũng vậy. Nhưng dần dần, cô ấy bắt đầu gửi con cho tôi nhiều hơn. Lý do ban đầu là bận việc, rồi đến bận đi công tác, sau đó là những buổi đi chơi với bạn trai mới. Có những lần, cô ấy nhắn tin sát giờ, nói chiều nay nhờ tôi đón con giúp vì có việc gấp. Tôi không nỡ từ chối, vì con không có lỗi trong chuyện của người lớn. Rồi việc ""nhờ trông giúp vài hôm"" trở thành cả tuần, cả tháng. Cuối cùng, con ở hẳn với tôi. Tôi không phản đối, chỉ nghĩ đơn giản, con cần một người ổn định hơn trong sinh hoạt hàng ngày, và lúc đó tôi là người có thể lo được. Tôi tự sắp xếp lại công việc, đón con đi học, tối về nấu cơm, kèm con học bài. Mệt nhưng quen dần. Có những lúc nhìn con ngủ, tôi chỉ mong con lớn lên bình yên, không phải chứng kiến thêm những xáo trộn từ người lớn. Gần đây, vợ cũ nhắn tin cho tôi, không phải hỏi thăm con, mà là hỏi vay tiền. Lý do vẫn là khó khăn, làm ăn chưa ổn định, phải trả nợ bạn vì bị hối thúc (vay bạn để chi tiêu sinh hoạt). Lần này vay hẳn 20 triệu đồng. Tôi đọc tin nhắn rất lâu và thấy mệt mỏi. Hồi con còn ở cùng vợ cũ, thỉnh thoảng cô ấy nhắn tin hỏi vay tôi một, hai triệu, nhiều thì dăm ba triệu, kể lể đợt này chi tiêu nhiều, con ốm đau phải đi khám, rồi thì cho con đi chơi chỗ nọ chỗ kia,... Tôi thường gửi cho cô ấy dư thêm một chút, bảo là gửi thêm cho con và không cần trả. Trước đây khi còn chung sống, lương của cô ấy chỉ được 12 triệu đồng. Cô ấy lại còn hay mua linh tinh nên thường do tôi chi tiền sinh hoạt trong nhà. Tôi đang phân vân không biết nên giúp hay dứt khoát từ chối. Tôi sợ nếu tiếp tục cho vay, cô ấy cứ ỷ lại vào tôi, có thể nói là lợi dụng tôi. Nhưng nếu không giúp, tôi cũng hơi áy náy, sợ cô ấy giận dỗi rồi đòi con về, con lại phải chịu những ngày ở nhà một mình, có hôm phải tự úp mì tôm ăn vì mẹ về muộn. Mong mọi người cho tôi xin lời khuyên. Minh Nguyên","Thứ tư, 24/12/2025, 00:00 (GMT+7)",Minh Nguyên,Tâm sự,,VN Express,
VNEX_241225_00063,Chàng trai mắc ung thư mô mềm di căn phổi,https://vnexpress.net/chang-trai-mac-ung-thu-mo-mem-di-can-phoi-4997497.html,"Kết quả nhuộm hóa mô miễn dịch cho thấy u ở ngực bệnh nhân là u sarcoma hoạt mạc (Synovial Sarcoma). PGS.TS.BS Vũ Hữu Vĩnh, Giám đốc Trung tâm Ngoại Lồng ngực - Mạch máu, Bệnh viện Đa khoa Tâm Anh TP HCM, cho biết đây là ung thư mô mềm, xuất hiện ở vùng ngực giữa (trung thất), âm thầm phát triển, lan rộng và đã di căn đến phổi. Sarcoma thường xảy ra ở người dưới 40 tuổi. Tỷ lệ mắc u sarcoma hoạt mạc khoảng 3/10 triệu người mỗi năm, theo bác sĩ Vĩnh. Bệnh thường liên quan đến đột biến nhiễm sắc thể, đồng thời có thể bị ảnh hưởng bởi các yếu tố ngoại cảnh như môi trường và lối sống. U sarcoma hoạt mạc được chẩn đoán sớm và điều trị đúng phác đồ có tiên lượng tốt, thậm chí chữa khỏi. Tuy nhiên, loại u này tiến triển rất chậm và thường không có triệu chứng. Khi khối u phát triển lớn hoặc xâm lấn các cơ quan lân cận, triệu chứng mới xuất hiện rõ ràng. Bác sĩ Vĩnh (thứ hai từ trái sang) cùng êkíp phẫu thuật loại bỏ khối u cho người bệnh. Ảnh:Bệnh viện Đa khoa Tâm Anh Đánh giá khối u xâm lấn sâu vào phổi bệnh nhân, các bác sĩ quyết định mổ mở để kiểm soát tối đa rủi ro và loại bỏ trọn tổn thương. Êkíp bóc tách từng lớp mô, mở đường tiếp cận khối u giữa vùng ngực chật hẹp, sau hơn ba tiếng, toàn bộkhối u ác tínhđược loại bỏ. ""Đây là ca phẫu thuật phức tạp do khối u của bệnh nhân đã to xâm lấn sâu vào động mạch phổi, động mạch chủ và tĩnh mạch phổi trên"", bác sĩ Vĩnh cho biết. Để loại bỏ khối u, êkíp buộc phải cắt một phần thùy trên phổi trái. Bác sĩ Vĩnh kiểm tra sức khỏe cho người bệnh sau khi phẫu thuật thành công. Ảnh:Bệnh viện cung cấp Hậu phẫu, sức khỏe người bệnh ổn định, tiếp tục được điều trị bổ trợ xạ trị, hóa trị nhằm kiểm soát nguy cơ tái phát, di căn. Bác sĩ Vĩnh khuyến cáo người trẻ không nên chủ quan với các triệu chứng bất thường nhưđau ngựckéo dài, khó thở, sờ thấy khối u dưới da. Nên đi khám khi thấy bất thường nhằm tăng cơ hội phát hiện bệnh sớm, điều trị kịp thời. Bảo Anh *Tên người bệnh đã được thay đổi","Thứ tư, 24/12/2025, 08:00 (GMT+7)",Bảo Anh,Sức khỏe,Các bệnh,VN Express,
