id,title,link,content,date,author,category,sub_category,source,summary
VNEX_060925_00071,Bị thắc mắc vì kết hôn sớm,https://vnexpress.net/bi-thac-mac-vi-ket-hon-som-4935735.html,"Chồng cô, Muhammad Danish Hussien, 22 tuổi, khi đó cũng vừa hoàn thành những tháng cuối nghĩa vụ quân sự. Quyết định của họ, đi trước gần một thập kỷ so với tuổi kết hôn trung bình ở Singapore (khoảng 30 tuổi), khiến gia đình và bạn bè sốc. Một số người còn nghi ngờ cô mang thai. Trong buổi gặp gia đình, họ hàng liên tục hỏi côTại sao muốn kết hôn trẻ thế? Cháu không muốn học tiếp, theo đuổi sự nghiệp trước khi ổn định sao? Cháu nghĩ hôn nhân dễ dàng à? Do tuổi còn trẻ, họ phải tham gia lớp chuẩn bị hôn nhân bắt buộc và tư vấn tâm lý trước khi đăng ký kết hôn. Chưa đủ 21 tuổi, Dzakiyyah không đủ điều kiện đứng tên nhà ở xã hội (HDB). Điều này làm trì hoãn ước mơ mua một căn hộ Build-to-Order (BTO) - cột mốc mà nhiều người Singapore xem là bước khởi đầu của hôn nhân. Cô buộc phải thuê căn hộ studio ở cùng chồng. ""Dù vậy, quyết định kết hôn là điều tuyệt vời nhất trong đời"", cô nói. ""Mỗi người sẽ có trải nghiệm khác nhau"". Đối với Natthan, 26 tuổi và Joye Hannah Lee, 25 tuổi, hôn nhân đến rất sớm nhưng thuận tự nhiên. Họ gặp nhau trong sinh hoạt nhà thờ giữa 2021. Những cuộc trò chuyện trực tuyến nhanh chóng mở ra các buổi đi chơi nhóm, trong đó có một chuyến đạp xe khiến cả hai tin vào tình yêu sét đánh. ""Người này sẽ là chồng con"", Lee nói với mẹ. Giữa 2022, họ chính thức hẹn hò và đi thẳng đến hôn nhân. Natthan lấy điện thoại ra xem lịch học và thống nhất ngày cưới mà không suy nghĩ hay do dự. Họ kết hôn ngày 8/4/2023 khi Lee vẫn là sinh viên đại học. Cô nói họ ở bên nhau thường xuyên đến mức việc tạm biệt vào cuối ngày không còn quan trọng, và hôn nhân giúp họ chia sẻ cuộc sống một cách tự nhiên. Natthan Lee và Joye Hannah Lee ở căn hộ riêng tại Singapore, tháng 8/2025. Ảnh:CNA Đôi vợ chồng này nằm trong số ít người Singapore kết hôn trẻ khi độ tuổi kết hôn lần đầu tiếp tục tăng, từ 30,2 lên 31,1 tuổi với nam và từ 28,2 lên 29,6 tuổi với nữ trong giai đoạn 2014–2024, theo Bộ Phát triển Xã hội và Gia đình. Ngược lại, số người kết hôn dưới 24 tuổi giảm từ 3.695 vào năm 2020 xuống 3.105 vào năm 2024, phản ánh áp lực và định kiến mà những người kết hôn trẻ phải đối mặt. Phụ nữ kết hôn ở độ tuổi 20-24 có tỷ lệ ly hôn trong 10 năm lên tới 24,3%, cao hơn nhiều so với các nhóm tuổi lớn hơn. Nhiều người trẻ ở Singapore khi thông báo kết hôn sớm thường bị cho là ""cưới chạy bầu"". Định kiến xã hội này khiến họ bị nhìn nhận là thiếu chuẩn bị hoặc bị ép buộc, dù quyết định đã được cân nhắc kỹ. Phản ứng này trở thành định kiến xã hội, cho rằng họ thiếu chuẩn bị hoặc bị ép buộc, buộc nhiều người phải giải thích quyết định dù đã cân nhắc kỹ dựa trên tình cảm và kế hoạch chung. Nur Dzakiyyah Isaman đã suy sụp khi đứng giữa đống giấy tờ BTO chưa thể đăng ký vì chưa đủ tuổi. Cô và chồng phải chi tiêu hạn chế và tận dụng mọi khoản thu nhập tối thiểu. ""Nếu kết hôn muộn hơn, bạn có thể ổn định tài chính hơn, nhưng lúc đó năng lượng và thời gian bên nhau sẽ ít đi. Chúng tôi chọn tận dụng những gì mình có"", cô nói. Các chuyên gia nhận thấy những người kết hôn trẻ thường phải thích nghi với thay đổi mục tiêu và căng thẳng tài chính, nhưng tuổi tác không quyết định kết quả hôn nhân. Nghiên cứu từ Viện Sức khỏe Quốc gia Singapore cho thấy, những người kết hôn trước 24 tuổi có nguy cơ ly hôn cao hơn, thường gặp căng thẳng tài chính, thiếu kinh nghiệm sống và áp lực xã hội. Jeremy E. Uecker, nhà xã hội học tại Đại học North Carolina at Chapel Hill (Mỹ), cho rằng kết hôn tự nguyện ở tuổi 22-26 có thể tăng sự hài lòng với cuộc sống nhờ hỗ trợ xã hội và cảm giác trách nhiệm, đồng thời giảm hành vi rủi ro như say rượu. Tuy nhiên, kết hôn ở độ tuổi đầu 20 có thể dẫn đến căng thẳng tâm lý do thiếu sự chuẩn bị, tỷ lệ ly hôn cao hơn và ảnh hưởng sức khỏe lâu dài. Ông Uecker cũng lưu ý rằng đôi khi, những người có sẵn vấn đề tâm lý thường chọn kết hôn sớm như một lối thoát khỏi hoàn cảnh khó khăn. Với phụ nữ, kết hôn sớm không mang lợi ích lâu dài nếu thiếu hỗ trợ kinh tế và cảm xúc. TheoUS Census Bureau, chỉ 23% phụ nữ và 13% nam giới 20-24 tuổi từng kết hôn với tỷ lệ duy trì hôn nhân BA năm là 78% ở phụ nữ kết hôn tuổi teen và 86% ở tuổi đầu 20. Nghiên cứuAdd Healthcho thấy người kết hôn sớm có mức căng thẳng tâm lý tương tự người độc thân, nhưng thấp hơn 20-30% so với người chưa kết hôn có vấn đề xã hội hoặc hành vi rủi ro. Ngọc Ngân(TheoCNA)","Thứ bảy, 6/9/2025, 09:35 (GMT+7)",Ngọc Ngân,Đời sống,Tổ ấm,VN Express,"Bài viết tập trung vào xu hướng kết hôn trẻ ở Singapore, đi ngược lại độ tuổi kết hôn trung bình ngày càng tăng. Hai cặp đôi được phỏng vấn chia sẻ về quyết định kết hôn sớm của họ, đối mặt với những khó khăn như định kiến xã hội, tài chính hạn hẹp và các quy định về nhà ở. Tuy nhiên, họ khẳng định hôn nhân mang lại hạnh phúc và sự gắn kết tự nhiên. Bài viết cũng đề cập đến tỷ lệ ly hôn cao hơn ở những người kết hôn trẻ và những áp lực mà họ phải đối mặt do định kiến xã hội."
VNEX_060925_00066,Tỉnh ngủ giữa đêm do khó thở là bệnh gì?,https://vnexpress.net/tinh-ngu-giua-dem-do-kho-tho-la-benh-gi-4935751.html,"Trả lời: Khó thở sau khi tập thể dục hoặc hoạt động gắng sức là bình thường. Song khó thở đột ngột, khoảng một hoặc hai giờ sau khi ngủ, khiến bạn phải thức dậy giữa đêm, ngồi thẳng khoảng 10-15 phút mới thở lại thoải mái có thể là biểu hiện của chứng khó thở kịch phát về đêm (Paroxysmal Nocturnal Dyspnea - PND). Kịch phát nghĩa là cơn khó thở diễn ra đột ngột nhưng biến mất nhanh chóng, khác với khó thở cấp tính từ vài giờ đến vài ngày. Khó thở mạn tính kéo dài hàng tuần. Khó thở kịch phát về đêm có thể kèm ho, thở có tiếng khò khè, tim đập nhanh nên thường sợ hãi, lo lắng. Một số người cần đi tới nơi thoáng khí hoặc mở cửa sổ để thấy an toàn hơn, không dám ngủ trở lại hoặc chỉ yên tâm khi ngủ ngồi. Các bệnh lý thường gây khó thở kịch phát về đêm là suy tim sung huyết, tăng huyết áp động mạch phổi, bệnh phổi tắc nghẽn mạn tính (COPD), hen suyễn, phù phổi, bệnh Parkinson, béo phì, rối loạn tâm lý hoặcngưng thở khi ngủ. Bác sĩ tư vấn cho bệnh nhân khó thở. Ảnh minh họa:Bệnh viện Đa khoa Tâm Anh Bạn cần đi khám để được chẩn đoán đúng bệnh. Bác sĩ sẽ kiểm tra huyết áp, cân nặng, nghe tim phổi, chụp X-quang ngực, cộng hưởng từ MRI hoặc cắt lớp CT để phát hiện bệnh lý phổi. Xét nghiệm máu, siêu âm tim, điện tim đồ được chỉ định để sàng lọc bệnh về tim, nhất là tình trạng suy tim sung huyết. Điều trị đúng bệnh sẽ giảm khó thở kịch phát về đêm, giúp bạn ngủ ngon hơn, bớt lo lắng và sợ hãi. Ví dụ, bệnh nhân COPD hoặc phù phổi, có dịch phổi có thể dùng liệu pháp oxy, thở máy, lợi tiểu. Bệnh nhân suy tim có thể được kê thuốc chẹn beta, thuốc lợi tiểu, thuốc tăng cường khả năng co bóp của cơ tim. Người bệnhhen suyễndùng thuốc hoặc corticosteroid dạng hít để kiểm soát triệu chứng ban đêm. Duy trì sống lành mạnh, thường xuyên tập thể dục, không hút thuốc lá, hạn chế uống bia rượu, cải thiện chế độ ăn uống, quản lý căng thẳng giúp giảm khó thở kịch phát về đêm. ThS.BS Lê Thị Hồng ThắmKhoa Hô hấpBệnh viện Đa khoa Tâm Anh Hà Nội","Thứ bảy, 6/9/2025, 09:00 (GMT+7)",ThS.BS Lê Thị Hồng Thắm,Sức khỏe,Các bệnh,VN Express,"Bài viết này nói về chứng khó thở kịch phát về đêm (PND), một tình trạng khó thở đột ngột vào ban đêm, thường gặp ở người có bệnh lý tim mạch, phổi hoặc rối loạn khác. PND khác với khó thở thông thường và cần được chẩn đoán chính xác thông qua các xét nghiệm y tế. Việc điều trị nguyên nhân gây bệnh và duy trì lối sống lành mạnh có thể giúp giảm triệu chứng PND và cải thiện giấc ngủ."
VNEX_060925_00054,Bức thư tình người chồng 1.100 năm trước gửi vợ,https://vnexpress.net/buc-thu-tinh-nguoi-chong-1-100-nam-truoc-gui-vo-4935059.html,"Câu chuyện liên quan cổ vật thu hút nhiều bình luận khi trangShanxi Newsđăng trênWeibocuối tháng 8, dịp Thất tịch - ngày lễ Tình nhân theo phong tục truyền thống của người Hoa. Năm 1986, để phối hợp tu sửa chùa Pháp Môn tại tỉnh Thiểm Tây, Trung Quốc, đoàn khảo cổ khai quật khu vực chân tháp của chùa, tìm thấy cung điện dưới lòng đất. Một năm sau, cánh cửa cung điện được mở ra, các nhà khảo cổ phát hiện xá lợi Đức Phật (xương ngón tay Đức Phật) cùng hơn 2.000 cổ vật thời Đường, trong đó có tấm trang trí hình bông hoa. Tháo lớp đồng bên ngoài, giới khảo cổ nhận ra lớp gỗ bên trong khắc tâm nguyện của người thợ tên Thôi Khánh Khả. Bảo vật trang trí trong cung điện dưới lòng đất. Ảnh:Shufa Zazhi Những dòng chữ được khắc năm 871, trong đó Thôi Khánh Khả không cầu mong giàu có, thăng quan tiến chức mà gửi gắm tới vợ: ""Đệ tử Thôi Khánh Khả kiếp sau nguyện được sống cùng Tào Thị"". Ngoài ra, người thợ cầu nguyện cho cha mẹ được siêu thoát. Thôi Khánh Khả cũng khắc lời nguyện cầu điều tốt đẹp cho chúng sinh. Cổ vật được đặt trên đỉnh của cung điện dưới lòng đất với mục đích trang trí, thể hiện sự tôn kính Đức Phật. Chất liệu chính gồm bạc, gỗ, đồng, đường nét kết hợp tinh hoa của văn hóa Phật giáo với các ngành nghề thủ công thời Đường. Tác phẩm được xếp vào danh sách bảo vật quốc gia Trung Quốc, hiện được lưu giữ tại Bảo tàng chùa Pháp Môn. Hoa văn trang trí bằng bạc. Ảnh:Shufa Zazhi ""Bức thư tình được phát hiện sau hơn 1.100 năm"" làm nhiều người xúc động vì tình nghĩa, sự lãng mạn của người xưa. Khán giả viết trên Weibo: ""Một thiên niên kỷ, tâm nguyện của ông ấy chắc thành hiện thực rồi nhỉ?"". Theo ghi chép trong sử sách, tên gọi chùa Pháp Môn do vua Đường Cao Tổ Lý Uyên đặt, ông là hoàng đế khai quốc triều Đường, trị vì từ năm 618 đến 626. Pháp Môn tự là thánh địa Phật giáo quan trọng thời Đường. Sau khi được khai quật năm 1987, xá lợi từng được tôn trí để Phật tử chiêm bái tại các chùa ở Thái Lan, Hàn Quốc, Hong Kong, Đài Loan. Như Anh(theoShanxi News)","Thứ bảy, 6/9/2025, 00:05 (GMT+7)",Như Anh,Giải trí,Sân khấu - Mỹ thuật,VN Express,"Năm 1986, khi khai quật khu vực chùa Pháp Môn, các nhà khảo cổ đã phát hiện ra cung điện dưới lòng đất chứa xá lợi Đức Phật và nhiều cổ vật thời Đường. Trong số đó, một tấm trang trí hình bông hoa hé lộ tâm nguyện của người thợ Thôi Khánh Khả, khắc năm 871, không cầu danh lợi mà chỉ mong kiếp sau được sống cùng vợ là Tào Thị và cầu nguyện cho gia đình, chúng sinh. Phát hiện này đã gây xúc động mạnh trên mạng xã hội, ca ngợi tình cảm sâu sắc và sự lãng mạn của người xưa."
VNEX_060925_00073,Quyết định buông bỏ người đàn ông tưởng 'im lặng là quyền lực',https://vnexpress.net/khong-con-tinh-yeu-phan-boi-tinh-yeu-quyet-dinh-buong-bo-nguoi-dan-ong-tuong-im-lang-la-quyen-luc-4934967.html,"Anh à, im lặng có thể là sự điềm tĩnh, là cách của những người trưởng thành để lắng nghe và thấu hiểu. Nhưng khi nó bị dùng như một ""chiêu trò"" để né tránh hay thao túng, sẽ chẳng còn gì đáng giá. Tiếc thay, anh đã chọn cách ấy. Thời gian đầu, tôi từng nghĩ sự im lặng ấy là chiều sâu, là nội tâm khó giãi bày của anh. Rồi tôi hiểu, nó chỉ là lớp vỏ che đậy sự yếu đuối. Một người đàn ông trưởng thành, đã đi qua bao nhiêu sóng gió, đổ vỡ, tưởng rằng phải biết đối diện để giải quyết vấn đề, vậy mà anh vẫn chọn cách trốn tránh thay vì đối thoại thì đó không phải bản lĩnh, mà là thất bại. Anh có thể bước ra ngoài, tìm kiếm những mối quan hệ mới, có thể ""chạy"" hết từ người phụ nữ này sang người phụ nữ khác. Nhưng anh sẽ mang theo chính cái vòng luẩn quẩn của mình: không dám mở lòng, không dám chịu trách nhiệm, chỉ biết dựa vào trò im lặng để tạo ảo tưởng về quyền lực. Anh tưởng rằng mình đang điều khiển, thực ra anh chỉ đang lặp lại một vết xe đổ. Cuối cùng, anh chẳng giữ được ai thật sự. Anh có biết vì sao những người phụ nữ từng ở bên anh vẫn chịu đựng sự im lặng ấy không? Không phải vì họ ngưỡng mộ hay chấp nhận, càng không phải vì anh mạnh mẽ, đơn giản vì họ còn hy vọng một ngày nào đó anh sẽ trưởng thành hơn, hoặc đôi khi chỉ vì thương hại mà nhẫn nhịn. Rồi khi niềm tin đã cạn, sự thương hại không còn, tất cả sẽ quay lưng, anh sẽ thấy rõ cái anh tưởng là sức mạnh chỉ là sự kém cỏi, khiến người khác mệt mỏi và thất vọng. Hơn hết, anh cần phải hiểu một điều, anh không xứng đáng có được tình yêu đó. Bởi tình yêu là sự sẻ chia và nâng niu. Người không biết trân trọng người khác sẽ không bao giờ có được hạnh phúc. Tôi không còn thấy buồn hay giận, chỉ thấy may mắn vì đã kịp rời đi. Bởi ở tuổi này, tôi cần một người đàn ông biết trân trọng, biết chia sẻ, không phải một kẻ mãi loay hoay trong trò chơi trẻ con. Ai cũng chỉ có một lần tuổi trẻ, một lần thanh xuân, tôi không có lý do gì để lãng phí nó vào những khoảng lặng rẻ tiền. Sự im lặng của anh đã cho tôi một câu trả lời: anh không đủ tầm, không đủ tình, cũng chẳng đủ sức để giữ chân bất kỳ ai. Tôi đã buông bỏ, nhẹ nhõm và không ngoái lại. Tôi bước đi, an yên và tự do. Còn anh, cứ tiếp tục ở lại với ""quyền lực im lặng"" mà anh vẫn ngộ nhận. Một ngày, khi những cuộc vui qua đi, khi tuổi tác in rõ trong gương, anh sẽ nhận ra thứ còn lại bên mình chỉ là khoảng trống quạnh quẽ. Đó sẽ là cái giá anh phải trả cho cách mình chọn sống. Hồng Hoa","Thứ bảy, 6/9/2025, 00:00 (GMT+7)",Hồng Hoa,Tâm sự,,VN Express,"Bài viết phê phán một người đàn ông lạm dụng sự im lặng như một ""chiêu trò"" để né tránh trách nhiệm và thao túng người khác trong mối quan hệ. Tác giả nhận ra đây không phải là sự trưởng thành mà là sự yếu đuối và trốn tránh. Cô kết luận rằng người đàn ông này không xứng đáng với tình yêu và sẽ phải trả giá cho sự lựa chọn sống trong vòng luẩn quẩn đó. Cuối cùng, tác giả cảm thấy may mắn vì đã rời đi và tìm kiếm một người đàn ông trưởng thành, biết trân trọng và sẻ chia."
VNEX_060925_00011,"Meey Group chuẩn hóa quản trị, hướng tới IPO",https://vnexpress.net/meey-group-chuan-hoa-quan-tri-huong-toi-ipo-4934829.html,"Theo kế hoạch, Meey Group đang hoàn thiện pháp lý - tài chính và cấu phần quản trị phục vụ gọi vốn; sau đó, nộp hồ sơ niêm yết trên sàn Nasdaq và tổ chức các hoạt động roadshow trước IPO. Trước đó, vào tháng 7, doanh nghiệp này ký kết hợp tác với ARC Group để đồng hành trong các hạng mục định giá, tư vấn tài chính và pháp lý cho lộ trình này, bổ sung nguồn lực quốc tế cho kế hoạch tiếp cận thị trường vốn nước ngoài. Doanh nghiệp prop-tech (sử dụng các công nghệ trong ngành bất động sản trên 3 mảng chính: thông tin, giao dịch và quản lý) đặt ưu tiên vào tính minh bạch, tuân thủ và năng lực vận hành như nền tảng để tiếp cận nhà đầu tư toàn cầu. Meey Group và ARC Group ký thỏa thuận hợp tác chiến lược để khởi động lộ trình tìm kiếm IPO tại Mỹ. Ảnh:Meey Group Song song với mục tiêu niêm yết, Meey Group cho biết đã làm việc với PwC trong ba năm nhằm từng bước áp dụng chuẩn mực báo cáo tài chính quốc tế (IFRS) và chuẩn hóa quy trình quản trị. Doanh nghiệp kỳ vọng những thay đổi ở cấp độ hệ thống sẽ giúp nâng độ tin cậy với nhà đầu tư, qua đó cải thiện khả năng huy động vốn cho giai đoạn tăng trưởng tiếp theo. Bà Nguyễn Lý Kiều Anh, Giám đốc chiến lược Meey Group, cùng ông Hoàng Mai Chung, Chủ tịch HĐQT Meey Group. Ảnh:Meey Group Về mô hình kinh doanh, Meey Group tập trung vào hai nguồn doanh thu: cung cấp dữ liệu và dịch vụ định giá cho tổ chức tài chính, đồng thời thu phí từ người dùng cá nhân với các sản phẩm số. Hệ sinh thái của doanh nghiệp gồm hơn 26 sản phẩm proptech như Meey Land, Meey Map, Meey CRM, Meey 3D, Meey Atlas... hướng đến các bài toán dữ liệu, định giá và chuẩn hóa quy trình giao dịch trên thị trường bất động sản. Bà Nguyễn Lý Kiều Anh, Giám đốc chiến lược Meey Group nhận định, giá trị cốt lõi của công ty công nghệ nằm ở dữ liệu, thuật toán, thương hiệu và cộng đồng người dùng; vì vậy việc đầu tư cho sản phẩm và dữ liệu tiếp tục là trọng tâm. Bối cảnh thị trường cũng được xem là yếu tố hỗ trợ. Theo bà Kiều Anh, hệ sinh thái khởi nghiệp Việt Nam nằm trong nhóm sôi động của khu vực, tạo điều kiện cho các công ty công nghệ mở rộng hợp tác và thu hút vốn. Tháng 8, Meey Group cùng lãnh đạo công ty được vinh danh tại ASEAN Award ở hai hạng mục thương hiệu và lãnh đạo. Đơn vị xem đây là tín hiệu tích cực cho chiến lược phát triển bền vững và hội nhập. Đại diện Meey Group nhận giải thưởng kép tại ASEAN Award 2025. Ảnh:Meey Group Giám đốc chiến lược của Meey Group cho biết, động lực tăng trưởng của doanh nghiệpđến từ đội ngũ kỹ sư và chuyên gia trẻ. ""Phần lớn nhân sự của chúng tôi là thế hệ 9x, mang tinh thần Gen Z nhanh nhạy, sáng tạo, dám nghĩ dám làm. Yếu tố trẻ mang lại sự nhanh nhạy trong xử lý thông tin, nắm bắt cơ hội và ra quyết định - điều mà nhà đầu tư chiến lược luôn tìm kiếm khi đánh giá các startup"", bà Kiều Anh nhấn mạnh. Với lộ trình đã công bố, Meey Group định vị mục tiêu kép: duy trì đà phát triển hệ sinh thái proptech tại thị trường nội địa, đồng thời hoàn thiện tiêu chuẩn quản trị để tiếp cận nhà đầu tư quốc tế. Doanh nghiệp kỳ vọng việc kết hợp giữa nền tảng quản trị, tài sản dữ liệu và mạng lưới đối tác toàn cầu sẽ tạo thêm dư địa cho kế hoạch IPO trong giai đoạn 2025-2026. Tuệ Anh","Thứ bảy, 6/9/2025, 09:00 (GMT+7)",Tuệ Anh,Kinh doanh,Doanh nghiệp,VN Express,"Meey Group, một doanh nghiệp proptech Việt Nam, đang hoàn thiện các thủ tục pháp lý và tài chính để chuẩn bị niêm yết trên sàn Nasdaq. Công ty đã hợp tác với ARC Group và PwC để chuẩn hóa quy trình quản trị và tài chính theo chuẩn quốc tế, nhằm tăng cường uy tín với nhà đầu tư. Meey Group tập trung vào cung cấp dữ liệu, dịch vụ định giá bất động sản và thu phí từ người dùng cá nhân thông qua hệ sinh thái sản phẩm proptech. Với đội ngũ nhân sự trẻ và năng động, Meey Group đặt mục tiêu phát triển hệ sinh thái proptech trong nước, đồng thời thu hút vốn từ các nhà đầu tư quốc tế."
