id,title,link,content,date,author,category,sub_category,source,summary
VNEX_011025_00020,Các bước tự đề Runners Of The Year,https://vnexpress.net/cac-buoc-tu-de-runners-of-the-year-4945811.html,"Năm 2025, giải thưởng Runners Of The Year (ROTY) lần đầu áp dụng cơ chế tự đề cử. Ban tổ chức kỳ vọng thay đổi này sẽ khuyến khích nhiều người tham gia, qua đó đa dạng hóa các đề cử thay vì chỉ hạn chế qua danh sách do đội ngũ chuyên môn đưa ra như năm ngoái. Để tự đề cử, người tham gia cần thực hiện 6 bước. Đầu tiên, runner đăng ký tài khoản MyVnE trên ứng dụng hoặc website của báo VnExpress. Sau đó, kiểm tra tiêu chí cho từng hạng mục để tìm ra hạng mục phù hợp cho bản thân hoặc câu lạc bộ. Khi xác định được, runner chuẩn bị hồ sơ tương ứng theo yêu cầu của ban tổ chức. Với cá nhân, hồ sơ gồm thông tin cơ bản như họ tên, email, điện thoại, số căn cước, giới tính, ngày sinh, quốc tịch, nơi sinh hoạt, liên kết mạng xã hội, tài khoản Strava và thành tích thi đấu trong năm. Với tập thể, các câu lạc bộ cần cung cấp tên, mô tả hoạt động, địa điểm sinh hoạt, liên kết fanpage, cùng thông tin đại diện chịu trách nhiệm. Ở bước thứ tư, runner truy cập vàocổng thông tincủa Runner Of The Year 2025, tìm đếnmục tự đề cửngay trên trang chủ. Sau khi nhập đầy đủ thông tin theo yêu cầu, runner hoặc người đại diện CLB xác nhận cam kết thông tin là chính xác và ấn nút đề cử. Bước cuối cùng là đợi thông báo từ ban tổ chức qua email đã cung cấp để xem yêu cầu tự đề cử có thành công hay không. 2025 là năm thứ hai liên tiếp VnExpress tổ chức bình chọn Runners Of The Year. Các cá nhân, tổ chức có ba tuần (từ 1-21/10) để điền tên vào danh sách. Sau thời gian này, ban giám khảo sẽ rà soát, thống nhất và công bố danh sách đề cử chính thức. Từ tháng 11 đến hết tháng 12, cổng bình chọn trực tuyến sẽ bắt đầu hoạt động. Kết quả mỗi hạng mục được tính theo 60% điểm từ hội đồng chuyên gia và 40% bình chọn của độc giả trên cổng ROTY 2025. Trước đó, ban tổ chức đã công bố tiêu chí của từng hạng mục. VĐV chuyên nghiệp xuất sắc cần đạt ít nhất một chức vô địch, hai lần á quân hoặc ba lần hạng ba trong các giải đấu. VĐV phong trào xuất sắc phải lọt top 3 ở ba giải lớn và tham gia tối thiểu ba hoạt động truyền cảm hứng. Các hạng mục khác như vận động viên tiềm năng, lão tướng, huấn luyện viên, KOL, runner truyền cảm hứng và câu lạc bộ xuất sắc cũng có tiêu chí cụ thể, nhằm đảm bảo đánh giá công bằng. Runner quan tâm xemchi tiết tại đây. Theo ban tổ chức, mục đích của cơ chế này là mở rộng cơ hội cho nhiều cá nhân, đặc biệt là những runner ít tên tuổi nhưng có đóng góp thiết thực. ""Cơ chế tự đề cử giúp bảo đảm tính công bằng, khi mọi cá nhân đều có cơ hội giới thiệu thành tích của mình, không phụ thuộc vào đề cử từ người khác"", ban tổ chức cho biết. Cơ chế này cũng được kỳ vọng khuyến khích runner chủ động ghi nhận, lưu giữ thành tích và hoạt động của bản thân trong năm. Thay vì chờ được phát hiện hay giới thiệu, runner có thể trực tiếp tham gia, từ đó làm phong phú hơn nguồn ứng viên cho giải thưởng. ROTY 2025 do VnExpress tổ chức, khởi động từ 1/10, hướng đến tôn vinh những thành tích thi đấu xuất sắc, tinh thần vượt giới hạn, và đóng góp tích cực cho cộng đồng. Lễ trao giải dự kiến diễn ra ngày 25/1/2026 tại Hà Nội. So với mùa đầu, ROTY năm nay mở rộng lên 19 hạng mục và cho phép runner tự đề cử. Mỗi lần đề cử, runner có thể nêu vắn tắt lý do đánh giá bản thân phù hợp với tiêu chí của hạng mục. Ban giám khảo sau đó sẽ thẩm định lại và quyết định liệu runner có xứng đáng được đưa vào danh sách ứng cử viên hay không. Đồng hành cùng sự kiện, vRace sẽ phát động giải online Race To ROTY từ 15/11 đến 31/12, cho phép cá nhân và CLB tích điểm đổi quà. Mỗi km hoàn thành được quy đổi thành cây xanh trồng mới với sự hỗ trợ của quỹ Hope. 6 bước tự đề cử Runner Of The Year 2025 Lan Anh","Thứ tư, 1/10/2025, 09:19 (GMT+7)",Lan Anh,Thể thao,Marathon,VN Express,
VNEX_011025_00089,Chồng bảo ly dị nếu tôi bắt anh đưa tiền chi tiêu hàng tháng,https://vnexpress.net/chong-giu-tien-mau-thuan-tai-chinh-vo-chong-khong-dong-thuanchong-bao-ly-di-neu-toi-bat-anh-dua-tien-chi-tieu-hang-thang-4945773.html,"Tôi 40 tuổi, yêu 6 năm và cưới được 10 năm. Theo đánh giá của bản thân, bạn bè và người quen, chồng tôi là người tốt, biết chăm sóc vợ con. Anh rất yêu và chăm sóc con kỹ. Thế nhưng từ khi yêu và cưới đến giờ, chưa bao giờ tặng tôi bất kỳ một món quà nào. Trong khi chồng vẫn đi làm, lương tháng theo tôi biết tầm 10 triệu đồng (có thể hơn) vì làm tự do. Hàng tháng tôi phải chi các khoản như tiền nhà (mua nhà trả góp), tiền học con cái, tiền điện nước, ăn uống... nói chung tất cả các khoản. Ngoài ra bên nhà chồng, anh chị em hay ba mẹ chồng có việc, anh cũng bảo tôi cho mượn tiền, nhiều khi còn tự ý lấy trộm tiền của tôi. Tôi mất lòng tin, không dám để tiền ở nhà, nếu có tiền mặt thì về nhà tôi phải giấu vì sợ chồng lấy. Tháng trước vợ chồng tôi vay tiền người quen sửa nhà, bình thường tôi sẽ đích thân đi trả, nhưng hôm đó chồng bảo để anh đi cho, tôi cứ ở nhà nghỉ ngơi. Sau đó tôi mới biết anh không trả. Khi bị đòi nợ, anh lấy luôn số tiền đó, tôi hỏi lý do, chồng không nói. Trước đây anh tham gia bài bạc và cá độ đá banh, nợ nần nhiều, tôi cũng đứng ra trả. Bây giờ anh không còn bài bạc nữa nhưng vẫn mê cá độ đá banh, tôi hỏi anh nói bỏ rồi. Khi tôi bảo chồng đưa ít tiền để lo nhà cửa, con cái, anh bảo không có, không sống được thì ly dị. Trong khi hàng tháng chi tiêu và trả nợ của cả nhà tôi không dưới 30 triệu đồng. Một mình tôi gồng gánh mệt mỏi quá. Vợ chồng tôi cơ bản chia sẻ được mọi vấn đề trong cuộc sống, chồng không ngại đi chợ, nấu ăn, dọn dẹp nhà cửa..., chỉ vấn đề tiền bạc thì không. Thêm vấn đề nữa, sức khỏe tôi không tốt, đi siêu âm bác sĩ bảo có khối u, cần điều trị gấp nhưng tôi không đi làm thì nhà không có tiền chi tiêu, trả nợ. Chồng biết tôi bệnh nhưng cho rằng bác sĩ khám tào lao chứ vợ khỏe mà, không sao đâu, khám chi cho tốn tiền. Tôi mệt mỏi quá, mong nhận được góp ý, chia sẻ của các bạn. Thùy Lâm","Thứ tư, 1/10/2025, 09:00 (GMT+7)",Thùy Lâm,Tâm sự,,VN Express,
VNEX_011025_00095,Ngành ôtô Hàn Quốc trông chờ vào xe cũ,https://vnexpress.net/nganh-oto-han-quoc-trong-cho-vao-xe-cu-4945517.html,"Mồ hôi nhễ nhại dưới cái nóng ngoài trời, các công nhân đang chất và buộc xe vào container suốt ngày đêm từ các cơ sở tạm thời tại trung tâm xuất khẩu xe cũ lớn nhất Hàn Quốc ở Incheon, phía tây Seoul. Hoạt động xuất khẩu xe cũ bùng nổ giúp giảm thiểu tác động của thuế quan Mỹ đối với doanh số xe mới. ""Thật xấu hổ khi chúng tôi tự nhận rằng doanh nghiệp của mình là một mặt hàng xuất khẩu chủ lực"", Kevin Seol, một thương nhân vận chuyển khoảng 100 chiếc xe cũ mỗi tháng, cho biết. ""Nhưng ngành công nghiệp này vẫn tiếp tục tăng trưởng về số lượng, vì vậy tôi nghĩ chúng tôi đang đóng góp vào kim ngạch xuất khẩu quốc gia"". Lượng xe xuất khẩu của Hàn Quốc sang Mỹ đã giảm trong 6 tháng liên tiếp kể từ khi Tổng thống Donald Trump công bố mức thuế 25%. Tuy nhiên, theo dữ liệu của Bộ Thương mại và hải quan, kim ngạch xuất khẩu ôtô toàn cầu của nước này đã tăng trong ba tháng liên tiếp, nhờ doanh số xe cũ đạt mức cao kỷ lục, chiếm 25% tổng kim ngạch xuất khẩu ôtô theo khối lượng và 13% theo giá trị. Bộ Thương mại Hàn Quốc cho biết, kim ngạch xuất khẩu ôtô của nước này trong tháng 8 đạt 5,5 tỷ USD, tăng 9% so với cùng kỳ 2024 và là mức cao nhất trong một tháng. Theo Viện Nghiên cứu phân phối ôtô cũ Hàn Quốc, kim ngạch xuất khẩu ôtô đã qua sử dụng tăng vọt 35% lên 711,5 triệu USD trong cùng tháng. Xe cũ chờ được vận chuyển tại khu phức hợp xuất khẩu ở khu công viên giải trí Songdo, Incheon. Ảnh:Yonhap Sự tăng trưởng của xe đã qua sử dụng chủ yếu được thúc đẩy bởi nhu cầu cao đối với các dòng xe Hyundai và Kia cũ tại Nga và Trung Đông, cùng với đồng won yếu hơn, các thương nhân và chuyên gia cho biết. ""Xuất khẩu sang Mỹ không chiếm phần lớn hoạt động kinh doanh của chúng tôi"", ông Seol nói. ""Nhu cầu từ các quốc gia khác rất lớn, vì vậy thuế quan không thực sự gây tổn hại cho chúng tôi"". Theo dữ liệu của chính phủ và các nhà giao dịch, Hàn Quốc xuất khẩu phần lớn ôtô đã qua sử dụng sang Trung Đông, Trung Á và Nga. Tại những thị trường này, ôtô Hàn Quốc có thể hấp dẫn hơn so với ôtô từ đối thủ xuất khẩu Nhật Bản vì xe được thiết kế để chạy bên phải đường, trong khi Nhật Bản lái xe bên trái. Tại thị trường xuất khẩu ôtô mới lớn nhất của Hàn Quốc là Mỹ, hoạt động xuất khẩu đã bị ảnh hưởng bởi mức thuế 25%, cao hơn mức 15% đối với ôtô Nhật Bản và châu Âu, mặc dù Seoul đang đàm phán để giảm thuế. Tuy nhiên, thuế quan của Mỹ là bất lợi đối với thị trường ôtô mới, nhưng có thể mở rộng nhu cầu và làm giá xe đã qua sử dụng tăng cao, Shin Hyun-do, giám đốc Viện Nghiên cứu phân phối ôtô cũ Hàn Quốc, cho biết. ""Nếu thuế quan của Mỹ đối với ôtô mới tăng, giá xe sẽ tăng. Điều đó sẽ dẫn đến giá xe tăng trên toàn cầu"", ông nói. ""Trong trường hợp đó, giá xe đã qua sử dụng có thể cũng sẽ tăng theo"". Trong nửa đầu năm, xuất khẩu ôtô đã qua sử dụng của Hàn Quốc tăng 72% lên 3,9 tỷ USD, với 437.151 xe xuất khẩu, Shin cho biết. Ông cho biết thêm rằng Hàn Quốc bán cho khu vực Trung Đông nhiều xe cũ hơn xe mới trong 6 tháng đầu năm và báo cáo mức tăng 40% doanh số trung bình hàng tháng sang Nga. Theo các chuyên gia, xuất khẩu xe đã qua sử dụng của Hàn Quốc dự kiến lập kỷ lục mới về khối lượng và giá trị trong năm nay. Tuy nhiên, các thương nhân cho biết sự tăng trưởng doanh số ra nước ngoài có nguy cơ bị hạn chế bởi cơ sở hạ tầng yếu kém tại các trung tâm xuất khẩu của nước này, bao gồm cả trung tâm ở Incheon, một bãi đất trống với các văn phòng tạm bợ và cơ sở vật chất không đầy đủ. ""Các doanh nghiệp tư nhân thuê những bãi đất trống và đỗ xe ở đó"", Park Young-hwa, một thương nhân điều hành Hiệp hội xuất khẩu xe đã qua sử dụng Hàn Quốc, cho biết. ""Vào mùa hè, điều kiện thời tiết xấu đến mức người mua bị kẹt chân trong bùn đất khó có thể kiểm tra xe"". Theo số liệu của chính phủ, xuất khẩu xe đã qua sử dụng và mỹ phẩm là những ngành xuất khẩu tăng trưởng nhanh nhất về giá trị đối với các doanh nghiệp vừa và nhỏ trong nửa đầu năm 2025. Mỹ Anh(theoReuters)","Thứ tư, 1/10/2025, 08:58 (GMT+7)",Mỹ Anh,Xe,Thị trường,VN Express,
VNEX_011025_00013,"Vì sao lạm phát thấp, chi tiêu hộ gia đình tăng vọt?",https://vnexpress.net/vi-sao-lam-phat-thap-chi-tieu-ho-gia-dinh-tang-vot-4938293.html,"Chị Hạnh cho hay, dù đã cố gắng tằn tiện trong chi tiêu nhưng do tiền thuê nhà hiện tăng 1,5 triệu mỗi tháng, học phí của con thêm 10%, tiền ăn cũng đắt hơn..., khiến tổng chi mỗi tháng của gia đình tăng gần 32% so với cùng kỳ năm trước. Không riêng chị Hạnh, nhiều gia đình khác cũng chung tình cảnh. Chị Lâm, nhân viên công ty thực phẩm ở quận 12, cho biết gia đình phải bỏ hẳn thói quen ăn ngoài để dành tiền chi cho điện nước và học phí. ""Đi chợ chỉ mua ít rau, thịt cũng tốn hơn 200.000 đồng, trong khi năm ngoái khoảng 120.000 đồng đã đủ một bữa cơm"", chị kể. Ở góc độ cơ quan thống kê, ông Nguyễn Trung Tiến - Phó cục trưởng Cục Thống kê - cho rằng có sự chênh lệch giữa mức tăng CPI và cảm nhận tăng giá của người dân là hiện tượng phổ biến toàn cầu. Ông dẫn chứng ở châu Âu năm 2022, khi giá khí đốt và lương thực leo thang, CPI tăng 9-10% nhưng hộ gia đình cảm nhận chi phí đội 30-40%. Tại Mỹ, CPI công bố 7-8% song nhiều người cho rằng chi tiêu tăng 20-30%. Nhật Bản cũng chứng kiến hiện tượng tương tự. Theo ông Tiến, nguyên nhân là người dân thường tập trung vào nhóm chi phí lặp lại hàng ngày như thực phẩm, điện, xăng, nước. Biến động ở nhóm này tạo áp lực mạnh, đặc biệt với hộ thu nhập trung bình và thấp. Trong khi đó, CPI là chỉ số tổng hợp của 752 mặt hàng, tính theo cơ cấu chi tiêu bình quân, nên mức tăng chung thấp hơn nhiều so với cảm nhận. Không chỉ vậy, CPI còn có độ trễ. Ví dụ, giá xăng tăng giữa tháng thì chỉ số tháng đó chỉ phản ánh một phần vì nửa đầu tháng vẫn theo giá cũ. Bên cạnh đó, rổ CPI không tính đến các chi phí đặc thù như lãi vay mua nhà hay học thêm cho con - vốn là gánh nặng lớn với hộ gia đình thành thị. Ông Tiến phân tích thêm, cơ cấu chi tiêu của hộ gia đình cho thấy 7 nhóm chính chiếm tới 86% tổng chi, trong đó thực phẩm và ăn uống (33,5%), nhà ở (18,8%), giao thông (9,7%), giáo dục (6,2%), y tế (5,4%)... ""Bất kỳ biến động giá nào ở những nhóm thiết yếu này đều tác động trực tiếp đến túi tiền người dân"", ông nhấn mạnh. Với nhóm thu nhập thấp, gần như toàn bộ chi tiêu dồn cho hàng thiết yếu. Khi giá nhóm này tăng nhanh hơn mức bình quân, họ không còn dư địa cho chi tiêu khác. Từ đó, ông cảnh báo chi phí sinh hoạt tăng không chỉ bào mòn thu nhập mà còn khiến nhiều gia đình buộc phải cắt giảm may mặc, đồ gia dụng, du lịch, giải trí. Nếu xu hướng này lan rộng, sức mua xã hội giảm, tác động ngược trở lại sản xuất và việc làm. ""Tiêu dùng cuối cùng của hộ gia đình chiếm hơn 55% GDP. Nếu sức mua bị nén, có thể tạo vòng xoáy tiêu cực: chi phí sinh hoạt tăng, sản xuất co hẹp, việc làm giảm, dẫn đến tiêu dùng càng suy yếu"", ông nói. Bổ sung thêm góc nhìn, TS Đinh Thế Hiển phân tích, giá lương thực - thực phẩm và một số dịch vụ dân sinh đã tăng, nhưng chủ yếu do chi phí mặt bằng, quy định thuế mới và sức mua giảm khiến tiểu thương nâng giá để bù lượng hàng bán ế. ""Đây là mức tăng không bền vững, có thể khiến số lượng khách giảm thêm và làm suy yếu sức sống của thị trường"", ông nói. Ngược lại, nhiều nhóm hàng không thiết yếu giữ nguyên giá vì sức mua yếu. Về mặt kỹ thuật, mức CPI tăng 3% giúp duy trì lãi suất thực dương, hỗ trợ doanh nghiệp vay vốn. Nhưng nếu chỉ phản ánh tiêu dùng co hẹp, đó lại là tín hiệu xấu. TS Nguyễn Đức Độ - Phó viện trưởng Viện Kinh tế Tài chính - cũng nhấn mạnh rằng cảm nhận của người dân còn chịu ảnh hưởng từ mốc so sánh. ""CPI tăng 3% là so với cùng kỳ năm trước, nhưng nếu nhìn từ 2-3 năm, mức tăng đã 6-10%. Người dân thường nhớ giá trong quãng dài hơn, nên cảm nhận mạnh hơn số liệu công bố"", ông phân tích. Ông lưu ý, CPI bình quân 10 năm qua là 3% mỗi năm, tức giá đã tăng 34% sau một thập kỷ. Nếu lương không tăng tương ứng, sức mua tất yếu giảm. Sau Covid-19, nhiều người mất thu nhập, xu hướng thắt chặt chi tiêu kéo dài, chỉ đến quý II năm nay, tiêu dùng mới bắt đầu hồi phục. Khách mua hàng tại siêu thị ở TP HCM. Ảnh:Thi Hà Về phương pháp đo lường, TS Hiển đề xuất Việt Nam cần xây dựng bộ chỉ số chi tiết hơn theo từng khu vực hoặc nhóm hàng, thay vì chỉ có một CPI chung toàn quốc. ""Người dân ở TP HCM, Hà Nội có mức chi tiêu khác hẳn nông thôn, nhưng chúng ta chưa có các tổ chức nghiên cứu độc lập xây dựng chỉ số riêng cho từng nhóm"", ông nói. Ông Hiển cũng phản đối chính sách ""bình ổn giá"" với hàng hóa cạnh tranh, cho rằng giá cả cần để thị trường quyết định. Doanh nghiệp sẽ buộc phải cải tiến năng suất, tiết giảm chi phí để tồn tại. Tuy nhiên, Nhà nước vẫn phải đóng vai trò trong các lĩnh vực hạ tầng độc quyền như giao thông, vận tải, điện lực. ""Câu hỏi đặt ra là các tập đoàn độc quyền này đã quản lý chi phí hiệu quả chưa? Nếu chưa, Nhà nước cần giám sát chặt chẽ để hạ giá thành, qua đó tạo dư địa giảm áp lực cho toàn nền kinh tế"", ông Hiển phân tích. Nhìn chung, các chuyên gia cho rằng mức lạm phát tăng 3% hiện chưa gây rủi ro cho nền kinh tế. Nhưng điều đáng lo ngại hơn là thu nhập của người dân không theo kịp giá thiết yếu, đặc biệt với nhóm trung bình và thấp. ""Bài toán không chỉ là giữ CPI ở mức thấp, mà quan trọng hơn là bảo đảm thu nhập cải thiện đủ để người dân duy trì mức sống. Nếu không, lạm phát thấp cũng khó giúp họ bớt lo lắng"", TS Nguyễn Đức Độ nói thêm. Thi Hà - Phương Ánh","Thứ tư, 1/10/2025, 07:00 (GMT+7)",Thi Hà - Phương Ánh,Kinh doanh,Hàng hóa,VN Express,
VNEX_011025_00091,Sở Giáo dục Hà Nội: Cho nghỉ học diện rộng cần cân nhắc kỹ,https://vnexpress.net/so-giao-duc-ha-noi-cho-nghi-hoc-dien-rong-can-can-nhac-ky-4945792.html,"Đại diện Sở Giáo dục và Đào tạo Hà Nội sáng 1/10 cho biết trong các đợt mưa bão, chủ trương của Sở là để các trường chủ động phương án, hình thức học phù hợp, nhất là ở những nơi ngập lụt. Vì vậy, việc cho học sinh nghỉ học hôm qua sẽ do các hiệu trưởng quyết định, căn cứ tình hình thực tế. ""Việc bất ngờ cho nghỉ khi giờ học cận kề, nhiều gia đình đang đưa con tới trường cũng sẽ khiến phụ huynh gặp rắc rối, khó tìm người trông con. Hơn nữa, không phải khu vực nào cũng bị ảnh hưởng bởi thiên tai"", vị này nhìn nhận. Vị này cho rằng sáng hôm qua, tuy trời mưa lớn song tầm 6-8h - khoảng thời gian hầu hết bố mẹ đưa con đi học - số điểm ngập được ghi nhận ""rất ít"". Đến buổi trưa, khi học sinh đã đến trường mà thông báo nghỉ toàn thành phố sẽ đột ngột. ""Quyết định nghỉ học diện rộng cần cân nhắc kỹ"", theo lãnh đạo Sở. Chiều 30/9, sau khi làm việc với các ban, ngành phụ trách giao thông, đô thị của Hà Nội, xác định còn nhiều điểm ngập, có thể không rút hết nước trong ngày 1/10 nên Sở quyết định cho học sinh cả thành phố nghỉ một ngày để đảm bảo an toàn. Thông báo được đưa ra khoảng 18h30 để các gia đình kịp bố trí người trông con hôm sau. Sở ghi nhận hầu hết trường đang khắc phục vệ sinh và dọn dẹp sau khi nước rút để ngày mai đón học sinh trở lại. Học sinh Hà Nội tan trường trong cơn mưa lớn, đường ngập sâu, trưa 30/9. Ảnh:Hoàng Giang Hai ngày qua, Hà Nội có mưa lớn liên tục, do ảnh hưởng của bão Buloi. Các đợt mưa cách nhau khoảng 15-30 phút, làm phát sinh 82 điểm ngập úng chủ yếu ở nội đô và cửa ngõ phía Tây, đẩygiao thông hỗn loạn. Sáng 30/9, hàng loạt trường đã cho học sinh nghỉ hoặc đón học sinh muộn. Trường THCS Cổ Nhuế 2, phường Đông Ngạc, phải nhờ lực lượng quân đội dùng xe chuyên dụng chở học sinh tới điểm khô ráo để phụ huynh đón con vào buổi trưa. Tới chiều, giao thông vẫn bị chia cắt khiến nhiều gia đình gặp khó khăn trong việc đưa con về nhà. Vì vậy, nhiều trường ngoài công lập như Nguyễn Bỉnh Khiêm, Marie Curie, Đa Trí Tuệ, Lương Thế Vinh, Nguyễn Tất Thành, Lê Quý Đôn... tổ chức trông giữ hoặc cho học sinh ăn tối miễn phí, sẵn sàng phương án để các em ở lại trường đêm qua. Trong thông báo phát đi sáng qua, Sở Giáo dục và Đào tạo Hà Nội yêu cầu các trường quản lý chặt học sinh, trang bị đầy đủ nước uống, lương thực khi các em ở trường. Đồng thời, trường không được tổ chức hoạt động ngoại khóa, sinh hoạt tập thể ở nơi có nguy cơ ngập úng, sạt lở. Sau khi tổ chức dạy và học trở lại, các trường chủ động dọn vệ sinh, khắc phục hậu quả, đảm bảo khuôn viên sạch sẽ, phòng chống dịch bệnh lây lan. Thanh Hằng","Thứ tư, 1/10/2025, 09:18 (GMT+7)",Thanh Hằng,Giáo dục,Tin tức,VN Express,
