id,title,link,content,date,author,category,sub_category,source,summary
VNEX_021025_00001,Thứ trưởng Hồ Văn Niên làm Bí thư Quảng Ngãi,https://vnexpress.net/thu-truong-ho-van-nien-lam-bi-thu-quang-ngai-4945809.html,"Quyết định nhân sự của Bộ Chính trị được ông Hoàng Đăng Quang, Phó thường trực Ban Tổ chức Trung ương công bố sáng 2/10. Ông Niên thay thế bà Bùi Thị Quỳnh Vân đã đượcđiều độnglàm Phó ban Tổ chức Trung ương hôm qua. Ông Hồ Văn Niên quê xã Đăk Pơ, tỉnh Gia Lai cũ, trình độ cử nhân Luật, từng làm Bí thư huyện ủy Đak Pơ (cũ), Trưởng ban Nội chính, Phó bí thư thường trực, Bí thư Tỉnh ủy Gia Lai. Sau khi Gia Lai sáp nhập với Quảng Ngãi, ông Niên được điều động làm Thứ trưởng thường trực Bộ Dân tộc và Tôn giáo. Ông Hồ Văn Niên. Ảnh:Cổng thông tin tỉnh Bình Định Trước đó, hôm 11/9, Đại hội Đảng bộ tỉnh Quảng Ngãi đã công bố quyết định của Bộ Chính trị về việc chỉ định Ban Chấp hành Đảng bộ tỉnh Quảng Ngãi nhiệm kỳ 2025-2030 gồm 68 người, Ban Thường vụ gồm 17 người. Khi đó, bà Bùi Thị Quỳnh Vân đượcchỉ địnhlàm Bí thư Quảng Ngãi. Các Phó bí thư gồm: ông U Huấn (45 tuổi, Phó bí thư thường trực); ông Nguyễn Hoàng Giang (54 tuổi, Chủ tịch UBND tỉnh), ông Nguyễn Đức Tuy (52 tuổi) và bà Đinh Thị Hồng Minh (55 tuổi). Theo Tổng Bí thư Tô Lâm, nhiệm kỳ này, Trung ương đang thực hiệnchủ trươngkhông có Bí thư tỉnh, thành nào là người địa phương. Việc thực hiện đồng bộ sẽ bảo đảm tính khách quan, minh bạch trong lãnh đạo, hạn chế tiêu cực, cục bộ địa phương. Tỉnh Quảng Ngãi mới rộng 14.830 km2 - xếp thứ 5 cả nước, dân số hơn 2,16 triệu người với 96 đơn vị hành chính cấp xã. Trong 5 năm qua, tốc độ tăng trưởng tổng sản phẩm (GRDP) bình quân của tỉnh đạt 7,3% năm, đứng thứ 10/34 tỉnh, thành phố. Thu ngân sách nhà nước luôn vượt dự toán bình quân 14% và năm tăng cao nhất đạt đến 34,7%, trong 5 năm đạt trên 165.000 tỷ đồng. Tỉnh ủy Quảng Ngãi đặt mục tiêu đến năm 2030 là tỉnh phát triển khá, trở thành một cực tăng trưởng quan trọng ở khu vực miền Trung - Tây Nguyên. Trong đó, phấn đấu tốc độ tăng trưởng GRDP bình quân giai đoạn 2026-2030 đạt từ 10%/năm trở lên. Phạm Linh","Thứ năm, 2/10/2025, 09:33 (GMT+7)",Phạm Linh,Thời sự,Chính trị,VN Express,
VNEX_021025_00067,5 thay đổi đơn giản trong bữa ăn giúp phòng đột quỵ,https://vnexpress.net/5-thay-doi-don-gian-trong-bua-an-giup-phong-dot-quy-4946009.html,"Có nhiều yếu tố làm tăng nguy cơ đột quỵ như bệnh nền, di truyền, béo phì, một trong số đó là chế độ ăn uống. Thói quen ăn nhiều chất xơ, ít natri có thể ổn định lượng đường trong máu, huyết áp và mức cholesterol, từ đó giảm nguy cơ hình thành mảng bám, tăng huyết áp, phòng ngừa tiểu đường - các yếu tố thúc đẩy phát triển đột quỵ. Ưu tiên ngũ cốc nguyên hạt Ngũ cốc ăn sáng vừa dễ chế biến vừa nhiều chất xơ nhưng nên chọn loại nguyên hạt chứa ít đường như yến mạch, hạt diêm mạch, hạt kê. Yến mạch giúp giảm cholesterol nhờ beta-glucan (một thành phần của chất xơ hòa tan) và duy trì lượng đường trong máu ổn định. Bổ sung chất xơ trong chế độ ăn uống giúp duy trì cân nặng khỏe mạnh, từ đó giảm nguy cơ mắc một số bệnh mạn tính. Thay gạo trắng, bún phở bằng các món làm từ gạo lứt, yến mạch để tránh tăng cân. Thêm rau củ quả trong mỗi bữa ăn Thực phẩm giàu kali như quả bơ, chuối, khoai lang... hỗ trợ hạhuyết áp cao, duy trì đường huyết ổn định. Chế độ ăn giàu rau củ quả góp phần tăng lượng chất xơ cho tiêu hóa, tăng cảm giác no, hạn chế ăn nhiều và tránh tích tụ mỡ nội tạng. Nên có ít nhất một món rau trong mâm cơm mỗi ngày và ăn tráng miệng bằng hoa quả để tăng cường sức khỏe tổng thể. Hạn chế protein từ thịt đỏ, thịt chế biến sẵn Bữa ăn giàu protein giúp no lâu, giảm lượng calo nạp vào. Tuy nhiên, nên chọn protein từ thịt trắng như thịt gà và vịt (bỏ da), cá, tôm, trứng hoặc protein thực vật như đậu nành... Hạn chế thịt chế biến sẵn, thịt đỏ vì chứa nhiều chất béo bão hòa và cholesterol, có thể làm tích tụ mảng bám trong động mạch, tăng nguy cơ hình thành cục máu đông. Tôm giàu protein giúp no lâu. Ảnh:Bùi Thủy Hạn chế muối Ngoài muối ăn, natri còn ẩn trong các món thịt chế biến sẵn như xúc xích, thịt nguội, dăm bông, bánh quy... Mọi người nên hạn chế thức ăn có hàm lượng natri cao để tránh tích nước, khiến huyết áp cao thúc đẩyđột quỵ. Người trưởng thành cần duy trì lượng natri dưới 2.300 mg mỗi ngày (lý tưởng nhất là gần 1.500 mg) để bảo vệ tim mạch. Giảm lượng đường bổ sung Khi chế biến món ăn, hạn chế ướp và cho đường khi xào nấu. Nên cắt giảm bánh ngọt, các món chế biến sẵn đóng hộp vì chứa nhiều đường tự nhiên, chất bảo quản không tốt cho sức khỏe. Ăn quá nhiều đườngdễ tăng cân, thúc đẩy tình trạng viêm. Bổ sung chất béo lành mạnh Trong bữa cơm mỗi ngày, mọi người nên ưu tiên dùng dầu ăn thực vật và dầu ô liu để tăng lượng chất béo lành mạnh, giúp tăng mức cholesterol HDL tốt. Chất béo lành mạnh như omega-3 còn có trong cá hồi, quả bơ... Chọn món ăn vặt là ngũ cốc, hạt lanh và các loại hạt óc chó, hạnh nhân, hạt chia để tăng thêm lợi ích cho sức khỏe tim mạch. Anh Chi(TheoEating Well)","Thứ năm, 2/10/2025, 09:00 (GMT+7)",Anh Chi,Sức khỏe,Các bệnh,VN Express,
VNEX_021025_00066,"Ăn gì hỗ trợ điều trị, phục hồi cho người bệnh ung thư?",https://vnexpress.net/an-gi-ho-tro-dieu-tri-phuc-hoi-cho-nguoi-benh-ung-thu-4945173.html,"Chế độ ăn uống lành mạnh hỗ trợ bệnh nhân ung thư trong quá trình điều trị và hồi phục. Bởi cơ thể cần đủ calo và chất dinh dưỡng để duy trì sức khỏe trong suốt quá trình điều trị. Không có chế độ ăn nào phù hợp cho tất cả bệnh nhân mà nên điều chỉnh tùy loại ung thư mắc phải, tình trạng bệnh để đáp ứng nhu cầu riêng. Trước khi điều trị Người bệnh nên chọn thực phẩm lành mạnh trước khi bắt đầu quá trình điều trị ung thư. Chế độ ăn uống lành mạnh, cân bằng bao gồm nhiều loại ngũ cốc nguyên hạt, trái cây, rau củ, đậu, các loại hạt và protein lành mạnh. Hạn chế thực phẩm chế biến sẵn sẽ tốt hơn cho sức khỏe. Người bệnh cũng nên dự trữ các món ăn nhẹ, ăn liền hoặc dễ làm như sữa chua, trái cây đông lạnh, các loại hạt, súp hoặc bánh quy... phòng trường hợp buồn nôn. Sữa lắc dinh dưỡng làm sẵn cũng rất tốt trong những ngày mà bạn cảm thấy không khỏe hoặc không thể ăn. Trong khi điều trị Mục tiêu của giai đoạn này là bổ sung đủ chất dinh dưỡng thiết yếu cho cơ thể, dù chỉ ở mức tối thiểu. Các tác dụng phụ của điều trị như buồn nôn, thay đổi vị giác và mệt mỏi, có thể khiến ăn uống khó khăn. Hãy cố gắng ăn các bữa nhỏ, thường xuyên với các loại thực phẩm nhạt như bột ngũ cốc mịn, bánh quy mặn, trái cây, trứng, phô mai tươi. Ăn đủ protein rất quan trọng để cơ thể khỏe mạnh, giúp phục hồi tổn thương do ung thư hoặc quá trình điều trị. Thực phẩm lành mạnh giàu protein bao gồm thịt nạc, thịt gà, cá, trứng, đậu, các loại hạt, sữa, phô mai, sữa chua. Người bệnh cũng có thể nạp protein thực vật để tăng cường chất xơ. Các lựa chọn tốt bao gồm đậu lăng, đậu Hà Lan... Người bệnh ung thư nên ăn thực phẩm giàu protein để cung cấp năng lượng cho cơ thể.Ảnh minh họa tạo bởi AI Nên ăn trái cây và rau củ mỗi ngày bởi chúng chứa chất xơ và giúp tăng cường hệ miễn dịch. Bổ sung rau xanh đậm, vàng đậm và trái cây họ cam quýt như cam, bưởi. Những thực phẩm nhiều màu sắc chứa nhiều chất dinh dưỡng lành mạnh. Lưu ý rửa sạch trái cây và rau củ trước khi ăn. Hãy uống đủ nước bởi các phương pháp điều trị ung thư có thể gây mất nước. Các tác dụng phụ như nôn mửa, tiêu chảy và sốt cũng có thể xảy ra. Ngoài nước lọc, người bệnh có thể uống sữa, đồ uống thể thao, trà và cà phê. Các loại thực phẩm như súp, gelatin, sữa chua và bánh pudding giúp giữ nước. Vào những ngày thèm ăn, hãy chọn những thực phẩm giàu calo để duy trì cân nặng. Ung thư và quá trình điều trị gây áp lực lên cơ thể. Để bổ sung calo vào chế độ ăn uống, người bệnh có thể thêm quả bơ, bơ đậu phộng hoặc dầu vào các loại thực phẩm như bánh mì, cơm hoặc mì. Uống các loại đồ uống giàu calo chẳng hạn nước ép trái cây, sữa lắc và sinh tố. Kiểm soát tác dụng phụ của điều trị ung thư Chế độ ăn uống có thể giúp người bệnh ung thư giảm một số tác dụng phụ của điều trị. Buồn nôn hoặc nôn: Tránh thức ăn nhiều chất béo, dầu mỡ, cay hoặc những thức ăn có mùi nồng. Ăn thức ăn khô như bánh quy giòn hoặc bánh mì nướng sau mỗi vài giờ. Uống các loại nước như nước dùng, đồ uống thể thao và nước lọc. Các vấn đề về miệng hoặc cổ họng: Nếu có các vết loét gây đau hoặc khó nuốt, hãy chọn thức ăn mềm. Tránh bất cứ thứ gì thô ráp hoặc gây khó chịu, cũng như thức ăn cay hay có tính axit. Ăn món ăn ấm (không nóng hoặc lạnh) và sử dụng ống hút cho súp hoặc đồ uống. Tiêu chảy và táo bón: Người bịtiêu chảyphải giữ đủ nước cho cơ thể. Uống nhiều chất lỏng và cắt giảm thực phẩm giàu chất xơ như ngũ cốc nguyên hạt và rau. Nếu bị táo bón, hãy bổ sung thêm thực phẩm giàu chất xơ từ từ vào chế độ ăn và uống nhiều nước. Thay đổi khẩu vị: Việc điều trị có thể ảnh hưởng đến vị giác. Những món mà bạn thích trước đây có thể kém ngon hoặc ngược lại. Hãy thử xem mình có thích vị chua hay chát như gừng hoặc lựu không. Các loại gia vị như hương thảo, bạc hà và kinh giới giúp thưởng thức món ăn ngon hơn. Thực phẩm cần tránh Tránh các thực phẩm chứa nhiều dầu hydro hóa vì có thể làm tăng tình trạng viêm. Không nên dùng thực phẩm chế biến sẵn, trứng lòng đào, cá sống hoặc chưa nấu chín, các sản phẩm từ sữa chưa tiệt trùng. Luôn hỏi ý kiến bác sĩ trước khi sử dụng thực phẩm bổ sung bởi nhiều loại có thể ảnh hưởng đến quá trình điều trị. Nếu không thể ăn nhiều như bình thường hoặc gặp các tác dụng phụ như tiêu chảy và nôn mửa gây mất các chất dinh dưỡng quan trọng, một loại vitamin tổng hợp có thể được xem xét. Song tốt nhất nên bổ sung chất dinh dưỡng từ thực phẩm. Sau điều trị ung thư Mục tiêu sau khi kết thúc điều trị ung thư là phục hồi cơ thể và duy trì sức khỏe lâu dài. Nhu cầu dinh dưỡng phụ thuộc vào loại ung thư mắc phải và phương pháp điều trị đã áp dụng. Nhìn chung, chế độ ăn uống cân bằng với nhiều trái cây, rau củ, ngũ cốc nguyên hạt và các loại đậu giúp giảm nguy cơ ung thư tái phát. Anh Ngọc(TheoWebmd)","Thứ năm, 2/10/2025, 09:12 (GMT+7)",Anh Ngọc,Sức khỏe,Các bệnh,VN Express,
VNEX_021025_00006,Cuộc chiến với smartphone ở thành phố Nhật Bản,https://vnexpress.net/cuoc-chien-voi-smartphone-o-thanh-pho-nhat-ban-4945946.html,"Masafumi Kouki, thị trưởng Toyoake ở Nhật Bản, không ghét bỏ điện thoại thông minh (smartphone). Ông vẫn dùng nó để theo dõi các trận đấu bóng chày hoặc xem bản đồ. Tuy nhiên, khi chứng kiến nhiều trẻ em và thậm chí cả người lớn dùng điện thoại quá nhiều mỗi ngày, ông quyết định thói quen này cần thay đổi. Chỉ trong vài ngày, Thị trưởng Kouki cùng đội ngũ cộng sự đã soạn thảo bản quy định giới hạn thời gian sử dụng điện thoại thông minh, máy tính bảng, máy chơi game và máy tính của cư dân Toyoake xuống hai giờ mỗi ngày, trừ lúc học và làm việc. Quy định, có hiệu lực từ 1/10, biến Toyoake trở thành một trong những thành phố đầu tiên ở Nhật Bản nỗ lực ban hành sắc lệnh để giúp công dân từ bỏ thói quen nghiện thiết bị kỹ thuật số. ""Thật buồn khi mỗi ngày kết thúc mà chúng ta chỉ ở nhà và nhìn chằm chằm vào điện thoại thông minh. Tôi hy vọng công dân sẽ thay đổi hành vi của họ"", ông Kouki nói trong cuộc phỏng vấn gần đây. Thị trưởng Masafumi Kouki giơ chiếc điện thoại của ông khi phỏng vấn tại thành phố Toyoake. Ảnh:Kyodo Sắc lệnh của Toyoake, được hội đồng thành phố thông qua tháng này với 12 phiếu thuận và 7 phiếu chống, về cơ bản chỉ mang tính biểu tượng. Quan chức thành phố cho hay chính quyền sẽ không giám sát việc sử dụng điện thoại của cư dân và không có hình phạt nếu họ vi phạm quy định. Tuy nhiên, ở Nhật Bản, người dân luôn chịu áp lực xã hội lớn để tuân theo những quy định được ban hành. Các lãnh đạo Toyoake hy vọng cư dân sẽ tự nguyện tuân thủ và dành thời đó cho gia đình hoặc bản thân. Nhiều học sinh ở Toyoake thường dùng điện thoại thông minh quá nhiều khi ở nhà. Ông Kouki không hoàn toàn đổ lỗi cho thiết bị điện tử này, nhưng nhận thấy chúng đang dễ dàng trở thành ""vật bất ly thân"" với những đứa trẻ cô đơn, bị cô lập. ""Học sinh trung học thường có điện thoại và phòng riêng. Chúng dành hàng giờ chỉ để nghịch điện thoại mà không quan tâm đêm hay ngày. Giấc ngủ của chúng theo đó bị đảo lộn"", ông nói. Các báo cáo từ tòa thị chính càng khiến ông thêm lo lắng. Trong các buổi kiểm tra sức khỏe, giới chức thành phố nhận thấy các bà mẹ thường đưa điện thoại cho những đứa trẻ, dù chúng còn rất bé. Ông Kouki nhận ra vấn đề không chỉ nằm ở nhóm thanh thiếu niên. Điện thoại thông minh cũng ngày càng ảnh hưởng nhiều tới cuộc sống của những người trưởng thành. Họ có thể bị mất ngủ, không còn mặn mà với các cuộc gặp gỡ và nói chuyện trực tiếp. ""Điện thoại thông minh vô cùng tiện lợi, nhưng chúng tôi muốn mọi người xem xét chúng có đang đánh cắp thời gian nghỉ ngơi của các bạn hay không? Chúng có ảnh hưởng tới những cuộc nói chuyện trong mỗi gia đình hay không?"", Thị trưởng Toyoake nói. Những điều đó đã thúc đẩy chính quyền Toyoake ban hành quy định để gửi đi thông điệp về thói quen sử dụng đáng báo động. ""Nếu chúng tôi chỉ đưa ra hướng dẫn hay những khẩu hiệu mềm mỏng, mọi người sẽ phớt lờ. Nhưng bằng cách biến nó thành quy định chính thức, mọi người sẽ xem xét vấn đề nghiêm túc hơn"", ông Kouki nói. Con số hai giờ mỗi ngày không phải đưa ra một cách ngẫu nhiên. Các quan chức thành phố đã tranh luận và phân tích kỹ về khoảng thời gian thực tế mọi người có để giải trí sau khi làm việc, học và ngủ. Các nghiên cứu về giấc ngủ được khuyến nghị cho trẻ em và người lớn cũng giúp họ định hướng thảo luận. Cuối cùng, họ thống nhất con số hai giờ mỗi ngày vào các ngày trong tuần. Quy định đã vấp nhiều tranh cãi từ khi được công bố vào tháng 8. Một số cư dân cho rằng chính quyền đang xâm phạm cuộc sống riêng của họ. Chính quyền thành phố đã nhận được khoảng 400 cuộc gọi và tin nhắn liên quan tới quy định, phần lớn trong đó là tiêu cực. Nhiều chính trị gia địa phương công khai lên án trên mạng xã hội. ""Tôi chỉ muốn nói rằng đó không phải là việc của họ"", Mariko Fujie, nhà lập pháp ở Toyoake đã bỏ phiếu phản đối quy định, cho hay. Bà Fujie cho rằng việc giới hạn dùng điện thoại thông minh ""không dựa trên bằng chứng khoa học"" và ""thiếu cân nhắc tới quyền trẻ em"". Bà lo lắng cư dân sẽ cảm thấy bị áp lực phải tuân thủ. ""Quy định này hoàn toàn vô lý"", bà nói. Những nỗ lực điều chỉnh thời gian sử dụng điện thoại không phải là mới ở Nhật Bản, nước sản sinh ra những gã khổng lồ công nghệ như Nintendo và Sony. Một nghiên cứu của chính phủ Nhật Bản công bố năm ngoái cho thấy học sinh tiểu học và trung học Nhật Bản sử dụng điện thoại trung bình 5 giờ mỗi ngày. Năm 2020, tỉnh Kagawa trên đảo Shikoku cũng có động thái tương tự nhằm giới hạn thời gian trẻ em chơi trò chơi điện tử. Động thái đã gây ra làn sóng phản đối và biểu tình, nhưng không đảo ngược được quy định. Tại Toyoake, hình ảnh mọi người sử dụng điện thoại thông minh có thể dễ dàng thấy trên xe buýt, công viên, nhà hàng và trường học. Kairi Tani, sinh viên 20 tuổi, cho biết mọi người khó có thể cưỡng lại sức hút của điện thoại thông minh. Anh sử dụng các thiết bị điện tử khoảng 5-6 giờ mỗi ngày. ""Bộ não và điện thoại của tôi như được kết nối chặt chẽ với nhau. Tôi không bao giờ có thể buông nó ra được"", Tani nói khi ngồi trên ghế đá bên ngoài ga xe lửa và chơi trò Puzzles and Dragons. Nhiều người trẻ chăm chú dùng điện thoại tại triển lãm Expo 2025 tại Osaka, Nhật Bản. Ảnh:VCG Asami Sahara, 38 tuổi, cho hay con trai 5 tuổi của cô ""rất nghiện chơi game"" và thường dành 4 giờ chơi điện thoại vào cuối tuần. Cô cho rằng quy định có thể giúp nâng cao nhận thức về tác động tiêu cực của việc sử dụng điện thoại quá nhiều. ""Mọi người nên xem xét thay vì phản đối"", cô nói. Sahara thêm rằng sẽ viện dẫn quy định này để yêu cầu con trai thay đổi thói quen dùng điện thoại. ""Tôi có thể dọa thằng bé rằng 'con sẽ bị bắt. Quy định không cho phép được dùng điện thoại'"". Thị trưởng Kouki cho biết ông đã ngừng dùng điện thoại khi ăn tối theo lời khuyên của vợ và hiện chỉ chọn xem một số đoạn nổi bật thay vì cả trận đấu bóng chày như trước. Ông thêm rằng thời gian sử dụng điện thoại hàng ngày hiện khoảng 3 giờ, gồm cả lúc làm việc. Ông hy vọng hành động của Toyoake sẽ trở thành tấm gương cho các thành phố khác trong nước và nhiều nơi khác. Ông hiện xem xét triển khai các quy định khác như ngăn người dân sử dụng thiết bị khi đi bộ. ""Tôi không ngại đối mặt chỉ trích. Tôi chỉ muốn các gia đình có nhiều thời gian nói chuyện và mọi người có thể ngủ đủ giấc"", ông nói. Thanh Tâm(TheoJapan Today, Kyodo, The Register)","Thứ năm, 2/10/2025, 08:08 (GMT+7)",Thanh Tâm,Thế giới,Tư liệu,VN Express,
VNEX_021025_00012,Tòa Tối cao Mỹ cho phép bà Lisa Cook tiếp tục giữ chức thống đốc,https://vnexpress.net/toa-toi-cao-my-cho-phep-ba-lisa-cook-tiep-tuc-giu-chuc-thong-doc-4946173.html,"Quyết định được nêu trong một phán quyết ngắn gọn, không ký tên, được Tòa án Tối cao Mỹ ban hành hôm 1/10. Theo đó, tòa từ chối xem xét khẩn cấp về đề nghị của Tổng thống Mỹ Donald Trump liên quan quyết định sa thải Thống đốc Lisa Cook và lên lịch tranh luận vào tháng 1/2026. Khi ấy, Tòa Tối cao sẽ xem xét liệu có nên chặn phán quyết của Tòa án Phúc thẩm Liên bang khi cho rằng quyết định của ông Trump là không đủ cơ sở pháp lý. Quyết định này đồng nghĩa bà Cook tiếp tục tham gia hai cuộc họp cuối cùng của Fed trong năm nay, gồm cuộc họp quan trọng vào cuối tháng 10, nơi Ủy ban chính sách lãi suất sẽ nhóm họp. Thống đốc Fed Lisa Cook tại cuộc họp ở Washington ngày 25/6. Ảnh:AFP Cuối tháng 8, Tổng thống Trump công bố lệnh sa thải Thống đốc Lisa Cook, với cáo buộc gian lận thế chấp. Chính quyền cho rằng bà khai báo cả hai bất động sản đã mua tại Michigan và Georgia là ""nhà ở chính"", hành vi có thể giúp hưởng lãi vay thấp hơn so với xác định là nhà thứ hai hoặc bất động sản cho thuê. Vài hôm sau, bà Cook nộp đơn kiện quyết định này. Ngày 9/9, Thẩm phán Tòa án liên bang Washington (DC) Jia Cobb ban hành lệnh cấm tạm thời, ngăn ông Trump thực thi lệnh sa thải trong lúc vụ kiện còn đang xử lý. Theo thẩm phán Jia Cobb, chính quyền Trump không đáp ứng điều kiện ""lý do chính đáng"" để sa thải, tức thống đốc vi phạm khi tại nhiệm. Quyết định cũng tước đi quyền hợp pháp của bà Cook trong việc tự bảo vệ trước tòa. Đáp lại, ông Trump tiếp tục yêu cầu Tòa Phúc thẩm Washington cho phép bãi nhiệm ngay lập tức, nhưng bị bác bỏ ngày 15/9. Trong 112 năm qua, chưa có tổng thống nào sa thải một thống đốc đương nhiệm. Thống đốc Cook được bổ nhiệm năm 2022 bởi Tổng thống Joe Biden. Bà phủ nhận mọi sai phạm và chưa bị buộc tội. Theo tài liệu doAPthu thập, trong bản ước tính vay tháng 5/2021, bà Cook ghi rõ căn hộ tại Atlanta là ""nhà nghỉ dưỡng"". Tại hồ sơ xin cấp phép an ninh, bà cũng mô tả đây là ""nhà thứ hai"", ngược với cáo buộc gian lận của chính quyền Trump. Bà Cook khẳng định không từ chức và hay bị ""đe dọa"" bởi ông Trump. Luật sư Abbe Lowell của bà cho biết thống đốc ""tiếp tục thực hiện đầy đủ trách nhiệm được Thượng viện phê chuẩn"". Giáo sư Lev Menand tại Đại học Columbia lưu ý Tòa Tối cao từng cho phép các vụ sa thải khác có hiệu lực trong khi vụ kiện đang xét xử, như trường hợp Rebecca Slaughter tại Ủy ban Thương mại Liên bang. Tuy nhiên, phán quyết hôm 1/10 cho thấy Fed được nhìn nhận không giống với các cơ quan độc lập khác. ""Có vẻ tòa đang chọn hướng đi khác trong trường hợp này, nhằm giữ nguyên hiện trạng có lợi cho tính độc lập của Fed"", ông bình luận. Người phát ngôn Nhà Trắng Kush Desai tuyên bố: ""Tổng thống Trump đã hợp pháp khi bãi nhiệm bà Lisa Cook khỏi Hội đồng Thống đốc Fed. Chúng tôi mong chờ chiến thắng cuối cùng khi trình bày lập luận trước Tòa Tối cao vào tháng 1"". Phiên An(theo AP)","Thứ năm, 2/10/2025, 05:40 (GMT+7)",Phiên An,Kinh doanh,Quốc tế,VN Express,
