id,title,link,content,date,author,category,sub_category,source,summary
VNEX_021025_00076,Toyota liên tiếp tăng doanh số toàn cầu,https://vnexpress.net/toyota-lien-tiep-tang-doanh-so-toan-cau-4945765.html,"Sự tăng trưởng củaToyotanhờ nhu cầu vững chắc tại Mỹ và các thị trường nước ngoài khác, theoNikkei. Nhà sản xuất ôtô lớn nhất thế giới về sản lượng cho biết sản lượng toàn cầu tăng 4,9% lên 744.176 xe, vượt mức của năm trước trong tháng thứ ba liên tiếp. Doanh số ở nước ngoài của hãng lập kỷ lục mới trong tháng 8, tăng 4,4% lên 748.694 xe, trong đó doanh số tại Mỹ tăng 13,6% lên 225.367 xe, nhờ nhu cầu mạnh mẽ đối với xe hybrid bất chấp mức thuế quan cao hơn do Tổng thống Donald Trump áp đặt. Một đại lý Toyota ở Wakayama, Nhật Bản. Ảnh:Toyota Trong số các khu vực khác, doanh số tại Trung Quốc tăng nhẹ 0,9% lên 153.415 xe, nhờ tác động của các khoản trợ cấp của chính phủ đối với việc mua xe thân thiện với môi trường và nhu cầu mạnh mẽ đối với mẫu xe điện mới của hãng, Toyota cho biết. Ngược lại, doanh số trong nước giảm 12,1% xuống còn 96.269 chiếc, do ảnh hưởng của việc giao hàng bị trì hoãn do sản lượng bị tạm dừng sau các cảnh báo sóng thần. Toyota cho biết sản lượng tại Mỹ tăng 19% lên 126.081 chiếc, nhưng tại Trung Quốc giảm 8,2% xuống còn 125.383 chiếc. Sản lượng trong nước tăng 12% lên 207.990 chiếc, nhờ sự phục hồi sau vụ bê bối chứng nhận năm 2024. Doanh số xe điện của Toyota tăng 35% lên 17.056 chiếc trên toàn cầu. Tuy nhiên, ngay tại Nhật Bản, hãng chỉ bán được 18 xe. Trong 8 tháng đầu năm, tổng doanh số xe điện của hãng ở thị trường nội địa chỉ đạt 469 xe, giảm 71,1%. Sự sụt giảm này diễn ra bất chấp tổng doanh số xe điện hóa tại Nhật Bản tăng 8,8% trong cùng kỳ, đạt 617.947 xe. Phần lớn trong số này là các mẫu xe hybrid truyền thống của Toyota, chiếm 603.676 xe. Trong tháng 8, Toyota đã hạ dự báo lợi nhuận hàng năm do cảnh báo về khoản lỗ 1,4 nghìn tỷ yen (9,5 tỷ USD) do mức thuế quan 15% của Tổng thống Trump, theoJapan Times. Hiện Toyota dự kiến lợi nhuận hoạt động đạt 3,2 nghìn tỷ yen cho năm tài chính kết thúc vào tháng 3/2026, giảm so với dự báo ban đầu là 3,8 nghìn tỷ yen. Trong tháng 8, doanh số củaNissantăng 3% lên 251.081 xe, phần lớn nhờ mức tăng 13% tại Mỹ và mức tăng 19% tại Trung Quốc. Trong khi đó, doanh số của Honda giảm 7% xuống còn 289.688 xe. Mỹ Anh","Thứ năm, 2/10/2025, 04:00 (GMT+7)",Mỹ Anh,Xe,Thị trường,VN Express,
VNEX_021025_00062,Khi nào viêm xoang lây nhiễm?,https://vnexpress.net/khi-nao-viem-xoang-lay-nhiem-4945626.html,"Khi dịch hoặc chất nhầy bị kẹt trong xoang, vi trùng bắt đầu phát triển và dẫn đến viêm xoang. Các nguyên nhân phổ biến gây viêm xoang gồm virus như virus gây cảm lạnh hoặc cúm, vi khuẩn, nấm, polyp mũi (là những khối u trong mũi), khối u mũi, dị ứng, vẹo vách ngăn (tình trạng vách ngăn giữa các hốc mũi bị cong hoặc lệch tâm). Viêm xoang cấp tính do rhinovirus, cúm, parainfluenza... lây truyền do các loại virus này có thể lây nhiễm qua tiếp xúc với dịch tiết của người bệnh khi ho, hắt xì hoặc dùng chung đồ cá nhân. Nếu viêm xoang do virus gây ra có khả năng lây lan sang người khác, gây cảm lạnh, rồi sau đó phát triển thành viêm xoang. Nếu vi khuẩn gây ra viêm xoang thì bệnh không lây nhiễm. Người mắc bệnh viêm xoang do virus không nên đến nơi đông người, không dùng chung dụng cụ ăn uống và đeo khẩu trang để tránh lây lan cho người khác. Tuy nhiên, nguy cơ lây nhiễm do viêm xoang thấp, không đáng ngại. Nếu không tiếp xúc quá gần và lâu dài với người bệnh thì khả năng lây nhiễm rất thấp. Virus gây nhiễm trùng xoang có thể lây truyền khi người bệnh hắt hơi hoặc ho. Che mũi và miệng khi ho, hắt hơi có thể giúp giảm khả năng lây lan nhiễm trùng. Dùng tay chưa được khử khuẩn sau hắt hơi hoặc ho trực tiếp chạm vào người hoặc vật thể khác, chẳng hạn tay nắm cửa cũng làm tăng nguy cơ. Viêm xoangkhông biến chứng là bệnh lý lành tính chỉ gây cảm giác khó chịu tại chỗ như nghẹt mũi, chảy mũi hay đau nặng mặt và không đe dọa tính mạng. Tuy nhiên, viêm xoang biến chứng có thể ảnh hưởng nghiêm trọng đến sức khỏe người bệnh. Phổ biến nhất là biến chứng viêm tai giữa, có thể gây suy giảm thính lực hoặc điếc vĩnh viễn. Các biến chứng nội sọ gây viêm não, màng não có thể gây tử vong nếu không được can thiệp kịp thời, nhất là ở trẻ nhỏ. Viêm xoang cũng có thể gây các biến chứng mắt như song thị hay lồi mắt. Để phòng bệnh viêm xoang lây nhiễm, mỗi người nên: Các triệu chứng cần đi khám gồm: Xem chi tiếtcách chăm sóc người bị viêm xoang tại nhà Bảo Bảo(TheoHealthline)","Thứ năm, 2/10/2025, 01:02 (GMT+7)",Bảo Bảo,Sức khỏe,Các bệnh,VN Express,
VNEX_021025_00063,Người mẹ từ chối chữa ung thư để con được chào đời khỏe mạnh,https://vnexpress.net/nguoi-me-tu-choi-chua-ung-thu-de-con-duoc-chao-doi-khoe-manh-4946083.html,"Sản phụ mang thai lần thứ ba, phát hiện mắc ung thư vòm họng giai đoạn cuối (CT2N3M0) ở tuần thai thứ 22. Khối u phát triển 4 cm và di căn hạch thượng đòn. Dù được Bệnh viện K tư vấn hóa trị song song giữ thai, chị từ chối điều trị vì lo ngại ảnh hưởng đến con. Chấp nhận mọi rủi ro, chị quyết tâm giữ thai nhi lớn thêm từng ngày. ""Tôi chỉ mong con được chào đời an toàn"", chị chia sẻ trước ca mổ ngày 29/9. Quyết định này khiến bệnh tình của thai phụ diễn biến trầm trọng trong ba tháng tiếp theo. Khối u phát triển nhanh gây chèn ép, khiến chị nuốt và nói đều khó khăn, phải nằm ở tư thế đầu cao. Tình trạng dinh dưỡng kém cũng làm thai nhi chậm phát triển. Một tuần trước khi mổ, chị nhập viện tại khoa Sản Bệnh lý, Bệnh viện Phụ sản Trung ương để các bác sĩ tiêm trưởng thành phổi cho em bé, chuẩn bị cho cuộc phẫu thuật ""cân não"". Khi thai nhi được 35 tuần, sức chịu đựng của người mẹ chạm ngưỡng giới hạn. Ban lãnh đạo bệnh viện cùng các chuyên khoa hội chẩn và quyết định mổ lấy thai để bảo toàn tính mạng cho cả hai mẹ con. Tiến sĩ, bác sĩ Nguyễn Thái Giang, Phó Trưởng khoa Phụ Ung thư, cho biết đây là trường hợp đầu tiên bệnh viện tiếp nhận sản phụ mang thai mắc ung thư vòm họng giai đoạn nặng như vậy. ""Bệnh nhân đã hy sinh cơ hội điều trị sớm để giữ con. Khi quay lại, chị gần như kiệt sức, buộc chúng tôi phải mổ lấy thai ngay lập tức"", bác sĩ Giang nói. Ca phẫu thuật đối mặt với thách thức lớn nhất từ khâu gây mê - hồi sức. Khối u lớn ở cổ khiến sản phụ không thể nằm ngửa, gây khó khăn cho việc đặt nội khí quản và đường truyền. Mạch máu tăng sinh cũng làm tăng nguy cơ chảy máu cao. Êkíp phẫu thuật buộc phải tiến hành trong tư thế sản phụ nửa nằm nửa ngồi và chuẩn bị mọi kịch bản dự phòng. Em bé chào đời khoẻ mạnh bên cạnh người mẹ. Ảnh:Bệnh viện cung cấp THS.BSCKII Bạch Minh Thu, Phụ trách Khoa Phẫu thuật Gây mê hồi sức, chia sẻ: ""Chúng tôi đã chọn phương án gây tê tủy sống. Đây là một tình huống vô cùng thách thức, đòi hỏi sự phối hợp nhịp nhàng và chính xác của toàn bộ êkíp"". Sau những phút giây căng thẳng, bé trai nặng 2,3 kg đã cất tiếng khóc chào đời trong niềm vui của các y bác sĩ. Hiện sức khỏe bé ổn định. Người mẹ tiếp tục hành trình chiến đấu với căn bệnh ung thư. ""Tôi thực sự khâm phục nghị lực và tình yêu thương vô bờ của người mẹ này. Chị đã kiên trì chịu đựng đau đớn suốt ba tháng chỉ với một mong ước duy nhất. Đó là sự hy sinh cao cả không lời nào tả hết"", bác sĩ Giang bày tỏ. Các chuyên gia khuyến cáo ung thư có thể xuất hiện ở bất kỳ thời điểm nào, kể cả khi mang thai. Do đó, thai phụ cần đi khám ngay khi có dấu hiệu bất thường để được chẩn đoán và can thiệp y tế kịp thời. Lê Nga","Thứ năm, 2/10/2025, 00:04 (GMT+7)",Lê Nga,Sức khỏe,Tin tức,VN Express,
VNEX_021025_00093,10 khách sạn Xanh tốt nhất Việt Nam 2025,https://vnexpress.net/10-khach-san-xanh-tot-nhat-viet-nam-2025-4944926.html,"Giải thưởng Khách sạn Xanh (Thân thiện môi trường) tốt nhất được Cục Du lịch Quốc gia trao cho 10 đơn vị trong chương trình Giải thưởng du lịch Việt Nam 2025, hôm 27/9. Kết quả xét chọn được tiến hành công khai, với sự tham gia của hội đồng với đại diện cơ quan quản lý, hiệp hội nghề nghiệp và các chuyên gia trong lĩnh vực du lịch. Các tiêu chí gồm chất lượng dịch vụ, đa dạng sản phẩm, thân thiện môi trường, giúp quảng bá hình ảnh Việt Nam, áp dụng công nghệ... Khu nghỉ dưỡng Ana Mandara Cam Ranh (Khánh Hòa) Ana Mandara Cam Ranh nằm ở Bãi Dài, được công nhận là ""Best Eco-Friendly Resort in Vietnam"" năm 2024 nhờ cam kết bảo vệ môi trường và phát triển bền vững. Khu nghỉ lấy cảm hứng từ văn hóa làng chài miền Trung Việt Nam, sử dụng vật liệu địa phương và thiết kế hòa hợp với thiên nhiên, giảm thiểu tác động tiêu cực đến cảnh quan núi non và biển cả. Resort áp dụng các biện pháp tiết kiệm năng lượng, nước và giảm chất thải, tái chế nước mưa và xử lý rác thải hữu cơ. Giải thưởng Khách sạn Xanh (Thân thiện môi trường) tốt nhất được Cục Du lịch Quốc gia trao cho 10 đơn vị trong chương trình Giải thưởng du lịch Việt Nam 2025, hôm 27/9. Kết quả xét chọn được tiến hành công khai, với sự tham gia của hội đồng với đại diện cơ quan quản lý, hiệp hội nghề nghiệp và các chuyên gia trong lĩnh vực du lịch. Các tiêu chí gồm chất lượng dịch vụ, đa dạng sản phẩm, thân thiện môi trường, giúp quảng bá hình ảnh Việt Nam, áp dụng công nghệ... Khu nghỉ dưỡng Ana Mandara Cam Ranh (Khánh Hòa) Ana Mandara Cam Ranh nằm ở Bãi Dài, được công nhận là ""Best Eco-Friendly Resort in Vietnam"" năm 2024 nhờ cam kết bảo vệ môi trường và phát triển bền vững. Khu nghỉ lấy cảm hứng từ văn hóa làng chài miền Trung Việt Nam, sử dụng vật liệu địa phương và thiết kế hòa hợp với thiên nhiên, giảm thiểu tác động tiêu cực đến cảnh quan núi non và biển cả. Resort áp dụng các biện pháp tiết kiệm năng lượng, nước và giảm chất thải, tái chế nước mưa và xử lý rác thải hữu cơ. Salinda Resort Phu Quoc Island (An Giang) Khu nghỉ dưỡng nằm ở trung tâm đảo Phú Quốc thân thiện môi trường nhờ cam kết phát triển bền vững từ thiết kế đến hoạt động. Resort sử dụng tấm gỗ Accoya (gỗ bền vững, chống chịu thời tiết cao) và tường đá điều hòa nhiệt độ tự nhiên, giúp giảm tiêu thụ năng lượng. Hơn 80% diện tích được bao phủ bởi vườn cây đa tầng, hòa quyện với cảnh quan thiên nhiên, giảm thiểu xâm phạm hệ sinh thái ven biển đảo Phú Quốc. Salinda Resort Phu Quoc Island (An Giang) Khu nghỉ dưỡng nằm ở trung tâm đảo Phú Quốc thân thiện môi trường nhờ cam kết phát triển bền vững từ thiết kế đến hoạt động. Resort sử dụng tấm gỗ Accoya (gỗ bền vững, chống chịu thời tiết cao) và tường đá điều hòa nhiệt độ tự nhiên, giúp giảm tiêu thụ năng lượng. Hơn 80% diện tích được bao phủ bởi vườn cây đa tầng, hòa quyện với cảnh quan thiên nhiên, giảm thiểu xâm phạm hệ sinh thái ven biển đảo Phú Quốc. Khách sạn Sofitel Legend Metropole (Hà Nội) Sofitel Legend Metropole Hanoi được công nhận là một trong những khách sạn sang trọng hàng đầu với cam kết phát triển bền vững. Khách sạn từng đạt chứng nhận Green Globe, tiêu chuẩn toàn cầu công nhận nỗ lực bảo vệ môi trường, trách nhiệm xã hội và tác động tích cực đến cộng đồng, giải thưởng ASEAN Green Hotel Award và Hanoi City Green Energy Award nhờ các sáng kiến giảm thiểu ""dấu chân carbon"" và bảo tồn tài nguyên. Ảnh:Giang Huy Khách sạn Sofitel Legend Metropole (Hà Nội) Sofitel Legend Metropole Hanoi được công nhận là một trong những khách sạn sang trọng hàng đầu với cam kết phát triển bền vững. Khách sạn từng đạt chứng nhận Green Globe, tiêu chuẩn toàn cầu công nhận nỗ lực bảo vệ môi trường, trách nhiệm xã hội và tác động tích cực đến cộng đồng, giải thưởng ASEAN Green Hotel Award và Hanoi City Green Energy Award nhờ các sáng kiến giảm thiểu ""dấu chân carbon"" và bảo tồn tài nguyên. Ảnh:Giang Huy Khách sạn Hotel de l'Opera Hanoi (Hà Nội) Khách sạn boutique 5 sao mang phong cách Pháp nằm ở trung tâm Hà Nội có cam kết với chương trình Planet 21 - sáng kiến toàn cầu về phát triển bền vững, giảm thiểu tác động môi trường, bảo vệ tài nguyên và hỗ trợ cộng đồng địa phương. Hệ thống chiếu sáng, công tắc tiết kiệm năng lượng, khuyến khích khách tái sử dụng khăn tắm và ga giường để giảm tiêu thụ nước và năng lượng. Hệ thống thùng rác phân loại tái chế được bố trí trong phòng. Khách sạn Hotel de l'Opera Hanoi (Hà Nội) Khách sạn boutique 5 sao mang phong cách Pháp nằm ở trung tâm Hà Nội có cam kết với chương trình Planet 21 - sáng kiến toàn cầu về phát triển bền vững, giảm thiểu tác động môi trường, bảo vệ tài nguyên và hỗ trợ cộng đồng địa phương. Hệ thống chiếu sáng, công tắc tiết kiệm năng lượng, khuyến khích khách tái sử dụng khăn tắm và ga giường để giảm tiêu thụ nước và năng lượng. Hệ thống thùng rác phân loại tái chế được bố trí trong phòng. Khách sạn Cửu Long - Majestic Sài Gòn (TP HCM) Khách sạn hoạt động từ năm 1925 nằm ở trung tâm TP HCM có nhiều sáng kiến xanh, phù hợp xu hướng du lịch bền vững tại Việt Nam. Khách sạn sử dụng chai nước tái chế, áp dụng chương trình tái sử dụng khăn tắm và ga giường. Với vị trí ven sông Sài Gòn, khách sạn ưu tiên bảo tồn cảnh quan tự nhiên qua thiết kế không xâm phạm hệ sinh thái. Các hoạt động như tour tham quan địa danh lịch sử bằng xe đạp hoặc đi bộ được khuyến khích. Khách sạn Cửu Long - Majestic Sài Gòn (TP HCM) Khách sạn hoạt động từ năm 1925 nằm ở trung tâm TP HCM có nhiều sáng kiến xanh, phù hợp xu hướng du lịch bền vững tại Việt Nam. Khách sạn sử dụng chai nước tái chế, áp dụng chương trình tái sử dụng khăn tắm và ga giường. Với vị trí ven sông Sài Gòn, khách sạn ưu tiên bảo tồn cảnh quan tự nhiên qua thiết kế không xâm phạm hệ sinh thái. Các hoạt động như tour tham quan địa danh lịch sử bằng xe đạp hoặc đi bộ được khuyến khích. Khách sạn Azerai La Residence Hue (Huế) Trải dài hơn 200 m dọc theo bờ sông Hương, khách sạn 90 năm tuổi có 122 phòng, bài trí đơn giản, hiện đại. Thông qua chương trình ""Sustainability"", Azerai ưu tiên các quyết định phát triển và vận hành có trách nhiệm, nhằm bảo tồn môi trường sông nước và hệ sinh thái Huế, đồng thời giảm thiểu dấu chân carbon. Khách sạn áp dụng các biện pháp giảm tiêu thụ năng lượng, như hệ thống chiếu sáng hiệu quả và quản lý tài nguyên nước, cung cấp nước uống đóng chai tự sản xuất. Khách sạn Azerai La Residence Hue (Huế) Trải dài hơn 200 m dọc theo bờ sông Hương, khách sạn 90 năm tuổi có 122 phòng, bài trí đơn giản, hiện đại. Thông qua chương trình ""Sustainability"", Azerai ưu tiên các quyết định phát triển và vận hành có trách nhiệm, nhằm bảo tồn môi trường sông nước và hệ sinh thái Huế, đồng thời giảm thiểu dấu chân carbon. Khách sạn áp dụng các biện pháp giảm tiêu thụ năng lượng, như hệ thống chiếu sáng hiệu quả và quản lý tài nguyên nước, cung cấp nước uống đóng chai tự sản xuất. Khu nghỉ dưỡng Silk Sense Hội An River Resort (Đà Nẵng) Silk Sense Hoi An River Resort nhận chứng chỉ ""Travelife Gold for Accommodation Sustainability"" từ tổ chức quốc tế về du lịch bền vững. Khu nghỉ chú trọng giảm thiểu tác động đến môi trường, cải thiện tác động kinh tế và xã hội cho cộng đồng địa phương, và bảo tồn sự đa dạng sinh học. Các phòng nghỉ được thiết kế tận dụng tối đa nguồn năng lượng tự nhiên, loại bỏ việc sử dụng nhựa, thay vào đó là vật liệu thân thiện môi trường như gốm và thủy tinh. Khu nghỉ dưỡng Silk Sense Hội An River Resort (Đà Nẵng) Silk Sense Hoi An River Resort nhận chứng chỉ ""Travelife Gold for Accommodation Sustainability"" từ tổ chức quốc tế về du lịch bền vững. Khu nghỉ chú trọng giảm thiểu tác động đến môi trường, cải thiện tác động kinh tế và xã hội cho cộng đồng địa phương, và bảo tồn sự đa dạng sinh học. Các phòng nghỉ được thiết kế tận dụng tối đa nguồn năng lượng tự nhiên, loại bỏ việc sử dụng nhựa, thay vào đó là vật liệu thân thiện môi trường như gốm và thủy tinh. Khách sạn Victoria Châu Đốc (An Giang) Victoria Châu Đốc Hotel là khu nghỉ mang phong cách kiến trúc thuộc địa Pháp nằm bên bờ sông Hậu. Khách sạn cam kết bảo vệ môi trường thông qua chương trình Travelife, một chứng nhận bền vững quốc tế đánh giá tác động đến môi trường, cộng đồng, di sản văn hóa và kinh tế địa phương. Khách sạn tổ chức các tour sinh thái, tour bộ hành, khuyến khích du khách di chuyển bằng xe đạp hoặc đi bộ. Khách sạn Victoria Châu Đốc (An Giang) Victoria Châu Đốc Hotel là khu nghỉ mang phong cách kiến trúc thuộc địa Pháp nằm bên bờ sông Hậu. Khách sạn cam kết bảo vệ môi trường thông qua chương trình Travelife, một chứng nhận bền vững quốc tế đánh giá tác động đến môi trường, cộng đồng, di sản văn hóa và kinh tế địa phương. Khách sạn tổ chức các tour sinh thái, tour bộ hành, khuyến khích du khách di chuyển bằng xe đạp hoặc đi bộ. Khu nghỉ dưỡng Champa Island Nha Trang (Khánh Hòa) Khu nghỉ dưỡng lấy cảm hứng từ kiến trúc Chăm, nằm trên đảo giữa thành phố Nha Trang. Resort cam kết phát triển bền vững, giảm chất thải nhựa và thúc đẩy lối sống xanh, góp phần bảo vệ hệ sinh thái vịnh Nha Trang. Champa Island Nha Trang còn áp dụng rộng rãi các sản phẩm thay thế như cốc giấy, túi vải, hộp từ bã mía, tạo việc làm cho cộng đồng địa phương, thúc đẩy tăng trưởng kinh tế xanh. Resort ưu tiên nguyên liệu địa phương trong ẩm thực, hỗ trợ nông dân, giảm vận chuyển. Khu nghỉ dưỡng Champa Island Nha Trang (Khánh Hòa) Khu nghỉ dưỡng lấy cảm hứng từ kiến trúc Chăm, nằm trên đảo giữa thành phố Nha Trang. Resort cam kết phát triển bền vững, giảm chất thải nhựa và thúc đẩy lối sống xanh, góp phần bảo vệ hệ sinh thái vịnh Nha Trang. Champa Island Nha Trang còn áp dụng rộng rãi các sản phẩm thay thế như cốc giấy, túi vải, hộp từ bã mía, tạo việc làm cho cộng đồng địa phương, thúc đẩy tăng trưởng kinh tế xanh. Resort ưu tiên nguyên liệu địa phương trong ẩm thực, hỗ trợ nông dân, giảm vận chuyển. Khách sạn H'mong Village (Tuyên Quang) Đây là khu nghỉ nằm giữa cao nguyên đá Đồng Văn, là một trong những điểm đến du lịch xanh hàng đầu, với giải thưởng Khách sạn Xanh ASEAN. Resort sử dụng vật liệu thân thiện như nhà trình tường đất, ngói âm dương, cỏ lợp mái và đá lát sân. Khuôn viên được bao phủ bởi hệ thống cây xanh đa dạng. Mỗi du khách tham gia chương trình trồng một cây xanh để góp phần bảo vệ môi trường, hỗ trợ đa dạng sinh học và chống xói mòn ở cao nguyên đá. Khách sạn H'mong Village (Tuyên Quang) Đây là khu nghỉ nằm giữa cao nguyên đá Đồng Văn, là một trong những điểm đến du lịch xanh hàng đầu, với giải thưởng Khách sạn Xanh ASEAN. Resort sử dụng vật liệu thân thiện như nhà trình tường đất, ngói âm dương, cỏ lợp mái và đá lát sân. Khuôn viên được bao phủ bởi hệ thống cây xanh đa dạng. Mỗi du khách tham gia chương trình trồng một cây xanh để góp phần bảo vệ môi trường, hỗ trợ đa dạng sinh học và chống xói mòn ở cao nguyên đá. Tâm AnhẢnh:Khách sạn","Thứ năm, 2/10/2025, 07:00 (GMT+7)",Tâm Anh,Du lịch,Điểm đến,VN Express,
