id,title,link,content,date,author,category,sub_category,source,summary
VNEX_040725_00070,20 bang kiện chính quyền Trump vì chia sẻ dữ liệu Medicaid,https://vnexpress.net/20-bang-kien-chinh-quyen-trump-vi-chia-se-du-lieu-medicaid-4909735.html,"Đơn kiện cáo buộc hành động này vi phạm luật liên bang và đe dọa quyền riêng tư của hàng triệu người dân. Vụ kiện được đệ trình hôm 2/7 tại tòa án liên bang Quận phía Bắc California. Tổng chưởng lý đảng Dân chủ Rob Bonta cho biết đây là lần thứ 28 trong vòng 23 tuần, California thách thức chính quyền Trump tại tòa. ""Theo hiểu biết và niềm tin của nguyên đơn, Trung tâm Dịch vụ Medicare & Medicaid (CMS) thuộc Bộ Y tế và Dịch vụ Nhân sinh Mỹ (HHS) đã chuyển giao một kho dữ liệu sức khỏe được bảo vệ, thu thập từ các bang bao gồm California, Illinois và Washington, cho cơ quan liên bang khác như Bộ An ninh Nội địa (DHS)"", đơn kiện nêu. Như vậy, hàng triệu thông tin sức khỏe cá nhân đã được chuyển giao mà không có sự đồng ý của người dân, vi phạm luật liên bang, nguyên đơn cáo buộc. Các bang này cho phép người không phải công dân Mỹ đăng ký chương trình Medicaid được tài trợ bằng tiền thuế tiểu bang, nhằm chi trả cho các dịch vụ khẩn cấp. AP từng đưa tin dữ liệu mà HHS chia sẻ với DHS bao gồm tên, địa chỉ, số an sinh xã hội, tình trạng nhập cư và dữ liệu khiếu nại của người đăng ký. ""Khi làm như vậy, chính quyền Trump đã âm thầm phá vỡ các rào cản bảo vệ dữ liệu sức khỏe nhạy cảm và hạn chế việc sử dụng dữ liệu theo quy định của Quốc hội, vi phạm luật liên bang bao gồm Đạo luật thủ tục hành chính (APA)"", đơn kiện viết. Ngoài ra, còn có cáo buộc vi phạm các luật liên bang khác như Đạo luật HIPAA, quy định nghiêm ngặt việc bảo vệ và không được tiết lộ dữ liệu sức khỏe cá nhân nếu không có sự đồng ý của người đó. HHS lập luận, việc chia sẻ dữ liệu nhằm ""đảm bảo rằng quyền lợi Medicaid chỉ dành cho người có đủ điều kiện hợp pháp"". Tuy nhiên, đơn kiện phản bác, Quốc hội đã mở rộng phạm vi Medicaid khẩn cấp cho tất cả cư dân tại Mỹ, kể cả người không có tình trạng nhập cư hợp pháp. ""Các bang vẫn đang và sẽ tiếp tục xác minh tính đủ điều kiện của người dân thông qua các hệ thống liên bang hiện có và hợp tác với hoạt động giám sát để bảo đảm chỉ các dịch vụ hợp pháp được liên bang chi trả"", tài liệu khẳng định. Tổng chưởng lý từ 19 bang khác gồm Arizona, Colorado, Connecticut, Delaware, Hawaii, Illinois, Massachusetts, Maine, Maryland, Michigan, Minnesota, Nevada, New Jersey, New Mexico, New York, Oregon, Rhode Island, Vermont và Washington đã cùng tham gia vụ kiện. Ông Bonta cho rằng Tổng thống Trump, Bộ trưởng Kristi Noem và Bộ trưởng Robert F. Kennedy Jr. đang biến Medicaid thành công cụ phục vụ chiến dịch chống nhập cư, đồng thời đe dọa quyền riêng tư của 78,4 triệu người tham gia Medicaid và chương trình bảo hiểm trẻ em CHIP để thực hiện các kế hoạch giám sát hàng loạt. ""Đây không phải việc chống gian lận hay cắt giảm chi tiêu. Đây là hành động truy tố người dễ tổn thương, những người đã tin tưởng trao quyền truy cập dữ liệu cho tiểu bang và liên bang để được chăm sóc sức khỏe, một quyền cơ bản của con người"", Bonta nói. Bộ trưởng Y tế và Dịch vụ Nhân sinh Mỹ, ông Robert F. Kennedy Jr. làm chứng trước Tiểu ban Y tế thuộc Ủy ban Năng lượng và Thương mại Hạ viện, ngày 24/6. Ảnh:AOL Đơn kiện cho rằng hành vi trên có thể khiến người nhập cư hợp pháp hoặc gia đình của họ sợ hãi, không dám đăng ký hoặc hủy đăng ký Medicaid khẩn cấp mà họ hợp pháp được hưởng. Điều này khiến các bang và bệnh viện phải gánh thêm chi phí điều trị khẩn cấp bắt buộc. ""Các tiểu bang sẽ phải đối mặt với chi phí y tế công cộng gia tăng do giảm tỷ lệ tiếp cận dịch vụ chăm sóc y tế khi sinh nở hoặc tình trạng khẩn cấp khác. Người dân sẽ chịu tác động tiêu cực từ tỷ lệ bệnh tật và tử vong tăng cao"", đơn kiện viết. Ông Bonta lưu ý, Medi-Cal của California hiện bảo hiểm cho khoảng một phần ba dân số bang, trong đó có hơn hai triệu người không phải công dân. Với nhóm không đủ điều kiện nhận hỗ trợ liên bang, California sử dụng ngân sách riêng để cung cấp phiên bản Medi-Cal riêng biệt cho tất cả cư dân đủ điều kiện, bất kể tình trạng nhập cư. Trong tuyên bố với Fox News Digital, người phát ngôn của HHS, ông Andrew Nixon, phản bác rằng CMS dưới quyền tiến sĩ Mehmet Oz đang ""tích cực giám sát các bang có thể đã sử dụng sai quỹ Medicaid liên bang để chăm sóc người nhập cư bất hợp pháp"". Ông khẳng định HHS đã hành động trong khuôn khổ pháp luật hiện hành để đảm bảo quyền lợi Medicaid chỉ dành cho người đủ điều kiện hợp pháp, bảo vệ đồng thời tiền thuế và uy tín của một trong những chương trình quan trọng nhất nước Mỹ. Thục Linh(TheoAP)","Thứ sáu, 4/7/2025, 00:04 (GMT+7)",Thục Linh,Sức khỏe,Tin tức,VN Express,"Một nhóm các bang, dẫn đầu bởi California, đã kiện chính quyền Trump vì cáo buộc chuyển giao trái phép dữ liệu sức khỏe cá nhân của hàng triệu người tham gia Medicaid cho Bộ An ninh Nội địa (DHS) mà không có sự đồng ý của họ. Vụ kiện cáo buộc hành động này vi phạm luật liên bang, bao gồm Đạo luật HIPAA và Đạo luật Thủ tục Hành chính (APA), đe dọa quyền riêng tư và biến Medicaid thành công cụ chống nhập cư. Các bang phản đối lý do ""đảm bảo quyền lợi Medicaid chỉ dành cho người đủ điều kiện hợp pháp"" của HHS, cho rằng việc mở rộng Medicaid khẩn cấp cho tất cả cư dân là hợp pháp và các bang đã có cơ chế xác minh hợp lệ. Vụ kiện có sự tham gia của 19 bang khác, thể hiện sự phản đối rộng rãi đối với chính sách này."
VNEX_040725_00083,Porsche 911 Carrera 4S 2026 thêm sức mạnh và trang bị,https://vnexpress.net/porsche-911-carrera-4s-2026-them-suc-manh-va-trang-bi-4909410.html,"Hãng xe ĐứcPorschera mắt911Carrera 4S 2026 đầu tiên ở thị trường Mỹ. Phiên bản mới nhất của 911 thuộc thế hệ 992.2 cải tiến là Carrera 4S, kết hợp hệ truyền động mới nâng cấp của S với dẫn động 4 bánh toàn thời gian và một vài tính năng. Có sẵn ở dạng Coupe, Cabriolet và Targa, 911 Carrera 4S 2026 lấp vào khoảng trống giữa Carrera S dẫn động cầu sau và GTS AWD. Theo hãng xe Đức, gần một nửa số người mua tại Mỹ lựa chọn mẫu S đều lấy dẫn động 4 bánh, khiến 4S trở thành một phần quan trọng. Ở ngoại hình Carrera 4S chia sẻ những đường nét thiết kế mới, như cản trước định hình lại và cụm đèn chiếu sáng mới trang bị tiêu chuẩn với công nghệ LED Matrix. Trong khi ở nội thất, bản Coupe có hai lựa chọn cấu hình 2 chỗ hoặc 2+2 chỗ mà không thêm chi phí. Tuy nhiên, Cabrilet và Targa trang bị ghế sau tiêu chuẩn. Điểm nhấn của 911 Carrera 4S 2026 nằm ở dưới nắp cốp sau, nơi động cơ được tinh chỉnh. Xe trang bị động cơ 3.0 I6 tăng áp kép, sản sinh công suất 473 mã lực, mô-men xoắn cực đại 528 Nm. Công suất này tương đương với công suất của Carrera S và tăng 30 mã lực so với Carrera 4S trước khi nâng cấp. Động cơ mới của 911 Carrera 4S 2026 ghép nối với hộp số ly hợp kép PDK 8 cấp và truyền lực đến tất cả bốn bánh thông qua hệ thống quản lý lực kéo PTM thiên về phía sau của Porsche. Thiết lập bao gồm bộ vi sai trước làm mát bằng nước và bộ ly hợp điều khiển cơ điện để phân phối lực chính xác. Bên cạnh tinh chỉnh động cơ, Porsche còn bổ sung trang bị tiêu chuẩn cho 911 Carrera 4S hệ thống ống xả thể thao với ống màu bạc và phanh từ GTS thế hệ trước. Bộ giảm chấn cải tiến cũng là một phần của gói nâng cấp. Khách hàng thêm tùy chọn gói Sport Chrono, treo thể thao PASM với chiều cao xe thấp hơn, hệ thống lái trục sau (tiêu chuẩn trên Targa 4S) và phanh gốm tổng hợp. Với gói Sport Chrono, Carrera 4S tăng tốc 0-96 km/h trong 3,1 giây và tốc độ tối đa 307 km/h, nhanh hơn 0,2 giây so với Carrera S và chỉ kém 0,2 giây so với GTS. Theo kế hoạch, lô hàng Porsche 911 Carrera 4S 2026 đầu tiên bàn giao cho khách hàng Mỹ vào cuối năm 2025. Giá công bố gần thời điểm bàn giao. Minh Vũ","Thứ sáu, 4/7/2025, 03:56 (GMT+7)",Minh Vũ,Xe,Thị trường,VN Express,"Porsche ra mắt mẫu 911 Carrera 4S 2026 tại Mỹ, phiên bản nâng cấp của dòng 911 thế hệ 992.2. Xe có thiết kế mới, động cơ 3.0 I6 tăng áp kép mạnh mẽ hơn (473 mã lực) và hệ dẫn động 4 bánh toàn thời gian. Điểm nổi bật khác bao gồm hộp số PDK 8 cấp, hệ thống ống xả thể thao và nhiều tùy chọn nâng cấp hiệu suất. Dự kiến lô hàng đầu tiên sẽ đến tay khách hàng Mỹ vào cuối năm 2025."
VNEX_040725_00002,Xuồng Ukraine phóng drone tập kích radar 100 triệu USD của Nga,https://vnexpress.net/xuong-ukraine-phong-drone-tap-kich-radar-100-trieu-usd-cua-nga-4909903.html,"""Bộ tư lệnh Tác chiến miền Nam Ukraine rạng sáng 2/7 tiến hành chiến dịch đặc biệt xuất sắc với độ chính xác cao"", Bộ Quốc phòng Ukraine thông báo, khẳng định cuộc tập kích đã phá hủy ba thành phần quan trọng thuộc tổ hợp radar Nebo-M Nga triển khai ở bán đảo Crimea, gồm đài radar RLM-M và RLM-D cùng xe chỉ huy. Video do quân đội Ukraine công bố cho thấy thiết bị bay không người lái (drone) triển khai từ xuồng không người lái trên Biển Đên, sau đó thả đầu đạn xuống các thành phần của tổ hợp Nebo-M và gây ra loạt vụ nổ. Video không cho thấy hậu quả sau đòn đánh. Bộ Quốc phòng Nga chưa bình luận về thông tin. Drone Ukraine thả đầu nổ vào tổ hợp radar Nebo-M Nga ở Crimea sáng 2/7. Video:BQP Ukraine Một nhà phân tích quân sự Nga cho biết triển khai drone mang đầu nổ từ xuồng không người lái là chiến thuật mới của Ukraine, trong đó mỗi drone có thể tung được nhiều đòn đánh thay vì chỉ dùng một lần như phiên bản tự sát. Drone dạng này cũng mang được đầu đạn nặng hơn và đạt tầm bay xa hơn mà vẫn duy trì được kết nối với tổ vận hành, do không cần bổ nhào để tấn công mục tiêu. Nhà phân tích Nga nói lực lượng nước này sau đó phá hủy được xuồng không người lái của Ukraine, song chưa đưa ra bằng chứng. Một trong các drone Ukraine sử dụng trong cuộc tập kích được cho là đã bị Nga tịch thu. ""Xuồng được điều khiển thông qua hệ thống Starlink và lực lượng Ukraine đã được huấn luyện để sử dụng nó ở Crimea. Cần phải cung cấp thêm tài nguyên cho lực lượng trực chiến để đối phó các phương án tấn công phi truyền thống như vậy"", người này cho hay. Howard Altman, cây viết của chuyên trang quân sự MỹWar Zone, nhận định xuồng không người lái Ukraine được trang bị hệ thống liên lạc vệ tinh để kết nối với tổ vận hành từ xa, còn drone thả đầu nổ được điều khiển thông qua tín hiệu vô tuyến trong tầm nhìn thẳng từ xuồng. Điều này cho phép lực lượng Ukraine vận hành xuồng từ bất cứ đâu, trong đó phương tiện này đóng vai trò là bệ phóng drone kiêm đài chuyển tiếp tín hiệu. Drone Ukraine phía Nga thu được sau vụ tập kích radar. Ảnh:War Zone Được đưa vào biên chế quân đội Nga từ năm 2017, Nebo-M là hệ thống radar tầm xa đa nhiệm, có khả năng phát hiện mục tiêu ở khoảng cách gần 600 km, sở hữu năng lực nhận diện, bám bắt các mối đe dọa như tên lửa đạn đạo và máy bay tàng hình. Mỗi tổ hợp được cho là có giá khoảng 100 triệu USD. Chưa rõ Nga triển khai bao nhiêu tổ hợp Nebo-M ở bán đảo Crimea và các vùng lân cận, nhưng giới chuyên gia Mỹ cho rằng cuộc tập kích của Ukraine sẽ gây ảnh hưởng nghiêm trọng đến năng lực cảnh giới của Moskva tại khu vực. Phạm Giang(TheoWar Zone)","Thứ sáu, 4/7/2025, 10:10 (GMT+7)",Phạm Giang,Thế giới,Quân sự,VN Express,"Rạng sáng 2/7, Ukraine tuyên bố đã phá hủy ba thành phần quan trọng của tổ hợp radar Nebo-M của Nga ở Crimea bằng chiến thuật mới: triển khai drone mang đầu nổ từ xuồng không người lái. Theo một nhà phân tích Nga, chiến thuật này cho phép drone tấn công nhiều lần với đầu đạn nặng hơn và tầm bay xa hơn. Các chuyên gia nhận định cuộc tập kích này gây ảnh hưởng nghiêm trọng đến năng lực cảnh giới của Nga tại khu vực, trong khi Nga cũng tuyên bố phá hủy được xuồng không người lái của Ukraine."
VNEX_040725_00062,Sao nhí 'Chân Hoàn truyện' thành thiếu nữ,https://vnexpress.net/sao-nhi-chan-hoan-truyen-thanh-thieu-nu-4909979.html,"Ngày 4/7, loạt ảnh Tư Hàm thời bé và hiện tại được nhiều fan chia sẻ trên mạng xã hội, vào danh sách chủ đề được quan tâm nhấtWeibo. Nhiều người cho biết bất ngờ vì bé gái 4 tuổi lớn nhanh, trở thành thiếu nữ. Ngày 4/7, loạt ảnh Tư Hàm thời bé và hiện tại được nhiều fan chia sẻ trên mạng xã hội, vào danh sách chủ đề được quan tâm nhấtWeibo. Nhiều người cho biết bất ngờ vì bé gái 4 tuổi lớn nhanh, trở thành thiếu nữ. Kỷ Tư Hàm trong ""Chân Hoàn truyện""Kỷ Tư Hàm trongChân Hoàn truyện, phim truyền hình gây tiếng vang năm 2012, Tư Hàm vào vai Ôn Nghi, nhị công chúa của vua Ung Chính. Video:Bilibili Thời bé, Kỷ Tư Hàm đóng khoảng 20 phim điện ảnh, truyền hình, cô còn lưu dấu ấn với vai con gái Triệu Vy ở phimMẹ hổ bố mèo(2015). Thời bé, Kỷ Tư Hàm đóng khoảng 20 phim điện ảnh, truyền hình, cô còn lưu dấu ấn với vai con gái Triệu Vy ở phimMẹ hổ bố mèo(2015). Kỷ Tư Hàm thời bé và hiện tại, 18 tuổi, nữ sinh trung học. Kỷ Tư Hàm thời bé và hiện tại, 18 tuổi, nữ sinh trung học. Cô sinh ở Bắc Kinh, đóng quảng cáo từ khi hai tuổi, đóng vai nhỏ ở các phim truyền hình từ năm lên ba. Cô sinh ở Bắc Kinh, đóng quảng cáo từ khi hai tuổi, đóng vai nhỏ ở các phim truyền hình từ năm lên ba. TheoSina, vẻ dễ thương, tinh nghịch của Kỷ Tư Hàm thời bé lưu dấu ấn sâu đậm với khán giả, trước đây làng giải trí lan truyền câu ""chờ Kỷ Tư Hàm trưởng thành để xem cô ấy đóng phim"". TheoSina, vẻ dễ thương, tinh nghịch của Kỷ Tư Hàm thời bé lưu dấu ấn sâu đậm với khán giả, trước đây làng giải trí lan truyền câu ""chờ Kỷ Tư Hàm trưởng thành để xem cô ấy đóng phim"". Từ năm 10 tuổi, cha mẹ Tư Hàm hạn chế con tham gia diễn xuất, làm người mẫu, để cô bé tập trung việc học. Từ năm 10 tuổi, cha mẹ Tư Hàm hạn chế con tham gia diễn xuất, làm người mẫu, để cô bé tập trung việc học. Ngoài các môn văn hóa ở trường, Kỷ Tư Hàm theo học bài bản vũ đạo, piano và mỹ thuật. Ngoài các môn văn hóa ở trường, Kỷ Tư Hàm theo học bài bản vũ đạo, piano và mỹ thuật. Thi thoảng, nữ sinh đăng trên trang cá nhân ảnh ở trường, đi chơi. Thi thoảng, nữ sinh đăng trên trang cá nhân ảnh ở trường, đi chơi. Dù không đóng phim nhiều năm qua, hầu như không tham gia sự kiện giải trí, Kỷ Tư Hàm có các fan gắn bó với cô. Hội fan của diễn viên duy trì hoạt động 9 năm. Dù không đóng phim nhiều năm qua, hầu như không tham gia sự kiện giải trí, Kỷ Tư Hàm có các fan gắn bó với cô. Hội fan của diễn viên duy trì hoạt động 9 năm. Tài khoảnWeibocủa nữ sinh thu hút hơn hai triệu người theo dõi. Tài khoảnWeibocủa nữ sinh thu hút hơn hai triệu người theo dõi. Loạt ảnh Kỷ Tư Hàm chụp mùa đông năm ngoái được nhiều khán giả nhận xét lãng mạn, ngọt ngào. Loạt ảnh Kỷ Tư Hàm chụp mùa đông năm ngoái được nhiều khán giả nhận xét lãng mạn, ngọt ngào. Tư Hàm thường phối trang phục đơn giản với quần jeans, crop-top, chân váy maxi. Tư Hàm thường phối trang phục đơn giản với quần jeans, crop-top, chân váy maxi. Như AnhẢnh:Weibo","Thứ sáu, 4/7/2025, 10:35 (GMT+7)",Unknown,Giải trí,Giới sao,VN Express,"Loạt ảnh so sánh hình ảnh thời bé và hiện tại của Kỷ Tư Hàm, diễn viên nhí nổi tiếng trong ""Chân Hoàn truyện"", đã gây sốt trên mạng xã hội Weibo. Khán giả bất ngờ trước sự trưởng thành của cô bé, từng được yêu mến nhờ vẻ ngoài dễ thương và tài năng diễn xuất từ nhỏ. Dù cha mẹ hạn chế hoạt động nghệ thuật để cô tập trung học tập, Kỷ Tư Hàm vẫn có lượng fan đông đảo và duy trì sức hút trên mạng xã hội nhờ hình ảnh đời thường giản dị."
VNEX_040725_00003,Mỹ điều 200 lính thủy đánh bộ đến Florida hỗ trợ kiểm soát nhập cư,https://vnexpress.net/my-dieu-200-linh-thuy-danh-bo-den-florida-ho-tro-kiem-soat-nhap-cu-4909898.html,"Quân đội Mỹ ngày 3/7 cho biết đây là đợt triển khai đầu tiên của Bộ Tư lệnh phía Bắc (USNORTHCOM) trong số nhiều đợt đã được Bộ An ninh Nội địa yêu cầu nhằm hỗ trợ Cơ quan Thực thi Di trú và Hải quan (ICE) tiến hành chiến dịch trấn áp người di cư bất hợp pháp. Bộ trưởng Quốc phòng Pete Hegseth tháng trước phê duyệt kế hoạch huy động 700 binh sĩ để hỗ trợ ICE ở các bang Florida, Louisiana và Texas. ""Quân nhân được triển khai lần này sẽ chỉ thực hiện các nhiệm vụ không liên quan hành pháp trong các cơ sở của ICE. Vai trò của họ tập trung vào nhiệm vụ hành chính và hậu cần. Họ không được tiếp xúc trực tiếp với những cá nhân đang bị ICE giam và cũng không tham gia vào bất cứ khía cạnh nào của quy trình giam giữ"", USNORTHCOM cho hay. Theo quy định của Mỹ, quân đội không được phép tham gia nhiệm vụ hành pháp, trừ khi Tổng thống kích hoạt Đạo luật Nổi loạn năm 1807. Ông Trump chưa thực hiện động thái như vậy. Lính thủy quân lục chiến Mỹ tại thành phố Los Angeles, bang California ngày 22/6. Ảnh:AFP Tricia McLaughlin, trợ lý Bộ trưởng An ninh Nội địa, cho biết lính thủy quân lục chiến ""sẽ được huấn luyện và sẵn sàng hỗ trợ quy trình nhập cư tại các địa điểm trên khắp Florida, phù hợp với cách tiếp cận của chính phủ nhằm thực hiện nhiệm vụ của Tổng thống Donald Trump đối với người dân Mỹ là loại bỏ các mối đe dọa an toàn công cộng"". Trấn áp người di cư trái phép là ưu tiên hàng đầu trong nhiệm kỳ thứ hai của Tổng thống Trump. Đầu tuần này, người đứng đầu Nhà Trắng đã đi thăm trung tâm giam người nhập cư mới ở Florida có biệt danh ""nhà tù cá sấu Alcatraz"". Cơ sở này có thể giam tới 1.000 người. Việc điều lính thủy đánh bộ đến Florida diễn ra một tháng sau khi ông Trump điều động 4.000 lính Vệ binh Quốc gia và 700 lính thủy đánh bộ đến Los Angeles, bang California để ứng phó các cuộc biểu tình phản đối chiến dịch truy quét người nhập cư do ICE tiến hành. Giới chức California phản đối gay gắt động thái của Tổng thống Trump, cho rằng điều này chỉ làm leo thang các cuộc biểu tình mà lực lượng hành pháp địa phương vốn có thể ứng phó được. Trong khi đó, chính quyền Trump khẳng định việc triển khai là cần thiết để dập tắt tình trạng bất ổn và bảo vệ tài sản cũng như nhân lực liên bang. California đã kiện chính quyền Trump về việc triển khai Vệ binh Quốc gia, nhưng một tòa phúc thẩm liên bang đã ra phán quyết ban đầu rằng Tổng thống đã hành động trong phạm vi thẩm quyền hợp pháp của mình. Huyền Lê(TheoAFP,Reuters, CBS News)","Thứ sáu, 4/7/2025, 09:00 (GMT+7)",Huyền Lê,Thế giới,Quân sự,VN Express,"Quân đội Mỹ, thông qua USNORTHCOM, đã triển khai 700 binh sĩ đến Florida, Louisiana và Texas để hỗ trợ ICE trong chiến dịch trấn áp người di cư bất hợp pháp, nhưng chỉ thực hiện các nhiệm vụ hành chính và hậu cần, không liên quan đến hành pháp hoặc tiếp xúc trực tiếp với người bị giam giữ. Việc triển khai này diễn ra trong bối cảnh chính quyền Trump tăng cường các biện pháp chống người di cư trái phép, bao gồm cả việc điều động quân đội đến các khu vực có biểu tình phản đối. Tuy nhiên, việc sử dụng quân đội cho các nhiệm vụ này đã gây ra tranh cãi, với các quan chức California phản đối việc điều động quân đội và cho rằng lực lượng hành pháp địa phương có thể tự giải quyết tình hình."
