id,title,link,content,date,author,category,sub_category,source,summary
VNEX_021025_00004,"Ba ngày sau vụ sập trường Indonesia, 59 người vẫn kẹt dưới đống đổ nát",https://vnexpress.net/ba-ngay-sau-vu-sap-truong-indonesia-59-nguoi-van-ket-duoi-dong-do-nat-4946232.html,"""Theo dữ liệu được cập nhật tới 23h ngày 1/10, 59 người vẫn còn mắc kẹt dưới đống đổ nát"", ông Abdul Muhari, phát ngôn viên cơ quan ứng phó thảm họa Indonesia, cho biết ngày 2/10, thêm rằng sẽ tiếp tục cập nhật con số vì có một số người sống sót trong sự việc vẫn chưa xác nhận với chính quyền. Tòa nhà tại trường nội trú Hồi giáo Al Khoziny ở Đông Java, Indonesia, đổ sập ngày 29/9, trong lúc học sinh đang cầu nguyện. Các nạn nhân chủ yếu là nam sinh từ 12 đến 17 tuổi. Ít nhất 5 người thiệt mạng. Lực lượng cứu hộ cứu nạn tại đống đổ nát của vụ sập trường ở Đông Java, Indonesia, ngày 1/10. Ảnh:AFP Tối 1/10, lực lượng cứu hộ thông báo đã cứu được 5 người còn sống dưới đống đổ nát. Hàng chục phụ huynh vẫn ngày đêm túc trực ở hiện trường, mong sớm có thông tin về con mình, khi ""thời gian vàng"" 72 tiếng, khoảng thời gian con người nhiều khả năng sống sót dưới đống đổ nát, đã trôi qua. ""Chúng tôi tin rằng các con của mình vẫn còn sống. Chiến dịch giải cứu cần được đẩy nhanh. Chúng ta đang chạy đua với thời gian"", anh Abdul Hanan, 45 tuổi, có cậu con trai 14 tuổi vẫn chưa rõ tung tích, nói. ""Tôi đã ở đây nhiều ngày. Tôi cứ bật khóc khi nghĩ về con. Tới nay tôi vẫn chưa nhận được thông tin nào, chỉ biết chờ đợi"", Dewi Sulistiana, mẹ của một học sinh 14 tuổi, nói. Cùng với nỗ lực giải cứu, chính quyền Indonesia cũng đang điều tra nguyên nhân vụ sập trường. Các dấu hiệu ban đầu cho thấy công trình này dường như có vấn đề về kết cấu, không đáp ứng tiêu chuẩn xây dựng. Trong tháng này, một tòa nhà ở Tây Java cũng bị sập trong lúc đang tổ chức cầu nguyện, khiến ít nhất ba người thiệt mạng và hàng chục người bị thương. Ngọc Ánh(TheoAFP)","Thứ năm, 2/10/2025, 09:46 (GMT+7)",Ngọc Ánh,Thế giới,,VN Express,
VNEX_021025_00007,Tương quan sức mạnh tàu sân bay Trung Quốc - Mỹ,https://vnexpress.net/tuong-quan-suc-manh-tau-san-bay-trung-quoc-my-4946148.html,Đồ họa:Minh Thu Đồ họa:Minh Thu,"Thứ năm, 2/10/2025, 08:00 (GMT+7)",Minh Thu,Thế giới,Quân sự,VN Express,
VNEX_021025_00061,7 bất thường ở móng tay cảnh báo bệnh nguy hiểm,https://vnexpress.net/7-bat-thuong-o-mong-tay-canh-bao-benh-nguy-hiem-4943175.html,"Móng tay tiết lộ nhiều vấn đề liên quan đến sức khỏe của con người. Khi móng tay có những biểu hiện bất thường, cần phải đặc biệt chú ý. Nhận thức về sức khỏe của móng tay có thể cho bạn một cảnh báo sớm về một vấn đề nghiêm trọng của cơ thể, như sau: Đường Beau Đây là những vết lõm hoặc đường nằm ngang chạy qua móng tay. Chúng thường xuất hiện khi cơ thể đang đối diện với căng thẳng lớn, chẳng hạn sốt cao, phẫu thuật hay ốm nặng. Nếu xuất hiện dấu hiệu này mà không nhớ từng mắc bệnh gần đây, cần nhanh chóng đến gặp bác sĩ. Nghiên cứu trên tạp chí Y học Quốc tế (QJM) năm 2017 giải thích rằng đường Beau cho thấy sự tạm ngưng phát triển của móng sau khi cơ thể chịu áp lực toàn thân. Móng tay thìa Dạng móng mỏng, lõm xuống, gần giống một cái muỗng. Nguyên nhân thường liên quan đến thiếu máu do thiếu sắt. Xét nghiệm máu đơn giản có thể xác nhận tình trạng này. Theo nghiên cứu vào năm 2023 bởi công ty cung cấp các tài nguyên y tế giáo dục trực tuyến StatPearls, móng tay thìa là dấu hiệu của bệnh thiếu máu do thiếu sắt hoặc bệnh lý toàn thân. Hội chứng móng tay vàng Móng mọc chậm, dày, có màu vàng thường do nấm. Nhưng nếu đi kèm với sưng tấy hoặc khó thở, nó có thể là hội chứng móng tay vàng. Trong bài tổng quan của tạp chí khoa học về bệnh hiếm Orphanet năm 2017 đã công bố ""móng tay vàng đi kèm bệnh phù bạch huyết và bệnh hô hấp"". Móng dày, dễ gãy Móng dày, dễ gãy hoặc đổi màu (vàng, nâu, hay trắng) do tác nhân chủ yếu là nấm Onychomycosis và thường thấy ở móng chân hơn. Nhiễm nấm móng không tự khỏi, cần được kiểm tra và điều trị. Theo tổng quan năm 2020 trên tạp chí Khoa học Quốc tế, các nhà nghiên cứu đã nhận định nấm móng không điều trị có thể gây ra những cơn đau, nhiễm trùng thứ phát và giảm khả năng vận động. Ngón tay có đường Beau (Beau’s line) ở người bị bệnh tiểu đường. Ảnh:Lynn McCleary Xuất huyết dằm Xuất huyết dằm là vệt màu nâu hoặc đỏ xuất hiện dưới móng, như những mảnh dằm, xảy ra do chấn thương nhẹ. Nhưng nhiều vệt thường liên quan các bệnh như nhiễm trùng tim hay mạch vành ba nhánh. Trong trường hợp kèm với sốt cao hay mệt mỏi, cần gặp bác sĩ. Đánh giá tổng quan năm 2022 của tạp chí Da liễu Quốc tế đã giải thích rằng xuất huyết dạng dằm có thể biểu thị bệnh lý toàn thân, bao gồm viêm nội tâm mạc nhiễm khuẩn hay viêm mạch máu. Sọc đen dọc móng tay Sọc nâu hoặc đen chạy dọc theo móng, thường vô hại. Tuy nhiên, ở người trưởng thành, sự xuất hiện của sọc mới có thể là dấu hiệu ung thư da dưới móng (u hắc tố dưới móng). Nếu thấy có một sọc sẫm màu mới, hãy đến gặp bác sĩ da liễu. Đánh giá tổng quan năm 2014 của tạp chí Viện hàn lâm Da liễu và bệnh hoa liễu châu Âu cảnh báo rằng chẩn đoán sai làm chậm trễ việc điều trị kịp thời, vốn có thể cứu sống người bệnh. Móng dùi trống Tình trạng móng phình to, các móng cong xuống. Thỉnh thoảng, kèm theo một dải màu hồng nhỏ ở phần đầu. Đây có thể là dấu hiệu bệnh phổi, tim, còn móng tay Terry thường liên quan đến bệnh gan. Móng tay dùi trống, móng trắng là những tín hiệu cảnh báo nghiêm trọng, không nên bỏ qua. Năm 2017, một đánh giá tổng quan ở các phòng khám chuyên khoa gan (Clinics in Liver Disease) cho thấy móng Terry liên quan đến xơ gan. Mặc khác, một nghiên cứu năm 2022 trên StatPearls (công ty cung cấp tài nguyên y tế trực tuyến) đã chia sẻ móng dùi trống hay gặp nhất ở bệnh lý phổi, tim mạch. Thường xuyên tự kiểm tra sức khỏe và đi khám bệnh kịp thời khi nhận thấy 7 thay đổi trên giúp chẩn đoán sớm và điều trị hiệu quả. Hương Giang(TheoTimes of India)","Thứ năm, 2/10/2025, 02:00 (GMT+7)",Hương Giang,Sức khỏe,Các bệnh,VN Express,
VNEX_021025_00069,U màng não gây rối loạn tiền đình,https://vnexpress.net/u-mang-nao-gay-roi-loan-tien-dinh-4946194.html,"ThS.BS.CKII Phạm Thái Duy, Trung tâm Tai Mũi Họng, Bệnh viện Đa khoa Tâm Anh TP HCM, cho biết người bệnh bị suy giảm thính lực không phải do thủng nhĩ hay viêm tai thông thường, kết quả đo chức năng tiền đình cho thấy phản xạ mắt - tiền đình giảm. Kiểm tra rung giật nhãn cầu ghi nhận bệnh nhân suy giảm nặng chức năng tiền đình một bên, cả trung ương và ngoại biên, gợi ý tình trạng tổn thương ở vùng tiền đình trong tai (tiền đình ngoại biên) và tiền đình trung ương (ở não - tiểu não - hành não), rối loạn vận nhãn trung ương. Chị Nga nghe kém hỗn hợp, vừa nghe kém dẫn truyền và nghe kém tiếp nhận. Theo bác sĩ Duy, thông thường, người mắc bệnh lý tai ngoài hoặc tai giữa thì chỉ nghe kém dẫn truyền. Còn người bệnh nghe kém tiếp nhận nặng kèm ù tai, choáng váng, mất thăng bằng, có thể do tổn thương sâu hơn ở dây thần kinh thính giác hoặc vùng não bộ liên quan. Bác sĩ Duy kiểm tra chức năng tiền đình cho chị Nga. Ảnh: Bệnh viện Đa khoa Tâm Anh Bác sĩ Duy chỉ định chụp CT loại trừ khả năng người bệnh xốp xơ tai. Xét nghiệm hình ảnh, chụp cộng hưởng từ (MRI) sọ não phát hiện bệnh nhân có tổn thương choán chỗ góc cầu tiểu não trái nghi u màng não, kích thước 24x44x33 mm. Khối u đè đẩy cầu não, tiểu não trái, phù não kế cận, não thất 4 lệch sang phải, đè ép khả năng teo dây 5 trái. Tổn thương đã lan vào ống tai trong trái, thay đổi toàn bộ chiều dài ống tai trong và lan vào khoang Meckel (một ngăn nhỏ trong sọ chứa hạch của dây thần kinh cảm giác chính ở vùng mặt) bên trái khoảng 4.5 mm. ThS.BS.CKII Chu Tấn Sĩ, Trưởng Khoa Phẫu thuật Thần kinh, Trung tâm Khoa học Thần kinh, Bệnh viện Đa khoa Tâm Anh TP HCM, đánh giá tổn thương do u màng não đã lan vào ống tai trái khiến bệnh nhân ngày càng nghe kém. Nếu không phẫu thuật, u phát triển sẽ chèn ép não và dây thần kinh có thể gây đau đầu, giảm thị lực,yếu liệt tay chân, ảnh hưởng tính mạng. Bác sĩ chỉ định phẫu thuật u nội sọ, vòm đại não không xâm lấn xoang tĩnh mạch, bằng đường mở nắp sọ để lấy khối u đang bám dính lều tiểu não. Bác sĩ Sĩ (giữa) cùng êkíp phẫu thuật cho chị Nga. Ảnh:Bệnh viện Đa khoa Tâm Anh Êkíp cắt gốc bám u và dùng máy Cusa đánh, hút từng phần khối u, không làm tổn thương các cấu trúc thần kinh xung quanh, cầm máu kỹ, bảo tồn tối đa dây thần kinh và mạch máu xung quanh. Sau cùng đóng vết mổ, vá kín màng cứng, đặt lại nắp sọ, khâu da từng lớp. Hậu phẫu, chị Nga hồi phục tốt, xuất viện sau 4 ngày. Tái khám sau 7 ngày, sức khỏe người bệnh ổn định, không ghi nhận dấu hiệu bất thường, giảm triệu chứng ù tai,nghe kém, choáng váng. Hai tháng sau phẫu thuật, các triệu chứng này hết hẳn. Sau phẫu thuật chị Nga cần tập vật lý trị liệu để cơ thể thích nghi và bù trừ chức năng tiền đình, lấy lại sự thăng bằng. Bác sĩ Duy lưu ý triệu chứngrối loạn tiền đìnhvà u não khá giống nhau nên khiến người bệnh nhầm lẫn, điều trị không đúng khiến bệnh kéo dài, diễn tiến nặng hơn. Trước đây, người bệnh thường được bác sĩ khám lâm sàng, khai thác bệnh sử, chẩn đoán dựa trên kinh nghiệm. Nhưng hiện nay, nhờ sự hỗ trợ của máy móc ứng dụng trí tuệ nhân tạo trong cả chẩn đoán và điều trị, giúp bác sĩ hiện sớm, chẩn đoán đúng và điều trị đúng hướng kịp thời, ngăn biến chứng. Khi có các triệu chứng kéo dài như đau đầu, ù tai, nghe kém, choáng váng, nôn ói, chóng mặt hay yếu, tê một phần cơ thể, người bệnh nên đến cơ sở y tế có trang thiết bị hiện đại để được khám, từ đó điều trị kịp thời ngăn biến chứng. Uyên Trinh * Tên bệnh nhân đã được thay đổi 20h ngày 2/10, Bệnh viện Đa khoa Tâm Anh TP HCM tổ chức tư vấn trực tuyến ""Ứng dụng trí tuệ nhân tạo (AI) chẩn đoán, điều trị rối loạn tiền đình và bệnh tai mũi họng"" phát trên fanpageVnExpress. Chương trình có sự tham gia của GS.TS.BS Trần Phan Chung Thủy, Giám đốc Trung tâm Tai Mũi Họng, TS.BS Lê Văn Tuấn, Giám đốc Trung tâm Khoa học Thần kinh, ThS.BS.CKI Trương Tấn Phát, Trưởng Chuyên khoa Tai Mũi Họng. Độc giả đặt câu hỏitại đâyđể được giải đáp.","Thứ năm, 2/10/2025, 08:00 (GMT+7)",Uyên Trinh,Sức khỏe,Các bệnh,VN Express,
VNEX_021025_00020,Người dẫn Champions League 'ảo' gây sốt,https://vnexpress.net/nguoi-dan-champions-league-ao-gay-sot-4946160.html,"Aksoy, được giới thiệu là người Thổ Nhĩ Kỳ, nhanh chóng thu hút hàng chục nghìn người hâm mộ khi xuất hiện với vai trò ""người dẫn chương trình Champions League"". Bức ảnh Eysan Aksoy, sản phẩm được tạo ra bằng trí tuệ nhân tạo, trong trường quay của Champions League. Ảnh:Instagram / eysanaksoytr Trong vòng 7 tháng, tài khoảnInstagramcủa Eysan Aksoy vượt mốc hơn 43.000 người theo dõi - con số mà nhiều nhà báo hay MC thể thao thực sự phải mơ ước. Dưới mỗi bức ảnh, nhiều người dùng để lại những lời khen ngợi tha thiết như ""Em đẹp tựa thiên thần"", ""Công chúa của trái tim anh, nữ hoàng của anh"" hay ""Nụ cười của em thật rực rỡ, Eysan tuyệt đẹp"". Một số người thậm chí bỏ ra hơn 1.000 USD mỗi tháng để truy cập ""nội dung 18+"" trên nền tảng trực tuyến cho phép người sáng tạo nội dung Patreon, dù tất cả đều được dựng bằng AI. Người sáng tạo bí ẩn của Eysan Aksoy thậm chí còn tính phí hơn 1.000 USD mỗi tháng cho nội dung 18+. Ảnh:Instagram / eysanaksoytr Dạo qua hơn 200 bài đăng, ""cuộc sống"" của Aksoy tràn ngập hình ảnh ở bãi biển, nhà hàng sang trọng, lớp học yoga, thậm chí là tạo dáng bên siêu xe. Vài tuần gần đây, nhân vật ảo này mới ""chuyển nghề"" sang lĩnh vực bóng đá, tung ra loạt ảnh giả lập trong trường quay và trên sân cỏ. Một trong những bài đăng gây tranh cãi nhất là khi Aksoy mặc áo của cả bốn CLB lớn Thổ Nhĩ Kỳ: Galatasaray, Fenerbahce, Besiktas và Trabzonspor - hành động được ví như mặc áo thi đấu của toàn bộ ""Big Six"" tạiNgoại hạng Anh. Điều đáng nói là trong phần mô tả tài khoản, Aksoy được ghi rõ là ""AI-generated model"", tức người mẫu được tạo ra bằng trí tuệ nhân tạo. Nhưng nhiều người hâm mộ không để tâm, hoặc cố tình bỏ qua. Với họ, sự hấp dẫn nằm ở những bức ảnh lung linh, những dòng trạng thái nóng bỏng và viễn cảnh lãng mạn mà họ tự vẽ ra. Hình ảnh khác của Eysan Aksoy trong lớp học. Ảnh:Instagram / eysanaksoytr Eysan Aksoy không phải trường hợp đầu tiên. Hè vừa qua, ""Mia Zelu"" - một ngôi sao mạng xã hội ảo khác - cũng gây chú ý với loạt bài đăng tại Wimbledon, thậm chí còn nhận được bình luận từ tuyển thủ cricket Ấn Độ Rishabh Pant. Việc xây dựng nhân vật AI với ngoại hình hoàn hảo, đời sống hào nhoáng và khả năng tương tác cao đang trở thành xu hướng. Người theo dõi vừa được thỏa mãn trí tưởng tượng, vừa giúp chủ nhân tài khoản - kẻ đứng sau màn hình - thu lợi lớn. ""Với tốc độ phát triển của công nghệ trí tuệ nhân tạo, những nhân vật như Eysan Aksoy có thể sẽ còn xuất hiện nhiều hơn, len lỏi từ thể thao, âm nhạc đến thời trang. Và câu hỏi đặt ra là: bao nhiêu người sẽ còn sẵn sàng 'trao tim' cho một người không hề tồn tại ngoài đời thực?"", báo AnhSportmailbình luận. Hồng Duy(theoDaily Mail)","Thứ năm, 2/10/2025, 00:00 (GMT+7)",Hồng Duy,Thể thao,Hậu trường,VN Express,
VNEX_021025_00018,Enrique: 'Thật sáo rỗng khi Barca thua và đổ lỗi cho thể lực',https://vnexpress.net/enrique-that-sao-rong-khi-barca-thua-va-do-loi-cho-the-luc-4946185.html,"Trên sân Montjuic, Barca chỉ mất 19 phút để mở tỷ số, với tình huống Marcus Rashford chọc khe cho Ferran Torres đệm bóng. Tuy nhiên, PSG chơi hay hơn sau bàn thua. Phút 38, sau pha đột phá cánh trái, Nuno Mendes chuyền cho Senny Mayulu gỡ hòa. PSG không chỉ kiểm soát bóng tốt hơn (54% so với 46%), mà còn dứt điểm (15-12) và dứt điểm trúng đích nhiều hơn (7-3). Phút 90, sau pha phản công bên cánh phải, Achraf Hakimi tạt cho Goncalo Ramos ấn định chiến thắng 2-1 cho nhà đương kim vô địch. Sau trận đấu, HLV Barca, Hansi Flick nói về sự mệt mỏi của các cầu thủ, còn hậu vệ Jules Kounde cho rằng PSG thắng nhờ thể lực tốt hơn. Tuy nhiên, Tuy nhiên, Enrique không đồng tình. Ông nhắc lại việc PSG phải thi đấu ở Club World Cup từ tháng 6 đến giữa tháng 7. Sau đó, nhà ĐKVĐ Champions League chỉ có hơn một tuần để chuẩn bị cho mùa giải mới, nên không thể tập và thi đấu tiền mùa giải nhiều như Barca và các đội khác. ""Chúng tôi là đội tập ít nhất châu Âu trong giai đoạn tiền mùa giải. Thật sáo rỗng khi thua và đổ lỗi cho thể lực"", Enrique nói sau trận. Nuno Mendes (phải) tranh bóng với Lamine Yamal trong trận Barca 1-2 PSG ở lượt hai vòng bảng Champions League tối 1/10. Ảnh:Reuters Về diễn biến, Enrique cho rằng PSG đã chơi một trận tuyệt vời. Ông mô tả 20 phút đầu diễn ra phức tạp, vì Barca có nhiều cầu thủ chất lượng và kiểm soát bóng tốt. Nhưng sang hiệp hai, PSG chơi hay hơn và xứng đáng thắng. ""Hai đội không thiên về tấn công, mà cố gắng gây khó khăn cho nhau bằng kiểm soát bóng"", Enrique nói thêm. ""Đối đầu với Barca luôn là một thử thách"". Trận này, PSG vắng cả Ousmane Dembele, Desire Doue và Khvicha Kvaratskhelia, ba tiền đạo đá chính trận chung kết mùa trước, do chấn thương. Tuy nhiên, các cầu thủ chơi thay đều thể hiện tốt. Mayulu gỡ hòa, còn Ramos ấn định chiến thắng sau khi vào sân thay người. Enriquehài lòng vì các cầu thủ ít thi đấu đều đáp ứng hệ thống chiến thuật. Ông không còn lo khi đội bóng gặp nhiều chấn thương hay phải xoay tua đội hình. Về Mayulu, tiền đạo 19 tuổi đang tiến bộ qua từng trận, HLV củaPSGkhen thêm: ""Cậu ấy có rất nhiều phẩm chất, có thể chơi tốt cả trong lẫn ngoài vòng cấm. Tôi thật may mắn khi có cậu ấy. Rồi bạn sẽ biết cậu ấy là ai"". Mùa này, PSG vàBarcatiếp tục là ứng cử viên sáng giá cho chức vô địch. Theo Enrique, việc thắng trên sân một đối thủ cạnh tranh như Barca sẽ tiếp thêm tự tin cho đội bóng của ông. Thanh Quý(theoAS)","Thứ năm, 2/10/2025, 07:47 (GMT+7)",Thanh Quý,Thể thao,Bóng đá,VN Express,
VNEX_021025_00014,Arsenal nối dài mạch thắng ở vòng bảng Champions League,https://vnexpress.net/arsenal-noi-dai-mach-thang-o-vong-bang-champions-league-4946179.html,"Nếu chỉ tính riêng tại sân nhà, Arsenal toàn thắng cả 8 trận ở vòng bảng Champions League gần nhất mà không để lọt lưới bàn nào. Nếu tính cả vòng bảng Europa League trong giai đoạn đầu nhiệm kỳ của Mikel Arteta, con số này là 14 trận toàn thắng và chỉ thủng lưới hai bàn. Saka (đỏ) mừng bàn ấn định chiến thắng 2-0, trên sân Emirates, London, Anh hôm 1/10. Ảnh:Reuters Olympiakos cũng mang đến Emirates một thống kê đáng kinh ngạc, khi họ đã thắng cả 3 lần gần nhất làm khách tại đây, trong đó hai lần gần nhất là ở vòng knock-out Europa League. Lần gần nhất Arsenal không thắng một trận vòng bảng cup châu Âu trên sân nhà đã là từ tháng 11/2019. Thất bại trước Frankfurt ở Europa League năm đó dẫn đến việc Unai Emery bị sa thải, Freddie Ljungberg tạm quyền rồi Mikel Arteta lên nắm đội. Trận châu Âu đầu tiên của Arteta khi đó cũng là gặp Olympiakos ở vòng 1/16, nơi Arsenal bị loại bởi bàn thua ở hiệp phụ lượt về ngay tại Emirates do luật bàn thắng sân khách. Đại diện Hy Lạp không thể nối dài mạch trận khó tin tại Emirates. Arsenal, với sức mạnh và chiều sâu đội hình vượt trội, thắng 2-0 dù Olympiakos năm nay cũng là một phiên bản đáng gờm. Trận đấu trở nên căng thẳng hơn những gì các CĐV chủ nhà mong muốn, khi đội khách dồn ép ở cuối trận và tạo ra một vài pha bóng khiến khán giả thót tim. Nhưng đây là một tập thể Arsenal rất khó bị xuyên thủng. Mùa giải đã bước sang tháng 10 mà họ mới chỉ để lọt lưới 3 bàn trên mọi đấu trường, và chỉ một trong số đó đến từ tình huống bóng sống. HLVMikel Artetathay 6 vị trí đá chính so với trận thắng Newcastle cuối tuần qua, và hai trong số những cầu thủ mới phối hợp tạo ra cơ hội ghi bàn ngay đầu trận. Myles Lewis-Skelly tạt đẹp cho Gabriel Martinelli, nhưng cầu thủ Brazil lại đưa bóng đi chệch khung thành. May mắn cho Martinelli, cơ hội tiếp theo gần như không thể bỏ lỡ. Anh dễ dàng đệm bóng vào lưới ở sát vạch cầu môn sau khi cú sút ban đầu của Viktor Gyokeres bật cột dọc. Martinelli đệm bóng cận thành mở tỷ số, trên sân Emirates, London, Anh hôm 1/10. Ảnh:Reuters Tiền đạo Thụy Điển còn bỏ lỡ thêm một cơ hội ngon ăn khác trong hiệp một, khi anh cứa lòng đưa bóng đi vọt xà. Trận đấu không hoàn toàn nghiêng vềArsenal, bởi Olympiakos cũng có những cơ hội rõ ràng để gỡ hòa trước giờ nghỉ. Tình huống đáng chú ý nhất là cú vô-lê của Daniel Podence, buộc thủ môn David Raya phải trổ tài. Martin Odegaard, cầu thủ hay nhất trận, kiến tạo cho Leandro Trossard ở đầu hiệp hai. Nhưng cú sút cận thành của tiền đạo Bỉ bị thủ môn Konstantinos Tzolakis cản phá. Ngay sau đó, Olympiakos tưởng như đã có bàn gỡ hòa khi Chiquinho đá bồi thành công, nhưng bàn thắng không được công nhận vì Ayoub El Kaabi việt vị. Ông chủ củaOlympiakos, Evangelos Marinakis cũng có mặt trên khán đài, chỉ vài tuần sau khi chứng kiến một CLB khác của ông là Nottingham Forest thua 0-3 tại đây. Khu khán đài dành cho CĐV khách thì vẫn luôn cuồng nhiệt. Họ gõ trống, hát vang không ngớt. Olympiakos vốn được xem là có một trong những hội CĐV cuồng nhiệt nhất châu Âu. Nhưng đội bóng Hy Lạp không thể đáp lại tinh thần ấy bằng một bàn thắng, thậm chí họ còn thua thêm. Arsenal nâng tỷ số nhờ côngBukayo Sakatrong thời gian bù, khi cầu thủ vào sân thay người sút bóng ""xâu kim"" thủ môn Tzolakis. Olympiakos thi đấu đầy nỗ lực, nhưng cuối cùng vẫn phải nhận thất bại thứ 11 liên tiếp trên sân khách ở vòng bảng Champions League. Đại diện Hy Lạp mới có một điểm sau hai lượt trận đầu mùa này, còn Arsenal là một trong 6 đội toàn thắng tại giải. Vy Anh","Thứ năm, 2/10/2025, 05:09 (GMT+7)",Vy Anh,Thể thao,Bóng đá,VN Express,
