id,title,link,content,date,author,category,sub_category,source,summary
VNEX_050925_00020,Nagelsmann dọa gạt bỏ hàng loạt ngôi sao tuyển Đức,https://vnexpress.net/nagelsmann-doa-gat-bo-hang-loat-ngoi-sao-tuyen-duc-4935265.html,"""Tôi không muốn nghe đến từ chất lượng nữa, điều quan trọng là cảm xúc"", Nagelsmann nói sau trận đấu tại sân Quốc gia của Slovakia ngày 4/9. ""Ngoài 2,3 cầu thủ chấn thương, chúng tôi đã chọn ra những cầu thủ giỏi nhất, nhưng có lẽ cần dùng những người ít tên tuổi hơn nếu họ sẵn sàng cống hiến hết mình. Khi đó, kết quả có thể đã khác"". Julian Nagelsmann phản ứng trong trận Đức thua Slovakia 0-2 ở vòng loại World Cup 2026 khu vực châu Âu tại Bratislava, Slovakia ngày 4/9/2025. Ảnh:DPA Trận này, Nagelsmann xếp hàng loạt ngôi sao đá chính, gồmtân binh 105 triệu USDcủa Newcastle Nick Woltemade, tiền vệ vừa cập bến Liverpool vớitổng phí 170 triệu USDFlorian Wirtz, các cầu thủ của Bayern là Leon Goretzka, Serge Gnabry, Joshua Kimmich, Jonathan Tah hay trung vệ Real Madrid Antonio Rudiger. Nhưng, họ chơi thiếu hiệu quả, vànhận thất bại 0-2. Đây là trận thua đầu tiên của Đức trên sân khách ở vòng loại World Cup, sau chuỗi 52 trận bất bại. Họ còn chịu kỷ lục buồn với chuỗi ba thất bại liên tiếp ở các giải chính thức - điều chưa từng xảy ra trong 117 năm. Trước đó, trong dịp FIFA Days hồi tháng 6, Đứcthua Bồ Đào Nha 1-2ở bán kết rồithua Pháp 0-2ở trận tranh giải Ba Nations League. Nagelsmanncho rằng các cầu thủ Đức đáng ra phải nhập cuộc như chơi một trận bán kết Champions League, thay vì thi đấu với ""phanh tay kéo lên"". Ông nhấn mạnh thất bại này là lời cảnh tỉnh rằng nếu thiếu tinh thần chiến đấu, đội bóng có thể khép lại giấc mơ World Cup ngay từ đầu. ""Tại sao ở Cup Quốc gia, một CLB hạng Ba như Wehen Wiesbadencó thể gỡ hòa 2-2 trước Bayern? Không phải vì chất lượng cầu thủ, mà bởi sự quyết liệt và cảm xúc"", HLV 38 tuổi lấy dẫn chứng. Joshua Kimmich (trái) đi bóng trước sự truy cản của Milan Skriniar. Ảnh:DFB Các tuyển thủ Đức cũng thừa nhận thi đấu dưới sức. ""Bắt đầu trận đấu đã tệ, mọi yếu tố quan trọng đều thiếu"", thủ quânJoshua Kimmichbày tỏ. ""Đây không phải chuyện hệ thống hay chiến thuật, mà là vấn đề thái độ. Nếu cứ chơi như hôm nay, sẽ chẳng có vé dự World Cup nào"". Thủ môn Oliver Baumann cho rằng Đức thua thiệt về mặt tranh chấp, thi đấu thiếu sự chắc chắn, gắn kết và phung phí cơ hội. Trung vệ Jonathan Tah thì thừa nhận đội nhà thiếu sự kiểm soát, cả khi có và không có bóng, và đáng nhận thất bại. ""Đây là màn trình diễn kém xa kỳ vọng. Chúng tôi phải nghiêm túc nhìn lại và làm tốt hơn ở trận tới"", anh nói. Ở trận còn lại của bảng A, Bắc Ireland thắng 3-1 trên sân của Luxembourg. Ở lượt tiếp theo ngày 7/9, Đức trở về sân nhà gặp Bắc Ireland, còn Slovakia đấu Luxembourg. Hồng Duytổng hợp","Thứ sáu, 5/9/2025, 08:24 (GMT+7)",Hồng Duy,Thể thao,Bóng đá,VN Express,"Sau trận thua 0-2 trước Slovakia, HLV Nagelsmann thất vọng cho rằng đội tuyển Đức thiếu tinh thần chiến đấu và cảm xúc, dù sở hữu nhiều ngôi sao. Ông nhấn mạnh rằng thái độ thi đấu quan trọng hơn chất lượng cầu thủ và cảnh báo về nguy cơ lỡ World Cup nếu không cải thiện. Các cầu thủ Đức cũng thừa nhận thi đấu dưới sức và thiếu thái độ cần thiết."
VNEX_050925_00078,Xe đầu kéo đâm bay xe cảnh sát ở trạm thu phí,https://vnexpress.net/xe-dau-keo-dam-bay-xe-canh-sat-o-tram-thu-phi-4934923.html,"Video:Anadolu Ajansı Gần tới trạm thu phí ở Cekmekoy, hôm 28/8, nhưng xe tải không có dấu hiệu giảm tốc độ. Sau khi đâm vào rào chắn, xe sượt qua một bốt thu phí và chệch sang phải, lao thẳng đến xe cảnh sát đang đỗ ngay phía trước. Một số cảnh sát vội bỏ chạy khi nhận ra nguy hiểm. Xe tải ngay sau đó húc bay chiếc xe đang làm nhiệm vụ xuống lề đường. Tai nạn khiến 5 người bị thương, gồm hai cảnh sát, hai người trên xe tải và một người dân địa phương. May mắn thương tích của cả 5 nạn nhân đều không nguy hiểm đến tính mạng. Bộ trưởng Nội vụ Thổ Nhĩ Kỳ Ali Yerlikaya chia sẻ một bài đăng liên quan đến vụ tai nạn, cho biết tài xế xe tải đã bị bắt giữ. Xét nghiệm cho thấy tài xế này lái xe dưới ảnh hưởng của chất kích thích. Mỹ Anh(theoAnadolu Ajansı)","Thứ sáu, 5/9/2025, 04:00 (GMT+7)",Mỹ Anh,Xe,Thị trường,VN Express,"Ngày 28/8, một xe tải không giảm tốc độ đã đâm vào trạm thu phí ở Cekmekoy, Thổ Nhĩ Kỳ, húc bay một xe cảnh sát và gây tai nạn liên hoàn. Vụ việc khiến 5 người bị thương nhẹ, bao gồm hai cảnh sát. Tài xế xe tải đã bị bắt giữ sau khi xét nghiệm cho thấy lái xe dưới ảnh hưởng của chất kích thích."
VNEX_050925_00085,Xe máy lao vào đuôi xe buýt như bịt mắt,https://vnexpress.net/xe-may-lao-vao-duoi-xe-buyt-nhu-bit-mat-4935267.html,"Video:Li Don Tình huống giao thông:Chiếc xe buýt táp vào lề đường để đón trả khách, lúc này phía sau một xe máy chở một nam một nữ không có dấu hiệu giảm tốc độ mà lao thẳng vào đuôi xe buýt. Cú đâm khá mạnh khiến cả hai người đi xe máy bị hất ngược ngã lăn ra đường. Chưa rõ thương vong. Kỹ năng lái xe:Người điều khiển phương tiện khi di chuyển trên đường cần tập trung quan sát, không vì mải làm việc riêng gây mất an toàn cho bản thân và những người đi đường khác. Nguyên Vũ","Thứ sáu, 5/9/2025, 08:57 (GMT+7)",Nguyên Vũ,Xe,Diễn đàn,VN Express,"Video ghi lại cảnh một xe máy chở hai người đâm mạnh vào đuôi xe buýt đang dừng đón trả khách do không giảm tốc độ. Vụ va chạm khiến cả hai người trên xe máy ngã ra đường, chưa rõ tình trạng thương vong. Bài học rút ra là người tham gia giao thông cần tập trung quan sát, tránh xao nhãng để đảm bảo an toàn cho bản thân và người khác."
VNEX_050925_00013,HSBC: Chứng khoán có thể hút hơn 10 tỷ USD vốn ngoại khi nâng hạng,https://vnexpress.net/hsbc-chung-khoan-co-the-hut-hon-10-ty-usd-von-ngoai-khi-nang-hang-4935142.html,"Nhận định được bộ phận nghiên cứu đầu tư toàn cầu HSBC đưa ra trong báo cáo mới phát hành. Thị trường chứng khoán Việt sẽ được tổ chức FTSE xem xét nâng hạng từ thị trường cận biên lên thị trường mới nổi trong kỳ rà soát chỉ số thường niên vào 7/10. FTSE Russell là một trong ba công ty cung cấp chỉ số hàng đầu thế giới gồm MSCI, FTSE Russell và S&P Dow Jones Indices, tạo cơ sở tham chiếu cho các nhà đầu tư quốc tế. Việc nâng hạng đồng nghĩa thị trường Việt Nam được vào các chỉ số FTSE All-World, FTSE Asia và FTSE EM (một chỉ số chứng khoán quốc tế do tổ chức FTSE Russell cung cấp, theo dõi hiệu suất của cổ phiếu từ các thị trường mới nổi trên toàn cầu). Các quỹ thụ động tham chiếu theo chỉ số này sẽ mua cổ phiếu hoặcETF. Các quỹ chủ động có quyền tự quyết định. Theo kịch bản lạc quan nhất HSBC đưa ra, việc FTSE nâng hạng có thể hút tối đa 10,4 tỷ USD vốn ngoại vào thị trường chứng khoán Việt Nam. Tuy nhiên, HSBC lưu ý dòng vốn thực tế sẽ khiêm tốn và phân bổ theo từng giai đoạn. Bởi FTSE thường thông báo trước khoảng 6 tháng khi thay đổi phân loại một thị trường. Giao dịch tại công ty cổ phần chứng khoán Rồng Việt, TP HCM, tháng 10/2024. Ảnh:An Khương Dữ liệu này được HSBC đưa ra khi phân tích phần lớn quỹ chủ động ở châu Á (38%) và thị trường mới nổi (30%) đã nắm giữ cổ phiếu Việt Nam. Các quỹ châu Á hiện nắm trung bình 0,5% danh mục tại Việt Nam. Số quỹ chuyên đầu tư vào Việt Nam cũng tăng những năm gần đây. Hiện có hơn 100 quỹ, với tổng tài sản quản lý 11 tỷ USD, so với chỉ 17 quỹ nắm 3 tỷ USD hồi cuối 2014. Giả sử được nâng hạng với vốn hóa hiện tại, chứng khoán Việt sẽ chiếm khoảng 0,6% tỷ trọng trong FTSE Asia và 0,5% trong FTSE EM. Ở kịch bản này, khoảng 1,5 tỷ USD vốn ngoại chảy vào thông qua các quỹ thụ động. Nếu tỷ trọng trong FTSE EM Asia đạt mức 1,3%, dòng vốn có thể tới 3 tỷ USD. Trong khi đó, nhiều quỹ chủ động đã nắm cổ phiếu của các doanh nghiệp Việt. Sau khi nâng hạng, HSBC ước tính dòng vốn từ khối này dao động từ 1,9 tỷ đến 7,4 tỷ USD, tùy theo tỷ trọng của Việt Nam trong chỉ số. Trước đó, một số tổ chức khác cũngdự báohàng tỷ USD vốn ngoại đổ vào khi thị trường được nâng hạng. Chứng khoán VPBank (VPBankS) ước tính quy mô dòng vốn khoảng 3-7 tỷ USD, trong khi Chứng khoán Vietcap cho rằng con số có thể dao động 6-8 tỷ USD. Thị trường Việt Nam được đưa vào danh sách theo dõi nâng hạng của FTSE Russell từ tháng 9/2018. Hiện 7 trên 9 tiêu chí cần thiết đã đạt. HSBC cho rằng, diễn biến mới về hai tiêu chí còn lại là Luật Chứng khoán sửa đổi hiệu lực từ 1/1/2025 và vận hànhhệ thống KRXtừ tháng 5 giúp tăng khả năng nâng hạng. Tuy nhiên, nhà băng lưu ý việc FTSE từng nhận định quy trình đăng ký cho nhà đầu tư nước ngoài còn phức tạp và giới hạn sở hữu của khối ngoại trong một số ngành như ngân hàng, hàng không và viễn thông. Điều này có nghĩa khi nhà đầu tư nước ngoài đã nắm 50% cổ phần công ty, họ chỉ có thể giao dịch với các nhà đầu tư nước ngoài khác. Khi đó, sẽ hình thành giá riêng cho khối ngoại. ""Đây không phải là yêu cầu bắt buộc của FTSE để tái phân loại, nhưng có thể trở thành vấn đề được nhà đầu tư nêu ra"", HSBC nhận định. Tính đến 1/9, chỉ có 12 cổ phiếu trong VN-Index hết room ngoại. Tính chung, VN-Index có mức room vốn ngoại trung bình 42%, trong khi tỷ lệ nắm giữ thực tế của khối này mới đạt khoảng 17%, tức chưa bằng một nửa giới hạn. Dỹ Tùng","Thứ sáu, 5/9/2025, 05:00 (GMT+7)",Dỹ Tùng,Kinh doanh,Chứng khoán,VN Express,"HSBC dự báo thị trường chứng khoán Việt Nam có khả năng được FTSE nâng hạng lên thị trường mới nổi trong kỳ rà soát tháng 10, mở ra cơ hội thu hút vốn ngoại đáng kể. Việc nâng hạng sẽ giúp Việt Nam góp mặt trong các chỉ số quan trọng của FTSE, thu hút các quỹ đầu tư thụ động và chủ động. HSBC ước tính dòng vốn tiềm năng có thể lên tới 10,4 tỷ USD, tuy nhiên con số thực tế có thể khiêm tốn hơn và phân bổ theo từng giai đoạn. Mặc dù vậy, HSBC lưu ý vẫn còn một số tiêu chí cần cải thiện liên quan đến quy trình đăng ký và giới hạn sở hữu nước ngoài để đảm bảo việc nâng hạng diễn ra thuận lợi."
VNEX_050925_00080,Hãng ôtô dùng mặt đường đầy ổ gà để quảng bá xe điện,https://vnexpress.net/hang-oto-dung-mat-duong-day-o-ga-de-quang-ba-xe-dien-4934808.html,"Gần đây, một bài đăng được chia sẻ trên X thu hút sự chú ý và mang lại thành công cho đội ngũ tiếp thị của Tata Motors khi quảng bá cho chiếc Harrier.ev mới ra mắt. Khung ảnh đặc biệt có nội dung: ""Tata.ev. Con đường hoàn hảo cho Harrier.ev"". Khung hình làm nổi bật rõ ràng những ổ gà lớn trên mặt đường phía sau. Đồng thời, màu vàng và đen bắt mắt và thu hút sự chú ý của các tài xế đi ngang qua. Cách làm đặc biệt này được đánh giá cao. Khung màu vàng đen của Tata Motors trên đoạn đường đầy ổ gà, phía sau là mẫu xe điện Harrier.ev. Ảnh:Tata Motors Một người bình luận: ""Một nước đi táo bạo, Tata. Ai cần đường bằng phẳng khi chiếc Harrier.ev của bạn có thể đóng vai chính trong một bộ phim hành động ổ gà chứ"". Người khác viết: ""Quên chuyến đi săn ở sa mạc Dubai đi, đến Ấn Độ để trải nghiệm chuyến đi săn ổ gà đi"". Một người hài hước: ""Đây chính là thiên tài tiếp thị của Ấn Độ! 'Con đường hoàn hảo cho Harrier.ev' bởi vì không gì thử thách hệ thống treo của xe điện tốt hơn địa hình trên Mặt Trăng! Tata nói một cách đơn giản: 'Mua xe của chúng tôi, bạn sẽ có cảm giác như đang lái xe địa hình trên sao Hỏa!'. Chỉ ở Ấn Độ, ổ gà mới có thể trở thành điểm nhấn bán hàng. Thật tuyệt vời!'. Tata Harrier.ev là mẫu SUV điện mới nhất và chủ lực của thương hiệu. Xe có giá khởi điểm 2.149.000 rupee (24.400 USD) cho phiên bản Adventure 65 tiêu chuẩn và lên đến 3.023.000 rupee (34.300 USD) cho phiên bản Empowered 75 Stealth. Chiếc SUV này cạnh tranh với Mahindra XEV 9E trên thị trường SUV điện Ấn Độ. Mẫu SUV điện có cửa sổ trời toàn cảnh, màn hình cảm ứng Samsung Neo QLED 14,53 inch tích hợp định vị. Ảnh:Tata Motors Tata Motors cung cấp Harrier.ev hai tùy chọn hệ dẫn động. Bản RWD đi kèm một môtơ ở trục sau, sản sinh công suất 238 mã lực. Bản AWD với hai môtơ với tổng công suất 396 mã lực và mô-men xoắn 504 Nm. Điểm nổi bật của Harrier.ev chính là khả năng dẫn động 4 bánh toàn thời gian. Xe có 6 chế độ: Bình thường, Tuyết/Cỏ, Bùn lầy, Cát, Đá lởm chởm, và Tùy chỉnh. Xe trang bị hệ thống hỗ trợ Off-Road, giúp kiểm soát mô-men xoắn trong các điều kiện địa hình khắc nghiệt như bùn lầy hoặc đá gồ ghề. Những điểm nổi bật đáng chú ý khác của Harrier.ev bao gồm camera 540 độ, hệ thống treo sau đa liên kết và khả năng lội nước 600 mm, một con số khá ấn tượng đối với một chiếc SUV điện. Danh sách trang bị bao gồm hệ thống thông tin giải trí màn hình cảm ứng Samsung Neo QLED 14,53 inch tích hợp định vị, camera quan sát ban đêm kỹ thuật số IRVM tích hợp camera hành trình và chìa khóa kỹ thuật số. Mỹ Anh(theoCartoq)","Thứ sáu, 5/9/2025, 05:00 (GMT+7)",Mỹ Anh,Xe,Thị trường,VN Express,"Tata Motors đã tạo ra một chiến dịch quảng cáo thông minh và hài hước cho chiếc Harrier.ev mới bằng cách đặt biển quảng cáo với dòng chữ ""Con đường hoàn hảo cho Harrier.ev"" ngay cạnh những con đường đầy ổ gà. Chiến dịch này đã thu hút sự chú ý lớn trên mạng xã hội, với nhiều người dùng ca ngợi sự táo bạo và sáng tạo của Tata Motors. Harrier.ev là mẫu SUV điện mới nhất của Tata Motors, có giá từ 2.149.000 rupee, với nhiều tính năng nổi bật như hệ dẫn động 4 bánh, camera 540 độ, và khả năng lội nước 600 mm."
VNEX_050925_00006,Israel tuyên bố kiểm soát gần nửa Gaza City,https://vnexpress.net/israel-tuyen-bo-kiem-soat-gan-nua-gaza-city-4935268.html,"""Chúng tôi đã kiểm soát khoảng 40% diện tích Gaza City. Quân đội Israel sẽ mở rộng và tăng cường hoạt động tấn công trong những ngày tới, gia tăng áp lực lên Hamas cho tới khi nhóm này bị đánh bại"", phát ngôn viên Lực lượng Phòng vệ Israel (IDF) Effie Defrin cho biết hôm 4/9. Chuẩn tướng Defrin khẳng định quân đội Israel đang tiếp tục kế hoạch kiểm soát hoàn toàn Gaza City, đang tiến gần đến mốc giành được 50% diện tích thành phố. Khói bốc lên sau trận không kích của Israel nhằm vào Gaza City ngày 4/9. Ảnh:AFP Cơ quan phòng vệ dân sự Dải Gaza cho biết trận không kích của Israel trong ngày 4/9 đã đánh trúng lều trại của một gia đình ở Gaza City và khiến 5 người thiệt mạng, trong đó có ba trẻ em. IDF sau đó thông báo họ nhắm vào một thành viên Hamas trong đòn tập kích, cho hay họ ""lấy làm tiếc về bất cứ tổn hại nào gây ra cho thường dân không liên quan"". Quan chức quốc phòng Israel cấp cao ngày 3/9 tiết lộ chính quyền nước này ước tính chiến dịch mới sẽ đẩy khoảng một triệu người khỏi Gaza City về phía nam. IDF trong những ngày qua tăng cường oanh tạc khu vực Gaza City, bất chấp áp lực quốc tế ngày càng tăng nhằm ngăn chiến dịch tấn công thành phố. IDF ngày 29/8 tuyên bố Gaza City là ""vùng chiến sự nguy hiểm"" và lệnh ngừng bắn cục bộ không còn áp dụng tại khu vực này. Quân đội Israel trước đó thường đình chỉ hoạt động quân sự tại một số khu vực ở Dải Gaza vào buổi trưa hàng ngày, nhằm tạo điều kiện phân phối hàng viện trợ nhân đạo. Vị trí Gaza City. Đồ họa:BBC Gaza City là thành phố lớn nhất ở Dải Gaza. Liên Hợp Quốc ước tính có hơn một triệu người đang sống ở tỉnh Gaza, khu vực gồm Gaza City và các vùng lân cận ở phía bắc dải đất. IDF mô tả đây là ""thành trì của Hamas"". Vụ tấn công ngày 7/10/2023 của Hamas vào miền nam Israel khiến 1.219 người thiệt mạng, phần lớn là dân thường. Trong số 251 con tin bị bắt, 47 người vẫn bị giam giữ tại Gaza với khoảng 20 người được tin là còn sống. Chiến dịch trả đũa của Israel đã khiến hơn 64.000 người Palestine thiệt mạng, đa số là dân thường, theo số liệu từ cơ quan y tế Dải Gaza. Nguyễn Tiến(TheoAFP, AP, Times of Israel)","Thứ sáu, 5/9/2025, 07:38 (GMT+7)",Nguyễn Tiến,Thế giới,Quân sự,VN Express,"Quân đội Israel (IDF) tuyên bố đã kiểm soát khoảng 40% Gaza City và sẽ tiếp tục mở rộng tấn công để đánh bại Hamas, đồng thời tiến gần đến mục tiêu kiểm soát hoàn toàn thành phố. Các cuộc không kích của Israel đã gây ra thương vong cho dân thường, bao gồm cả trẻ em, mặc dù IDF bày tỏ sự hối tiếc về những tổn thất này. Chính quyền Israel ước tính chiến dịch mới sẽ khiến khoảng một triệu người phải di tản về phía nam, trong bối cảnh áp lực quốc tế gia tăng nhằm ngăn chặn cuộc tấn công vào Gaza City. Gaza City, thành phố lớn nhất ở Dải Gaza, được IDF xem là ""thành trì của Hamas"", nơi diễn ra các hoạt động trả đũa sau vụ tấn công của Hamas vào Israel."
VNEX_050925_00018,Chủ tịch Tottenham từ chức sau gần 25 năm,https://vnexpress.net/chu-tich-tottenham-tu-chuc-sau-gan-25-nam-4935260.html,"Trong thời gian nắm quyền từ tháng 3/2001, Levy để lại di sản lớn khi biếnTottenhamthành một trong những thương hiệu toàn cầu với sân vận động và trung tâm huấn luyện hiện đại bậc nhất châu Âu. Nhưng về mặt chuyên môn, ""Gà trống"" chỉ giành hai chức vô địch là Cup Liên đoàn năm 2008 và Europa League 2025. Levy rời ghế trong bối cảnh ông nhiều lần đối mặt làn sóng phản đối từ CĐV vì cho rằng ông đặt lợi ích tài chính lên trên tham vọng chinh phục danh hiệu. Doanh nhân 62 tuổi từng thừa nhận: ""Tôi muốn thắng, và khi CLB không chơi tốt, không thắng, tôi cũng đau đớn chẳng khác gì các CĐV"". Daniel Levy dự khán trận Tottenham gặp West Ham ở Ngoại hạng Anh tại sân vận động Tottenham Hotspur, London, Anh ngày 19/10/2024. Ảnh:AP Trong thông cáo chia tay, Levy khẳng định tự hào vì đã ""xây dựng Tottenham thành một thế lực toàn cầu và một cộng đồng lớn mạnh"", đồng thời gửi lời cảm ơn tới các cầu thủ, HLV và người hâm mộ đã đồng hành suốt thời gian ông cống hiến. Tottenham cũng nhấn mạnh CLB đã có những bước chuyển mình mạnh mẽ dưới thời Levy: góp mặt tại các Cup châu Âu ở 18 trong 20 mùa gần nhất, liên tục đầu tư vào học viện, đội hình, cơ sở vật chất, đồng thờigiành Europa Leaguemùa trước. Hàng loạt nhân sự cấp cao đã được bổ nhiệm như CEO Vinai Venkatesham, HLV trưởng nam Thomas Frank, HLV trưởng nữ Martin Ho, cùng tân Chủ tịch Peter Charrington. Charrington - Giám đốc của tập đoàn sở hữu ENIC, vừa gia nhập ban lãnh đạo hồi tháng 3 - được bổ nhiệm thay thế Levy ở vị trí Chủ tịch không điều hành. Tottenham cho biết quá trình kế nhiệm đã được chuẩn bị nhiều tháng, song khẳng định cấu trúc sở hữu hiện tại không thay đổi. ENIC nắm 86,58% cổ phần Tottenham, trong đó Levy sở hữu 29,88% của ENIC. Trong phát biểu nhậm chức, Charrington cam kết dẫn dắt CLB bước vào kỷ nguyên mới trong và ngoài sân cỏ, tập trung vào ổn định và trao quyền nhiều hơn cho đội ngũ điều hành do Venkatesham dẫn dắt. Daniel Levy (phải) ôm HLV Ange Postecoglou sau khi Tottenham thắng Man Utd ở chung kết Europa League mùa 2024-2025. Ảnh:PA Wire Trong vài tháng qua, Tottenham liên tục biến động nhân sự: Giám đốc bóng đá Scott Munn rời đi tháng 6, thành viên hội đồng Donna-Maria Cullen cũng chia tay CLB. Chính Levy là người quyết địnhsa thải HLV Ange Postecoglouhồi tháng 6, chỉ 16 ngày sau khi ông giúp CLB chấm dứt 17 năm trắng tay bằng chức vô địch Europa League. Hồng Duy(theoESPN)","Thứ sáu, 5/9/2025, 06:08 (GMT+7)",Hồng Duy,Thể thao,Ngoại hạng Anh,VN Express,"Daniel Levy rời chức chủ tịch Tottenham sau hơn 20 năm, để lại di sản về một câu lạc bộ có cơ sở vật chất hiện đại và thương hiệu toàn cầu. Tuy nhiên, ông cũng vấp phải nhiều chỉ trích vì ưu tiên lợi ích tài chính hơn danh hiệu, dù Tottenham đã giành Europa League 2025 dưới thời ông. Tân chủ tịch Peter Charrington cam kết dẫn dắt câu lạc bộ vào kỷ nguyên mới, tập trung vào sự ổn định và trao quyền cho đội ngũ điều hành, trong bối cảnh Tottenham có nhiều biến động nhân sự gần đây."
