id,title,link,content,date,author,category,sub_category,source,summary
VNEX_140725_00087,Đội tuyển Việt Nam giành 4 huy chương vàng Olympic Hóa quốc tế,https://vnexpress.net/doi-tuyen-viet-nam-gianh-4-huy-chuong-vang-olympic-hoa-quoc-te-4913775.html,"Bộ Giáo dục và Đào tạo cho biết tin trên sáng 14/7. Những học sinh đạt huy chương vàng gồm: 1. Ngô Quang Minh (lớp 12, trường THPT chuyên Bắc Ninh), đứng hạng 7. 2. Nguyễn Hoàng Khôi (lớp 12, trường THPT chuyên Đại học Sư phạm, trường Đại học Sư phạm Hà Nội), hạng 10. 3. Giang Đức Dũng (lớp 12, trường THPT chuyên Khoa học Tự nhiên, trường Đại học Khoa học Tự nhiên, Đại học Quốc gia Hà Nội), hạng 14. 4. Nguyễn Mạnh Tuấn (lớp 11, trường THPT chuyên Hà Nội - Amsterdam, Hà Nội), hạng 37. Bộ cho biết trên bảng tổng sắp huy chương, Việt Nam cùng hạng với đoàn Trung Quốc và Mỹ về số huy chương vàng. Kể từ khi tham gia IChO năm 1996, đây là năm thứ ba cả đoàn Việt Nam đều giành huy chương vàng. Nhưng hai lần trước (2020 và 2022), kỳ thi diễn ra trực tuyến vì Covid-19, còn năm nay thi trực tiếp. Đoàn Việt Nam tại IChO 2025. Ảnh:MOET Trong giai đoạn 2020-2025, đoàn Việt Nam giành 24/24 huy chương, trong đó có tới 21 huy chương vàng, ba huy chương bạc tại Olympic Hóa học quốc tế. ""Thành tích này tiếp tục khẳng định chất lượng giáo dục mũi nhọn phổ thông, bên cạnh giáo dục đại trà, đồng thời khẳng định hướng đi đúng trong việc phát hiện, tuyển chọn và bồi dưỡng học sinh giỏi"", Bộ đánh giá. IChO năm 2025 diễn ra từ ngày 5 đến 14/7 tại UAE, thu hút 354 học sinh đến từ 90 quốc gia và vùng lãnh thổ. Đây là lần thứ 57 cuộc thi diễn ra. Kỳ thi IChO có một bài thi lý thuyết, một bài thực hành, mỗi bài làm trong 5 tiếng. Bài thi thực hành năm nay yêu cầu thí sinh thực hiện thành thạo các kỹ năng thí nghiệm từ cơ bản đến nâng cao, như tổng hợp và phân tích chất, xác định các amino acid, nhận biết các hợp chất hữu cơ bằng các kỹ thuật sắc ký bản mỏng, chuẩn độ và đo phổ hấp thụ UV-Vis. Theo Bộ, đây là bài thi đòi hỏi sự chính xác, tư duy logic và thao tác phòng thí nghiệm thuần thục. Trong khi đó, bài thi lý thuyết xoay quanh các vấn đề môi trường, công nghệ hay ứng dụng của hóa học trong cuộc sống như: khử mặn nước biển, năng lượng mặt trời, những quả bóng tennis, đèn lồng... đòi hỏi thí sinh vận dụng kiến thức tổng hợp và tư duy phản biện để giải quyết các vấn đề. ""Cấu trúc đề thi năm nay được đánh giá là sáng tạo, gần gũi với thực tiễn đời sống nhưng vẫn đảm bảo chiều sâu về khoa học"", Bộ nhận định. Thanh Hằng","Thứ hai, 14/7/2025, 07:48 (GMT+7)",Thanh Hằng,Giáo dục,Tin tức,VN Express,"Đội tuyển Việt Nam đã xuất sắc giành 4 huy chương vàng tại Olympic Hóa học quốc tế (IChO) 2025, sánh ngang thành tích với Trung Quốc và Mỹ. Đây là lần thứ ba đoàn Việt Nam đạt thành tích toàn huy chương vàng kể từ khi tham gia IChO, nhưng là lần đầu tiên thành tích này đạt được khi kỳ thi diễn ra trực tiếp. Thành tích này khẳng định chất lượng giáo dục mũi nhọn của Việt Nam và hướng đi đúng trong việc phát hiện, bồi dưỡng học sinh giỏi. Kỳ thi năm nay có cấu trúc đề sáng tạo, gần gũi với thực tiễn và đòi hỏi thí sinh có kiến thức tổng hợp và kỹ năng thí nghiệm thuần thục."
VNEX_140725_00113,Đề thi: đánh giá hay đánh đố,https://vnexpress.net/de-thi-danh-gia-hay-danh-do-4913567.html,"Để đánh giá, trong giáo dục có một số lý thuyết được công nhận rộng rãi về các tiêu chí của một đề thi hiệu quả, trong đó hai tiêu chí thường được đưa lên hàng đầu và lặp đi lặp lại trong các lý thuyết khác nhau làValidityvàReliability.Validity(tính hợp lệ) nghĩa là đề thi có thực hiện đúng chức năng của nó là đánh giá, phân loại không. Một đề thi Văn được khen ""hay"", ""gây xúc động mạnh"", nhưng không có khả năng đánh giá năng lực ngôn ngữ, văn học của học sinh thì dù được lòng dư luận tới cỡ nào, đó vẫn là một đề thi kém chất lượng, không dùng được cho mục đích đánh giá. Reliability(mức độ tin cậy) phản ánh tính ổn định của đề. Ví dụ, các kỳ thi tiếng Anh quốc tế của tổ chức Cambridge English hay IELTS thường có cấu trúc (format) ổn định, độ dài của đề ổn định, lượng từ vựng và yêu cầu đối với thí sinh tương ứng với mức độ ngôn ngữ mục tiêu cần khảo sát, do vậy hiếm khi nào tạo ra may - rủi cho thí sinh đợt thi trước và đợt thi sau. Kỳ thi tốt nghiệp phổ thông trung học là kỳ thi quốc gia với chức năng ""hai trong một"", vừa để xét công nhận tốt nghiệp, vừa làm cơ sở cho đầu vào đại học. Một học sinh cần đạt điểm 5 để tốt nghiệp thì đề thi phải đảm bảo một học sinh trung bình có thể làm bài được 5 điểm, và từ 6 đến 10 là mức điểm để phân hóa. Đề thi không nên là một cuộc chơi may rủi vì nó cần đảm bảo công bằng cơ hội cho người học. Một số ý kiến tin rằng ""khó thì khó đều"", nhưng điều này chỉ đúng khi xét riêng biệt từng môn. Giả sử đề thi Toán, Tiếng Anh năm nay quá khó, thí sinh xét tuyển bằng tổ hợp Toán - Lý - Hóa, Toán - Hóa - Sinh sẽ được lợi hơn tổ hợp Toán - Văn - Anh. Hoặc thí sinh có điểm thi IELTS sẽ có lợi hơn thí sinh không có. Điều này dẫn tới sinh viên vào đại học có sức học không đều, có thí sinh vào trường nhờ sức học tốt, nhưng có những thí sinh kém hơn nhiều vẫn vào trường vì ""gặp thời"", và lấy mất chỗ của thí sinh xứng đáng hơn mình. Điều này làm phá vỡ nguyên tắc công bằng trong tuyển sinh. Lấy đơn cử đề thi môn tiếng Anh, là môn tôi được đào tạo chuyên sâu để giảng dạy. Cộng đồng giáo viên cũng nhận ra đề thi có thể ở mức B2 - C1, đồng thời chịu các tác động bất lợi khác như thời gian ít hơn nhiều kỳ thi Cambridge English hay IELTS, font chữ trong đề nhỏ hơn, học sinh phải thi dồn dập trong nhiều ngày liên tiếp... Trình độ tiếng Anh C1 hiện nay (hay Bậc 5 khung năng lực ngoại ngữ quốc gia) là trình độ chuẩn của giáo viên ngoại ngữ chúng ta đang hướng tới mà đến năm 2030 chưa chắc đạt được, thì việc kiểm tra mức C1 với học sinh cần trình độ B1 là không phù hợp. Thông thường, nếu xác định mức độ mục tiêu của học sinh phổ thông là B1, thì đề thi rất hiếm khi đẩy lên mức vượt quá B2. Nếu đề thi bao gồm cả trình độ C1- C2 có thể đã trở thành đề thi học sinh giỏi. Việc giải thích rằng đề thi ""cần tạo ra yếu tố bất ngờ để học sinh không học theo lối cũ"" là cách hiểu đầy bất cập. Các yêu cầu của đề thi, hình thức đề thi phải được minh bạch ngay từ đầu năm học để người học chuẩn bị. Cách bất ngờ ""lật thuyền"" xem ai biết bơi không phải là mục tiêu của kiểm tra, đánh giá. Để đánh giá đề thi năm nay dễ, khó như thế nào sẽ cần nhìn vào phổ điểm, xem độ lệch giữa các môn, cũng như mức độ phân hóa của thí sinh trong từng môn. Giả sử chúng ta đang tin rằng chất lượng giáo dục phổ thông không đổi hoặc đang đi lên, mà tỷ lệ thí sinh năm nay đạt điểm dưới trung bình tăng cao bất thường, thì có hai giả thiết: hoặc là chất lượng giảng dạy ba năm phổ thông trung học thực ra không đạt yêu cầu cho tốt nghiệp, hoặc đề thi tốt nghiệp năm nay khó bất thường. Một số chương trình giáo dục trên thế giới đã có những hướng xử lý hợp lý khi phân loại thí sinh, như cho phép thí sinh ngay từ đầu đăng ký thi theo trình độ chuẩn hay nâng cao, như vậy thí sinh sẽ có lựa chọn đặt trọng tâm vào việc chỉ cần tốt nghiệp, hay cần chứng tỏ năng lực để vào đại học. Hệ thống giáo dục Mỹ thậm chí không có kỳ thi tốt nghiệp phổ thông, mà sử dụng hệ thống tín chỉ, khi học đủ số môn, lấy đủ điểm thì tự động được tốt nghiệp. Còn muốn vào đại học phải chứng tỏ điểm trung bình học bạ (GPA) cao, kèm thêm điểm thi nâng cao AP. Không nên nhìn nhận những phản hồi, thậm chí than phiền của người học về đề thi khó là tiêu cực, trái lại đó là cơ hội để nhìn lại độ ""vênh"" giữa học và thi, giữa thực tế dạy học với kết quả đầu ra, hay thậm chí cả những vấn đề tiềm ẩn như coi trọng ngoại ngữ mà coi nhẹ các môn khoa học nền tảng... Đề thi có chất lượng cũng phải dựa vào các tiêu chí khoa học, chứ không dựa vào độ ""hot"", độ ""hay"" của đề. Vì đề thi là công cụ đánh giá, không phải là một sản phẩm truyền thông. Bùi Khánh Nguyên","Thứ hai, 14/7/2025, 00:00 (GMT+7)",Bùi Khánh Nguyên,Góc nhìn,Giáo dục & tri thức,VN Express,"Văn bản trên nhấn mạnh hai tiêu chí quan trọng để đánh giá một đề thi hiệu quả trong giáo dục là tính hợp lệ (validity) và mức độ tin cậy (reliability). Tính hợp lệ đảm bảo đề thi đánh giá đúng năng lực cần thiết, trong khi mức độ tin cậy đảm bảo tính ổn định và công bằng của đề thi qua các kỳ thi. Đề thi tốt nghiệp THPT cần cân bằng giữa việc xét tốt nghiệp và phân loại học sinh, tránh tạo ra sự may rủi và đảm bảo công bằng trong tuyển sinh đại học. Việc ra đề thi vượt quá trình độ mục tiêu của học sinh và tạo ra những yếu tố bất ngờ không báo trước là không phù hợp."
VNEX_140725_00016,Ông Trump chiếm sân khấu trong lễ trao Cup của Chelsea,https://vnexpress.net/ong-trump-chiem-san-khau-trong-le-trao-cup-cua-chelsea-4913799.html,"Đại diện cho nước chủ nhà Mỹ, ông Trump cùng Chủ tịch FIFA Gianni Infantino mang Cup đến bục vinh quang cho các cầu thủ Chelsea, sau trận chung kết trên sân MetLife, New Jersey ngày 13/7. Infantino sau đó chủ động né ra ngoài, và dường như cũng đề nghị ông Trump rời đi. Nhưng Tổng thống Mỹ phớt lờ, vẫn đứng giữa khung hình khi đội trưởng Reece James cùng các đồng đội ăn mừng danh hiệu. Tổng thống Mỹ Donald Trump đứng cạnh đội trưởng Chelsea Reece James trong lễ nâng Cup. Ảnh:Reuters Thực tế, ngay trước khoảnh khắc nâng Cup, tiền vệ Cole Palmer dường như hỏi đội trưởng James tại sao ông Trump vẫn còn ở trên sân khấu. Hậu vệ người Anh sau đó quay sang nói với Tổng thống Mỹ: ""Ông có định rời đi không?"". Đáp lại, ông Trump có vẻ như nói ""Tôi sẽ ăn mừng cùng các cậu"", rồi tiếp tục đứng vỗ tay. Trong cuộc phỏng vấn với kênhDAZN, Palmer thừa nhận bối rối khi ông Trump đứng chụp ảnh cùng toàn đội Chelsea trong lễ nâng Cup. ""Tôi biết ông ấy sẽ dự khán, nhưng không biết ông ấy sẽ đứng trên sân khấu khi chúng tôi nâng Cup"", tiền vệ người Anh nói. Chelsea, đội bóng thuộc sở hữu của nhóm do tỷ phú người Mỹ Todd Boehly đứng đầu, có mối liên hệ với Mỹ. Boehly đã cùng Trump, Infantino và Chủ tịch PSG Nasser el-Khelaifi lên sân khấu sau trận. Trước chủ đề gây tranh cãi ở trên, ông Trump còn bị la ó khi xuất hiện trên màn hình lớn trong lúc Quốc ca Mỹ được cử hành trước trận chung kết. Tan trận, Tổng thống Mỹ tiếp tục bị chế giễu khi song hành cùng Chủ tịch FIFA Infantino trong lễ trao giải. Với sự có mặt của ông Trump, an ninh tại sân vận động được thắt chặt hơn so với các trận đấu trước đó, khi các đặc vụ mật vụ được bố trí tại các cổng. Việc xếp hàng vào sân diễn ra chậm nhưng không có sự cố lớn nào, ngoài việc trận đấu bắt đầu muộn khoảng 8 phút. Tổng thống Trump (giữa), phu nhân Melania (trái) và Chủ tịch FIFA Gianni Infantino dự khán chung kết FIFA Club World Cup. Ảnh:Timesnownews Đoàn xe của Trump đi vào lối vào đặc biệt nằm cạnh lối vào của các cầu thủ. Ông chủ Nhà Trắng và đoàn tùy tùng rời khỏi xe dưới một chiếc lều có rèm che khoảng 30 phút trước trận. Cùng với Trump trong khu vực VIP là Infantino, huyền thoại bóng bầu dục người Mỹ Tom Brady, và ông trùm truyền thông Rupert Murdoch. Các thành viên nội các của Trump, gồm Bộ trưởng Tư pháp Pam Bondi, Bộ trưởng Giao thông Vận tải Sean Duffy và Giám đốc An ninh Nội địa Kristi Noem cũng có mặt. Diễn biến chính trận Chelsea 3-0 PSG. Hồng Duytổng hợp","Thứ hai, 14/7/2025, 08:46 (GMT+7)",Hồng Duy,Thể thao,Fifa Club World Cup 2025,VN Express,"Ông Trump, đại diện nước chủ nhà Mỹ, đã gây tranh cãi khi đứng trên sân khấu ăn mừng chức vô địch cùng các cầu thủ Chelsea, mặc dù Chủ tịch FIFA Infantino và thậm chí cả cầu thủ Chelsea đã tế nhị đề nghị ông rời đi. Sự xuất hiện của ông Trump, cùng với các biện pháp an ninh thắt chặt, đã làm chậm quá trình vào sân và gây bối rối cho một số cầu thủ Chelsea. Trước đó, ông Trump còn bị la ó khi xuất hiện trên màn hình lớn lúc cử hành Quốc ca và bị chế giễu trong lễ trao giải. Sự kiện này cho thấy mối liên hệ giữa Chelsea, đội bóng thuộc sở hữu của một tỷ phú người Mỹ, và các nhân vật chính trị hàng đầu của Mỹ."
VNEX_140725_00010,"Cuộc sống sáng cà phê, tối trú tên lửa ở Kiev",https://vnexpress.net/cuoc-song-sang-ca-phe-toi-tru-ten-lua-o-kiev-4913123.html,"Thủ đô Ukraine ban ngày nhộn nhịp sức sống với tàu điện ngầm đông đúc, người dắt chó đi dạo và trẻ em vui đùa ở sân chơi. Đêm đến, Kiev trở thành chiến trường dưới các cuộc tấn công bằng máy bay không người lái (UAV) và tên lửa của Nga, khiến phần lớn người dân phải xuống lòng đất tìm nơi trú ẩn. Nga đẩy mạnh tấn công về đêm trong năm thứ tư của cuộc xung đột, với số lượng UAV đôi lúc hơn 700 chiếc. Giới chức Ukraine nhận định những cuộc tấn công quy mô 1.000 UAV có thể sớm trở thành điều bình thường. Người dân ngồi nghỉ trên ghế đá giữa trung tâm Kiev ngày 9/7. Ảnh:AP Nhiều người dân Kiev mô tả đợt tấn công trong những ngày gần đây dữ dội ""chưa từng thấy"". Ngay cả những cư dân thường phớt lờ còi báo động cũng buộc phải xuống hầm trú bom trong hệ thống tàu điện ngầm. ""Ban ngày, bạn đi dạo, uống cà phê, vui cười, gặp gỡ bạn bè, trò chuyện, làm việc mình thích, thư giãn"", Karyna Holf, 25 tuổi, nói. ""Nhưng vào ban đêm, bạn chuẩn bị cho cái chết mỗi khi nghe thấy tiếng UAV hoặc tên lửa"". Cuộc tấn công của Nga ngày 10/7 phá hủy nhà cô. Holf đang ở phòng khách gần cửa sổ thì nghe thấy tiếng rít của vũ khí đang lao tới. Vài giây sau, ngôi nhà biến thành đống đổ nát. Cô đã may mắn sống sót. Cảm giác cận kề cái chết lại làm nảy sinh tinh thần hài hước kiểu chua chát. Ban đêm, nhiều người tê liệt vì sợ hãi. Nhưng ban ngày, họ đùa rằng họ không dám cởi hết quần áo đi ngủ để phòng khi bị kẹt dưới đống đổ nát và lực lượng cứu nạn phải kéo họ ra. ""Cuộc sống bây giờ giống trò chơi điện tử. Bạn phải sống sót trong lúc vẫn hoạt động bình thường"", Danylo Kuzemskyi, 35 tuổi, nói về sự cân bằng giữa cuộc sống hàng ngày và xung đột. Người dân mua bán ở khu chợ cóc gần một tòa chung cư trúng tên lửa Nga ở Kiev ngày 10/7. Ảnh:AP Tiếng ù ù của UAV và tiếng hệ thống phòng không đánh chặn có thể kéo dài hàng giờ. Tiếng ồn khiến nhiều người kiệt sức vì thiếu ngủ kinh niên. Không khí đầy khói và mùi thuốc súng. Kể từ đầu năm, hơn 800 địa điểm ở Kiev đã bị tấn công, trong đó có hơn 600 tòa nhà dân cư, theo ông Tymur Tkachenko, người đứng đầu chính quyền thành phố Kiev. ""Họ cố tình tấn công các tòa nhà chung cư và các quận nội thành"", ông nói. ""Đây là chiến thuật của họ: gieo rắc nỗi sợ và tăng số lượng thương vong dân sự"". Cáo buộc của Tkachenko trái với tuyên bố của Nga, bởi Moskva luôn khẳng định chỉ tấn công các mục tiêu quân sự. Các cuộc tấn công của Nga củng cố tinh thần đoàn kết của người dân Kiev. Trên mạng xã hội, người ta đăng bài kể chuyện uống một tách cappuccino vào buổi sáng, đến phòng tập hay đi hẹn hò, quyết không bỏ lỡ nhịp sống thường nhật. ""Tôi hiểu rằng Nga đang cố gắng làm chúng tôi mất tinh thần"", Kuzemskyi, người có căn hộ bị phá hủy trong một cuộc tấn công, nói. ""Họ có thành công không? Trong trường hợp của tôi, tôi sẽ nói là không"". Anh là một trong số những người không còn đến hầm trú ẩn vì bây giờ ""ưu tiên giấc ngủ"" hơn là sự an toàn. Người dân Ukraine trú ẩm dưới sân ga tàu điện ngầm ở Kiev trong một đợt tấn công của Nga ngày 10/7. Ảnh:AP Đối với Oleksandra Umanets, 23 tuổi, người có con trai 10 tháng tuổi, trú ẩn ở ga tàu điện ngầm cho cô cảm giác an toàn hơn ngôi nhà của mình vào ban đêm. Khoảng 5h, cô sẽ rời hầm trú ẩn cùng con, đi bộ về nhà, nằm xuống ngủ và thức dậy với cảm giác nhẹ nhõm khi thấy con mình mỉm cười. ""Tôi ngắm nhìn trẻ con chạy nhảy, vui đùa và những bà mẹ mỉm cười"", cô kể lại chuyến đi dạo ban ngày của hai mẹ con. ""Bạn sẽ không đoán được rằng họ đã qua đêm ở ga tàu điện ngầm, thậm chí không ngủ chút nào, dù ai cũng ngầm hiểu. Nhưng không ai nói về nó. Mọi người vẫn tiếp tục sống"". Rồi buổi tối lại đến. Cô gói một chiếc túi, đặt cạnh cửa, chuẩn bị xe đẩy và sắp sẵn quần áo cho mình và con. Khi còi báo động vang lên, cô đã sẵn sàng để ẩn náu. ""Có người giờ không còn đi trú bom nữa. Nhưng khi chuyện này không chỉ liên quan đến bạn, mà còn là sự an toàn của con bạn, thì tại sao lại không đi?"", cô nói. ""Không lẽ để các con chết chỉ vì chúng được sinh ra ở Ukraine sao? Chúng đâu có quyền chọn nơi mình chào đời"". Hồng Hạnh(TheoAP)","Thứ hai, 14/7/2025, 05:00 (GMT+7)",Hồng Hạnh,Thế giới,Cuộc sống đó đây,VN Express,"Kiev, thủ đô Ukraine, ban ngày vẫn nhộn nhịp với cuộc sống thường nhật, nhưng đêm đến lại chìm trong nỗi kinh hoàng của các cuộc tấn công bằng UAV và tên lửa Nga. Người dân phải đối mặt với sự tương phản nghiệt ngã giữa cuộc sống và cái chết, buộc họ phải tìm nơi trú ẩn dưới lòng đất. Dù vậy, tinh thần đoàn kết và quyết tâm duy trì cuộc sống bình thường vẫn mạnh mẽ, thể hiện qua việc người dân cố gắng tận hưởng những niềm vui nhỏ bé và không khuất phục trước nỗi sợ hãi. Các cuộc tấn công của Nga nhắm vào các khu dân cư, nhưng người dân Kiev vẫn kiên cường và không để mất tinh thần."
VNEX_140725_00069,Nguyễn Hồng Nhung kết hôn lần hai,https://vnexpress.net/nguyen-hong-nhung-ket-hon-lan-hai-4913759.html,"Cô cho biết cả hai quen nhau từ nhỏ, cùng học âm nhạc, đến nay đã hơn 30 năm, từng yêu nhưng chưa đủ duyên gắn bó. Cho đến hai năm trước, sau nhiều biến cố trong cuộc sống cá nhân, ca sĩ may mắn khi người yêu cũ vẫn bên cạnh, sẵn sàng giang tay khi cô yếu đuối. ""Anh đến xoa dịu nhiều cô đơn, tổn thương trong tôi sau hai lần đổ vỡ tình cảm. Bạn trai mang cho tôi cảm giác bình yên, để mỗi khi nghĩ về nhau, tôi luôn thấy xứng đáng vì chịu mở lòng"", Nguyễn Hồng Nhung nói. Nguyễn Hồng Nhung chia sẻ hình ảnh tình cảm bên chồng. Họ đã tổ chức lễ cưới ở Mỹ. Video:Nhân vật cung cấp Với cô, chồng là người hiểu biết, thông minh, hài hước, học nhạc nhưng không theo đuổi chuyên nghiệp, hiện làm kinh doanh. Họ có chung con trai, hiện được một tháng tuổi. Nguyễn Hồng Nhung còn có hai con riêng: con gái sáu tuổi, con trai,13 tuổi. Nguyễn Hồng Nhung kết hôn sau hai lần đổ vỡ tình cảm. Ảnh:Nhân vật cung cấp Nguyễn Hồng Nhungtừng theo học Cao đẳng Nghệ thuật Hà Nội. Cô được biết đến khi thi Sao Mai điểm hẹn năm 2004, hoạt động trong nước thời gian rồi sang Mỹ định cư. Cô kết hôn với em trai của ca sĩ hải ngoại Trizzie Phương Trinh - Quý Nguyễn - năm 2010 vàly hônnăm 2013. Sau đó, Hồng Nhung chung sống với doanh nhân Minh Quân. Tháng 9/2019, ca sĩkết thúcmối quan hệ sau gần bốn năm sống chung. Ca sĩ từng thực hiện các album nhưNiềm đau đã qua, Dĩ vãng cuộc tình, Love song - Mộc.Năm 2019, Nguyễn Hồng Nhung về nước tổ chức đêm nhạc, ra album tái ngộ khán giả sau 14 năm xa quê. Hoàng Dung","Thứ hai, 14/7/2025, 07:40 (GMT+7)",Hoàng Dung,Giải trí,Giới sao,VN Express,"Ca sĩ Nguyễn Hồng Nhung đã kết hôn với người yêu cũ sau hơn 30 năm quen biết và hai năm gắn bó lại sau nhiều biến cố trong cuộc sống của cô. Người chồng hiện tại là một doanh nhân, mang lại cho cô cảm giác bình yên và xứng đáng sau hai lần đổ vỡ tình cảm trước đó. Cả hai đã có chung một con trai một tháng tuổi và Nguyễn Hồng Nhung còn có hai con riêng từ những mối quan hệ trước. Trước khi kết hôn, cô từng trải qua hai cuộc tình không thành với Quý Nguyễn và doanh nhân Minh Quân."
