id,title,link,content,date,author,category,sub_category,source,summary
VNEX_050925_00070,Bị glôcôm sau nhỏ mắt bằng thuốc chứa corticoid,https://vnexpress.net/bi-glocom-sau-nho-mat-bang-thuoc-chua-corticoid-4935174.html,"ThS.BS Phạm Huy Vũ Tùng, Trung tâm Mắt Công nghệ cao, Bệnh viện Đa khoa Tâm Anh TP HCM, cho biết bà Thảo đến viện khám trong tình trạng mờ, nhức mắt, có ghèn và chảy nước mắt nhiều. Kết quả kiểm tra mắt chuyên sâu cho thấy nhãn áp ở mắt phải người bệnh gần 28 mmHg (bình thường dưới 21 mmHg), mắt trái nhãn áp ổn định, 18 mmHg. Bác sĩ kiểm tra thị lực, soi đáy mắt phát hiện bà Thảo mắc bệnh glôcôm (còn gọi cườm nước hay thiên đầu thống) ở mắt phải. Bà cho biết tự mua thuốc nhỏ mắt chứa corticoid dùng khoảng 6 tháng. Bác sĩ Tùng giải thích corticoid là nhóm thuốc kháng viêm mạnh, thường được chỉ định điều trị nhiều bệnh, trong đó có viêm kết mạc, viêm màng bồ đào, viêm giác mạc hoặc sau phẫu thuật mắt. Người bệnh tự ý dùng loại thuốc này trong thời gian dài có thể gây rối loạn hệ thống dẫn lưu thủy dịch trong mắt khiến áp lực nội nhãn tăng cao, từ đó gây ra bệnh glôcôm. Đây là nguyên nhân phổ biến hàng đầu gây mất thị lực không hồi phục. Bác sĩ Tùng (bên trái) và kỹ thuật viên đo nhãn áp cho người bệnh. Ảnh minh họa:Bệnh viện Đa khoa Tâm Anh Tương tự, chị Thanh, 40 tuổi, cũng mắcbệnh glôcômdo lạm dụng thuốc nhỏ mắt chứa corticoid để giảm viêm, ngứa mắt trong nhiều tháng qua. Khi đến viện khám, người bệnh bị cộm, ngứa mắt nhiều kèm nhức đầu kéo dài. Bác sĩ phát hiện thị trường của chị Thanh có dấu hiệu tổn thương, đặc biệt nhãn áp ghi nhận cao gần gấp đôi bình thường, hơn 35 mmHg. Bác sĩ Tùng chẩn đoán hai trường hợp này là dạng glôcôm góc mở và yêu cầu người bệnh dừng ngay các loại thuốc nhỏ mắt có chứa corticoid đang sử dụng. Glôcôm góc mở là dạng phổ biến nhất, gây ra hiện tượng góc thoát thủy dịch giữa giác mạc và mống mắt vẫn mở, nhưng hệ thống thoát dịch bị suy giảm chức năng, từ đó thủy dịch thoát ra kém, dẫn đến tăng nhãn áp và gây tổn thương dần dần cho thần kinh thị giác. Trái ngược với góc mở, glôcôm góc đóng với diễn biến nhanh, gây đau cấp tính. Tùy theo mức độ bệnh, nguyên nhân và dạng glôcôm, bác sĩ chọn phương pháp điều trị phù hợp, bao gồm dùng thuốc, can thiệp laser hoặc phẫu thuật. Ở giai đoạn nhẹ hoặc mới phát hiện, người bệnh thường được chỉ định thuốc nhỏ mắt hoặc thuốc uống có tác dụng giảm sản xuất thủy dịch hoặc tăng khả năng dẫn lưu, từ đó giúp hạ nhãn áp. Đối với hai trường hợp trên, bác sĩ kê thuốc nhỏ mắt combigan nhằm mục tiêu kiểm soát nhãn áp để ngăn ngừa tổn thương thần kinh thị giác thêm và bảo tồn thị lực. Bà Thảo và chị Thành đều đáp ứng thuốc, nhãn áp giảm tốt, tình trạng mắt dần ổn định. Bệnh glôcôm thường tiến triển âm thầm, không có triệu chứng rõ rệt ở giai đoạn đầu, khiến người bệnh khó nhận biết cho đến khi thị lực bắt đầu giảm, nhất là vùng nhìn ngoại vi. Bác sĩ khuyến cáo người bệnh không tự ý sử dụngthuốc nhỏ mắt chứa corticoidkhi chưa có chỉ định rõ ràng, nên kiểm tra nhãn áp định kỳ nếu từng dùng nhóm thuốc này. Khi có các dấu hiệu bất thường như mờ mắt, đau nhức, nhìn thấy quầng sáng quanh đèn hoặc giảm thị lực, người bệnh cần đi khám ngay để được chẩn đoán và điều trị kịp thời. Nhật Thành *Tên người bệnh đã được thay đổi","Thứ sáu, 5/9/2025, 08:00 (GMT+7)",Nhật Thành,Sức khỏe,Các bệnh,VN Express,"Bác sĩ khuyến cáo việc lạm dụng thuốc nhỏ mắt chứa corticoid có thể gây ra bệnh glôcôm, một bệnh nguy hiểm dẫn đến mất thị lực không hồi phục, như trường hợp của bà Thảo và chị Thanh. Hai bệnh nhân này đều bị glôcôm góc mở do tự ý sử dụng thuốc nhỏ mắt chứa corticoid trong thời gian dài. Bác sĩ khuyến cáo người dân không nên tự ý sử dụng các loại thuốc này và nên kiểm tra mắt định kỳ, đặc biệt là khi có các dấu hiệu bất thường về thị lực. Việc phát hiện và điều trị sớm glôcôm là rất quan trọng để bảo tồn thị lực."
VNEX_050925_00024,HLV thể hình Canada leo 111.285 bậc thang,https://vnexpress.net/hlv-the-hinh-canada-leo-111-285-bac-thang-4935247.html,"Kỷ lục trước đó thuộc về Lynna Taubman, 50 tuổi, HLV thể hình ở Kingston (Australia) với 108.887 bậc, thiết lập hồi tháng 9/2024. Helkat Jaffer lập kỷ lục Guinness khi chinh phục 111.285 bậc thang trên máy StairMaster trong vòng 24 giờ. Jaffer bắt đầu thử thách vào trưa 30/8 tại phòng tập GoodLife Fitness ở Orleans, nơi anh đang làm việc. Suốt quá trình, HLV thể hình này có đội ngũ y tế túc trực và hàng chục người đến động viên. Dù phá kỷ lục khi còn 30 phút, Jaffer vẫn tiếp tục leo để nâng tổng thành tích. Việc chinh phục 111.285 bậc thang trên máy StairMaster tương đương leo tháp CN Tower 62 lần liên tiếp trong một ngày - một thử thách thể lực gần như không tưởng. CN Tower (tháp truyền hình và quan sát cao 553 mét tại Toronto, biểu tượng của Canada) có 1.776 bậc thang, thường được chọn làm thử thách leo bộ gây quỹ từ thiện. ""Đến những phút cuối tôi chỉ nghĩ: vẫn còn thời gian, và tôi không thể phụ lòng đám đông này"", Jaffer chia sẻ vớiCTV Newssau khi lập kỷ lục. ""Chính họ đã tiếp thêm động lực để tôi bước tiếp"". Helkat Jaffer phá kỷ lục leo cầu thang 24 giờ. Điều đặc biệt là Jaffer thực hiện thử thách này sau khi bị rách gân gót chân (Achilles) năm ngoái - chấn thương vốn khiến nhiều VĐV phải nghỉ dài hạn. Jaffer xem việc thực hiện thử thách cách vừa trở lại tập luyện thể thao, vừa hướng đến cộng đồng. Toàn bộ sự kiện được tổ chức nhằm gây quỹ cho Boys and Girls Club of Ottawa (BGC), nơi Jaffer từng là thành viên. Tính đến ngày 3/9, anh đã gây quỹ được 5.000 USD. ""Cứ mỗi 365 USD quyên góp là thêm một tuần cung cấp bữa ăn cho thanh thiếu niên"", Jaffer viết trênInstagram. Anh cũng cam kết tặng sách The Power of Movement cho những ai ủng hộ từ 36,5 USD trở lên. Adam Joiner, Tổng giám đốc BGC Ottawa, khẳng định: ""Những gì Helkat đang làm chính là tinh thần của BGC. Quan trọng hơn, anh ấy từng là thành viên của chúng tôi, và giờ quay lại để cống hiến cho cộng đồng"". Hồng Duy(theoCanadian Running Magazine)","Thứ sáu, 5/9/2025, 05:01 (GMT+7)",Hồng Duy,Thể thao,Marathon,VN Express,"Helkat Jaffer đã phá kỷ lục Guinness thế giới khi chinh phục 111.285 bậc thang trên máy StairMaster trong 24 giờ, vượt qua kỷ lục cũ của Lynna Taubman. Thử thách này tương đương với việc leo tháp CN Tower 62 lần liên tiếp và được Jaffer thực hiện sau khi hồi phục từ chấn thương gân gót chân. Sự kiện này không chỉ là thử thách thể lực mà còn là hoạt động gây quỹ cho Boys and Girls Club of Ottawa (BGC), nơi Jaffer từng là thành viên, thể hiện tinh thần cống hiến cho cộng đồng."
VNEX_050925_00094,Xu hướng dùng gạch tái chế trong xây nhà dân dụng,https://vnexpress.net/xu-huong-dung-gach-tai-che-trong-xay-nha-dan-dung-4933176.html,"Chất thải xây dựng ngày càng lớn do quá trình đô thị hóa nhanh, từ gạch vỡ, bê tông, tro bay đến thủy tinh công nghiệp. Tái sử dụng những vật liệu này để sản xuất gạch giúp giảm áp lực xử lý rác thải, hạn chế việc khai thác đất sét hay giảm tiêu hao năng lượng và phát thải carbon. Các nghiên cứu quốc tế chỉ ra rằng gạch tái chế mang lại lợi ích kinh tế rõ rệt. Nghiên cứu tại Ai Cập ghi nhận gạch tái chế từ hỗn hợp gạch vỡ và nhựa giảm chi phí sản xuất đến 60 % so với loại truyền thống, đồng thời tiết kiệm năng lượng 33,5 %. Tại Anh, loại ""K‐Briq"" được làm từ 90 % phế thải xây dựng không nung, giảm 95% lượng carbon tích hợp so với gạch nung truyền thống. Chất thải xây dựng ngày càng lớn do quá trình đô thị hóa nhanh, từ gạch vỡ, bê tông, tro bay đến thủy tinh công nghiệp. Tái sử dụng những vật liệu này để sản xuất gạch giúp giảm áp lực xử lý rác thải, hạn chế việc khai thác đất sét hay giảm tiêu hao năng lượng và phát thải carbon. Các nghiên cứu quốc tế chỉ ra rằng gạch tái chế mang lại lợi ích kinh tế rõ rệt. Nghiên cứu tại Ai Cập ghi nhận gạch tái chế từ hỗn hợp gạch vỡ và nhựa giảm chi phí sản xuất đến 60 % so với loại truyền thống, đồng thời tiết kiệm năng lượng 33,5 %. Tại Anh, loại ""K‐Briq"" được làm từ 90 % phế thải xây dựng không nung, giảm 95% lượng carbon tích hợp so với gạch nung truyền thống. Trong kiến trúc nhà ở, gạch tái chế được ứng dụng ở các hạng mục ngoại thất hoặc không gian không chịu lực. Các mảng tường điểm nhấn, lối đi sân vườn, tường rào hay ốp mặt tiền là nơi vật liệu này phát huy hiệu quả về thẩm mỹ và công năng. Với bề mặt thô mộc, gạch tái chế phù hợp với phong cách công nghiệp (industrial), tối giản hoặc những công trình hướng tới sự gắn kết cảnh quan xanh. Trong kiến trúc nhà ở, gạch tái chế được ứng dụng ở các hạng mục ngoại thất hoặc không gian không chịu lực. Các mảng tường điểm nhấn, lối đi sân vườn, tường rào hay ốp mặt tiền là nơi vật liệu này phát huy hiệu quả về thẩm mỹ và công năng. Với bề mặt thô mộc, gạch tái chế phù hợp với phong cách công nghiệp (industrial), tối giản hoặc những công trình hướng tới sự gắn kết cảnh quan xanh. Ngôi nhà hiện đại tại đường Herbert, Mornington (Australia) là ví dụ cho việc sử dụng vật liệu gạch tái chế. Công trình sử dụng hơn 20.000 viên gạch tái chế, kết hợp giữa phong cách đô thị và thiết kế đương đại. Ngôi nhà hiện đại tại đường Herbert, Mornington (Australia) là ví dụ cho việc sử dụng vật liệu gạch tái chế. Công trình sử dụng hơn 20.000 viên gạch tái chế, kết hợp giữa phong cách đô thị và thiết kế đương đại. Căn nhà sử dụng gạch tái chế và gỗ tự nhiên để tạo không gian sống yên tĩnh, kín đáo ở thành phố biển Wollongong, Australia. Để đảm bảo riêng tư và an ninh cho trẻ nhỏ, ngôi nhà bố trí hàng rào cao nhưng thông thoáng, với kính hai lớp cách âm, chống nhìn xuyên và cửa sổ cao. Căn nhà sử dụng gạch tái chế và gỗ tự nhiên để tạo không gian sống yên tĩnh, kín đáo ở thành phố biển Wollongong, Australia. Để đảm bảo riêng tư và an ninh cho trẻ nhỏ, ngôi nhà bố trí hàng rào cao nhưng thông thoáng, với kính hai lớp cách âm, chống nhìn xuyên và cửa sổ cao. Công trình nằm giữa tổ hợp khách sạn và cao ốc thương mại, nhưng được thiết kế như một ngôi nhà riêng tư cho gia đình 5 người cùng hai chú chó. Yêu cầu của chủ nhà là không gian sống một tầng, ít bảo trì, mang chất liệu tự nhiên. Vì vậy, KTS lựa chọn vật liệu chính gồm bê tông, gạch tái chế, gỗ Tasmania cho trần nhà, đồng thời sử dụng hệ kính lớn giúp lấy sáng. Công trình nằm giữa tổ hợp khách sạn và cao ốc thương mại, nhưng được thiết kế như một ngôi nhà riêng tư cho gia đình 5 người cùng hai chú chó. Yêu cầu của chủ nhà là không gian sống một tầng, ít bảo trì, mang chất liệu tự nhiên. Vì vậy, KTS lựa chọn vật liệu chính gồm bê tông, gạch tái chế, gỗ Tasmania cho trần nhà, đồng thời sử dụng hệ kính lớn giúp lấy sáng. Công trình tại Melbourne, Australia này có ba tầng: gara tại tầng một, tầng hai là studio, sân thượng trồng rau ở phía trên cùng. Nhà sử dụng vật liệu tái chế kết hợp gạch men màu đỏ - xanh tạo điểm nhấn thị giác. Cầu thang với thiết kế xoắn ốc và cửa sổ tròn làm điểm nhấn cho công trình. Công trình tại Melbourne, Australia này có ba tầng: gara tại tầng một, tầng hai là studio, sân thượng trồng rau ở phía trên cùng. Nhà sử dụng vật liệu tái chế kết hợp gạch men màu đỏ - xanh tạo điểm nhấn thị giác. Cầu thang với thiết kế xoắn ốc và cửa sổ tròn làm điểm nhấn cho công trình. Sự thay đổi ánh sáng theo thời điểm trong ngày làm nổi bật các chi tiết gạch men và tái chế, tạo hiệu ứng ánh sáng - bóng đổ. Sự thay đổi ánh sáng theo thời điểm trong ngày làm nổi bật các chi tiết gạch men và tái chế, tạo hiệu ứng ánh sáng - bóng đổ. Căn nhà tại Richmond, Mỹ với kiến trúc công nghiệp hiện đại. Gạch đỏ tái chế được sử dụng đồng bộ từ ngoại thất đến nội thất. Căn nhà tại Richmond, Mỹ với kiến trúc công nghiệp hiện đại. Gạch đỏ tái chế được sử dụng đồng bộ từ ngoại thất đến nội thất. Công trình ở Gentbrugge (Bỉ), ứng dụng gạch tái chế, mang đến vẻ ngoài tối giản, bền vững với thời gian. Phần bên ngoài hình trụ tròn ôm lấy không gian bên trong. Công trình ở Gentbrugge (Bỉ), ứng dụng gạch tái chế, mang đến vẻ ngoài tối giản, bền vững với thời gian. Phần bên ngoài hình trụ tròn ôm lấy không gian bên trong. Gạch tái chế cũng được sử dụng hoàn thiện bề mặt bên trong căn nhà, tạo cảm giác sống gần gũi tự nhiên. Gạch tái chế cũng được sử dụng hoàn thiện bề mặt bên trong căn nhà, tạo cảm giác sống gần gũi tự nhiên. Bích Phương(theoArchitecture and design, Designboom)Ảnh:Stijn Bollaert, Tess Kelly, Tim Shaw, Erik Holt","Thứ sáu, 5/9/2025, 00:03 (GMT+7)",Bích Phương,Bất động sản,Không gian sống,VN Express,"Quá trình đô thị hóa tạo ra lượng lớn chất thải xây dựng. Việc tái chế chất thải này thành gạch mang lại nhiều lợi ích kinh tế và môi trường, như giảm chi phí sản xuất, tiết kiệm năng lượng, và giảm phát thải carbon. Gạch tái chế được ứng dụng rộng rãi trong kiến trúc nhà ở, đặc biệt ở các hạng mục ngoại thất và không gian không chịu lực, phù hợp với nhiều phong cách thiết kế. Các công trình tại Australia là minh chứng cho hiệu quả sử dụng gạch tái chế trong kiến trúc hiện đại."
VNEX_050925_00011,Ông Trump nói 'sẽ có chuyện xảy ra' nếu không hài lòng với ông Putin,https://vnexpress.net/ong-trump-noi-se-co-chuyen-xay-ra-neu-khong-hai-long-voi-ong-putin-4934786.html,"""Tôi không có thông điệp nào để gửi Tổng thống Nga Vladimir Putin. Ông ấy biết lập trường của tôi và sẽ tự ra quyết định"", Tổng thống Mỹ Donald Trump phát biểu với báo giới tại Phòng Bầu dục ngày 3/9, khi ông gặp người đồng cấp Ba Lan Karol Nawrocki. ""Bất kể quyết định của ông ấy là gì, chúng tôi cũng sẽ hài lòng hoặc không hài lòng. Nếu chúng tôi không hài lòng, các bạn sẽ thấy có chuyện xảy ra"", ông chủ Nhà Trắng tiếp tục, nhưng không nêu cụ thể là chuyện gì. Tổng thống Trump bác bỏ thông tin cho rằng ông có lập trường mềm mỏng với Nga. Ông nêu dẫn chứng là các lệnh trừng phạt thứ cấp đối với Ấn Độ vì mua dầu của Nga, đồng thời ám chỉ có thể còn các bước tiếp theo. ""Các bạn gọi đó là không hành động gì à? Tôi còn chưa thực hiện giai đoạn hai và ba"", ông Trump nói. Tổng thống Mỹ Donald Trump tại Nhà Trắng ngày 3/9. Ảnh:AFP Sau khi trở lại Nhà Trắng hồi tháng 1, ông Trump đã đẩy mạnh nỗ lực trung gian nhằm chấm dứt chiến sự Ukraine, nhưng đến nay chưa có đột phá. Ông đã họp thượng đỉnh với người đồng cấp Putin ở Alaska, sau đó gặp các lãnh đạo châu Âu và Tổng thống Ukraine Volodymyr Zelensky tại Nhà Trắng. Các sự kiện làm dấy lên kỳ vọng về cuộc gặp trực tiếp giữa ông Putin và ông Zelensky để thảo luận về phương án chấm dứt chiến sự. Tuy nhiên, những diễn biến sau đó cho thấy triển vọng sự kiện rất mong manh. Tổng thống Putin ngày 3/9 cho biết các bên đang đứng trước cơ hội chấm dứt chiến sự Ukraine thông qua đàm phán ""nếu lẽ phải thắng thế"", nhưng cũng cảnh báo rằng Moskva sẵn sàng kết thúc cuộc chiến bằng vũ lực nếu đó là phương cách duy nhất. Ông chủ Điện Kremlin tuyên bố sẵn sàng gặp người đồng cấp Zelensky nếu lãnh đạo Ukraine đến Moskva. Ngoại trưởng Ukraine Andrii Sybiha gọi đây là đề xuất ""không thể chấp nhận được"". Như Tâm(TheoAFP, Reuters)","Thứ sáu, 5/9/2025, 10:01 (GMT+7)",Như Tâm,Thế giới,Tư liệu,VN Express,"Tổng thống Trump tuyên bố không có thông điệp riêng gửi tới Putin, người đã biết rõ lập trường của ông, và Mỹ sẽ có phản ứng nếu không hài lòng với quyết định của Nga về Ukraine. Ông bác bỏ cáo buộc mềm mỏng với Nga, viện dẫn các lệnh trừng phạt và ám chỉ các biện pháp tiếp theo. Mặc dù nỗ lực trung gian hòa giải chiến sự Ukraine của Trump chưa đạt đột phá, Putin bày tỏ sẵn sàng đàm phán nếu ""lẽ phải thắng thế"", nhưng cũng cảnh báo về khả năng sử dụng vũ lực, trong khi Ukraine bác bỏ đề xuất đàm phán tại Moscow."
VNEX_050925_00023,Chủ tịch Liên đoàn quyền Anh Việt Nam nghi bị bắt vì buôn ma túy,https://vnexpress.net/chu-tich-lien-doan-quyen-anh-viet-nam-nghi-bi-bat-vi-buon-ma-tuy-4935309.html,"Ông Bảo đã rời Việt Nam sang Mỹ tháng 2/2025 với lý do giải quyết việc gia đình. Kể từ đó, các thành viên trong VBF không thể liên lạc với ông. Trong cuộc họp khẩn của Liên đoàn hôm qua, Chủ tịch Lưu Tú Bảo tiếp tục vắng mặt dù được mời tham dự trực tuyến. Vị này sau đó được xác định không còn khả năng điều hành liên đoàn, do dính líu đến các vấn đề pháp lý tại Mỹ. Vì vậy, VBF sẽ triệu tập đại hội rồi tiến hành bầu cử ban chấp hành và chọn ra một chủ tịch mới. Ông Lưu Tú Bảo (giữa) nhận đai danh dự WBA châu Á vì những đóng góp cho quyền Anh Việt Nam, tháng 10/2023 tại TP HCM. Ảnh:Kickfit Sự vắng mặt của ông Bảo khiến dư luận đặt dấu hỏi từ nhiều tháng qua, nhất là khi có tin ông gặp rắc rối pháp lý ở nước ngoài. Theo trang tin MỹSan Francisco Public Safety News,một người đàn ông tên ""Bao Luu"" - trùng khớp với danh tính của ông Bảo - bị bắt tại California hồi tháng 4 và đã ra hầu tòa liên bang tại San Francisco theo yêu cầu dẫn độ của Australia. Người này bị cáo buộc cầm đầu và giám sát một tổ chức tội phạm xuyên quốc gia, điều hành hoạt động buôn bán ma túy từ Việt Nam. Trong giai đoạn 2016-2017, nhóm này được cho là đã tìm cách đưa tổng cộng 178 kg cocaine vào Australia. Tới tháng 4/2025, Tòa án Melbourne ra lệnh bắt giữ ""Bao Luu"" và lệnh này đến giờ vẫn còn hiệu lực. Hồ sơ tại Mỹ cho thấy công tố viên Australia nắm trong tay nhiều tin nhắn được cho là của ông ""Bao Luu"" với các cộng sự, trao đổi về việc nhập hàng và hình ảnh những bánh cocaine. Ông sử dụng các ứng dụng mã hóa SkyECC và Cypher Elite, với nhiều biệt danh khác nhau, để liên lạc với đối tác và thậm chí cả mật vụ chìm của FBI. Tại phiên tòa ở San Francisco, luật sư biện hộ Jay Rorty khẳng định thân chủ là công dân Mỹ, bị bắt ngay khi nhập cảnh để dự tang lễ con. Ông cũng nói rằng chưa có bằng chứng xác thực nào ngoài lời cáo buộc từ phía Australia. Thẩm phán Thomas Hixson đã quyết định tạm giam ""Bao Luu"" và ấn định phiên điều trần tiếp theo vào ngày 28/8/2025. Sau đó, tòa tiếp tục sắp xếp lịch xử dẫn độ vào ngày 29/1/2026, sau khi nhận đủ hồ sơ từ phía Australia. Nếu bị dẫn độ và kết tội tại Australia, ""Bao Luu"" có thể chịu án tù chung thân. Ông Bảo sinh năm 1976, có hơn 10 năm kinh nghiệm phát triển quyền Anh và các môn võ ở Việt Nam. Ông làm Chủ tịch VBF khóa II, từ ngày 15/10/2023, đồng thời giữ chức Chủ tịch Liên đoàn Võ tổng hợp TP HCM (HMMAF) và Giám đốc điều hành Saigon Sports Club (SSC) - một trong những CLB quyền Anh chuyên nghiệp ra đời sớm nhất ở Việt Nam. Ông từng được Hiệp hội quyền Anh WBA châu Á trao đai danh dự năm 2023 vì đóng góp cho phong trào. Đức Đồng","Thứ sáu, 5/9/2025, 08:19 (GMT+7)",Đức Đồng,Thể thao,Các môn khác,VN Express,"Chủ tịch Liên đoàn Quyền Anh Việt Nam (VBF) Lưu Tú Bảo vắng mặt dài ngày và không thể liên lạc sau khi sang Mỹ vào tháng 2/2025. Ông Bảo bị cáo buộc dính líu đến đường dây buôn bán ma túy xuyên quốc gia và bị bắt tại Mỹ theo yêu cầu dẫn độ của Australia. Do không còn khả năng điều hành và vướng vào các vấn đề pháp lý nghiêm trọng, VBF sẽ tiến hành bầu cử chủ tịch mới. Nếu bị dẫn độ và kết tội tại Australia, ông Bảo có thể phải đối mặt với án tù chung thân."
