id,title,link,content,date,author,category,sub_category,source,summary
VNEX_291025_00104,Tiền đánh bạc từ đâu ra?,https://vnexpress.net/tien-danh-bac-tu-dau-ra-4957066.html,"Trong số 136 người bị xét xử về tộiĐánh bạc,có cựu Phó Chủ tịch Phú Thọ (cũ), cựu bí thư Thành ủy thành phố Hòa Bình - tỉnh Hòa Bình (cũ), cựu Hiệu phó Đại học Hùng Vương, và một số cán bộ trưởng - phó phòng cấp tỉnh... Theo cáo trạng, chỉ trong 5 tháng lúc còn đương chức, Phó Chủ tịch Phú Thọ, dưới cái tên nước ngoài ""Mr. Michael"", đã 95 lần tham gia sát phạt tại sòng bài King Club, ""nướng"" hơn 7 triệu USD, tương đương hơn 170 tỷ đồng. Lần chơi ít nhất gần 118 triệu đồng, lần nhiều nhất tới 8 tỷ đồng và thua bạc 18 tỷ đồng. Những cáo buộc này gây sững sờ không chỉ vì độ lớn của khoản tiền, mà bởi một câu hỏi bật ra ngay lập tức: một phó chủ tịch tỉnh lấy đâu ra hàng triệu USD để đánh bạc trong thời gian ngắn như vậy? Tính cả lương, phụ cấp, thưởng và các khoản thu nhập hợp pháp khác, con số ấy cũng rất khó tưởng. Câu hỏi khó trả lời này lại dẫn tới một nghi vấn khác: liệu đồng tiền có đến từ quyền lực? Trong xã hội, mỗi nghề đều có quy luật sinh lợi riêng. Làm ruộng nếu được mùa - lãi gấp đôi; buôn bán giỏi giang và chịu khó bươn chải - lãi gấp ba. Còn khi quan chức có thể vung ra số tiền gấp 1.000 lần thu nhập bình quân hàng tháng của người lao động cho một lần đánh bạc, người dân có quyền nghi ngờ tính minh bạch về tài sản của họ. Đây là chuyện con sâu bỏ rầu nồi canh, bởi không phải ai làm quan cũng hành xử bất chính. Dù bộ máy được vận hành bởi những cán bộ liêm chính, tận tụy, chỉ cần một tỷ lệ nhỏ những con bạc ở cấp phó chủ tịch tỉnh, cựu bí thư thành phố, niềm tin xã hội sẽ ít nhiều bị tổn thương. Bởi vấn đề không chỉ là sa ngã cá nhân, mà còn là dấu hiệu về sự thiếu chặt chẽ trong quản lý tài sản và giám sát quyền lực. Những sự việc như thế không tự nhiên xảy ra, mà nảy sinh từ điều kiện thuận lợi mà các cá nhân này có được: quyền lực lớn, giám sát yếu, và chế tài chưa đủ mạnh. Việt Nam đã có quy định về kê khai tài sản, thu nhập, nhưng ở một số nơi chỉ dừng lại ở mức hình thức. Cán bộ kê khai ít khi bị kiểm tra chéo hay xác minh thực tế. Khi không có cơ quan độc lập thẩm định, bản kê khai rất dễ trở thành một thủ tục hành chính... mang tính tượng trưng. Một số quốc gia châu Á đã chứng minh: minh bạch tài sản là cốt lõi của liêm chính công quyền. Ở Singapore, Cục Điều tra Tham nhũng (CPIB) có quyền rất mạnh, bao gồm việc được khám xét, tịch thu, điều tra tài sản ngay khi có những dấu hiệu khả nghi ban đầu. Tại Hàn Quốc, việc công khai tài sản quan chức là bắt buộc. Báo chí, công chúng được quyền tiếp cận dữ liệu này. Một bộ trưởng Tư pháp nước này từng phải từ chức do bê bối gia đình và các khoản đầu tư không minh bạch. Sự sa chân vào sòng bạc của các quan chức, cán bộ trong đường dây hơn 100 triệu USD này chỉ là phần nổi của tảng băng. Phần chìm là sự tồn tại ở đâu đó những không gian dung túng sự dễ dãi. Một người có vị trí, nếu không bị kiểm soát, sẽ sớm coi quyền lực như tài sản riêng. Càng ít giám sát, càng dễ sinh tâm lý ""một mình một cõi"". Trong môi trường đó, có thể còn có những ""sự im lặng bảo thân"" do thiếu cơ chế bảo vệ người tố giác. Đó là lý do khi nhiều vụ án lớn được đưa ra ánh sáng, người dân thường ngạc nhiên: tại sao bao nhiêu năm không ai biết? Mất mát lớn nhất trong vụ án này có lẽ là mối ngờ về sự bất minh của các khoản tiền, sự suy giảm niềm tin vào hiệu quả của quy trình giám sát. Khi niềm tin bị tổn thương, không thể lấy lại bằng lời hứa, mà chỉ bằng hành động thực chất. Hành động đó là gì? Là công khai hóa tài sản của cán bộ, lãnh đạo. Là thiết lập cơ quan độc lập có quyền xác minh, điều tra tài sản bất thường, tách khỏi hệ thống hành chính địa phương để đảm bảo khách quan. Là bảo vệ người tố cáo và khuyến khích báo chí điều tra, thay vì e dè, né tránh. Và quan trọng nhất: xử lý nghiêm minh, công khai, không có vùng cấm. Chỉ khi ấy, người dân mới thấy công lý không mù quáng, và quyền lực luôn nằm trong khuôn khổ pháp luật. Trong văn hóa Á Đông, làm quan từng được coi là lý tưởng của người được ăn học. Làm quan để phụng sự, để ""đem sức mình giúp dân giúp nước"". Ngày nay cũng vậy. Làm quan đúng nghĩa là gánh trách nhiệm, chịu kiểm soát, sống minh bạch. Làm quan để làm giàu và hưởng thụ thú vui bằng nguồn thu bất chính, sớm muộn cũng thành gánh nặng cho dân. Một nền quản trị tốt không thể chỉ dựa vào lòng tin, mà phải dựa vào thiết chế kiểm soát tài sản và quyền lực, trong đó, cán bộ - công chức bị ràng buộc bởi tính minh bạch và trách nhiệm giải trình. Lê Thọ Bình","Thứ tư, 29/10/2025, 00:00 (GMT+7)",Lê Thọ Bình,Góc nhìn,Kinh doanh & quản trị,VN Express,
VNEX_291025_00016,Ronaldo bị Benzema 'đá' khỏi King's Cup,https://vnexpress.net/ronaldo-bi-benzema-da-khoi-king-s-cup-4957087.html,"Kể từ khi gia nhập Al Nassr, Ronaldo đã thất bại ở tất cả kỳ giải anh tham dự. Siêu sao Bồ Đào Nha lỡ hẹn với danh hiệu trong ba mùa Saudi Pro League, bốn King's Cup, không thể giành Siêu cup Arab Saudi và hai lần thất bại ở AFC Champions League. Ronaldo thất vọng trong trận thua Al Ittihad, trên sân King Saud University, Riyadh, Arab Saudi. Ảnh:BeIN Đối đầu vớiAl Ittihadtối 28/10, Ronaldo và đồng đội nhập cuộc chủ động, nhưng thủng lưới trước. Phút 15, từ pha phản công nhanh, Moussa Diaby bật tường với Karim Benzema ở giữa sân rồi bứt tốc bên cánh phải. Sau đó Diaby tạt cho Benzema dứt điểm gọn gàng, hạ gục thủ môn Bento. Al Nassr chỉ cần 15 phút để gỡ hòa. Từ pha căng ngang của Ronaldo bên cánh trái, hậu vệ của Al Ittihad phá bóng không dứt khoát, tạo điều kiện để Angelo Gabriel dứt điểm tung nóc lưới. Nhưng, Al Ittihad một lần nữa vượt lên ở cuối hiệp, khi Houssem Aouar xâm nhập từ cánh trái, đặt lòng vào góc xa thành bàn. Al Nassr có lợi thế hơn người từ phút 49, khi Ahmed Al Julaydan của Al Ittihad bị thẻ đỏ sau pha phạm lỗi nguy hiểm với Yahya. Dù vậy, hàng công với những Ronaldo, Sadio Mane hay Joao Felix vẫn không thể xuyên thủng hàng thủ Al Ittihad trong phần còn lại trận đấu, đành chấp nhận thua 1-2 và bị loại. Al Ittihad của Benzema giành vé vào tứ kết King's Cup Arab Saudi, gặp Al Fateh. Trong cả trận,Ronaldochỉ để lại dấu ấn trong bàn gỡ hòa, còn lại khá mờ nhạt. Anh dứt điểm 5 lần, trong đó có một lần trúng hướng cầu môn, chuyền chính xác chỉ 83%, không qua người lần nào và mất bóng bảy lần. Thất bại khiếnAl Nassrđứt chuỗi 10 trận thắng liên tiếp trên mọi đấu trường, gồm 6 trận ở Saudi Pro League và 3 tại AFC Champions League Two. Sau khi đã thua ở Siêu cup Arab Saudi, đây là lần thứ hai Ronaldo và đồng đội lỡ cơ hội nâng cup mùa này. Sau trận HLV Al Nassr, Jorge Jesus kêu gọi các học trò và người hâm mộ bình tĩnh. Ông nhấn mạnh rằng mục tiêu lớn nhất của đội vẫn là vô địch giải quốc nội, cũng như sân chơi châu lục AFC Champions League Two - nơi Al Nassr được đánh giá cao bậc nhất tại giải. Vy Anh","Thứ tư, 29/10/2025, 06:24 (GMT+7)",Vy Anh,Thể thao,Bóng đá,VN Express,"Từ khi gia nhập Al Nassr, Ronaldo chưa giành được danh hiệu nào trong các giải đấu đã tham gia. Trong trận đấu gần nhất tại King's Cup Arab Saudi, dù Al Nassr có lợi thế hơn người, họ vẫn thua Al Ittihad 1-2, với Ronaldo chỉ để lại dấu ấn mờ nhạt. Thất bại này chấm dứt chuỗi 10 trận thắng liên tiếp của Al Nassr, khiến họ lỡ cơ hội giành cúp lần thứ hai trong mùa giải này. HLV Al Nassr kêu gọi đội bóng tập trung vào mục tiêu vô địch giải quốc nội và AFC Champions League Two."
VNEX_291025_00010,Bill Gates: Phúc lợi cho con người nên được ưu tiên hơn cắt giảm khí thải,https://vnexpress.net/bill-gates-phuc-loi-cho-con-nguoi-nen-duoc-uu-tien-hon-cat-giam-khi-thai-4956826.html,"Chia sẻ trên trang cá nhân quan điểm ""sự thật về khí hậu"" ngày 28/10, tỷ phú, nhà từ thiện Bill Gates cho rằng nhiệt độ toàn cầu hay lượng khí thải cắt giảm không phải thước đo khí hậu tốt nhất. Ông lấy ví dụ về hai lựa chọn giữa việc xóa sổ bệnh sốt rét và nhiệt độ tăng thêm 0,1 độ C. ""Tôi sẽ chấp nhận nhiệt độ tăng thêm 0,1 độ C để loại bỏ bệnh sốt rét. Người dân không hiểu được nỗi thống khổ đang tồn tại ngày nay"", ông nêu. Cựu CEO Microsoft phân tích cộng đồng người nghèo chịu ảnh hưởng lớn nhất từbiến đổi khí hậu. Nhưng với đa số họ, mối đe dọa lớn nhất không phải biến đổi khí hậu, mà là bệnh tật và nghèo đói. Ông kêu gọi các nhà lãnh đạo tại hội nghị khí hậu COP30 tới đây tập trung vào thước đo con người thay vì các chỉ số khí thải và nhiệt độ toàn cầu. Bill Gates phát biểu tại Diễn đàn Toàn cầu Bloomberg Philanthropies thường niên ở Manhattan, New York, Mỹ, ngày 24/9. Ảnh:Reuters COP30 là hội nghị khí hậu thường niên, diễn ra ngày 10-21/11 tại thành phố cảng Belem thuộc vùng hạ lưu sông Amazon của Brazil. Các nước tham dự sẽ trình bày cam kết khí hậu quốc gia cập nhật, đánh giá tiến độ thực hiện mục tiêu năng lượng tái tạo đã được thống nhất tại hội nghị thượng đỉnh trước. Thế giới đã dành cả thập kỷ qua để hướng tới các mục tiêu của Thỏa thuận Paris, nhằm hạn chế sự nóng lên toàn cầu dưới 2 độ C so với mức trung bình thời kỳ tiền công nghiệp. Tuy nhiên, mục tiêu này vẫn đang đi chệch hướng. Theo Bill Gates, nhiệt độ không nói lên được gì về chất lượng cuộc sống. Ông cho rằng chất lượng sống không phải khái niệm mơ hồ, mà có thể đo lường bằng chỉ số phát triển con người (HDI) của Liên Hợp Quốc, với thang điểm từ 0 đến 1. Chất lượng sống có sự chênh lệch giữa các quốc gia. Thụy Sĩ có chỉ số HDI cao nhất, mức 0,96. Chỉ số này tại Nam Sudan là 0,33, thấp nhất trong xếp hạng của Liên Hợp Quốc. Khoảng 30 quốc gia ghi nhận điểm HDI thấp nhất là nơi sinh sống của một phần tám dân số thế giới, nhưng chỉ đóng góp khoảng một phần ba phần trăm GDP toàn cầu. ""Họ có tỷ lệ nghèo đói cao nhất và thật đáng buồn, kết quả sức khỏe tồi tệ nhất. Trẻ sinh ra ở Nam Sudan có nguy cơ tử vong trước khi được đón sinh nhật lần thứ năm cao gấp 39 lần so với một đứa trẻ Thụy Điển"", Gates nói. Ông nhấn mạnh sự bất bình đẳng này là lý do chiến lược khí hậu của các quốc gia cần ưu tiên phúc lợi con người, một điều có vẻ hiển nhiên, nhưng đôi khi lại bị xem nhẹ hơn việc giảm khí thải, dẫn đến những hậu quả xấu. Bill Gates dẫn chứng vài năm trước, chính phủ một quốc gia thu nhập thấp đặt mục tiêu cắt giảm khí thải bằng cách cấm phân bón tổng hợp. Năng suất nông nghiệp giảm mạnh, lượng thực phẩm khan hiếm hơn, đẩy giá tăng vọt. Quốc gia này đối mặt với khủng hoảng vì chính phủ coi việc giảm khí thải quan trọng hơn những điều khác. Một ví dụ khác là các tổ chức cho vay đa phương chịu sức ép của nhóm cổ đông giàu có, buộc ngừng tài trợ cho dự án sử dụng nhiên liệu hóa thạch. Nhóm cổ đông hy vọng hạn chế khí thải bằng cách giữ dầu, khí đốt và than đá trong lòng đất. Bill Gates cho rằng áp lực này hầu như không tác động đến khí thải toàn cầu, nhưng khiến các nước nghèo khó tiếp cận khoản vay lãi suất thấp cho nhà máy điện. Số này là nơi cung cấp năng lượng ổn định cho hộ gia đình, trường học và trạm y tế của họ. Ông thừa nhận những tình huống như trên rất phức tạp, bởi việc đốt nhiên liệu hóa thạch giúp ích cho con người hiện tại, nhưng lại gây hại cho khí hậu và ảnh hưởng đến cuộc sống của thế hệ tương lai. ""Hãy nhớ rằng, biến đổi khí hậu không phải là mối đe dọa lớn nhất với cuộc sống và sinh kế người dân ở các nước nghèo, và điều đó cũng không thay đổi trong tương lai"", ông nói. Từ cách nhìn này, tỷ phú công nghệ cho rằng những khoản đầu tư hiệu quả nhất trong thích ứng với biến đổi khí hậu là hoạt động chống đói nghèo và tăng cường sức khỏe. Nếu đo lường hành động khí hậu bằng tác động của từng đồng USD đầu tư, ông Gates cho rằng cải thiện nông nghiệp và y tế nên đứng đầu danh sách. ""Biến đổi khí hậu, bệnh tật và nghèo đói đều là những vấn đề lớn, nên cần giải quyết tương xứng với mức độ thiệt hại mà chúng gây ra. Và chúng ta nên sử dụng dữ liệu để tối đa hóa mọi hành động"", Gates chốt lại. Bảo Bảo(theoGates Notes)","Thứ tư, 29/10/2025, 00:05 (GMT+7)",Bảo Bảo,Kinh doanh,Netzero,VN Express,
VNEX_291025_00017,Ông trùm F1 95 tuổi và cuộc sống yên bình bên con trai 5 tuổi,https://vnexpress.net/ong-trum-f1-95-tuoi-va-cuoc-song-yen-binh-ben-con-trai-5-tuoi-4957077.html,"Bernie Ecclestone và vợ Fabiana gặp nhau vào năm 2009 tại Hội đồng Thể thao Ô tô Thế giới, khi cô làm việc trong bộ phận tiếp thị cho Grand Prix Brazil, trước khi kết hôn vào năm 2012. Tỷ phú người Anh đón sinh nhật trong không khí yên ả bên người vợ 49 tuổi Fabiana và cậu con trai út 5 tuổi Ace. Hai người chia sẻ họ dành hầu hết thời gian cho gia đình, duy trì nếp sống quy củ và hạn chế tối đa công nghệ trong việc nuôi dạy con. Ace không được dùng màn hình vào các ngày trong tuần, phải hoàn thành bài tập trước khi chơi và luôn trò chuyện cùng bố mẹ trong bữa tối. ""Ace là một cậu bé tuyệt vời, thông minh, hiếu kỳ và luôn muốn tìm hiểu mọi thứ"", Ecclestone nói. Fabiana thì cho biết hai vợ chồng bù trừ cho nhau: chồng kiên nhẫn, còn bà nghiêm khắc hơn trong việc đặt ra giới hạn cho con. Đó là hình ảnh hoàn toàn trái ngược với Ecclestone của nhiều thập kỷ trước - người từng điều hành F1 bằng sự quyết liệt và tầm nhìn sắt đá, biến môn thể thao này thành đế chế hàng tỷ USD. ""Tiền chưa bao giờ là động lực chính"", ông nói. ""Tôi chỉ quan tâm đến ý tưởng và quyền kiểm soát"". Bộ sưu tập bao gồm 69 chiếc xe, mà Ecclestone cho biết là hiện thân của 70 năm lịch sử F1. Đầu năm nay, Ecclestone gây chú ý khi bán bộ sưu tập 69 xe F1 cá nhân - trị giá khoảng 663 triệu USD - cho Mark Mateschitz, con trai cố đồng sáng lập Red Bull. Ông gọi đây là ""những chiếc xe viết nên lịch sử thể thao, đánh dấu 70 năm phát triển của F1"", và tin rằng bộ sưu tập đang nằm trong tay người xứng đáng nhất. Mateschitz cho biết ông sẽ mở không gian trưng bày công khai trong tương lai gần. TheoBild, Ecclestone cũng đã bán một du thuyền và dự định bán nốt chiếc còn lại, coi đó là cách dọn dẹp cuộc sống. Fabiana giải thích rằng chúng hầu như chỉ được dùng vài ngày mỗi năm. Sự thay đổi này đến sau vụ kiện thuế năm 2023, khi Ecclestone thừa nhận khai man tài sản ở nước ngoài và phải nộp gần 1 tỷ USD tiền phạt. Ông nhận án treo 17 tháng, thoát tù nhưng khép lại một giai đoạn đầy sóng gió. Giờ đây, dù sở hữu khối tài sản gần 4 tỷ USD, Ecclestone và vợ sống giản dị trong căn nhà gỗ nhìn ra dãy Alps. Ông đọc sách vào buổi sáng, đi dạo buổi chiều và tối quây quần cùng gia đình. Fabiana cùng Ecclestone dắt con trai út Ace, 5 tuổi, đi dạo. Ảnh:Bild Điều khiến nhiều người ngạc nhiên là ""cây gia phả"" của ông: con gái lớn Deborah đã 70 tuổi, trong khi con út Ace mới vào lớp một. ""Thật kỳ lạ khi nhìn đứa lớn và đứa nhỏ rồi nhận ra chặng đường dài giữa hai thế hệ"", ông nói. Ace đang học tại một trường quốc tế gần nhà, nói trôi chảy tiếng Anh, Bồ Đào Nha, Thụy Sĩ, Đức. Fabiana mong con trai hiểu giá trị của cuộc sống bình thường, dù sinh ra trong gia đình giàu có. Khi nhìn lại sự nghiệp, Ecclestone nhắc đến những người bạn đã khuất - tay đua Jochen Rindt, chủ tịch FIA Max Mosley và huyền thoại Niki Lauda - những người từng gắn bó với ông suốt nửa thế kỷ. Giờ đây, ông chỉ còn Flavio Briatore, cựu lãnh đạo Renault và Benetton, là bạn thân duy nhất còn sống. ""Nhiều người đến rồi đi"", ông nói. ""Nhưng bạn thật sự, người ở lại với bạn qua mọi thăng trầm thì chỉ có rất ít. Tôi có bốn người như thế, và giờ chỉ còn một"". Bernie Ecclestone (phải) và huyền thoại F1 Michael Schumacher. Ảnh:Bild Bernie Ecclestone là một trong những nhân vật quyền lực nhất trong lịch sử thể thao thế giới. Ông được xem là người đã biến F1 từ một môn đua xe chỉ dành cho giới mê tốc độ thành đế chế thể thao toàn cầu trị giá hàng tỷ USD. Sinh năm 1930 tại Anh, Ecclestone khởi đầu sự nghiệp với vai trò tay đua, sau đó chuyển sang quản lý đội đua và nhanh chóng nắm quyền điều hành toàn bộ hệ thống thương mại của F1 trong nhiều thập kỷ. Trong thời kỳ đỉnh cao, Ecclestone kiểm soát mọi khía cạnh của giải đua - từ bản quyền truyền hình, hợp đồng tài trợ cho đến lịch thi đấu toàn cầu. Dù từng gây tranh cãi vì phong cách điều hành cứng rắn và phát ngôn thẳng thắn, không ai có thể phủ nhận vai trò của ông trong việc đưa F1 trở thành biểu tượng của tốc độ, xa xỉ và sức ảnh hưởng toàn cầu. Ecclestone rời vị trí Giám đốc điều hành F1 đầu năm 2017, sau cuộc chuyển giao quyền lực trị giá 8 tỷ đôla khi tập đoàn Liberty Media hoàn tất thương vụ thâu tóm giải đua xe tốc độ nhất hành tinh. Hồng Duy(theoDaily Mail)","Thứ tư, 29/10/2025, 05:54 (GMT+7)",Hồng Duy,Thể thao,F1,VN Express,
VNEX_291025_00025,Carlsen gieo thêm sầu cho Vua cờ Gukesh,https://vnexpress.net/carlsen-gieo-them-sau-cho-vua-co-gukesh-4957215.html,"Carlsen thắng cả 4 ván gặp Gukesh và kỳ thủ số hai thế giới Hikaru Nakamura. Dù sau đó để thua hai ván liên tiếp dưới tay Fabiano Caruana, kỳ thủ Na Uy vẫn dẫn đầu giải trước ngày thi cuối. Nhưng Carlsen nói anh vẫn chưa hài lòng với màn trình diễn của bản thân: ""Tôi muốn kiểm soát các ván đấu tốt hơn, nhưng dù sao, tôi vẫn phải chấp nhận kết quả này"". Gukesh Dommaraju (phải) trong ván đấu với Magnus Carlsen ở siêu giải Clutch Chess: Champions Showdown tại CLB cờ vua St Louis, bang Missouri, Mỹ, ngày 28/10/2025. Ảnh:SLCC Cả hai ván thắng củaCarlsentrước Gukesh hôm 28/10 có cùng kịch bản. Anh chiếm được ưu thế nhỏ ở cuối trung cuộc, để chuyển hóa thành chiến thắng trong tàn cuộc. Ở ván đầu, Carlsen có lợi thế đôi tượng so với tượng và mã đối thủ. Trong ván sau, anh lại hơn một tốt, dù phải chịu tốt chồng. Ở ngày thi thứ hai,Gukeshchỉ kiếm được ba trong 12 điểm tối đa. Kỳ thủ 19 tuổi không chỉ mất đỉnh bảng sau hai ngày, mà còn rơi xuống cuối với 7 điểm như Hikaru Nakamura. Kỳ thủ Ấn Độ nói sẽ quên màn trình diễn đáng thất vọng trong ngày này. Carlsen với 11,5 điểm, leo lên đỉnh bảng trước ngày cuối. Còn Caruana đứng thứ hai với 10,5 điểm. Ngày cuối cùng diễn ra từ 0h thứ Năm 30/10, giờ Hà Nội. Theo thể thức đặc biệt, mỗi chiến thắng ở ngày cuối sẽ được tính ba điểm, hòa một điểm, khiến khả năng lật ngược tình thế hoàn toàn có thể xảy ra. Thắng một, thua một sẽ được lợi hơn hai ván hòa. Giải quy tụ 4 kỳ thủ hàng đầu thế giới, gồm số một Carlsen, số hai Nakamura, số ba Caruana và Vua cờ đang đứng thứ 11 Gukesh, với quỹ thưởng 412.000 USD. Họ thi đấu cờ nhanh (10 phút, thêm 5 giây sau từng nước đi) theo thể thức vòng tròn 6 lượt, trong ba ngày. Mỗi ngày, số điểm cho một ván thắng tăng dần. Một điểm ở ngày đầu, hai điểm ngày hai và ba điểm ở ngày cuối. Xuân Bình","Thứ tư, 29/10/2025, 10:23 (GMT+7)",Xuân Bình,Thể thao,Các môn khác,VN Express,
