id,title,link,content,date,author,category,sub_category,source,summary
VNEX_311025_00060,Anh có thể hứng chịu dịch cúm tồi tệ nhất thập kỷ,https://vnexpress.net/anh-co-the-hung-chiu-dich-cum-toi-te-nhat-thap-ky-4958068.html,"Cơ quan An ninh Y tế Vương quốc Anh (UKHSA) cho biết các ca mắc đang tăng nhanh, đặc biệt ở trẻ em và thanh thiếu niên, theoTelegraphngày 30/10. Dữ liệu mới nhất cho thấy tỷ lệ ca bệnh tăng từ 6,1% lên 8,2% chỉ trong tuần này, chủ yếu do sự gia tăng đột biến ở trẻ em trong độ tuổi đến trường. Tình hình này diễn ra trong bối cảnh Nhật Bản cũng đang vật lộn với dịch cúm, khiến nhiều trường học phải đóng cửa và 6.000 người nhập viện. Tiến sĩ Suzanna McDonald, trưởng nhóm cúm của UKHSA, cho biết: ""Chúng tôi lo lắng rằng cúm đã bắt đầu lưu hành sớm hơn một chút so với bình thường. Đây là một căn bệnh rất nghiêm trọng, không chỉ là một cơn cảm lạnh khó chịu"". Giới chức lo ngại virus sẽ sớm lây lan sang các nhóm tuổi lớn hơn, dễ bị tổn thương và mùa cúm có thể đạt đỉnh trước khi phần lớn nhóm này được tiêm phòng, do chiến dịch tiêm chủng mới chỉ bắt đầu vài tuần. Tuy nhiên, UKHSA cho biết hiện không có kế hoạch ban hành hướng dẫn khuyến nghị đóng cửa trường học. Theo NHS, tất cả người lớn đủ điều kiện nên đặt mục tiêu tiêm vaccine trước cuối tháng 11. Ảnh:SolStock/E+ Hai trong số những mùa cúm mùa đông tồi tệ nhất thập kỷ qua được ghi nhận trong ba năm gần đây, một phần được cho là do sự bùng phát trở lại của virus sau các hạn chế Covid và khi khả năng miễn dịch cộng đồng ở mức thấp. Năm ngoái, gần 8.000 người ở Anh chết vì cúm. Con số này trong mùa cúm 2022-23 là gần 16.000 người. Sự xuất hiện sớm củacúmđược coi là ""rất đáng lo ngại"" đối với Dịch vụ Y tế Quốc gia (NHS). Ông Rory Deighton, Giám đốc chăm sóc cấp tính và cộng đồng tại Liên đoàn NHS, cho biết hệ thống vốn đã ""hoạt động hết công suất"" sau một mùa hè bận rộn và điều này sẽ ""chồng chất thêm áp lực lên các dịch vụ vốn đã bị quá tải"". Ông Duncan Burton, Giám đốc Điều dưỡng của Anh, cũng nhận định sự gia tăng sớm ở trẻ em là ""đặc biệt đáng lo ngại"", vì sự lây lan ở trẻ thường đi trước người lớn. Giới chức y tế đang kêu gọi người dân đi tiêm phòng. Ông Burton nhấn mạnh virus cúm thay đổi hàng năm nên việc tiêm phòng mỗi năm là rất quan trọng để bảo vệ gia đình và giảm lây lan. ""Vaccine là một trong những cách an toàn và hiệu quả nhất để giúp bảo vệ khỏi virus và chuẩn bị cho một mùa đông dự kiến sẽ rất thách thức. Tôi kêu gọi mọi người đủ điều kiện hãy đi tiêm ngay khi có thể"", ông nói. Tiến sĩ Alex Allen, nhà dịch tễ học tư vấn tại UKHSA, nhấn mạnh: ""Nếu bạn đủ điều kiện tiêm vaccine, đó là vì bạn có nguy cơ mắc bệnh nặng cao hơn. Vaccine là tuyến phòng thủ tốt nhất của chúng ta"". Tất cả người lớn đủ điều kiện được khuyến cáo tiêm phòng cúm trước cuối tháng 11. Vaccine cúm miễn phí được cung cấp cho mọi người từ 65 tuổi trở lên, phụ nữ mang thai và những người có bệnh lý nền. Các bậc phụ huynh được nhắc nhở hoàn thành phiếu đồng ý tiêm chủng gửi đến trường học cho con em mình, hoặc đặt lịch hẹn cho trẻ 2-3 tuổi. Tiến sĩ Allen cũng khuyên bất kỳ ai có triệu chứng cúm hoặc Covid, bao gồm sốt cao, ho, mệt mỏi hoặc đau nhức nên hạn chế tiếp xúc với người khác, đặc biệt là những người dễ bị tổn thương, cân nhắc đeo khẩu trang, rửa tay thường xuyên và giữ thông thoáng không gian. Trong khi đó, UKHSA cho biết các ca nhiễm Covid-19 đang giảm và virus này hiện ở mức cơ bản. Bình Minh(TheoTelegraph, BBC)","Thứ sáu, 31/10/2025, 08:43 (GMT+7)",Bình Minh,Sức khỏe,Tin tức,VN Express,
VNEX_311025_00067,'Góc khuất' viện dưỡng lão,https://vnexpress.net/goc-khuat-vien-duong-lao-4954114.html,"Sau cánh cửa khép hờ, một cụ bà gầy gò đập chân như bổ củi xuống đệm, lầm bầm chửi đổng. Ở ba chiếc giường bên cạnh, những cụ khác nằm bất động, đôi mắt mở trừng, im lặng chịu đựng. Lên thêm một tầng, khung cảnh trái ngược. Sau tiếng gọi của điều dưỡng, hành lang rộn lên tiếng bước chân của các cụ đi dùng bữa xế. Tiếng cười nói khuấy động căn phòng, rộn rã như lớp mầm non. Tầng trên cùng là khu VIP, nơi chỉ có một đến ba người ở chung phòng. Trong mỗi phòng đều có TV, tủ lạnh, nhà vệ sinh riêng, cửa sổ mở ra đón nắng và tầm nhìn đẹp. Hầu hết những người sống ở đây còn minh mẫn và cuộc sống của họ như đi nghỉ dưỡng. ""Mỗi cầu thang trong viện dưỡng lão như dẫn vào một lát cắt khác nhau của tuổi già. Viện dưỡng lão là một xã hội thu nhỏ với nhiều ""góc khuất"" và không phải người cao tuổi nào vào cũng dễ dàng thích nghi"", chị Trần Thị Thúy Nga, chuyên gia ngành Công tác xã hội, phó giám đốc một hệ thống dưỡng lão ở miền Bắc nói. Người cao tuổi tắm nắng, vận động nhẹ nhàng tại một viện dưỡng lão ở Hoàng Mai, Hà Nội tháng 9/2025. Ảnh:Phan Dương Sống trong viện dưỡng lão ở Hoàng Mai một năm nay, bà Thúy Hà, 88 tuổi, cho biết thích chế độ ăn uống, nếp sinh hoạt hợp với tuổi già. Có nhiều bạn già và các điều dưỡng trẻ trò chuyện, khác hoàn toàn với cuộc sống cùng người giúp việc trước đây, cả ngày không được nói chuyện một câu. ""Nhưng sống tập thể có những chuyện rất khó chịu"", bà nói. Phòng bà Hà có bốn người, trong đó một cụ đang có những biểu hiện mắc Alzheimer. Cụ này rất ghét ai chạm vào người, mỗi lần điều dưỡng tắm rửa bị phản ứng dữ dội. Phiền toái nhất là sở thích nghịch nước. Chỉ cần sơ hở, bà cụ vào nhà vệ sinh mở vòi nước. Có những trưa, cụ ngồi lì trong đó, xả nước nghịch, không ai khuyên nổi. ""Chúng tôi nhiều lần phản ánh. Điều dưỡng và ban giám đốc nhắc nhở, khóa vòi nhưng bà ấy cứ tái diễn"", bà Hà kể. Hết cách, cả phòng đề xuất đưa cụ này xuống khu dành cho người sa sút trí tuệ. Nhưng gia đình cụ không đồng ý, một mực yêu cầu phải ở lại phòng. Tuần đầu tiên vào viện dưỡng lão ở Tây Hồ, cụ Đặng Thị Ngọc Bảo, 93 tuổi, cũng sốc nặng. ""Đang ăn, các cụ cũng có thể cãi nhau chỉ vì chỗ ngồi. Có khi một người ho, cả phòng ho theo hệt như một dàn nhạc giao hưởng"", cụ kể. Thời đó cụ Bảo ở cùng phòng với một bà ""siêu cá tính"". Mới 7-8h tối, bà đã yêu cầu tắt điện đi ngủ. Bà còn giao cho cụ Bảo nhiệm vụ bật quạt, kéo rèm, chỉnh điều hòa. Một lần, vì nhường mọi người đi thang máy trước, cụ Bảo lên phòng muộn, liền bị quát: ""Bà đi đâu giờ mới về? Nóng chết cả người rồi"". Những câu chuyện này cho thấy xung đột và thích nghi là ""góc khuất"" lớn nhất người cao tuổi phải đối mặt khi vào viện dưỡng lão. Các cụ đã quen với nhịp sống riêng trong gia đình nên phải học lại từ đầu cách sống cùng người lạ - điều tưởng nhỏ nhưng lại rất khó ở tuổi này. Ở nhiều trung tâm hiện nay, các nhân viên công tác xã hội và điều dưỡng không chỉ chăm sóc thể chất, còn trở thành người kết nối, lắng nghe, hóa giải hiểu lầm và khơi lại cảm giác được tôn trọng ở các cụ. Nếu những xung đột sinh hoạt là va đập dễ thấy, thì chênh lệch vật chất và tình cảm lại tạo ra những khoảng cách âm ỉ hơn. Có cụ bước vào trung tâm với nguồn tài chính dồi dào, cũng có cụ phải nhờ những đồng tiền gom góp của con cháu mới có chỗ nương thân. Các viện dưỡng lão hiện có nhiều mức phí, dao động từ 8 đến 30 triệu đồng mỗi tháng. Hơn 10 năm làm ngành này, chị Nga chứng kiến không ít cụ muốn ở lại nhưng con cháu phải đưa về vì không kham nổi chi phí. Tại các viện dưỡng lão như Thiên Đức, Diên Hồng, hay Tâm Phúc đã và đang hỗ trợ một số trường hợp không may ""đứt gánh giữa đường"". Trong số những mảnh đời như vậy, có bà Lệ Hà, 82 tuổi, ở tại một viện dưỡng lão ở thị trấn Xuân Mai. Bà từng có quá khứ khấm khá, nhưng người con trai duy nhất ăn chơi, tiêu tán hết tài sản. Bị đẩy vào bước đường cùng, bà tìm đến viện dưỡng lão. Tuy nhiên khi chi phí ngày càng tăng, mức lương hưu hơn 5 triệu đồng của bà không kham nổi. ""Những ngày đó, sự lo lắng như một bóng đen đè nặng, tôi đã tính đến chuyện ra ngoài thuê phòng trọ bình dân, sống cùng sinh viên để có người bầu bạn và hỗ trợ lúc ốm đau,"" bà chia sẻ. May mắn, trung tâm dưỡng lão bà Hà đang sống mở cơ sở mới xa trung tâm thành phố, giá bình dân hơn, đồng thời giảm cho bà một phần chi phí. Hơn hai năm nay bà được sống trong trung tâm mới xây theo tiêu chuẩn Nhật Bản, có nhiều cây xanh và bạn già trò chuyện. Lại có người giàu có tiền bạc nhưng thiếu hơi ấm tình thân. Bà Nguyễn Thị Hoàn, 82 tuổi, sống ở một viện dưỡng lão tại Lĩnh Nam kể rằng đã sống một mình nhiều năm từ khi ly hôn và hai con định cư tại Czech. Những tưởng gần đất xa trời được con cháu đón sang đoàn tụ, phụng dưỡng cuối đời, nhưng không được mấy năm bà lại phải trở về vì bệnh tai biến và khó khăn thủ tục nhập cư. Mặc dù thi thoảng có các cháu họ vào thăm và con gọi điện về, bà vẫn không khỏi chạnh lòng. ""Lo chứ"", mắt bà ngấn nước nói về viễn cảnh sức khỏe ngày một yếu đi, trong khi các con ở quá xa. Theo chị Thúy Nga, chìa khóa để xóa nhòa phần nào những chênh lệch vật chất hay tình cảm, nằm ở việc kiến tạo một môi trường thật sự nhân văn và tôn trọng. Tại đó, người cao tuổi phải được nhìn nhận qua giá trị sống, kinh nghiệm tích lũy và những câu chuyện đời của họ, chứ không phải qua số tiền đóng phí hay tình trạng sức khỏe. Bên cạnh các hoạt động giao lưu nội bộ, kết nối và tâm tình thường xuyên, chị Nga cũng nhấn mạnh vai trò thiết yếu từ sự hiện diện của người nhà, bạn bè. ""Có những cụ con cái bận rộn hoặc ngại đường xa, ít khi ghé thăm, chúng tôi đã gọi điện nhắc họ"", chị Nga chia sẻ. Một ""góc khuất"" khác là cảm giác đánh mất giá trị bản thân. Hơn một nửa người cao tuổi vào đây không thể tự chăm sóc, nhiều người vẫn giữ quan niệm ""trẻ cậy cha, già cậy con"", nên khi phải rời nhà, họ mang theo mặc cảm bị bỏ rơi. Ông Nguyễn Tuấn Ngọc - người đầu tiên mở viện dưỡng lão tư nhân tại Việt Nam - nhớ lại, 10-20 năm trước, quan niệm ""đưa cha mẹ vào viện dưỡng lão là bất hiếu"" rất nặng nề và chính nó là rào cản để mô hình này tiếp cận thị trường. ""Giờ đây, khi cấu trúc gia đình thay đổi, con cái đi làm xa, người già sống lâu hơn, quan niệm ấy đã được nhìn nhận thực tế hơn"", ông nói. Cụ Ngọc Bảo, 93 tuổi (phải) trò chuyện với một cụ bà trong một viện dưỡng lão ở Tây Hồ, Hà Nội cuối tháng 9/2025. Ảnh:Phan Dương Nhưng thay đổi suy nghĩ là một chuyện, tìm lại giá trị trong môi trường mới lại là hành trình khác. Với cụ Ngọc Bảo, hành trình đó bắt đầu sau một mất mát lớn. Năm 2023, con trai duy nhất của cụ qua đời vì ung thư. Trong những ngày buồn bã, cụ tình cờ xem chương trình nói về người cao tuổi sống tại viện dưỡng lão, nên quyết định đi một thời gian cho khuây khỏa. Vào môi trường này chứng kiến rất nhiều hoàn cảnh khiến cụ Bảo tự chuyển biến cảm xúc của mình. ""Tôi từng hai lần mổ ung thư vú, ba lần bị ngã cầu thang phải mổ não, may mắn tôi vẫn giữ được minh mẫn. Nhìn các cụ khác, tôi tự thấy mình có cuộc sống may mắn hơn"", cụ tâm sự. Từ ngày vào đây cụ Bảo bỗng thấy mình có ích. ""Tôi bắt đầu chìa tay ra với người khác, một chai dầu, cây gậy, một lời hỏi thăm, một cái dắt tay xuống cầu thang cũng là sự an ủi ở tuổi này"", cụ nói. Từ ngày có cụ Bảo, không khí trong trung tâm cũng ấm áp hơn. Một cụ bà sống khép mình trên tầng VIP đã theo chân cụ Bảo xuống dưới giao du, giúp đỡ mọi người. Sau hai năm vào viện dưỡng lão, cụ thấy được nhiều hơn mất. Con cháu nhiều lần muốn đón về, nhưng cụ chỉ ở vài ngày rồi lại quay lại trung tâm - nơi cụ gọi là ""nhà của mình"". ""Giờ tôi thấy mình có giá trị, ở cái nơi người ta tưởng chỉ dành cho tuổi gần đất xa trời"", cụ bà 93 tuổi nói. Phan Dương","Thứ sáu, 31/10/2025, 06:00 (GMT+7)",Phan Dương,Đời sống,Nhịp sống,VN Express,
VNEX_311025_00006,Mỹ giới hạn tiếp nhận 7.500 người tị nạn mỗi năm,https://vnexpress.net/my-gioi-han-tiep-nhan-7-500-nguoi-ti-nan-moi-nam-4958077.html,"""Quyết định này đúng đắn, phù hợp với mối quan tâm nhân đạo và lợi ích quốc gia"", chính quyền Tổng thống Mỹ Donald Trump cho biết ngày 30/10, khi thông báo sẽ tiếp nhận 7.500 người tị nạn cho năm tài khóa 2026. Chính phủ Mỹ không giải thích thêm về sự sụt giảm số lượng người tị nạn được tiếp nhận vào nước này. Đây là con số thấp hơn đáng kể so với mức trần là 125.000 người tị nạn được đưa ra hồi năm ngoái dưới thời cựu tổng thống Joe Biden, tương đương mức giảm 94%. Những người Nam Phi đến Mỹ với tư cách người tị nạn tại buổi lễ chào đón ở Virginia hôm 12/5. Ảnh:AFP Truyền thông Mỹ trước đó đã đưa tin về kế hoạch này, cho biết người Nam Phi da trắng sẽ được ưu tiên tị nạn. Thông báo từ chính phủ Mỹ nhanh chóng vấp phải chỉ trích từ các tổ chức tị nạn. Dự án Hỗ trợ Người tị nạn Quốc tế (IPF) cho biết động thái này cho thấy Washington ""chính trị hóa chương trình nhân đạo"" và ""coi trọng chính trị hơn là bảo vệ"". Ngay trong diễn văn nhậm chức hồi tháng 1, Tổng thống Trump đã thông báo ngưng tiếp nhận người tị nạn và kể từ đó, chỉ một số ít người tị nạn nhập cảnh vào Mỹ, chủ yếu là người Nam Phi da trắng. Chính quyền Mỹ hồi tháng 2 công bố chương trình riêng dành cho người Nam Phi da trắng, với lý do nông dân trong cộng đồng này phải đối mặt với phân biệt đối xử và bạo lực tại quê nhà. Chính phủ Nam Phi bác bỏ cáo buộc này. Ngọc Ánh(TheoAP)","Thứ sáu, 31/10/2025, 08:41 (GMT+7)",Ngọc Ánh,Thế giới,Quân sự,VN Express,
VNEX_311025_00062,Mổ triệt căn ung thư vú kết hợp tái tạo ngực,https://vnexpress.net/mo-triet-can-ung-thu-vu-ket-hop-tai-tao-nguc-4958054.html,"Ban đầu kết quả chọc hút (FNA) cho thấy chị Thư âm tính với ung thư. Tuy nhiên sau ba tháng u không tiêu biến, chị đến Bệnh viện Đa khoa Tâm Anh TP HCM khám, sinh thiết lõi kim xác định ung thư biểu mô xâm nhập dạng tiểu thùy (ung thư vú phải giai đoạn sớm). Ảnh chụp MRI và nhũ ảnh cho thấy khối u ở ngực phải không di căn, ngực trái không bất thường. ThS.BS CKI Huỳnh Bá Tấn, khoa Ngoại Vú - Đầu Mặt Cổ, chỉ định sinh thiết hạch gác cửa bằng kỹ thuật ICG, đoạn nhũ phải tiết kiệm da và tái tạo ngực tức thì bằng vạt cơ thẳng bụng (TRAM). Trước mổ, người bệnh được gây mê toàn thân và tiêm một lượng nhỏ thuốc nhuộm huỳnh quang ICG (Indocyanine Green) quanh nhũ hoa. Sau khi tiêm, thuốc theo dòng bạch huyết đến hạch đầu tiên tiếp nhận dẫn lưu từ khối u - gọi là hạch gác cửa. Dưới camera hồng ngoại gần, hạch này phát sáng màu xanh lục, giúp bác sĩ nhìn rõ đường đi của mạch bạch huyết và xác định chính xác vị trí cần lấy mẫu. Bác sĩ Tấn (phải) phẫu thuật cho bệnh nhân Thư. Ảnh:Bệnh viện Đa khoa Tâm Anh Mẫu được lấy ra gửi xét nghiệm nhanh kết quả dương tính, tế bào ung thư đã di căn hạch, đồng nghĩa chị Thư phải nạo vét toàn bộ hạch nách, ngăn nguy cơ tái phát. Êkíp bóc tách khối u cho chị Thư, lấy vạt da - cơ bụng dưới tái tạo tuyến vú (vạt TRAM), phục hồi thành bụng bằng lưới nhân tạo và đặt hai ống dẫn lưu hút áp lực âm nhằm tránh tụ dịch. Sau mổ, chị Thư tỉnh táo, hồi phục và xuất viện sau ba ngày, dáng ngực tự nhiên, bầu ngực cân đối và không thay đổi nhiều so với trước phẫu thuật. Bác sĩ Tấn cho biết trước đây sinh thiết hạch gác cửa thường dùng các chất màu xanh như isosulfan hay methylene blue dễ gây dị ứng hoặc hoại tử da. ICG khắc phục các vấn đề này và có độ chính xác cao. Hiện, kỹ thuật ICG được ứng dụng trong phẫu thuật gan - mật, ung thư gan, tạo hình vi phẫu và đánh giá lưu thông máu nuôi mô, góp phần nâng cao độ an toàn và hiệu quả trong các ca phẫu thuật lớn. Theo Globocan năm 2022,ung thư vúphổ biến nhất thế giới với hơn 2,3 triệu ca mắc mới và 670.000 ca tử vong mỗi năm. Tại Việt Nam, mỗi năm có hơn 21.500 ca mới, chiếm gần 25% tổng số ung thư ở nữ giới, với khoảng 9.300 ca tử vong. Bác sĩ khuyến cáo phụ nữ trên 40 tuổi nên tầm soát ung thư vú định kỳ bằng siêu âm, nhũ ảnh hoặc MRI, nhất là khi có yếu tố nguy cơ như tiền sử gia đình, béo phì hoặc dùng nội tiết kéo dài. Phát hiện sớm giúp điều trị hiệu quả, giảm tái phát. Minh Tâm","Thứ sáu, 31/10/2025, 08:00 (GMT+7)",Minh Tâm,Sức khỏe,Các bệnh,VN Express,
VNEX_311025_00012,Bảo hiểm PVI 5 năm liên tiếp vào top 50 doanh nghiệp lợi nhuận xuất sắc,https://vnexpress.net/bao-hiem-pvi-5-nam-lien-tiep-vao-top-50-doanh-nghiep-loi-nhuan-xuat-sac-4958128.html,"Theo đại diện Bảo hiểm PVI, việc liên tiếp có mặt trong danh sách cùng các tập đoàn lớn như PVN, Viettel, FPT, Vietcombank cho thấy Bảo hiểm PVI nằm trong nhóm doanh nghiệp có hiệu quả hoạt động và quản trị tốt trên thị trường bảo hiểm phi nhân thọ. Top 50 Doanh nghiệp Lợi nhuận xuất sắc Việt Nam năm 2025 ghi nhận những doanh nghiệp có hiệu quả kinh doanh cao, khả năng sinh lời bền vững và duy trì tăng trưởng ổn định trong bối cảnh thị trường nhiều biến động. Bà Nguyễn Vũ Tâm, Phó tổng giám đốc Bảo hiểm PVI đại diện nhận giải thưởng Top 50 Doanh nghiệp lợi nhuận xuất sắc Việt Nam. Ảnh:Bảo hiểm PVI Trong 9 tháng qua, Bảo hiểm PVI đạt doanh thu 21.538 tỷ đồng, hoàn thành 108,4% kế hoạch năm và tăng 38,7% so với cùng kỳ. Lợi nhuận trước thuế đạt 1.148 tỷ đồng, tương đương 145% kế hoạch năm, tăng hơn 104% so với cùng kỳ 2024. Đáng chú ý, mảng tái bảo hiểm quốc tế ghi nhận doanh thu tăng gấp đôi, cho thấy uy tín của công ty tại thị trường bảo hiểm quốc tế. Trong tháng 9, doanh nghiệp tăng vốn điều lệ lên 4.320 tỷ đồng, củng cố năng lực tài chính và nền tảng tăng trưởng dài hạn. Bảo hiểm PVI hiện được tổ chức xếp hạng tín nhiệm AM Best duy trì mức A- (Xuất sắc) suốt 3 năm liên tiếp. Đây được xem là bước đệm quan trọng để doanh nghiệp mở rộng hoạt động ra khu vực và tiến gần hơn tới mục tiêu trở thành thương hiệu bảo hiểm mang tầm quốc tế. Chia sẻ tại lễ vinh danh, bà Nguyễn Vũ Tâm, Phó tổng giám đốc Bảo hiểm PVI, cho biết giải thưởng là sự khẳng định vị thế của doanh nghiệp trong ngành bảo hiểm Việt Nam. ""Với nền tảng tài chính vững mạnh và chiến lược phát triển bền vững, chúng tôi kiên định mục tiêu tiên phong, nâng cao năng lực cạnh tranh và mang lại giá trị cho khách hàng, cổ đông và nền kinh tế"", bà Tâm nhấn mạnh. Xuất phát từ định hướng phát triển gắn liền trách nhiệm xã hội, doanh nghiệp cho biết tăng trưởng không chỉ là mục tiêu kinh doanh, mà còn là cam kết sẻ chia cùng khách hàng, lan tỏa giá trị thương hiệu Việt và đồng hành cùng quá trình hội nhập, nâng tầm vị thế kinh tế Việt Nam trên trường quốc tế. Trong khuôn khổ lễ vinh danh, PVI Holdings ghi dấu tại hạng mục Top 30 Tập đoàn Đầu tư Chiến lược Việt Nam năm 2025 (Alpha 30). Đây là giải thưởng được Vietnam Report công bố lần đầu tiên, nhằm tôn vinh các tập đoàn tiên phong trong kiến tạo hệ sinh thái, nâng tầm quản trị và thúc đẩy tăng trưởng bền vững. PVI Holdings hiện là tập đoàn đầu tư chiến lược trong lĩnh vực tài chính - bảo hiểm. Với nền tảng tài chính vững mạnh, chiến lược đầu tư bài bản và năng lực quản trị chuẩn quốc tế, PVI Holdings ngày càng khẳng định vị thế tập đoàn Việt Nam tiêu biểu, góp phần định hình mô hình tăng trưởng bền vững cho nền kinh tế. Minh Ngọc","Thứ sáu, 31/10/2025, 10:00 (GMT+7)",Minh Ngọc,Kinh doanh,Doanh nghiệp,VN Express,
