id,title,link,content,date,author,category,sub_category,source,summary
VNEX_030625_00063,6 thói quen ăn uống âm thầm tàn phá sức khỏe,https://vnexpress.net/suc-khoe-cam-nang-6-thoi-quen-an-uong-am-tham-tan-pha-suc-khoe-4893439.html,"Theo ThS.BS Nguyễn Trọng Tín, Bệnh viện Đại học Y Dược TP HCM - Cơ sở 3, trong Y học cổ truyền, ăn uống không đơn thuần là để no bụng hay thỏa mãn vị giác, mà còn là một phương pháp dưỡng sinh - tức giữ gìn và nuôi dưỡng sức khỏe. Khi ăn uống đúng cách, thuận theo quy luật tự nhiên, cơ thể sẽ đạt được trạng thái cân bằng, giúp khí huyết lưu thông, tinh thần minh mẫn. Ngược lại, nếu ăn uống thiếu điều độ - còn gọi là ""ẩm thực thất điều"", sẽ khiến nội tạng rối loạn, khí huyết mất điều hòa, lâu ngày sinh ra bệnh tật. Trong cuộc sống hiện đại, con người ngày càng bận rộn, nhiều người không còn chú ý đến cách ăn uống đúng đắn. Dưới đây là những thói quen phổ biến nhưng lại gây hại cho sức khỏe: Ăn uống không đúng giờ Bỏ bữa sáng, ăn tối quá muộn, hay ăn đêm đều làm rối loạn đồng hồ sinh học của cơ thể. Ví dụ, việc ăn khuya khiến hệ tiêu hóa phải làm việc khi lẽ ra cần nghỉ ngơi, dễ dẫn đến đầy bụng, khó ngủ, thậm chí rối loạn chuyển hóa. Ăn quá no hoặc để bụng quá đói Nhiều người có thói quen nhịn ăn cả ngày rồi ""ăn bù"" vào buổi tối. Cách ăn này khiến dạ dày bị quá tải đột ngột, gây khó tiêu, tăng nguy cơbéo phì, rối loạn chuyển hóa. Ngược lại, để bụng quá đói làm giảm năng lượng, ảnh hưởng đến trí nhớ, khả năng tập trung và trao đổi chất. Vừa ăn vừa làm việc khác Xem điện thoại, đọc sách, hoặc suy nghĩ căng thẳng khi ăn sẽ làm giảm hiệu quả tiêu hóa. Theo Y học cổ truyền, khi tâm trí không ""đặt vào bữa ăn"", khí huyết khó điều hòa, Tỳ Vị dễ bị tổn thương. Ăn quá nhanh, nhai không kỹ Thức ăn chưa được nghiền nát kỹ sẽ khiến dạ dày phải làm việc nặng hơn. Về lâu dài, có thể dẫn đếnđau dạ dày,viêm loéthoặc khó hấp thu dưỡng chất. Bữa ăn thiếu sự điều hòa khí vị Y học cổ truyền cho rằng mỗi loại hương vị đều tương ứng với một yếu tố trong ngũ hành: chua (mộc), đắng (hỏa), ngọt (thổ), cay (kim), mặn (thủy). Khi ngũ vị được kết hợp hài hòa trong một bữa ăn, cơ thể sẽ dễ hấp thu và duy trì sự cân bằng nội tạng. Tuy nhiên, ngày nay nhiều người ăn uống chỉ theo sở thích. Việc thiếu cân bằng về khẩu vị sẽ khiến cơ thể mất điều hòa và dễ sinh bệnh. Kết hợp thực phẩm không hợp lý Ví dụ: Ăn quá nhiều hải sản (tính lạnh) mà không kèm các gia vị ấm như gừng, sả, tiêu... sẽ làm cơ thể dễ bị lạnh bụng, đau bụng,tiêu chảyhoặcrối loạn tiêu hóa. Hải sản (tính lạnh) cần ăn kèm các gia vị ấm như gừng, sả, tiêu... Ảnh:Bùi Thủy Tóm lại, việc thay đổi thói quen ăn uống cần bắt đầu từ những việc đơn giản như: - Ăn đúng giờ, không bỏ bữa. - Ăn trong không gian yên tĩnh, tập trung vào bữa ăn. - Ăn chậm, nhai kỹ. - Đảm bảo khẩu phần ăn đa dạng, cân bằng dinh dưỡng. - Kết hợp thực phẩm và gia vị một cách hợp lý để cân bằng tính hàn - nhiệt trong món ăn. Mỹ Ý","Thứ ba, 3/6/2025, 06:04 (GMT+7)",Mỹ Ý,Sức khỏe,Sống khỏe,VN Express,"Theo Y học cổ truyền, ăn uống đúng cách không chỉ để no mà còn là phương pháp dưỡng sinh, giúp cơ thể cân bằng và khỏe mạnh. Ngược lại, ăn uống thiếu điều độ sẽ gây rối loạn nội tạng và sinh ra bệnh tật. Bài viết chỉ ra những thói quen ăn uống phổ biến gây hại cho sức khỏe như ăn không đúng giờ, ăn quá no hoặc quá đói, vừa ăn vừa làm việc khác, ăn quá nhanh và thiếu sự điều hòa khí vị. Để cải thiện, cần ăn đúng giờ, tập trung vào bữa ăn, ăn chậm nhai kỹ, đảm bảo khẩu phần ăn đa dạng và kết hợp thực phẩm hợp lý."
VNEX_030625_00003,Cuộc tập kích drone có thể thay đổi quy tắc chiến tranh Nga - Ukraine,https://vnexpress.net/cuoc-tap-kich-drone-co-the-thay-doi-quy-tac-chien-tranh-nga-ukraine-4893259.html,"Cơ quan An ninh Ukraine (SBU) ngày 1/6 cho biết nước này đã mở chiến dịch Mạng nhện, sử dụng UAV tấn công loạt căn cứ không quân chiến lược nằm sâu trong lãnh thổ Nga. Kiev tuyên bố cuộc tấn công phá hủy, làm hư hại 40 máy bay chiến lược của đối phương, gồm oanh tạc cơ Tu-22M3 và Tu-95MS, cùng phi cơ cảnh báo sớm A-50. Bộ Quốc phòng Nga xác nhận Ukraine đã sử dụng drone góc nhìn thứ nhất (drone FPV) tấn công sân bay quân sự ở các tỉnh Murmansk, Irkutsk, Ivanovo, Ryazan và Amur, cách biên giới Ukraine hàng nghìn km. Hình ảnh, video trên mạng xã hội cho thấy drone FPV được Ukraine giấu trong thùng container và triển khai bất ngờ từ khu vực gần sân bay, khiến lực lượng phòng thủ không kịp đối phó. Giới phân tích đánh giá trong quá trình triển khai chiến dịch, lực lượng Ukraine đã cho thấy chiến thuật sử dụng drone chưa từng có, hiệu quả tới mức ""có thể khiến các tướng tá quân đội trên thế giới mất ngủ nhiều đêm"". ""Ukraine ngày 1/6 đã viết lại quy tắc chiến tranh. Các chỉ huy cấp cao của Nga chắc hẳn bị sốc như người Mỹ năm 1941"", Max Boot, cây viết về an ninh quốc gia tạiWashington Post, bình luận, nhắc đến trận Trân Châu Cảng, khi đế quốc Nhật Bản bất ngờ tấn công căn cứ hải quân Mỹ ở Hawaii. Các máy bay Nga bốc cháy trong đòn tập kích của Ukraine vào tỉnh Irkutsk ngày 1/6. Video:Pravda Ông Boot cho biết ngoài mở ra một cuộc chiến mới, trận Trân Châu Cảng còn báo hiệu cho sự lỗi thời của thiết giáp hạm, loại tàu chiến chủ đạo của hải quân các nước khi đó. Đây có thể là điểm tương đồng giữa sự kiện thời Thế chiến II với chiến dịch Mạng nhện của Ukraine. ""Ngày nay, hệ thống vũ khí đã lỗi thời có thể là máy bay quân sự có người lái"", ông Boot viết. Một đàn drone Ukraine chỉ cần vài chục nghìn USD để chế tạo đủ sức để gây thiệt hại nặng nề cho không quân Nga, phá hủy những oanh tạc cơ chiến lược không dễ thay thế trong một sớm một chiều. Nga thường sử dụng những oanh tạc cơ này để khai hỏa tên lửa tầm xa vào các mục tiêu ở Ukraine, nhằm tăng tầm bắn và vận tốc của chúng, gây khó khăn cho lưới phòng không đối phương. Trước đây, Ukraine gần như không có cách nào đối phó với những oanh tạc cơ này, do chúng hoạt động sâu trong lãnh thổ Nga, ngoài tầm bắn của các hệ thống phòng không Kiev. ""Nhưng mọi loại thiết bị quân sự đều có điểm yếu"", Valeriy Romaneko, nhà phân tích chiến tranh người Ukraine, nói vớiABC. ""Với các phi cơ, điểm yếu đó là thùng nhiên liệu khi chúng nằm yên trên đường băng"". ""Nếu drone tự sát lao vào, kích nổ và xuyên thủng được thùng chứa nhiên liệu máy bay, chúng ta sẽ thấy chuyện như ở Olenegorsk và Belaya"", ông Romaneko, nói tiếp, nhắc đến hai căn cứ không quân Nga ở Murmansk và Irkutsk. Các nguồn tin am hiểu về SBU ước tính Ukraine đã chuyển khoảng 150 drone và 300 quả bom vào Nga để thực hiện kế hoạch này từ nhiều tháng trước. Chúng được đặt trong thùng container bằng gỗ có nắp có thể mở từ xa, sau đó chất lên xe tải. Drone dùng mạng di động Nga truyền hình ảnh về Ukraine và tự động nhắm mục tiêu theo thông tin lập trình sẵn. Một nguồn tin tình báo Ukraine nói các tài xế xe tải nhiều khả năng được thuê để chở những thùng gỗ đến địa điểm gần sân bay, mà không biết bên trong có gì. Họ cũng gần như không biết được ai là người đã thuê mình. ""Loại hình tác chiến này rất phức tạp, thường không hé lộ thông tin cho những người giữ vai trò then chốt"", người này nói. Tổng thống Ukraine Volodymyr Zelensky tối 1/6 xác nhận nước này đã tập kích bằng 117 drone và Nga ""chịu tổn thất rất rõ ràng"". Ông thêm rằng SBU đã lập trung tâm chỉ huy gần một văn phòng địa phương của Cơ quan An ninh Liên bang Nga (FSB) mà không bị phát hiện. Những người tham gia chiến dịch đã mất 18 tháng chuẩn bị mọi thứ và rời khỏi Nga trong đêm trước khi xảy ra vụ tập kích. SBU ước tính chiến dịch Mạng nhện khiến Nga mất ""34% đội bay oanh tạc cơ chiến lược"", thiệt hại khoảng 7 tỷ USD. Các căn cứ không quân Nga bị Ukraine tập kích bằng UAV trong cuộc tấn công ngày 1/8. Đồ họa:ISW Gus McLachlan, tướng lục quân Australia về hưu, cho rằng chiến thuật sử dụng drone chưa từng có này của Ukraine là điều mà các nhà hoạch định quân sự phương Tây nên xem xét. ""Khả năng đổi mới và thích ứng của họ với công nghệ mới, có chi phí rất thấp này rất đáng chú ý"", ông Mc Lachlan nói. ""Chúng tôi nghĩ mỗi chiếc drone đó chỉ khoảng 4.000 USD. Chi phí để bố trí, chuẩn bị cho kế hoạch có thể cũng đáng kể, nhưng thực tế đã cho thấy chúng phá hủy được những phi cơ hàng tỷ USD"". Đòn tấn công này một lần nữa chứng minh hiệu quả của drone trong chiến tranh. Đây là bài học về sự cần thiết phải cân bằng giữa việc sở hữu các hệ thống vũ khí tinh vi, tốn kém với việc trang bị những năng lực tấn công rẻ tiền hơn, Mick Ryan, nhà nghiên cứu quân sự cấp cao tại Chương trình An ninh Quốc tế, Viện Lowy, bình luận. Nó còn cho thấy các căn cứ quân sự dù trong vùng chiến sự hay sâu trong hậu phương đều đang đối mặt nguy cơ cao hơn bao giờ hết trước những vũ khí rẻ tiền, dễ che giấu và triển khai nhanh, ít bị chú ý, ông Ryan nói. Binh sĩ Ukraine chuẩn bị drone tác chiến ở Zaporizhzhia ngày 24/5. Ảnh:AFP ""Nếu Ukraine có khả năng âm thầm đưa được lượng lớn drone đến sát các căn cứ không quân lớn ở Nga, chuyện tương tự hoàn toàn có thể xảy ra ở bất cứ quốc gia nào xảy ra xung đột"", ông Boot nhận định. Theo ông Boot, đây là lo ngại hợp lý bởi suốt nhiều năm qua, phương Tây thậm chí còn tập trung phi cơ tại số căn cứ không quân còn ít hơn ở Nga và chưa đầu tư để gia cố các nhà chứa máy bay để đối phó tên lửa hay drone. Các oanh tạc cơ chiến lược của Mỹ thường xuyên xuất hiện trên ảnh vệ tinh thương mại. Ông Boot cho rằng những lực lượng quân sự từng tự tin họ đã bảo vệ được căn cứ không quân của mình bằng hàng rào điện và trạm gác giờ đây phải đối mặt với mối đe dọa từ trên không từ các drone rẻ tiền, phổ biến và dễ dàng sửa đổi cho mục đích quân sự. ""Điều này sẽ đòi hỏi các nước đầu tư lớn vào các hệ thống chống drone. Chi phí bỏ ra cho các hệ thống vũ khí có người lái truyền thống ngày càng có vẻ lãng phí, giống như cho kỵ binh vào những năm 1930, lực lượng đã bị đánh bại hoàn toàn khi súng máy ra đời"", ông Boot viết. Như Tâm(TheoEconomic Times, Washington Post, ABC)","Thứ ba, 3/6/2025, 05:00 (GMT+7)",Như Tâm,Thế giới,Phân tích,VN Express,"Chiến dịch ""Mạng nhện"" của Ukraine, sử dụng UAV tấn công bất ngờ vào các căn cứ không quân Nga, gây thiệt hại đáng kể cho máy bay chiến lược của đối phương. Ukraine đã sử dụng chiến thuật triển khai drone FPV độc đáo, giấu trong container và kích hoạt từ xa, khiến phòng thủ Nga không kịp trở tay. Giới phân tích đánh giá chiến thuật này hiệu quả, làm thay đổi cục diện chiến tranh và đặt ra câu hỏi về sự lỗi thời của máy bay quân sự có người lái. Chiến dịch này không chỉ gây thiệt hại vật chất mà còn có thể làm thay đổi tư duy quân sự toàn cầu."
VNEX_030625_00079,Xe tải đi lùi trên cao tốc,https://vnexpress.net/xe-tai-di-lui-tren-cao-toc-4893237.html,"Video:CTV Tình huống giao thông:Chiếc xe chở hàng màu vàng đi lùi ở làn đường khẩn cấp hướng cấp. Vụ việc xảy ra tại cao tốc Hà Nội Thái Nguyên nơi cho phép ôtô di chuyển tốc độ tối đa 90 km/h. Kỹ năng lái xe:Các phương tiện tuyệt đối không được phép đi lùi trên cao tốc nơi cho phép các phương tiện di chuyển tốc độ cao, tiềm ẩn nguy cơ gây tai nạn cao. Trường hợp đi quá lối ra, lái xe tiếp tục cho xe di chuyển cho đến khi tìm được đường đi an toàn phù hợp. Nghị định 168/2024 quy định đối với lái xe có hành vi đi lùi trên cao tốc sẽ bị phạt tiền 30-40 triệu đồng và trừ 10 điểm trên giấy phép lái xe. Nguyên Vũ","Thứ ba, 3/6/2025, 05:00 (GMT+7)",Nguyên Vũ,Xe,Diễn đàn,VN Express,"Một chiếc xe chở hàng màu vàng đã đi lùi trên làn đường khẩn cấp của cao tốc Hà Nội - Thái Nguyên, nơi các xe được phép di chuyển với tốc độ tối đa 90km/h. Hành vi này là cực kỳ nguy hiểm và bị nghiêm cấm trên cao tốc. Theo Nghị định 168/2024, lái xe vi phạm sẽ bị phạt tiền 30-40 triệu đồng và trừ 10 điểm bằng lái."
VNEX_030625_00077,"30 đại học ở Hà Nội công bố 'điểm sàn' SAT, ACT",https://vnexpress.net/30-dai-hoc-o-ha-noi-cong-bo-diem-san-sat-act-4893615.html,"Đến ngày 2/6, khoảng 30 trường đại học ở Hà Nội công bố mức điểm SAT, ACT tối thiểu để thí sinh đăng ký xét tuyển đầu vào. SAT là bài thi chuẩn hóa kiểm tra kiến thức tự nhiên, xã hội và tư duy logic, được nhiều trường đại học, cao đẳng ở Mỹ sử dụng như một tiêu chí tuyển sinh. Còn ACT đánh giá kỹ năng học sinh về tiếng Anh, toán học, khoa học và đọc hiểu. Các đại học Việt Nam thường sử dụng kết quả hai bài thi này theo hướng xét độc lập chứng chỉ, hoặc kết hợp với điểm thi tốt nghiệp THPT hay học bạ. Một số cộng điểm khuyến khích. Đại học Dược Hà Nội đặt điều kiện điểm SAT cao nhất. Trường xét tuyển kết hợp học bạ vào ngành Dược học với thí sinh có SAT 1400/1600, các ngành khác là 1350. Kế đến là Đại học Ngoại thương. Thí sinh đạt SAT 1380 và ACT 30/36 trở lên mới được đăng ký xét kết hợp với chứng chỉ ngoại ngữ quốc tế. Ở chiều ngược lại, Học viện Nông nghiệp Việt Nam yêu cầu thấp nhất. Thí sinh chỉ cần đạt 800 điểm SAT hoặc 13 điểm ACT là được cộng điểm, ở phương thức xét điểm thi tốt nghiệp THPT và học bạ. Điều kiện điểm SAT, ACT của 30 trường đại học ở Hà Nội như sau: Ngoài các trường trên, một số đại học công bố dùng điểm bài thi SAT hay ACT để xét tuyển đầu vào nhưng chưa đưa ra ngưỡng tối thiểu, như Đại học Bách khoa Hà Nội, trường Đại học Công nghệ, Đại học Quốc gia Hà Nội. Bộ Giáo dục và Đào tạo năm nay yêu cầu các trường phải quy đổi tương đương điểm sàn và điểm chuẩn của các phương thức về cùng một thang điểm. Hiện, các trường thường quy đổi điểm theo bài thi SAT, ACT về thang 30. TheoCollege Board,tổ chức sở hữu bài thi SAT, điểm trung bình SAT ở Mỹ năm 2024 là 1050. Crimson - tổ chức tư vấn nộp đơn đại học nổi tiếng, cho biết học sinh được nhận vào các trường hàng đầu ở Mỹ thường có điểm SAT khoảng 1450-1550. Với các trường Ivy League, điểm SAT tốt thường khoảng 1560 trở lên. Thí sinh thi tốt nghiệp THPT 2024 tại TP HCM. Ảnh:Quỳnh Trần Dương Tâm","Thứ ba, 3/6/2025, 06:00 (GMT+7)",Dương Tâm,Giáo dục,Tuyển sinh,VN Express,"Khoảng 30 trường đại học ở Hà Nội đã công bố điểm SAT/ACT tối thiểu để xét tuyển, sử dụng kết quả các bài thi này độc lập hoặc kết hợp với các tiêu chí khác. Điểm SAT/ACT yêu cầu khác nhau giữa các trường, từ mức cao như Đại học Dược Hà Nội (SAT 1350-1400) đến mức thấp như Học viện Nông nghiệp Việt Nam (SAT 800/ACT 13). Các trường chưa đưa ra ngưỡng tối thiểu cũng có, và Bộ Giáo dục yêu cầu quy đổi điểm về cùng thang điểm. Điểm SAT trung bình ở Mỹ năm 2024 là 1050, trong khi các trường hàng đầu thường yêu cầu từ 1450 trở lên."
VNEX_030625_00065,Loại thực phẩm có thể loại bỏ hóa chất gây ung thư khỏi cơ thể,https://vnexpress.net/suc-khoe-cam-nang-loai-thuc-pham-co-the-loai-bo-hoa-chat-gay-ung-thu-khoi-co-the-4893554.html,"Đây là kết quả từ một nghiên cứu mới công bố trên tạp chí Environmental Health. PFAS (chất per- và polyfluoroalkyl) thường có trong các sản phẩm chống dính, hộp nhựa, chất chống thấm nước và bọt chữa cháy. Những hóa chất này không phân hủy trong môi trường và có xu hướng tích tụ trong cơ thể con người, làm tăng nguy cơ mắc nhiều vấn đề sức khỏe nghiêm trọng như vô sinh, suy nội tạng và ung thư. Trong nghiên cứu, các nhà khoa học từ Đại học Boston đã theo dõi 72 nam giới từ 18 đến 65 tuổi trong bốn tuần. 42 người được cho sử dụng thực phẩm bổ sung chứa một gram beta-glucan từ yến mạch ba lần mỗi ngày, trước mỗi bữa ăn khoảng 10 phút. Nhóm còn lại dùng thực phẩm bổ sung kiểm soát có nguồn gốc từ gạo. Kết quả xét nghiệm máu cho thấy những người dùng beta-glucan giảm khoảng 8% nồng độ hai dạng PFAS phổ biến và nguy hiểm nhất: PFOA và PFOS. Đây là hai hóa chất tổng hợp thường được sử dụng để tạo tính năng chống nước, chống bẩn và chống dính trong các sản phẩm tiêu dùng. PFOA đã được Cơ quan Nghiên cứu Ung thư Quốc tế (IARC) xếp vào Nhóm 1, nhóm chất gây ung thư ở người, PFOS thuộc Nhóm 2, có thể gây ung thư. Theo các nhà nghiên cứu, chất xơ giúp cản trở quá trình hấp thụ PFAS tại ruột bằng cách hình thành lớp gel ngăn axit mật, nơi PFAS bám vào, quay trở lại máu. Thay vào đó, axit mật sẽ bị đào thải qua phân, kéo theo một phần PFAS rời khỏi cơ thể. Đây được xem là một trong những nghiên cứu đầu tiên chứng minh bằng thực nghiệm tác dụng của chế độ ăn giàu chất xơ trong việc đào thải PFAS, loại hóa chất vốn được cho là ""vĩnh viễn"" trong cơ thể. Nấm có thể làm giảm mức độ hóa chất vĩnh cửu gây ung thư trong cơ thể người. Ảnh:Pexel Ngoài việc hỗ trợ đào thải độc tố, chất xơ còn mang lại nhiều lợi ích sức khỏe đã được chứng minh như tăng trọng lượng phân, hỗ trợ nhu động ruột, giảm táo bón và nguy cơung thư đại tràng. Phân mềm hơn cũng giúp rút ngắn thời gian lưu lại trong ruột già, từ đó giảm khả năng các chất độc hại kích thích viêm hoặc tăng sinh tế bào bất thường. Tuy nhiên, giới nghiên cứu cảnh báo rằng không phải mọi loại chất xơ đều có tác dụng loại bỏ PFAS. Ngoài ra, vì PFAS có thể tồn tại trong cơ thể từ hai đến bảy năm nên thời gian nghiên cứu bốn tuần là chưa đủ để đánh giá toàn diện mối liên hệ. Họ cho rằng cần thực hiện thêm các thử nghiệm dài hạn với liều lượng chất xơ cao hơn. Thực tế, có đến 90% người Mỹ không hấp thụ đủ lượng chất xơ khuyến nghị mỗi ngày (22–34 gram). Điều này không chỉ cản trở khả năng đào thải PFAS mà còn làm tăng nguy cơ mắc các bệnh mạn tính, bao gồm ung thư ruột kết. Nghiên cứu gợi mở một phương án tự nhiên, đơn giản và dễ tiếp cận để hỗ trợ cơ thể chống lại tác động của các hóa chất độc hại từ môi trường, thông qua chế độ ăn giàu chất xơ, đặc biệt là từ yến mạch, nấm và hạt. Thục Linh(TheoDaily Mail)","Thứ ba, 3/6/2025, 00:04 (GMT+7)",Thục Linh,Sức khỏe,Tin tức,VN Express,"Nghiên cứu mới cho thấy beta-glucan từ yến mạch có thể giúp giảm nồng độ PFAS (hóa chất độc hại thường thấy trong đồ gia dụng) trong máu. Các nhà khoa học phát hiện ra rằng chất xơ trong yến mạch cản trở quá trình hấp thụ PFAS tại ruột, giúp cơ thể đào thải chúng qua đường tiêu hóa. Tuy nhiên, nghiên cứu này mới chỉ là bước đầu và cần thêm các thử nghiệm dài hạn để xác nhận hiệu quả toàn diện. Nghiên cứu cũng nhấn mạnh tầm quan trọng của việc bổ sung đủ chất xơ trong chế độ ăn uống để hỗ trợ cơ thể chống lại các hóa chất độc hại từ môi trường."
