id,title,link,content,date,author,category,sub_category,source,summary
VNEX_120725_00066,Rối loạn vùng dưới đồi là gì?,https://vnexpress.net/roi-loan-vung-duoi-doi-la-gi-4913052.html,"Trả lời: Vùng dưới đồi là một phần của não giữa, có vai trò duy trì cân bằng, kiểm soát các chức năng nội tiết và tự chủ. Nó cũng tham gia điều hòa nhiệt độ cơ thể, cảm giác thèm ăn, cân nặng, tăng trưởng, chu kỳ ngủ - thức, ham muốn tình dục, cảm xúc và hành vi. Tổn thương hoặc bệnh lý ở vùng dưới đồi có thể gây ra các triệu chứng khác nhau tùy vào vùng bị ảnh hưởng. Điển hình như nôn và buồn nôn, tăng natri máu, hạ natri máu và tiểu nhiều. Rối loạn vùng dưới đồi có thể do nhiều nguyên nhân như khối u, chấn thương, phẫu thuật, viêm, nhiễm trùng, chán ăn tâm thần, béo phì khởi phát nhanh, rối loạn di truyền... Phần lớn các hội chứng rối loạn chức năng vùng dưới đồi ảnh hưởng đến trục dưới đồi - tuyến yên - tuyến thượng thận. Các rối loạn liên quan đến vùng dưới đồi ảnh hưởng đến hai hormone thần kinh vasopressin và oxytocin. Các hormone này tác động đến quá trình tái hấp thu nước của các ống thận xa, tạo ra cơn co thắt tử cung trong quá trình chuyển dạ, phản xạ tống sữa và phản ứng tình dục. Rối loạn vùng dưới đồi có thể ảnh hưởng đến cân nặng. Ảnh:Bệnh viện Đa khoa Tâm Anh Trẻ em bị rối loạn chức năng vùng dưới đồi có biểu hiện chậm phát triển chiều cao, béo phì, hạ thân nhiệt, chậm phát triển, co giật toàn thân, dậy thì muộn, đôi khidậy thì sớm. Thiếu hụt hormone có thể gây ra suy giáp trung ương hoặc suy tuyến thượng thận. Những tình trạng này khả năng cao dẫn đến các biến chứng toàn thân như các vấn đề về tim mạch.Suy giảm hormonesinh dục tuyến yên và oxytocin gây ra các biến chứng như vô sinh, vấn đề cương cứng, vấn đề cho con bú, khó khăn khi chuyển dạ, loãng xương, giảm kích thích và phản ứng tình dục. Phương pháp điều trị phụ thuộc vào nguyên nhân gây rối loạn chức năng vùng dưới đồi cũng như triệu chứng biểu hiện của bệnh nhân như xử lý các khối u, bổ sung, thay thế hormone... Bạn nên cho con đến bệnh viện có chuyên khoa Nội tiết kiểm tra, bác sĩ xác định nguyên nhân, từ đó tư vấn phác đồ phù hợp. BS.CKI Phan Thị Thùy DungĐơn vị Nội tiết - Đái tháo đườngPhòng khám Đa khoa Tâm Anh Quận 7","Thứ bảy, 12/7/2025, 08:00 (GMT+7)",BS.CKI Phan Thị Thùy Dung,Sức khỏe,Các bệnh,VN Express,"Vùng dưới đồi, một phần quan trọng của não giữa, đóng vai trò then chốt trong việc duy trì cân bằng nội môi, kiểm soát chức năng nội tiết, tự chủ, và điều hòa nhiều quá trình sinh lý khác. Tổn thương vùng này có thể gây ra nhiều triệu chứng khác nhau, liên quan đến các chức năng như điều hòa nhiệt độ, thèm ăn, giấc ngủ, cảm xúc và hormone. Rối loạn vùng dưới đồi có thể do nhiều nguyên nhân, ảnh hưởng đến trục dưới đồi - tuyến yên - tuyến thượng thận và các hormone quan trọng như vasopressin và oxytocin. Việc điều trị phụ thuộc vào nguyên nhân và triệu chứng cụ thể, bao gồm xử lý các khối u và bổ sung hormone khi cần thiết."
VNEX_120725_00069,Sự thật về hot girl 'gây sốt' ở giải quần vợt Wimbledon,https://vnexpress.net/su-that-ve-hot-girl-gay-sot-o-giai-quan-vot-wimbledon-4913371.html,"Mia Zelu là một ngôi sao mạng xã hội do trí tuệ nhân tạo (AI) tạo ra. Cô có hơn 150.000 theo dõi trên Instagram nhờ những bức ảnh gợi cảm tại các sự kiện quần vợt và nhiều nơi khác. Người đứng sau nhân vật này vẫn là một ẩn số. Gần đây, tài khoản này đăng ảnh Zelu ngồi bên sân đấu tại Wimbledon, thưởng thức ly Pimm's - đồ uống đặc trưng của giải đấu. Dưới bức ảnh, Zelu, tự nhận là ""người kể chuyện kỹ thuật số"" và viết: ""Trận đấu Wimbledon nào là trận bạn yêu thích nhất"". Bức ảnh Zelu ngồi bên sân đấu tại Wimbledon, Anh, gây 'sốt' mạng. Ảnh:Instagram/@miazelu Các bài đăng của Zelu không chỉ có hình ảnh siêu thực mà còn kèm những dòng trạng thái sâu sắc, giống hệt người thật. ""Bạn có biết điều gì mệt mỏi nhất không? Đó là giả vờ ổn trong khi bản thân đang dần kiệt sức"", một bài đăng của Zelu viết, kèm ảnh cô mặc quần short jean ở quán cà phê. ""Tất cả chúng ta đều đã và đang làm vậy. Bởi vì thành thật có cảm giác rủi ro. Bởi vì chúng ta không muốn tỏ ra yếu đuối"". Zelu thường xuyên chia sẻ ảnh đi du lịch lên trang cá nhân và nhận hàng trăm nghìn lượt yêu thích. Ảnh:Instagram/@miazelu Zelu còn có một ""em gái"" tên Ana, một nhân vật tóc nâu với 266.000 người theo dõi. Dù Zelu ghi rõ ""AI"" trên hồ sơ cá nhân, nhiều người vẫn tin cô là thật và để lại những bình luận tán tỉnh như ""Em thật lộng lẫy"", ""Cưới anh nhé?"". Sự việc gây chú ý khi người hâm mộ phát hiện ngôi sao cricket Ấn Độ Rishabh Pant ""thích"" nhiều bài đăng của cô. Nhiều người cho rằng Pant đã ""sập bẫy"" của một tài khoản giả mạo. ""Ai đó nên nói cho Rishabh Pant biết đây là một tài khoản AI"", một người bình luận. TheoDaily Mail, Pant sau đó đã bỏ thích các bài đăng của Zelu và chưa bình luận về sự việc. Mia Zelu tạo dáng trên khán đài tại một trận đấu quần vợt ở Anh. Ảnh:Instagram/@miazelu Zelu là một trong số nhiều ""influencer AI"" đang xuất hiện ngày càng nhiều. Năm ngoái, influencer ảo Alba Renai trở thành người dẫn chương trình không phải người thật đầu tiên cho một phân đoạn của show ""Survivor"" phiên bản Tây Ban Nha. Tuy nhiên, xu hướng này cũng tiềm ẩn nhiều nguy cơ. Năm 2024, một phụ nữ Anh mất hơn 20.000 USD cho kẻ lừa đảo tình cảm dùng video AI giả dạng đại tá quân đội Mỹ. Gần đây, mộtcặp vợ chồngở Malaysia lái xe hơn 300 km đến điểm du lịch trong video do AI tạo nhưng phát hiện nơi đó không có thật. Minh Phương(TheoNypost)","Thứ bảy, 12/7/2025, 10:37 (GMT+7)",Minh Phương,Đời sống,Nhịp sống,VN Express,"Mia Zelu là một influencer AI nổi tiếng trên Instagram với hơn 150.000 người theo dõi, thu hút sự chú ý nhờ những bức ảnh gợi cảm và dòng trạng thái sâu sắc như người thật. Dù Zelu công khai là AI, nhiều người vẫn tin cô là thật, thậm chí ngôi sao cricket Rishabh Pant cũng từng ""thích"" bài đăng của cô. Sự xuất hiện của Zelu cho thấy xu hướng influencer AI ngày càng tăng, nhưng cũng tiềm ẩn nguy cơ lừa đảo và tạo ra những hình ảnh sai lệch về thực tế."
VNEX_120725_00094,'Chạy bộ góp phần định hình lối sống Đà Nẵng',https://vnexpress.net/chay-bo-gop-phan-dinh-hinh-loi-song-da-nang-4913024.html,"Những ngày tháng 7, khi VnExpress Marathon Đà Nẵng 2025 cận kề, nhiều tuyến đường ven biển và khu trung tâm thành phố nhộn nhịp hơn bởi các câu lạc bộ, nhóm chạy tập luyện vào mỗi sáng, chuẩn bị cho ngày tranh tài. Theo ông Cao Trí Dũng, Chủ tịch Hiệp hội Du lịch Đà Nẵng, vài năm gần đây, những cung đường Hoàng Sa, Võ Nguyên Giáp, Bạch Đằng, cầu Rồng thường xuyên xuất hiện các nhóm người dân và du khách chạy bộ. ""Chạy bộ không chỉ là rèn luyện, mà trở thành một thói quen sinh hoạt hàng ngày, góp phần tạo nhịp sống khỏe khoắn cho đô thị "", ông Dũng nhấn mạnh. Du khách tham gia giải VnExpress Marathon Đà Nẵng 2024. Ảnh:VM Tại Đà Nẵng, các sự kiện thể thao liên quan đến chạy bộ như VnExpress Marathon, Ironman 70.3, Marathon quốc tế Đà Nẵng thu hút hàng nghìn VĐV tham gia, kéo theo người thân, bạn bè đến đô thành, gia tăng doanh thu cho dịch vụ lưu trú, ăn uống và du lịch ""Khi một giải chạy quy mô như VnExpress Marathon quy tụ đến 11.000 VĐV, kéo theo hàng chục ngàn người thân và gia đình, tác động của nó vượt xa những con số kinh tế đơn thuần. Đây không chỉ là cú hích cho ngành dịch vụ lưu trú, ăn uống, mà còn tạo sức lan tỏa mạnh mẽ trong cộng đồng"", ông Dũng nhấn mạnh. Theo ông Dũng, Đà Nẵng đã hai lần được công nhận là điểm đến lễ hội và sự kiện hàng đầu châu Á. Việc duy trì và phát triển các sự kiện như VnExpress Marathon giúp thành phố giữ vững vị trí trong nhóm địa phương có khả năng tổ chức sự kiện quy mô lớn. Từ góc nhìn rộng hơn, ông đánh giá thói quen chạy bộ đang góp phần định hình một góp phần hình thành một ""nhịp sống mới"" tại thành phố ven sông Hàn, tạo ra các giá trị văn hóa mới. Không chỉ lan rộng trong cộng đồng người dân địa phương, phong trào này cũng được ghi nhận trong nhóm cư dân quốc tế sinh sống tại Đà Nẵng - đối tượng chiếm tỷ trọng ngày càng lớn trong tổng lượng khách dài ngày. ""Thành phố đã thu hút cư dân ngoại tỉnh và quốc gia khác đến sống, làm việc, thụ hưởng những giá trị đặc trưng như khí hậu trong lành, hạ tầng hiện đại, dịch vụ phong phú và môi trường an toàn, thân thiện. Khi kết hợp với các hoạt động thể thao nâng cao thể trạng và đáp ứng xu hướng cá nhân hóa như chạy bộ, những giá trị 'đáng sống' được nâng lên tầm vóc mới"", Chủ tịch Hiệp hội du lịch nói. CLB Đà Nẵng Runners luyện tập ở khu vực cầu Rồng. Ảnh:Đà Nẵng Runners Theo ông, Đà Nẵng sở hữu các cung đường chạy ven biển, vượt cầu, ven sông, triền núi, phù hợp nhiều cự ly và hình thức trải nghiệm. Hệ thống hạ tầng, khách sạn, giao thông, dịch vụ hỗ trợ đủ điều kiện đón lượng khách đến thành phố theo mô hình du lịch thể thao. Ông Dũng cho rằng đây là thời điểm để địa phương làm mới hình ảnh thông qua các sản phẩm mới, hướng đến phân khúc khách hàng cụ thể, đặc biệt là nhóm trẻ có xu hướng lựa chọn du lịch gắn với trải nghiệm cá nhân. ""Chúng tôi đang tập trung vào đổi mới sản phẩm, tăng tính cá nhân hóa, tăng trải nghiệm thực tế và kéo dài thời gian lưu trú. Du lịch thể thao là một trong những hướng đi phù hợp với định hướng phát triển đó"", ông nói. Lan Anh","Thứ bảy, 12/7/2025, 08:00 (GMT+7)",Lan Anh,Du lịch,Điểm đến,VN Express,"Khi VnExpress Marathon Đà Nẵng 2025 đến gần, Đà Nẵng trở nên sôi động với phong trào chạy bộ, thu hút cả người dân địa phương và du khách. Các sự kiện thể thao như VnExpress Marathon không chỉ thúc đẩy du lịch, dịch vụ lưu trú và ăn uống, mà còn góp phần tạo nên một nhịp sống khỏe mạnh và lan tỏa trong cộng đồng. Đà Nẵng tận dụng lợi thế về hạ tầng và cảnh quan để phát triển du lịch thể thao, thu hút du khách trẻ và tạo ra những trải nghiệm cá nhân hóa, từ đó nâng cao vị thế là điểm đến sự kiện hàng đầu châu Á. Thành phố đang tập trung đổi mới sản phẩm du lịch, tăng tính trải nghiệm và kéo dài thời gian lưu trú, với du lịch thể thao là một hướng đi phù hợp."
VNEX_120725_00001,Ưu - nhược điểm khi xây dựng sân bay ở Ninh Bình,https://vnexpress.net/uu-nhuoc-diem-khi-xay-dung-san-bay-o-ninh-binh-4912160.html,"UBND tỉnh Ninh Bình và doanh nghiệp xây dựng Xuân Trường mới đây kiến nghị xây dựng sân bay quốc tế, vị trí dự kiến tại Ý Yên (tỉnh Nam Định cũ) hoặc địa điểm do Bộ Xây dựng đề xuất. Nguồn vốn đầu tư từ ngân sách tỉnh Ninh Bình và vốn xã hội hóa. Bộ Xây dựng đã ủng hộ chủ trương nghiên cứu, xem xét bổ sung quy hoạch cảng hàng không tại địa phương này trong giai đoạn tới. Nhìn nhận về đề xuất này, chuyên gia thiết kế công trình hàng không Nguyễn Bách Tùng cho rằng ưu điểm khi xây dựng sân bay tại Ninh Bình là thúc đẩy du lịch, kinh tế địa phương. Ninh Bình là điểm đến du lịch nổi tiếng với quần thể danh thắng Tràng An, Tam Cốc - Bích Động, cố đô Hoa Lư, chùa Bái Đính... Năm 2024, du lịch Ninh Bình đón hơn 8,7 triệu lượt khách, hướng đến mục tiêu đón trên 9 triệu lượt, trong đó có trên 2 triệu khách quốc tế trong năm 2025. Lượng khách du lịch lớn song hiện địa phương chưa có sân bay, gây bất tiện cho khách. Khách thường phải đến sân bay Nội Bài (Hà Nội) hoặc Thọ Xuân (Thanh Hóa) rồi đi đường bộ khoảng 3-4 giờ đến Ninh Bình. ""Việc có sân bay sẽ giúp Ninh Bình đón được nhiều khách quốc tế và nội địa hơn, giảm phụ thuộc sân bay Nội Bài hay Thọ Xuân, Thanh Hóa"", TS Tùng nói. Không chỉ phục vụ khách du lịch, sân bay ở Ninh Bình còn phục vụ đi lại của người dân tỉnh Ninh Bình mới (gồm Nam Định, Ninh Bình, Hà Nam cũ), một phần dân cư ở Thanh Hóa và phía nam Hà Nội. Lễ hội tại khu di sản Tràng An (Ninh Bình) thu hút rất đông khách du lịch. Ảnh:Giang Huy Theo ông Tùng, điểm thuận lợi khi xây dựng sân bay là có sự tham gia của doanh nghiệp đầu tư theo hình thức đối tác công tư (PPP), lĩnh vực mà lâu nay khó huy động xã hội hóa. Việc triển khai PPP cũng là động lực thúc đẩy phát triển kinh tế tư nhân, phù hợp với tinh thần Nghị quyết 68 của trung ương. Ủng hộ nghiên cứu quy hoạch sân bay Ninh Bình, TS Lương Hoài Nam, Tổng giám đốc Bamboo Airways, đánh giá hạ tầng sân bay của Việt Nam đang tụt hậu, vẫn loay hoay với mô hình phát triển sân bay cũ kỹ, phức tạp, trong khi các nước khác đã tiến xa hơn rất nhiều. Như ở Mỹ, thị trấn nhỏ cũng có sân bay riêng và không phải từ tiền ngân sách mà từ doanh nghiệp, cộng đồng, cơ chế mở để người dân và nhà đầu tư có quyền được làm.Hiện nhiều địa phương có tiềm năng du lịch, bất động sản hoàn toàn có thể tự đầu tư xây sân bay nhỏ, là động lực phát triển kinh tế. Tỉnh không trông chờ ngân sách, sẵn sàng bỏ tiền ra làm miễn là có một khuôn khổ pháp lý rõ ràng. Tuy nhiên, nhiều chuyên gia chỉ ra một số nhược điểm khi xây dựng sân bay tại Ninh Bình.Quy hoạch mạng lưới cảng hàng không Việt Nam đến năm 2030, tầm nhìn 2050 và các quy hoạch chung Thủ đô Hà Nội đã xác định quy hoạch sân bay thứ hai của Vùng Thủ đô nằm tại phía nam Hà Nội, xây dựng từ năm 2030 đến năm 2050. Các quy hoạch giao thông và quy hoạch chung Thủ đô cũng xác định vị trí dự kiến sân bay này tại huyện Phú Xuyên cũ. Khoảng cách từ Ý Yên (Ninh Bình) đến khu vực Phú Xuyên chỉ khoảng 40-50 km, theo chuyên gia hàng không Nguyễn Bách Tùng là ""khá gần"". Nếu cả hai sân bay cùng được xây dựng thì nguy cơ chia sẻ thị phần hành khách và hàng hóa là rất cao. Cơ quan chức năng cần nghiên cứu kỹ lưỡng tiềm năng phát triển của cả hai sân bay và phải điều chỉnh quy hoạch nếu cần thiết. Nếu được thực hiện, địa phương cần lựa vị trí sân bay không ảnh hưởng nhiều đến đất trồng lúa, sớm quy hoạch để giảm thiểu tác động khi thu hồi đất sau này.TS Đào Ngọc Nghiêm, Phó chủ tịch Hội Quy hoạch phát triển đô thị Việt Nam, phân tích UBND TP Hà Nội đã xác định xây dựng sân bay thứ hai ở Phú Xuyên sau năm 2030 không chỉ để giảm tải vận chuyển hành khách cho Nội Bài mà còn vận chuyển hàng hóa, thúc đẩy kinh tế, phát triển logistics. Sân bay hình thành sẽ gắn với khu đô thị vệ tinh mới, cụm công nghiệp, làng nghề ở phía nam Thủ đô. Nếu có thêm sân bay Ninh Bình cách sân bay ở Phú Xuyên 40-50 km thì phải chia sẻ lưu lượng hàng khách và hàng hóa, giảm hiệu quả đầu tư. ""Trường hợp cả hai được đưa vào quy hoạch, Bộ Xây dựng phải tính toán, xác định thời điểm xây dựng, quy mô và chức năng của từng sân bay để tránh lãng phí"", ông Nghiêm nói. TS Trần Quang Châu, Chủ tịch Hội Khoa học và Công nghệ Hàng không Việt Nam, lo ngại có thêm sân bay Ninh Bình thì khả năng trùng lặp luồng tuyến bay và ảnh hưởng vùng trời khi có nhiều sân bay nằm gần nhau. Bởi khi quy hoạch sân bay cần nghiên cứu không chỉ vị trí trên mặt đất mà phải cả vùng trời. Các chuyên gia đánh giá quy hoạch mạng lưới cảng hàng không sân bay đã được Bộ Giao thông Vận tải trước đây (Bộ Xây dựng hiện nay) nghiên cứu chặt chẽ, dựa trên các tiêu chí như nhu cầu sản lượng hàng hóa, hành khách; phát triển kinh tế xã hội; quốc phòng, an ninh; điều kiện tự nhiên; cự ly tới đô thị trung tâm, các cảng hàng không lân cận... và đã được Chính phủ phê duyệt. Các sân bay như Gia Bình (Bắc Ninh), Măng Đen (Kon Tum), Vân Phong (Khánh Hòa) được xác định là sân bay tiềm năng nên có thể xem xét bổ sung vào quy hoạch khi có nhu cầu. Sân bay Ninh Bình chưa nằm trong danh sách tiềm năng nên trước mắt nên xây dựng theo hướng sân bay chuyên dùng (vận chuyển du khách, hàng hóa mà không phải là vận chuyển công cộng thường lệ). Đoàn Loan","Thứ bảy, 12/7/2025, 04:00 (GMT+7)",Đoàn Loan,Thời sự,Giao thông,VN Express,"UBND tỉnh Ninh Bình và doanh nghiệp Xuân Trường đề xuất xây dựng sân bay quốc tế tại Ninh Bình nhằm thúc đẩy du lịch và kinh tế địa phương, vốn đang phát triển mạnh mẽ nhưng thiếu hạ tầng hàng không. Đề xuất này nhận được sự ủng hộ từ Bộ Xây dựng và một số chuyên gia, cho rằng sân bay sẽ giảm tải cho Nội Bài và Thọ Xuân, đồng thời tạo động lực phát triển kinh tế tư nhân. Tuy nhiên, một số chuyên gia lo ngại về sự trùng lặp với quy hoạch sân bay thứ hai của Vùng Thủ đô tại Phú Xuyên, Hà Nội, do khoảng cách địa lý khá gần. Mặc dù có những ưu điểm và tiềm năng phát triển, dự án cần được xem xét kỹ lưỡng để đảm bảo tính hiệu quả và phù hợp với quy hoạch tổng thể."
VNEX_120725_00068,Phẫu thuật cho bé trai bị lác mắt,https://vnexpress.net/phau-thuat-cho-be-trai-bi-lac-mat-4912978.html,"PGS.TS.BS Nguyễn Thị Thu Hiền, Trưởng khoa Khúc xạ, Trung tâm Mắt Công nghệ cao, Bệnh viện Đa khoa Tâm Anh Hà Nội, cho biết bé Phong đến khám khi đang sử dụng kính điều chỉnh viễn thị (+1.75 độ ở mắt phải và +1.5 độ ở mắt trái). Thị lực hai mắt khi đeo kính đạt khoảng 20/25. Tình trạng lác trong của bé dao động thất thường, có thời điểm lệch nhẹ chỉ 15 độ, nhưng có lúc vượt quá 45 độ (so với trục nhìn của mắt bình thường). Độ lác không ổn định là yếu tố gây khó khăn trong quá trình điều trị cho bé, nếu không xử lý triệt để sẽ dẫn đến tình trạng dư lác sau mổ hoặc tái lệch cần phẫu thuật lần hai. Bác sĩ Hiền khám cho bé Farrell Lê Phong. Ảnh:Bệnh viện Đa khoa Tâm Anh Các bác sĩ hội chẩn, đánh giá đo lường chính xác độ lác, thị lực hai mắt, chức năng điều tiết..., chỉ định phẫu thuật để điều chỉnh trục nhãn cầu của bệnh nhi, khắc phục tình trạng lác. Bệnh nhi được gây mê nội khí quản trong suốt quá trình can thiệp. Bác sĩ lùi rút cơ trực trong và trực ngoài mắt phải, kết hợp thêm kỹ thuật Fadel (còn gọi là treo cơ) nhằm hạn chế biến động cơ mắt sau mổ. Kỹ thuật này được sử dụng trong các ca lác không ổn định giúp làm giảm hoạt động quá mức của cơ vận nhãn mà không làm thay đổi vị trí nghỉ của nhãn cầu quá nhiều, từ đó hạn chế khả năng tái phát tình trạng lác. Sau ca mổ kéo dài khoảng 35 phút, bệnh nhi tỉnh táo, hồi phục nhanh, xuất viện ngay trong ngày. Bác sĩ Hiền kê đơn thuốc nhỏ mắt,hướng dẫn chăm sóchậu phẫu như vệ sinh mắt bằng nước ấm, theo dõi triệu chứng bất thường. Tái khám sau 4 tuần, hai mắt bé không còn lệch, vận nhãn (khả năng chuyển động của mắt) nhịp nhàng, thị lực ổn định. Bé vẫn cần tiếp tục đeo kính khi trở lại Australia học tập để duy trì thị lực tối ưu. Theobác sĩ Hiền, can thiệp đúng thời điểm cho bé Phong rất quan trọng. Nếu trì hoãn thêm, bệnh nhi có nguy cơ nhược thị - tình trạng suy giảm thị lực không hồi phục. Bác sĩ khuyến cáo cha mẹ cần chủ động đưa trẻ đi khám mắt từ khi mới sinh đến dưới một tuổi, sau đó kiểm tra định kỳ mỗi 6-12 tháng. Các biểu hiện như mắt lệch, nghiêng đầu khi nhìn, mỏi mắt, đọc sách hay nhắm một bên mắt đều có thể là dấu hiệu cảnh báo mắt của trẻ có vấn đề. Nếu được phát hiện và điều trị sớm, hầu hết các trường hợp lác,tật khúc xạđều có thể được điều trị, theo dõi hiệu quả, góp phần bảo vệ thị lực lâu dài, tránh ảnh hưởng đến chất lượng sống và học tập của trẻ. Minh Đức","Thứ bảy, 12/7/2025, 08:00 (GMT+7)",Minh Đức,Sức khỏe,Các bệnh,VN Express,"Bé Phong, một bệnh nhi bị lác trong và viễn thị với độ lác không ổn định, đã được bác sĩ Nguyễn Thị Thu Hiền và các đồng nghiệp tại Bệnh viện Đa khoa Tâm Anh Hà Nội phẫu thuật thành công bằng kỹ thuật lùi rút cơ kết hợp Fadel. Ca phẫu thuật giúp điều chỉnh trục nhãn cầu, khắc phục tình trạng lác và duy trì thị lực ổn định cho bé. Bác sĩ khuyến cáo phụ huynh nên chủ động đưa trẻ đi khám mắt định kỳ để phát hiện và điều trị sớm các vấn đề về thị lực, tránh nguy cơ nhược thị và ảnh hưởng đến sự phát triển của trẻ."
