id,title,link,content,date,author,category,sub_category,source,summary
VNEX_271225_00063,Đề xuất nghiên cứu sinh ngành bán dẫn không được đi làm,https://vnexpress.net/de-xuat-nghien-cuu-sinh-nganh-ban-dan-khong-duoc-di-lam-4998799.html,"Bộ Giáo dục và Đào tạo chiều 26/12 công bố dự thảo chuẩn chương trình đào tạo tiến sĩ lĩnh vực vi mạch bán dẫn. Đại diện tổ soạn thảo, GS.TS Chử Đức Trình, Hiệu trưởng trường Đại học Công nghệ, Đại học Quốc gia Hà Nội, cho biết nghiên cứu sinh ở lĩnh vực này phải dành toàn bộ thời gian học tập, nghiên cứu ở trường, tham gia các đề tài khoa học. Bù lại, họ được miễn học phí, hỗ trợ học bổng, sinh hoạt phí và kinh phí nghiên cứu. ""Phải xác định hy sinh khoảng 3 năm đi làm để tập trung hoàn toàn. Điều này đã được Mỹ và các nước Bắc Âu áp dụng triệt để"", ông Trình nói, ví dụ một giảng viên ở trường A nếu làm nghiên cứu sinh ở trường B thì phải tạm dừng công việc. Người lao động ở các tổ chức, doanh nghiệp cũng tương tự. Thực tế, trường Đại học Công nghệ đã áp dụng cơ chế này,miễn học phívà cấp sinh hoạt phí 7 triệu đồng mỗi tháng. Nếu có kết quả nghiên cứu tốt, mức chi trả lên tới 9-12 triệu đồng. Ông Trình cho hay các điều kiện, tiêu chuẩn trên tiệm cận với chất lượng đào tạo tiến sĩ của Mỹ, Nhật Bản, châu Âu, do đó cao hơn mức chung của Việt Nam hiện nay. Nếu thành công, đây sẽ là ""bước nhảy"" về mặt chất lượng đào tạo bậc cao. GS.TS Chử Đức Trình thông tin dự thảo chuẩn chương trình đào tạo tiến sĩ lĩnh vực vi mạch bán dẫn, chiều 26/12. Ảnh:Lệ Nguyễn Về chuẩn đầu vào, dự kiến nghiên cứu sinh tiến sĩ phải tốt nghiệp đại học hoặc thạc sĩ loại giỏi ở ngành phù hợp với lĩnh vực vi mạch bán dẫn; có kinh nghiệm nghiên cứu; ngoại ngữ bậc 4/6 (tương đương B2). Đầu ra, họ cần đáp ứng chuẩn kiến thức, kỹ năng và có ít nhất 2 bài báo khoa học về vi mạch bán dẫn, được công bố trên tạp chí quốc tế thuộc danh mục ISI/Scopus, ưu tiên nhóm Q1, Q2 (uy tín nhất). ""Đào tạo tiến sĩ bán dẫn phải gắn liền với các sáng kiến khoa học có điểm mới ở tầm vóc thế giới"", ông Trình nhìn nhận. Cơ sở đào tạo chỉ được tuyển nghiên cứu sinh khi có đề tài khoa học phù hợp với lĩnh vực vi mạch bán dẫn và nguồn tài chính đảm bảo. Tiêu chí để xác định điều này sẽ được thảo luận cụ thể hơn trong quá trình lấy ý kiến dự thảo. Theo ông Trình, các tiêu chuẩn trong dự thảo không bắt buộc với mọi cơ sở giáo dục đại học. Nhưng nếu tham gia, các trường sẽ được nhà nước ưu tiên đầu tư, giao đề tài nghiên cứu về vi mạch bán dẫn. Số chỉ tiêu tuyển sinh tiến sĩ nói chung của cả nước khoảng 5.000-7.000 mỗi năm, nhưng thường tuyển được không quá 50%, theo thống kê của Bộ Giáo dục và Đào tạo. Ở bậc đại học, năm nay có hơn 137.200 thí sinh trúng tuyển vào38 ngành đào tạoliên quan lĩnh vực vi mạch bán dẫn. Lệ Nguyễn","Thứ bảy, 27/12/2025, 00:00 (GMT+7)",Lệ Nguyễn,Giáo dục,Tin tức,VN Express,
VNEX_271225_00066,Định kiến thuốc BHYT,https://vnexpress.net/danh-muc-thuoc-bhyt-moi-4998874.html,"Danh mục thuốc bị kêu ca rất nhiều: ít, toàn ""của nội"", thiếu thuốc đặc trị... Khi đó quỹ BHYT thanh toán theo cơ chế: mỗi bệnh viện nhận phân bổ một số lượng thẻ BHYT nhất định, nhân với giá trị mỗi thẻ thì ra tổng số tiền. Nghe qua có vẻ rất sòng phẳng, đóng bao nhiêu thì tiêu bấy nhiêu. Nhưng bệnh viện nào nhận được nhiều thẻ BHYT của thanh niên, những người cả năm không đi khám lần nào, thì quỹ rủng rỉnh. Còn bệnh viện tôi phục vụ phần lớn bệnh nhân là cán bộ hưu trí. Các cụ tháng nào cũng phải đi khám vài lần, thế là chúng tôi luôn chi vượt quỹ, có những năm âm cả chục tỷ đồng. Với ngân quỹ ít ỏi so với nhu cầu, tôi hiểu đương nhiên phải dùng thuốc nội, có khi thuốc nội còn không đủ. Cảm nhận về thuốc BHYT ""thiếu thốn, giá rẻ, kém hiệu quả"" cũng dần dà trở thành một định kiến trong người dân. Bây giờ, BHYT đã phát triển vượt bậc, bao phủ trên 90% dân số. Cách quản lý quỹ đã thay đổi, hợp lý hơn rất nhiều, thể hiện đúng tính ưu việt là lấy số đông người khoẻ để giúp đỡ số ít người bệnh. Một số thay đổi lớn đã được thực hiện. Trước hết, BHYT thông tuyến đến tỉnh. Người có thẻ không còn bị gắn chặt với một bệnh viện nữa mà tự do lựa chọn nơi khám và điều trị. Phía bệnh viện cũng không gây khó dễ cho bệnh nhân khi chuyển tuyến, mà giữ chân người bệnh bằng trình độ chuyên môn và thái độ phục vụ. Thay đổi lớn thứ hai là BHYT thanh toán cho bệnh viện theo thực chi. Hồ sơ điều trị hết bao nhiêu tiền, nếu hợp lệ, BHYT sẽ thanh toán lại bấy nhiêu. Như vậy quỹ BHYT của mỗi bệnh viện sẽ sát với chi tiêu thực tế hơn xưa rất nhiều. Thay đổi lớn thứ ba là danh mục thuốc. Có thầy thì phải có thuốc mới chữa được bệnh. Năm 2022, theo Thông tư số 20 của Bộ Y tế, danh mục thuốc BHYT bao gồm 1.037 hoạt chất, thuốc hóa dược và sinh phẩm chia làm 27 nhóm lớn và 59 thuốc phóng xạ và chất đánh dấu. Đọc Thông tư 20, tôi thấy danh mục thuốc hết sức phong phú, tốt hơn ngày trước rất nhiều. Tuy danh mục thuốc khá đầy đủ như thế, bác sĩ vẫn kêu thiếu, người bệnh vẫn phải mua ngoài. Nghiên cứu kỹ thì thấy, danh mục thuốc đa dạng, nhưng Thông tư 20 lại quy định phân tuyến trong sử dụng thuốc. Tuyến xã hầu như chỉ được dùng một số loại thuốc uống. Tuyến huyện là danh mục thuốc cơ bản. Thuốc đặc trị được dùng ở tuyến tỉnh và trung ương. Tức là càng lên tuyến trên người bệnh càng được hưởng nhiều thuốc BHYT. Đây cũng là một trong những nguyên nhân khiến bệnh viện trung ương quá tải trong khi bệnh viện tuyến dưới vắng vẻ Ngày 28/11 năm nay, Bộ Y tế tổ chức Hội thảo xin ý kiến dự thảo Thông tư ban hành Danh mục thuốc mới, dùng trong khám bệnh, chữa bệnh thuộc phạm vi được hưởng của người tham gia bảo hiểm y tế. Tỷ lệ tiền thuốc trong tổng chi BHYT rất lớn, luôn trên 30%, nên việc lựa chọn sử dụng và chi trả BHYT cho thuốc hợp lý là rất quan trọng, qua đó góp phần giảm chi phí điều trị, sử dụng hiệu quả quỹ BHYT và giảm chi tiền túi của người dân. Trong dự thảo này, danh mục thuốc đã được rà soát, cập nhật thuốc bổ sung mới; sửa đổi một số điều kiện, tỷ lệ thanh toán và xem xét loại bỏ các thuốc không còn lưu hành, không đáp ứng tiêu chí an toàn, hiệu quả ra khỏi danh mục. Bộ Y tế dự kiến bổ sung 76 thuốc mới và loại bỏ 130 thuốc khỏi danh mục. Trong số thuốc mới, có một số kháng sinh thế hệ mới nhằm chiến đấu với những ca nặng nhiễm vi khuẩn đa kháng thuốc, có một số thuốc điều trị đái tháo đường thế hệ mới nhất. Đặc biệt có 28 thuốc điều trị ung thư và điều hòa miễn dịch, trong đó 22 thuốc điều trị đích - nhóm có chi phí cao và nhu cầu lớn. Bên cạnh đó, dự thảo lần này còn làm một việc rất quan trọng là mở rộng danh mục thuốc cho trạm y tế xã - thực hiện đúng chủ trương phát triển, nâng cao chất lượng, hiệu quả y tế cơ sở, nhằm tăng cường tiếp cận y tế đầy đủ, thuận lợi cho người dân ngay tại cấp ban đầu. Tôi đếm thử, có khoảng 300 thuốc trước kia chỉ dùng từ tuyến huyện trở lên nay đã được dùng ở tuyến xã. Nhiều trong số đó là các thuốc dùng đường tiêm, sẽ tăng khả năng điều trị cho y tế tuyến cơ sở. Ví dụ, thuốc hạ sốt paracetamol, trước kia ở xã chỉ được dùng dạng viên uống hoặc đặt hậu môn. Nếu gặp trường hợp trẻ em sốt cao kèm cả nôn và tiêu chảy thì thầy thuốc bó tay, phải chuyển lên tuyến trên. Nay dự thảo danh mục mới cho phép tuyến xã dùng paracetamol dạng truyền tĩnh mạch, cấp cơ sở có thể giữ lại điều trị được những trường hợp bệnh đó. Nhưng mở rộng danh mục cho tuyến dưới cũng như bổ sung một số thuốc liệu có ảnh hưởng tới khả năng chi trả của quỹ BHYT không? Trước hết, với danh mục thuốc mở rộng cho tuyến xã dùng, theo tôi sẽ không làm tăng quỹ hoặc chỉ tăng không đáng kể. Vì những thuốc đó trước kia không được cấp ở xã thì dân sẽ lên huyện hoặc tỉnh để lấy. Nay bệnh nhân sẽ được nhận luôn tại tuyến y tế cơ sở, thuận tiện đi lại, tuyến dưới tăng lưu lượng khám chữa thì việc sử dụng thuốc ở tuyến trên giảm đi. Với việc bổ sung 76 thuốc, Bộ y tế dự kiến làm tăng chi quỹ BHYT khoảng 12.245 tỷ đồng trong 5 năm tới. Ngược lại, việc loại bỏ 130 thuốc giúp tiết kiệm khoảng 3.343 tỷ đồng. Đối với những thuốc có chi phí điều trị lớn, cơ quan soạn thảo cho biết, bắt buộc phải quy định tỷ lệ thanh toán. Trong khi đó, lộ trình tăng mức đóng BHYT từ 4,5% mức lương lên 6%, sẽ tăng tổng thu BHYT thêm khoảng 30.000 tỷ đồng năm, đủ bù đắp số tiền thuốc tăng thêm này, cũng như hỗ trợ miễn viện phí mức cơ bản. Vì vậy, càng cần phải tuyên truyền để người dân và doanh nghiệp ủng hộ tăng mức đóng BHYT. Điều cuối cùng khiến tôi còn băn khoăn là vấn đề phát huy hiệu quả danh mục mới ở tuyến xã. Mối lo mới nảy sinh là ""có thuốc, thiếu thầy"". Khi tuyến xã được dùng những thuốc điều trị cấp cứu như dopamin, dobutamin, đòi hỏi phải có bơm tiêm điện hay các thuốc chống đông máu acenocoumarol; cần phải có xét nghiệm đông máu chuyên sâu... thì tuyến xã sẽ rất cần các thầy thuốc có kinh nghiệm. Đây chính là vấn đề quan trọng, cần tới các chính sách điều phối hiệu quả nhân lực ngành y. Với tư cách là thầy thuốc nhiều năm làm việc cả ở tuyến trung ương và địa phương, tôi hiểu BHYT chưa thể đáp ứng hoàn toàn nhu cầu của người dân nhưng bản dự thảo danh mục thuốc mới này sẽ giúp giảm đi một phần những chi phí tự thanh toán của người bệnh. Đây là những nỗ lực để góp phần thay đổi định kiến về thuốc BHYT. Đủ thầy, đủ thuốc, ta có niềm tin rằng sức khỏe của người dân sẽ được chăm sóc tốt hơn. Quan Thế Dân","Thứ bảy, 27/12/2025, 09:58 (GMT+7)",Quan Thế Dân,Góc nhìn,Y tế & sức khỏe,VN Express,
VNEX_271225_00005,Chiến dịch bắt tàu của Mỹ bóp nghẹt huyết mạch dầu mỏ Venezuela,https://vnexpress.net/chien-dich-bat-tau-cua-my-bop-nghet-huyet-mach-dau-mo-venezuela-4998407.html,"Tổng thống Donald Trump hồi giữa tháng tuyên bố áp đặt phong tỏa đối với ""tàu chở dầu bị trừng phạt"" đến và đi từ Venezuela, nhằm gia tăng sức ép với chính quyền Tổng thống Nicolas Maduro. Trong hai tuần qua, Mỹ đã bắt một tàu chở dầu trong danh sách trừng phạt khi đang trên đường từ Venezuela tới châu Á. Họ cũng đã chặn một tàu dầu khác vốn không nằm trong danh sách trừng phạt. Tuần duyên Mỹ đang truy đuổi một tàu dầu nằm trong danh sách trừng phạt, với cáo buộc nó né lệnh cấm vận nhằm vào Venezuela. Loạt vụ bắt tàu diễn ra khi Mỹ triển khai lượng lớn tàu chiến đến gần Venezuela, nhằm gia tăng áp lực lên chính quyền Tổng thống Maduro. Hoạt động của Mỹ đã làm tê liệt ngành xuất khẩu dầu mỏ của Venezuela, vốn được xem là huyết mạch tài chính nước này khi mang lại 96% nguồn thu quốc gia. Các giàn bơm dầu tại Maracaibo, Venezuela hồi tháng 5/2018. Ảnh:AFP Tàu chở dầu đang ùn lại tại các cảng của Venezuela, do lo ngại việc ra khơi sẽ khiến chúng rơi vào tầm ngắm của Mỹ. Dữ liệu vận tải biển cho thấy nhiều tàu đang hướng về Venezuela đã phải quay đầu giữa chừng. Để duy trì hoạt động liên tục của các giếng dầu, chính quyền ông Maduro đang cân nhắc thuê tàu dầu tư nhân để lưu trữ dầu thô cho đến khi tìm ra cách xuất khẩu. Tuy nhiên, đây cũng chỉ là giải pháp tình thế. Một số nguồn tin cho hay ông Maduro đang cân nhắc phản ứng mạnh hơn. Các chiến hạm của Venezuela đã bắt đầu hộ tống tàu dầu ra khơi, nhưng chúng chỉ dừng lại ở ranh giới lãnh hải. Chính phủ của ông Maduro thậm chí xem xét đưa binh sĩ có vũ trang lên bảo vệ tàu chở dầu tới Trung Quốc, nước nhập khẩu dầu lớn nhất của Venezuela. Động thái này sẽ gây khó khăn cho nỗ lực chặn bắt của tuần duyên Mỹ, nhưng nó cũng có thể kéo Venezuela vào cuộc xung đột quân sự với các chiến hạm mà ông Trump triển khai ở vùng biển Caribe những tháng qua. Ông chủ Nhà Trắng đã cáo buộc Venezuela tuồn ma túy vào Mỹ và đánh cắp dầu của các công ty nước này, dù không cung cấp bằng chứng. Một số người trong ngành mô tả các trở ngại mà ngành dầu khí Venezuela phải đối mặt là nghiêm trọng và có thể phá hỏng nỗ lực phục hồi của nước này sau nhiều năm khủng hoảng kinh tế. Trong những năm gần đây, Tổng thống Maduro được cho là đã nhượng quyền khai thác dầu cho hàng chục công ty tư nhân và không còn kiểm soát hoạt động trong các dự án liên doanh giữa công ty dầu khí nhà nước với các tập đoàn đa quốc gia. Những cải cách này đã giúp sản lượng khai thác dầu của Venezuela tăng lên khoảng 1,1 triệu thùng mỗi ngày trong năm nay, từ mức 360.000 thùng vào nửa cuối năm 2020. Tuy nhiên, lệnh trừng phạt của ông Trump với đội tàu chở dầu có nguy cơ chấm dứt đà tăng trưởng này. WSJcho hay có tới 75 tàu chở dầu đang nằm chờ ngoài khơi Venezuela, dù trangTankerTrackers.comcho biết chỉ một nửa trong số đó nằm trong danh sách trừng phạt của Mỹ. Chỉ có hai tàu chở dầu thô của công ty nhà nước Venezuela cố gắng ra khơi kể từ khi Mỹ bắt tàu dầu đầu tiên hôm 10/12. ""Đã có những con tàu quyết định không rời Venezuela vì sợ bị bắt và cũng có những tàu đang trên đường tới Venezuela đã quyết định quay đầu"", một nhà phân tích dầu khí tại Đại học Rice nói vớiAP. Tàu chở dầu Evana neo đậu ở cảng El Palito tại Puerto Cabello, Venezuela ngày 21/12. Ảnh:AP Trong khi đó, tập đoàn Chevron của Mỹ, công ty điều hành dầu khí tư nhân lớn nhất tại Venezuela, được hưởng ngoại lệ khi có thể tiếp tục xuất khẩu dầu từ quốc gia Nam Mỹ này nhờ giấy phép đặc biệt từ chính quyền ông Trump. Ông Maduro coi các chuyến hàng của Chevron là bằng chứng cho thấy hoạt động của ngành dầu mỏ nước này vẫn diễn ra bình thường bất chấp áp lực từ Mỹ. Truyền hình nhà nước Venezuela ngày 21/12 còn phát sóng cảnh tàu Canopus Voyager mang theo dầu thô mà Chevron sản xuất rời cảng tới Texas, Mỹ. Tuy nhiên, chính phủ của ông Maduro chỉ nhận được rất ít lợi ích tài chính từ việc xuất khẩu dầu của Chevron. Theo điều khoản hợp đồng, Chevron sẽ giữ một nửa trong số khoảng 240.000 thùng/ngày mà họ giúp sản xuất và sau đó chuyển sang các nhà máy lọc dầu ở Mỹ. Một nửa còn lại thuộc về Venezuela, nhưng việc xuất khẩu chúng đang ngày càng trở nên khó khăn. Juan Szabo, cựu phó chủ tịch công ty dầu mỏ nhà nước Venezuela PDVSA, dự đoán xuất khẩu dầu của Venezuela sẽ giảm gần một nửa trong những tháng tới, làm giảm đáng kể nguồn thu ngoại tệ của nước này. ""Chiến dịch bắt tàu dầu của Mỹ có thể khiến Venezuela thiệt hại tới 8 tỷ USD doanh thu"", một nhà kinh tế Venezuela nói vớiWSJ. Thanh Tâm(TheoFrance 24, Oil Price)","Thứ bảy, 27/12/2025, 05:00 (GMT+7)",Thanh Tâm,Thế giới,Tư liệu,VN Express,
