id,title,link,content,date,author,category,sub_category,source,summary
VNEX_311025_00014,Amorim: 'Man Utd có thể thắng nhiều hơn nếu đá 4-4-2',https://vnexpress.net/amorim-man-utd-co-the-thang-nhieu-hon-neu-da-4-4-2-4958035.html,"Hệ thống 3-4-3 của Amorim gây tranh cãi từ khi ông nắm quyền ở sân Old Trafford. Gary Neville cho rằng Amorim bảo thủ khitrung thành với hệ thống ba trung vệ, còn Wayne Rooneytuyên bố không tinnhà cầm quân người Bồ Đào Nha có thể xoay chuyển mùa giải. Sean Dyche, HLV bị Everton sa thải hồi đầu năm 2025, thì tuyên bốsẽ giúp Man Utd thắng nhiều trận hơnvới hệ thống 4-4-2, nếu thế chỗ Amorim. HLV Ruben Amorim chỉ đạo trong trận Man Utd thắng Liverpool 2-1 ở vòng 8 Ngoại hạng Anh ngày 19/10/2025. Ảnh:Reuters Trong buổi họp báo trước trận gặp Nottingham Forest ở vòng 10 Ngoại hạng Anh, Amorim tái khẳng định không từ bỏ triết lý hay sơ đồ 3-4-3. ""Có thể đúng, nếu chơi 4-4-2, chúng tôi sẽ thắng nhiều hơn"", nhà cầm quân người Bồ Đào Nha nói. ""Nhưng tôi luôn tin rằng cách chơi của mình cần thời gian, và khi ổn định, nó sẽ mang lại kết quả tốt hơn. Không ai có thể biết chắc được"". Amorimcho biết ông hiểu sự khác biệt giữa vai trò bình luận viên và HLV, ám chỉ các chuyên gia phải phát biểu mạnh mẽ để thu hút sự chú ý. ""Khi làm chuyên gia truyền hình, nếu bạn không nói những điều mạnh mẽ thì chẳng ai muốn nghe"", HLV 40 tuổi bày tỏ. ""Tôi cũng thế thôi. Tôi biết Sean Dyche rất thông minh và hiểu rõ bóng đá. Nhưng làm HLV khác hoàn toàn với ngồi phân tích trận đấu"". Trận gặp Nottingham Forest ngày 1/11 cũngđánh dấu tròn một nămAmorim được bổ nhiệm dẫn dắt Man Utd thay thếErik ten Hag. Sau giai đoạn khó khăn, ""Quỷ Đỏ"" dần khởi sắc với ba chiến thắng liên tiếp trước Sunderland, Liverpool và Brighton. Amorim thừa nhận gặp nhiều thử thách trên hành trình một năm tại Man Utd, nhưng cho rằng hoàn cảnh cũng giúp ông trưởng thành hơn. ""Có lúc rất tệ, có lúc tuyệt vời, nhưng tôi học được nhiều điều quan trọng"", ông nói. ""Ngay cả khi ở thời điểm khó khăn nhất, tôi vẫn giữ được niềm tin vào cách mình làm việc - đó là điều tốt nhất mà một HLV có thể học được. Hôm nay tôi cảm thấy khác hẳn ba tuần trước. Được dẫn dắt Man Utd là một trong những vinh dự lớn nhất đời tôi, và tôi muốn ở đây lâu dài"". HLV người Bồ Đào Nha cũng đề cập đến thách thức sắp tới khi một số cầu thủ như Amad Diallo, Noussair Mazraoui và Bryan Mbeumo sẽ dự Cup châu Phi tại Morocco từ 21/12 đến 18/1. Họ có thể vắng mặt tới 6 trậnNgoại hạng Anh- là các trận gặp Aston Villa, Newcastle, Wolves, Leeds, Burnley và Man City. ""Chúng tôi sẽ phải chịu thiệt thòi đôi chút, nhưng điều đó đã nằm trong dự tính"", Amorim bày tỏ. ""Đây cũng là cơ hội cho những cầu thủ ít được ra sân thể hiện. Trong các buổi tập, có nhiều người xứng đáng được thi đấu, nhưng khó để thay đổi khi đội đang vận hành tốt. Giờ họ sẽ có cơ hội giúp đội bóng, và tôi tin điều đó sẽ không làm thay đổi tinh thần hay ý tưởng chơi của chúng tôi"". Hồng Duy(theoESPN, Manutd.com)","Thứ sáu, 31/10/2025, 00:00 (GMT+7)",Hồng Duy,Thể thao,Ngoại hạng Anh,VN Express,"HLV Amorim của Man Utd đang đối mặt với nhiều tranh cãi về hệ thống 3-4-3 của mình, với những ý kiến trái chiều từ các chuyên gia như Gary Neville, Wayne Rooney và Sean Dyche. Tuy nhiên, Amorim khẳng định sẽ không từ bỏ triết lý của mình và tin rằng nó sẽ mang lại kết quả tốt hơn về lâu dài. Ông cũng thừa nhận những thách thức trong năm đầu tiên dẫn dắt Man Utd, đồng thời nhắc đến khó khăn sắp tới khi một số cầu thủ phải tham dự Cup châu Phi."
VNEX_311025_00073,Những dàn âm thanh tiền tỷ trên ôtô của dân chơi Việt,https://vnexpress.net/nhung-dan-am-thanh-tien-ty-tren-oto-cua-dan-choi-viet-4957898.html,"Giải đấu âm thanh của Hiệp hội thử thách âm thanh ôtô Quốc tế (IASCA) diễn ra tại Long Biên, Hà Nội, quy tụ gần 50 xe tham dự với nhiều kiểu độ âm thanh. IASCA đã được thành lập 38 năm, tên ban đầu gọi là CAN (Car Audio Nationals) năm 1987 và đổi tên vào năm 1989. IASCA Việt Nam mới gia nhập thành viên của IASCA World từ năm 2019. So với Emma (European Mobile Media Association) từng tổ chức tại Việt Nam, IASCA có quy mô chuyên nghiệp và điều kiện thi khắc nghiệt hơn. Giải đấu âm thanh của Hiệp hội thử thách âm thanh ôtô Quốc tế (IASCA) diễn ra tại Long Biên, Hà Nội, quy tụ gần 50 xe tham dự với nhiều kiểu độ âm thanh. IASCA đã được thành lập 38 năm, tên ban đầu gọi là CAN (Car Audio Nationals) năm 1987 và đổi tên vào năm 1989. IASCA Việt Nam mới gia nhập thành viên của IASCA World từ năm 2019. So với Emma (European Mobile Media Association) từng tổ chức tại Việt Nam, IASCA có quy mô chuyên nghiệp và điều kiện thi khắc nghiệt hơn. Tại IASCA, các tài xế thi đấu với 70 hạng mục khác nhau, từ cơ bản đến cao cấp, từ Novice (người mới) đến Expert (chuyên nghiệp). Không quan trọng mức chi phí mà chủ nhân độ trên xe. Các thương hiệu âm thanh nổi tiếng như MTS (Italy), DynAudio (Đan Mạch), Alpine (Nhật Bản), Focal (Pháp) cũng góp mặt. IASCA nổi tiếng với cuộc thi Soundoff, là phương tiện để các hãng sản xuất thiết bị cùng nhau trình diễn sản phẩm. Một số hạng mục tiêu biểu của Soundoff như chất lượng âm thanh, cường độ âm thanh, thi công và thẩm mỹ và cân chỉnh âm học. Tại IASCA, các tài xế thi đấu với 70 hạng mục khác nhau, từ cơ bản đến cao cấp, từ Novice (người mới) đến Expert (chuyên nghiệp). Không quan trọng mức chi phí mà chủ nhân độ trên xe. Các thương hiệu âm thanh nổi tiếng như MTS (Italy), DynAudio (Đan Mạch), Alpine (Nhật Bản), Focal (Pháp) cũng góp mặt. IASCA nổi tiếng với cuộc thi Soundoff, là phương tiện để các hãng sản xuất thiết bị cùng nhau trình diễn sản phẩm. Một số hạng mục tiêu biểu của Soundoff như chất lượng âm thanh, cường độ âm thanh, thi công và thẩm mỹ và cân chỉnh âm học. Xe độ âm thanh tại giải đấu đa dạng thương hiệu, kiểu dáng, từ các mẫu xe nhỏ như VF 3 tới xe sang BMW X5. Xe độ âm thanh tại giải đấu đa dạng thương hiệu, kiểu dáng, từ các mẫu xe nhỏ như VF 3 tới xe sang BMW X5. Giải Expert, giải cao nhất thuộc về chiếc Lynk & Co 09. Chủ xe Hàn Hoàng Hiệp cho biết chi phí độ âm thanh vào khoảng 1,7 tỷ đồng, thời gian thi công mất 7 ngày. Trên xe sử dụng nhiều hệ thống loa tweet, loa sub, ampli, bộ khuếch đại, dây tín hiệu của các hãng như Morel (Isarel), Audiotec (Đức), Accuton (Đức), Gladen (Đức), Mosconi (Italy), Bewith (Nhật Bản), Aune (Trung Quốc). Giải Expert, giải cao nhất thuộc về chiếc Lynk & Co 09. Chủ xe Hàn Hoàng Hiệp cho biết chi phí độ âm thanh vào khoảng 1,7 tỷ đồng, thời gian thi công mất 7 ngày. Trên xe sử dụng nhiều hệ thống loa tweet, loa sub, ampli, bộ khuếch đại, dây tín hiệu của các hãng như Morel (Isarel), Audiotec (Đức), Accuton (Đức), Gladen (Đức), Mosconi (Italy), Bewith (Nhật Bản), Aune (Trung Quốc). Đội ngũ ban giám khảo là những trọng tài quốc tế nhiều kinh nghiệm, với 5 chuyên gia âm thanh chấm điểm gồm một của Việt Nam, hai của Trung Quốc, hai của Đài Loan. Các trọng tài ngồi trên xe, điều chỉnh các thông số trên màn hình theo các tiêu chí có sẵn và nghe với âm lượng khác nhau để đưa ra kết quả cuối cùng. Đội ngũ ban giám khảo là những trọng tài quốc tế nhiều kinh nghiệm, với 5 chuyên gia âm thanh chấm điểm gồm một của Việt Nam, hai của Trung Quốc, hai của Đài Loan. Các trọng tài ngồi trên xe, điều chỉnh các thông số trên màn hình theo các tiêu chí có sẵn và nghe với âm lượng khác nhau để đưa ra kết quả cuối cùng. Trong cuộc thi có sự xuất hiện của chiếc VinFast VF 9 độ dàn âm thanh 900 triệu đồng, thời gian thi công 21 ngày. Ngoài ra, còn có một chiếc VF 9 độ dàn âm thanh 2 tỷ đồng tham dự tại sự kiện nhưng không thi đấu. Trong cuộc thi có sự xuất hiện của chiếc VinFast VF 9 độ dàn âm thanh 900 triệu đồng, thời gian thi công 21 ngày. Ngoài ra, còn có một chiếc VF 9 độ dàn âm thanh 2 tỷ đồng tham dự tại sự kiện nhưng không thi đấu. Theo một thợ thi công, đa số linh kiện nhập từ nước ngoài của các thương hiệu nổi tiếng. Một số hàng sản xuất tại Việt Nam, nhưng được đưa qua Mỹ kiểm định rồi nhập lại. Các chi tiết trong xe đều được quét 3D để lắp đặt vừa vặn và tăng tính thẩm mỹ, giúp giảm thời gian thi công. Nếu lắp đặt thủ công, phải đo đạc và cắt ghép, thời gian sẽ tăng lên vài tháng. Đồng thời tất cả xe độ hệ thống âm thanh bắt buộc phải lắp đặt hệ thống chống ồn, mức giá dao động tùy theo diện tích của thân xe. Theo một thợ thi công, đa số linh kiện nhập từ nước ngoài của các thương hiệu nổi tiếng. Một số hàng sản xuất tại Việt Nam, nhưng được đưa qua Mỹ kiểm định rồi nhập lại. Các chi tiết trong xe đều được quét 3D để lắp đặt vừa vặn và tăng tính thẩm mỹ, giúp giảm thời gian thi công. Nếu lắp đặt thủ công, phải đo đạc và cắt ghép, thời gian sẽ tăng lên vài tháng. Đồng thời tất cả xe độ hệ thống âm thanh bắt buộc phải lắp đặt hệ thống chống ồn, mức giá dao động tùy theo diện tích của thân xe. Ngoài ra, người thợ cho biết toàn bộ dàn âm thanh đều sử dụng máy phát trên xe, tuy nhiên máy phát và ắc-quy đều được nâng cấp dung tích, am-pe lớn hơn để chịu tải dòng điện từ công suất loa. Một số bộ loa chỉ bật 60% âm lượng đã dùng 400 W điện. Ngoài ra, người thợ cho biết toàn bộ dàn âm thanh đều sử dụng máy phát trên xe, tuy nhiên máy phát và ắc-quy đều được nâng cấp dung tích, am-pe lớn hơn để chịu tải dòng điện từ công suất loa. Một số bộ loa chỉ bật 60% âm lượng đã dùng 400 W điện. Hệ thống điện cũng được nâng cấp bằng dây chuyên dụng. Có những xe sử dụng sợi dây cáp điện giá 10 triệu đồng. Đi kèm là cầu chì nhằm bảo vệ thiết bị, tránh xảy ra sự cố cháy nổ. Hệ thống điện cũng được nâng cấp bằng dây chuyên dụng. Có những xe sử dụng sợi dây cáp điện giá 10 triệu đồng. Đi kèm là cầu chì nhằm bảo vệ thiết bị, tránh xảy ra sự cố cháy nổ. Mỗi một vị trí loa lắp thêm đều được tính toán nhằm tái tạo không gian trong xe như một rạp hát giả lập. Loa mid và treble lắp ở cột A giúp tiếng hát ở giải âm tần đến trung và cao phát ra từ chính diện, giúp người nghe cảm nhận tiếng trực tiếp, tránh cảm giác nghe tiếng hát phát ra từ phía sau. Trong giải đấu IASCA, hạng mục chấm điểm âm thanh ở nhiều vị trí trong xe cũng lần đầu xuất hiện tại Việt Nam. Mỗi một vị trí loa lắp thêm đều được tính toán nhằm tái tạo không gian trong xe như một rạp hát giả lập. Loa mid và treble lắp ở cột A giúp tiếng hát ở giải âm tần đến trung và cao phát ra từ chính diện, giúp người nghe cảm nhận tiếng trực tiếp, tránh cảm giác nghe tiếng hát phát ra từ phía sau. Trong giải đấu IASCA, hạng mục chấm điểm âm thanh ở nhiều vị trí trong xe cũng lần đầu xuất hiện tại Việt Nam. IASCA được tổ chức không chỉ giúp các chủ xe, chủ xưởng thi đấu âm thanh mà còn đánh dấu sự phát triển trong mảng độ âm thanh ôtô trong nước, từ đó tạo ra cộng đồng có sân chơi chuyên nghiệp. Những xe đạt giải cao nhất tại IASCA Việt Nam sẽ được tuyển chọn để mang đi thi đấu tại IASCA World. IASCA được tổ chức không chỉ giúp các chủ xe, chủ xưởng thi đấu âm thanh mà còn đánh dấu sự phát triển trong mảng độ âm thanh ôtô trong nước, từ đó tạo ra cộng đồng có sân chơi chuyên nghiệp. Những xe đạt giải cao nhất tại IASCA Việt Nam sẽ được tuyển chọn để mang đi thi đấu tại IASCA World. Một xe độ gọn gàng với sơ đồ của hệ thống âm thanh kèm loa trầm đặt phía sau. Loa trầm với âm tần thấp thường đặt ở cốp, xe hướng tới âm thanh công suất lớn nên sơ đồ lắp đặt đơn giản hơn. Một xe độ gọn gàng với sơ đồ của hệ thống âm thanh kèm loa trầm đặt phía sau. Loa trầm với âm tần thấp thường đặt ở cốp, xe hướng tới âm thanh công suất lớn nên sơ đồ lắp đặt đơn giản hơn. Minh Quân","Thứ sáu, 31/10/2025, 06:00 (GMT+7)",Minh Quân,Xe,Thị trường,VN Express,"Giải đấu âm thanh IASCA, quy tụ gần 50 xe độ âm thanh, đã diễn ra tại Hà Nội với nhiều hạng mục thi đấu từ cơ bản đến chuyên nghiệp. IASCA là một tổ chức quốc tế lâu đời, chuyên nghiệp và khắt khe hơn so với các giải đấu tương tự như Emma. Giải đấu nổi tiếng với cuộc thi Soundoff, nơi các hãng sản xuất thiết bị âm thanh trình diễn sản phẩm trên các xe đa dạng, từ VF 3 đến BMW X5. Giải cao nhất thuộc về chiếc Lynk & Co 09 với chi phí độ âm thanh lên đến 1,7 tỷ đồng."
VNEX_311025_00063,Đau đầu kèm tê mặt có phải dấu hiệu đột quỵ?,https://vnexpress.net/dau-dau-kem-te-mat-co-phai-dau-hieu-dot-quy-4958004.html,"Trả lời: Đau đầu kèm tê mặt có thể do nhiều nguyên nhân từ lành tính đến nguy hiểm. Đau đầu kèm tê mặt có thể liên quan đến đau nửa đầu migraine, rối loạn thần kinh cảm giác sau chấn thương hoặc bệnh lý dây thần kinh sinh ba (trigeminal neuralgia). Những bệnh này có thể gây cảm giác tê, châm chích, đau nhói nửa mặt, nhưng không kèm yếu liệt tay chân như đột quỵ. Stress, lo âu kéo dài dẫn cũng có các triệu chứng tương tự. Nếu đau đầu xuất hiện thoáng qua, kèm theo tê môi, tê tay, yếu một bên cơ thể hoặc nói khó, nhìn mờ... có thể là dấu hiệu cảnh báo sớm của cơn thiếu máu não thoáng qua (TIA) - tiền đột quỵ. Các triệu chứng này thường kéo dài vài phút đến một giờ rồi tự hết khiến người bệnh bỏ qua. Người bệnh điều trị đau đầu bằng phương pháp kích thích từ trường xuyên sọ. Ảnh minh họa:Bệnh viện Đa khoa Tâm Anh Bạn nên đi khám để bác sĩ kiểm tra, xác định chính xác nguyên nhân. Bác sĩ thường chỉ định chụp MRI 3 Tesla - hệ thống giúp phát hiện sớm tổn thương nhỏ ở mô mềm, mạch máu não, dây thần kinh; đo điện cơ (EMG) để đánh giá dẫn truyền thần kinh mặt và tay. Các kỹ thuật này được thực hiện phối hợp, giúp chẩn đoán sớm các bệnh lý thần kinh - mạch máu não, từ đó can thiệp kịp thời. Nếu nguyên nhân là rối loạn dẫn truyền thần kinh hoặc co cứng cơ mặt sauđột quỵ, bác sĩ có thể chỉ định tiêm botox điều trị co cứng cơ, kết hợp kích thích từ trường xuyên sọ (rTMS) - công nghệ dùng sóng điện từ điều hòa hoạt động vùng não tổn thương, cải thiện cảm giác và phục hồi chức năng vận động. Đây là liệu pháp đa mô thức được ứng dụng phổ biến trong điều trị các bệnh lý thần kinh, hỗ trợ người bệnh giảm triệu chứng, rút ngắn thời gian hồi phục. Đểphòng ngừa đột quỵ, bạn nên kiểm soát huyết áp, đường huyết, mỡ máu. Tập thể dục đều đặn, ngủ đủ giấc và tránh stress kéo dài. Bổ sung thực phẩm giàu omega-3, vitamin nhóm B, các tinh chất tự nhiên như blueberry (việt quất) và ginkgo biloba (bạch quả) góp phần tăng tuần hoàn máu não, giảm stress oxy hóa, hỗ trợ bảo vệ tế bào thần kinh. BS.CKI Nguyễn Hữu KhánhTrung tâm Khoa học Thần KinhBệnh viện Đa khoa Tâm Anh TP HCM","Thứ sáu, 31/10/2025, 08:00 (GMT+7)",BS.CKI Nguyễn Hữu Khánh,Sức khỏe,Các bệnh,VN Express,"Đau đầu kèm tê mặt có thể do nhiều nguyên nhân, từ các bệnh lý như đau nửa đầu, rối loạn thần kinh đến dấu hiệu cảnh báo sớm của thiếu máu não thoáng qua. Để xác định chính xác nguyên nhân, người bệnh nên đi khám và thực hiện các xét nghiệm như MRI và đo điện cơ. Tùy thuộc vào nguyên nhân, bác sĩ có thể chỉ định các phương pháp điều trị như tiêm botox, kích thích từ trường xuyên sọ, hoặc các liệu pháp đa mô thức khác. Để phòng ngừa đột quỵ, cần kiểm soát huyết áp, đường huyết, mỡ máu, tập thể dục đều đặn, ngủ đủ giấc, tránh stress, và bổ sung các dưỡng chất có lợi cho não bộ."
VNEX_311025_00093,"Đầu tháng nhận lương, giữa tháng hết tiền",https://vnexpress.net/dau-thang-nhan-luong-giua-thang-het-tien-4958026.html,"Lương của tôi - một người không còn trẻ - hết luôn trong ngày. Bài toán có nghiệm không đổi tháng này qua tháng khác với tôi như sau. Thu nhập của tôi khoảng 15 triệu đồng mỗi tháng - mức được xem là trung bình khá trong khối cơ quan nhà nước. Nhưng thực tế, sáng nhận lương, chiều tôi đã chuyển khoản xong: 7 triệu đồng nợ ngân hàng cho căn hộ xã hội; khoảng 4 triệu đồng học phí mỗi tháng, cho hai con học đại học. Tài khoản của tôi gần như lại rỗng. Thu nhập của vợ tôi cũng khoảng 15 triệu đồng mỗi tháng, cho tất cả ăn uống, đi lại, điện nước, thuốc men... Vén khéo lắm, chúng tôi sống tùng tiệm, tạm đủ đến kỳ lương sau. Nhưng nếu có các khoản phát sinh như ma chay cưới hỏi, mà những phát sinh này diễn ra thường xuyên, thu nhập của hai công chức chỉ trụ được đến giữa tháng. Hai vợ chồng động viên nhau, chừng nào trả hết nợ ngân hàng, chúng tôi sẽ có ""đồng tiêu, đồng để dành"". Hành trình một ngày làm việc của tôi, cũng như hàng vạn công chức khác, bắt đầu từ 6 giờ sáng - rời nhà, bắt xe buýt hơn một tiếng tới cơ quan. 7h30 bắt đầu làm việc, thường đến tận 6-7h tối mới xong. Việc gì cũng gấp, cũng cần, không thể bỏ sót. Nhiều người nghĩ ""làm nhà nước chân trong chân ngoài"", nhưng thực tế - với cường độ công việc hiện nay - tôi chẳng thể rút chân nào ra nổi. Tôi chỉ có thể tranh thủ thời gian ban đêm hoặc cuối tuần để viết báo, như bài này, vừa có thêm chút nhuận bút động viên, vừa có niềm vui được chia sẻ trải nghiệm và góc nhìn cá nhân với cộng đồng. Nhiều lúc ngồi trên chuyến xe buýt tan tầm, tôi nhìn ra cửa kính, thấy dòng người hối hả, lòng không tránh khỏi cảm giác chênh vênh. Ba mươi năm công tác, tôi chưa bao giờ than thở, cũng không nghĩ đến chuyện bỏ nghề. Tôi biết nhiều đồng nghiệp của mình vẫn miệt mài với công việc, dù mỗi tháng đều là một cuộc ""chạy marathon"" tài chính hụt hơi. Nhưng đôi khi, giữa những hóa đơn chất chồng và giá cả tăng nhanh mỗi ngày, tôi không khỏi tự hỏi: chúng tôi sẽ giữ được sự tận tụy đến bao giờ nếu cuộc sống tiếp tục thiếu trước hụt sau? Bởi vậy, khi hay tin đại biểu Quốc hội đề nghị tăng lương cơ sở từ 1/1/2026, tôi thật sự hy vọng. Chính phủ đã nhiều lần cải cách tiền lương, tăng lương cơ sở, nhưng thực tế mức tăng không theo kịp giá cả thị trường. Trong khi gánh nặng ngân sách ngày càng lớn, việc điều chỉnh lương luôn là bài toán khó. Tuy vậy, như đại biểu Tuấn đã nói: ""Cán bộ có đủ sống thì mới yên tâm phục vụ. Công chức không bị nặng gánh cơm áo gạo tiền thì mới nhẹ lòng cống hiến"" - đó là sự thật không thể né tránh. Khi thu nhập không đủ chi tiêu, công chức bằng cách này hay cách khác buộc phải xoay xở thêm, tìm cách để tồn tại. Chậm tăng lương cơ sở không chắc là yếu tố quyết định đến mức tăng trưởng các chỉ số kinh tế vĩ mô, ngược lại, nó có thể khiến hàng loạt công chức tâm huyết phải rời bỏ bộ máy nhà nước. Việc tăng lương cần được nhìn nhận không chỉ ở góc độ tài chính, mà như sự đầu tư cho chất lượng bộ máy công vụ. Đồng lương đủ sống giúp công chức giữ được sự liêm chính, yên tâm cống hiến và tránh những ""lối thoát"" tiêu cực. Cải cách tiền lương, vì vậy, không đơn thuần là chia lại ngân sách, mà là đặt lại thước đo công bằng giữa trách nhiệm và đãi ngộ. Tất nhiên, tăng lương chỉ có ý nghĩa khi đi kèm các biện pháp kiểm soát lạm phát và nâng cao năng suất lao động. Nếu ""lương chưa lên, giá đã tăng"", nỗ lực cải cách sẽ rơi vào vòng luẩn quẩn. Cần song song thực hiện các giải pháp như siết chặt quản lý thị trường, minh bạch chi phí trung gian trong các mặt hàng thiết yếu, thúc đẩy sản xuất trong nước và cải thiện hiệu quả chi tiêu công. Khi đồng tiền giữ được giá trị thực, tăng lương mới thật sự là tăng chất lượng đời sống, chứ không chỉ là điều chỉnh con số trên bảng excel. Đằng sau mỗi con số về lương cơ sở là hàng triệu cuộc đời thầm lặng. Kiến nghị sớm tăng lương không chỉ là vấn đề chính sách, mà là sự chia sẻ, thấu hiểu cho những con người đang giữ nhịp vận hành bộ máy nhà nước, để niềm tin và lòng tận tụy không vơi đi theo những tờ hóa đơn cuối tháng. Trần Phú Dũng","Thứ sáu, 31/10/2025, 00:00 (GMT+7)",Trần Phú Dũng,Góc nhìn,Chính trị & chính sách,VN Express,"Bài viết phản ánh thực trạng khó khăn tài chính của một công chức trung niên với thu nhập 15 triệu đồng/tháng, không đủ trang trải các khoản nợ, học phí và chi phí sinh hoạt gia đình. Dù làm việc vất vả và tranh thủ làm thêm, tác giả vẫn cảm thấy chênh vênh trước gánh nặng kinh tế và lo lắng về khả năng duy trì sự tận tụy với công việc. Tác giả bày tỏ sự hy vọng vào việc tăng lương cơ sở để công chức có thể yên tâm cống hiến và giữ được sự liêm chính."
