id,title,link,content,date,author,category,sub_category,source,summary
VNEX_190825_00103,Các ông lớn địa ốc đổ bộ thị trường Tây Ninh,https://vnexpress.net/cac-ong-lon-dia-oc-do-bo-thi-truong-tay-ninh-4928225.html,"Cuối tháng 3, Vingroup khởi công Vinhomes Green City tại Đức Hòa - khu đô thị phức hợp rộng gần 200 ha, tổng vốn hơn 28.000 tỷ đồng. Dự án cung cấp gần 5.500 sản phẩm nhà phố, liền kề và 5 tòa chung cư cao 25 tầng cùng khu nhà ở xã hội. Ngoài dự án này, tại Tây Ninh (Long An cũ), Vingroup còn lên kế hoạch triển khai hai siêu dự án khác là khu đô thị Phước Vĩnh Tây gần 1.090 ha với vốn hơn 90.000 tỷ đồng và khu đô thị mới Tân Mỹ quy mô 930 ha, vốn gần 74.500 tỷ đồng. Chỉ riêng 3 dự án của Vingroup đang triển khai tại Tây Ninh đã chiếm hơn 192.500 tỷ đồng (khoảng 7,7 tỷ USD), vượt xa các thị trường bất động sản khác tại miền Nam (trừ TP HCM). Không riêng Vingroup, một chủ đầu tư có tiếng trong phát triển đô thị là Ecopark cũng đang nhắm đến thị trường Tây Ninh với dự án Eco Reatreat 220 ha tại Bến Lức, tổng vốn 17.000 tỷ đồng, gồm hàng nghìn sản phẩm nhà phố, biệt thự và căn hộ. T&T Group cũng đang triển khai khu đô thị T&T Millenniaquy mô 267 ha tại xã Cần Giuộc, vốn đầu tư 41.000 tỷ đồng. Còn Him Lam đang hoàn tất thủ tục pháp lý cho dự án 270 ha tại Khu công nghiệp Đức Hòa 3, trong khi Nam Long tiếp tục mở rộng đại đô thị Waterpoint 335 ha với hơn 10.000 sản phẩm... Bên cạnh nhà liền thổ, Tây Ninh cũng đang đẩy mạnh phát triển dự án cao tầng, dòng sản phẩm trước đây ít được quan tâm. Nổi bật như Seaholdings đang triển khai dự án khu căn hộ Destino Centro tại xã Mỹ Yên. Dự án này gồm 5 khối chung cư cao 20 tầng, cung cấp hơn 2.000 căn hộ, giá bán dao động khoảng 30 triệu đồng mỗi m2. Nam Long Group lên kế hoạch triển khai gần 4.000 căn hộ cao tầng trong Waterpoint. Thắng Lợi Group dự kiến phát triển khu đô thị 12 ha với khoảng 6.000 căn hộ. Các tên tuổi khác như Trần Anh, VinaLiving, Quốc tế Năm Sao, Prodezi... cũng công bố loạt dự án quy mô hàng chục đến hàng trăm ha. Một dự án chung cư cao tầng đang triển khai tại Tây Ninh. Ảnh:Huy Vũ Theo Sở Tài chính Tây Ninh, trong nửa đầu năm kinh tế Tây Ninh tăng trưởng 9,63%, mức cao nhất từ 2021 đến nay. Thu ngân sách tỉnh hơn 28.249 tỷ đồng, trong đó thu tiền sử dụng đất đạt hơn 8.462 tỷ đồng (khoảng 144% dự toán Trung ương), tăng trưởng tới 84% so với cùng kỳ năm ngoái. Đây là mức tăng cao trong nhiều năm trở lại đây, phản ánh sức hấp dẫn đầu tư vào hạ tầng và thị trường bất động sản tại địa phương. Xét về đầu tư, Tây Ninh cũng đã cấp mới 43 dự án đầu tư trong nước với tổng vốn hơn 9.327 tỷ đồng. Đến nay, tỉnh có 2.294 dự án trong nước với vốn đăng ký gần 516.000 tỷ đồng. Ở lĩnh vực FDI, tỉnh cấp mới 76 dự án, với vốn đăng ký 251 triệu USD. Tính chung, Tây Ninh hiện có 1.530 dự án FDI với tổng vốn đăng ký trên 13 tỷ USD. Sự xuất hiện đồng loạt của nhiều chủ đầu tư lớn đã tạo động lực tăng trưởng rõ rệt cho thị trường địa ốc Long An. Hiệu ứng ""ăn theo"" từ các dự án quy mô đang lan rộng, thu hút dòng vốn đầu tư khắp nơi. Theo DKRA Group, trong nửa đầu năm, Tây Ninh (Long An cũ) là thị trường chiếm tỷ trọng lớn về nguồn cung nhà liền thổ tại phía Nam, với hơn 33% nguồn cung đất nền, 90% rổ hàng nhà liền thổ. Về cầu, gần 80% giao dịch đất nền và nhà liền thổ của khu vực tập trung ở Tây Ninh, với khoảng 3.000 giao dịch thành công. Báo cáo từ CBRE Việt Nam cũng ghi nhận, giá bất động sản của tỉnh này nửa đầu năm nay tăng 19% so với cùng kỳ năm ngoái, mức cao nhất tại các tỉnh phía Nam. Đà tăng trên được nhận định chủ yếu do rổ hàng mới triển khai của các chủ đầu tư lớn, kéo giá bán bình quân tăng cao. Ông Võ Hồng Thắng, Phó tổng giám đốc DKRA Group, đánh giá nguyên nhân khiến Tây Ninh hấp dẫn các chủ đầu tư lớn xuất phát từ nhiều yếu tố. Giá đất vẫn thấp hơn đáng kể so với TP HCM hay Đồng Nai nhưng dư địa tăng giá còn lớn. Tây Ninh có vị trí chiến lược, vừa là cửa ngõ kết nối TP HCM với miền Tây, vừa giáp Đông Nam Bộ và Campuchia. Hạ tầng đang được đầu tư mạnh với các trục giao thông lớn như vành đai 3, cao tốc Bến Lức - Long Thành, quốc lộ 22 mở rộng, mở ra triển vọng liên kết vùng rõ rệt. Ông Võ Huỳnh Tuấn Kiệt, Giám đốc thị trường nhà ở CBRE Viet Nam, nhận định động thái triển khai dự án của các tập đoàn lớn như Vingroup, Ecopark, Nam Long, Seaholding ... sẽ thúc đẩy thị trường Tây Ninh phát triển mạnh. Sự khác biệt hiện nay là quy mô dự án ngày càng lớn, từ 100 đến 200 ha, phản ánh sự chuyên nghiệp hóa và xu hướng phát triển các đô thị đồng bộ thay vì những cơn sốt đất nền manh mún trước đây. Theo ông Kiệt, khi nguồn cung nhiều, thị trường chắc chắn sẽ thu hút sự quan tâm của nhà đầu tư không chỉ tại địa phương mà cả nước. ""Mức độ hấp thụ cụ thể còn cần theo dõi, nhưng có thể khẳng định nhà ở Tây Ninh sẽ sôi động trong những quý tới"", ông nói. Ông Đinh Minh Tuấn, Giám đốc Batdongsan khu vực miền Nam, bổ sung rằng xu hướng mở rộng không gian đô thị ra vùng ven TP HCM sẽ tiếp diễn, trong đó Tây Ninh là điểm đến tiềm năng. Đây là cơ hội để thị trường phát triển, nhất là các khu đô thị quy hoạch tiện ích bài bản, đang ở giai đoạn đầu tư hạ tầng, dư địa tăng trưởng còn lớn. Bên cạnh đó, tăng trưởng khu công nghiệp cũng sẽ kéo theo làn sóng di dân cơ học mạnh mẽ đến với Tây Ninh, nhất là lao động từ các tỉnh miền Tây. Tỉnh hiện quy hoạch 46 khu công nghiệp với tổng diện tích hơn 14.500 ha, trong đó 32 khu đã đủ điều kiện tiếp nhận đầu tư với tỷ lệ lấp đầy gần 70%, hơn 1.000 ha đất sạch sẵn sàng cho thuê. Các khu công nghiệp đã thu hút 2.490 dự án, gồm 1.403 dự án FDI (17,3 tỷ USD) và 1.087 dự án trong nước (217.517 tỷ đồng), tạo việc làm cho khoảng 350.000 lao động. Theo quy hoạch đến năm 2030, Tây Ninh sẽ có 59 khu công nghiệp với diện tích 16.800 ha. Nhiều chuyên gia dự báo trong 3-5 năm tới, Tây Ninh có thể vươn lên cạnh tranh trực tiếp với TP HCM và Đồng Nai - những địa phương dẫn dắt thị trường phía Nam nhiều năm qua và sẽ chuyển mình từ ""sân sau"" của TP HCM thành một cực phát triển mới của bất động sản phía Nam. Phương Uyên","Thứ ba, 19/8/2025, 06:48 (GMT+7)",Phương Uyên,Bất động sản,Thị trường,VN Express,"Văn bản tóm tắt như sau:

Nhiều tập đoàn bất động sản lớn như Vingroup, Ecopark, T&T Group đang đầu tư mạnh vào thị trường Tây Ninh với các dự án khu đô thị quy mô lớn, bao gồm cả nhà liền thổ và căn hộ cao tầng. Sự đổ bộ của các ""ông lớn"" này đã thúc đẩy tăng trưởng kinh tế và thu ngân sách của tỉnh Long An, đặc biệt là từ tiền sử dụng đất. Tây Ninh hiện là thị trường bất động sản hấp dẫn, thu hút vốn đầu tư lớn cả trong nước và quốc tế, chiếm tỷ trọng lớn về nguồn cung nhà liền thổ tại phía Nam. Thị trường đang có sự tăng trưởng mạnh mẽ và thu hút dòng vốn đầu tư khắp nơi."
VNEX_190825_00075,Lợi ích sức khỏe từ nước ion kiềm giàu hydrogen,https://vnexpress.net/loi-ich-suc-khoe-tu-nuoc-ion-kiem-giau-hydrogen-4928456.html,"""Nước kiềm"" có độ pH cao hơn mức trung tính. Nếu pH dưới 7, nước có tính axit; trên 7 có tính kiềm. Trong khi đó, nước hydrogen (hay nước giàu hydro) là loại có chứa các phân tử hydrogen (H2) ở dạng hòa tan. Nước ion kiềm giàu hydrogen đang được gia đình hiện đại ưa chuộng nhờ khả năng hỗ trợ trung hòa axit dư, góp phần chống oxy hóa và cải thiện cân bằng nội môi của cơ thể. Với công nghệ điện giải, nguồn nước này được tạo ra thông qua quá trình tách nước thành dạng giàu ion kiềm và chứa phân tử hydrogen hòa tan. Lợi ích của loại nước được nhiều nghiên cứu nghi nhận. Nguồn nước ion kiềm giàu hydrogen. Ảnh:Photo AC Cuộc sống hiện đại bận rộn và thói quen sử dụng rượu bia, nước có ga, đồ ăn nhanh nhiều dầu mỡ, làm việc liên tục gây căng thẳng kéo dài gây nên hiện tượng rối loạn cân bằng axit - kiềm. Tình trạng này khiến axit dịch vị tăng trong dạ dày. Trong một nghiên cứu lâm sàng do Trường Đại học Y Shiga phối hợp với Bệnh viện Quốc gia Ohkura (Nhật Bản), 6 tình nguyện viên được cho uống 1 lít mỗi ngày nước ion kiềm có độ pH lần lượt là 9, 10 và 11. Các nhà nghiên cứu ghi nhận sau khi uống nước ion kiềm pH 9, độ pH trong dạ dày tăng lên và duy trì ở mức cao hơn trong khoảng 30 phút, gợi ý về khả năng hỗ trợ kiểm soát độ axit của loại nước này. Độ axit là yếu tố thường mất cân bằng ở người có chế độ ăn nhiều dầu mỡ, uống rượu bia hoặc chịu căng thẳng kéo dài. Bên cạnh đó, các nghiên cứu như của Tiến sĩ Lei Huang (Đại học Loma Linda, Mỹ) cho thấy hydrogen trong nước có khả năng khuếch tán sâu vào tế bào và chọn lọc phản ứng với gốc hydroxyl – một trong những gốc tự do độc hại. Đặc điểm chọn lọc này cho phép hydrogen tác động đến các gốc tự do có hại mà không làm ảnh hưởng đến các phân tử oxy và nitơ phản ứng khác, vốn đóng vai trò trong việc điều hòa tín hiệu sinh học bình thường của tế bào. Khả năng chống oxy hóa của nước này được đo bằng chỉ số ORP. Chỉ số ORP âm càng thấp thì mức độ chống oxy hóa càng lớn. Vì vậy, khi tìm hiểu các dòng nước ion kiềm hydrogen, người dùng cần căn cứ vào các chỉ số như độ pH, ORP và hàm lượng hydrogen để lựa chọn phù hợp. Các dòng máy lọc nước điện giải tạo nước ion kiềm hydrogen tại Mutosi. Ảnh:Mutosi Từ những cơ sở khoa học này,máy lọc nước điện giảiion kiềm hydrogen đang được nhiều gia đình lựa chọn như giải pháp kết hợp giữa cung cấp nguồn nước sạch và hỗ trợ bảo vệ sức khỏe. Trong đó, thương hiệu Việt Mutosi đã phát triển dòng máy có thể tạo ra nước ion kiềm giàu hydrogen với chỉ số sau lọc ổn định, ứng dụng thêm màng RO để thích ứng với đa dạng nguồn nước trong nước. Theo công bố, các chỉ số của nước tạo ra từ máy lọc nước điện giải Mutosi hỗ trợ trung hòa axit dư và chống oxy hóa khi sử dụng lâu dài. Đây là kết quả của nhiều năm Mutosi nghiên cứu về nguồn nước và lối sống của người Việt. Đầu tư một thiết bị lọc nước điện giải góp phần đảm bảo nguồn nước an toàn, đồng thời hỗ trợ chăm sóc sức khỏe. Do đó, thương hiệu Mutosi mang đến các sản phẩm kết hợp công nghệ và thiết kế đi kèm mức giá dễ tiếp cận cho người Việt. Linh Lam","Thứ ba, 19/8/2025, 08:00 (GMT+7)",Linh Lam,Sức khỏe,Tin tức,VN Express,
VNEX_190825_00036,Cơ hội để Ronaldo phá dớp trắng tay cùng Al Nassr,https://vnexpress.net/co-hoi-de-ronaldo-pha-dop-trang-tay-cung-al-nassr-4928553.html,"Al Nassr - Al Ittihad: 19h hôm nay 19/8, giờ Hà Nội. Siêu Cup Saudi năm nay lần đầu được tổ chức tại Hong Kong, như một bước đi nhằm quảng bá bóng đá Arab Saudi ra thế giới. Ban tổ chức kỳ vọng sự kiện này không chỉ mang đến bầu không khí cuồng nhiệt cho khán giả châu Á mà còn khẳng định tham vọng toàn cầu của bóng đá Saudi. Trận bán kết tâm điểm sẽ là màn đối đầu giữaAl Nassr- với những ngôi sao Ronaldo, Sadio Mane, Joao Felix, Kingsley Coman, và Al Ittihad của Benzema, N'Golo Kante cùng Fabinho. Cristiano Ronaldo trong buổi tập của Al Nassr tại Hong Kong ngày 18/8. Ảnh:Al Nassr Đây là cơ hội đểRonaldođoạt danh hiệu chính thức đầu tiên cùng Al Nassr. Từ khi chuyển đến Al Nassr, tiền đạo 40 tuổi về nhì Saudi Pro League hai lần, thua hai trận bán kết và một trận chung kết Siêu Cup Arab Saudi, thua một trận bán kết và một trận chung kết King Cup, bị loại ở tứ kết và bán kết AFC Champions League châu Á. Danh hiệu duy nhất Ronaldo giành được với Al Nassr làgiải giao hữu Arab Champions Cup 2023. Dù trắng tay tại các giải đấu chính, Ronaldo vẫn đạt thành tích cá nhân cao, ghi 99 bàn và có 19 kiến tạo qua 111 trận trên mọi đấu trường cho Al Nassr. Tiền đạo Bồ Đào Nha giành Vua phá lưới Saudi Pro League hai mùa gần nhất, với lần lượt 35 và 25 bàn. Trận bán kết giữa Al Nassr và Al Ittihad hứa hẹn khó lường bởi quá khứ cạnh tranh khốc liệt. Trong năm lần gặp nhau gần nhất, kết quả liên tục đảo chiều: Al Nassr từng thắng đậm 5-2 và 4-2, nhưng cũng thua 1-2 rồi 2-3. Trận đấu ngày 7/5/2025 là minh chứng rõ nét: Al Nassr dẫn 2-0 sau hiệp một, nhưng lại để Al Ittihad ngược dòng thắng 3-2 nhờ các bàn của Benzema, Kante và Aouar. Thất bại đó khiến Ronaldo tức giận,trách đồng đội mơ ngủngay trên sân. Siêu Cup Saudi chứng kiến những thay đổi sát giờ khiAl Hilalrút lui, để tập trung cho FIFA Club World Cup và đảm bảo cam kết nghỉ phép cho các cầu thủ. Liên đoàn Bóng đá Saudi (SAFF) sau đó cấm Al Hilal tham dự hai kỳ Siêu Cup kế tiếp và phạt CLB này khoảng 133.350 USD vì quyết định rút lui vào phút chót. Điều này càng khiến cuộc đối đầu giữa Al Nassr và Al Ittihad trở thành tâm điểm chú ý lớn nhất. Đội thắng sẽ gặp Al Ahli hoặc Al Qadsiah ở chung kết trên Sân vận động Hồng Kông lúc 19h ngày 23/8, giờ Hà Nội. Hồng Duytổng hợp","Thứ ba, 19/8/2025, 05:57 (GMT+7)",Hồng Duy,Thể thao,Bóng đá,VN Express,
VNEX_190825_00080,Chồng nói cách tôi dạy con là 'diễn' vì không dùng đòn roi,https://vnexpress.net/chong-gia-truong-day-con-don-roi-chong-noi-cach-toi-day-con-la-dien-vi-khong-dung-don-roi-4928573.html,"Tôi 48 tuổi, chồng 61 tuổi, cưới nhau 23 năm, có hai con gái: một con học năm thứ ba ở nước ngoài, một con học lớp chín. Chúng tôi sống ở Sài Gòn được 25 năm. Về tình cảm, đến tận bây giờ chúng tôi vẫn còn yêu thương và tôn trọng nhau, tuy không như thời mới cưới nhưng cũng ổn. Về kinh tế, từ khi lấy anh đến giờ, tôi vẫn là trụ cột chính trong gia đình. Nhờ tiết kiệm và công việc hiện tại với mức lương khá ổn nên cuộc sống cũng đầy đủ, không nợ nần. Chồng tôi đã về hưu nhưng vẫn còn làm thêm (công việc này anh có thể chủ động thời gian, dù thu nhập không nhiều, khoảng 15-20 triệu đồng mỗi tháng). Hôm nay tôi viết lên đây xin quý độc giả cho lời khuyên: tôi có sai trong vấn đề dạy con, hay tôi đang đòi hỏi quá nhiều ở chồng trong cách giáo dục con cái? Bé đầu: Từ khi con tập nói, tôi luôn đồng hành cùng con. Tôi để con tự lập, tự quyết nhưng vẫn dõi theo và uốn nắn khi con chưa đúng. Khi con bước vào tuổi dậy thì, không may bị rối loạn, phải dùng thuốc. Ba con không đồng ý, thậm chí còn nói những lời như: ""Mới bây lớn mà trầm cảm thì sao sống nổi với đời"", hoặc ""Mới bây lớn mà ương bướng thì lớn lên coi như bỏ"", hay ""Đổ thừa trầm cảm vì ở nhà nhiều do dịch Covid thì chắc cả thế giới này bị trầm cảm hết à"". Tôi giải thích thế nào anh cũng không nghe, tôi vẫn kiên trì theo bác sĩ và đồng hành cùng con mỗi ngày. Cùng thời gian đó, con bị mụn rất nhiều. Tôi cho con đi điều trị thì ba con bảo: ""Mụn mà điều trị gì, hết dậy thì tự hết, điều trị chi cho mệt"". Con là con gái, mặt đầy mụn mủ mà ba không xót xa, không lo lắng, tôi đành âm thầm vừa điều trị mụn, vừa hỗ trợ tâm lý cho con. Giai đoạn đó, tôi rất cô đơn, không ai chia sẻ, không ai để tôi dựa vào. Ở nhà, tôi cố giữ vẻ bình thản, đi làm thì gắng tập trung để không sai sót. Năm lớp 11, con đạt giải quốc gia. Khi khoe với ba, anh lại bảo: ""Con mà giỏi gì, ngoài kia đầy người giỏi hơn, con chỉ là hạt cát giữa sa mạc"". Con im lặng nhưng tôi biết rất buồn. Hôm sau, con nói: ""Ba chưa bao giờ công nhận thành quả học tập của con"". Từ đó con quyết tâm học để giành học bổng đi xa. Giờ con đã sang năm thứ ba, mọi thứ ổn, con cứng rắn và trưởng thành nhiều. Ngày nào con cũng nhắn tin, trò chuyện với tôi dù bận, luôn cảm ơn tôi đã dìu dắt, là bạn, là chỗ dựa. Nhưng con hiếm khi liên lạc với ba, phần lớn do tôi nhắc nhở. Chồng tôi cho rằng cách tôi dạy con là ""diễn"", vì tôi không dùng đòn roi. Tôi cũng hiểu anh lớn lên trong gia đình nhiều chị em gái, dạy con bằng nạt nộ, mạt sát, nên anh đã quen với văn hóa đó. Bé thứ hai: Con học khá nhưng còn lơ là. Tôi cũng rèn luyện, sát cánh như với chị gái. Con đang tuổi dậy thì, năm cuối cấp hai nên tôi muốn ba gần gũi con hơn. Nhưng anh thường lấy lý do để từ chối: (1) Dạy con khó, dạy sai coi như hỏng nên không tham gia. (2)) Từ trước tới giờ tôi dạy con, giờ anh tham gia sợ ""trống đánh xuôi, kèn thổi ngược"" nên nhường. (3) Đi làm về đã tối, ai có việc nấy, hỏi han con hàng ngày chỉ là xã giao, nhàm chán. (4) Tôi gợi ý dành 15 phút mỗi tối trò chuyện với con, anh nói không biết nói gì, nói cho có cũng vô ích. (5) Anh bảo cũng muốn động viên con nhưng ""mỗi nhà mỗi khác"", sợ nói sai nên chọn im lặng. Tôi vẫn nói với anh, thà quan tâm động viên còn hơn im lặng. Chồng đi làm về lúc 20h hoặc hơn, chỉ ăn tối rồi cầm điện thoại xem clip ngắn, mạng xã hội đến giờ ngủ, không quan tâm con vui buồn ra sao. Tôi gợi ý anh đi làm về sớm để đón con, hoặc nghỉ một hôm ở nhà cho con gần gũi với ba, anh đều từ chối, bảo ""về sớm chả có gì để làm"" hoặc ""ở nhà đi ra đi vào chán"". Khi con khoe kết quả học thêm, anh còn lẫn lộn môn học, thậm chí con nói: ""Chắc ba không biết con học lớp mấy luôn quá"". Anh lại có quan điểm con dùng điện thoại thì thoải mái, không giới hạn. Tôi nhắc 11h khuya rồi, anh nói: ""Để thoải mái, quản con vậy nó bị điên à?"". Tôi không biết mình dạy con sai ở đâu mà chồng luôn né tránh, nhường hết chuyện giáo dục con cho tôi? Hay do khoảng cách tuổi tác khiến anh không hiểu? Hay anh đã quá lớn tuổi để còn đủ kiên nhẫn nuôi dạy một đứa trẻ? Xin độc giả cho tôi lời khuyên. Thu Nga","Thứ ba, 19/8/2025, 09:08 (GMT+7)",Thu Nga,Tâm sự,,VN Express,
