id,title,link,content,date,author,category,sub_category,source,summary
VNEX_251025_00022,Arteta ám ảnh với 'bóng chết' từ 10 năm trước,https://vnexpress.net/arteta-am-anh-voi-bong-chet-tu-10-nam-truoc-4955542.html,"""Cách đây 10 năm tôi đã nói rằng bóng chết là thứ cực kỳ quan trọng. Tôi bắt đầu có một tầm nhìn, xây dựng phương pháp và tìm những người giỏi nhất để cùng thực hiện điều đó"", Arteta nói ngày 24/10 tại họp báo trước trận gặp Crystal Palace ở vòng 9 Ngoại hạng Anh. Artetagiải nghệ trong màu áo Arsenal sau mùa 2014-2015, và càng nhận ra tầm quan trọng của bóng chết khi học lấy bằng HLV. Ông cố gắng trau dồi và cải thiện ở lĩnh vực này từ khi làm trợ lý ở Man City hè 2016. ""Tôi sang Man City và được làm việc với HLV giỏi nhất thế giới là Pep Guardiola. Khi đó tôi nhận ra có thể cải thiện rất nhiều ở khâu này. Tôi không phải người giỏi nhất để làm việc đó, nên cần tìm ra người có phương pháp tốt hơn, và kết quả là mọi thứ đã thay đổi rõ rệt"", nhà cầm quân người Tây Ban Nha nói thêm. HLV Mikel Arteta chỉ đạo trong buổi tập của Arsenal ngày 24/10. Ảnh:Arsenal FC Arsenaltrở thành ""Vua bóng chết""nhờ công lớn của chuyên gia bóng chết Nicolas Jover - người được Arteta đưa về từ tháng 7/2021. Kể từ đầu mùa 2023-2024, Arsenal đã ghi 43 bàn từ các tình huống cố định ở Ngoại hạng Anh, nhiều hơn 10 bàn so với đội xếp thứ hai là Everton (33). Tính riêng mùa này, ""Pháo thủ"" ghi 10 bàn từ các tình huống cố định, không tính phạt đền, qua 12 trận trên mọi đấu trường. Dù khẳng định không xem các tình huống cố định là yếu tố tối quan trọng, Arteta nhấn mạnh rằng đó là một phần tất yếu trong cáchArsenaltìm cách phát triển và trở nên khó lường hơn. ""Đó là cách chúng tôi tiến hóa, giúp các cầu thủ có thêm công cụ để tạo khác biệt"", HLV 43 tuổi cho biết. ""Bóng chết không hơn, nhưng cũng không kém quan trọng so với các cách ghi bàn khác. Điều quan trọng là tận dụng được những cơ hội xuất hiện thường xuyên nhất"". Gabriel Magalhaeslà điểm đến quen thuộc từ những quả tạt vào vòng cấm, khi anh là trung vệ duy nhất góp dấu giày vào 20 bàn tại Ngoại hạng Anh (18 bàn và 2 kiến tạo), kể từ khi gia nhập Arsenal mùa 2020-2021. Tuy nhiên, trung vệ Brazil đang để ngỏ khả năng ra sân vì chấn thương nhẹ sau trậnthắng Atletico 4-0ở Champions League hồi giữa tuần. Arteta sau đó nói thêm về vũ khí cố định của Arsenal: ""Điều cốt lõi là tạo ra văn hóa, giúp cầu thủ hiểu tầm quan trọng của khía cạnh này trong trận đấu. Bóng đá luôn thay đổi, và chúng tôi phải không ngừng tìm cách khai thác tối đa những chi tiết nhỏ, vì chính những điều đó mang lại giá trị lớn nhất"". Gabriel Magalhaes mừng bàn ở cột cờ góc, trong trận Arsenal thắng Atletico 4-0 ở lượt ba Champions League trên sân Emirates, London, Anh ngày 21/10/2025. Ảnh:Arsenal FC Ngoài bài tấn công này, ""Pháo Thủ"" còn gây ấn tượng vớihàng thủ chắc chắn. Họ mới thủng lưới 3 bàn, giữ sạch lưới trong 5 trận gần nhất và được kỳ vọng có thể phá kỷ lục phòng ngự huyền thoại củaChelseamùa 2004-2005, khi đội bóng củaJose Mourinhochỉ để lọt lưới 15 bàn sau 38 vòng. Về điều này, Arteta tỏ ra thận trọng nhưng vẫn đầy tham vọng. Ông nói: ""Chúng tôi muốn có những kỷ lục như vậy, vì chúng luôn đi cùng với thành công. Cuối cùng, mục tiêu của chúng tôi vẫn là giành danh hiệu. Thành tích phòng ngự hiện tại rất tốt, nhưng mùa giải mới chỉ bắt đầu, chúng tôi cần duy trì sự ổn định và tiếp tục cải thiện"". Hồng Duy(theoDaily Mail, Arsenal.com)","Thứ bảy, 25/10/2025, 04:06 (GMT+7)",Hồng Duy,Thể thao,Ngoại hạng Anh,VN Express,
VNEX_251025_00003,"Đồng Nai chi gần 85 tỷ đồng mua xe công cho phường, xã",https://vnexpress.net/dong-nai-chi-gan-85-ty-dong-mua-xe-cong-cho-phuong-xa-4955529.html,"Trong nguồn kinh phí được UBND tỉnh Đồng Nai duyệt chi ngày 24/10, hơn 74 tỷ đồng sẽ được phân bổ cho 79 xã, phường mua ôtô phục vụ công tác chung; gần 11 tỷ đồng cho 11 xã, phường mua ôtô thay thế các xe thời hạn dùng trên 20 năm. Mỗi phường xã sẽ được cấp từ 900 đến 950 triệu đồng để mua ôtô Ngoài ra tỉnh cũng chi hơn 25 tỷ đồng cho 11 sở, ban, ngành mua ôtô còn thiếu so với tiêu chuẩn, định mức. Cán bộ ở Bình Phước cũ đi xe đưa đón đến làm việc ở phường Trấn Biên. Ảnh:Phước Tuấn Sau sáp nhập Bình Phước, tỉnh Đồng Nai diện tích hơn 12.700 km2, xếp thứ 9 cả nước, dân số hơn 4,5 triệu người, đứng thứ năm trong các tỉnh thành. Tỉnh có 95 xã, phường, trung tâm hành chính tại phường Trấn Biên (thuộc TP Biên Hòa cũ). Nhiệm kỳ tới, Đồng Nai đặt mục tiêu tốc độ tăng trưởng tổng sản phẩm trên địa bàn (GRDP) bình quân đạt 10%/năm. Đến năm 2030, GRDP (theo giá hiện hành) đạt trên 1.200.000 tỷ đồng; GRDP bình quân đầu người đạt trên 250 triệu đồng; thu ngân sách tăng 10-12% mỗi năm. Phước Tuấn","Thứ bảy, 25/10/2025, 00:00 (GMT+7)",Phước Tuấn,Thời sự,Giao thông,VN Express,
VNEX_251025_00079,Hai túi phình động mạch não gây mờ mắt,https://vnexpress.net/hai-tui-phinh-dong-mach-nao-gay-mo-mat-4955573.html,"Kết quả chụp MRI mạch não của chị Như cho thấy một túi phình ở động mạch cảnh trong trái, đường kính cổ túi khoảng 6 mm rộng 8 mm; túi phình còn lại ở bên phải kích thước nhỏ hơn. BS.CKI Dương Đình Hoàn, Trưởng Đơn vị Can thiệp Thần kinh, Trung tâm Chẩn đoán hình ảnh và Điện quang can thiệp, Bệnh viện Đa khoa Tâm Anh TP HCM, cho biết đây là vị trí mạch máu nằm sát dây thần kinh thị giác, nguy cơ vỡ cao và có thể dẫn tới xuất huyết dưới nhện, đột quỵ. Bác sĩ chỉ định can thiệp túi phình bên trái để tránh nguy cơ vỡ mạch, xuất huyết nghiêm trọng. Người bệnh được can thiệp mạch máu bằng cách đặt stent thay đổi dòng chảy. Bác sĩ Hoàn cho biết kỹ thuật này cho phép điều hướng dòng chảy trong lòng mạch, giảm áp lực lên túi phình và giúp thành mạch được tái cấu trúc tự nhiên thay vì phải phẫu thuật mở sọ như trước đây. Bác sĩ Hoàn (giữa) cùng êkíp đặt stent can thiệp mạch máu não cho chị Như. Ảnh:Bệnh viện Đa khoa Tâm Anh Bác sĩ luồn ống thông từ động mạch đùi phải lên não, đặt stent chuyển dòng qua vị trítúi phình động mạchcảnh trong trái. Sau hơn hai giờ can thiệp dưới sự hỗ trợ của hệ thống chụp mạch can thiệp số hóa xóa nền (DSA), stent được mở ra đúng vị trí, dòng máu não lưu thông ổn định. Túi phình còn lại ở bên phải, bác sĩ tư vấn theo dõi và kiểm tra định kỳ 6 tháng một lần để đánh giá tình trạng phát triển của túi phình. Hậu phẫu, người bệnh tỉnh táo, cử động tứ chi bình thường, phản xạ đồng tử hai bên tốt. Ba ngày sau can thiệp, sức khỏe chị Như ổn định, xuất viện. Sau can thiệp đặt stent chuyển dòng, người bệnh cần uống thuốc kháng kết tập tiểu cầu kép ít nhất ba tháng, tái khám định kỳ để đánh giá lưu thông trong stent và tình trạng túi phình. Trường hợp túi phình có dấu hiệu phát triển nhanh, thay đổi hình dạng, bác sĩ sẽ xem xét can thiệp sớm để phòng ngừa biến chứng. Theo bác sĩ Hoàn, túi phình mạch máu não là bệnh lý diễn tiến âm thầm, nhiều người không có triệu chứng cho đến khi vỡ, khiến tỷ lệ tử vong hoặc tàn phế cao. Những túi phình nhỏ dưới 5 mm, bác sĩ thường ưu tiên theo dõi bởi phẫu thuật hay can thiệp nội mạch đều tiềm ẩn rủi ro biến chứng. Để giảm nguy cơ tái hình thànhtúi phình, người bệnh cần duy trì lối sống lành mạnh, kiểm soát các yếu tố nguy cơ như tăng huyết áp, rối loạn mỡ máu, tiểu đường, không hút thuốc lá hay uống rượu bia. Khi có dấu hiệu đau đầu dai dẳng, nhìn mờ, tê yếu nửa người hoặc chóng mặt kéo dài, người bệnh nên đi khám để được kiểm tra. Phát hiện sớm và điều trị đúng thời điểm không chỉ giúp cứu sống người bệnh mà còn bảo toàn được chức năng thần kinh, thị giác và chất lượng sống lâu dài. Nhật Thành *Tên người bệnh đã được thay đổi","Thứ bảy, 25/10/2025, 08:00 (GMT+7)",Nhật Thành,Sức khỏe,Các bệnh,VN Express,
VNEX_251025_00024,Nike ra mắt đôi giày điện đầu tiên trong lịch sử,https://vnexpress.net/nike-ra-mat-doi-giay-dien-dau-tien-trong-lich-su-4955571.html,"Sau xe điện, đến lượt giày chạy bước vào kỷ nguyên điện hóa. Nike vừa công bố dự án Amplify, đôi giày điện đầu tiên trong lịch sử, được thiết kế không chỉ cho elite mà còn hướng tới người dùng trong cuộc sống thường ngày. Thiết kế giày điện mới của Nike trong dự án Amplify. Ảnh:Nike Sản phẩm dự kiến ra mắt đầu năm 2026. Đây là kết quả nghiên cứu nhiều năm tại Phòng thí nghiệm thể thao của Nike, nơi các nhà khoa học và kỹ sư phát triển thuật toán chuyển động cùng hệ thống cơ học tinh vi gồm động cơ siêu nhẹ, dây curoa truyền lực và pin sạc gắn trên cổ chân. Tất cả được tích hợp liền mạch với lớp vỏ sợi carbon của giày, có thể tháo rời để sử dụng như giày chạy thông thường. Theo mô tả, hệ thống này hoạt động như một exo-skeleton (bộ khung trợ lực), giúp runner giảm tải cho các nhóm cơ khi leo dốc hoặc chạy dài, nhờ đó có thể chạy thêm hơn 3 km so với bình thường. Nike cho biết nhóm người dùng mục tiêu là những VĐV nghiệp dư có pace 6-8, tức chạy 1 km trung bình từ 6 đến 8 phút, đối tượng dễ bị mỏi cơ hoặc chấn thương trong quá trình tập luyện dài. Michael Donaghu, Phó Chủ tịch mảng ""Create The Future"" của Nike, chia sẻ: ""Công việc của chúng tôi là mơ thật lớn, nhưng vẫn đặt VĐV ở trung tâm. Dự án Amplify bắt đầu từ một câu hỏi đơn giản: Nếu chúng ta có thể giúp họ chạy nhanh hơn, xa hơn mà tốn ít năng lượng hơn thì sao?"". Nike đã phát triển Dự án Amplify trong nhiều năm, trong ảnh là một số nguyên mẫu. Ảnh: Nike Để hoàn thiện mẫu đầu tiên, hơn 400 VĐV thử nghiệm đã thực hiện tổng cộng 2,4 triệu bước chạy, tương đương 12.000 vòng quanh đường đua 200 mét trong phòng thí nghiệm. Họ đã trải qua 9 phiên bản phần cứng khác nhau, mỗi lần tập trung tinh chỉnh một yếu tố riêng biệt, từ lực truyền đến khả năng phản hồi. Nike công bố giày Amplify cùng lúc với việc tái cấu trúc bộ máy sáng tạo, sáp nhập nhóm Nghiên cứu - Thiết kế - Sản phẩm của Nike, Jordan và Converse thành một đơn vị thống nhất gồm 1.000 nhà khoa học và kỹ sư. Theo hãng, đây là bước đi chiến lược nhằm ""đẩy nhanh tương lai của thể thao"". Nike công bố giày Nike Mind 001 và Mind 002 có khả năng giúp VĐV tăng khả năng tập trung trước và sau thi đấu. Ảnh:Nike Bên cạnh giày điện, Nike còn giới thiệu loạt công nghệ khác trong cùng chương trình nghiên cứu, trong đó códòng trang phục AeroFit, có khả năng lưu thông không khí gấp đôi mẫu cũ, giúp vận động viên duy trì hiệu suất trong điều kiện thời tiết khắc nghiệt. Dự kiến các đội bóng sẽ sử dụng trang phục này tại World Cup 2026. Áo khoác Therma Fit Air Milano, nhẹ và linh hoạt, cho phép người mặc điều chỉnh nhiệt độ cơ thể bằng cách bơm hoặc xả khí trong lớp áo, thay vì thay nhiều lớp quần áo.Giày Nike Mind 001 và Mind 002, thành quả của 10 năm nghiên cứu thần kinh học, được chứng minh có khả năng kích thích vùng cảm giác ở lòng bàn chân, giúp VĐV tăng khả năng tập trung trước và sau thi đấu. Nike công bố 4 sản phẩm mới trong dự án Amplify. Từ giày tự buộc dây từng xuất hiện trong Back to the Future II đến giày điện hoạt động bằng pin, Nike cho thấy họ đang biến những ý tưởng viễn tưởng thành hiện thực. Với dự án Amplify, hãng không chỉ mở ra một phân khúc mới trong thị trường thể thao mà còn đặt nền móng cho cuộc cách mạng về chuyển động con người - nơi công nghệ và cơ thể cùng hòa làm một. Hồng Duytổng hợp","Thứ bảy, 25/10/2025, 08:55 (GMT+7)",Hồng Duy,Thể thao,Marathon,VN Express,
VNEX_251025_00082,Mẹ chồng để tôi nằm trên nền gạch hôm động phòng,https://vnexpress.net/me-chong-de-toi-nam-tren-nen-gach-hom-dong-phong-4949839.html,"Tôi và anh quen rồi yêu nhau 3 năm mới tiến tới hôn nhân. Cứ nghĩ với tình yêu của hai đứa, thu nhập ổn định... cuộc đời sẽ màu hồng đối với tôi. Thế nhưng tôi lại đau đầu và buồn tủi vô cùng với mẹ chồng. Tôi quen anh khi hai đứa làm chung công ty. Thấy lương bấp bênh quá nên tôi tự kinh doanh từ tay trắng vì nhà tôi ở quê cũng rất nghèo. Thời gian đầu khó khăn nên nợ rất nhiều, sau hai năm tôi có mức lợi nhuận ổn định, tuy vẫn chưa trả được nợ. Công ty tôi càng phát triển thì nợ lại tăng lên do tôi làm ngành thương mại, chủ yếu là nợ anh chị em và đối tác bán hàng. Anh là kỹ thuật viên, lương đủ ăn. Anh làm nhiều năm, chưa tích cóp được gì. Tôi yêu vì anh hiền lành, thẳng thắn. Ngày đầu tiên anh dẫn tôi về ra mắt gia đình. Nhà anh chỉ có hai mẹ con, ba mất vài năm trước. Mẹ anh làm chủ hụi, sáng có bán đồ ăn sáng kiếm chút đỉnh ăn uống hàng ngày. Ấn tượng đầu tiên là tôi thấy mẹ anh hiền lành, phúc hậu. Tôi vui lắm vì biết sau này thế nào cũng sống chung với mẹ. Có mẹ chồng hiền lành cũng là cái phước. Tôi không làm đám hỏi vì không có nhiều tiền, cũng không muốn mẹ ruột phải vất vả nhiều. Tôi tự lo toàn bộ chi phí cưới cho nhà gái, mua sắm đồ dùng gia đình để chuẩn bị cho tổ ấm mới (chồng cũng để dành và góp vào chút đỉnh). Nói về nhà trai, ngày sắp cưới, tôi có về nhà anh chơi. Mẹ anh bảo đưa tiền cho bà chuẩn bị đám cưới. Tôi cảm thấy đau lòng vô cùng (tuy đã chuẩn bị ít tiền biếu bà). Đám cưới, hầu như tôi cũng tự bỏ tiền ra toàn bộ, từ chụp hình cưới, mua sắm nữ trang làm của hồi môn cho con dâu, tiền xe đưa đón dâu, mâm quả. Trước đó, anh gửi mẹ hơn 20 triệu đồng chơi hụi kiếm lời, do mẹ anh làm chủ hụi nên chắc chắn là không có chuyện giật hụi rồi. Vậy mà tới ngày cưới, mẹ cũng không đưa lại để anh phụ lo cưới cùng tôi. Tôi cảm thấy buồn tủi vô cùng. Lúc đó sắp cưới, tôi cũng lâng lâng niềm hạnh phúc mà quên đi sự buồn tủi đó. Ngày động phòng, tôi phải nằm trên nền gạch, mẹ chồng không mua được cái nệm, cái chăn mới, cặp gối mới cho tôi. Tôi không quen nằm dưới nền nhà nên không ngủ được. Chồng say nên ngủ chẳng biết gì. Mình tôi nằm khóc một mình trong đêm đầu tiên về nhà chồng. Tôi cũng là con gái nhà lành, ăn học đàng hoàng, xinh xắn, biết kiếm tiền, sao mẹ chồng đối xử tệ với tôi như vậy. Qua cưới, mẹ chồng nói đưa lại chiếc nhẫn để mẹ đi đám cưới cháu ruột, tôi càng sốc. Lúc cưới, mẹ chồng cho tôi và chồng mỗi người một chiếc nhẫn (vật đáng giá nhất mà mẹ chồng cho tôi). Ba mẹ đẻ tôi không thách cưới nhưng tôi sợ ba mẹ buồn vì của hồi môn của nhà chồng không bao nhiêu, vì thế tôi mua thêm gần hai cây vàng cho mẹ chồng và gia đình mình nở mày nở mặt. Vừa cưới xong, tôi đi bán hết nữ trang để buôn bán tiếp. Sau cưới một tuần, do suy nghĩ quá nhiều, lo chạy tiền bạc, kinh doanh lại rất vất vả, tôi bị đột quỵ phải cấp cứu. Bác sĩ bảo chuẩn bị 100 triệu đồng đồng gấp trong vòng 4 giờ, nếu không tôi sẽ bị liệt. Chồng gọi nhờ tất cả người thân gia đình gom tiền, mẹ chồng cũng lên nhưng cho tôi một triệu đồng. Nhờ trời thương, tôi hồi phục lại rất nhanh, đi đứng bình thường tuy người có yếu đi. Vừa xuất viện về nhà được 10 ngày, tôi lại biết mình có thai được hơn tháng. Tôi phải bỏ thai vì đã tiêm thuốc quá nhiều khi ốm. Sau đó, tôi lại tiếp tục làm việc mà không có thời gian nghỉ ngơi hồi phục sức khỏe. Tôi khuyên mấy tháng trời, cuối cùng anh cũng chịu nghỉ việc về phụ giúp tôi (công việc kinh doanh tôi tuy vất vả nhưng cũng có lãi khá cao, có thuê vài nhân viên). Mỗi tháng vợ chồng về nhà mẹ chồng một lần, ngủ lại một hai đêm nhưng tôi không cách nào ngủ được do không thể nằm đất. Chồng nói mẹ mua cho cái nệm. Mẹ mua xong về tính tiền lại với tôi. Vợ chồng tôi ăn sáng, đồ ăn mẹ bán có hơn 20 nghìn đồng mà mẹ cũng thu tiền. Lâu lâu chồng nhờ mẹ mua ít hải sản, cá khô gửi lên, khi về quê mẹ cũng thu tiền của chúng tôi. Thật sự tôi không biết mẹ chồng hiền quá hay do bà tính toán quá. Đến nay hơn một năm lấy chồng, tôi kinh doanh rất thuận lợi, có dư chút đỉnh, tuy vẫn chưa mua được tài sản nào lớn. Mỗi tháng tôi phụ gia đình hai bên chi tiêu đầy đủ, mua máy giặt, máy lạnh cho mẹ chồng, mua này mua kia cho mẹ ruột. Tôi cảm thấy hạnh phúc lắm. Đùng một cái, mẹ chồng gọi điện khóc, bảo bị giật nợ, số nợ thiếu hiện giờ gần 600 triệu đồng. Vợ chồng tôi chỉ biết khóc. Mẹ bảo giờ cho mẹ mượn vài chục triệu để xoay xở. Tôi chuyển ngay vài chục triệu đồng, thu xếp về quê với bà. Mẹ không có tài sản gì ngoài ngôi nhà đang ở, chồng tôi kêu bán trả nợ (trị giá nhà cũng tầm nhiêu đó nợ). Lúc đầu mẹ không đồng ý, cứ kêu vay ngân hàng trả từ từ. Tôi không chấp nhận vì vay ngân hàng xong thì chính vợ chồng tôi trả chứ bà đâu trả. Cuối cùng bà cũng chịu bán nhà. Tôi lên Sài Gòn vội chuyển về cho bà thêm vài chục triệu đồng trả bớt, rồi lại chuyển thêm hơn chục triệu đồng làm giấy tờ nhà cho bà. Lúc đó bà nói bán nhà xong lên ở với vợ chồng tôi, phụ nấu cơm nước. Tôi đang mang thai, công việc lại quá nhiều, không có thời gian nấu ăn. Giờ có người đồng ý mua nhà. Bà liền nói với tôi: ""Bán nhà xong, mẹ lên con ở, rồi đi làm lau dọn, nấu ăn theo giờ cho mấy nhà giàu kiếm tiền xài"". Tôi buồn vô cùng, ai nhìn vào sẽ nghĩ sau mà bắt mẹ chồng đi làm ôsin kiếm tiền, trong khi con cái ở nhà cao cửa rộng (tôi thuê nhà để kinh doanh và để ở, nhà khá to). Tôi không có khả năng trả hết nợ cho bà nhưng cũng hỗ trợ bà gần trăm triệu đồng. Tôi còn nói chồng mời bà lên ở để vợ chồng cùng chăm sóc. Tôi kinh doanh, mượn chị gái gần hết tiền bạc. Mẹ tôi cầm hết nhà cửa, ruộng đất, vay tiền cho tôi mượn. Nợ công lao nuôi dưỡng của mẹ, nợ anh chị tình nghĩa, tôi chưa trả được gì, chỉ hỗ trợ mẹ mỗi tháng vài triệu đồng tiêu xài. Tôi thấy có lỗi với gia đình mình vô cùng. Mẹ nuôi tới lớn, chưa cho mẹ được bao nhiêu mà chỉ lo cho mẹ chồng. Tự hỏi tôi có làm gì phật ý mẹ chồng, tôi đã hết lòng vì bà rồi giờ tôi biết làm gì hơn? Tôi rất giận vì câu nói đó, bà còn nói bóng gió: ""Con còn không thương mẹ thì ai mà thương"". Sau nhiều chuyện, tôi nghĩ không nên ở với mẹ chồng lúc này vì có quá nhiều chuyện xảy ra. Sự tôn kính của tôi đối với bà đã không còn như trước nữa. Tôi có đề cập với chồng là nói mẹ chồng về sống với em gái ruột của mẹ, nhà cách nhà mẹ chồng vài căn, rất rộng rãi, chỉ có anh ruột của mẹ, em gái ruột và cháu gái sắp lấy chồng. Mỗi tháng chúng tôi gửi tiền về cho mẹ tiêu xài, vài năm sau mẹ lên sống với vợ chồng tôi, bởi hiện tại thật sự tôi không còn cảm giác yêu thương mẹ chồng nữa. Tôi thấy mình cũng quá đáng nhưng phải có thời gian làm tôi quên đi sự tổn thương này. Vợ chồng tôi vì việc này mà lớn tiếng nhau. Xin nói thêm, chồng rất yêu tôi, anh cũng thương vì tôi không nhận được gì từ nhà chồng từ khi làm dâu. Mấy ngày nay tôi không ngủ được, cũng suy nghĩ, sau này sống chung chắc chắn sẽ có chuyện ""mẹ chồng nàng dâu"". Rồi hôn nhân tôi có bền vững khi ở trong hoàn cảnh này lâu dài? Tính tôi giận là tỏ ra mặt ngay. Trước giờ chỉ giận một lần lúc bà đòi làm ôsin nhà người ta, rồi nói: ""Con còn không thương mẹ thì ai thương"". Bà lên chơi cũng thấy tôi giận nên bỏ về sớm. Xin hãy cho tôi lời khuyên. Hồng Hạnh","Thứ bảy, 25/10/2025, 09:00 (GMT+7)",Hồng Hạnh,Tâm sự,,VN Express,
VNEX_251025_00011,Lễ mở ký Công ước Hà Nội diễn ra hôm nay,https://vnexpress.net/le-mo-ky-cong-uoc-ha-noi-dien-ra-hom-nay-4955421.html,"Lễ mở ký Công ước Liên Hợp Quốc (LHQ) về Chống tội phạm mạng tại Hà Nội với chủ đề ""Chống tội phạm mạng - Chia sẻ trách nhiệm - Hướng tới tương lai"" được tổ chức tại Trung tâm Hội nghị Quốc gia ngày 25-26/10. Sự kiện có sự tham dự của Tổng Thư ký Liên Hợp Quốc Antonio Guterres, đại diện gần 100 quốc gia và hơn 100 tổ chức quốc tế, khu vực. Ngoài phiên khai mạc, bế mạc, lễ mở ký sẽ có các phiên thảo luận toàn thể, phiên ký, phiên thảo luận cấp cao, phiên thảo luận bàn tròn cùng các sự kiện liên quan. Chủ tịch nước Lương Cường kiểm tra buổi tổng duyệt Lễ mở ký Công ước Hà Nội ngày 23/10. Ảnh:TTXVN Đây là lần đầu tiên một địa điểm của Việt Nam được gắn với hiệp ước đa phương toàn cầu trong lĩnh vực có tầm quan trọng quốc tế. Điều này phản ánh sự ghi nhận của cộng đồng quốc tế với quá trình đóng góp của Việt Nam khi xây dựng Công ước, theo Thứ trưởng Ngoại giao Đặng Hoàng Giang. Công ước gồm 9 chương, 71 điều, là kết quả của gần 5 năm thương lượng liên tục và kéo dài giữa các quốc gia thành viên, nhằm xây dựng một khuôn khổ pháp lý đa phương toàn diện để đấu tranh với tội phạm trên không gian mạng. Công ước có nhiều nội dung quan trọng như hình sự hóa các hành vi phạm tội qua mạng; cơ chế hợp tác quốc tế trong điều tra, dẫn độ, chia sẻ chứng cứ điện tử, tịch thu, xử lý tài sản phạm tội, bảo vệ nhân chứng, hỗ trợ nạn nhân. Ngọc Ánh","Thứ bảy, 25/10/2025, 00:00 (GMT+7)",Ngọc Ánh,Thế giới,Quân sự,VN Express,
