id,title,link,content,date,author,category,sub_category,source,summary
VNEX_261125_00063,5 thói quen hàng ngày tốt cho gan,https://vnexpress.net/5-thoi-quen-hang-ngay-tot-cho-gan-4985952.html,"Gan hoạt động liên tục để lọc độc tố ra khỏi máu, phân hủy các chất độc hại và chuyển hóa thuốc cũng như rượu. Gan cũng đóng vai trò quan trọng trong quá trình tiêu hóa bằng cách sản xuất mật, giúp phân hủy chất béo, hấp thụ chất dinh dưỡng. Tuy nhiên, một vài thói quen sinh hoạt thất thường có thể khiến sức khỏe gan giảm sút, phổ biến nhất là gan nhiễm mỡ. Gan nhiễm mỡlà tình trạng mỡ thừa tích tụ trong các tế bào gan (chiếm hơn 5% trọng lượng gan). Nguyên nhân do gan không thể phân hủy chất béo đúng cách, khiến mỡ tích tụ theo thời gian. Một số thay đổi trong chế độ và thói quen ăn uống có thể cải thiện sức khỏe gan, đẩy lùi bệnh mỡ gan. Ăn tối đúng giờ Các enzyme gan đạt đỉnh điểm vào lúc nửa đêm, do đó nên duy trì giấc ngủ liên tục từ 22h đến 2h. Đây là thời điểm gan tích cực giải độc và trong cơ thể diễn ra quá trình chuyển hóa lipid cao. Ăn tối 3 tiếng trước khi ngủ để gan được nghỉ ngơi và có khả năng tập trung vào quá trình giải độc. Ưu tiên hoàn thành bữa tối khoảng 18h hoặc 19h và dành 3 tiếng trước khi đi ngủ để thư giãn. Tránh rượu bia và thực phẩm chế biến sẵn Uống rượu bia và chất béo dẫn đến quá tải lipid, lượng độc tố và gây ra stress oxy hóa cho gan. Do đó, mỗi người nên tránh rượu bia và thực phẩm chế biến sẵn, đóng gói. Rượu bia còn làm tăng tốc độ tiến triển của xơ gan và tương tác với các yếu tố nguy cơ khác, bao gồmbéo phì,bệnh tiểu đường type 2vàviêm ganvirus. Bổ sung chất béo lành mạnh vào chế độ ăn uống Bổ sung dầu ôliu, bơ hạt cùng các loại hạt như hạt bí ngô, hạt lanh vào chế độ ăn uống hàng ngày cũng có lợi.Quả bơ, nho khô, chà là cũng chứa chất béo tốt, giúp loại bỏ độc tố dư thừa, thanh lọc thận đồng thời hỗ trợ quá trìnhgiải độc gantự nhiên. Uống cà phê nguyên chất Stress oxy hóa có thể tác động tiêu cực đến các tế bào gan, thúc đẩy tình trạng viêm và kháng insulin. Uống cà phê, nhất làcà phêđen không đường, có thể mang lại nhiều lợi ích cho gan. Điều này là do cà phê cung cấp các hợp chất cụ thể như axit chlorogenic và polyphenol, có tác dụng chống oxy hóa, chống viêm, điều hòa chức năng gan, tăng cường sức khỏe gan. Chúng cũng giảm tích tụ mỡ, đẩy lùi viêm, ngăn sự hình thành mô sẹo (xơ hóa) trong gan. Lượng caffeine an toàn nói chung là khoảng 400 mg (tương đương 3-4 tách) mỗi ngày, nhưng lượng này có thể thay đổi tùy theo khả năng dung nạp của mỗi người. Ăn thực phẩm nhiều màu sắc Các loại rau củ nhiều màu sắc như cải bó xôi, củ dền, cần tây, rau mùi, lá cà ri, tảo xoắn đều giàu hợp chất thực vật, có lợi cho gan. Các loại rau củ nhưcà rốtvàcủ dềncó khả năng tái tạo men gan, giảm tình trạng quá tải độc tố từ gan. Bảo Bảo(TheoMedical News Today, Times of India)","Thứ tư, 26/11/2025, 02:00 (GMT+7)",Bảo Bảo,Sức khỏe,Các bệnh,VN Express,"Gan đóng vai trò quan trọng trong việc lọc độc tố, tiêu hóa và chuyển hóa chất. Gan nhiễm mỡ xảy ra khi chất béo tích tụ quá nhiều trong gan do gan không thể phân hủy chất béo đúng cách. Để cải thiện sức khỏe gan, cần ăn tối đúng giờ, tránh rượu bia và thực phẩm chế biến sẵn, bổ sung chất béo lành mạnh, uống cà phê nguyên chất và ăn nhiều rau củ quả có màu sắc đa dạng. Những thay đổi này giúp gan giải độc hiệu quả hơn, giảm tích tụ mỡ và ngăn ngừa các bệnh về gan."
VNEX_261125_00076,'Nên quy định làn trái chỉ dùng để vượt',https://vnexpress.net/nen-quy-dinh-lan-trai-chi-dung-de-vuot-4986188.html,"Video:Minh Hiếu Xem tình huống trong video tôi vô cùng bức xúc khi thấy chiếc xe con ung dung gây cản trở giao thông bằng cách đi trên cao tốc mà bám lì làn trái với tốc độ rùa mà nhất quyết không nhường đường, dù phía trước trống trơn. Chiếc xe phía sau vừa bấm còi vừa nháy đèn xin vượt mà lái xe vẫn như không hay biết, thậm chí còn tỏ thái độ kiểu tôi đi đúng luật, thích thì chờ. Chính kiểu tư duy ích kỷ này biến cao tốc thành nơi ức chế, nguy hiểm và đầy xung đột. Theo luật, người điều khiển ôtô không nhường đường cho xe xin vượt khi đã đủ điều kiện an toàn bị phạt 2 - 3 triệu đồng và bị trừ 2 điểm trên giấy phép lái xe. Nếu hành vi không nhường đường dẫn đến tai nạn giao thông, tài xế bị phạt 20 - 22 triệu đồng và bị trừ 10 điểm trên giấy phép lái xe. Nhiều người cho rằng ""tôi đi đúng tốc độ tối đa, không có gì phải nhường"" theo tôi đây là hành vi ích kỷ. Dù đang đi tốc độ gần tối đa mà phía sau có xe cần vượt, lái xe vẫn nên chuyển sang làn phải để nhường đường, việc lái xe khác đi quá tốc độ hay phạm luật là việc của cơ quan chức năng. Việc của mình là đi đến nơi về đến chốn an toàn, tránh xung đột trên đường mất vui. Không nhường đường không chỉ là thiếu văn hóa giao thông mà còn là hành vi tiềm ẩn nguy cơ tai nạn: dồn xe phía sau, gây phanh gấp, khiến các xe khác phải chuyển làn bất ngờ. Nguy hiểm hơn cả là tạo tâm lý ức chế khiến nhiều người chọn giải pháp vượt phải vi phạm luật và cực kỳ rủi ro. Đặc biệt, tôi còn thấy nhiều người lại lên án những hành động nháy đèn xin vượt, bấm còi cảnh báo và thản nhiên bênh vực xe cản đường. Thực tế, nháy đèn xin vượt là tín hiệu cảnh báo hoàn toàn hợp pháp và văn minh trên cao tốc. Nếu ai đó cảm thấy bị xúc phạm khi người khác xin vượt, thì vấn đề nằm ở cái tôi và sự thiếu hiểu biết chứ không nằm ở tín hiệu. Thứ nhất, xử phạt nặng hơn hành vi cố tình chiếm làn trái. Phạt nặng vài lần, tôi tin thói quen này sẽ biến mất nhanh chóng. Thứ hai, áp dụng giống như các nước tiên tiến ""Làn trái chỉ dùng để vượt"". Thứ ba, định hướng lại tư duy giao thông không phải cuộc chiến sĩ diện. Nhường đường không khiến ai ""thấp bé"" hơn, mà thể hiện văn minh và tôn trọng mạng sống. Cao tốc được thiết kế để nhanh, thông suốt và an toàn. Nhưng chỉ cần một chiếc xe bám làn trái cố chấp, cả hệ thống trở nên tắc nghẽn và tiềm ẩn nhiều nguy cơ mất an toàn. Văn minh giao thông bắt đầu từ một hành động rất đơn giản là thấy xe phía sau cần vượt là nhường. Nhường không phải vì sợ, mà vì đó là luật và là đạo đức tối thiểu của người cầm lái. Độc giảVũ Vũ","Thứ tư, 26/11/2025, 10:31 (GMT+7)",Vũ Vũ,Xe,Diễn đàn,VN Express,"Bài viết lên án hành vi lái xe ích kỷ trên cao tốc, bám làn trái với tốc độ chậm, gây cản trở và nguy hiểm cho các xe khác. Tác giả nhấn mạnh việc nhường đường là văn minh, đúng luật, đồng thời chỉ ra những hệ lụy của việc không nhường đường. Để giải quyết tình trạng này, tác giả đề xuất tăng nặng xử phạt, áp dụng quy định ""Làn trái chỉ dùng để vượt"" và thay đổi tư duy giao thông."
VNEX_261125_00062,Trả giá đắt bởi chữa bệnh bằng AI,https://vnexpress.net/tra-gia-dat-boi-chua-benh-bang-ai-4964717.html,"Mai, 25 tuổi, ở TP HCM, có dấu hiệu căng thẳng, lo âu kéo dài từ sau khi mất việc nhưng thay vì tìm gặp chuyên gia tâm lý, cô sử dụng ChatGPT để trò chuyện, chia sẻ nỗi buồn. Ban đầu, Mai cảm thấy dễ chịu vì AI luôn lắng nghe và đưa ra những câu trả lời khuôn mẫu như ""Bạn không đơn độc"" hay ""Hãy thử tập thể dục"", ""Tình trạng không nghiêm trọng, bạn sẽ ổn thôi"" khiến Mai tin rằng bản thân không có bệnh. Tuy nhiên, sau 6 tháng, triệu chứng của Mai trở nặng: mất ngủ, suy nghĩ tiêu cực, thậm chí có ý định tự hại bản thân. Khi gia đình phát hiện và đưa đi khám, bác sĩ chẩn đoán cô bịrối loạn lo âu, có dấu hiệutrầm cảm, cần can thiệp bằng thuốc và trị liệu tâm lý. Trường hợp khác, người đàn ông 38 tuổi, ở Hà Nội, bị rối loạn cương dương, được bác sĩ Bệnh viện Nam học và hiếm muộn Việt - Bỉ kê thuốc, song hỏi ChatGPT thấy ghi thuốc gây biến chứng giác mạc nên không dùng. Khi anh quay lại bệnh viện, tình trạng đã ở mức độ nghiêm trọng, cần điều trị lâu dài và tốn kém hơn nhiều so với ban đầu. Giao diện hỏi đáp của ChatGPT trên ứng dụng cho Android. Ảnh:Bảo Lâm Bệnh viện Gia An 115 (TP HCM) từng tiếp nhận nữ bệnh nhân 42 tuổi, mắc đái tháo đường, tự ý bỏ thuốc theo ""AI y tế"", vài tuần sau đường huyết tăng vọt, suýt hôn mê. Một bệnh nhân 38 tuổi khác, bị rối loạn lipid máu, cũng dừng thuốc statin, chuyển sang thảo dược theo tư vấn của AI, hậu quả là bị hẹp động mạch vành. Sự bùng nổ của các ứng dụng AI tạo sinh (GenAI) đang định hình lại thói quen chăm sóc sức khỏe toàn cầu. Theo OpenAI, hơn 200 triệu người sử dụng ChatGPT mỗi tuần. Tại Việt Nam, báo cáo của Sensor Tower cho thấy chỉ trong nửa đầu năm 2025, người dùng đã dành tới 283 triệu giờ với 7,5 tỷ phiên truy cập vào các ứng dụng này. Tuy nhiên, sự phụ thuộc vào ""bác sĩ ảo"" đang tạo ra một cuộc khủng hoảng ngầm trong y tế. Cốt lõi của vấn đề nằm ở sự ngộ nhận về độ chính xác. Một nghiên cứu đăng trên tạp chí khoa họcPLOS ONEchỉ ra rằng độ chính xác trong chẩn đoán y khoa của ChatGPT chỉ đạt 49% - một tỷ lệ rủi ro quá lớn đối với tính mạng con người. Tiến sĩ Artie Shen từ Đại học New York giải thích, AI chỉ tổng hợp thông tin dựa trên xác suất từ ngữ mà không có nền tảng lý luận thực tiễn, khiến người dùng nhận được chẩn đoán nhưng không hiểu bản chất vấn đề. Bác sĩ Trương Hữu Khanh, Phó chủ tịch Liên chi hội Truyền nhiễm TP HCM, đánh giá ChatGPT là sản phẩm thông minh, hữu ích, có thể hỗ trợ y bác sĩ trong tìm kiếm thông tin thường thức đơn giản như một nguồn tham khảo, nhưng không thể thay thế thầy thuốc trong khám, điều trị. Ví dụ, bệnh nhân có dấu hiệu sốt, ho, nôn, hay vàng da phải được bác sĩ thăm khám, chẩn đoán chứ ChatGPT không thể tự khám và đưa ra kết luận. Chưa kể, nhiều bệnh có triệu chứng khác nhau, chuyển biến nhanh từ dấu hiệu đơn giản mà chỉ bác sĩ mới phát hiện và xử trí kịp thời bằng sự nhạy cảm lâm sàng và kiến thức chuyên môn. ""Hai bác sĩ khám cho một bệnh nhân còn có thể đưa ra kết luận khác biệt, có thời gian thì khám kỹ và ra nhiều triệu chứng hơn, điều trị trúng đích hơn"", ông Khanh nói. Ngoài ra, một trong những yếu tố cốt lõi của y khoa mà AI không thể thay thế là sự đồng cảm. Bác sĩ Khanh lấy ví dụ bệnh nhânung thưgiai đoạn cuối cần sự chăm sóc giảm nhẹ và đồng hành tâm lý. Trong tình huống như vậy, sự thấu hiểu và lòng nhân ái của người thầy thuốc đóng vai trò vô cùng quan trọng, giúp bệnh nhân có được những ngày cuối đời bình yên. Đây là điều mà một cỗ máy vô tri không bao giờ làm được. Đồng quan điểm, thạc sĩ tâm lý lâm sàng Vương Nguyễn Toàn Thiện, Giám đốc chuyên môn Trung tâm Lumos cho rằng AI thông minh nhưng không có cảm xúc thật sự. Dựa trên dữ liệu lập trình, AI chỉ phản hồi ở mức cơ bản, phù hợp với các kịch bản định sẵn, nhưng không thể mô phỏng mối quan hệ liên cá nhân. Chuyên gia cũng chỉ ra rằng, AI có thể dựa trên các bài kiểm tra lâm sàng để đưa đánh giá, nhưng không thể cảm nhận và thấu hiểu những khổ đau sâu kín của người dùng. Điều này đặc biệt nguy hiểm với những người mắc rối loạn lo âu, trầm cảm nặng hoặc trải qua tổn thương tâm lý, vì AI không đủ khả năng xử lý vấn đề phức tạp. Một nguy cơ lớn khác là sự phụ thuộc ngày càng tăng vào AI. Người dùng có thể trì hoãn việc tìm kiếm trợ giúp từ bác sĩ hoặc chuyên gia. Điều này dẫn đến những rủi ro như bỏ lỡ chẩn đoán quan trọng, khiến bệnh tình chuyển nặng, và trong nhiều trường hợp, khó điều trị hơn. Các bác sĩ khuyến cáo người bệnh chỉ nên coi AI là công cụ hỗ trợ tra cứu thông tin thường thức hoặc sắp xếp hồ sơ, tuyệt đối không dùng để tự kê đơn hay tự ý ngưng phác đồ điều trị. Khi có dấu hiệu bất thường, hãy đến cơ sở y tế chuyên khoa, bởi sự tiện lợi của công nghệ không bao giờ đáng giá bằng sự an toàn của tính mạng. ""Y học là khoa học của sự cá thể hóa và lòng trắc ẩn, nơi trách nhiệm y đức của bác sĩ đóng vai trò quyết định mà máy móc không thể sao chép"", chuyên gia nói. Mỹ Ý","Thứ tư, 26/11/2025, 05:00 (GMT+7)",Mỹ Ý,Sức khỏe,Tin tức,VN Express,
VNEX_261125_00088,Thanh tra Hải Phòng: Nhiều người mua nhà ở xã hội kê khai không trung thực,https://vnexpress.net/thanh-tra-hai-phong-nhieu-nguoi-mua-nha-o-xa-hoi-ke-khai-khong-trung-thuc-4986152.html,"Nội dung này nêu tại kết luận thanh tra về phát triển, quản lý nhà ở xã hội (NOXH) tại Hải Phòng. Theo đó, thanh tra thành phố phát hiện một số sai phạm tại các dự án 384 Lê Thánh Tông, 39 Lương Khánh Thiện, Tổng kho 3 Lạc Viên (142 Lê Lai) và chung cư cho người thu nhập thấp tại khu dân cư An Đồng, quận An Dương cũ (nay là phường An Hải). Cụ thể, kiểm tra xác suất 155 hồ sơ mua nhà các dự án trên, thanh tra phát hiện ở dự án 384 Lê Thánh Tông có 7 hồ sơ kê khai không đúng. Tại dự án 39 Lương Khánh Thiện, Tổng kho 3 Lạc Viên (142 Lê Lai) và khu chung cư cho người thu nhập thấp tại An Đồng, mỗi nơi có một hồ sơ. Các hồ sơ kê khai sai nơi làm việc và thu nhập không đúng thực tế (cao hơn so với khai trong hồ sơ). Nhiều hồ sơ được xác nhận chỗ ở và thu nhập của một doanh nghiệp môi giới bất động sản. Dự án nhà ở xã hội 384 Lê Thánh Tông. Ảnh:Lê Tân Thanh tra Thanh phố Hải Phòng yêu cầu 14 người mua có hồ sơ kê khai không trung thực phối hợp với chủ đầu tư thanh lý hợp đồng, bàn giao lại nhà. 25 trường hợp khác cũng được yêu cầu rà soát lại hồ sơ mua nhà. Trường hợp sau rà soát xác định không đủ điều kiện hưởng chính sách nhà ở xã hội, người mua và chủ đầu tư phải thanh lý hợp đồng mua bán theo quy định. Ngoài xử lý hồ sơ sai phạm, Thanh tra TP Hải Phòng yêu cầu các dự án phải công khai số căn hộ đã bán, chưa bán, giá bán - thuê trên cổng thông tin của Sở Xây dựng và các phương tiện truyền thông. Hải Phòng hiện là một trong những địa phương đi đầu cả nước về phát triển nhà ở xã hội. Tính tới hết năm nay, thành phố sẽ hoàn thành khoảng 17.291 căn, vượt 736 căn so với chỉ tiêu Chính phủ giao. Lê Tân","Thứ tư, 26/11/2025, 09:50 (GMT+7)",Lê Tân,Bất động sản,,VN Express,
VNEX_261125_00060,Cúm A thổi bùng biến chứng hô hấp ở người bệnh ung thư,https://vnexpress.net/cum-a-thoi-bung-bien-chung-ho-hap-o-nguoi-benh-ung-thu-4985741.html,"Bà Sáp sốt, ho hai ngày trước khi nhập viện. Bác sĩ Đàm Thị Thanh Tâm, khoa Nội Tổng hợp, Bệnh viện Đa khoa Tâm Anh Hà Nội, cho biết chỉ số SpO2 của bà 89-90% (bình thường hơn 95%), nhịp thở tăng lên 22 lần mỗi phút, có tiếng ran nổ ở đáy phổi phải là dấu hiệu thường gặp khi viêm phổi, nước mũi đặc vàng. Người bệnh dương tính cúm A, biến chứng viêm phổi gây suy hô hấp. Bà Sáp bị ung thư vú 7 năm, đang hóa trị duy trì. Bác sĩ Tâm cho rằng bà Sáp điều trị bằng hóa chất kéo dài khiến hệ miễn dịch ảnh hưởng, số lượng bạch cầu giảm, khả năng chống chọi với các tác nhân gây bệnh giảm. Khi nhiễm cúm A, tình trạng suy giảm miễn dịch khiến bệnh chuyển nặng chỉ sau một ngày. Bác sĩ chỉ định bà Sáp điều trị bằng thuốc kháng virus cúm, kháng sinh đường tĩnh mạch để kiểm soát nguy cơ bội nhiễm vi khuẩn, thở oxy kính mũi 2 lít/phút nhằm cải thiện oxy máu đồng thời bù nước và điện giải. Sau khoảng 48 giờ điều trị, người bệnh giảm sốt, đỡ mệt, chỉ số SpO2 trở về mức an toàn, tự thở được. Các triệu chứng nghẹt mũi,ho nhiềuvà nôn giảm rõ rệt, bà xuất viện sau 5 ngày. Bác sĩ Tâm dặn dò bà Sáp lịch tái khám trước khi xuất viện. Ảnh:Bệnh viện Đa khoa Tâm Anh Virus cúm A biến đổi kháng nguyên bề mặt liên tục, khả năng lây lan mạnh, đặc biệt trong mùa lạnh ẩm, theo bác sĩ Tâm. Dùng thuốc kháng virus trong 48 giờ đầu giúp giảm triệu chứng, nguy cơ biến chứng. Ba tháng gần đây, cả nước ghi nhận 8.500-11.000 ca cúm mùa mỗi tháng, tăng đột biến so với giữa năm, Bộ Y tế cảnh báo dịch bùng phát. Theo thống kê tại Bệnh viện Đa khoa Tâm Anh Hà Nội, tính từ tháng 10 đến nay khoa Nội tổng hợp tiếp nhận số ca nội trú điều trị cúm A bằng một nửa số ca của cả năm (riêng trong tuần gần đây có 40 ca cúm A nhập viện mới). ""Cúm Akhông phải là bệnh nhẹ ở người trưởng thành, đặc biệt là những người có bệnh nền và hệ miễn dịch suy giảm"", bác sĩ Tâm nói, đồng thời khuyến cáo tăng cường vệ sinh phòng bệnh, đeo khẩu trang nơi đông người, khám ngay khi sốt cao, ho nhiều, đau mỏi hoặc khó thở. Thanh Ba","Thứ tư, 26/11/2025, 08:00 (GMT+7)",Thanh Ba,Sức khỏe,Các bệnh,VN Express,
