id,title,link,content,date,author,category,sub_category,source,summary
VNEX_241025_00014,Sabalenka dùng bikini đáp trả chỉ trích,https://vnexpress.net/sabalenka-dung-bikini-dap-tra-chi-trich-4955076.html,"Sabalenka tại khu nghỉ dưỡng 5 sao Atlantis The Royal, ở Dubai, UAE tuần này. Ảnh:Sun Sau khi vô địch Mỹ Mở rộng rồi dừng bước ở bán kết Vũ Hán Mở rộng,Sabalenkađến Dubai để thư giãn cùng bạn thân và cũng là đồng nghiệp Paula Badosa. Cô nghỉ ngơi trước khi bước vào giải đấu cuối mùa WTA Finals tại Riyadh, Arab Saudi khởi tranh 1/11. Trong chuyến đi, Sabalenka đăng tải một loạt ảnh gợi cảm với áo tắm, tại khu nghỉ dưỡng 5 sao Atlantis The Royal.The Suncho rằng đây là động thái để đáp trả những bình luận của Kostyuk về sự ""nam tính"" của cô. Kostyuk, đang xếp thứ 27 thế giới, cho rằng việc phải đối đầu với Sabalenka hoặc Iga Swiatek là không công bằng. Tay vợt 23 tuổi đã thua cả 7 lần gặp họ, trong đó có bốn lần trước Sabalenka. Kostyuk cho rằng lý do thất bại nằm ở thể chất vượt trội của bộ đôi kể trên. ""Chúng ta ai cũng có cấu trúc sinh học riêng"", Kostyuk nói vớiTennis365khi dự giải Vũ Hán Mở rộng hồi đầu tháng. ""Một số người có mức testosterone cao hơn. Đó là điều tự nhiên, và rõ ràng điều đó mang lại lợi thế. Tôi cảm thấy mình nhỏ bé hơn họ. Tôi cố gắng tìm cách đánh bại họ bằng những kỹ năng tennis mà tôi có, nhưng tôi phải nỗ lực và di chuyển nhiều hơn họ để thắng từng điểm"". Kostyuk (trái) rời sân sau khi thua Sabalenka 2-6, 3-6 tại vòng một Roland Garros 2023. Ảnh:AP Thực tế, Kostyuk kémSwiatekmột tuổi nhưng có cùng chiều cao 1,75 m, trong khi Sabalenka 27 tuổi cao 1,8 m. Kostyuk chỉ nặng 60 kg, kém Swiatek 10 kg và kém Sabalenka 20kg, nhưng di chuyển không vượt trội hai đối thủ top 2 thế giới. Trong top 6 bảng điểm WTA, Jessica Pegula chỉ cao 1,7 m còn Jasmine Paolini 1,63 m vẫn cạnh tranh sòng phẳng với Sabalenka và Swiatek. ""Tôi có kỹ năng riêng, nhưng cuối cùng thì họ đều to lớn hơn tôi, cao hơn tôi, mạnh hơn tôi"", Kostyuk nói thêm. ""Tôi không thể tự khiến mình nặng hơn 10 kg hay cao thêm 5 cm, vì vậy tôi phải tận dụng mọi thứ tôi có. Khi nhìn lại những bức ảnh lúc bắt tay ở lưới, tôi trông nhỏ bé hơn rất nhiều so với họ. Có rất nhiều điều tôi có thể làm để trở nên giỏi hơn, nhưng họ vẫn có lợi thế so với tôi"". Trái với sự mạnh mẽ trên sân đấu, qua loạt ảnh chụp tại Dubai mới đăng tải, Sabalenka xuất hiện quyến rũ trong những bộ bikini. Cô dần thay đổi hình ảnh sau biến cố vào năm 2024, khi bạn trai cũ Konstantin Koltsov qua đời ở tuổi 42 trong một trường hợp được xác định là tự tử. Sau đó, cô hẹn hò với Georgios Frangulis, doanh nhân người Brazil gốc Hy Lạp. Loạt ảnh bikini của Sabalenka trên mạng xã hội, khi cô nghỉ dưỡng tại Dubai, UAE tuần này. Ảnh:Sun Năm 2025, sự nghiệp của Sabalenka cũng thăng tiến mạnh với bốn danh hiệu, trong đó có chức vô địch Mỹ Mở rộng. Tay vợt số một thế giới cũng vào chung kết một Grand Slam khác là Roland Garros. Trong sự nghiệp, Sabalenka đã giành 21 chức vô địch, kiếm được hơn 42 triệu USD tiền thưởng. Vy Anh","Thứ sáu, 24/10/2025, 03:43 (GMT+7)",Vy Anh,Thể thao,Tennis,VN Express,
VNEX_241025_00068,"Ford triệu hồi gần 1,5 triệu xe, hơn doanh số cả năm của hãng khác",https://vnexpress.net/ford-trieu-hoi-gan-1-5-trieu-xe-hon-doanh-so-ca-nam-cua-hang-khac-4954692.html,"Số lượng 1.448.655 xeFordtại Mỹ bị triệu hồi do camera chiếu hậu có thể ngừng hoạt động. Chiến dịch áp dụng cho một loạt mẫu xe mang logo Ford và Lincoln, được sản xuất trong thời gian 2014-2020. Số xe mà Ford triệu hồi đợt này lớn hơn doanh số củaHondavà thương hiệu con là Acura tại Mỹ trong năm 2024, lần lượt là 1.291.490 và 132.367 xe, với tổng doanh số 1.423.857 xe. Con số này thậm chí còn vượt qua tất cảMazdaMX-5 bán ra trên toàn cầu kể từ năm 1989, với hơn 1,2 triệu xe. Các mẫu Ford trong diện triệu hồi gồm Fiesta, C-Max, Taurus, Flex, Fusion,Explorer, Mustang và Escape, trong khi về phía Lincoln là MKZ và MKT. Ford Explorer 2023 nằm trong diện triệu hồi. Ảnh:Otogo Vấn đề chính xác dẫn đến việc triệu hồi là đường truyền hình ảnh bị lỗi có thể khiến video trên màn hình điều khiển bị méo, gián đoạn hoặc chỉ đơn giản là trống trơn khi tài xế đang cố gắng tránh va vào thùng rác tái chế, xe SUV của hàng xóm và góc cửa nhà để xe. Việc triệu hồi xe do camera lùi đã trở thành một phần không thể thiếu trong bối cảnh ôtô những năm 2020, và nhiều hơn cả lỗi do hệ thống thông tin giải trí. Điều đó có nghĩa việc sửa lỗi không đơn giản. Mỗi chiếc trong số gần 1,5 triệu xe sẽ cần phải đến đại lý địa phương để kiểm tra camera và rất có thể sẽ được thay thế. Ford cho biết camera mới được lắp đặt thay thế được chế tạo theo ""quy trình cập nhật với khả năng kiểm soát chất lượng cao hơn"". Chỉ tính riêng năm nay, Ford đã ban hành 126 lệnh triệu hồi, từ nguy cơ cháy nổ đến hệ thống lái. Hãng Mỹ vốn lànhà vô địch về triệu hồi xe vào 2023vàá quân năm 2024. Tính đến tháng 7 vừa qua, Ford đã phá vỡ kỷ lục của chính mình về số lần triệu hồi nhiều nhất trong một năm, và đến đợt mới nhất này là 126 lần. Cả năm 2024, hãng chỉ có 63 đợt triệu hồi. Mỹ Anh(theoCarscoops)","Thứ sáu, 24/10/2025, 06:00 (GMT+7)",Mỹ Anh,Xe,Thị trường,VN Express,
VNEX_241025_00058,Tắm nắng buổi sáng tốt cho giấc ngủ,https://vnexpress.net/tam-nang-buoi-sang-tot-cho-giac-ngu-4954696.html,"Ánh sáng là tín hiệu quan trọng với chu kỳ giấc ngủ. Cơ thể cảm nhận được khi nào là ban ngày và khi nào là ban đêm bằng cách tiếp xúc với ánh sáng. Đồng hồ sinh học của cơ thể là chu kỳ 24 giờ, nhạy cảm nhất với ánh sáng vào ba thời điểm, gồm khoảng một giờ sau khi thức dậy vào buổi sáng, khoảng hai giờ trước khi đi ngủ và ban đêm. Tiếp xúc với ánh sáng mạnh vào buổi sáng giúp bạn cảm thấy tỉnh táo hơn vào ban ngày và hỗ trợ vào giấc nhanh hơn, dễ buồn ngủ buổi tối. Tuy nhiên, nếu tiếp xúc với ánh sáng mạnh trong vòng hai giờ trước khi đi ngủ có thể dẫn đến mất ngủ, trằn trọc suốt đêm. Ánh sáng mặt trời buổi sáng ảnh hưởng đến giấc ngủ theo nhiều cách. Khi ở dưới ánh nắng mặt trời, cơ thể sẽ ấm lên. Đến thời điểm hết tiếp xúc với ánh nắng, nhiệt độ cơ thể có xu hướng giảm, giúp tăng cảm giác buồn ngủ. Ánh sáng mặt trời hỗ trợ cơ thể tạo ra một chất hóa học trong não gọi là serotonin, chất này có vai trò quan trọng đối với sức khỏe nói chung và não bộ nói riêng. Tiếp xúc với ánh sáng vào buổi sáng có lợi cho một số người bịrối loạn giấc ngủnhư hội chứng ngủ muộn gây ngủ muộn và thức dậy muộn, mất ngủ, ngủ không đủ giấc. Đi bộ buổi sáng giúp tiếp xúc với ánh nắng mặt trời.Ảnh được tạo bởi AI Để sử dụng liệu pháp ánh nắng buổi sáng hiệu quả, người mất ngủ nên tiếp xúc với nó ngay khi thức dậy. Cố gắng ra ngoài trong giờ đầu tiên hoặc giờ thứ hai sau khi thức dậy để điều chỉnh nhịp sinh học. Dành 30-45 phút dưới ánh nắng trực tiếp, không đeo tấm che nắng hoặc kính râm vì làm giảm tác dụng, có thể sử dụng kem chống nắng để bảo vệ làn da. Thời gian lý tưởng để tắm nắng là khoảng 5h-8h. Bởi ánh nắng mặt trời dịu nhẹ hơn vào buổi sáng, không gay gắt như buổi chiều. Người mất ngủ nên đi bộ vào buổi sáng sớm để vừa tiếp xúc ánh nắng vừa rèn luyện sức khỏe. Bạn cũng có thể ăn sáng hoặc uống cà phê ở khu vực có ánh nắng chiếu vào. Thức dậy cùng một giờ mỗi ngày và đón ánh nắng buổi sáng là một sự kết hợp tốt. Để cải thiện chất lượng giấc ngủ, mỗi người nên duy trì thói quen sống lành mạnh, hạn chế tiếp xúc với ánh sáng xanh vào buổi tối, nhất là khung 1-2 giờ trước khi ngủ. Không ăn quá no vào buổi tối, hạn chế thực phẩm chiên rán, tinh bột để tránhảnh hưởng đến đường huyết. Sau 16h, không nên ăn uống thực phẩm chứa caffein. Chuẩn bị phòng ngủ sạch sẽ, gọn gàng, đủ tối và nhiệt độ vừa phải, có thể sử dụng tinh dầu và máy tạo hơi nước giúp thư giãn, dễ chịu. Anh Chi(TheoVery Well Health)","Thứ sáu, 24/10/2025, 10:00 (GMT+7)",Anh Chi,Sức khỏe,Các bệnh,VN Express,
VNEX_241025_00090,Chế biến bánh mì nặng gần 7 kg cho hàng chục người ăn,https://vnexpress.net/che-bien-banh-mi-nang-gan-7-kg-cho-hang-chuc-nguoi-an-4955007.html,"Ngày 23/10, tại một khách sạn ở phường Tân Sơn Nhất, quận Tân Bình cũ, các đầu bếp giới thiệu những ổ bánh mì khổng lồ, nặng trung bình 3-7 kg. Bánh tạo hình cá sấu, chép và nhân làm từ các loại cá. Ngày 23/10, tại một khách sạn ở phường Tân Sơn Nhất, quận Tân Bình cũ, các đầu bếp giới thiệu những ổ bánh mì khổng lồ, nặng trung bình 3-7 kg. Bánh tạo hình cá sấu, chép và nhân làm từ các loại cá. Chiếc bánh mì pate cá ngừ đại dương của đầu bếp Bùi Hoài Thanh (bìa phải) dài một mét, nặng gần 7 kg. Bánh phải có hai người cùng mở vỏ để không bị hỏng. Chiếc bánh mì pate cá ngừ đại dương của đầu bếp Bùi Hoài Thanh (bìa phải) dài một mét, nặng gần 7 kg. Bánh phải có hai người cùng mở vỏ để không bị hỏng. Theo đầu bếp, người có 34 năm gắn bó với nghề, đây là lần đầu tiên anh thực hiện chiếc bánh khổng lồ, theo công thức của bánh mì cá Phan Thiết. Theo đầu bếp, người có 34 năm gắn bó với nghề, đây là lần đầu tiên anh thực hiện chiếc bánh khổng lồ, theo công thức của bánh mì cá Phan Thiết. Phần nhân chế biến công phu. Cá ngừ đại dương loại 50 kg được chọn để làm pate, cá nục xốt cà chua nấu nhừ rải đều trong ruột bánh cùng rau. Phần nhân chế biến công phu. Cá ngừ đại dương loại 50 kg được chọn để làm pate, cá nục xốt cà chua nấu nhừ rải đều trong ruột bánh cùng rau. Những con cá nục xếp lớp được ướp gia vị vừa ăn, xốt cà chua, rải thêm lớp rau ngò rí, hành lá, ớt, cà rốt thái sợi lên trên. Theo đầu bếp, nhân chính làm từ 20 kg cá nục hầm với cà chua trong 5 tiếng. ""Nhờ vậy mà món ăn thấm đều gia vị và rất mềm"", anh Bùi Hoài Thanh nói. Những con cá nục xếp lớp được ướp gia vị vừa ăn, xốt cà chua, rải thêm lớp rau ngò rí, hành lá, ớt, cà rốt thái sợi lên trên. Theo đầu bếp, nhân chính làm từ 20 kg cá nục hầm với cà chua trong 5 tiếng. ""Nhờ vậy mà món ăn thấm đều gia vị và rất mềm"", anh Bùi Hoài Thanh nói. Cạnh đó là chiếc bánh mì xíu mại cũng có kích thước và khối lượng tương đương, khẩu phần cho hàng chục người ăn. Cạnh đó là chiếc bánh mì xíu mại cũng có kích thước và khối lượng tương đương, khẩu phần cho hàng chục người ăn. Đầu bếp mất 5 tiếng để làm xong các loại nhân cho bánh mì. Trong đó phần xíu mại chế biến từ cá thu sốt cà chua, nấu trong một tiếng. ""Dù có kích thước lớn nhưng món ăn vẫn giữ hương vị thơm ngon đặc trưng nhờ chuẩn bị trong thời gian ngắn trước khi trình diễn"", anh Thanh cho biết. Đầu bếp mất 5 tiếng để làm xong các loại nhân cho bánh mì. Trong đó phần xíu mại chế biến từ cá thu sốt cà chua, nấu trong một tiếng. ""Dù có kích thước lớn nhưng món ăn vẫn giữ hương vị thơm ngon đặc trưng nhờ chuẩn bị trong thời gian ngắn trước khi trình diễn"", anh Thanh cho biết. Sự kiện còn trưng bày bánh mì không nhân, tạo hình cá chép, cá sấu với kích thước dài một mét. Đầu bếp Thanh cho biết, mong muốn qua lần quảng diễn để giới thiệu sự phong phú của bánh mì Việt Nam, tôn vinh nguyên liệu cá - nguồn thực phẩm quen thuộc, giàu dinh dưỡng và gắn liền với đời sống ngư dân. Sự kiện còn trưng bày bánh mì không nhân, tạo hình cá chép, cá sấu với kích thước dài một mét. Đầu bếp Thanh cho biết, mong muốn qua lần quảng diễn để giới thiệu sự phong phú của bánh mì Việt Nam, tôn vinh nguyên liệu cá - nguồn thực phẩm quen thuộc, giàu dinh dưỡng và gắn liền với đời sống ngư dân. Nghệ nhân Hồ Đắc Thiếu Anh đánh giá, ngoài những loại bánh mì truyền thống sự kết hợp nhiều loại nhân làm từ cá thể hiện tinh thần sáng tạo của người Việt trong ẩm thực và tận dụng nguồn nguyên liệu biển phong phú của Việt Nam. Nghệ nhân Hồ Đắc Thiếu Anh đánh giá, ngoài những loại bánh mì truyền thống sự kết hợp nhiều loại nhân làm từ cá thể hiện tinh thần sáng tạo của người Việt trong ẩm thực và tận dụng nguồn nguyên liệu biển phong phú của Việt Nam. Bên cạnh bánh mì, 100 món ăn khác làm từ cá được trưng bày, thu hút nhiều du khách, đầu bếp tham quan. Bên cạnh bánh mì, 100 món ăn khác làm từ cá được trưng bày, thu hút nhiều du khách, đầu bếp tham quan. Quỳnh Trần - Anh Tuấn","Thứ sáu, 24/10/2025, 08:29 (GMT+7)",Unknown,Du lịch,Ẩm thực,VN Express,
VNEX_241025_00019,Aston Villa thua sốc dù đội hình đắt gấp 25 lần đối thủ,https://vnexpress.net/aston-villa-thua-soc-du-doi-hinh-dat-gap-25-lan-doi-thu-4955144.html,"Theo trang chuyển nhượngTransfermarkt, Go Ahead Eagles - CLB đang đứng thứ 12 giải VĐQG Hà Lan - có doanh thu mùa trước chỉ 23 triệu USD. Toàn bộ đội hình của họ được định giá 13,7 triệu USD - thấp hơn khoảng 25 lần so với đội hình xuất phát của Aston Villa trận này (khoảng 317 triệu USD). Các cầu thủ Go Ahead Eagles mừng bàn gỡ trong trận thắng ngược Aston Villa 2-1 ở lượt ba Europa League trên sân De Adelaarshorst, Deventer, Hà Lan ngày 23/10/2025. Ảnh:Reuters Chênh lệch đẳng cấp và tài chính tưởng chừng sẽ khiến trận đấu trên sân De Adelaarshorst chỉ mang tính thủ tục.Aston Villatưởng như củng cố thêm nhận định bằng bàn mở tỷ số ngay phút 4, nhờ cú đá bồi cận thành của Evann Guessand. Đội khách sau đó tạo thêm hàng loạt cơ hội. Nhưng, sự chủ quan và mất tập trung đã khiến họ phải trả giá. Cả trận, Go Ahead Eagles chỉ kiểm soát bóng 35%, dứt điểm trúng đích ba lần, đạt thông số bàn thắng kỳ vọng (xG) chỉ 0,83 nhưng ghi tới hai bàn. Phút 42, Mathis Suray thoát xuống dứt điểm chạm chân cầu thủ đội khách đổi hướng, khiến thủ thành vô địch World CupEmiliano Martinezchôn chân. Phút 61, toàn bộ hàng thủ Aston Villa đứng im để hậu vệ trái Mats Deijl xộc vào vòng cấm và dứt điểm thắng Martinez trong thế đối mặt, nâng tỷ số lên 2-1. Thời gian còn lại, Aston Villa ép sân nghẹt thở và tiến sát bàn gỡ khi được hưởng phạt đền ở phút 79. Nhưng Emiliano Buendia lại dứt điểm vọt xà, khiến Aston Villa đứt chuỗi 5 trận thắng trên mọi đấu trường. Cú đá phạt đền vọt xà của Emiliano Buendia. Ảnh:Reuters Sau trận thua sốc, HLVUnai Emerythừa nhận các học trò cần cải thiện khả năng sút phạt đền - điểm yếu khiến Aston Villa nhiều lần trả giá trong năm qua. ""Trách nhiệm hôm nay thuộc về Buendia"", nhà cầm quân người Tây Ban Nha nói. ""Bình thường cậu ấy đá phạt đền tốt, nhưng lần này lại sút hỏng. Chúng tôi cần trở nên lạnh lùng và chính xác hơn. Những người có thể đá penalty của đội gồm Buendia, Jadon Sancho, John McGinn và Morgan Rogers. Và tất nhiên, Buendia vẫn có thể được trao cơ hội lần nữa"". Emery cho rằng kết quả này phản ánh bản chất khó lường của bóng đá châu Âu. Ông nói: ""Đây là lý do tôi yêu bóng đá. Bạn có thể kiểm soát trận đấu, tạo ra nhiều cơ hội, nhưng chỉ cần vài sai lầm là có thể thua. Điều đó không khiến tôi bất ngờ, bóng đá luôn khó đoán như vậy"". Mats Deijl (phải) sút chéo góc ấn định chiến thắng cho Go Ahead Eagles. Ảnh:Reuters Trong khi đó, hậu vệ Mats Deijl - người ghi bàn quyết định cho Go Ahead Eagles - khẳng định đây là chiến thắng lớn nhất trong lịch sử CLB. ""Không ai nghĩ chúng tôi có thể làm được điều này"", anh tự hào. ""Tất cả đều cho rằng sẽ rất khó khăn ở châu Âu, nhưng hôm nay mọi người đã thấy chúng tôi chiến đấu ra sao"". Thất bại này còn có thể xem là lời cảnh tỉnh đắt giá cho Aston Villa trước thềm đại chiến với Man City tại Ngoại hạng Anh vào cuối tuần. ""Dù vẫn là ứng viên hàng đầu cho chức vô địch Europa League, đội quân của Emery phải đối mặt với thực tế: đội hình có giá trị vượt trội vẫn có thể thất bại vì kiêu ngạo và mất tập trung"", báo AnhSportmailbình luận. Hồng Duy","Thứ sáu, 24/10/2025, 07:21 (GMT+7)",Hồng Duy,Thể thao,Bóng đá,VN Express,
VNEX_241025_00093,Rừng tre nổi tiếng Nhật Bản bị khắc chữ chi chít,https://vnexpress.net/rung-tre-noi-tieng-nhat-ban-bi-khac-chu-chi-chit-4955055.html,"""Bamboo Path"" (con đường tre) là đoạn đường nổi tiếng nhất của rừng tre Sagano ở Arashiyama, Kyoto, thu hút hàng nghìn lượt khách mỗi ngày. Tuy nhiên, trong những năm gần đây, nhiều du khách vô ý thức đã khắc chữ lên thân tre, gây mất mỹ quan. Theo thống kê, tới tháng 10, khoảng 350 thân tre đã bị khắc chữ, hình lên. Nhiều thân tre xuất hiện các chữ tiếng Anh được khắc bằng vật sắc, nhọn. Trong một số ảnh chụp, người ta cũng thấy một số thân tre bị khắc tiếng Việt, thể hiện tình yêu đôi lứa. Nhiều thân tre còn bị khắc chi chít từ trên xuống dưới. Tại ""Bamboo Path"", các biển báo cấm khắc chữ đã được dựng lên bằng nhiều ngôn ngữ như tiếng Nhật, tiếng Trung, tiếng Anh và tiếng Hàn. Tuy nhiên, điều này không ngăn cản được những hành vi kém ý thức của du khách. Dòng chữ tiếng Việt được khắc lên thân tre. Ảnh:FNN Ông Kazutaka Mitsui, đại diện công ty điều hành dịch vụ xe kéo ""Ebisuya"", cho biết hành vi khắc chữ bắt đầu xuất hiện từ khoảng 7-8 năm trước nhưng trong vài năm gần đây, tình trạng gia tăng trở lại. Công ty Ebisuya đã dán áp phích kêu gọi du khách không khắc chữ lên tre và sử dụng băng keo để che phủ một số vết khắc nhằm giảm tác động xấu đến cảnh quan. ""Dán băng keo không phải giải pháp lý tưởng nhưng còn hơn là để lộ những vết khắc. Chúng tôi muốn du khách được thưởng thức cảnh đẹp nguyên vẹn, vì vậy mong mọi người ngừng hành vi này"", ông kêu gọi. Sự việc khiến nhiều người Nhật Bản bức xúc về cách quản lý của chính quyền lẫn ý thức của du khách. ""Tôi thấy biển báo phạt khắp nơi nhưng người ta vẫn hút thuốc và chỉ bị nhắc nhở, y như chuyện này. Chúng ta cần có cơ chế phạt rõ ràng và nếu không chịu nộp phạt, họ cần lao động công ích"", một người dùng viết trên Yahoo JP. ""Quy định của Nhật Bản quá lỏng lẻo nên du khách dường như đang coi thường pháp luật. Muốn làm điều sai trái thì về nước mình đi, đừng gây chuyện ở Nhật Bản"", người khác viết. Trong khi đó, JNF, người địa phương chia sẻ hàng dài khách du lịch tập trung ở đây khiến anh khó khăn khi băng qua rừng tre về nhà. Đôi khi, anh cố chen qua và bị quát tháo như kẻ gây rối. Nhiều thân tre bị khắc chữ chi chít. Ảnh:FNN Hành vi khắc chữ làm xấu cảnh quan và gây ảnh hưởng đến sự phát triển của cây tre. Ông Sada Nakai, chuyên gia cây cối tại Vườn thực vật Kyoto, giải thích bề mặt tre hoàn toàn được cấu tạo từ các tế bào thực vật nên khi bị khắc, các tế bào tại vị trí đó không thể tái sinh. Những vùng bị khắc không có khả năng phục hồi, làm giảm khả năng quang hợp, dẫn đến nguy cơ cây chết vì ngã đổ. Chính quyền thành phố Kyoto đang cân nhắc việc chặt bỏ những cây tre bị khắc chữ để bảo vệ cảnh quan và đảm bảo an toàn. Nằm ở phía tây của cố đô Kyoto, rừng tre Sagano là một trong những điểm du lịch nổi tiếng nhất Nhật Bản. Rừng tre Sagano nổi tiếng từ thời Heian (794-1185). Thời đó giới thương nhân quý tộc hay chọn khu rừng này là điểm nghỉ dưỡng yêu thích. Tiếng lá tre xào xạc khi gió thổi tạo nên những âm thanh độc đáo tựa như lời thì thầm của gió, gây ấn tượng với du khách. Âm thanh của khu rừng được Bộ Môi trường Nhật Bản đưa vào danh sách 100 âm thanh của Nhật Bản và khuyến khích người dân cảm nhận những âm thanh tự nhiên đặc trưng của xứ sở mặt trời mọc. Hoài Anh(TheoYahoo JP, FNN)","Thứ sáu, 24/10/2025, 05:00 (GMT+7)",Hoài Anh,Du lịch,Tin tức,VN Express,
