id,title,link,content,date,author,category,sub_category,source,summary
VNEX_140725_00092,Tài xế ngồi thiền bên đường sau khi gây tai nạn nghiêm trọng,https://vnexpress.net/tai-xe-ngoi-thien-ben-duong-sau-khi-gay-tai-nan-nghiem-trong-4913892.html,"Vụ va chạm giữa hai xe xảy ra trên quốc lộ 6 thuộc huyện Nam Đầu, ngày 3/7. Chiếc SUV màu xám đâm vào một chiếc sedan màu bạc phía trước với nguyên nhân chưa xác định. Chiếc SUV nằm phía sau dải phân cách, đầu xe ghếch lên barie. Ảnh:UDN Sau va chạm, chiếc SUV trượt khỏi làn đường và phần đầu xe mắc trên lan can. Người điều khiển chiếc SUV, 24 tuổi, bị thương nhẹ và ngồi thiền bên lề đường sau tai nạn trong lúc chờ cảnh sát cũng như nhân viên y tế đến xử lý. Tài xế xe sedan, 62 tuổi, may mắn vô sự. Chiếc SUV dập móp toàn thân với phần đầu xe vỡ toác. Cách đó không xa, xe sedan cũng bị hư hỏng nghiêm trọng. Vô số mảnh vỡ văng xung quanh, trong đó có các thanh barie bị gãy. Tài xế xe SUV bị thương nhẹ và ngồi thiền bên lề đường. Ảnh:UDN Khi cảnh sát đặt câu hỏi, tài xế của chiếc SUV tỏ ra không hoàn toàn bình thường, thậm chí đưa ra câu trả lời không liên quan và ở trong tình trạng tinh thần không tốt. Sau đó người này đã được đưa đến bệnh viện kiểm tra và đánh giá sức khỏe. Mỹ Anh(theoUDN)","Thứ hai, 14/7/2025, 11:30 (GMT+7)",Mỹ Anh,Xe,Diễn đàn,VN Express,"Ngày 3/7, một vụ va chạm giữa SUV và sedan xảy ra trên quốc lộ 6 ở huyện Nam Đầu, khiến cả hai xe hư hỏng nặng. Tài xế SUV 24 tuổi bị thương nhẹ và ngồi thiền bên đường chờ cứu hộ, trong khi tài xế sedan 62 tuổi may mắn không bị thương. Cảnh sát nghi ngờ tài xế SUV có dấu hiệu bất thường về tinh thần và đã đưa người này đến bệnh viện để kiểm tra. Nguyên nhân vụ tai nạn đang được điều tra."
VNEX_140725_00004,8 năm thực hiện chủ trương cấm xe máy ở Hà Nội,https://vnexpress.net/8-nam-thuc-hien-chu-truong-cam-xe-may-o-ha-noi-4913737.html,"Ngày 12/7, trong Chỉ thị 20 về một số nhiệm vụ cấp bách, quyết liệt ngăn chặn, giải quyết tình trạng ô nhiễm môi trường, Thủ tướng Phạm Minh Chính yêu cầu Hà Nội triển khai các giải pháp để tổ chức, cá nhân chuyển đổi phương tiện, bảo đảm đến ngày 1/7/2026 không còn xe môtô, xe gắn máy sử dụng nhiên liệu hóa thạch lưu thông trong vành đai 1. Từ ngày 1/1/2028, ngoài cấm xe môtô, xe gắn máy chạy xăng dầu, ôtô cá nhân sử dụng nhiên liệu hóa thạch cũng bị hạn chế trong vành đai 1 và 2; đến năm 2030 áp dụng với toàn bộ phương tiện cá nhân sử dụng nhiên liệu hóa thạch trong phạm vi vành đai 3. Phương tiện xe máy chạy xăng lưu thông trên phố Hàng Đào (trong vành đai 1). Ảnh:Giang Huy Thực tế từ năm 2017, trước vấn nạn ô nhiễm không khí và ùn tắc giao thông, Hà Nội đã đặt ra lộ trình từng bước hạn chế hoạt động của xe máy ở một số khu vực và dừng hoạt động xe máy ở các quận cũ vào năm 2030 (Nghị quyết số 04 được HĐND TP Hà Nội thông qua ngày 4/7/2017). Thực hiện Nghị quyết, thành phố đã giao các đơn vị chuyên môn xây dựng đề án liên quan. Trong đó có đề án ""Phân vùng hạn chế xe máy, năng lực phục vụ của hệ thống vận tải công cộng tiến tới dừng hoạt động xe máy ở các quận vào năm 2030"" do Sở Giao thông Vận tải (nay là Sở Xây dựng) và Viện chiến lược phát triển giao thông (Bộ Xây dựng) thực hiện. Đề án đưa ra hai phương án phân vùng hạn chế xe máy. Thứ nhất là hạn chế xe máy theo quận (12 quận và 5 huyện chuẩn bị lên quận). Tuy nhiên, phương án này được cho có nhiều hạn chế, như: công tác tổ chức giao thông sẽ khó khăn vì không có vành đai kỹ thuật đảm bảo đủ điều kiện; khó xây dựng bãi đỗ xe, điểm trung chuyển để kết nối. Phương án thứ hai là hạn chế xe máy theo vành đai. Viện Chiến lược giao thông cho hay trong 5 vành đai được Hà Nội xây dựng đến năm 2030, vành đai 3 đạt đầy đủ chỉ tiêu để hạn chế xe máy do là vành đai khép kín, mặt cắt ngang rộng, quy mô 8-10 làn xe, trên tuyến có một số đoạn cao tốc đô thị đảm bảo khả năng phân luồng lưu thông. Vành đai 3 có quỹ đất dự phòng lớn, thuận tiện xây dựng điểm đỗ xe, điểm trung chuyển, trạm dừng nghỉ hơn vành đai 2 vốn đã chật chội. Ô nhiễm không khí ở khu vực Trung Hòa hồi đầu năm 2025. Ảnh:Thanh Hải Trong những năm đầu thực hiện chủ trương hạn chế tiến tới cấm xe máy, lãnh đạo thành phố và Sở Giao thông Vận tải đều bày tỏ quyết tâm hoàn thành mục tiêu này trước năm 2030. Nguyên Giám đốc Sở Giao thông vận tải Vũ Văn Viện tại cuộc làm việc với Bí thư Thành ủy Hà Nội ngày 9/3/2019 nêu quan điểm ""cấm được xe máy càng sớm càng tốt"". Hai tháng sau, phát biểu trong hội nghị đối thoại với công nhân, Chủ tịch thành phố Nguyễn Đức Chung nói ""nếu điều kiện phát triển giao thông công cộng tốt lên, thành phố có thể đẩy nhanh tiến độ cấm xe máy trước năm 2030"". Quyết tâm của lãnh đạo thành phố vẫn chưa thể thúc đẩy được chính sách. Cuối năm 2021, UBND TP Hà Nội gửi HĐND cùng cấp tờ trình về Chương trình mục tiêu giảm ùn tắc, đảm bảo an toàn giao thông giai đoạn 2021-2025. Theo đó, những năm tới thành phố tiếp tục nghiên cứu, hoàn thiện thủ tục để phê duyệt đề án về phân vùng hạn chế hoạt động xe máy và tiến tới dừng hoạt động loại phương tiện này tại các quận. Nhưng đề án sau đó không được trình ra kỳ họp của HĐND thành phố. Tới tháng 8/2024, trong báo cáo thực hiện Nghị quyết của HĐND thành phố về kế hoạch phát triển kinh tế - xã hội 5 năm 2021-2025, Sở Giao thông Vận tải thừa nhận còn một số nội dung chưa hoàn thành đúng thời hạn, như ""Đề án phân vùng hạn chế hoạt động của xe máy phù hợp với cơ sở hạ tầng và năng lực phục vụ của hệ thống vận tải hành khách công cộng tiến tới dừng hoạt động xe máy trên địa bàn các quận năm 2030"". Sở giải thích lý do: ""Đây là nội dung khó, nhạy cảm, ảnh hưởng lớn đến người dân, do vậy Sở cần phải rà soát, nghiên cứu kỹ lưỡng, đánh giá toàn diện tác động của Đề án đến xã hội, người dân, thận trọng đề xuất các phương án, giải pháp đảm bảo chặt chẽ các điều kiện về pháp lý theo quy định pháp luật vào thời điểm phù hợp"". Trong danh mục nội dung thực hiện về kinh tế - xã hội trong giai đoạn 2021-2025 do UBND báo cáo HĐND thành phố vào tháng 8/2024, Đề án phân vùng hoạt động của xe máy còn được ghi ""xin dừng thực hiện"". Các vành đai 1, 2, 3 của Hà Nội. Đồ họa:Hoàng Khánh Đến năm 2025, trong bối cảnh xe điện đã phát triển mạnh, ngày 9/6 tại buổi làm việc với Hiệp hội Các nhà sản xuất xe máy Việt Nam, Chủ tịch thành phố Trần Sỹ Thanh khẳng định Hà Nội kiên định với chủ trương đã được HĐND thông qua từ năm 2017 về quản lý phương tiện cá nhân nhằm giảm ùn tắc và ô nhiễm môi trường. Hà Nội sẽ giữ nguyên lộ trình hạn chế xe máy tại các quận vào năm 2030, đồng thời từng bước chuyển đổi từ xe máy xăng sang xe máy điện. ""Chủ trương này đã ban hành cách đây hơn 7 năm nên không có gì bất ngờ với doanh nghiệp hay người dân. Thành phố quyết tâm thực hiện lộ trình chuyển đổi phương tiện sử dụng nhiên liệu hóa thạch sang năng lượng sạch"", ông nói. Để thực hiện mục tiêu, Hà Nội sẽ có chính sách hỗ trợ người dân chuyển đổi, đầu tư hệ thống trạm sạc, nâng tiêu chuẩn an toàn tại các khu vực sạc tập trung, đồng thời phát triển mạnh vận tải công cộng. Thành phố đặt mục tiêu chậm nhất đến năm 2030 sẽ chuyển toàn bộ xe buýt sang năng lượng sạch và đến năm 2035 hoàn thành 10 tuyến đường sắt đô thị với tổng chiều dài hơn 400 km. Ông Trần Sỹ Thanh giao Sở Xây dựng làm đầu mối phối hợp với các bên liên quan xây dựng lộ trình chuyển đổi phù hợp, hài hòa lợi ích giữa Nhà nước, doanh nghiệp và người dân. ""Các doanh nghiệp sản xuất xe máy đã có mặt tại Việt Nam nhiều thập kỷ, vì vậy nên cùng thành phố hỗ trợ người dân chuyển đổi sang phương tiện xanh, góp phần xây dựng Thủ đô văn minh, xanh sạch hơn"", ông nói. Thống kê của Sở Giao thông Vận tải, đến hết năm 2024 Hà Nội có trên 9,2 triệu phương tiện các loại đang hoạt động trên địa bàn (chưa bao gồm xe của cơ quan trung ương). Trong đó thành phố đang quản lý hơn 8 triệu phương tiện, gồm 1,1 triệu ôtô và trên 6,9 triệu xe máy. Ngoài ra, còn có khoảng 1,2 triệu ôtô, xe máy cá nhân từ các tỉnh, thành phố khác lưu thông trên địa bàn. Tốc độ gia tăng phương tiện của Hà Nội nói chung khoảng 4-5%/năm, gấp từ 11 đến 17 lần tốc độ mở rộng đường sá. Đặc biệt, ôtô cá nhân đang tăng khoảng 10%/năm, cao gấp hơn 30 lần tốc độ gia tăng đất dành cho giao thông. Hoạt động giao thông, với lượng phương tiện chạy bằng xăng dầu lớn, là một trong 5 nguồn gây ô nhiễm không khí ở Hà Nội. Võ Hải","Thứ hai, 14/7/2025, 01:24 (GMT+7)",Võ Hải,Thời sự,Giao thông,VN Express,"Để giải quyết ô nhiễm môi trường, Thủ tướng yêu cầu Hà Nội thực hiện lộ trình cấm xe máy và hạn chế ô tô cá nhân sử dụng nhiên liệu hóa thạch trong các vành đai từ năm 2026 đến 2030. Hà Nội đã có nghị quyết từ năm 2017 về việc hạn chế xe máy, và đang xem xét hai phương án: hạn chế theo quận hoặc theo vành đai, với vành đai 3 được đánh giá là phù hợp nhất. Mặc dù lãnh đạo thành phố đã thể hiện quyết tâm thực hiện sớm chính sách này, tiến độ vẫn còn chậm."
VNEX_140725_00078,Bố mẹ mang gene lặn di truyền con gái gây 'nam hóa',https://vnexpress.net/bo-me-mang-gene-lan-di-truyen-con-gai-gay-nam-hoa-4913800.html,"Đây có thể là lý do khiến con gái đầu của vợ chồng, nay 5 tuổi, mắc bệnh tăng sản thượng thận bẩm sinh, theo ThS.BS.CKI Nguyễn Phương Thảo, Trung tâm Y học bào thai, Bệnh viện Đa khoa Tâm Anh TP HCM. Khi chào đời, bé có cơ quan sinh dục ngoài bất thường (giống nam), kết quả xét nghiệm máu ghi nhận chỉ số 17-hydroxyprogesterone, một hormone steroid được sản xuất bởi tuyến thượng thận, vượt 300 ng/dL (bình thường khoảng 110 ng/dL). Chỉ số này cho thấy bé bị tăng sản tuyến thượng thận. Bác sĩ Thảo giải thích tăng sản thượng thận bẩm sinh xảy ra do rối loạn tổng hợp hormone tuyến thượng thận, gây suy thượng thận cấp và bất thường cơ quan sinh dục. Bé gái mang bộ nhiễm sắc thể 46 XX, thực tế là nữ nhưng bộ phận sinh dục ngoài có xu hướng nam hóa (âm vật phì đại), đã được phẫu thuật tạo hình bộ phận sinh dục kết hợp điều trị nội tiết. Tăng sản thượng thận bẩm sinh di truyền theo kiểu lặn trên nhiễm sắc thể thường số 6. Kết quả phân tích gene ghi nhận cả hai vợ chồng chị Hạ đều mang đột biến gene CYP21A2, là người lành mang gene bệnh. Vợ chồng không có triệu chứng, vì vậy không sàng lọc bệnh trước khi mang thai nên đã di truyền cho con gái. Nếu phát hiện sớm trong thai kỳ, bé gái có thể được điều trị từ trong bào thai tránh tình trạng nam hóa cơ quan sinh dục ngoài, sau sinh điều trị nội tiết hạn chế các biến chứng mất muối nước gây tử vong. Về mặt di truyền học, nếu vợ chồng chị Hạ sinh con thứ hai có 25% khả năng chào đời khỏe mạnh, 25% nguy cơ mắc bệnh tăng sản thượng thận bẩm sinh với các mức độ khác nhau từ nhẹ đến nặng. 50% khả năng con là người lành mang gene bệnh có thể di truyền cho thế hệ sau. Xét nghiệm máu sàng lọc di truyền trước mang thai. Ảnh minh họa:Bệnh viện Đa khoa Tâm Anh Sau khisàng lọc di truyềntrước mang thai lần hai, vợ chồng chị chọn thực hiện thụ tinh trong ống nghiệm và sàng lọc phôi để đảm bảo sinh con khỏe mạnh. Sàng lọc di truyền mục đích xác định người lànhmang gene bệnhgiúp phòng ngừa, giảm tình trạng nam hóa gây bất thường phát triển cơ quan sinh dục ngoài của bé gái. Xét nghiệm di truyền trước sinh còn hỗ trợ bác sĩ lên kế hoạch điều trị ngay khi trẻ chào đời, phòng tránh suy thượng thận cấp. Trẻ gái bị nam hóa được điều trị sớm có thể phát triển bình thường, chẩn đoán muộn trẻ gái nam hóa hoàn toàn, dẫn đến vô sinh hiếm muộn về sau. Trẻ trai mắc bệnh này thường dậy thì sớm, hạn chế phát triển chiều cao. Bệnh nhân điều trị bằng liệu pháp thay thế hormone thượng thận suốt đời, phẫu thuật chỉnh hình dị dạng cơ quan sinh dục ngoài. Tăng sản thượng thận bẩm sinh chiếm tỷ lệ 1/10.000 đến 1/15.000 trẻ sơ sinh sống. Bệnh có thể gây ra triệu chứng như tăng kali trong máu, nôn, mất nước, chậm tăng cân, giảm huyết áp, hạ đường huyết, rối loạn điện giải, sốc tuần hoàn... nguy cơ tử vong nếu không điều trị kịp thời. Bệnh cũng dẫn đến sự phát triển bất thường của cơ quan sinh dục như phì đại âm vật ở bé gái, dương vật to, tinh hoàn nhỏ ở bé trai, dậy thì sớm, kinh nguyệt không đều hoặc vô kinh... Bệnh nhân tăng sản thượng thận bẩm sinh có nguy cơ mắc cácbệnh tim mạchchuyển hóa cao hơn như tăng huyết áp, béo phì, rối loạn lipid máu, kháng insulin, rối loạn cân bằng glucose... Tuy nhiên nếu phát hiện sớm, điều trị đầy đủ thì các bé này có cuộc sống gần như bình thường, vẫn có khả năng sinh con khỏe mạnh, theo bác sĩ Thảo. Ngọc Châu * Tên người bệnh đã được thay đổi","Thứ hai, 14/7/2025, 10:00 (GMT+7)",Ngọc Châu,Sức khỏe,Các bệnh,VN Express,"Bé gái 5 tuổi con của vợ chồng chị Hạ mắc bệnh tăng sản thượng thận bẩm sinh do cả hai vợ chồng đều mang gene bệnh này. Bệnh gây rối loạn tổng hợp hormone tuyến thượng thận, dẫn đến bất thường cơ quan sinh dục và nguy cơ suy thượng thận cấp. Nhờ sàng lọc di truyền trước khi mang thai lần hai, vợ chồng chị đã sinh con khỏe mạnh bằng phương pháp thụ tinh trong ống nghiệm và sàng lọc phôi. Việc phát hiện và điều trị sớm bệnh tăng sản thượng thận bẩm sinh rất quan trọng để tránh các biến chứng nguy hiểm và đảm bảo sự phát triển bình thường của trẻ."
VNEX_140725_00073,Lý do khiến bạn tỉnh giấc ngay trước chuông báo thức,https://vnexpress.net/ly-do-khien-ban-tinh-giac-ngay-truoc-chuong-bao-thuc-4912709.html,"Bạn có từng tỉnh dậy lúc 7h28, chỉ hai phút trước chuông báo thức 7h30? Hiện tượng này khiến bạn bực bội vì mất giấc ngủ hay tò mò về khả năng ""siêu nhiên"" nắm bắt thời gian khi ngủ? Tiến sĩ Andrea Matsumura, chuyên gia y học giấc ngủ lý giải việc thức dậy ngay trước chuông báo thức, có ba nguyên nhân, bao gồm: Nhịp sinh học ổn định Nếu bạn ngủ và thức đúng giờ mỗi ngày (ít nhất 7 tiếng), cơ thể như ""đồng hồ sinh học"" tự động đánh thức bạn. Ánh sáng ban ngày và melatonin ban đêm giúp đồng hồ này hoạt động chính xác. Duy trì giờ ngủ và thức đều đặn, kết hợp tín hiệu ánh sáng, giúp nhịp sinh học vận hành chính xác như dàn nhạc chuyên nghiệp. Nhiều người thường tỉnh dậy ngay trước khi chuông báo thức reo. Ảnh:Pexels Căng thẳng về việc thức dậy Khi bạn căng thẳng về việc phải dậy sớm (như sợ muộn chuyến bay), cơ thể tiết hormone cortisol và ACTH, khiến bạn tỉnh giấc trước giờ báo thức, đôi khi thức gián đoạn trong đêm mà không nhớ. Nếu điều này xảy ra thường xuyên và bạn luôn thức dậy với cảm giác lo lắng và đầu óc mụ mị, nhịp sinh học có thể bị rối loạn. Chẳng hạn khi ai đó là cú đêm và đi ngủ sau nửa đêm, nhưng phải thức dậy để làm việc lúc 6 giờ sáng, họ sẽ hình thành kiểu cảnh giác cao độ trong giấc ngủ và cảm thấy như bản thân đang ngủ với một mắt mở to, bà Matsumura nói. May mắn thay, bạn có thể thực hiện các bước để điều chỉnh lại nhịp sinh học của mình. Đã ""hiện thực hóa"" giờ thức dậy của mình Có nghiên cứu khoa học thần kinh đằng sau sự hiện thực hóa và sức mạnh của sự thuyết phục, bà Matsumura nói. Một số người ""tự đặt"" giờ dậy trong đầu, như vận động viên hình dung chiến thắng. Não có thể được rèn để tự đánh thức đúng giờ mà không cần báo thức. Chưa có nghiên cứu về việc làm thế nào có thể rèn luyện bản thân để thức dậy khi muốn. Nhưng chúng ta có thể suy rộng ra rằng sức mạnh của sự hiện thực hóa có thể giúp điều chỉnh thời gian ngủ, miễn là phù hợp với nhịp sinh học của bản thân. Mỹ Ý(TheoReal Simple)","Thứ hai, 14/7/2025, 02:00 (GMT+7)",Mỹ Ý,Sức khỏe,Sống khỏe,VN Express,"Bài viết giải thích hiện tượng thức dậy ngay trước chuông báo thức bằng ba nguyên nhân chính: nhịp sinh học ổn định do ngủ đủ giấc và đúng giờ, căng thẳng về việc thức dậy sớm khiến cơ thể tiết hormone gây tỉnh giấc, và khả năng ""hiện thực hóa"" giờ thức dậy nhờ sức mạnh của sự thuyết phục. Việc duy trì giờ giấc ngủ nghỉ đều đặn, kết hợp với ánh sáng và thư giãn, có thể giúp điều chỉnh nhịp sinh học và cải thiện chất lượng giấc ngủ. Tuy chưa có nghiên cứu cụ thể, nhưng việc rèn luyện não bộ thông qua hiện thực hóa có thể giúp đánh thức đúng giờ, miễn là phù hợp với nhịp sinh học tự nhiên của cơ thể."
VNEX_140725_00009,"Xả súng bên ngoài nhà thờ Mỹ, ít nhất 2 người chết",https://vnexpress.net/xa-sung-ben-ngoai-nha-tho-my-it-nhat-2-nguoi-chet-4913756.html,"Sự việc xảy ra lúc 11h30 ngày 13/7 (22h30 giờ Hà Nội) khi cảnh sát bang Kentucky của Mỹ dừng một ôtô nghi vấn để kiểm tra hành chính gần sân bay Blue Grass ở hạt Fayette. Nghi phạm nổ súng khiến một cảnh sát bị thương. Nghi phạm sau đó cướp xe, chạy trốn đến nhà thờ Richmond Road Baptist và bắt đầu nổ súng vào những người ở đó, khiến hai người thiệt mạng và 2 người bị thương. Nghi phạm bị cảnh sát bắn hạ ngay sau đó. Giới chức cho biết hai phụ nữ thiệt mạng gồm Christina Combs, 34 tuổi, và Beverly Gumm, 72 tuổi. Hai người đàn ông bị thương được đưa đến bệnh viện, trong đó một người đang nguy kịch và một người đã ổn định sức khỏe. Sĩ quan bị bắn gần sân bay cũng trong tình trạng ổn định. ""Có những ngày mọi thứ thực sự tồi tệ như hôm nay. Đôi khi có chuyện xảy ra và bạn không biết tại sao"", Lawrence Weathers, cảnh sát trưởng thành phố Lexington ở hạt Fayette, nói. Lực lượng an ninh phong tỏa khu vực xả súng ở Kentucky ngày 13/7. Ảnh:WDKY Cảnh sát địa phương chưa cung cấp thông tin về danh tính nghi phạm và động cơ dẫn đến vụ nổ súng. Tuy nhiên, họ cho biết có một số dấu hiệu cho thấy nghi phạm quen biết những người ở nhà thờ. Thống đốc Kentucky Andy Beshear kêu gọi người dân bày tỏ lòng biết ơn với lực lượng thực thi pháp luật và cầu nguyện cho các nạn nhân. ""Xin hãy cầu nguyện cho tất cả những người bị ảnh hưởng bởi hành vi bạo lực vô nghĩa này. Chúng ta hãy cảm ơn phản ứng nhanh chóng của Sở cảnh sát Lexington và cảnh sát bang Kentucky"", ông viết trên mạng xã hội. Các vụ nổ súng tại Mỹ được xem là xả súng nếu có từ 4 người trở lên bị bắn, ngoại trừ nghi phạm. Gun Violence Archive (GVA), tổ chức phi lợi nhuận chuyên lưu trữ hồ sơ về các vụ bạo lực súng đạn, cho biết đã có hơn 200 vụ xả súng xảy ra ở Mỹ trong năm nay. Thùy Lâm(TheoReuters, CNN)","Thứ hai, 14/7/2025, 06:52 (GMT+7)",Thùy Lâm,Thế giới,Tư liệu,VN Express,"Ngày 13/7, một vụ xả súng kinh hoàng xảy ra ở Kentucky, Mỹ, khi một nghi phạm sau khi nổ súng vào cảnh sát đã cướp xe, chạy đến nhà thờ và xả súng vào đám đông, làm 2 người chết và 2 người bị thương. Nghi phạm đã bị cảnh sát bắn hạ, trong khi sĩ quan cảnh sát bị thương cũng đã ổn định. Cảnh sát đang điều tra động cơ gây án, đồng thời thống đốc bang kêu gọi người dân cầu nguyện cho các nạn nhân và cảm ơn lực lượng an ninh. Vụ việc này là một trong hơn 200 vụ xả súng đã xảy ra tại Mỹ trong năm nay."
