id,title,link,content,date,author,category,sub_category,source,summary
VNEX_170925_00073,Bí quyết duy trì bộ não trẻ trung,https://vnexpress.net/bi-quyet-duy-tri-bo-nao-tre-trung-4937958.html,"Trong nỗ lực duy trì sự trẻ trung, nhiều người chỉ chú trọng vẻ ngoài, nhưng giữ bộ não khỏe mạnh mới là chìa khóa. Sa sút trí tuệ, nguyên nhân hàng đầu gây khuyết tật ở người lớn tuổi, ảnh hưởng đến 57 triệu người toàn cầu năm 2021, với gần 10 triệu ca mới mỗi năm. Tiến sĩ Prashant Katakol, chuyên gia giải phẫu thần kinh tại Bangalore, Ấn Độ, chia sẻ 3 thói quen đơn giản giúp giữ bộ não sắc bén và trẻ trung. Thử thách não bộ Để duy trì bộ não sắc bén và trẻ trung, hãy liên tục sử dụng và thử thách nó. ""Bộ não phát triển nhờ thử thách. Hãy học kỹ năng mới, giải ô chữ hoặc thử đường đi khác mỗi ngày"", ông chia sẻ trên Instagram. Nghiên cứu chỉ ra rằng chơi ô chữ thường xuyên có thể trì hoãn suy giảm trí nhớ tới 2,5 năm. Các trò chơi như Sudoku hoặc hoạt động kích thích trí óc khác cũng mang lại lợi ích tương tự. Các trò chơi như Sudoku giúp duy trì bộ não sắc bén và trẻ trung Ảnh:The Science Explorer Thở đúng cách Các bài tập thở không chỉ đơn giản mà còn rất quan trọng để giữ bộ não khỏe mạnh, theo tiến sĩ Katakol. ""Tôi dạy bệnh nhân bài tập thở yoga đơn giản: ngồi thoải mái, tập trung giữa hai lông mày, hít vào 4 nhịp, giữ hơi 4 nhịp, thở ra 4 nhịp"", ông chia sẻ. Kỹ thuật này giúp làm dịu tâm trí, trẻ hóa não bộ. Các hoạt động chánh niệm như thiền hoặcyogacũng mang lại lợi ích tương tự, hỗ trợ duy trì sự sắc bén và trẻ trung cho trí óc. Kết nối xã hội Theo tiến sĩ Katakol, bộ não phát triển nhờ các mối quan hệ, sự cô lập có thể gây hại nghiêm trọng. ""Hãy xây dựng vòng tròn kết nối, cô lập tổn thương não bộ như thực phẩm không lành mạnh"", ông nhấn mạnh. Gọi điện cho bạn bè, tham gia nhóm hoặc câu lạc bộ đọc sách không chỉ cải thiện tâm trạng mà còn tăng cường chức năng não. Dành thời gian mỗi ngày cho các hoạt động xã hội là cách đơn giản để giữ trí óc sắc bén và trẻ trung. ""Giữ tâm trí hoạt động, kiểm soát hơi thở và duy trì tình bạn là 'đơn thuốc' cho bộ não trẻ trung"", ông nói. Chìa khóa nằm ở sự nhất quán - thực hiện các bước nhỏ như thử thách trí tuệ, tập thở và kết nối xã hội mỗi ngày để đạt hiệu quả tối đa. Mỹ Ý(TheoTimes of India)","Thứ tư, 17/9/2025, 02:00 (GMT+7)",Mỹ Ý,Sức khỏe,Sống khỏe,VN Express,"Để duy trì sự trẻ trung, bên cạnh vẻ ngoài, việc giữ cho bộ não khỏe mạnh là vô cùng quan trọng. Tiến sĩ Prashant Katakol chia sẻ ba thói quen đơn giản giúp giữ bộ não sắc bén và trẻ trung: thử thách não bộ bằng cách học hỏi và giải đố, tập thở đúng cách để làm dịu tâm trí và trẻ hóa não bộ, và kết nối xã hội để tránh sự cô lập gây hại. Quan trọng nhất là sự nhất quán trong việc thực hiện những thói quen này hàng ngày để đạt hiệu quả tối đa."
VNEX_170925_00006,Giám đốc FBI đấu khẩu với phe Dân chủ,https://vnexpress.net/giam-doc-fbi-dau-khau-voi-phe-dan-chu-4939956.html,"Tại buổi điều trần của giám đốc FBI Kash Patel trước Thượng viện Mỹ hôm 16/9, thượng nghị sĩ Dân chủ Dick Durbin cáo buộc ông Patel gây ra ""thiệt hại không thể đong đếm"" với FBI cũng như gây nguy hiểm cho an ninh quốc gia và an toàn của cộng đồng, khi sa thải hàng loạt đặc vụ từng tham gia những vụ án hình sự nhằm vào Tổng thống Mỹ Donald Trump trong quá khứ. Thượng nghị sĩ Dân chủ Cory Booker cho rằng điều này khiến nước Mỹ ""trở nên yếu ớt và kém an toàn hơn"", đồng thời dự đoán giám đốc FBI ""sẽ không còn tại vị lâu"". ""Dù ông có phục tùng ý muốn của Donald Trump, chứ không phải Hiến pháp Mỹ, Donald Trump đã cho thấy mình không gắn bó với những người như ông và sẽ bỏ rơi ông"", nghị sĩ Booker nói. Khi bị thượng nghị sĩ Dân chủ Adam Schiff chất vấn liệu có đặc vụ FBI nào bị sa thải vì lý do trả thù chính trị hay không, ông Patel nổi giận và gọi ông Schiff là ""kẻ gian lận lớn nhất từng ngồi ở Thượng viện Mỹ"" và ""gã hề chính trị"". ""Tôi không có danh sách kẻ thù"", giám đốc FBI nói. ""Những động thái mà chúng tôi tiến hành với nhân sự của FBI đều dựa trên năng lực, trình độ và khả năng thực hiện nghĩa vụ được quy định trong hiến pháp. Nếu không đáp ứng được thì họ sẽ không còn làm việc nữa"". Giám đốc FBI Kash Patel tại buổi điều trần trước Thượng viện Mỹ hôm 16/9. Ảnh:AFP Các thượng nghị sĩ Dân chủ và Cộng hòa cũng hỏi ông Patel về vụ án của tỷ phú ấu dâm Jeffrey Epstein, người hiện là tâm điểm tranh cãi về chính trị dưới thời ông Trump. Giám đốc FBI cho biết không phát hiện thông tin nào trong hồ sơ cho thấy Epstein đã môi giới mại dâm phụ nữ trẻ cho người khác. ""Không có thông tin đáng tin cậy nào, hoàn toàn không"", ông nói. Ông Patel đã bị cả cánh tả lẫn cánh hữu ở Mỹ chỉ trích kể từ khi được ông Trump bổ nhiệm làm giám đốc FBI, cơ quan hành pháp hàng đầu của đất nước. Một số người thuộc nhóm ủng hộ ông Trump nhiệt thành nhất đã theo dõi vụ án của Epstein trong nhiều năm. Họ tin rằng giới tinh hoa thuộc ""nhà nước ngầm"" đã bảo vệ những người thân cận với tỷ phú ấu dâm trong nội bộ đảng Dân chủ và Hollywood. Ông Patel đã khiến những người trung thành với ông Trump tức giận khi hồi tháng 7 công bố một bản ghi nhớ khiến cuộc điều tra về Esptein về cơ bản đã kết thúc. Fox Newscho biết quan hệ giữa giám đốc FBI và Bộ trưởng Tư pháp Pam Bondi đang đặc biệt căng thẳng, dù ông vẫn nhận được tín nhiệm của Nhà Trắng. Ông Patel cũng bị chỉ trích sau vụ nhà hoạt động bảo thủ Charlie Kirk bị ám sát tại trường đại học ở Utah. Giám đốc FBI ban đầu thông báo bắt được nghi phạm khoảng vài giờ sau vụ nổ súng, song sau đó thừa nhận đã bắt nhầm và trả tự do cho người này. Cuối cùng, nghi phạm thực sự bị bắt sau 33 giờ truy lùng. Phạm Giang(TheoAFP)","Thứ tư, 17/9/2025, 07:03 (GMT+7)",Phạm Giang,Thế giới,,VN Express,"Tại buổi điều trần trước Thượng viện Mỹ, Giám đốc FBI Kash Patel bị các thượng nghị sĩ Dân chủ cáo buộc gây tổn hại cho FBI và an ninh quốc gia khi sa thải các đặc vụ liên quan đến các vụ án chống lại Donald Trump. Ông Patel bác bỏ cáo buộc này, khẳng định các quyết định nhân sự dựa trên năng lực. Ông cũng khẳng định không tìm thấy bằng chứng về việc Jeffrey Epstein môi giới mại dâm cho người khác, gây ra tranh cãi trong cả phe cánh tả và cánh hữu."
VNEX_170925_00074,5 món ăn sáng có thể khiến thận yếu,https://vnexpress.net/5-mon-an-sang-co-the-khien-than-yeu-4939374.html,"Một số thực phẩm trong bữa sáng không tốt cho thận, nhất là người đã có bệnh nền. Hạn chế những món này có thể giúp bảo vệ chức năng thận và hỗ trợ sức khỏe lâu dài. Thực phẩm chế biến sẵnlà lựa chọn nhanh chóng cho bữa sáng song hàm lượng muối cao lại có khả năng gây hại thận. Dung nạp quá nhiều muối có thể dẫn đến tăng huyết áp, ảnh hưởng xấu đến thận. Theo thời gian, tiêu thụ thực phẩm này thường xuyên góp phần gây áp lực lên thận. Thay vào đó, hãy tự làm bữa sáng với rau tươi và protein như trứng, các loại hạt để bổ dưỡng, có lợi cho sức khỏe. Một số thực phẩm trong bữa sáng không tốt cho thận, nhất là người đã có bệnh nền. Hạn chế những món này có thể giúp bảo vệ chức năng thận và hỗ trợ sức khỏe lâu dài. Thực phẩm chế biến sẵnlà lựa chọn nhanh chóng cho bữa sáng song hàm lượng muối cao lại có khả năng gây hại thận. Dung nạp quá nhiều muối có thể dẫn đến tăng huyết áp, ảnh hưởng xấu đến thận. Theo thời gian, tiêu thụ thực phẩm này thường xuyên góp phần gây áp lực lên thận. Thay vào đó, hãy tự làm bữa sáng với rau tươi và protein như trứng, các loại hạt để bổ dưỡng, có lợi cho sức khỏe. Thịt chế biến sẵnnhư thịt xông khói, xúc xích thường có trong bữa sáng nhưng chúng có thể gây hại cho thận. Theo Quỹ Thận Quốc gia Mỹ, tiêu thụ nhiều thịt chế biến sẵn có liên quan đến tăng nguy cơ mắc bệnh thận mạn tính do hàm lượng natri và phốt pho cao. Những loại thịt này chứa nhiều natri, có thể làmtăng huyết áp. Thịt chế biến sẵn chứa các chất bảo quản như nitrat và nitrit, có thể gia tăng căng thẳng cho cơ quan này. Lựa chọn các nguồn protein tươi, chưa qua chế biến như trứng, các loại đậu để cung cấp dinh dưỡng mà không gây quá tải. Thịt chế biến sẵnnhư thịt xông khói, xúc xích thường có trong bữa sáng nhưng chúng có thể gây hại cho thận. Theo Quỹ Thận Quốc gia Mỹ, tiêu thụ nhiều thịt chế biến sẵn có liên quan đến tăng nguy cơ mắc bệnh thận mạn tính do hàm lượng natri và phốt pho cao. Những loại thịt này chứa nhiều natri, có thể làmtăng huyết áp. Thịt chế biến sẵn chứa các chất bảo quản như nitrat và nitrit, có thể gia tăng căng thẳng cho cơ quan này. Lựa chọn các nguồn protein tươi, chưa qua chế biến như trứng, các loại đậu để cung cấp dinh dưỡng mà không gây quá tải. Ngũ cốc có đườngthường có hàm lượng đường và các chất phụ gia nhân tạo cao, ảnh hưởng tiêu cực đến sức khỏe thận. Lượng đường dư thừa góp phần gây béo phì và kháng insulin - những yếu tố nguy cơ chính thúc đẩybệnh thận. Thay thế thực phẩm này bằng ngũ cốc nguyên hạt như yến mạch, kiều mạch, gạo lứt để cung cấp chất xơ, vitamin và khoáng chất, duy trì chức năng thận tốt hơn. Ngũ cốc có đườngthường có hàm lượng đường và các chất phụ gia nhân tạo cao, ảnh hưởng tiêu cực đến sức khỏe thận. Lượng đường dư thừa góp phần gây béo phì và kháng insulin - những yếu tố nguy cơ chính thúc đẩybệnh thận. Thay thế thực phẩm này bằng ngũ cốc nguyên hạt như yến mạch, kiều mạch, gạo lứt để cung cấp chất xơ, vitamin và khoáng chất, duy trì chức năng thận tốt hơn. Bánh ngọtvà bánh donutchứa nhiều đường tinh luyện, chất béo không lành mạnh và carbohydrate đơn giản. Những thành phần này có thể gây tăng đột biếnđường huyết, góp phần gây béo phì, tăng thêm áp lực cho thận. Các lựa chọn thay thế tốt hơn như bánh làm từ ngũ cốc nguyên hạt, ít chất béo, thỏa cơn thèm ăn vào buổi sáng đồng thời bảo vệ sức khỏe thận. Bánh ngọtvà bánh donutchứa nhiều đường tinh luyện, chất béo không lành mạnh và carbohydrate đơn giản. Những thành phần này có thể gây tăng đột biếnđường huyết, góp phần gây béo phì, tăng thêm áp lực cho thận. Các lựa chọn thay thế tốt hơn như bánh làm từ ngũ cốc nguyên hạt, ít chất béo, thỏa cơn thèm ăn vào buổi sáng đồng thời bảo vệ sức khỏe thận. Nước ép trái cây đóng chaichứa hàm lượng đường bổ sung cao đồng thời ít chất xơ so với ăn nguyên trái. Lượng chất xơ khiến lượng đường trong máu tăng đột biến, dễ tăng cân. Lựa chọn trái cây nguyên quả hoặc tự làm nước ép ít đường để tận dụng lợi ích tự nhiên của trái cây, giúp thận khỏe theo thời gian. Nước ép trái cây đóng chaichứa hàm lượng đường bổ sung cao đồng thời ít chất xơ so với ăn nguyên trái. Lượng chất xơ khiến lượng đường trong máu tăng đột biến, dễ tăng cân. Lựa chọn trái cây nguyên quả hoặc tự làm nước ép ít đường để tận dụng lợi ích tự nhiên của trái cây, giúp thận khỏe theo thời gian. Bảo Bảo(TheoWebMD)Ảnh:Bảo Bảo, AI","Thứ tư, 17/9/2025, 01:00 (GMT+7)",Bảo Bảo,Sức khỏe,Các bệnh,VN Express,"Bữa sáng với thực phẩm chế biến sẵn, thịt chế biến sẵn, ngũ cốc có đường và bánh ngọt có thể gây hại cho thận do chứa nhiều muối, natri, đường và chất phụ gia. Những thành phần này làm tăng huyết áp, béo phì và kháng insulin, tăng nguy cơ mắc bệnh thận. Thay vào đó, nên lựa chọn bữa sáng với thực phẩm tươi, nguyên hạt và protein lành mạnh như rau, trứng, các loại hạt và yến mạch để bảo vệ chức năng thận."
VNEX_170925_00014,"Messi ghi bàn và kiến tạo, giúp Inter Miami trả hận",https://vnexpress.net/messi-ghi-ban-va-kien-tao-giup-inter-miami-tra-han-4940003.html,"Inter Miami chơi lấn lướt ngay từ đầu trận. Phút 12, sau tình huống Seattle Sounders mất bóng giữa sân, Lionel Messi chuyền từ trung lộ sang cánh trái, tạo điều kiện cho Jordi Alba lao lên sút bật chân thủ môn mở tỷ số. Sau bàn đầu, Inter Miami tiếp tục ép sân. Phút 41, Alba ""trả lễ"" cho Messi bằng quả tạt từ cánh trái, tạo điều kiện cho đội trưởng băng vào đệm bóng nhân đôi cách biệt. Tuyến giữa Seattle Sounders tiếp tục mắc sai lầm mất bóng ở bàn thua thứ hai. Tiền đạo Lionel Messi mừng sau khi ghi bàn cho Inter Miami trong trận tiếp Seattle Sounders ở vòng 31 MLS ngày 16/9/2025 trên sân Fort Lauderdale, Florida, Mỹ. Ảnh: AP Sau hai bàn thua đầu, đội khách sa sút tinh thần. Đến phút 52, Ian Fray đánh đầu từ quả phạt góc, nâng tỷ số lên 3-0 cho Inter Miami. Seattle Sounders chỉ gỡ được một bàn nhờ công Obed Vargas ở phút 69. Trận thắng Seattle Sounders giúp Inter Miami lên thứ năm bảng miền đông MLS, với 49 điểm sau 27 trận.Messivà đồng đội kém đội đầu bảng Philadelphia Union tám điểm, nhưng chơi ít hơn ba trận. Trận thắng sáng 17/9 cũng giúp Inter Miami trả hận Seattle Sounders. Trong trận chung kết Leagues Cup hôm 1/9,Inter Miamithua đội này 0-3. * Tiếp tục cập nhật Thanh Quý","Thứ tư, 17/9/2025, 08:39 (GMT+7)",Thanh Quý,Thể thao,Bóng đá,VN Express,"Inter Miami đã có chiến thắng ấn tượng trước Seattle Sounders với tỷ số 3-1, trong đó Messi và Alba phối hợp ghi 2 bàn thắng quan trọng trong hiệp một. Đội chủ nhà tiếp tục áp đảo và ghi thêm một bàn nữa trong hiệp hai, trước khi đối thủ gỡ được một bàn danh dự. Chiến thắng này giúp Inter Miami vươn lên vị trí thứ năm ở bảng miền Đông MLS và trả lại món nợ thua trận trước đó."
VNEX_170925_00020,De Zerbi: 'Quả phạt đền thứ hai của Real đáng xấu hổ',https://vnexpress.net/de-zerbi-qua-phat-den-thu-hai-cua-real-dang-xau-ho-4939958.html,"""Quả phạt đền thứ hai của Real có phần đáng xấu hổ"", De Zerbi nói. ""Nó không phải và không bao giờ là một quả phạt đền. Tôi vẫn sẽ nói như vậy ngay cả khi nó có lợi cho đội của tôi"". Tối 16/9, Marseille suýt giành điểm trong trận ra quân Champions League trên sân Bernabeu. Đội bóng của HLV De Zerbi mở tỷ số ở phút 22, khi Mason Greenwood kiến tạo cho Timothy Weah trong vòng cấm. Nhưng sau đó, Real thắng ngược bằng hai quả phạt đền của Kylian Mbappe. Mbappe (giữa) mừng bàn quyết định trong trận Real 2-1 Marseille tối 16/9. Ảnh:AFP Trọng tài Irfan Peljto thổi quả đầu tiên khi Kondogbia phạm lỗi với Rodrygo ở phút 27. Đến phút 79, ông thổi quả thứ hai khi Facundo Medina để bóng chạm tay trong vòng cấm. Medina thực hiện cú tắc chính xác đối với Vinicius, nhưng để bóng chạm tay khi cơ thể tiếp đất theo quán tính. Giữa hai quả phạt đền, trọng tài Peljto phạt thẻ đỏ đối với Dani Carvajal. Đội trưởng Real bị phạt khi húc nhẹ vào đầu thủ môn Geromino Rulli trong tình huống tranh cãi ở phút 72. ""Khi tôi nói quả phạt đền thứ hai đáng xấu hổ, tôi không hề có suy nghĩ đằng sau nào, kiểu như nó là sự đền bù cho Real vì đã đuổi Carvajal"", De Zerbi nói thêm. HLV củaMarseillethậm chí không đồng tình với việc trọng tài đuổi Carvajal. Ông cho rằng đội trưởng Real chỉ nghiêng đầu mà không thực sự ra đòn. ""Tôi không coi đó là bạo lực"", De Zerbi nói thêm. ""Khi ai đó nghiêng đầu mà không ra đòn, tôi sẽ không phạt thẻ đỏ"". Về quả phạt đền thứ hai củaReal, cựu trọng tài người Tây Ban Nha, Perez Burull không đồng tình với quyết định của trọng tài Peljto. Ông cho rằng Medina ngã xuống đất là hành động tự nhiên và không phạm luật. ""Cầu thủ ngã xuống đất và tay anh ta không chủ ý hướng tới bóng"", Burull nói trênRadio Marca. Về thẻ đỏ của Carvajal, cựu trọng tài thừa nhận cú húc đầu không quá mạnh, nhưng đáng bị coi là một pha phạm lỗi không bóng. Do đó, ông khẳng định việc bị truất quyền thi đấu là đúng. ""Bạn có thể nổi giận, nhưng không thể hành động như vậy"", Burull nói thêm. Thanh Quý(theoMarca, MD)","Thứ tư, 17/9/2025, 07:42 (GMT+7)",Thanh Quý,Thể thao,Bóng đá,VN Express,"HLV De Zerbi của Marseille cho rằng quả phạt đền thứ hai của Real Madrid là ""đáng xấu hổ"" và không đáng thổi, ngay cả khi nó mang lại lợi thế cho đội của ông. Trong trận đấu đó, Marseille đã thua ngược Real Madrid 2-1, với cả hai bàn thắng của Real đều đến từ các quả phạt đền gây tranh cãi. Bên cạnh đó, De Zerbi cũng không đồng tình với việc truất quyền thi đấu của Carvajal bên phía Real Madrid, trong khi cựu trọng tài Perez Burull lại cho rằng thẻ đỏ là hợp lý."
VNEX_170925_00101,Lotte sẽ mở thêm 3 trung tâm thương mại cao cấp tại Việt Nam,https://vnexpress.net/lotte-se-mo-them-3-trung-tam-thuong-mai-cao-cap-tai-viet-nam-4939933.html,"Kế hoạch trên được ông Kim Sang-hyun, Phó chủ tịch, kiêm Giám đốc điều hành Lotte Shopping chia sẻ tại một sự kiện ở Seoul hôm 15/9. ""Đến năm 2030, chúng tôi sẽ khai trương thêm hai đến ba tổ hợp thương mại tại Việt Nam tương tự Lotte Mall West Lake đã ra mắt vào tháng 9/2023 ở Hà Nội"", ông Kim Sang-hyun nói. Tập đoàn lớn thứ năm của Hàn Quốc đã thành công với tổ hợp ở Tây Hồ Tây. Trung tâm thương mại này của Lotte có tổng diện tích mặt sàn khoảng 354.00 m2, tạo được nhiều sự khác biệt với các cơ sở khác tại Việt Nam. Trong số 233 cửa hàng tại khu phức hợp, 40% là các thương hiệu trước đây chưa từng có mặt tại Hà Nội. Nhiều nhãn hàng cao cấp như Chanel Beauty, Lancome, Coach đã khai trương cửa hàng tại đây. Doanh số lũy kế Lotte Mall West Lake đạt hơn 300 tỷ won vào cuối tháng 12/2024. Từ khi lúc khai trương đến cuối năm ngoái, trung tâm thương mại này đã đón 12 triệu lượt khách. Lotte đặt mục tiêu phát triển thêm trung tâm thương mại trong bối cảnh đang nhắm đến phân khúc khách hàng cao cấp tại Việt Nam. Họ áp dụng phong cách tiếp thị Hàn Quốc, cũng như tận dụng sức hút ngày càng tăng của ẩm thực, văn hóa nước này. Tại Hà Nội, Lotte còn có một trung tâm thương mại khác ở Liễu Giai. Việt Nam được coi là thị trường quan trọng thứ ba của Lotte sau Hàn Quốc và Nhật Bản. Chaebol này cũng có hàng trăm cửa hàng đồ ăn nhanh Lotteria và 15 siêu thị Lotte Mart tại Việt Nam. Tại khu vực Đông Nam Á, ngoài Việt Nam, Lotte cũng có kế hoạch tăng hiện diện ở Indonesia. Năm 2018, Lotte trở thành nhà bán lẻ Hàn Quốc đầu tiên gia nhập Indonesia. Hiện tập đoàn này vận hành 48 siêu thị Lotte Mart và một trung tâm thương mại tại quốc gia này. Anh Tú(theo Korea Economic Daily)","Thứ tư, 17/9/2025, 04:45 (GMT+7)",Anh Tú,Bất động sản,Thị trường,VN Express,"Lotte Shopping, sau thành công của Lotte Mall West Lake tại Hà Nội, có kế hoạch mở thêm 2-3 tổ hợp thương mại tương tự tại Việt Nam vào năm 2030, nhắm đến phân khúc khách hàng cao cấp và tận dụng sức hút của văn hóa Hàn Quốc. Việt Nam là thị trường quan trọng thứ ba của Lotte, nơi tập đoàn này đã có nhiều cửa hàng Lotteria và Lotte Mart. Ngoài Việt Nam, Lotte cũng có kế hoạch mở rộng sự hiện diện tại Indonesia."
