id,title,link,content,date,author,category,sub_category,source,summary
VNEX_011025_00014,Hãng chip tỷ USD của Mỹ đẩy mạnh tuyển kỹ sư ở Việt Nam,https://vnexpress.net/hang-chip-ty-usd-cua-my-day-manh-tuyen-ky-su-o-viet-nam-4945726.html,"Thông tin được công bố nhân dịp Marvell vận hành 3 văn phòng mới tại TP HCM và Đà Nẵng hôm 30/9. Trong đó, văn phòng đặt tại eTown6 (TP HCM) đóng vai trò trung tâm nghiên cứu và kiểm thử (lab) các sản phẩm kết nối tốc độ cao. Ông Lê Quang Đạm, Tổng giám đốc Marvell Việt Nam cho biết hoạt động tại Việt Nam đã phát triển nhanh chóng, chính thức trở thành trung tâm nghiên cứu và phát triển (R&D) lớn thứ ba trên thế giới của hãng với hơn 500 kỹ sư. Nhân sự làm việc tại Marvell Việt Nam. Ảnhcông ty cung cấp Hiện 75% nhân sự của Marvell Việt Nam đến từ các trường đại học, thông qua phối hợp đào tạo sinh viên, đặc biệt là các môn chuyên ngành vi mạch bán dẫn. Vào tháng 4, công ty bắt tay Trường Đại học Bách khoa TP HCM tùy chỉnh chương trình đào tạo phù hợp hơn với nhu cầu thực tế của ngành này và đưa kỹ sư Marvell tham gia giảng dạy. ""Chúng tôi dự kiến mở rộng mô hình hợp tác này đến các trường đại học khác tại TP HCM và Đà Nẵng"", ông nói. 25% nhân sự còn lại là các kỹ sư có kinh nghiệm trong nước, quốc tế. Họ có chính sách hỗ trợ và thu hút nhân tài toàn cầu để mang đến góc nhìn mới và chuyên môn sâu cho đội ngũ. Vốn hóa hiện 71,5 tỷ USD, Marvell là nhà thiết kế vi mạch và bán dẫn phục vụ cơ sở hạ tầng dữ liệu, niêm yết trên sàn Nasdaq (Mỹ). Họ đến Việt Nam năm 2013 với 5 kỹ sư, đặt văn phòng tại khu chế xuất Tân Thuận, TP HCM. Ban đầu, nhóm kỹ sư này chủ yếu tập trung kiểm định, sau đó dần tham gia vào toàn bộ quy trình thiết kế vi mạch (IC). Năm 2023, hãng tăng trưởng 50% đội ngũ kỹ sư. Sau 2 năm, Việt Nam vượt Israel thành trung tâm nghiên cứu và phát triễn (R&D) lớn thứ ba của Marvell, sau Mỹ và Ấn Độ. Trước đây, để kiểm thử các sản phẩm kết nối tốc độ cao từ 200 GB đến 1,6 TB, Marvell Việt Nam gửi mẫu sang các phòng thí nghiệm tại Mỹ, Đài Loan hoặc Singapore. Hiện với lab mới ở eTown6, các kỹ sư trực tiếp kiểm tra sản phẩm họ thiết kế nhanh chóng, không gián đoạn. Ông Đạm nói các kỹ sư Việt đang tham gia vào những dự án công nghệ tiên tiến và phức tạp nhất. Ví dụ, con chip kết nối quang học ODSP tốc độ 1,6 TB một giây dùng trong trung tâm dữ liệu của hãng do đội ngũ kỹ sư Việt Nam đảm trách gần như toàn bộ quá trình từ khâu thiết kế. Viễn Thông","Thứ tư, 1/10/2025, 06:30 (GMT+7)",Viễn Thông,Kinh doanh,Doanh nghiệp,VN Express,
VNEX_011025_00009,Đại sứ Nam Phi tại Pháp tử vong trong khách sạn,https://vnexpress.net/dai-su-nam-phi-tai-phap-tu-vong-trong-khach-san-4945748.html,"Thi thể của ông Mthethwa được một nhân viên an ninh phát hiện trong sân của khách sạn Hyatt ở Paris vào ngày 30/9. Trong căn phòng của ông tại tầng 22, cửa sổ bị cạy bằng một chiếc kéo được tìm thấy tại hiện trường. Theo công tố viên Laure Beccuau, vợ ông Mthethwa gặp chồng lần cuối vào chiều 29/9, trước khi ông đi dự tiệc. Đến đêm đó, bà nhận được tin nhắn xin lỗi từ ông, trong đó thể hiện rõ ý định tự sát. ""Các kết quả điều tra ban đầu cho thấy đây có thể là hành động có chủ ý, không có sự can thiệp của bên thứ ba"", bà Beccuau nói, đồng thời nhấn mạnh cuộc điều tra vẫn tiếp tục để làm rõ. Ông Nkosinathi Emmanuel Nathi Mthethwa phát biểu tại Nam Phi vào tháng 2/2014, khi còn giữ chức bộ trưởng cảnh sát. Ảnh:AFP Bộ Ngoại giao Nam Phi xác nhận thông tin ông Mthethwa đã thiệt mạng, gọi sự ra đi của đại sứ tại Pháp là mất mát của cả quốc gia. ""Đại sứ Mthethwa đã cống hiến cho đất nước ở nhiều cương vị, nhưng sự nghiệp ấy đã kết thúc quá sớm và đầy bi kịch"", Tổng thống Nam Phi Cyril Ramaphosa bày tỏ đau buồn. Ông Mthethwa giữ chức đại sứ Nam Phi tại Pháp từ tháng 12/2023. Ông là một chính khách kỳ cựu, từng giữ nhiều chức vụ quan trọng trong chính phủ Nam Phi như bộ trưởng văn hóa, bộ trưởng thể thao và bộ trưởng cảnh sát. Ngoài ra, ông còn góp mặt trong ban tổ chức World Cup 2010 tại Nam Phi. Ông cũng là thành viên cấp cao của đảng Đại hội Dân tộc Phi (ANC) trong giai đoạn 2007–2022, từng tham gia hoạt động bí mật trong cánh vũ trang ANC thời kỳ chống chủ nghĩa apartheid và bị bắt giam năm 1989. Thanh Danh(TheoAFP, Reuters)","Thứ tư, 1/10/2025, 06:50 (GMT+7)",Thanh Danh,Thế giới,Quân sự,VN Express,
VNEX_011025_00027,Kane giúp Bayern thắng lớn ở Champions League,https://vnexpress.net/kane-giup-bayern-thang-lon-o-champions-league-4945737.html,"Bayerntoàn thắng 6 lần đối đầu với các đội Cyprus, ghi tới 31 và chỉ thủng lưới hai bàn. ""Hùm xám"" tiếp tục thể hiện sự vượt trội trong lần đầu gặp Pafos tại Alphamega hôm 30/9. Harry Kane mừng bàn mở tỷ số trong trận Bayern thắng Pafos 5-1 ở lượt hai Champions League trên sân Alphamega, Kolossi, Quận Limassol, Cyprus ngày 30/9/2025. Ảnh:Reuters Đội khách ra sân với ""song sát"" Harry Kane, Nicolas Jackson và bộ đôi tiền đạo này thay nhau tỏa sáng, góp dấu giày vào cả năm bàn. Phút 15, Michael Olise chọc khe để Kane thoát xuống dứt điểm chân phải chéo góc mở tỷ số. 5 phút sau, Jackson làm tường để Raphael Guerreiro xâm nhập vòng cấm rồi sút tung lưới Pafos, nhân đôi cách biệt. Guerreiro ghi bàn đầu tiên ở Champions League kể từtrận thắng Dinamo Zagreb 9-2hồi tháng 9/2024. Các cầu thủ Bayern mừng bàn của Nicolas Jackson. Ảnh:FC Bayern Phút 31, lại là Michael Olise đột phá bên cánh phải rồi chuyền vào vòng cấm để Jackson đá nối nâng tỷ số lên 3-0. Đây lần lượt là pha kiến tạo và bàn thắng đầu tiên của tiền đạo người Senegal, sau khi rời Chelsea để chuyển đến Bayerntheo hợp đồng cho mượn. Ở pha lên bóng ngay sau đó,Kanesút chân trái cận thành, giúp Bayern bước vào giờ nghỉ với lợi thế dẫn bốn bàn. Tiền đạo người Anh ghi 21 bàn qua 26 trận ở Champions League cho Bayern, cân bằng thành tích qua 32 trận khoác áo Tottenham. Kane nâng thành tích lên 18 bàn qua 9 trận trên mọi đấu trường mùa này, đạt hiệu suất hai bàn mỗi trận. Đây cũng là lần thứ 26 anh ghi ít nhất hai bàn trong một trận đấu cho Bayern. Michael Olise (giữa) chia vui cùng Serge Gnabry và Aleksandar Pavlovic sau khi ghi bàn. Ảnh:Imago Phút 68, Jackson lỡ cơ hội đối mặt, rồi Olise ập vào đá bồi tung lưới chủ nhà. Với một bàn, hai kiến tạo, Olise lần thứ hai góp dấu giày vào ba bàn trong một trận tại Champions League, kể từtrận thắng Shakhtar 5-1hồi tháng 12/2024 (2 bàn, 1 kiến tạo). Kết quả 5-1 giúp Bayern nối dài mạch toàn thắng 9 trận từ đầu mùa. Cụ thể, ""Hùm xám"" giành 15 điểm tuyệt đối tại Bundesliga, thắng cả hai lượt đầu Champions League,hạ Wehen Wiesbaden 3-2tại vòng một Cup Đức vàđánh bại Stuttgart 2-1ở trận tranh Siêu Cup Đức. Hồng Duy","Thứ tư, 1/10/2025, 05:22 (GMT+7)",Hồng Duy,Thể thao,Bóng đá,VN Express,
VNEX_011025_00007,Bộ trưởng Hegseth chỉ trích 'tướng béo' khi gặp hàng trăm chỉ huy quân đội,https://vnexpress.net/bo-truong-hegseth-chi-trich-tuong-beo-khi-gap-hang-tram-chi-huy-quan-doi-4945763.html,"""Tôi hoàn toàn không thể chấp nhận hình ảnh các tướng béo trong Lầu Năm Góc. Đây là điều tệ hại cho hình ảnh của chúng ta"", Bộ trưởng Quốc phòng Mỹ Pete Hegseth nói trong cuộc gặp hàng trăm tướng lĩnh Mỹ hôm 30/9 tại căn cứ Thủy quân lục chiến Quantico ở bang Virginia. Ông tuyên bố từ nay toàn bộ quân nhân Mỹ, bất kể cấp bậc, sẽ phải tuân thủ các bài kiểm tra thể lực và tiêu chuẩn về chiều cao, cân nặng hai lần mỗi năm, đồng thời cảnh báo những người không đồng thuận nên tự nguyện từ chức. ""Mọi công việc của chúng ta đều bắt đầu từ thể lực và phong thái. Nếu Bộ trưởng Quốc phòng có thể rèn luyện thể lực thường xuyên, mọi cá nhân trong quân ngũ đều có thể làm như tôi"", ông nói. ""Thật sự thì tôi đã quá ngán ngẩm việc nhìn thấy lính béo mỗi khi thị sát các đội hình tác chiến hay bất kỳ nhiệm vụ nào khác"". Bộ trưởng Quốc phòng Mỹ Pete Hegseth phát biểu trước tướng lĩnh ngày 30/9. Ảnh:AFP Ông chỉ trích chính sách đa dạng hóa trong quân đội từ những đời chính phủ trước. Lãnh đạo Lầu Năm Góc khẳng định từ giờ chỉ áp dụng ""chuẩn nam giới cao nhất"" cho các đơn vị tác chiến. ""Những lãnh đạo chính trị ngớ ngẩn và liều lĩnh đã đặt ra kim chỉ nam sai lầm khiến chúng ta lạc lối. Chúng ta đã trở thành 'Bộ Thức tỉnh (Woke)'"", ông nói. Ông tuyên bố sẽ kết thúc ""thời kỳ xuống cấp"" của quân đội với những gì ông gọi là ""văn hóa woke"", từ các tháng lễ hội bản sắc, việc làm ngơ cho quân nhân để râu, văn phòng đa dạng và hòa nhập (DEI) đến các chính sách liên quan giới tính. ""Woke"" là từ thường được sử dụng tại Mỹ, nói về việc nâng cao nhận thức về các định kiến trong xã hội như phân biệt chủng tộc, giới tính hay kỳ thị cộng đồng LGBTQ+... ""Kể từ thời khắc này, sứ mệnh duy nhất của cơ quan vừa được khôi phục, mang tên Bộ Chiến tranh, chính là đánh trận"", Bộ trưởng Hegseth nói, đề cập tên gọi mới của Bộ Quốc phòng Mỹ theo sắc lệnh tháng 9 từ Tổng thống Donald Trump. ""Chúng ta cần chuẩn bị cho chiến tranh và chuẩn bị cho chiến thắng, không được nghỉ ngơi và không có thỏa hiệp. Chúng ta làm điều này không phải vì hiếu chiến, mà chính vì chúng ta yêu hòa bình"", ông nói. Tổng thống Trump cũng có bài phát biểu dài hơn một tiếng tại sự kiện. Ông nhiều lần khẳng định sẽ loại bỏ các chính sách ""né tránh nhạy cảm chính trị"" trong quân đội, tuyên bố sẽ đánh giá mọi thứ dựa trên năng lực. ""Sẽ không ai có thể thay thế quý vị chỉ vì họ giỏi hơn về mặt né tránh các vấn đề nhạy cảm chính trị. Tôi sẽ sát cánh với quý vị và ủng hộ 100% với tư cách Tổng thống "", ông Trump nói. Hàng trăm tướng lĩnh Mỹ có mặt tại căn cứ Thủy quân lục chiến Quantico ở bang Virginia ngày 30/9. Ảnh:AFP Tổng thống đồng thời đề xuất các tướng coi loạt thành phố Mỹ mà Lầu Năm Góc triển khai quân tới làm nhiệm vụ trị an tại tương đương ""thao trường"" tác chiến. Ông nhắc lại kế hoạch đưa Vệ binh Quốc gia tới Portland, Los Angeles và sắp tới là Chicago, bất chấp phản đối từ chính quyền địa phương. ""Chúng ta đang bị xâm lược từ bên trong, bởi những người nhập cư bất hợp pháp"", ông Trump tuyên bố, ví họ như ""kẻ thù ngoại bang nhưng nguy hiểm hơn vì không mặc quân phục"". Bộ trưởng Hegseth ngày 25/9 yêu cầu hàng trăm tướng lĩnh Mỹ đang làm nhiệm vụ, trong đó có các chỉ huy đang triển khai trên khắp thế giới, về nước dự họp tại căn cứ Thủy quân lục chiến Quantico ở bang Virginia. Đây là sự kiện chưa từng có, buộc nhiều sĩ quan cấp cao phải di chuyển hàng nghìn km tới nơi tổ chức trong thời gian ngắn. Ông Hegseth trước đó tuyên bố sẽ giảm 20% lượng sĩ quan cấp tướng và từng cách chức khoảng 20 sĩ quan cấp cao. Ông đang xem xét hạ cấp chỉ huy tại một số đơn vị từ đại tướng xuống trung tướng, đề xuất hợp nhất các bộ tư lệnh tác chiến để tập trung vào khu vực châu Phi, Trung Đông, Ấn Độ Dương - Thái Bình Dương. Kể từ khi Tổng thống Trump nhậm chức, Lầu Năm Góc trải qua hàng loạt biến động. Nhiều tướng lĩnh bị sa thải, nhiều đầu sách bị cấm đưa vào thư viện quân đội. Ông Trump cũng tăng đầu tư ngân sách cho quốc phòng lên 1.000 tỷ USD thông qua Đạo luật To đẹp (OBBA) hồi tháng 7, cho khởi động nghiên cứu nhiều loại vũ khí mới. Sự kiện đã làm dấy lên nhiều chỉ trích từ đảng Dân chủ. Thống đốc bang Illinois JB Pritzker gọi các ngôn từ của Tổng thống Trump kích động chia rẽ, trong khi thượng nghị sĩ Jack Reed, thành viên cao cấp của Ủy ban Quân vụ Thượng viện, cho rằng thông điệp mà ông Trump phát đi tại sự kiện là ""lòng trung thành đảng phái quan trọng hơn năng lực, bản lĩnh hay sự tận hiến phục vụ"". Thanh Danh(TheoReuters, Newsweek, AP)","Thứ tư, 1/10/2025, 07:57 (GMT+7)",Thanh Danh,Thế giới,Quân sự,VN Express,
VNEX_011025_00081,Vì sao polyp hình thành trong mũi?,https://vnexpress.net/vi-sao-polyp-hinh-thanh-trong-mui-4945826.html,"Trả lời: Polyp mũi là khối mềm, nhẵn, lành tính trong hốc mũi và thường không gây đau. Polyp gây nghẹt mũi, giảm hoặc mất khứu giác; các triệu chứng thứ phát gồm khạc đờm, đau mặt, nhức đầu, rối loạn giấc ngủ. Polyp mũi hình thành từ các phản ứng viêm kéo dài trong niêm mạc mũi xoang. Khi cơ thể bị nhiễm virus, vi khuẩn, dị ứng hoặc kích hoạt phản ứng miễn dịch chống lại nấm, niêm mạc sẽ phù nề, thấm dịch và dần thoái hóa thành nhiều ổ tổn thương. Quá trình viêm mạn tính này khiến niêm mạc dày lên, sa xuống, lâu ngày phát triển thành polyp mũi. Các yếu tố làm tăng nguy cơ polyp mũi như viêm xoang mạn tính,viêm mũi dị ứng, hen suyễn, xơ nang (rối loạn di truyền do sự sản xuất và tiết ra chất dịch bất thường từ mũi xoang), hội chứng Churg - Strauss, nhạy cảm với các thuốc kháng viêm không steroid, di truyền. Bác sĩ Hằng nội soi mũi cho một người bệnh. Ảnh minh họa:Bệnh viện Đa khoa Tâm Anh Có 4 mức độ polyp mũi theo kích thước, tình trạng tiến triển qua các giai đoạn khác nhau. Mức độ một, polyp kích thước nhỏ, mềm, nằm gọn trong khe giữa mũi. Mức độ hai, polyp kích thước vừa phải, chiếm hết khe giữa mũi và chạm tới cuốn mũi giữa. Mức độ ba, kích thước của polyp to, chạm tới lưng cuốn mũi dưới gây nghẹt thở, rối loạn khứu giác. Mức độ 4, polyp mũi phình rất to, lấp kín gần hết hốc mũi và thò tới cửa lỗ mũi. Polyp mũikhông tự biến mất nếu không được điều trị. Ngược lại, nó phát triển theo thời gian, gây ảnh hưởng tới sức khỏe, chất lượng sống của người bệnh. Bạn nên đi khám để bác sĩ kiểm tra polyp đang ở mức độ nào. Bạn có thể được điều trị nội khoa, nếu không đáp ứng, tùy thuộc vị trí, kích thước và số lượng polyp, bác sĩ có thể chỉ định phẫu thuật cắt polyp mũi hoặc phẫu thuật nội soi mũi xoang cắt polyp và mở rộng lỗ thông xoang bị tắc. Để phòng ngừapolyp mũi tái phátsau phẫu thuật, người bệnh nên vệ sinh mũi bằng nước muối sinh lý hàng ngày để tránh viêm nhiễm, dùng thuốc xịt mũi theo đúng chỉ định, tránh các chất gây kích thích mũi xoang. Vệ sinh môi trường sống sạch sẽ, kiểm soát tình trạng dị ứng và hen suyễn cũng giúp phòng polyp mũi tái phát. ThS.BS.CKII Trần Thị Thúy HằngTrưởng khoa Tai Mũi HọngTrung tâm Tai Mũi HọngBệnh viện Đa khoa Tâm Anh TP HCM","Thứ tư, 1/10/2025, 10:00 (GMT+7)",ThS.BS.CKII Trần Thị Thúy Hằng,Sức khỏe,Các bệnh,VN Express,
VNEX_011025_00005,Nepal chọn bé gái hai tuổi làm thánh nữ,https://vnexpress.net/nepal-chon-be-gai-hai-tuoi-lam-thanh-nu-4945781.html,"Aryatara Shakya được người thân bế từ ngôi nhà trong ngõ hẻm ở Kathmandu đến đền thờ hôm 30/9, trong lễ hội Hindu dài nhất và quan trọng nhất ở Nepal. Cô bé được chọn làm Kumari mới, tức thánh nữ đồng trinh. Gia đình, bạn bè và các tín đồ đã rước Aryatara Shakya đi qua phố phường Kathmandu trước khi tiến vào đền thờ, nơi sẽ trở thành nhà của cô bé trong vài năm tới. Aryatara Shakya, hai tuổi 8 tháng, được bố bế tới đền Thánh nữ ở Kathmandu ngày 30/9. Ảnh:AFP Các tín đồ xếp hàng để áp trán lên chân cô bé, dấu hiệu tôn kính cao nhất trong tín ngưỡng Hindu tại quốc gia vùng Himalaya này, và dâng hoa cùng tiền. Kumari mới sẽ ban phước lành cho các tín đồ, trong đó có Tổng thống, vào 2/10. ""Đến hôm qua, cháu vẫn chỉ là con gái tôi, nhưng hôm nay cháu đã là thánh nữ"", cha của cô bé, ông Ananta Shakya, nói. Ông cho biết từ trước khi Aryatara Shakya sinh ra, đã có dấu hiệu cho thấy con gái là thánh nữ tương lai. ""Khi mang thai, vợ tôi đã mơ thấy con bé là thánh nữ và chúng tôi biết rằng con sẽ trở thành một người rất đặc biệt"", ông nói. Trishna Shakya, Kumari tiền nhiệm, hiện 11 tuổi, rời đi từ cửa hậu ngôi đền trên một chiếc kiệu do gia đình và tín đồ khiêng. Cô bé trở thành thánh nữ năm 2017 và trở thành người phàm khi đến tuổi dậy thì. Bố mẹ của tân thánh nữ bế con gái trong nhà riêng ở Kathmandu, trước giờ khởi hành tới đền Thánh nữ hôm 30/9. Ảnh:AP Các thánh nữ Kumari thường được chọn từ những gia tộc Shakya thuộc cộng đồng Newar, dân bản địa tại thung lũng Kathmandu, và được các tín đồ Hindu lẫn đạo Phật tôn kính. Các bé gái trong danh sách lựa chọn đều ở độ tuổi từ 2 đến 4 và phải có làn da, mái tóc, đôi mắt và hàm răng hoàn hảo, không tì vết, không được sợ bóng tối. Kumari luôn mặc trang phục màu đỏ, búi tóc thành một búi trên đỉnh đầu và vẽ con mắt thứ ba trên trán. Các gia đình thuộc gia tộc Shakya đủ điều kiện cho vị trí danh giá này đều cạnh tranh để con gái mình được chọn. Gia đình của Kumari được chọn sẽ có địa vị xã hội và địa vị trong gia tộc cao hơn. Nhưng Kumari phải sống một cuộc sống tách biệt. Họ chỉ có vài người bạn chơi được lựa chọn và chỉ được phép ra ngoài vài lần trong năm vào các lễ hội. Du khách đứng đợi để chiêm ngưỡng tân thánh nữ trong lễ rước đến đền thờ ở Kathmandu hôm 30/9. Ảnh:AP Các Kumari thường gặp khó khăn, khó thích nghi với cuộc sống bình thường, phải học cách làm việc nhà và theo học tại các trường bình thường. Theo truyền thuyết Nepal, đàn ông kết hôn với người từng làm Kumari sẽ chết trẻ nên nhiều cô gái lựa chọn độc thân. Trong vài năm gần đây, truyền thống này đã dần thay đổi. Kumari bây giờ được phép học tập trong đền thờ, do gia sư dạy dỗ, thậm chí được xem tivi. Chính phủ cấp cho các cựu Kumari một khoản trợ cấp nhỏ hàng tháng khoảng 110 USD, cao hơn một chút so với mức lương tối thiểu. Hồng Hạnh(TheoAP)","Thứ tư, 1/10/2025, 09:38 (GMT+7)",Hồng Hạnh,Thế giới,Cuộc sống đó đây,VN Express,
VNEX_011025_00084,Dấu hiệu thiếu máu não thường gặp,https://vnexpress.net/dau-hieu-thieu-mau-nao-thuong-gap-4945442.html,"Thiếu máu não là tình trạng lưu lượng máu cung cấp cho não bị hạn chế, khiến các tế bào não không nhận đủ oxy và dưỡng chất cần thiết, ảnh hưởng đến hoạt động của tế bào thần kinh và chức năng của não. Triệu chứng thiếu máu não rất đa dạng. Bác sĩ Hoàng Quyết Tiến, Trung tâm Thông tin Y khoa, Bệnh viện Đa khoa Tâm Anh TP HCM, chỉ ra một số dấu hiệu thiếu máu não phổ biến. Đau đầu Đau đầu là dấu hiệu thường gặp nhất của tình trạng thiếu máu não nhưng dễ nhầm lẫn với bệnh lý khác. Cơn đau đầu do thiếu máu não có thể xảy ra trong vài phút hoặc kéo dài vài giờ, cường độ tăng dần. Cảm giác đau nhói xuất hiện ở một hoặc nhiều khu vực trên đầu. Mất ngủ Người bệnh thường gặp tình trạng ngủ chập chờn, ngủ không sâu giấc, dễ tỉnh giấc giữa đêm hoặc khó ngủ lại. Nguyên nhân do não không được cung cấp đủ lượng máu cần thiết, gây ảnh hưởng đến hệ thần kinh và chu kỳ giấc ngủ. Suy giảm trí nhớ Ngườibị thiếu máu nãothường cảm thấy thiếu sức lực, mệt mỏi, mất khả năng tập trung, chú ý kém khiến hiệu quả làm việc, học tập sa sút. Tình trạng này do tế bào thần kinh não bị thiếu oxy và các chất dinh dưỡng cần thiết cho hoạt động bình thường. Lâu dần gây tổn thương tế bào thần kinh, dẫn đến suy giảm chức năng. Chóng mặt, đau đầu là những dấu hiệu cảnh báo thiếu máu não.Ảnh được tạo bởi AI Hoa mắt, chóng mặt Những biểu hiện điển hình như nhìn mọi vật xung quanh bị mờ nhòe hoặc cảm giác xây xẩm, có thể đi kèm với cảm giác buồn nôn và nôn.Các cơn chóng mặtcó thể chỉ ngắn vài phút, có khi kéo dài đến vài ngày. Ù tai, nghe kém Theo bác sĩ Tiến, tình trạng giảm lưu lượng máu đến não và các cơ quan như tiền đình ốc tai, các cơ điều tiết mắt... có thể dẫn đến ù tai, mờ mắt, tầm nhìn kém. Tê bì chân, tay Khi các vùng não kiểm soát cảm giác của cơ thể bị thiếu máu thường gây rối loạn cảm giác. Triệu chứng gồm đau, tê, buốt, châm chích, kiến bò... Theo bác sĩ Tiến, để phòng thiếu máu lên não, mỗi người cần xây dựng chế độ ăn uống, sinh hoạt, tập luyện khoa học. Khi có dấu hiệu của thiếu máu não, cần sớm đến bệnh viện để bác sĩ chuyên khoa thần kinh để được khám và điều trị kịp thời. Bổ sung các dưỡng chất thiên nhiên từ blueberry (việt quất), ginkgo biloba (bạch quả) thúc đẩy tăng cường máu lên não, giảmđau đầu, chóng mặt và suy giảm trí nhớ do thiếu máu não. Đình Diệu","Thứ tư, 1/10/2025, 10:00 (GMT+7)",Đình Diệu,Sức khỏe,Các bệnh,VN Express,
