id,title,link,content,date,author,category,sub_category,source,summary
VNEX_261125_00004,Nhà Trắng bác tin ông Trump tính cách chức Giám đốc FBI,https://vnexpress.net/nha-trang-bac-tin-ong-trump-tinh-cach-chuc-giam-doc-fbi-4986174.html,"Truyền thông Mỹ ngày 25/11 dẫn các nguồn tin cho biết Tổng thống Donald Trump và các trợ lý hàng đầu của ông ngày càng thất vọng trước những vấn đề tiêu cực mà Giám đốc FBI Kash Patel tạo ra. Nhóm trợ lý nói với đồng minh của họ rằng Tổng thống đang cân nhắc cách chức Patel vào giữa tháng sau và xem xét lựa chọn quan chức cấp cao FBI Andrew Bailey lên thay thế. Thư ký báo chí Nhà Trắng Karoline Leavitt đăng trên X rằng thông tin này ""hoàn toàn bịa đặt"", kèm theo bức ảnh ông Trump và ông Patel tại Phòng Bầu dục ngày 25/11. Theo bà Leavitt, Tổng thống Trump và Giám đốc FBI Patel đang họp khi thông tin về việc cách chức xuất hiện trên truyền thông. Tổng thống cười và nói: ""Gì cơ? Chuyện này hoàn toàn sai sự thật. Nào Kash, chụp một bức ảnh để mọi người thấy anh đang làm rất tốt!"". Tổng thống Mỹ Donald Trump (phải) và Giám đốc FBI Kash Patel tại Phòng Bầu dục, Nhà Trắng ngày 25/11. Ảnh:Nhà Trắng Trong một thông cáo khác gửi tới báo chí, Nhà Trắng ca ngợi những đóng góp của ông Patel. ""Tổng thống Trump đã tập hợp được một chính quyền tài năng, ấn tượng nhất trong lịch sử, và họ đang thực hiện xuất sắc chương trình nghị sự của Tổng thống. Giám đốc FBI Patel là thành viên chủ chốt trong đội ngũ và ông đang làm việc không ngừng nghỉ để khôi phục uy tín cho FBI"", Nhà Trắng cho hay. Ông Patel đã bị cả cánh tả lẫn cánh hữu ở Mỹ chỉ trích kể từ khi được Tổng thống Trump bổ nhiệm làm giám đốc FBI, cơ quan hành pháp hàng đầu của đất nước. Patel khiến những người trung thành với Tổng thống tức giận khi hồi tháng 7 công bố một bản ghi nhớ khiến cuộc điều tra về tỷ phú ấu dâm Jeffrey Esptein về cơ bản đã khép lại. Một số người ủng hộ ông Trump tin rằng giới tinh hoa thuộc ""nhà nước ngầm"" đã bảo vệ những người thân cận với tỷ phú ấu dâm trong nội bộ đảng Dân chủ và Hollywood. Fox Newshồi tháng 9 đưa tin quan hệ giữa giám đốc FBI và Bộ trưởng Tư pháp Pam Bondi đặc biệt căng thẳng, dù ông vẫn nhận được tín nhiệm của Nhà Trắng. Ông Patel cũng bị chỉ trích sau vụ nhà hoạt động bảo thủ Charlie Kirk bị ám sát tại trường đại học ở bang Utah. Giám đốc FBI ban đầu thông báo bắt được nghi phạm khoảng vài giờ sau vụ nổ súng, song sau đó thừa nhận đã bắt nhầm và trả tự do cho người này. Cuối cùng, nghi phạm thực sự bị bắt sau 33 giờ truy lùng. Huyền Lê(TheoReuters,Fox News)","Thứ tư, 26/11/2025, 07:44 (GMT+7)",Huyền Lê,Thế giới,Cuộc sống đó đây,VN Express,
VNEX_261125_00007,Ông Trump muốn gửi tiền cho dân để bỏ Obamacare,https://vnexpress.net/ong-trump-muon-gui-tien-cho-dan-de-bo-obamacare-4985713.html,"Sau khi giải được bài toán đóng cửa chính phủ, Tổng thống Donald Trump đang đứng trước sức ép đưa ra một kế hoạch mới nhằm giải quyết vấn đề chi phí chăm sóc sức khỏe cho người Mỹ, trong bối cảnh các khoản trợ cấp theo Đạo luật Chăm sóc Sức khỏe Giá cả phải chăng (ACA), hay còn gọi là Obamacare, sắp hết hạn vào cuối năm nay. ""Chính sách chăm sóc sức khỏe duy nhất mà tôi ủng hộ hoặc chấp nhận phê duyệt chính là gửi tiền trực tiếp cho người dân"", Tổng thống Mỹ Donald Trump viết trên Truth Social ngày 18/11, đề cập đến chính sách hỗ trợ y tế mới cho người dân Mỹ để thay thế Obamacare, vốn đã được ông hứa hẹn từ nhiệm kỳ đầu tiên. Ý tưởng chuyển tiền trực tiếp cho người dân thay vì thông qua các công ty bảo hiểm đang được giới chức đảng Cộng hòa xem xét, trong nỗ lực tái cấu trúc hệ thống bảo hiểm y tế Mỹ. Trong thỏa thuận mở cửa lại chính phủ đầu tháng này, Hạ viện đã tạm gác lại tranh cãi về các khoản ""tín dụng thuế"" liên quan Obamacare, cơ chế cho phép người dân Mỹ cấn trừ chi phí y tế vào nghĩa vụ đóng thuế. Các đề xuất của phía Cộng hòa vẫn còn khá mơ hồ, song họ cho rằng chuyển tiền trực tiếp cho dân sẽ hiệu quả hơn so với cơ chế tín dụng thuế hiện nay. Trong khi đó, phe Dân chủ vẫn muốn củng cố Obamacare bằng cách gia hạn các khoản hỗ trợ được áp dụng từ thời kỳ đại dịch, dự kiến hết hiệu lực từ đầu năm sau. Theo tổ chức nghiên cứu KFF, nếu tín dụng thuế không được gia hạn, chi phí trung bình cho bảo hiểm y tế của 22 triệu người đang hưởng trợ cấp sẽ tăng gấp đôi từ ngày 1/1/2026. Tổng thống Mỹ Donald Trump phát biểu tại Nhà Trắng ngày 17/11, trong buổi họp về đăng cai World Cup 2026. Ảnh:AFP Lãnh đạo phe đa số Thượng viện John Thune cam kết sẽ đưa vấn đề tín dụng thuế ra bỏ phiếu vào giữa tháng 12, nhưng không đảm bảo sự ủng hộ của toàn bộ đảng Cộng hòa. Chủ tịch Hạ viện Mike Johnson cũng chưa cam kết, song nhấn mạnh các khoản hỗ trợ từ thời đại dịch là ""lãng phí"". Tuy nhiên, ngay cả khi được gia hạn, tín dụng thuế cũng không thể giải quyết xu hướng chi phí y tế tăng cao tại Mỹ vốn đang trở thành gánh nặng của phần lớn người dân, bất kể họ tham gia bảo hiểm qua doanh nghiệp, Medicare hay Obamacare. Hơn 150 triệu người được bảo hiểm thông qua doanh nghiệp sẽ chứng kiến mức tăng chi phí bình quân năm 2026 ở mức cao nhất trong 15 năm qua. Người cao tuổi sử dụng Medicare cũng có thể chứng kiến phí bảo hiểm cho dịch vụ ngoại trú, thăm khám và thiết bị y tế tăng 9,7% trong năm sau. Nhiều nghị sĩ Cộng hòa, cựu quan chức chính quyền Trump và một số nhà nghiên cứu đề xuất mở rộng vai trò của Tài khoản Tiết kiệm Y tế (HSA). Đây là hình thức phổ biến với người lao động được công ty mua bảo hiểm. Họ có thể trích thu nhập trước thuế để chi trả các chi phí y tế theo danh mục quy định, thường đi kèm các gói bảo hiểm có mức khấu trừ cao. Thượng nghị sĩ Bill Cassidy đề xuất kết hợp HSA với các gói bảo hiểm cấp thấp trong Obamacare, theo đó người dân nhận tiền từ chính phủ liên bang qua HSA để tự chi trả dịch vụ y tế. Brian Blase, cựu cố vấn Nhà Trắng thời Trump, cho rằng chính phủ nên chuyển một phần kinh phí hỗ trợ đồng chi trả cho người thu nhập thấp sang HSA. Thượng nghị sĩ Rick Scott còn giới thiệu dự luật thành lập ""Tài khoản Tự do Y tế Trump"", cho phép người dân dùng tài khoản này thanh toán cả phí bảo hiểm. Phe Dân chủ tỏ ra hoài nghi về thời điểm và tính khả thi của các đề xuất. Thượng nghị sĩ Catherine Cortez Masto cảnh báo hàng triệu người có nguy cơ mất bảo hiểm nếu Hạ viện hấp tấp. Bà đề xuất gia hạn tín dụng thuế thêm một năm để hai đảng có thời gian đánh giá các phương án dài hạn. Thượng nghị sĩ Ron Wyden cũng nhận định không thể xây dựng một kế hoạch hoàn chỉnh trong vài tuần khi nhiều người thụ hưởng Obamacare chuẩn bị bước sang chu kỳ phí mới vào tháng 1/2026. Trong khi đó, theo kinh tế gia Robert Kaestner, ý tưởng gửi tiền chăm sóc y tế trực tiếp cho người dân đã tồn tại hơn 40 năm. Ông nhận định mô hình HSA có thể phù hợp với nhóm thu nhập trung bình và cao, nhưng với người thu nhập thấp thì khoản tiết kiệm này khó có thể trang trải những chi phí y tế lớn và đột xuất. Thanh Danh(TheoUSA Today, Politico)","Thứ tư, 26/11/2025, 02:00 (GMT+7)",Thanh Danh,Thế giới,Bắc Mỹ,VN Express,
VNEX_261125_00077,"Chuyển hướng ẩu, học sinh đi xe máy bị ôtô đâm bay",https://vnexpress.net/chuyen-huong-au-hoc-sinh-di-xe-may-bi-oto-dam-bay-4986031.html,"Video:CTV Tình huống giao thông:Tại ngã tư, một người trong trang phục học sinh lao xe máy từ phía sau ôtô để chuyển hướng rẽ trái. Lúc này ôtô ở hướng ngược chiều đi tới đâm bay cậu bé và xe ra đường. May mắn cậu bé có thể đứng dậy sau đó. Kỹ năng lái xe:Các phương tiện khi chuyển hướng, ngoài tín hiệu xin đường cần quan sát kỹ và chỉ di chuyển khi đảm bảo an toàn. Từ góc khuất ôtô phía trước, người đi xe máy không nên lập tức tạt ngang đường gây mất an toàn cho bản thân và khó khăn cho những người đi đường khác trong việc phán đoán tình huống. Quy tắc rẽ trái ở ngã tư là phương tiện cần đi qua tim đường, sau đó đợi dòng phương tiện ngược chiều thoáng đãng thì mới rẽ. Việc rẽ tắt rất dễ gây tình trạng đi vào vùng góc khuất của xe phía trước, gây tai nạn. Nguyên Vũ","Thứ tư, 26/11/2025, 08:27 (GMT+7)",Nguyên Vũ,Xe,Diễn đàn,VN Express,
VNEX_261125_00069,5 thói quen buổi sáng làm tăng huyết áp khi trời lạnh,https://vnexpress.net/5-thoi-quen-buoi-sang-lam-tang-huyet-ap-khi-troi-lanh-4986178.html,"ThS.BS Đỗ Thị Thảo, khoa Tim mạch, Bệnh viện Đa khoa Tâm Anh Hà Nội, cho biết thời tiết lạnh khiến mạch máu co lại, tim phải bơm máu nhiều hơn để duy trì nhiệt độ cơ thể. Buổi sáng từ 6h đến 11h là thời điểm nguy cơ cao xảy ra các cơn thiếu máu cơ tim. Khi ngủ, huyết áp giảm (dipping) nhưng sau khi thức dậy, hệ thần kinh giao cảm và các hormone như adrenaline, cortisol tăng vọt khiến huyết áp tăng lên nhanh (morning surge). Áp lực đột ngột này tác động lên mảng xơ vữa khiến chúng dễ nứt vỡ. Tiểu cầu nhanh chóng kết tập tạo cục máu đông, gây hẹp hoặc tắc mạch. Dưới đây là những thói quen buổi sáng tưởng vô hại nhưng có thể làm gia tăng nguy cơ biến cố tim mạch. Bật dậy, rời giường đột ngột Sau một đêm ngủ, cơ thể vẫn trong trạng thái nghỉ ngơi, khi bật dậy quá nhanh có thể gây hạ huyết áp tư thế với triệu chứng chóng mặt. Ở người bình thường, cơ thể phản xạ bù lại nhanh chóng bằng cách tăng nhịp tim, co mạch, đưa huyết áp về mức bình thường. Tuy nhiên, ở một số người lớn tuổi, có bệnh tim mạch, xơ cứng mạch hoặc rối loạn điều hòa huyết áp tự chủ, phản xạ bù quá mức hoặc rối loạn có thể làm cho huyết áp tăng cao, tạo gánh nặng cho tim. Ra ngoài trời lạnh ngay khi vừa thức dậy Cơ thể vừa thức dậy, tiếp xúc với lạnh đột ngột sẽ cộng hưởng hai cơ chế co mạch và tụt huyết áp tư thế. Hậu quả là gây đau ngực, khó thở và nguy cơ bùng phát biến cố tim mạch. Ngoài ra, huyết áp thay đổi liên tục nhanh và lặp đi lặp lại có thể kích hoạt hệ renin - angiotensin - aldosterone (RAAS) và các hormone (endothelin, vasopressin) gây co mạch, tăng nguy cơ huyết khối,xơ vữa động mạch. Uống quá nhiều cà phê hoặc uống khi chưa ăn sáng làm huyết áp tạm thời tăng. Ảnh:Ly Nguyễn Tập luyện cường độ cao Ở người mắc bệnh mạch vành hoặc có tiền sử tim mạch, việc gắng sức ngoài trời lạnh dễ khởi phát thiếu máu cơ tim. Các bài tập cường độ cao như chạy nhanh, HIIT, leo dốc hay mang vác nặng tiềm ẩn rủi ro, nhất là khi cơ thể chưa được khởi động kỹ, trang bị chưa đủ ấm. Không uống đủ nước Trời lạnh khiến nhiều người ít uống nước, dù cơ thể vẫn mất nước qua hô hấp và mồ hôi. Thiếu nước làm máu cô đặc hơn, làm tăng độ nhớt và sức cản trong mạch máu, hậu quả làtăng huyết ápvà gánh nặng cho tim đồng thời dễ hình thành huyết khối. Nạp nhiều muối và caffeine Uống quá nhiều cà phê hoặc uống khi chưa ăn sáng khiến caffeine kích thích hệ thần kinh giao cảm, làm huyết áp tạm thời tăng. Khi ăn quá mặn hoặc lượng lớn thực phẩm chế biến sẵn, lượng muối khiến cơ thể giữ nước, làm tăng thể tích máu và huyết áp. Bác sĩ Thảo khuyến cáo, sau khi thức giấc, mọi người nên ngồi dậy từ từ, nghỉ ở mép giường một vài phút và cử động nhẹ tay chân để tuần hoàn ổn định trước khi đứng lên. Mặc đủ ấm và khởi động nhẹ trong nhà 5-10 phút, ưu tiên tập trong nhà khi trời rét sâu, lựa chọn các bài tập mức độ nhẹ đến vừa. Nên uống một ít nước ấm ngay sau khi thức dậy để bù nước sau một đêm ngủ, giúphuyết áp ổn địnhhơn trong ngày lạnh. Bữa sáng nên ít muối, ưu tiên thực phẩm lành mạnh như trứng, sữa chua, ngũ cốc nguyên hạt, trái cây. Không nên nạp nhiều đồ ăn, thức uống chứa caffeine vào buổi sáng vì dễ khiến huyết áp tăng tạm thời. Nếu buổi sáng thường xuyên xuất hiện dấu hiệu như đau đầu, mặt nóng bừng, chóng mặt khi đứng dậy, hồi hộp, tim đập nhanh hoặc đo được huyết áp trung bình trên 130/80 mmHg, người bệnh nên kiểm tra sức khỏe sớm. Bác sĩ sẽ đánh giá nguy cơ tim mạch và tư vấn điều chỉnh lối sống kịp thời. Ly Nguyễn","Thứ tư, 26/11/2025, 08:00 (GMT+7)",Ly Nguyễn,Sức khỏe,Các bệnh,VN Express,
VNEX_261125_00014,Mourinho lần đầu thắng ở Champions League sau 6 năm,https://vnexpress.net/mourinho-lan-dau-thang-o-champions-league-sau-6-nam-4986166.html,"Trên sân Johan Cruyff tối 25/11,Benficakiểm soát bóng chỉ 37%, nhưng chất lượng trong khâu kết thúc giúp họ rời Hà Lan với ba điểm. Cả trận, đội bóng của Mourinho dứt điểm 10 lần với 3 trúng đích - so với 6 và 3 của Ajax. Phút 6, từ tình huống phạt góc, một cầu thủ Benfica đánh đầu chéo góc bị thủ môn Vitezslav Jaros cản phá. Bóng bật ra đúng tầm để Samuel Dahl đá bồi chéo góc uy lực mở tỷ số. Đội khách ấn định chiến thắng ở phút thi đấu chính thức cuối cùng. Trong pha phản công, Leandro Barreiro bật tường với Fredrik Aursnes rồi xâm nhập vòng cấm và dứt điểm tung nóc lưới Ajax. Các cầu thủ Benfica mừng bàn trong trận thắng Ajax 2-0 tại Amsterdam ArenA, Hà Lan ngày 25/11/2025. Ảnh:Abola Chiến thắng 2-0 giúp Benfica giành những điểm số đầu tiên tại Champions League mùa này. Đội bóng Bồ Đào Nhathua cả bốn lượt đầu, gồm ba trận dưới trướng Mourinho trước Leverkusen, Chelsea cùng 0-1 và Newcastle 0-3. Ở trận ra quân dưới trướng Bruno Lage, họ thua Qarabag 2-3. Trước khi đến Benfica, lần gần nhất Mourinho dẫn dắt một CLB tại Champions League, không tính vòng loại, làTottenhammùa 2019-2020. Khi đó, ""Gà trống"" thắng Olympiacos 4-2 ở lượt áp chót vòng bảng ngày 26/11/2019. Đội bóng của Mourinho sau đó toàn thua, trước Bayern 1-3 ở lượt cuối vòng bảng rồi RB Leipzig 0-1, 0-3 qua hai lượt vòng 1/8. Sau trận hôm qua,Mourinhothừa nhận Benfica có lúc hỗn loạn, đặc biệt ở 10 phút cuối hiệp một, khi gặp khó khăn trong việc giữ nhịp và kiểm soát không gian. Nhưng sang hiệp hai, dù đội nhà không tạo ra nhiều pha phản công sắc nét, ông cho rằng Ajax cũng chỉ có đúng một cơ hội đáng chú ý của Davy Klaassen. ""Cảm giác của tôi là, ngay cả nếu đá thêm 150 phút, Ajax cũng không ghi bàn. Chúng tôi rất chắc chắn, tập trung, và toàn đội xứng đáng tận hưởng niềm vui này"", Mourinho nói vớiSport TV, nhấn mạnh. HLV Jose Mourinho chỉ đạo trong trận thắng Ajax. Ảnh:Abola Nhà cầm quân 62 tuổi cũng giải thích áp lực mà Benfica phải chịu khi buộc phải thắng. Trước trận này, ông cùng học trò đang đứng ở nhóm cuối giai đoạn vòng bảng Champions League. ""Một chuyện là chơi để thắng, chuyện khác là phải thắng bằng mọi giá. Áp lực ấy rất khác"", Mourinho nói. ""Người Đặc biệt"" cũng thừa nhận Benfica không có nhiều cầu thủ tốc độ để chơi phản công, buộc ông phải điều chỉnh cách chơi. ""Chúng tôi dùng những gì mình có. Đội đã phòng ngự tuyệt vời. Bàn của Barreiro gần như khép lại trận đấu, nhưng thực ra cảm giác của tôi là thế trận đã nằm trong tay Benfica từ trước đó rồi"", HLV người Bồ Đào Nha cho biết thêm. Ngày 29/11, Benfica làm khách của Nacional ở vòng 12 giải VĐQG Bồ Đào Nha. Thầy trò Mourinho đang đứng thứ ba với 25 điểm, kém đỉnh bảng Porto 6 điểm. Hồng Duy(theoAbola)","Thứ tư, 26/11/2025, 05:30 (GMT+7)",Hồng Duy,Thể thao,Bóng đá,VN Express,
VNEX_261125_00018,Ronaldo thoát án treo giò tại World Cup 2026,https://vnexpress.net/ronaldo-thoat-an-treo-gio-tai-world-cup-2026-4986164.html,"Ngày 25/11, FIFA quyết định phạtRonaldomột trận treo giò, kèm hai trận án treo trong vòng một năm. Điều này đồng nghĩa tiền đạo 40 tuổi đã thi hành xong án phạt, bởi anh vắng mặt trong trận đấu cuối vòng loại World Cup 2026 khu vực châu Âugặp Armenia. Ronaldo ""giả khóc"" để giễu đối thủ trong trận Bồ Đào Nha thua Ireland trên sân Aviva, thành phố Dublin, Ireland, lượt áp chót bảng F vòng loại khu vực châu Âu, World Cup 2026 tối 13/11/2025. Ảnh:INPHO Theo quy định của FIFA, án phạt cho hành vi bạo lực, bao gồm đánh nguội, thúc khuỷu tay, có thể dao động từ một đến ba trận, tùy mức độ nghiêm trọng. Dựa trên Điều 27 của Bộ luật Kỷ luật FIFA, Ủy ban Tư pháp có quyền đình chỉ một phần hoặc toàn bộ án phạt nếu xét thấy phù hợp. FIFA nêu rõ trong thông báo: nếu Ronaldo tái phạm trong vòng một năm, hai trận treo còn lại sẽ tự động kích hoạt và được thi hành ngay ở các trận chính thức kế tiếp của tuyển Bồ Đào Nha, chưa kể các án bổ sung cho hành vi mới. Giống tình huốngRonaldo bị phạt thẻ, quyết định mới nhất của FIFA tiếp tục gây tranh cãi, và vẫn có thể bị kháng cáo lên Ủy ban Kháng nghị của tổ chức này. TrênSky Sports, phóng viên Kaveh Solhekol cho rằng đây là quyết định chưa từng có tiền lệ và rõ ràng đem lại lợi ích cho cả Ronaldo lẫn FIFA. Theo ông, ở hoàn cảnh bình thường, siêu sao Bồ Đào Nha phải nghỉ ít nhất hai trận, nhưng ""không có gì là bình thường khi nói về Ronaldo"". Người hâm mộ thì cho rằng Ronaldo xứng đáng được cân nhắc đặc biệt, trong khi giới chuyên môn lại nhấn mạnh ""luật thì phải là luật"". Tinh huống dẫn đến thẻ đỏ của Ronaldo. Ronaldo nhận thẻ đỏtrong trận gặp Ireland lượt áp chót bảng F vòng loại khu vực châu Âu World Cup 2026 ngày 13/11. Phút 59, khi Bồ Đào Nha đang bị dẫn 0-2, Ronaldo dùng khuỷu tay tác động vào lưng Dara O’Shea rồi thực hiện động tác giả khóc để chế giễu. Trọng tài Glenn Nyberg ban đầu rút thẻ vàng, nhưng sau khi VAR can thiệp, ông đổi thành thẻ đỏ trực tiếp. Sau đó, với sự tham gia trực tiếp của Chủ tịch Pedro Proenca, Liên đoàn bóng đá Bồ Đào Nha (FPF)khiếu nại lên FIFA, cho rằng môi trường thi đấu căng thẳng tại Dublin với những phát biểu công kích của HLV Ireland Heimir Hallgrimsson trước trận dẫn đến phản ứng của CR7. Ronaldo đã khẳng định World Cup 2026 là kỳ cuối cùng anh góp mặt. Giải đấu gồm 48 đội, diễn ra tại Canada, Mỹ và Mexico từ 11/6 đến 19/7/2026. Lễ bốc thăm vòng bảng World Cup 2026 sẽ diễn ra tại Washington D.C, Mỹ vào ngày 5/12/2025, dù6 đội cuối cùng chưa được xác định. Hồng Duy(theoGuardian, Sky Sports)","Thứ tư, 26/11/2025, 05:36 (GMT+7)",Hồng Duy,Thể thao,Bóng đá,VN Express,
