id,title,link,content,date,author,category,sub_category,source,summary
VNEX_060625_00001,Giao thông TP HCM kỳ vọng đột phá từ cú hích đô thị nén,https://vnexpress.net/giao-thong-tp-hcm-ky-vong-dot-pha-tu-cu-hich-do-thi-nen-4894411.html,"Ý tưởng phát triển TOD được nhắc đến từ hơn một thập kỷ trước, khi thành phố bắt đầu xây dựng tuyến metro Bến Thành - Suối Tiên. Thời điểm đó, KTS Ngô Viết Nam Sơn đề xuất điều chỉnh vị trí ga Tân Cảng về phía khu đô thị Vinhomes Central Park (quận Bình Thạnh) để tạo kết nối trực tiếp, thuận tiện cho cư dân, nhân viên văn phòng, khách đến các trung tâm thương mại, giúp tối ưu hiệu quả tuyến tàu điện đầu tiên ở thành phố. Tuy nhiên, ý tưởng trên không được chấp thuận. Ga Tân Cảng tiếp tục xây dựng gần chân cầu Sài Gòn phía bên kia đường như quy hoạch, tách biệt khu đô thị rộng gần 44 ha ở đối diện - nơi hiện tập trung hàng chục cao ốc, bao gồm tòa nhà Landmark 81 cao nhất Việt Nam, với hàng trăm nghìn cư dân sống và làm việc. ""Nếu ga Tân Cảng đặt trong khu Vinhomes, mô hình đô thị tích hợp giao thông công cộng có thể đã hình thành bài bản, giúp người dân tiếp cận metro thuận tiện hơn, tránh tình trạng phải băng qua đường lớn hoặc tuyến thường xuyên ùn tắc như Nguyễn Hữu Cảnh, Điện Biên Phủ"", ông Sơn nhận định. Ga metro Tân Cảng xây dựng gần chân cầu Sài Gòn, tách biệt khu đô thị lớn ở đối diện. Ảnh:Quỳnh Trần Theo ông, thành phố từng có cơ hội phát triển đô thị nén gắn với giao thông công cộng ngay từ giai đoạn đầu, nhưng bỏ lỡ do thiếu định hướng quy hoạch. Hiện, với mạng lưới metro mở rộng, cơ chế đặc thù từ Nghị quyết 98 và 188, TP HCM có điều kiện thuận lợi để hiện thực hóa mô hình TOD. TOD (Transit-Oriented Development) là mô hình phát triển đô thị lấy giao thông công cộng làm trung tâm. Dù cách triển khai có thể khác nhau tùy địa phương, điểm chung của mô hình này là phát triển đa chức năng với mật độ cao, bao gồm nhà ở cao tầng, trung tâm thương mại, văn phòng, cùng các tiện ích giáo dục, y tế, thể thao... Tất cả được tích hợp trong bán kính đi bộ quanh các đầu mối giao thông công cộng như nhà ga metro, nhằm đảm bảo khả năng kết nối thuận tiện nhất. Mô hình này đã được áp dụng thành công tại nhiều đô thị lớn như: London (Anh), Hong Kong, Quảng Châu (Trung Quốc)... Tuy nhiên, tại Việt Nam, TOD vẫn chưa được triển khai một cách bài bản. Gần đây, TP HCM đã lên kế hoạch phát triển TOD tại11 khu đấtdọc các tuyến metro và đường Vành đai 3 và đang xem xét thêm 35 vị trí khác với tổng diện tích gần 7.400 ha. Ngoài ra, thành phố cũng ghi nhậnđề xuấtđầu tư TOD của một doanh nghiệp tại khu vực Hàng Xanh (Bình Thạnh), quy mô 51 ha, tổng vốn đầu tư sơ bộ khoảng 216.000 tỷ đồng (hơn 8,5 tỷ USD). Các vị trí TP HCM đang lên kế hoạch phát triển TOD trong giai đoạn trước mắt. Đồ họa:Đăng Hiếu ""Mô hình TOD nếu thực hiện thành công sẽ tạo đột phá cho TP HCM, giúp khai thác tối ưu quỹ đất, tạo nguồn lực tài chính rất lớn đầu tư hạ tầng"", ông Sơn nói, cho rằng TOD còn giúp tái cấu trúc không gian đô thị, giao thông. Tuy nhiên, để triển khai hiệu quả, thành phố còn đối mặt nhiều thách thức, bởi hiện mới có khung pháp lý, còn cách vận dụng vẫn là bài toán lớn. Từ kinh nghiệm tuyến metro Bến Thành - Suối Tiên, ông Sơn cho rằng TP HCM cần thay đổi cách tiếp cận quy hoạch, trong đó giao thông công cộng và đô thị nên tích hợp ngay từ đầu thay vì riêng lẻ. Trong bối cảnh thành phố sẽ nhập với Bình Dương và Bà Rịa - Vũng Tàu, không gian đô thị mở rộng thêm, việc cập nhật quy hoạch metro và các khu TOD cần được thực hiện đồng bộ để thuận lợi triển khai. PGS.TS Vũ Anh Tuấn, Giám đốc Trung tâm Nghiên cứu Giao thông Vận tải, Đại học Việt Đức, đánh giá TOD là giải pháp TP HCM buộc phải thực hiện trong bối cảnh nhu cầu vốn cho mạng lưới metro đến 2035 ước tính hơn 40 tỷ USD. Tuy nhiên, ông cho rằng thách thức lớn nằm ở hành lang pháp lý chưa rõ ràng và cơ chế điều phối còn phân tán. ""TOD liên quan nhiều ngành, lĩnh vực và chịu ảnh hưởng mạnh bởi biến động thị trường, nên cần một cơ quan đầu mối đủ thẩm quyền để điều phối xuyên suốt"", ông nói. Ông Tuấn đề xuất thành phố thành lập Hội đồng phát triển TOD do Chủ tịch hoặc Phó chủ tịch UBND thành phố làm trưởng ban, giao Sở Xây dựng hoặc Ban Quản lý đường sắt đô thị làm cơ quan thường trực. Đồng thời, thành phố nên sớm ban hành khung pháp lý về đất đai ở khu vực TOD, bao gồm thiết lập cơ chế hợp tác giữa nhà nước với tư nhân, không nên đấu giá đất quá nhiều do dễ thất thoát nguồn lực. Khu đất nằm quanh ga Phước Long của metro Bến Thành - Suối Tiên là một trong những vị trí TP HCM đang lên kế hoạch phát triển TOD. Ảnh:Quỳnh Trần TS Nguyễn Quốc Hiển, Phó Ban quản lý Đường sắt đô thị TP HCM, đánh giá TOD có thể mang lại nhiều lợi ích như: phát triển đô thị theo hướng ""nén"", tăng thu cho đơn vị vận hành metro và tạo cơ hội sinh lời cho nhà đầu tư bất động sản. Tuy nhiên, ông cũng nhìn nhận việc triển khai mô hình này rất phức tạp, đòi hỏi một đơn vị đủ năng lực điều phối. Theo ông Hiển, tại một số quốc gia khác ""nhạc trưởng"" triển khai TOD có thể là một cơ quan trực thuộc Chính phủ hay chính quyền địa phương, hoặc các công ty xây dựng và vận hành đường sắt. Thậm chí, vai trò này còn được trao cho doanh nghiệp tư nhân tự khảo sát và chủ động đề xuất triển khai dự án. ""Hiện các ban quản lý dự án và doanh nghiệp vận hành metro chưa đủ năng lực đảm nhiệm vai trò này. Thành phố cần một đơn vị có chuyên môn và thẩm quyền để quy hoạch và phát triển TOD hiệu quả, góp phần tối ưu hóa tài nguyên đất và hạ tầng đô thị"", ông Hiển nói. Giang Anh","Thứ sáu, 6/6/2025, 06:00 (GMT+7)",Giang Anh,Thời sự,Giao thông,VN Express,"Bài viết đề cập đến ý tưởng phát triển mô hình đô thị TOD (Transit-Oriented Development) tại TP.HCM, lấy giao thông công cộng làm trung tâm. Trước đây, thành phố đã bỏ lỡ cơ hội phát triển TOD khi không chấp thuận điều chỉnh vị trí ga metro Tân Cảng. Hiện tại, TP.HCM đang lên kế hoạch triển khai TOD tại nhiều khu vực dọc các tuyến metro và đường Vành đai, tuy nhiên, vẫn còn nhiều thách thức trong việc vận dụng khung pháp lý để thực hiện hiệu quả mô hình này. Việc thực hiện thành công TOD được kỳ vọng sẽ tạo đột phá cho thành phố, khai thác tối ưu quỹ đất và tái cấu trúc không gian đô thị."
VNEX_060625_00006,Triều Tiên cứu hộ thành công chiến hạm 5.000 tấn,https://vnexpress.net/trieu-tien-cuu-ho-thanh-cong-chien-ham-5-000-tan-4895165.html,"Hãng thông tấn trung ương Triều Tiên KCNA hôm nay cho biết chiến hạm 5.000 tấn đã được hạ thủy và đang neo ở một cầu cảng sau khi được dựng thẳng thành công. ""Các chuyên gia tiếp đó sẽ kiểm tra thân tàu trong 7-10 ngày. Quá trình sửa chữa toàn bộ chiến hạm dự kiến hoàn tất trước một cuộc họp của đảng Lao động Triều Tiên trong tháng này"", KCNA cho hay. Ảnh vệ tinh thương mại chụp khu vực nhà máy đóng tàu tại Chongjin hôm 5/6 cho thấy chiến hạm Triều Tiên đã nổi trên mặt nước, ở vị trí cách xa triền nghiêng mà nó mắc kẹt trong suốt nhiều ngày. Trong ảnh chụp trước đó ba ngày, tàu chiến đã được dựng thẳng đứng, nhưng vẫn trong trạng thái nửa dưới nước nửa trên cạn. Ảnh vệ tinh chụp tàu chiến Triều Tiên tại nhà máy ở Chongjin hôm 5/6. Ảnh:Planet Labs ""Nhiều chuyên gia từng hoài nghi yêu cầu của lãnh đạo Triều Tiên Kim Jong-un, khi ông ra lệnh hoàn thành quá trình khôi phục tàu trong tháng 6. Dữ liệu mới nhất cho thấy nhân lực tại Chongjin đã đạt bước tiến đáng kể hướng tới mục tiêu này"",38 North, dự án về Triều Tiên thuộc Trung tâm Stimson tại Mỹ, nhận xét. Hãng thông tấn Triều Tiên KCNA cho biết khu trục hạm với lượng giãn nước 5.000 tấn đã bị hư hại do sự cố nghiêm trọng trong lễ hạ thủy tại xưởng đóng tàu ở thành phố cảng Chongjin hôm 21/5. Đây là chiếc thứ hai thuộc lớp Choe Hyon, mẫu tàu chiến lớn và hiện đại nhất trong lịch sử Triều Tiên. Decker Eveleth, thành viên Trung tâm Phân tích Hải quân (CNA) ở Mỹ, nhấn mạnh vị trí chênh vênh, nửa trên cạn nửa dưới nước của tàu chiến Triều Tiên khiến hoạt động cứu hộ trở nên phức tạp hơn rất nhiều so với trường hợp nó lật úp hẳn xuống nước hoặc đổ nghiêng trên cạn. ""Về cơ bản, đây là tình huống tồi tệ nhất. Trong tình trạng hiện nay, nỗ lực nâng phần chìm lên sẽ dẫn đến nguy cơ vặn xoắn và gãy sống tàu. Nếu điều đó xảy ra, toàn bộ con tàu sẽ biến thành đống sắt vụn"", Eveleth cho hay. Tàu chiến Triều Tiên sau sự cố hạ thủy ngày 21/5. Ảnh:Airbus KCNA ngày 23/5 thông báo cuộc kiểm tra chi tiết phần dưới nước và bên trong chiến hạm cho thấy không có lỗ thủng nào xuất hiện dưới đáy tàu như thông báo ban đầu. ""Mạn phải của tàu bị trầy xước và một lượng nước biển đã tràn vào phần đuôi tàu thông qua kênh thoát"", cơ quan này cho hay. Ít nhất ba quan chức liên quan đến sự cố đã bị bắt, gồm kỹ sư trưởng nhà máy Kang Jong-chol, trưởng phân xưởng đóng thân tàu Han Kyong-hak và phó giám đốc hành chính Kim Yong-hak. Như Tâm(TheoKCNA, Yonhap)","Thứ sáu, 6/6/2025, 06:55 (GMT+7)",Như Tâm,Thế giới,Quân sự,VN Express,"Triều Tiên thông báo đã hạ thủy thành công chiến hạm 5.000 tấn sau sự cố trong lễ hạ thủy trước đó, và đang neo đậu để kiểm tra thân tàu. Các chuyên gia đánh giá việc hoàn thành quá trình khôi phục tàu trong tháng 6 là một bước tiến đáng kể. Khu trục hạm này thuộc lớp Choe Hyon, mẫu tàu chiến lớn và hiện đại nhất của Triều Tiên, và việc sửa chữa dự kiến hoàn tất trước cuộc họp đảng Lao động. Vụ việc cũng dẫn đến việc bắt giữ một số quan chức liên quan do những thiệt hại và sơ suất trong quá trình hạ thủy."
VNEX_060625_00064,Khí nén từ vòi xịt ôtô làm thủng trực tràng người thợ,https://vnexpress.net/khi-nen-tu-voi-xit-oto-lam-thung-truc-trang-nguoi-tho-4894990.html,"Bệnh nhân quê Hải Phòng, được đưa vào Bệnh viện Hữu nghị Việt Đức (Hà Nội) cấp cứu trong tình trạng đau bụng dữ dội vùng hạ vị, bụng chướng. Bác sĩ chẩn đoán áp lực khí nén từ vòi xịt gây tăng áp đột ngột trong trực tràng - hậu môn bệnh nhân dẫn đến tình trạng viêm phúc mạc do thủng tạng. Bác sĩ Hoàng Minh Đức, khoa Điều trị theo yêu cầu, cho biết hình ảnh siêu âm, chụp chiếu cho thấy có khí tự do trong ổ bụng bệnh nhân, chỉ định phẫu thuật cấp cứu. Trong khi mổ, bác sĩ ghi nhận trực tràng có lỗ thủng kích thước 2,5 cm, vết xước thanh mạc. Êkíp phẫu thuật làm sạch ổ bụng, khâu lỗ thủng và đưa đại tràng sigma ra làm hậu môn nhân tạo cho người bệnh. Bệnh nhân đang được chăm sóc sau mổ. Bác sĩ Đức thăm khám cho người bệnh sau phẫu thuật. Ảnh:Bệnh viện cung cấp Bác sĩ Đức cho hay đây là trường hợp tổn thương trực tràng nghiêm trọng do áp lực khí nén, một tai nạn sinh hoạt hiếm gặp, có nguy cơ gây biến chứng nặng nề như viêm phúc mạc, sốc nhiễm trùng. ""Những thiết bị tưởng chừng quen thuộc như vòi xịt khô khí nén, vòi xịt nước áp lực cao có thể trở nên nguy hiểm nếu sử dụng không đúng cách hoặc không được kiểm soát chặt chẽ"", bác sĩ Đức nói. Bác sĩ khuyến cáo người lao động và các cơ sở sử dụng thiết bị khí nén cần được trang bị kiến thức về an toàn khi vận hành, tuyệt đối không dùng khí nén để hướng vào cơ thể người, đặc biệt là vùng hậu môn. Lê Nga","Thứ sáu, 6/6/2025, 00:03 (GMT+7)",Lê Nga,Sức khỏe,Tin tức,VN Express,"Một bệnh nhân từ Hải Phòng đã nhập viện trong tình trạng nguy kịch do bị thủng trực tràng và viêm phúc mạc sau khi bị khí nén từ vòi xịt tác động vào hậu môn. Bác sĩ Bệnh viện Việt Đức đã phẫu thuật cấp cứu để khâu lỗ thủng và tạo hậu môn nhân tạo cho bệnh nhân. Bác sĩ khuyến cáo về sự nguy hiểm tiềm ẩn của các thiết bị khí nén và nhấn mạnh tầm quan trọng của việc sử dụng chúng một cách an toàn, đặc biệt là tránh hướng khí nén vào cơ thể người."
VNEX_060625_00014,"Carlsen hạ Caruana, trở lại đỉnh bảng siêu giải Na Uy",https://vnexpress.net/carlsen-ha-caruana-tro-lai-dinh-bang-sieu-giai-na-uy-4895160.html,"Carlsen chọn khai cuộc Catalan, phương án thường được các cao thủ sử dụng mỗi khi họ cần thắng bằng quân trắng. Chuyên gia khai cuộc này là Đại kiện tướng Daniil Dubov, trợ tá cũ của Carlsen trong trận chung kết cờ vua thế giới gặp chính Caruana. Sau khai cuộc, máy tính đánh giá cờ cân bằng, nhưng Trắng chiếm thế chủ động. Carlsen bắt được một tốt trắng ở trung cuộc, sau đó đưa cờ về hình tàn hậu, xe và các tốt. Máy tính vẫn cho rằng cờ cân bằng, nhưng Carlsen đã thắng hàng trăm ván đấu có tình thế tương tự. Đại kiện tướng Daniel Naroditsky cho rằng Caruana không dễ phòng thủ trong thế cờ đó. Carlsen (trái) trong ván thắng Caruana ở vòng 9 siêu giải Na Uy tại tòa nhà Finansparken, thành phố Stavanger, Na Uy, ngày 5/6/2025. Ảnh:Norway Chess Caruana chống đỡ ổn, nhưng chỉ một sai lầm khiến anh phải trả giá. Ở nước thứ 47, anh lấy hậu bắt tốt trắng h5, nhưng đây là quân tốt được Carlsen ""tẩm độc"". Anh thoáng mỉm cười sau sai lầm của kỳ thủ Mỹ gốc Italy. Trắng thắng sau đó chỉ năm nước cờ. Sau trận, kỳ thủ số một thế giới cho biết anh để đối thủ bắt tốt h5 như cái bẫy. ""Đáng lẽ Caruana không nên bắt tốt, mà tiếp tục dùng hậu phòng ngự thụ động và chờ thời cơ"", Carlsen nói. ""Về điểm này, Hikaru Nakamura thường làm rất tốt. Không phải kỳ thủ nào cũng có được sự kiên nhẫn khi phòng thủ"". Nakamura là kỳ thủ số hai thế giới, thường tự nhận có sở trường phòng thủ. Khi bình luận ván đấu, anh cũng cho rằng Caruana không nên bắt tốt h5, mà phải đưa hậu về chặn các đường lên của tốt trắng. Thế cờ sau nước 47.Rb2. Máy tính đề xuất Đen phải đưa hậu về, có thể là ô e6, để ngăn hai tốt trắng tiến lên. Tuy nhiên, Caruana lại chọn bắt tốt h5, thành sai lầm nghiêm trọng, từ hòa thành thua. Carlsencũng phân tích rằng Caruana đã có thể đổi hậu, thí tốt, để có thể đưa vua lên bắt lại hai tốt trắng. ""Đó là một mánh khóe cậu ấy đã hai lần bỏ qua trong ván này"", kỳ thủ 34 tuổi nói thêm. Caruana32 tuổi, từng đứng số hai thế giới trong tổng cộng 70 tháng (gần 6 năm), lâu nhất thời Carlsen đứng số một liên tiếp hơn 14 năm qua. Anh giỏi về khai cuộc và khả năng tính toán, nhưng không được đánh giá cao về phòng thủ và trực giác. Vì thế, Caruana thường gặp khó khăn khi thời gian gần cạn. Cũng ở vòng 9, Vua cờ 19 tuổiGukesh Dommarajucầm quân trắng, thắng Vi Dịch ở cờ tiêu chuẩn. Một lần nữa tài năng Ấn Độ thể hiện được khả năng phòng thủ trong thế bị động, khi đại diện Trung Quốc chiếm ưu thế lớn ở trung cuộc. Chiến thắng này đưa Gukesh lên nhì bảng, chỉ ít hơn Carlsen một điểm. Trong cặp đấu còn lại, Nakamura thắng Erigaisi Arjun ở ván armageddon, nuôi hy vọng nhỏ vô địch. Còn cửa đăng quang của Caruana coi như không còn. Bảng điểm trước vòng cuối Siêu giải Na Uy là giải mời mạnh nhất năm, diễn ra từ 26/5 đến 6/6 tại thành phố Stavanger, với quỹ thưởng 148.000 USD. 6 kỳ thủ đấu vòng tròn hai lượt, cờ tiêu chuẩn. Mỗi ván thắng được 3 điểm, thua không có điểm. Nếu hòa cờ tiêu chuẩn, họ sẽ đánh cờ nhanh theo thể thức armageddon. Người thắng ván armageddon được 1,5 điểm, thua 1 điểm. Vòng 10, cũng là vòng cuối bắt đầu lúc 22h hôm nay thứ Sáu 6/6, giờ Hà Nội, với các cặp đấu:Erigaisi - Carlsen,Caruana - GukeshvàVi - Nakamura. Xuân Bình","Thứ sáu, 6/6/2025, 06:22 (GMT+7)",Xuân Bình,Thể thao,Các môn khác,VN Express,"Trong ván đấu tại siêu giải Na Uy, Carlsen đã sử dụng khai cuộc Catalan và bẫy đối thủ Caruana bằng cách nhử anh bắt tốt h5. Sai lầm này khiến Caruana phải trả giá bằng thất bại, dù trước đó thế cờ được đánh giá là cân bằng. Carlsen nhận xét rằng Caruana thiếu kiên nhẫn trong phòng thủ, khác với Nakamura, và đã bỏ lỡ cơ hội đổi hậu để thủ hòa. Đồng thời, Gukesh Dommaraju thắng Vi Dịch nhờ khả năng phòng thủ tốt, còn Nakamura thắng Erigaisi Arjun ở ván armageddon."
VNEX_060625_00074,Đề Văn thi vào lớp 10 của TP HCM,https://vnexpress.net/de-van-thi-vao-lop-10-o-tp-hcm-2025-4895001.html,"Đề Văn gồm hai phần: Đọc hiểu văn bản văn học và viết đoạn văn (5 điểm); Đọc hiểu văn bản nghị luận hoặc thông tin và viết bài văn (5 điểm). Đề thi lớp 10 môn Văn của TP HCM như sau: Chiều nay, thí sinh tiếp tục dự thi môn Ngoại ngữ, trong 90 phút. Ngày 7/6, các em làm bài thi môn Toán với 120 phút. Những em có nguyện vọng vào lớp 10 chuyên sẽ thi thêm môn tương ứng, trong 150 phút. Năm nay, thành phố có gần 89.000 học sinh tốt nghiệp THCS lớp 9. Hơn 76.400 em đăng ký thi lớp 10, cạnh tranh hơn 70.000 suất học công lập. Tỷ lệ trúng tuyển là hơn 91% - cao nhất trong nhiều năm gần đây. Trong 109 trường THPT công lập, trường THCS-THPT Trần Đại Nghĩa có tỷ lệ chọi cao nhất (1/2,9), cứ ba em thi có một em đỗ. Ở chiều ngược lại, hơn 40 trường có tỷ lệ cạnh tranh dưới 1, tức số thí sinh đăng ký ít hơn chỉ tiêu. Nếu đăng ký vào các trường này, cơ hội trúng tuyển cao hơn. Tỷ lệ chọi 109 trường THPT công lập ở TP HCM Năm ngoái,điểm cao nhất ở môn Vănlà 9,5. Khoảng hơn 200 em có điểm từ 9 đến 9,25. Số bài thi đạt điểm trên 8 là 14.000. Thí sinh dự thi lớp 10 công lập TP HCM tại điểm thi THPT Trưng Vương, quận 1, ngày 5/6. Ảnh:Quỳnh Trần Lệ Nguyễn","Thứ sáu, 6/6/2025, 10:10 (GMT+7)",Lệ Nguyễn,Giáo dục,Tuyển sinh,VN Express,"Đề thi lớp 10 môn Văn ở TP HCM gồm hai phần: Đọc hiểu và viết văn. Kỳ thi năm nay có gần 89.000 học sinh tốt nghiệp THCS, trong đó hơn 76.400 em đăng ký thi vào lớp 10 công lập để cạnh tranh hơn 70.000 suất học. Tỷ lệ trúng tuyển năm nay là hơn 91%, và trường THCS-THPT Trần Đại Nghĩa có tỷ lệ chọi cao nhất."
