id,title,link,content,date,author,category,sub_category,source,summary
VNEX_241225_00071,Suzuki đem toàn bộ xe con đến triển lãm ôtô lớn nhất Việt Nam,https://vnexpress.net/suzuki-dem-toan-bo-xe-con-den-trien-lam-oto-lon-nhat-viet-nam-4997150.html,"Suzuki là một trong những thương hiệu sở hữu dàn xe hùng hậu nhất tại triển lãm Phương tiện Di chuyển Việt Nam 2025 (Vietnam Mobility Show - VnMS) do báoVnExpresstổ chức tại Trung tâm Triển lãm Việt Nam (VEC), Đông Anh trong ba ngày (26-28/12, mở cửa tự do. >> Đăng ký tham gia triển lãm Toàn bộ dòng xe con đang bán tại Việt Nam củaSuzukiđều sẽ xuất hiện tại VnMS 2025. Từ mẫu xe gầm thấpSwiftnhập Nhật, đến dàn xe gầm cao, MPV nhưFronx,Jimny,XL7. Suzuki Fronx trong hành trình Car Test 2025. Ảnh:Lương Dũng Tâm điểm chú ý của gian trưng bày Suzuki là tân binh gầm cao cỡ A+ nhập khẩu Indonesia - Fronx. Thiết kế coupe khác biệt trong phân khúc, nhiều tiện nghi và an toàn, Suzuki Fronx là hy vọng mới của hãng Nhật tại thị trường Việt. Khi đến VnMS 2025, không chỉ Fronx, khách hàng có cơ hội tìm hiểu, lái thử chiếc MPV ăn khách nhất của Suzuki - XL7. Hay mẫu SUV cỡ nhỏ Jimny, mẫu hatchback cỡ B - Swift. Trừ Jimny, ba mẫu xe còn lại của hãng là XL7, Swift và Fronx đều sở hữu công nghệ mild-hybrid. Suzuki Việt Nam cho biết dành nhiều quà tặng cho khách tham quan gian hàng. Các chương trình khuyến mãi tháng 12 cũng áp dụng xuyên suốt thời gian diễn ra triển lãm. Vietnam Mobility Show 2025 - triển lãm ôtô, xe máy lớn nhất Việt Nam trong 2025 - quy tụ nhiều thương hiệu ôtô, xe máy và phụ kiện. Triển lãm mang đến cơ hội xem và lái thử các mẫu xe mới nhất, từ xe điện hóa đến xe hiệu suất cao trên sa hình chuyên biệt trên khu vực ngoài trời với tổng diện tích khoảng 90.000 m2. Bên cạnh những mẫu xe trưng bày và lái thử, khách tham quan có thể đến khu vực Car Care dành cho các chủ sở hữu quan tâm đến việc chăm sóc, bảo dưỡng xế yêu, hay Car Community là không gian dành cho hoạt động cộng đồng của các hãng xe. Cả gia đình còn có thể cùng nhau giải trí, xả stress cuối tuần với những hoạt động thể chất như giải chạyCarlympicvới đường chạy 1,5 km xung quanh triển lãm, khu vực trò chơi và những góc ẩm thực hấp dẫn. >> Đăng ký tham gia triển lãm, vào cửa tự do Phạm Trung","Thứ tư, 24/12/2025, 05:00 (GMT+7)",Phạm Trung,Xe,Thị trường,VN Express,
VNEX_241225_00068,Mỹ thay đổi luật chơi 'xổ số' H-1B,https://vnexpress.net/my-thay-doi-luat-choi-xo-so-h-1b-4997562.html,"Quy định do Bộ An ninh Nội địa (DHS) thông báo hôm 23/12, dự kiến có hiệu lực vào ngày 27/2/2026, ngay trước đợt chọn người được nhận H-1B ngẫu nhiên vào mùa xuân hàng năm. H-1B là thị thực dành cho lao động nước ngoài trong các ngành nghề chuyên môn, chẳng hạn như chăm sóc sức khỏe, khoa học máy tính và phân tích tài chính. Hiện giới hạn visa H-1B là 85.000 hàng năm. Nếu vượt quá mức này, các ứng viên sẽ được đưa vào một đợt ""xổ số"" ngẫu nhiên để chọn. Theo chính sách mới, những người có thu nhập cao hơn sẽ được đưa vào nhóm lựa chọn với tần suất từ một đến bốn lần, thay vì chỉ một lần như trước. Matthew Tragesser, người phát ngôn của Cơ quan Dịch vụ Nhập cư và Quốc tịch Mỹ (USCIS), cho biết thay đổi này nhằm ngăn chặn tình trạng các doanh nghiệp lợi dụng H-1B để tuyển lao động nước ngoài giá rẻ, gây bất lợi cho công dân Mỹ. Thay vào đó, chính phủ khuyến khích nhà tuyển dụng nộp đơn xin cấp phép cho lao động nước ngoài có trình độ và mức lương cao hơn, từ đó ""tăng khả năng cạnh tranh của Mỹ"". 10 nhóm ngành được cấp visa H-1B nhiều nhất ở Mỹ Khuôn viên Đại học Pennsylvania, Mỹ. Ảnh:University of Pennsylvania Fanpage Tuy nhiên, quy định mới đang vấp phải sự phản đối từ giới công nghệ và giáo dục. Họ lập luận rằng sự thay đổi sẽ làm giảm sức mạnh của ngành công nghệ Mỹ, khiến các công ty chuyển cơ sở và việc làm ra nước ngoài. ""Không đủ sinh viên người Mỹ tốt nghiệp ngành Khoa học máy tính để giúp đất nước đổi mới và tăng trưởng kinh tế. Tại sao chính phủ lại muốn hạn chế lao động nước ngoài?"", Ben Waxman, giám đốc điều hành Intead, công ty chuyên về tiếp thị chiến lược và quản lý tuyển sinh cho giáo dục đại học, chia sẻ vớiThe PIE. Thay đổi còn có thể khiến sức hấp dẫn của Mỹ đối với sinh viên quốc tế giảm sút, bởi họ ngày càng coi kinh nghiệm làm việc và cơ hội nghề nghiệp là các yếu tố chính cho quyết định du học. Trong một cuộc khảo sát gần đây của Hiệp hội giáo dục quốc tế Mỹ với du học sinh, hơn một nửa (53%) cho biết sẽ không đăng ký học ngay từ đầu nếu việc nhận H-1B được xác định bằng mức lương. Tỷ lệ tương tự (54%) nói sẽ không bao giờ đăng ký học tại Mỹ nếu không có Chương trình Đào tạo Thực hành Tùy chọn (OPT) - chính sách mà các chuyên gia dự đoán cũng đang bị đe dọa. Còn những người đang ở Mỹ, đã và sắp tốt nghiệp phải vật lộn với thị trường việc làm ảm đạm. Số lượng công việc cần tuyển đang ở mức thấp nhất kể từ năm 2014, trừ giai đoạn đầu đại dịch Covid-19. Thậm chí, Cục Thống kê Lao động Mỹ từng dự đoán số việc làm mới của tháng 5 và 6 vào khoảng gần 150.000, nhưng thực tế chỉ bằng 1/10. Trong khi đó, số du học sinh ở Mỹ lên tới hơn 1,18 triệu - cao nhất mọi thời. Do đó, cơ hội để được bảo lãnh visa H-1B càng khó khăn hơn. Hồi tháng 9, Mỹ đã có động thái đảm bảo visa H-1B được cấp cho những người có thu nhập cao, trong đó gồm việc tăng phí bảo lãnh lên 100.000 USD – cao hơn tới 20 lần so với mức mà nhà tuyển dụng phải trả trước đây. Khánh Linh","Thứ tư, 24/12/2025, 09:46 (GMT+7)",Khánh Linh,Giáo dục,Du học,VN Express,
VNEX_241225_00091,'Học phí ngầm' trường công,https://vnexpress.net/hoc-phi-ngam-truong-cong-4997472.html,"""Học phí bây giờ được giảm hết, ăn trưa cũng được hỗ trợ. Bớt được đồng nào hay đồng đó, nhưng nặng vào chỗ học liên kết bác ạ"", chị chia sẻ. Chỉ đạocủa Tổng Bí thư Tô Lâm về việc ""đừng thương mại hóa trá hình, không thể biến trường học thành nơi làm dịch vụ, thu tiền"" chạm đúng căn bệnh dai dẳng: miễn học phí ở cổng trường, nhưng trả tiền trong lớp - qua các chương trình liên kết, kỹ năng, STEM - robotics, tiếng Anh tăng cường... được xếp chung thời khóa biểu. Hệ lụy sâu xa không chỉ là vài khoản thu. Đó là lệch động cơ và rối quản trị. Khi ngân sách, biên chế và năng lực cung ứng của trường chưa theo kịp nhu cầu mới, nhà trường chọn ""đường tắt"": đưa dịch vụ vào trường công để bù thiếu. Tâm lý ""có thu thì có chi"" từ đó nảy sinh, và thêm cơ chế giám sát chưa đủ chặt, trường học biến thành bên bán, còn phụ huynh thành ""khách hàng bất đắc dĩ"". Nơi khó xử nhất, cần nói thẳng, là gia đình nghèo. Với họ, ""tự nguyện"" kiểu chen vào giờ học là một thứ ép buộc mềm: không đăng ký thì không thể đón con tan trường sớm, con sẽ ngồi đâu khi các bạn vẫn học; chưa kể nỗi lo con bị tách khỏi nhịp lớp. Khoản thu ấy, vì vậy, không phải chi tiêu lựa chọn, mà là gánh nặng trực tiếp làm suy giảm khả năng chi trả tiền chợ, tiền điện, tiền thuốc - các nhu cầu thiết yếu. Miễn học phí ai cũng mừng, nhưng ở nhiều nơi, học phí chỉ là một phần; gánh nặng giáo dục còn đến từ các khoản thu do chương trình liên kết. Khi ""tự nguyện"" bị trộn vào thời khóa biểu, nó không còn là tự nguyện nữa; nó biến thành một khoản phải đóng để con được yên ổn. Đó là sự bất cập cần được xử lý rốt ráo. Muốn chữa tận gốc, phải chặn ngay điểm biến tướng: trộn lẫn bắt buộc với tự nguyện. Kinh nghiệm quốc tế cho thấy: cái gì là giáo dục trong giờ học thì không được thu. Ở Anh, hướng dẫn ""Charging for school activities"" (Thu tiền cho các hoạt động nhà trường) nêu nguyên tắc: trường công không được thu tiền cho giáo dục trong giờ học; các dịch vụ ""mở rộng ngày học"" có thể có phí nhưng không được biến thành khoản bắt buộc. Vậy gỡ thế nào để ""tự nguyện"" trở lại đúng nghĩa, không còn là việc bất đắc dĩ phải làm? Trước hết, đóng ngay cửa ""thời khóa biểu"": các chương trình thu tiền từ bên thứ ba không được chèn vào khung giờ bắt buộc (kể cả bán trú). Muốn gọi là tự nguyện thì phải bố trí ngoài giờ. Và quan trọng hơn cả, học sinh không tham gia vẫn phải có phương án trông giữ/ sinh hoạt thay thế an toàn, để phụ huynh khó khăn không bị dồn vào thế ""đăng ký cho xong"". Kế tiếp, dạy liên kết vẫn phải phù hợp với tính chất trường công. Chọn đối tác theo tiêu chí nào, dạy nội dung gì, mục tiêu cụ thể ra sao, chi phí bao nhiêu, chia sẻ thu - chi thế nào... phải công khai, có giám sát, có kiểm toán, có kênh phản ánh. Cái gì không thể minh bạch thì không nên đưa vào trường công, gây lẫn lộn: danh nghĩa là công, vận hành lại như tư, và phụ huynh gánh học phí ngầm. Vấn đề cốt lõi còn nằm ở quản lý nhà nước: thiếu hụt năng lực phải được bù đắp bằng đầu tư cho nhà trường, không thể giải quyết bằng cách tăng các khoản thu. Thiếu giáo viên tin học, tiếng Anh, công nghệ... thì tuyển dụng, bồi dưỡng; điều phối, ưu tiên ngân sách cho các năng lực cốt lõi. Không thể để tình trạng muốn học đủ kiến thức, kỹ năng thì phải đăng ký học liên kết thêm - vừa sai tinh thần giáo dục công, vừa làm hỏng chất lượng và tạo sự bất công. Các dịch vụ sau giờ học (trông trẻ, hoạt động kỹ năng...), có thể chấp nhận vì nhu cầu là có thật, nhưng phải quản theo logic phúc lợi, không theo logic ""vé vào cửa"". Kinh nghiệm như Singapore cho thấy có thể tổ chức chăm sóc học sinh trong trường và có hỗ trợ theo thu nhập để con nhà nghèo không bị thiệt; điều quan trọng là dịch vụ phải đúng nghĩa tự nguyện, minh bạch và có cơ chế hỗ trợ. Cuối cùng, thanh tra phải đều tay và xử phải ""đủ đau""; thay vì chỉ thanh kiểm tra dịp đầu - cuối năm, hoặc chờ báo chí phát hiện. Cần kiểm tra định kỳ trong năm học, công khai kết quả, gắn trách nhiệm người đứng đầu... Muốn chấm dứt ""thương mại hóa trá hình"" đừng chỉ kêu gọi đạo đức, mà phải đóng đúng cánh cửa tạo ra ép buộc mềm (thời khóa biểu), minh bạch hóa dòng tiền, đầu tư năng lực công, và thiết kế cơ chế hỗ trợ để trẻ em nghèo không bị sàng lọc bằng túi tiền. Hoàng Ngọc Vinh","Thứ tư, 24/12/2025, 00:00 (GMT+7)",Hoàng Ngọc Vinh,Góc nhìn,Giáo dục & tri thức,VN Express,
VNEX_241225_00013,Dấu ấn qua 30 năm phát triển của Vietravel,https://vnexpress.net/dau-an-qua-30-nam-phat-trien-cua-vietravel-4997370.html,"Vietravel ra đời năm 1995, khi du lịch Việt Nam mới bắt đầu hội nhập. Trong bối cảnh này, quyết định thành lập một công ty lữ hành chuyên nghiệp được xem là bước đi đầy táo bạo. Qua nhiều bước nhảy, từ một doanh nghiệp còn phải chắt chiu từng đồng để trả lương tháng đầu tiên, Vietravel nay chuyển mình theo mô hình ""Doanh nghiệp Xanh - Số - Tuần hoàn kết nối sâu"", sau 30 năm thành lập. ""Tháng đầu tiên, tôi không thể quên khoảnh khắc mọi người nhìn mình chờ lương. Khi đó trong lòng ai cũng có chút hoài nghi. Nhưng cả tập thể vẫn chọn kiên trì, bởi chúng tôi tin rằng du lịch là con đường lan tỏa giá trị văn hóa Việt Nam"", ông Nguyễn Quốc Kỳ, Chủ tịch HĐQT Tập đoàn Du lịch Vietravel nhớ lại. Ông Nguyễn Quốc Kỳ, Chủ tịch HĐQT Tập đoàn Du lịch Vietravel. Ảnh:Vietravel Từ chuyến xe xuyên Việt đến hành trình thế giới Những ngày đầu thành lập, Vietravel chỉ có trong tay nguồn lực hạn chế. Công ty chọn cách đi từ những điều nhỏ nhất: khai thác các tuyến nội địa bằng đường bộ và đường sắt, đưa khách xuyên Việt qua TP HCM - Hà Nội - Nha Trang - Đà Lạt. Theo ông, đây là những tour thương mại đầu tiên do một doanh nghiệp tư nhân tổ chức, minh chứng cho tư duy ""làm du lịch phải tạo ra những hành trình kết nối đất nước bằng trải nghiệm thực sự"". Văn phòng của Vietravel những ngày mới thành lập. Ảnh:Vietravel Đến năm 2002, bước ngoặt lớn đến với Vietravel khi chính thức nhận giấy phép lữ hành quốc tế. Quyết định này mở cánh cửa cho doanh nghiệp bước ra thế giới. Các thị trường Mỹ, Pháp, Australia, Thái Lan, Campuchia và Ấn Độ lần lượt được khai phá, đưa cái tên Vietravel vượt khỏi biên giới Việt Nam. Cũng trong thời điểm ấy, ngành du lịch toàn cầu liên tiếp đối mặt với dịch cúm gia cầm H5N1, đại dịch SARS, thảm họa động đất - sóng thần. ""Có những lúc tưởng như mọi thứ sẽ dừng lại. Nhưng nếu sợ hãi, chúng ta sẽ không bao giờ đi xa được"", ông Nguyễn Quốc Kỳ chia sẻ. Chính sự bình tĩnh, kiên định và tầm nhìn dài hơi ấy đã giúp Vietravel đứng vững, thậm chí trưởng thành hơn sau mỗi biến cố. Đi qua một thập niên, đến 2007, công ty bắt đầu mở rộng với sự ra đời của mạng bán tour trực tuyến đầu tiên tại Việt Nam. Chiến lược giúp công ty tăng trưởng liên tục. Năm 2010, Vietravel gia nhập ""câu lạc bộ 1.000 tỷ"" với tổng doanh thu 1.480 tỷ đồng. Từ 2013 đến 2015, công ty mở rộng mạng lưới quốc tế và chuyển đổi sang mô hình công ty cổ phần. Năm 2015, Vietravel bước vào giai đoạn mới: chuyển sang mô hình tập đoàn, hoàn thiện chuỗi giá trị du lịch - dịch vụ. 4 năm sau, đơn vị thành lập Vietravel Airlines. Hiện tại, Vietravel bước vào thời kỳ tái định vị thương hiệu với tầm nhìn 10 năm, đặt mục tiêu xanh hóa mô hình. Tại sự kiện kỷ niệm 30 năm thành lập vào ngày 20/12, ông Nguyễn Quốc Kỳ, Chủ tịch HĐQT Tập đoàn Du lịch Vietravel nói, 30 năm qua công ty không ít lần trải qua thách thức, gắn với biến cố toàn cầu. Những biến cố ấy trải dài, từ khủng hoảng tài chính châu Á 1997, dịch SARS 2002, suy thoái toàn cầu 2008-2012, cho đến đại dịch Covid-19. ""Năm 2021, nguồn thu của công ty gần như bằng 0 suốt mấy tháng liền, đó là ký ức không ai muốn lặp lại. Nhưng chính trong những thời điểm tăm tối nhất, tôi lại thấy được sức mạnh đoàn kết của tập thể Vietravel - những con người quyết tâm giữ lửa, giữ nghề, giữ niềm tin"", ông chia sẻ. Để vượt qua những lần ""thử lửa"" đó, Chủ tịch Vietravel nói rằng sức mạnh lớn nhất của doanh nghiệp nằm ở con người. Nhiều nhân viên vào Vietravel khi còn là sinh viên, rồi trưởng thành, trở thành lãnh đạo. Có người gắn bó đến ngày nghỉ hưu, có người đã không còn nữa. ""Họ là những lớp người đã dựng nên nền móng Vietravel"", ông chia sẻ đầy xúc động. Hướng dẫn viên Vietravel trong một lần dẫn tour tham quan TP HCM. Ảnh:Vietravel Đến nay, tập đoàn 13 năm liên tiếp được vinh danh tại Giải thưởng Du lịch Thế giới (World Travel Awards), 7 lần đạt danh hiệu Thương hiệu Quốc gia do Bộ Công Thương trao tặng cùng nhiều Huân chương Lao động. Bên cạnh phát triển kinh doanh, Vietravel nhiều lần được các bộ, ngành, hiệp hội giao trọng trách tổ chức các chương trình xúc tiến điểm đến và sự kiện ngoại giao văn hóa quy mô lớn như Hội nghị Cấp cao APEC, Đại lễ Vesak, Đại hội Thể thao Bãi biển châu Á hay ""Những ngày Việt Nam tại Pháp"". Đổimới sau 30 năm Bước sang tuổi 30, Vietravel công bố nhận diện thương hiệu mới, đánh dấu cột mốc chuyển mình mang ý nghĩa chiến lược. Theo đơn vị, sự kiện thể hiện bước trưởng thành bền vững, quyết tâm đổi mới, tinh thần đi trước đón đầu và sự chuẩn bị toàn diện để bước vào giai đoạn phát triển tiếp theo với tư duy hiện đại, linh hoạt, hướng đến phát triển bền vững. Ông Kỳ nói, việc tái nhận diện thương hiệu không dừng lại ở thay đổi yếu tố hình ảnh, mà là quá trình tái định vị toàn diện, nhằm nâng cao năng lực thích ứng của Vietravel trước những biến động nhanh của thị trường, sự thay đổi trong hành vi du khách và các tiêu chuẩn ngày càng cao về chất lượng trải nghiệm trong kỷ nguyên số. Đây là bước chuyển quan trọng giúp Vietravel củng cố nền tảng cho giai đoạn tăng trưởng mới, phù hợp với tầm nhìn dài hạn của doanh nghiệp. Công ty Cổ phần Du lịch Vietravel trong sự kiện ra mắt nhận diện thương hiệu mới. Ảnh:Vietravel Trong diện mạo mới, thương hiệu Vietravel sử dụng sắc xanh hiện đại, thể hiện tinh thần đổi mới, sức trẻ và sự bền vững. Biểu tượng ""Mặt Trời đỏ"" được kế thừa, tinh giản và hoàn thiện từ dấu ấn quen thuộc qua nhiều năm, với bố cục chuyển động hài hòa, thể hiện năng lượng tích cực, khát vọng vươn xa và tinh thần đổi mới liên tục. Song hành cùng hình ảnh mới, tuyên ngôn thương hiệu ""Your Journey - Your Value"" khẳng định định hướng của doanh nghiệp trong giai đoạn mới: đặt khách hàng ở vị trí trung tâm, không ngừng nâng cao chất lượng dịch vụ. Lý giải nguyên nhân cho sự thay đổi này, Chủ tịch HĐQT Tập đoàn Du lịch Vietravel, cho biết 2025 là dấu mốc hội tụ hai yếu tố của Vietravel: sự trưởng thành nội lực và thay đổi thị trường. Theo đó, hậu đại dịch, Vietravel cần giai đoạn phục hồi. Đến nay hành vi khách hàng, công nghệ, chuỗi cung ứng đã thay đổi mạnh; 30 năm là thời điểm chín muồi để khởi động chu kỳ tăng trưởng 2025-2035 bền vững hơn. Ngoài ra, có ba thách thức chính hiện nay mà Vietravel cần phải thực sự chuyển đổi để bắt kịp với xu hướng thị trường: sự khác biệt và làm mới sản phẩm, chuyển đổi số, và thay đổi mạnh của chuỗi cung ứng cũng như nhu cầu thị trường Một doanh nghiệp bền vững không chỉ được đo bằng chỉ số phát triển mà còn nằm ở độ thích ứng - xoay chuyển để đúng nhịp thị trường. ""30 năm là thời điểm chín muồi để Vietravel khởi động chu kỳ tăng trưởng mới, khi nội lực đã đủ mạnh, thị trường thay đổi và tầm nhìn phát triển đã rõ ràng"", ông nhấn mạnh. Lúc này, chiến lược 10 năm (2025-2035) của doanh nghiệp được xây dựng trên ba trụ cột: Doanh nghiệp Xanh, Doanh nghiệp Số và Doanh nghiệp Tuần hoàn - Kết nối sâu. Doanh nghiệp Xanh khẳng định cam kết của Vietravel đối với môi trường và cộng đồng, thúc đẩy du lịch có trách nhiệm, lan tỏa lối sống bền vững và gắn kết văn hóa địa phương. Doanh nghiệp Số cho thấy bước tiến mạnh mẽ trong chuyển đổi số - ứng dụng dữ liệu và công nghệ hiện đại nhằm cá nhân hóa trải nghiệm, tối ưu hiệu quả vận hành và xây dựng hệ sinh thái thông minh. Doanh nghiệp Tuần hoàn - Kết nối sâu hiện thực hóa triết lý phát triển dựa trên sự đồng hành và gắn bó lâu dài với khách hàng, các đối tác chiến lược và cộng đồng - sẻ chia giá trị, thúc đẩy kinh tế địa phương, hướng tới phát triển du lịch bền vững. Từ đó, các sản phẩm du lịch của Vietravel được tái thiết kế theo chủ đề như nghệ thuật, thể thao, du lịch chăm sóc sức khỏe (wellness), đồng thời cá nhân hóa trải nghiệm nhờ dữ liệu và công nghệ, mang đến dịch vụ linh hoạt 24/7. Doanh nghiệp cũng định hướng năm nhóm sản phẩm chiến lược gồm du lịch xanh - bền vững, du lịch wellness, du lịch sự kiện - giải trí, du lịch cao cấp và du lịch dành cho gia đình trẻ, thế hệ Gen Z. Các tour ""Di sản miền Trung"", ""Hành trình xanh Tây Bắc"", ""Về nguồn - kết nối văn hóa Việt"" tiếp tục được mở rộng, hướng đến khách quốc tế. Song song, doanh nghiệp đầu tư hệ thống dữ liệu, CRM và AI để dự đoán nhu cầu, tối ưu hóa hành trình, chăm sóc khách hàng toàn diện. Vietravel cũng lan tỏa tinh thần du lịch bền vững qua các dự án ""Du lịch cùng học sinh vùng cao"", ""Chung tay giữ màu xanh Việt Nam"", ""Vietravel đồng hành cùng di sản"". Vietravel nhận định năm 2025, ngành du lịch Việt Nam phục hồi mạnh, trở thành thời cơ vàng để đổi mới sản phẩm, nâng cấp trải nghiệm và đẩy mạnh xúc tiến văn hóa. Vì vậy, đơn vị đặt mục tiêu tham vọng là doanh thu thuần hơn 9.500 tỷ đồng, hướng tới vị thế tập đoàn du lịch hàng đầu châu Á. Việc thoái vốn khỏi Vietravel Airlines trong năm nay được xem là bước ""quay lại giá trị cốt lõi"", tập trung nguồn lực cho lĩnh vực lữ hành và dịch vụ. ""Suốt 30 năm, chúng tôi theo đuổi sứ mệnh mang lại giá trị sống bền vững. Mỗi chuyến đi mở ra một điểm đến, khơi dậy cảm xúc, niềm tin và khát vọng sống tích cực trong mỗi con người"", ông Nguyễn Quốc Kỳ nói thêm. Thái Anh","Thứ tư, 24/12/2025, 07:00 (GMT+7)",Thái Anh,Kinh doanh,Doanh nghiệp,VN Express,
