id,title,link,content,date,author,category,sub_category,source,summary
VNEX_251025_00071,Vì sao nam giới hai con không vợ được ưu tiên mua nhà xã hội?,https://vnexpress.net/vi-sao-nam-gioi-hai-con-khong-vo-duoc-uu-tien-mua-nha-xa-hoi-4955429.html,"Ngày 24/10, ông Lê Thanh Dũng, Cục trưởng Dân số, Bộ Y tế, cho hay chính sách duy trì mức sinh thay thế là một trong 4 nhóm chính sách lớn được quy định dự thảo Luật Dân số. Trong đó Luật tiếp tục kế thừa quy định quyền và nghĩa vụ của mỗi cặp vợ chồng, cá nhân trong việc sinh con tại Pháp lệnh Dân số, đồng thời quy định các biện pháp, chính sách nhằm khuyến khích, hỗ trợ cặp vợ chồng, cá nhân sinh con, nuôi con. Đối với chính sách ưu tiên mua hoặc thuê nhà ở xã hội, Luật Nhà ở xã hội năm 2023 quy định các đối tượng và điều kiện được hưởng. Trong đó hướng đến người nghèo, cận nghèo, thu nhập thấp hoặc công chức, viên chức, công nhân, lao động khu công nghiệp... mà không phân biệt có con hay chưa có con. Do vậy, dự thảo Luật Dân số đề xuất đưa tiêu chí ""phụ nữ sinh đủ hai con hoặc nam giới có hai con đẻ mà không có vợ hoặc vợ đã chết"" được ưu tiên xét hưởng chính sách nhà ở xã hội. ""Chính sách này nhằm giúp gia đình, vợ chồng, cá nhân có hai con sớm an cư, giảm bớt gánh nặng về nhà ở, tập trung cho việc chăm sóc, nuôi dạy con cái"", ông Dũng giải thích. Tuy nhiên, dự thảo không đưa ra các tiêu chí xét ""nam giới có con không vợ"" cụ thể như thế nào, độ tuổi, điều kiện kèm hỗ trợ nhà ở xã hội ra sao... Hai em bé chào đời sinh đôi chào đời ở Bệnh viện Từ Dũ. Ảnh:Ngọc Ngân Ngoài các chính sách về ưu tiên mua nhà xã hội, dự luật Dân số xác định quyết định thời điểm, số con và khoảng cách sinh là quyền của mỗi cặp vợ chồng, cá nhân, song Nhà nước khuyến khích duy trì mức sinh thay thế. Theo đó, phụ nữ sinh con thứ hai được nghỉ thêm một tháng thai sản; nam giới được nghỉ thêm 5 ngày làm việc khi vợ sinh con. Phụ nữ sinh đủ hai con trước 35 tuổi, phụ nữ dân tộc thiểu số và ở địa phương có mức sinh thấp được hỗ trợ tài chính theo chính sách của Nhà nước. Các địa phương được giao căn cứ điều kiện kinh tế - xã hội từng thời kỳ để quy định cụ thể, bảo đảm tính linh hoạt và phù hợp ngân sách. Ngoài ra, chính quyền có thể mở rộng các phúc lợi xã hội cho gia đình sinh đủ hai con như giảm học phí, ưu tiên dịch vụ giữ trẻ, hỗ trợ giáo dục mầm non. ""Tăng thời gian nghỉ thai sản khi sinh con thứ hai và ưu tiên xét mua hoặc thuê nhà ở xã hội đối với cá nhân, vợ chồng sinh đủ hai con là hai chính sách lớn sát sườn đối với người dân"", ông Dũng đánh giá. Chính sách về duy trì mức sinh thay thế có thể coi là giải pháp trước mắt nhằm ngăn chặn xu hướng giảm sinh đang lan rộng trên phạm vi toàn quốc; khắc phục tình trạng sinh con muộn, sinh ít hoặc không sinh con. Tuy nhiên, sức ép về kinh tế trong việc sinh, nuôi dạy con cùng với biện pháp hỗ trợ gia đình có con nhỏ, đặc biệt tại các khu vực kinh tế, khu công nghiệp còn hạn chế. Nhu cầu phát triển sự nghiệp, tìm kiếm thu nhập cao hơn, trải nghiệm bản thân... là những yếu tố tác động đến xu hướng kết hôn, sinh con muộn, sinh ít hoặc không sinh con. Vì vậy, các chính sách nêu trên được đề xuất xuất phát từ thực tiễn mức sinh đang giảm thấp dưới mức sinh thay thế tại Việt Nam, đồng thời tham khảo có chọn lọc kinh nghiệm quốc tế phù hợp với các giá trị văn hóa dân tộc và con người Việt Nam, theo ông Dũng. Bác sĩ Mai Xuân Phương, nguyên Phó Vụ trưởng Vụ Truyền thông - Giáo dục (Tổng cục Dân số), nhìn nhận nhiều địa phương, đặc biệt tỉnh, thành phố lớn như TP HCM, Đà Nẵng, Thừa Thiên - Huế, Đồng Tháp...mức sinh thấpdưới 1,5 con/phụ nữ, thấp hơn nhiều so với mức sinh thay thế (2,1 con/phụ nữ). ""Mức sinh thấp kéo dài không chỉ là câu chuyện dân số mà còn là thách thức phát triển quốc gia"", ông Phương nói. Nếu không có những chính sách khuyến sinh kịp thời, đồng bộ và đủ mạnh, Việt Nam có thể đối mặt với nguy cơ già hóa trước khi giàu, và đánh mất cơ hội tận dụng giai đoạn dân số vàng hiện nay. Ông Phương đánh giá Dự thảo Luật dân số đưa ra một số chính sách cụ thể, như ưu tiên tiếp cận nhà ở xã hội cho gia đình sinh đủ hai con, tăng quyền lợi nghỉ thai sản cho con thứ hai, hỗ trợ tài chính cho các nhóm mục tiêu. Những quy định này có thể tạo động lực thực tế cho một bộ phận gia đình. Tuy nhiên, hiệu quả lâu dài phụ thuộc nhiều vào nguồn lực thực thi, cơ chế hỗ trợ doanh nghiệp để tránh phân biệt lao động nữ. Quan trọng nhất là phải có gói chính sách toàn diện như nhà ở, chăm sóc trẻ, việc làm ổn định, giáo dục. Lê Nga","Thứ bảy, 25/10/2025, 05:00 (GMT+7)",Lê Nga,Sức khỏe,Tin tức,VN Express,
VNEX_251025_00084,Hyundai Venue thế hệ mới ra mắt,https://vnexpress.net/hyundai-venue-the-he-moi-ra-mat-4955608.html,"Hyundaihé lộ Venue thế hệ mới trước khi chính thức ra mắt vào ngày 4/11. Hãng cũng đã nhận đặt hàng tại các đại lý ở Ấn Độ, với khoản đặt trước 285 USD. Venue mới cao hơn, rộng hơn và có chiều dài cơ sở lớn hơn so với phiên bản tiền nhiệm, nhằm mục đích cung cấp không gian cabin rộng rãi hơn. Mẫu xe này phù hợp với chiến lược hiện tại của Hyundai là cung cấp những chiếc SUV nhỏ gọn, thiết thực được thiết kế để sử dụng trong đô thị, đồng thời đáp ứng nhu cầu của người mua ưu tiên tính linh hoạt và khả năng kết nối. Ngoại thất của Venue mới áp dụng ngôn ngữ thiết kế SUV mới nhất của Hyundai. Dải đèn LED liền mạch ở phía trước, một tính năng hiện đã trở thành đặc trưng của hầu hết các mẫu xe Hyundai hiện đại. Đèn LED chạy ban ngày tách rời và đóng vai trò như đèn báo rẽ. Đèn pha LED 4 bóng bố trí trên cản trước, nơi sơn hai tông màu. Một tấm ốp bảo vệ gầm giả. Cảm biến đỗ xe phía trước. Logo Hyundai mới được đặt trên nắp ca-pô. Lưới tản nhiệt mạ crôm tối màu với các khe hút gió hình chữ nhật. Chắn bùn loe rộng với ốp viền quanh vòm bánh xe. Tay nắm cửa truyền thống và thanh ray trên nóc xe cùng màu thân xe. Phần đuôi xe nổi bật với cụm đèn hậu LED và dải đèn LED liền mạch. Cửa hậu trông gọn gàng với nhiều đường gân dập nổi, và giống như phía trước, một tấm ốp gầm giả màu bạc phía cản sau. Cản sau gắn biển số xe và có đèn phản quang. Cánh gió tích hợp và ăng-ten vây cá mập. Một trong những thay đổi lớn nhất sẽ là việc bổ sung hệ thống hỗ trợ lái xe tiên tiến (ADAS) cấp độ 2. Chiếc SUV trang bị camera 360 độ, cửa sổ trời chỉnh điện, ghế lái chỉnh điện, hệ thống thông gió ghế trước và màn hình cong bao gồm hệ thống thông tin giải trí màn hình cảm ứng và cụm đồng hồ kỹ thuật số. Hyundai Venue thế hệ mới trong một lần bị bắt gặp chạy thử mà không có lớp ngụy trang. Ảnh:Korean Car Blog Không có thay đổi nào dưới nắp ca-pô. Venue 2026 giữ nguyên các tùy chọn động cơ như trước: động cơ xăng hút khí tự nhiên 1,2 lít, động cơ xăng tăng áp 1 lít và động cơ dầu 1,5 lít. Các tùy chọn hộp số cũng không thay đổi, với hộp số sàn, tự động và DCT. Tại Ấn Độ, Hyundai Venue sẽ bán ra gồm 7 phiên bản máy xăng và 4 phiên bản máy dầu. Giá bán chưa được công bố. Tại thị trường Việt Nam,Hyundai Venuelắp ráp trong nước, lắp động cơ 1.0 tăng áp và bán hai phiên bản, tiêu chuẩn giá từ 499 triệu đồng và đặc biệt từ 539 triệu đồng. Mỹ Anh(theoCartoq)","Thứ bảy, 25/10/2025, 10:22 (GMT+7)",Mỹ Anh,Xe,Thị trường,VN Express,
VNEX_251025_00070,'Chợ' tinh trùng trên Facebook,https://vnexpress.net/cho-tinh-trung-tren-facebook-4954861.html,"""Tôi là cựu quân nhân 31 tuổi, cựu cầu thủ bóng bầu dục bán chuyên"", một người dùng Facebook viết. ""Cao 1m83, tóc nâu sẫm, mắt nâu"", một người khác mời chào. ""Tôi khỏe mạnh, vóc dáng cân đối, đến phòng tập ba lần một tuần"", người thứ ba giới thiệu. TheoTelegraph, những hồ sơ này trông giống quảng cáo hẹn hò, nhưng mục đích của họ không phải là tìm kiếm sự lãng mạn. Họ đang cung cấp tinh trùng cho người lạ trên ""Sperm Donors UK"", một nhóm Facebook có hơn 17.500 thành viên. Đây là một trong hàng chục nhóm trực tuyến, nơi phụ nữ, dù đơn thân hay có bạn đời, có thể ""mua sắm"" người hiến tặng tiềm năng. Giọng điệu các bài đăng thay đổi đột ngột, từ mong muốn nhân văn giúp người khác thực hiện ước mơ, đến những lời đề nghị đáng lo ngại như ""tinh trùng miễn phí"" để đổi lấy quan hệ tình dục. Đối với các chuyên gia, hoạt động giao dịch không được kiểm soát này đang đặt ra những câu hỏi đáng báo động. Tại Anh, trong những thập niên giữa thế kỷ 20, hiến tinh trùng là một hoạt động ẩn danh, thường do các bác sĩ tự sắp xếp một cách kín đáo và không có hồ sơ lưu trữ chính thức. Bước ngoặt lớn là sự ra đời của Đạo luật Phôi thai và Thụ tinh Nhân tạo năm 1990, lần đầu tiên thiết lập một khung pháp lý toàn diện cho việc hỗ trợ sinh sản, nhưng vẫn duy trì quyền ẩn danh tuyệt đối cho người hiến tặng. Một sự thay đổi mang tính cách mạng đã diễn ra vào năm 2005, khi chính phủ Anh bãi bỏ quyền ẩn danh của người hiến tinh trùng. Kể từ thời điểm đó, bất kỳ đứa trẻ nào được sinh ra từ tinh trùng hiến tặng đều có quyền hợp pháp để biết danh tính của người cha sinh học khi tròn 18 tuổi. Mặc dù quyết định này được đưa ra vì lợi ích tốt nhất của đứa trẻ, nó đã gây ra một hệ quả không lường trước khi số lượng người tình nguyện hiến tặng sụt giảm nghiêm trọng. Ngoài ra, quy trình hiến tinh trùng chính thức được giám sát chặt chẽ bởi Cơ quan Phôi thai và Thụ tinh Nhân tạo (HFEA). Người hiến tặng tại các phòng khám được cấp phép phải trải qua sàng lọc y tế toàn diện để loại trừ các bệnh di truyền và truyền nhiễm. Người hiến chỉ nhận một khoản phụ cấp nhỏ, và mọi hình thức trả tiền khác đều bị cấm. Tuy nhiên, con đường chính thống này có hai rào cản lớn là chi phí và sự khan hiếm. Chi phí cho một mẫu tinh trùng dao động t900-1.300 bảng Anh, chưa kể các dịch vụ hỗ trợ sinh sản như bơm tinh trùng vào tử cung (IUI) có giá khoảng 1.500 bảng mỗi chu kỳ. Nguồn cung chính thức cũng thiếu hụt trầm trọng, một phần vì luật pháp giới hạn tinh trùng của một người hiến chỉ được dùng để tạo ra tối đa 10 gia đình, nhằm giảm nguy cơ quan hệ cận huyết ngoài ý muốn. Theo một nghiên cứu của tạp chíHuman Fertility, thời gian chờ đợi trung bình cho tinh trùng hiến tặng tại các phòng khám ở Anh có thể kéo dài từ 6 đến 12 tháng. Các chuyên gia nhận định sụt giảm nguồn cung này, kết hợp với nhu cầu làm cha mẹ ngày càng tăng (đặc biệt từ phụ nữ đơn thân và các cặp đôi đồng giới), tạo ra một tình trạng khan hiếm trầm trọng trong hệ thống chính thức. Chính sự mất cân bằng cung cầu này, cùng với chi phí đắt đỏ của các phòng khám tư nhân, đã trở thành mảnh đất màu mỡ cho sự trỗi dậy của Internet và sau đó là mạng xã hội. Ngoài các nhóm Facebook, một startup tên ""The Y Factor"" ra mắt vào tháng 6, tự quảng cáo là ""phương thức hiện đại và có đạo đức"" để kết nối người hiến và người nhận. Ứng dụng này hoạt động tương tự một ứng dụng hẹn hò, cho phép người dùng tạo hồ sơ, tải ảnh và nêu rõ phương thức thụ thai mong muốn, từ ""tự làm"" tại nhà đến ""tự nhiên"" (quan hệ tình dục). Sofie Hafström Kritsotaki, đồng sáng lập ứng dụng, cho biết khoảng 70% người hiến tặng miễn phí, trong khi một số người nhận sẵn sàng trả 50-100 bảng để bồi thường chi phí đi lại. Giao diện của startup Y Factor. Ảnh:Telegraph Bất chấp sự tiện lợi, HFEA cảnh báo rằng việc tìm người hiến qua mạng xã hội, bỏ qua các bước sàng lọc y tế, bảo vệ pháp lý và kiểm tra tâm lý, là một hành động ""đốt cháy giai đoạn"" đầy rủi ro, đầu tiên là về sức khỏe và xã hội. Năm 2016, Simon Watson gây chấn động khi tuyên bố đã làm cha của 800 đứa trẻ thông qua việc bán tinh trùng không kiểm soát trên mạng. Các chuyên gia sinh sản gọi đây là hành vi ""gây xáo trộn sâu sắc"", làm tăng nguy cơ ""loạn luân vô tình"" trong tương lai. Thứ hai là rủi ro pháp lý. Đầu năm nay, tòa án gia đình phải công khai danh tính Robert Charles Albon, kẻ tự xưng đã có hơn 180 con, để cảnh báo cộng đồng. Sau khi hiến tinh trùng cho một cặp đồng tính nữ, Albon cố gắng đòi quyền làm cha mẹ và có tên trên giấy khai sinh, dù các cáo buộc của ông ta bị thẩm phán bác bỏ và mô tả là ""mang tính thao túng"". Nina Barnsley, Giám đốc Mạng lưới Thụ thai từ người hiến (DCN), nhấn mạnh: ""Người hiến có thể bị coi là cha mẹ hợp pháp, và người mẹ cũng dễ bị tổn thương khi người đàn ông đưa ra yêu sách đối với đứa trẻ. Sự rõ ràng về mặt pháp lý này không tồn tại bên ngoài phòng khám"". Đối với những người như Natalie Lovejoy, 42 tuổi, việc xin tinh trùng hợp pháp là bất khả thi về tài chính. Vì thế, cô đã thử các nhóm Facebook nhưng cảm thấy ""nhếch nhác"" vì nhiều người ""khăng khăng chỉ thụ tinh tự nhiên"" hoặc có vẻ là ""những kẻ hiến tặng hàng loạt"". Cô tìm đến The Y Factor như một giải pháp trung gian có vẻ an toàn hơn, nhưng vẫn thừa nhận sự mệt mỏi: ""Vẫn chưa gặp được ai, và tôi nhận ra các ứng dụng hẹn hò thật tồi tệ"". Trong khi đó, Meta, công ty mẹ của Facebook, cho biết đang điều tra nhóm Sperm Donors UK. Theo chính sách của công ty, việc quảng cáo hiến tặng dịch cơ thể người (như tinh dịch) được cho phép nhưng việc mua, bán hoặc trao đổi những vật liệu này thì bị cấm. Bình Minh(TheoTelegraph)","Thứ bảy, 25/10/2025, 01:05 (GMT+7)",Bình Minh,Sức khỏe,Tin tức,VN Express,
VNEX_251025_00097,"Dự kiến từ 2026, người dân phải cung cấp số lượng nhà đất sở hữu",https://vnexpress.net/du-kien-tu-2026-nguoi-dan-phai-cung-cap-so-luong-nha-dat-so-huu-4955574.html,"Đề xuất trên được Bộ Xây dựng nêu trong dự thảo Nghị định về xây dựng, quản lý cơ sở dữ liệu về nhà ở và thị trường bất động sản đang lấy ý kiến. Dự thảo gồm 6 chương và 47 điều, trong đó bổ sung thêm quy định về thông tin sở hữu nhà ở. Theo đó, tổ chức, cá nhân Việt Nam và nước ngoài sẽ phải cung cấp trường dữ liệu gồm thông tin nhận diện (họ tên, số định danh, giấy tờ pháp lý); loại hình nhà sở hữu, địa chỉ, diện tích, số lượng; thời hạn và hình thức sở hữu; tình trạng pháp lý. Dự thảo cũng bổ sung thông tin về thụ hưởng chính sách, hỗ trợ nhà ở gồm thông tin định danh, loại hình thụ hưởng (nhà xã hội, nhà ở cho người có công, nhà cho người nghèo, cận nghèo...), số lượng và thời gian thụ hưởng. Người dân thuộc nhóm được mua nhà xã hội cần cung cấp thông tin định danh cá nhân, hình thức đăng ký (mua, thuê, thuê mua) và dự án sẽ đăng ký. Với nhà ở thuộc tài sản công, tổ chức, cá nhân sẽ cung cấp số lượng tài sản, diện tích, mục đích sử dụng, tình trạng quản lý và đơn vị được giao quản lý. Trước đó, Nghị định 94 về cơ sở dữ liệu về nhà ở và thị trường bất động sản chưa có quy định chi tiết về thông tin sở hữu nhà của tổ chức, cá nhân. Lý giải đề xuất này, Bộ Xây dựng cho biết quy định mới giúp nâng cao chất lượng dữ liệu được thu thập, từ đó làm minh bạch thông tin, điều tiết thị trường, đáp ứng nhu cầu chính đáng của xã hội. Bất động sản khu đông TP HCM. Ảnh:Quỳnh Trần Bộ Xây dựng cũng đề xuấttạo mã số bất động sảnvà quản lý trên hệ thống thông tin. Mỗi dự án bất động sản sẽ được gắn tự động một mã số duy nhất, bảo đảm tính định danh và không thay đổi trong suốt vòng đời dữ liệu. Cơ quan chuyên môn cấp tỉnh sẽ khởi tạo mã số này trên địa bàn tại thời điểm dự án được chấp thuận, phê duyệt đồng thời tiếp tục liên kết, cập nhật dữ liệu với từng sản phẩm trong dự án đó. Trường thông tin cấu thành mã số dự án bất động sản gồm chủ đầu tư, vị trí, quy mô, tổng vốn đầu tư, thời hạn hoạt động, tiến độ cùng các văn bản pháp lý (chấp thuận đầu tư, lựa chọn nhà đầu tư, quy hoạch chi tiết, giấy phép xây dựng...). Bên cạnh nhóm nhà ở thương mại, nhà xã hội, dữ liệu này còn gồm nhiều loại hình đặc thù như nhà lưu trú công nhân trong khu công nghiệp, nhà ở công vụ, nhà tái định cư, nhà ở cho lực lượng vũ trang, nhà cho thuê do hộ gia đình hoặc doanh nghiệp đầu tư, cũng như nhà ở bán cho tổ chức, cá nhân nước ngoài. Về lộ trình triển khai, Bộ Xây dựng đề xuất giai đoạn chuẩn bị từ quý IV năm nay, gồm triển khai thí điểm tại 5 thành phố gồm Hà Nội, TP HCM, Hải Phòng, Đà Nẵng và Cần Thơ. Hai quý đầu năm 2026 sẽ là giai đoạn triển khai kỹ thuật và cập nhật dữ liệu. Cơ quan quản lý sẽ tích hợp dữ liệu để đồng bộ với Hệ thống thông tin quốc gia về nhà ở và thị trường bất động sản. Việc thu thập thông tin, cập nhật và lưu trữ dữ liệu sẽ được triển khai trong giai đoạn này, đảm bảo tính kịp thời và bảo mật. Từ quý III/2026, hệ thống thông tin dự kiến được vận hành thử nghiệm trong phạm vi nội bộ và vận hành chính thức từ quý IV năm sau. Cơ quan quản lý sẽ đánh giá định kỳ kết quả triển khai, hoàn thiện và duy trì hệ thống từ 2027 trở đi. Bộ Xây dựng cho biết sẽ đầu tư, nâng cấp hoặc thuê dịch vụ hệ thống hạ tầng, kỹ thuật công nghệ để đáp ứng việc kết nối với các đơn vị và địa phương. Cơ quan này cũng chịu trách nhiệm xây dựng kế hoạch, quản lý nguồn vốn được bố trí để điều tra, xây dựng cơ sở dữ liệu. Bộ Nông nghiệp và Môi trường sẽ cùng phối hợp để kết nối, chia sẻ từ cơ sở dữ liệu quốc gia về đất đai. UBND các tỉnh, thành được giao xây dựng và ban hành Quy chế phối hợp về chia sẻ, cung cấp thông tin, dữ liệu nhà ở trên địa bàn. Còn các tổ chức, cá nhân có trách nhiệm cung cấp đầy đủ thông tin về nhà ở và thị trường bất động sản đúng thời hạn. Khi hệ thống phần mềm dùng chung được hoàn thiện, người dân sẽ cung cấp thông tin theo hình thức trực tuyến. Trước đó, Cục Quản lý đất đai (Bộ Nông nghiệp và Môi trường) đã có hướng dẫn các địa phương chỉnh lý cơ sở dữ liệu đất đai theo chính quyền 2 cấp sau sáp nhập và gắn mã định danh thửa đất tại địa bàn có dữ liệu địa chính. Quy trình xây dựng mã ID cho thửa đất có 4 bước, gồm xác định điểm đặc trưng của thửa đất; chuyển vị trí từ hệ tọa độ của Việt Nam sang quốc tế; mã hóa vị trí điểm đặc trưng và cập nhật bảng dữ liệu không gian thửa đất. Luật Đất đai hiện hành và các văn bản hướng dẫn chưa quy định cụ thể về thông tin sở hữu nhà ở hay mã định danh bất động sản. Tuy nhiên, nhiều quy định đột phá về quản lý dữ liệu và thông tin đất đai được nêu trong luật, triển khai số hóa và liên thông dữ liệu quốc gia. Đơn cử, luật quy định hệ thống thông tin quốc gia về đất đai được xây dựng tập trung, thống nhất từ trung ương đến địa phương, đa mục tiêu và kết nối liên thông cả nước. Cùng với đó, hồ sơ địa chính gồm các tài liệu phải được số hóa, thể hiện thông tin chi tiết về từng thửa đất. Ngọc Diễm","Thứ bảy, 25/10/2025, 08:22 (GMT+7)",Ngọc Diễm,Bất động sản,Chính sách,VN Express,
