id,title,link,content,date,author,category,sub_category,source,summary
VNEX_210725_00002,Gần 100 người thiệt mạng khi đi nhận viện trợ ở Gaza,https://vnexpress.net/gan-100-nguoi-thiet-mang-khi-di-nhan-vien-tro-o-gaza-4916748.html,"Cơ quan phòng vệ dân sự do Hamas điều hành ở Dải Gaza cho biết Lực lượng Phòng vệ Israel (IDF) ngày 20/7 nổ súng vào những người Palestine đi nhận hỗ trợ nhân đạo ở nhiều địa điểm, khiến tổng cộng 93 người thiệt mạng và hàng chục người bị thương. Trong đó, 80 người bị sát hại gần đoàn xe viện trợ tới miền bắc Gaza, 9 người bị bắn gần một điểm phân phối hàng nhân đạo cạnh thành phố Rafah tại miền nam dải đất. Bốn người còn lại mất mạng gần một điểm phân phát hàng viện trợ khác ở thành phố Khan Younis, cũng tại miền nam Gaza. Đây là ngày đẫm máu nhất với người đi nhận viện trợ tại Dải Gaza kể từ khi xung đột bùng phát từ tháng 10/2023. Người dân tụ tập tại một điểm phân phối lương thực ở Gaza City hôm 20/7. Ảnh:AFP Chương trình Lương thực Thế giới (WFP) của Liên Hợp Quốc cho biết đoàn xe chở hàng viện trợ gồm 25 chiếc của họ ngày 20/7 từ phía Israel tiến vào thành phố Gaza City ở miền bắc dải đất. Sau khi vượt qua trạm kiểm soát tại cửa khẩu Zikim, các nhân viên WFP chứng kiến cảnh tượng ""rất đông người dân đói khát"" đang chờ đợi nguồn thực phẩm cứu trợ. Khi đoàn xe tới gần, đám đông này ""hứng chịu hỏa lực từ xe tăng, lính bắn tỉa và các loại vũ khí khác của Israel"", thông báo của WFP có đoạn. Tổ chức này gọi hành động bạo lực nhằm vào người đi nhận viện trợ là ""không thể chấp nhận được"". ""Chúng tôi vô cùng lo ngại và đau buồn sâu sắc trước thảm kịch khiến vô số mạng sống bị tước đoạt này"", WFP cho biết. ""Những người đó chỉ đang tìm cách tiếp cận nguồn thực phẩm để nuôi sống bản thân và gia đình khỏi nạn đói"". Qasem Abu Khater, 36 tuổi, nói khi vội vã đến đây để cố kiếm một bao bột mì, anh trông thấy hàng nghìn người tuyệt vọng đang chen lấn và xô đẩy theo cách hết sức nguy hiểm. ""Xe tăng sau đó xả đạn bừa bãi vào chúng tôi, còn lính bắn tỉa Israel nhắm bắn như thể đang săn thú trong rừng vậy. Hàng chục người đã chết ngay trước mắt tôi và không ai có thể cứu người khác"", Khater cho hay. IDF cho rằng số liệu thương vong không chính xác, đồng thời nhấn mạnh binh sĩ của họ chỉ nổ súng cảnh cáo nhằm ""loại bỏ mối đe dọa trực tiếp"" khi phải đối mặt với đám đông gồm hàng nghìn người gần Gaza City. Lực lượng này cùng ngày đăng video đoàn người Palestine ào đến để lấy hàng viện trợ trên một xe tải, trong lúc các sĩ quan Israel yêu cầu binh sĩ của họ đứng xung quanh ""không được nổ súng"". Đám đông sau đó quay về hướng quân nhân Israel để vỗ tay và hoan hô. Không rõ thời điểm và địa điểm video được quay. ""Không có viên đạn nào được bắn ra. Mệnh lệnh đưa ra rất rõ ràng: không được nổ súng. Phản ứng của người Palestine thể hiện niềm hy vọng, chứ không phải sợ hãi. Dân thường bắt đầu chào đón chúng tôi"", phát ngôn viên IDF Avichay Adraee cho hay, đồng thời cáo buộc lực lượng Hamas đang lan truyền thông tin sai sự thật. Đoàn người Palestine lấy hàng viện trợ từ xe tải trong video được IDF đăng ngày 20/7. Video:IDF Israel ngày 20/7 thu hồi giấy phép cư trú của Jonathan Whittall, người đứng đầu văn phòng Cơ quan Điều phối Các vấn đề Nhân đạo (OCHA) của Liên Hợp Quốc tại Israel, sau khi quan chức này nhiều lần phản ánh tình trạng nhân đạo tại Dải Gaza. Ngoại trưởng Israel Gideon Saar cáo buộc ông Whittall lan truyền thông tin sai lệch về tình hình ở vùng lãnh thổ. Thông tin dân thường Gaza thiệt mạng khi đi nhận viện trợ xuất hiện gần như hàng ngày trong thời gian qua. Họ được cho là đã bị quân đội Israel sát hại. Liên Hợp Quốc hồi đầu tháng cho biết kể từ cuối tháng 5, gần 800 người tại Dải Gaza đã thiệt mạng khi đi nhận viện trợ, trong đó có các trường hợp xảy ra trên tuyến đường của đoàn xe chở hàng nhân đạo. IDF tuyên bố đã nỗ lực để tránh gây tổn hại cho dân thường. Lực lượng này trong tháng này đã ban hành chỉ thị mới cho binh sĩ trên thực địa sau khi ""rút ra bài học"" từ các sự việc người Palestine thiệt mạng khi đi nhận viện trợ. Phạm Giang(TheoAFP, Times of Israel)","Thứ hai, 21/7/2025, 09:43 (GMT+7)",Phạm Giang,Thế giới,Quân sự,VN Express,"Cơ quan phòng vệ dân sự do Hamas điều hành ở Dải Gaza cáo buộc IDF đã nổ súng vào người Palestine đang nhận viện trợ, khiến 93 người thiệt mạng và hàng chục người bị thương ở nhiều địa điểm khác nhau. WFP của Liên Hợp Quốc cũng lên án hành động bạo lực này, trong khi IDF cho rằng binh sĩ chỉ nổ súng cảnh cáo để loại bỏ mối đe dọa từ đám đông và cáo buộc Hamas lan truyền thông tin sai lệch. Cùng ngày, Israel thu hồi giấy phép cư trú của người đứng đầu văn phòng OCHA của Liên Hợp Quốc. Các báo cáo về vụ việc mâu thuẫn nhau, với các bên đưa ra những cáo buộc và phản bác riêng."
VNEX_210725_00022,Bạn gái Ronaldo bị chỉ trích khi tới Bồ Đào Nha,https://vnexpress.net/ban-gai-ronaldo-bi-chi-trich-khi-toi-bo-dao-nha-4916538.html,"Hôm 18/7, Georgina đăng ảnh về chuyến thăm thánh đường Fatima tại Bồ Đào Nha, quê hương của Cristiano Ronaldo. Các bức ảnh cho thấy cô đội mũ lưỡi trai, mặc váy mỏng, để trần vai và tay. Theo truyền thống, phụ nữ khi đến địa điểm tôn giáo cần mặc kín đáo, có tay áo, che vai và đầu gối. Nếu trang phục hở nhiều da thịt, người mặc cần mang theo khăn choàng. Thành viên mạng xã hội phản ứng tiêu cực về trang phục của Georgina qua các bình luận: ""Làm ơn đừng đội mũ vào nhà thờ. Có lẽ điều đó được chấp nhận ở Arab Saudi, nhưng không phải ở Bồ Đào Nha""; ""Đừng bao giờ đội mũ vào nhà thờ. Thật bất kính""; ""Lần sau, hãy che vai khi vào nhà thờ, cảm ơn bạn"". Georgina, người mẫu mang hai quốc tịch Argentina và Tây Ban Nha, hẹn hò với Ronaldo từ năm 2016. Năm 2017, cô sinh con gái. Năm 2022, cô sinh một trai và một gái, nhưng bé trai không may qua đời trong lúc ""vượt cạn"". Ngoài hai con với Georgina, Ronaldo còn có ba con riêng nhờ biện pháp mang thai hộ. Gia đình luôn di chuyển theo hành trình thi đấu củaRonaldo, từ Tây Ban Nha, sang Italy, Anh và hiện tại là Arab Saudi. Ronaldo vừa ký hợp đồng mới có thời hạn hai năm với CLB Al Nassr, sau khi kết thúc hợp đồng hai năm rưỡi. Thanh Quý(theoInstagram, Marca)","Thứ hai, 21/7/2025, 06:21 (GMT+7)",Thanh Quý,Thể thao,Hậu trường,VN Express,"Georgina Rodriguez, bạn gái của Cristiano Ronaldo, đã bị chỉ trích vì trang phục hở hang khi đến thăm thánh đường Fatima ở Bồ Đào Nha. Người dùng mạng xã hội cho rằng trang phục của cô không phù hợp với quy tắc ăn mặc kín đáo tại các địa điểm tôn giáo. Georgina và Ronaldo đã hẹn hò từ năm 2016 và có hai con chung, ngoài ra Ronaldo còn có ba con riêng. Hiện gia đình đang sống ở Arab Saudi sau khi Ronaldo ký hợp đồng với CLB Al Nassr."
VNEX_210725_00003,Thủ tướng Israel ngộ độc thực phẩm,https://vnexpress.net/thu-tuong-israel-ngo-doc-thuc-pham-4916677.html,"Văn phòng Thủ tướng Israel ngày 20/7 thông báo ông Benjamin Netanyahu cảm thấy không khỏe vào đêm hôm trước và được bác sĩ Alon Hershko, trưởng khoa nội bệnh viện Hadassah Ein Kerem, khám tại nhà. Bác sĩ Hershko chẩn đoán ông Netanyahu bị viêm ruột do ăn phải thực phẩm ôi thiu. Xét nghiệm bổ sung cho thấy ông Netanyahu đang trong tình trạng tốt và Thủ tướng Israel đã được truyền dịch sau khi bị mất nước. ""Thủ tướng sẽ nghỉ ngơi tại nhà trong 3 ngày tới và điều hành công việc từ xa theo chỉ dẫn của bác sĩ"", thông báo có đoạn. Thủ tướng Benjamin Netanyahu phát biểu tại buổi họp báo ở Jerusalem ngày 16/2. Ảnh:Reuters Tòa án Quận Jerusalem đã hủy các phiên điều trần của ông Netanyahu, dự kiến diễn ra ngày 21 và 22/7. Điều này đồng nghĩa với các phiên điều trần của Thủ tướng Israel sẽ hoãn tới tháng 9, do các tòa án Israel sẽ bước vào kỳ nghỉ hè từ nay đến ngày 5/9 và hạn chế hoạt động. Các phiên điều trần của Thủ tướng Netanyahu, liên quan đến phiên tòa xét xử cáo buộc tham nhũng, đã nhiều lần bị hoãn kể từ khi bắt đầu vào tháng 12/2024, do vấn đề sức khỏe của ông Netanyahu, chiến sự tại Dải Gaza, xung đột Iran - Israel, các chuyến công du nước ngoài và những nhiệm vụ trên cương vị Thủ tướng. Ông Netanyahu, 75 tuổi, đối mặt nhiều vấn đề sức khỏe trong những năm qua. Ông phải phẫu thuật vùng thoát vị rồi nghỉ làm vì bị cúm vào tháng 3/2024, phải cắt tuyến tiền liệt sau đó 9 tháng. Vào năm 2023, ông cũng trải qua cuộc phẫu thuật lắp máy tạo nhịp tim. Nguyễn Tiến(TheoTimes of Israel, AFP, Reuters)","Thứ hai, 21/7/2025, 07:04 (GMT+7)",Nguyễn Tiến,Thế giới,Quân sự,VN Express,"Thủ tướng Israel Benjamin Netanyahu bị viêm ruột do thực phẩm ôi thiu và phải nghỉ ngơi tại nhà trong 3 ngày. Các phiên điều trần liên quan đến cáo buộc tham nhũng của ông cũng bị hoãn đến tháng 9 do kỳ nghỉ hè của tòa án và tình trạng sức khỏe của ông. Trong những năm gần đây, ông Netanyahu, 75 tuổi, đã trải qua nhiều vấn đề sức khỏe và phẫu thuật."
VNEX_210725_00092,Doanh số sedan cỡ C chỉ còn tương đương xe cỡ A,https://vnexpress.net/doanh-so-sedan-co-c-chi-con-tuong-duong-xe-co-a-4916494.html,"Trong tháng 6, doanh số phân khúc sedan cỡ C giảm 10% so với tháng trước. Có 424 xe giao đến khách hàng, trong đó hầu hết các mẫu xe giảm doanh số, biên độ giảm tương đồng nhau, chỉ có một mẫu xe tăng doanh số, thứ hạng không thay đổi. Bộ đôi Nhật - Hàn do Thaco lắp ráp, phân phối vẫn dẫn đầu bảng doanh số trong tháng 6. Cụ thể,Mazda3bán ra 184 xe, giảm 10,7%, cònKia K3bán ra 116 xe, giảm 12,8%. Tổng cộng, bộ đôi này chiếm 70% thị phần trong tháng. Doanh số các mẫu xe còn lại vẫn dừng ở mức hai con số.Hyundai Elantrabán ra 51 xe, giảm 12,1%, Honda Civic bán ra 47 xe, giảm 7,5%.Toyota Corolla Altisđứng cuối với 24 xe, nhưng là mẫu xe duy nhất có doanh số tăng trong tháng, mức tăng 14,3%. Cộng gộp doanh số nửa đầu 2025, toàn phân khúc sedan cỡ C bán ra 2.942 xe, giảm mạnh 45% so với cùng kỳ năm trước. Như vậy, mức bán sedan cỡ C trong thời gian qua chỉ tương đương xe cỡ A (2.926 xe), cho thấy xu hướng thoái trào rõ rệt của phân khúc này tại thị trường Việt Nam. Toyota Corolla Altis là mẫu xe duy nhất có doanh số tăng trong tháng 6/2025. Ảnh:TMV Bên cạnh đó, phân khúc sedan cỡ C cũng có sự phân hóa rõ rệt khi trong nửa năm qua, trên 70% thị phần thuộc về bộ đôi Mazda3 - Kia K3, 30% còn lại thuộc về Elantra, Civic và Corolla Altis. Elantra và Civic đang so kè sát nhau khi doanh số hai mẫu này đều ở mức trên 3.000 chiếc, còn Corolla Altis bị bỏ lại xa với chỉ 139 xe bán ra. Hồ Tân","Thứ hai, 21/7/2025, 05:55 (GMT+7)",Hồ Tân,Xe,Thị trường,VN Express,"Trong tháng 6, doanh số phân khúc sedan cỡ C giảm 10%, đạt 424 xe, với hầu hết các mẫu xe giảm, trừ Toyota Corolla Altis tăng nhẹ. Mazda3 và Kia K3 vẫn dẫn đầu, chiếm 70% thị phần. Tổng doanh số nửa đầu năm 2025 giảm mạnh 45% so với cùng kỳ, tương đương xe cỡ A, cho thấy sự thoái trào của phân khúc này tại Việt Nam, với sự phân hóa rõ rệt giữa bộ đôi dẫn đầu và các mẫu xe còn lại."
VNEX_210725_00087,Bạn trai hoàn hảo nhưng tôi lại không thể 'yêu đến phát điên',https://vnexpress.net/ban-trai-hoan-hao-nhung-toi-lai-khong-the-yeu-den-phat-dien-4916591.html,"Chúng tôi quen nhau qua lời giới thiệu của một người bạn chung. Anh hơn tôi ba tuổi, là người đàn ông tử tế, kiên nhẫn và rất biết quan tâm. Từ lần đầu gặp, tôi không cảm thấy trái tim rung lên, đập loạn nhịp hoặc có cảm giác hồi hộp nhưng nghĩ có lẽ thời gian sẽ giúp mọi thứ dần nảy nở. Anh thông minh, trưởng thành, hiểu biết nhiều và có chút khiếu hài hước, ngoại hình hợp mắt tôi và thường khiến tôi thấy yên tâm. Anh đã có nhà, kinh tế ổn. Anh luôn đến đón tôi đúng giờ, nhớ những chi tiết nhỏ tôi từng kể, sẵn sàng chịu đựng những lúc tôi nóng nảy hay vô lý. Anh chưa từng lớn tiếng với tôi, chưa từng để tôi phải đợi lâu, cũng chưa bao giờ làm điều gì khiến tôi buồn tủi. Gia đình, bạn bè ai cũng khen tôi may mắn, bảo rằng kiếm đâu ra được một người đàn ông như thế trong thời buổi này. Nhưng chính tôi lại thấy mơ hồ. Tôi vẫn không cảm nhận được cảm giác ""yêu đến phát điên"", không háo hức nhắn tin, không bồn chồn khi đợi gặp anh. Tôi quý anh, trân trọng cách anh đối xử với mình nhưng trong sâu thẳm, tôi biết mình chưa rung động mãnh liệt với anh. Nhiều lúc anh ôm tôi thật chặt, nói về tương lai, tôi chỉ im lặng, cố gắng mỉm cười mà lòng trống rỗng. Tôi từng có một mối tình thời sinh viên. Dù cuối cùng chia tay trong đau khổ, nhưng với người ấy, tôi từng khóc, từng cười, từng nhớ đến quay quắt. Còn bây giờ, mọi thứ bình lặng đến mức tôi không nhận ra mình đang yêu hay chỉ đang ở cạnh một người quá tốt không nỡ buông tay. Tôi sợ làm anh tổn thương, sợ đánh mất một người hoàn hảo như anh (trong mắt tôi) và không thể gặp được ai như vậy nữa, nhưng cũng sợ chính mình sẽ hối hận khi sống mãi trong mối quan hệ không thật lòng. Tôi không biết nên tiếp tục hy vọng tình cảm sẽ lớn dần theo thời gian, hay dừng lại để anh tìm được người thật sự yêu anh bởi anh đáng được nhận điều đó. Mong mọi người cho tôi xin lời khuyên. Hương Quỳnh","Thứ hai, 21/7/2025, 00:00 (GMT+7)",Hương Quỳnh,Tâm sự,,VN Express,"Hương Quỳnh đang phân vân trong mối quan hệ với một người đàn ông tốt, chu đáo và ổn định, người mà cô quen qua giới thiệu. Dù được mọi người xung quanh khen ngợi và bản thân cô cũng quý trọng anh, nhưng cô lại không cảm nhận được tình yêu mãnh liệt như đã từng trải qua trong quá khứ. Cô lo sợ làm anh tổn thương nếu chia tay, nhưng cũng sợ hối hận nếu tiếp tục một mối quan hệ không có tình yêu thật sự. Cô đang băn khoăn không biết nên tiếp tục hy vọng tình cảm sẽ nảy sinh hay dừng lại để anh tìm được người yêu anh thật lòng."
VNEX_210725_00024,Gabriel: 'Năm nay sẽ khác với Arsenal',https://vnexpress.net/gabriel-nam-nay-se-khac-voi-arsenal-4916667.html,"""Tôi ở CLB 5 năm rồi và chứng kiến đội bóng phát triển ra sao"", kênhESPNdẫn lời Gabriel ngày 20/7. ""Tôi ở đây để đoạt những danh hiệu lớn và tôi tin rằng mùa 2025-2026 sẽ khác. Thời gian qua, chúng tôi vuột mất vài danh hiệu, dù đã ở rất gần. Nhưng năm nay mọi thứ sẽ khác. Tôi rất tin tưởng vào điều đó"". Gabriel ăn mừng trong trận Arsenal thắng Sporting 5-1 ở vòng bảng Champions League trên sân Jose Alvalade, Lisbon, Bồ Đào Nha ngày 26/11/2024. Ảnh:AP Dưới thờiMikel Arteta, ""Pháo thủ"" tiến bộ, nhưng mới đoạt Cup FA 2020, Siêu Cup Anh 2020, 2023. Họ về nhì cả ba mùa gần nhất ở Ngoại hạng Anh. Mùa gần nhất 2024-2025,Arsenalnhận nhiều kỳ vọng hơn cả, thua Newcastle ở bán kết Cup Liên đoàn, Man Utd ở vòng ba Cup FA, PSG ở bán kết Champions League và sớm tụt lại so với Liverpool trên đường đua vô địch Ngoại hạng Anh. Theo Gabriel, Arsenal hơi thiếu may mắn trong ba năm qua, và muốn tập trung cho giai đoạn tiền mùa giải để cải thiện và thay đổi. ""Chúng tôi đã làm mọi thứ có thể trong ba năm qua và không thể viện cớ"", trung vệ Brazil nói. ""Giai đoạn tiền mùa giải đã bắt đầu. Chúng tôi tập trung vào những gì HLV yêu cầu. Tôi nghĩ năm nay sẽ khác. Toàn đội đều tin có thể giành được những danh hiệu lớn"". Tháng trước,Gabrielgia hạn hợp đồng đến năm 2029 và chấm dứt những đồn đoán về việc có thể gia nhập Saudi Pro League. Khi được hỏi thêm về yếu tố thuyết phục anh cam kết tương lai với Arsenal, trung vệ 28 tuổi nói: ""Tôi chỉ có một điều để nói, và Mikel Arteta cũng nói như vậy: Chúng tôi sẵn sàng đạt đến những tầm cao mới trong mùa giải này"". Gabriel cùng Arsenal có mặt tại Singapore ngày 20/7. Ảnh:Arsenal FC Gabrielchấn thương gân kheovào tháng 4, phải phẫu thuật và kết thúc sớm mùa 2024-2025. Trung vệ Brazil cho biết đang hồi phục tốt và có thể kịp đátrận mở màn Ngoại hạng Anhgặp Man Utd tại Old Trafford ngày 17/8. Ngày 20/7, Gabriel và các đồng đội đã đến Singapore để bắt đầu chuyến du đấu châu Á. Arsenal sẽ lần lượt gặp AC Milan ngày 23/7 và Newcastle 27/7 tại Đông Nam Á, rồi sang Hong Kong đá giao hữu với Tottenham ngày 31/7. Hồng Duy(theo ESPN)","Thứ hai, 21/7/2025, 06:15 (GMT+7)",Hồng Duy,Thể thao,Ngoại hạng Anh,VN Express,"Gabriel, trung vệ của Arsenal, tin tưởng mùa giải 2025-2026 sẽ là một bước ngoặt, sau khi đội bóng liên tục lỡ hẹn với các danh hiệu lớn trong ba năm qua. Anh nhấn mạnh sự tập trung vào giai đoạn tiền mùa giải để cải thiện và đáp ứng yêu cầu của HLV Arteta. Gabriel vừa gia hạn hợp đồng đến năm 2029 và khẳng định Arsenal sẵn sàng vươn tới những tầm cao mới, bất chấp chấn thương gặp phải trước đó. Hiện tại, anh đang hồi phục tốt và cùng đội bóng du đấu châu Á chuẩn bị cho mùa giải mới."
VNEX_210725_00113,"Điểm tin 6h: Bão Wipha mạnh cấp 11, tiến vào Vịnh Bắc Bộ | Chứng khoán tuần này có thể tăng tiếp",https://vnexpress.net/diem-tin-6h-bao-wipha-manh-cap-11-tien-vao-vinh-bac-bo-chung-khoan-tuan-nay-co-the-tang-tiep-4916672.html,Liên hệ: 084 666 0123 hoặcpodcast@vnexpress.net.,"Thứ hai, 21/7/2025, 06:06 (GMT+7)",Unknown,Podcasts,,VN Express,Đoạn văn này cung cấp thông tin liên hệ để người đọc có thể liên lạc. Có hai phương thức liên hệ được cung cấp: qua số điện thoại 084 666 0123 hoặc qua địa chỉ email podcast@vnexpress.net. Người đọc có thể sử dụng thông tin này để liên hệ với người hoặc tổ chức được đề cập trong văn bản gốc.
